hsa/gfx950/fmoe_2stages/aiter/configs/profile_fmoe.csv
stage,cu_num,token,model_dim,inter_dim,expert,topk,act_type,dtype,q_dtype_a,q_dtype_w,q_type,use_g1u1,doweight_stage1,block_m,ksplit,us,kernelName,err,tflops,bw
stage1,256,1024,2048,192,128,8,ActivationType.Gelu,torch.bfloat16,torch.bfloat16,torch.bfloat16,QuantType.No,1,0,32,0,81.0427,moe_ck2stages_gemm1_256x32x64x128_1x4_TypeCast_v1_Nswizzle0_Quant0_MulRoutedWeight0_gelu_B16_B16_B16,0.0%,238.48,3829.81
stage1,256,1024,2048,192,128,8,ActivationType.Gelu,torch.bfloat16,torch.bfloat16,torch.bfloat16,QuantType.No,1,0,32,0,78.8069,moe_ck2stages_gemm1_256x32x64x64_1x4_TypeCast_v1_Nswizzle0_Quant0_MulRoutedWeight0_gelu_B16_B16_B16,0.0%,245.25,3938.47
stage2,256,1024,2048,192,128,8,ActivationType.Gelu,torch.bfloat16,torch.bfloat16,torch.bfloat16,QuantType.No,1,0,32,0,inf,moe_ck2stages_gemm2_256x32x128x128_1x4_TypeCast_v1_Nswizzle0_Quant0_MulRoutedWeight1_B16_B16_B16,100.0%,0.0,0.0
stage2,256,1024,2048,192,128,8,ActivationType.Gelu,torch.bfloat16,torch.bfloat16,torch.bfloat16,QuantType.No,1,0,32,0,44.0089,moe_ck2stages_gemm2_256x32x64x64_1x4_TypeCast_v1_Nswizzle0_Quant0_MulRoutedWeight1_B16_B16_B16,0.0%,439.17,7052.63
stage1,256,1024,2048,192,128,8,ActivationType.Gelu,torch.bfloat16,torch.bfloat16,torch.bfloat16,QuantType.No,1,0,64,0,60.9897,moe_ck2stages_gemm1_256x64x64x128_1x4_TypeCast_v1_Nswizzle0_Quant0_MulRoutedWeight0_gelu_B16_B16_B16,0.0%,316.9,5089.03
stage1,256,1024,2048,192,128,8,ActivationType.Gelu,torch.bfloat16,torch.bfloat16,torch.bfloat16,QuantType.No,1,0,64,0,62.1154,moe_ck2stages_gemm1_256x64x64x64_1x4_TypeCast_v1_Nswizzle0_Quant0_MulRoutedWeight0_gelu_B16_B16_B16,0.0%,311.15,4996.8
stage2,256,1024,2048,192,128,8,ActivationType.Gelu,torch.bfloat16,torch.bfloat16,torch.bfloat16,QuantType.No,1,0,64,0,inf,moe_ck2stages_gemm2_256x64x128x128_1x4_TypeCast_v1_Nswizzle0_Quant0_MulRoutedWeight1_B16_B16_B16,100.0%,0.0,0.0
stage2,256,1024,2048,192,128,8,ActivationType.Gelu,torch.bfloat16,torch.bfloat16,torch.bfloat16,QuantType.No,1,0,64,0,46.1821,moe_ck2stages_gemm2_256x64x64x64_1x4_TypeCast_v1_Nswizzle0_Quant0_MulRoutedWeight1_B16_B16_B16,0.0%,418.5,6720.75
stage2,256,1024,2048,192,128,8,ActivationType.Gelu,torch.bfloat16,torch.bfloat16,torch.bfloat16,QuantType.No,1,0,64,0,68.7845,moe_ck2stages_gemm2_256x64x128x64_1x4_TypeCast_v1_Nswizzle0_Quant0_MulRoutedWeight1_B16_B16_B16,0.0%,280.98,4512.33
stage1,256,1024,2048,192,128,8,ActivationType.Gelu,torch.bfloat16,torch.bfloat16,torch.bfloat16,QuantType.No,1,0,128,0,48.8897,moe_ck2stages_gemm1_256x128x64x64_1x4_TypeCast_v1_Nswizzle0_Quant0_MulRoutedWeight0_gelu_B16_B16_B16,0.0%,395.33,6348.55
stage1,256,1024,2048,192,128,8,ActivationType.Gelu,torch.bfloat16,torch.bfloat16,torch.bfloat16,QuantType.No,1,0,128,0,inf,moe_ck2stages_gemm1_256x128x128x64_1x4_TypeCast_v3_Nswizzle0_Quant0_MulRoutedWeight0_gelu_B16_B16_B16,100.0%,0.0,0.0
stage2,256,1024,2048,192,128,8,ActivationType.Gelu,torch.bfloat16,torch.bfloat16,torch.bfloat16,QuantType.No,1,0,128,0,75.6703,moe_ck2stages_gemm2_256x128x128x64_1x4_TypeCast_v1_Nswizzle0_Quant0_MulRoutedWeight1_B16_B16_B16,0.0%,255.42,4101.72
stage2,256,1024,2048,192,128,8,ActivationType.Gelu,torch.bfloat16,torch.bfloat16,torch.bfloat16,QuantType.No,1,0,128,0,75.2041,moe_ck2stages_gemm2_256x128x128x64_1x4_TypeCast_v3_Nswizzle0_Quant0_MulRoutedWeight1_B16_B16_B16,0.0%,257.0,4127.15
stage2,256,1024,2048,192,128,8,ActivationType.Gelu,torch.bfloat16,torch.bfloat16,torch.bfloat16,QuantType.No,1,0,128,0,50.3819,moe_ck2stages_gemm2_256x128x64x64_1x4_TypeCast_v3_Nswizzle0_Quant0_MulRoutedWeight1_B16_B16_B16,0.0%,383.62,6160.52
stage2,256,1024,2048,192,128,8,ActivationType.Gelu,torch.bfloat16,torch.bfloat16,torch.bfloat16,QuantType.No,1,0,128,0,57.1866,moe_ck2stages_gemm2_256x128x64x64_1x4_TypeCast_v1_Nswizzle0_Quant0_MulRoutedWeight1_B16_B16_B16,0.0%,337.97,5427.47
stage1,256,1024,2048,192,128,8,ActivationType.Gelu,torch.bfloat16,torch.bfloat16,torch.bfloat16,QuantType.No,1,1,32,0,81.0502,moe_ck2stages_gemm1_256x32x64x128_1x4_TypeCast_v1_Nswizzle0_Quant0_MulRoutedWeight1_gelu_B16_B16_B16,0.0%,238.46,3829.46
stage1,256,1024,2048,192,128,8,ActivationType.Gelu,torch.bfloat16,torch.bfloat16,torch.bfloat16,QuantType.No,1,1,32,0,79.1071,moe_ck2stages_gemm1_256x32x64x64_1x4_TypeCast_v1_Nswizzle0_Quant0_MulRoutedWeight1_gelu_B16_B16_B16,0.0%,244.32,3923.52
stage2,256,1024,2048,192,128,8,ActivationType.Gelu,torch.bfloat16,torch.bfloat16,torch.bfloat16,QuantType.No,1,1,32,0,inf,moe_ck2stages_gemm2_256x32x128x128_1x4_TypeCast_v1_Nswizzle0_Quant0_MulRoutedWeight0_B16_B16_B16,100.0%,0.0,0.0
stage2,256,1024,2048,192,128,8,ActivationType.Gelu,torch.bfloat16,torch.bfloat16,torch.bfloat16,QuantType.No,1,1,32,0,42.0774,moe_ck2stages_gemm2_256x32x64x64_1x4_TypeCast_v1_Nswizzle0_Quant0_MulRoutedWeight0_B16_B16_B16,0.0%,459.33,7376.37
stage1,256,1024,2048,192,128,8,ActivationType.Gelu,torch.bfloat16,torch.bfloat16,torch.bfloat16,QuantType.No,1,1,64,0,60.4658,moe_ck2stages_gemm1_256x64x64x128_1x4_TypeCast_v1_Nswizzle0_Quant0_MulRoutedWeight1_gelu_B16_B16_B16,0.0%,319.64,5133.12
stage1,256,1024,2048,192,128,8,ActivationType.Gelu,torch.bfloat16,torch.bfloat16,torch.bfloat16,QuantType.No,1,1,64,0,63.0084,moe_ck2stages_gemm1_256x64x64x64_1x4_TypeCast_v1_Nswizzle0_Quant0_MulRoutedWeight1_gelu_B16_B16_B16,0.0%,306.74,4925.99
stage2,256,1024,2048,192,128,8,ActivationType.Gelu,torch.bfloat16,torch.bfloat16,torch.bfloat16,QuantType.No,1,1,64,0,inf,moe_ck2stages_gemm2_256x64x128x128_1x4_TypeCast_v1_Nswizzle0_Quant0_MulRoutedWeight0_B16_B16_B16,100.0%,0.0,0.0
stage2,256,1024,2048,192,128,8,ActivationType.Gelu,torch.bfloat16,torch.bfloat16,torch.bfloat16,QuantType.No,1,1,64,0,43.0716,moe_ck2stages_gemm2_256x64x64x64_1x4_TypeCast_v1_Nswizzle0_Quant0_MulRoutedWeight0_B16_B16_B16,0.0%,448.73,7206.11
stage2,256,1024,2048,192,128,8,ActivationType.Gelu,torch.bfloat16,torch.bfloat16,torch.bfloat16,QuantType.No,1,1,64,0,67.1104,moe_ck2stages_gemm2_256x64x128x64_1x4_TypeCast_v1_Nswizzle0_Quant0_MulRoutedWeight0_B16_B16_B16,0.0%,287.99,4624.89
stage1,256,1024,2048,192,128,8,ActivationType.Gelu,torch.bfloat16,torch.bfloat16,torch.bfloat16,QuantType.No,1,1,128,0,50.722,moe_ck2stages_gemm1_256x128x64x64_1x4_TypeCast_v1_Nswizzle0_Quant0_MulRoutedWeight1_gelu_B16_B16_B16,0.0%,381.04,6119.21
stage1,256,1024,2048,192,128,8,ActivationType.Gelu,torch.bfloat16,torch.bfloat16,torch.bfloat16,QuantType.No,1,1,128,0,inf,moe_ck2stages_gemm1_256x128x128x64_1x4_TypeCast_v3_Nswizzle0_Quant0_MulRoutedWeight1_gelu_B16_B16_B16,100.0%,0.0,0.0
stage2,256,1024,2048,192,128,8,ActivationType.Gelu,torch.bfloat16,torch.bfloat16,torch.bfloat16,QuantType.No,1,1,128,0,71.9917,moe_ck2stages_gemm2_256x128x128x64_1x4_TypeCast_v1_Nswizzle0_Quant0_MulRoutedWeight0_B16_B16_B16,0.0%,268.47,4311.31
stage2,256,1024,2048,192,128,8,ActivationType.Gelu,torch.bfloat16,torch.bfloat16,torch.bfloat16,QuantType.No,1,1,128,0,72.1036,moe_ck2stages_gemm2_256x128x128x64_1x4_TypeCast_v3_Nswizzle0_Quant0_MulRoutedWeight0_B16_B16_B16,0.0%,268.05,4304.62
stage2,256,1024,2048,192,128,8,ActivationType.Gelu,torch.bfloat16,torch.bfloat16,torch.bfloat16,QuantType.No,1,1,128,0,47.1523,moe_ck2stages_gemm2_256x128x64x64_1x4_TypeCast_v3_Nswizzle0_Quant0_MulRoutedWeight0_B16_B16_B16,0.0%,409.89,6582.47
stage2,256,1024,2048,192,128,8,ActivationType.Gelu,torch.bfloat16,torch.bfloat16,torch.bfloat16,QuantType.No,1,1,128,0,53.5419,moe_ck2stages_gemm2_256x128x64x64_1x4_TypeCast_v1_Nswizzle0_Quant0_MulRoutedWeight0_B16_B16_B16,0.0%,360.98,5796.93
stage1,256,1024,2048,192,128,8,ActivationType.Silu,torch.bfloat16,torch.bfloat16,torch.bfloat16,QuantType.No,1,0,32,0,80.8423,moe_ck2stages_gemm1_256x32x64x128_1x4_TypeCast_v1_Nswizzle0_Quant0_MulRoutedWeight0_silu_B16_B16_B16,0.0%,239.07,3839.31
stage1,256,1024,2048,192,128,8,ActivationType.Silu,torch.bfloat16,torch.bfloat16,torch.bfloat16,QuantType.No,1,0,32,0,78.7768,moe_ck2stages_gemm1_256x32x64x64_1x4_TypeCast_v1_Nswizzle0_Quant0_MulRoutedWeight0_silu_B16_B16_B16,0.0%,245.34,3939.97
stage2,256,1024,2048,192,128,8,ActivationType.Silu,torch.bfloat16,torch.bfloat16,torch.bfloat16,QuantType.No,1,0,32,0,inf,moe_ck2stages_gemm2_256x32x128x128_1x4_TypeCast_v1_Nswizzle0_Quant0_MulRoutedWeight1_B16_B16_B16,100.0%,0.0,0.0
stage2,256,1024,2048,192,128,8,ActivationType.Silu,torch.bfloat16,torch.bfloat16,torch.bfloat16,QuantType.No,1,0,32,0,43.9151,moe_ck2stages_gemm2_256x32x64x64_1x4_TypeCast_v1_Nswizzle0_Quant0_MulRoutedWeight1_B16_B16_B16,0.0%,440.11,7067.69
stage1,256,1024,2048,192,128,8,ActivationType.Silu,torch.bfloat16,torch.bfloat16,torch.bfloat16,QuantType.No,1,0,64,0,60.3331,moe_ck2stages_gemm1_256x64x64x128_1x4_TypeCast_v1_Nswizzle0_Quant0_MulRoutedWeight0_silu_B16_B16_B16,0.0%,320.34,5144.41
stage1,256,1024,2048,192,128,8,ActivationType.Silu,torch.bfloat16,torch.bfloat16,torch.bfloat16,QuantType.No,1,0,64,0,62.0429,moe_ck2stages_gemm1_256x64x64x64_1x4_TypeCast_v1_Nswizzle0_Quant0_MulRoutedWeight0_silu_B16_B16_B16,0.0%,311.52,5002.64
stage2,256,1024,2048,192,128,8,ActivationType.Silu,torch.bfloat16,torch.bfloat16,torch.bfloat16,QuantType.No,1,0,64,0,inf,moe_ck2stages_gemm2_256x64x128x128_1x4_TypeCast_v1_Nswizzle0_Quant0_MulRoutedWeight1_B16_B16_B16,100.0%,0.0,0.0
stage2,256,1024,2048,192,128,8,ActivationType.Silu,torch.bfloat16,torch.bfloat16,torch.bfloat16,QuantType.No,1,0,64,0,46.0042,moe_ck2stages_gemm2_256x64x64x64_1x4_TypeCast_v1_Nswizzle0_Quant0_MulRoutedWeight1_B16_B16_B16,0.0%,420.12,6746.74
stage2,256,1024,2048,192,128,8,ActivationType.Silu,torch.bfloat16,torch.bfloat16,torch.bfloat16,QuantType.No,1,0,64,0,69.2157,moe_ck2stages_gemm2_256x64x128x64_1x4_TypeCast_v1_Nswizzle0_Quant0_MulRoutedWeight1_B16_B16_B16,0.0%,279.23,4484.22
stage1,256,1024,2048,192,128,8,ActivationType.Silu,torch.bfloat16,torch.bfloat16,torch.bfloat16,QuantType.No,1,0,128,0,49.3199,moe_ck2stages_gemm1_256x128x64x64_1x4_TypeCast_v1_Nswizzle0_Quant0_MulRoutedWeight0_silu_B16_B16_B16,0.0%,391.88,6293.17
stage1,256,1024,2048,192,128,8,ActivationType.Silu,torch.bfloat16,torch.bfloat16,torch.bfloat16,QuantType.No,1,0,128,0,inf,moe_ck2stages_gemm1_256x128x128x64_1x4_TypeCast_v3_Nswizzle0_Quant0_MulRoutedWeight0_silu_B16_B16_B16,100.0%,0.0,0.0
stage2,256,1024,2048,192,128,8,ActivationType.Silu,torch.bfloat16,torch.bfloat16,torch.bfloat16,QuantType.No,1,0,128,0,76.1624,moe_ck2stages_gemm2_256x128x128x64_1x4_TypeCast_v1_Nswizzle0_Quant0_MulRoutedWeight1_B16_B16_B16,0.0%,253.77,4075.22
stage2,256,1024,2048,192,128,8,ActivationType.Silu,torch.bfloat16,torch.bfloat16,torch.bfloat16,QuantType.No,1,0,128,0,75.3858,moe_ck2stages_gemm2_256x128x128x64_1x4_TypeCast_v3_Nswizzle0_Quant0_MulRoutedWeight1_B16_B16_B16,0.0%,256.38,4117.2
stage2,256,1024,2048,192,128,8,ActivationType.Silu,torch.bfloat16,torch.bfloat16,torch.bfloat16,QuantType.No,1,0,128,0,49.6898,moe_ck2stages_gemm2_256x128x64x64_1x4_TypeCast_v3_Nswizzle0_Quant0_MulRoutedWeight1_B16_B16_B16,0.0%,388.96,6246.32
stage2,256,1024,2048,192,128,8,ActivationType.Silu,torch.bfloat16,torch.bfloat16,torch.bfloat16,QuantType.No,1,0,128,0,57.4551,moe_ck2stages_gemm2_256x128x64x64_1x4_TypeCast_v1_Nswizzle0_Quant0_MulRoutedWeight1_B16_B16_B16,0.0%,336.39,5402.11
stage1,256,1024,2048,192,128,8,ActivationType.Silu,torch.bfloat16,torch.bfloat16,torch.bfloat16,QuantType.No,1,1,32,0,80.5542,moe_ck2stages_gemm1_256x32x64x128_1x4_TypeCast_v1_Nswizzle0_Quant0_MulRoutedWeight1_silu_B16_B16_B16,0.0%,239.93,3853.04
stage1,256,1024,2048,192,128,8,ActivationType.Silu,torch.bfloat16,torch.bfloat16,torch.bfloat16,QuantType.No,1,1,32,0,79.15,moe_ck2stages_gemm1_256x32x64x64_1x4_TypeCast_v1_Nswizzle0_Quant0_MulRoutedWeight1_silu_B16_B16_B16,0.0%,244.19,3921.4
stage2,256,1024,2048,192,128,8,ActivationType.Silu,torch.bfloat16,torch.bfloat16,torch.bfloat16,QuantType.No,1,1,32,0,inf,moe_ck2stages_gemm2_256x32x128x128_1x4_TypeCast_v1_Nswizzle0_Quant0_MulRoutedWeight0_B16_B16_B16,100.0%,0.0,0.0
stage2,256,1024,2048,192,128,8,ActivationType.Silu,torch.bfloat16,torch.bfloat16,torch.bfloat16,QuantType.No,1,1,32,0,41.9942,moe_ck2stages_gemm2_256x32x64x64_1x4_TypeCast_v1_Nswizzle0_Quant0_MulRoutedWeight0_B16_B16_B16,0.0%,460.24,7390.98
stage1,256,1024,2048,192,128,8,ActivationType.Silu,torch.bfloat16,torch.bfloat16,torch.bfloat16,QuantType.No,1,1,64,0,60.6654,moe_ck2stages_gemm1_256x64x64x128_1x4_TypeCast_v1_Nswizzle0_Quant0_MulRoutedWeight1_silu_B16_B16_B16,0.0%,318.59,5116.24
stage1,256,1024,2048,192,128,8,ActivationType.Silu,torch.bfloat16,torch.bfloat16,torch.bfloat16,QuantType.No,1,1,64,0,62.5945,moe_ck2stages_gemm1_256x64x64x64_1x4_TypeCast_v1_Nswizzle0_Quant0_MulRoutedWeight1_silu_B16_B16_B16,0.0%,308.77,4958.56
stage2,256,1024,2048,192,128,8,ActivationType.Silu,torch.bfloat16,torch.bfloat16,torch.bfloat16,QuantType.No,1,1,64,0,inf,moe_ck2stages_gemm2_256x64x128x128_1x4_TypeCast_v1_Nswizzle0_Quant0_MulRoutedWeight0_B16_B16_B16,100.0%,0.0,0.0
stage2,256,1024,2048,192,128,8,ActivationType.Silu,torch.bfloat16,torch.bfloat16,torch.bfloat16,QuantType.No,1,1,64,0,43.0191,moe_ck2stages_gemm2_256x64x64x64_1x4_TypeCast_v1_Nswizzle0_Quant0_MulRoutedWeight0_B16_B16_B16,0.0%,449.27,7214.9
stage2,256,1024,2048,192,128,8,ActivationType.Silu,torch.bfloat16,torch.bfloat16,torch.bfloat16,QuantType.No,1,1,64,0,67.3928,moe_ck2stages_gemm2_256x64x128x64_1x4_TypeCast_v1_Nswizzle0_Quant0_MulRoutedWeight0_B16_B16_B16,0.0%,286.79,4605.51
stage1,256,1024,2048,192,128,8,ActivationType.Silu,torch.bfloat16,torch.bfloat16,torch.bfloat16,QuantType.No,1,1,128,0,50.0884,moe_ck2stages_gemm1_256x128x64x64_1x4_TypeCast_v1_Nswizzle0_Quant0_MulRoutedWeight1_silu_B16_B16_B16,0.0%,385.86,6196.61
stage1,256,1024,2048,192,128,8,ActivationType.Silu,torch.bfloat16,torch.bfloat16,torch.bfloat16,QuantType.No,1,1,128,0,inf,moe_ck2stages_gemm1_256x128x128x64_1x4_TypeCast_v3_Nswizzle0_Quant0_MulRoutedWeight1_silu_B16_B16_B16,100.0%,0.0,0.0
stage2,256,1024,2048,192,128,8,ActivationType.Silu,torch.bfloat16,torch.bfloat16,torch.bfloat16,QuantType.No,1,1,128,0,71.7366,moe_ck2stages_gemm2_256x128x128x64_1x4_TypeCast_v1_Nswizzle0_Quant0_MulRoutedWeight0_B16_B16_B16,0.0%,269.42,4326.64
stage2,256,1024,2048,192,128,8,ActivationType.Silu,torch.bfloat16,torch.bfloat16,torch.bfloat16,QuantType.No,1,1,128,0,72.6975,moe_ck2stages_gemm2_256x128x128x64_1x4_TypeCast_v3_Nswizzle0_Quant0_MulRoutedWeight0_B16_B16_B16,0.0%,265.86,4269.45
stage2,256,1024,2048,192,128,8,ActivationType.Silu,torch.bfloat16,torch.bfloat16,torch.bfloat16,QuantType.No,1,1,128,0,47.0087,moe_ck2stages_gemm2_256x128x64x64_1x4_TypeCast_v3_Nswizzle0_Quant0_MulRoutedWeight0_B16_B16_B16,0.0%,411.14,6602.58
stage2,256,1024,2048,192,128,8,ActivationType.Silu,torch.bfloat16,torch.bfloat16,torch.bfloat16,QuantType.No,1,1,128,0,53.3719,moe_ck2stages_gemm2_256x128x64x64_1x4_TypeCast_v1_Nswizzle0_Quant0_MulRoutedWeight0_B16_B16_B16,0.0%,362.13,5815.39
stage1,256,1024,4096,192,128,8,ActivationType.Gelu,torch.bfloat16,torch.bfloat16,torch.bfloat16,QuantType.No,1,0,32,0,158.0836,moe_ck2stages_gemm1_256x32x64x128_1x4_TypeCast_v1_Nswizzle0_Quant0_MulRoutedWeight0_gelu_B16_B16_B16,0.0%,244.52,3926.76
stage1,256,1024,4096,192,128,8,ActivationType.Gelu,torch.bfloat16,torch.bfloat16,torch.bfloat16,QuantType.No,1,0,32,0,153.1641,moe_ck2stages_gemm1_256x32x64x64_1x4_TypeCast_v1_Nswizzle0_Quant0_MulRoutedWeight0_gelu_B16_B16_B16,0.0%,252.37,4052.89
stage2,256,1024,4096,192,128,8,ActivationType.Gelu,torch.bfloat16,torch.bfloat16,torch.bfloat16,QuantType.No,1,0,32,0,inf,moe_ck2stages_gemm2_256x32x128x128_1x4_TypeCast_v1_Nswizzle0_Quant0_MulRoutedWeight1_B16_B16_B16,100.0%,0.0,0.0
stage2,256,1024,4096,192,128,8,ActivationType.Gelu,torch.bfloat16,torch.bfloat16,torch.bfloat16,QuantType.No,1,0,32,0,78.732,moe_ck2stages_gemm2_256x32x64x64_1x4_TypeCast_v1_Nswizzle0_Quant0_MulRoutedWeight1_B16_B16_B16,0.1%,490.97,7884.43
stage1,256,1024,4096,192,128,8,ActivationType.Gelu,torch.bfloat16,torch.bfloat16,torch.bfloat16,QuantType.No,1,0,64,0,117.5011,moe_ck2stages_gemm1_256x64x64x128_1x4_TypeCast_v1_Nswizzle0_Quant0_MulRoutedWeight0_gelu_B16_B16_B16,0.0%,328.97,5282.99
stage1,256,1024,4096,192,128,8,ActivationType.Gelu,torch.bfloat16,torch.bfloat16,torch.bfloat16,QuantType.No,1,0,64,0,122.94,moe_ck2stages_gemm1_256x64x64x64_1x4_TypeCast_v1_Nswizzle0_Quant0_MulRoutedWeight0_gelu_B16_B16_B16,0.0%,314.42,5049.27
stage2,256,1024,4096,192,128,8,ActivationType.Gelu,torch.bfloat16,torch.bfloat16,torch.bfloat16,QuantType.No,1,0,64,0,inf,moe_ck2stages_gemm2_256x64x128x128_1x4_TypeCast_v1_Nswizzle0_Quant0_MulRoutedWeight1_B16_B16_B16,100.0%,0.0,0.0
stage2,256,1024,4096,192,128,8,ActivationType.Gelu,torch.bfloat16,torch.bfloat16,torch.bfloat16,QuantType.No,1,0,64,0,79.6165,moe_ck2stages_gemm2_256x64x64x64_1x4_TypeCast_v1_Nswizzle0_Quant0_MulRoutedWeight1_B16_B16_B16,0.1%,485.51,7796.84
stage2,256,1024,4096,192,128,8,ActivationType.Gelu,torch.bfloat16,torch.bfloat16,torch.bfloat16,QuantType.No,1,0,64,0,122.2122,moe_ck2stages_gemm2_256x64x128x64_1x4_TypeCast_v1_Nswizzle0_Quant0_MulRoutedWeight1_B16_B16_B16,0.1%,316.29,5079.34
stage1,256,1024,4096,192,128,8,ActivationType.Gelu,torch.bfloat16,torch.bfloat16,torch.bfloat16,QuantType.No,1,0,128,0,87.0362,moe_ck2stages_gemm1_256x128x64x64_1x4_TypeCast_v1_Nswizzle0_Quant0_MulRoutedWeight0_gelu_B16_B16_B16,0.0%,444.12,7132.17
stage1,256,1024,4096,192,128,8,ActivationType.Gelu,torch.bfloat16,torch.bfloat16,torch.bfloat16,QuantType.No,1,0,128,0,inf,moe_ck2stages_gemm1_256x128x128x64_1x4_TypeCast_v3_Nswizzle0_Quant0_MulRoutedWeight0_gelu_B16_B16_B16,100.0%,0.0,0.0
stage2,256,1024,4096,192,128,8,ActivationType.Gelu,torch.bfloat16,torch.bfloat16,torch.bfloat16,QuantType.No,1,0,128,0,128.9769,moe_ck2stages_gemm2_256x128x128x64_1x4_TypeCast_v1_Nswizzle0_Quant0_MulRoutedWeight1_B16_B16_B16,0.1%,299.7,4812.93
stage2,256,1024,4096,192,128,8,ActivationType.Gelu,torch.bfloat16,torch.bfloat16,torch.bfloat16,QuantType.No,1,0,128,0,128.3841,moe_ck2stages_gemm2_256x128x128x64_1x4_TypeCast_v3_Nswizzle0_Quant0_MulRoutedWeight1_B16_B16_B16,0.1%,301.09,4835.15
stage2,256,1024,4096,192,128,8,ActivationType.Gelu,torch.bfloat16,torch.bfloat16,torch.bfloat16,QuantType.No,1,0,128,0,86.3989,moe_ck2stages_gemm2_256x128x64x64_1x4_TypeCast_v3_Nswizzle0_Quant0_MulRoutedWeight1_B16_B16_B16,0.1%,447.4,7184.78
stage2,256,1024,4096,192,128,8,ActivationType.Gelu,torch.bfloat16,torch.bfloat16,torch.bfloat16,QuantType.No,1,0,128,0,97.812,moe_ck2stages_gemm2_256x128x64x64_1x4_TypeCast_v1_Nswizzle0_Quant0_MulRoutedWeight1_B16_B16_B16,0.1%,395.19,6346.43
stage1,256,1024,4096,192,128,8,ActivationType.Gelu,torch.bfloat16,torch.bfloat16,torch.bfloat16,QuantType.No,1,1,32,0,159.1184,moe_ck2stages_gemm1_256x32x64x128_1x4_TypeCast_v1_Nswizzle0_Quant0_MulRoutedWeight1_gelu_B16_B16_B16,0.0%,242.93,3901.23
stage1,256,1024,4096,192,128,8,ActivationType.Gelu,torch.bfloat16,torch.bfloat16,torch.bfloat16,QuantType.No,1,1,32,0,156.3631,moe_ck2stages_gemm1_256x32x64x64_1x4_TypeCast_v1_Nswizzle0_Quant0_MulRoutedWeight1_gelu_B16_B16_B16,0.0%,247.21,3969.97
stage2,256,1024,4096,192,128,8,ActivationType.Gelu,torch.bfloat16,torch.bfloat16,torch.bfloat16,QuantType.No,1,1,32,0,inf,moe_ck2stages_gemm2_256x32x128x128_1x4_TypeCast_v1_Nswizzle0_Quant0_MulRoutedWeight0_B16_B16_B16,100.0%,0.0,0.0
stage2,256,1024,4096,192,128,8,ActivationType.Gelu,torch.bfloat16,torch.bfloat16,torch.bfloat16,QuantType.No,1,1,32,0,76.0651,moe_ck2stages_gemm2_256x32x64x64_1x4_TypeCast_v1_Nswizzle0_Quant0_MulRoutedWeight0_B16_B16_B16,0.0%,508.18,8160.86
stage1,256,1024,4096,192,128,8,ActivationType.Gelu,torch.bfloat16,torch.bfloat16,torch.bfloat16,QuantType.No,1,1,64,0,120.0817,moe_ck2stages_gemm1_256x64x64x128_1x4_TypeCast_v1_Nswizzle0_Quant0_MulRoutedWeight1_gelu_B16_B16_B16,0.0%,321.9,5169.46
stage1,256,1024,4096,192,128,8,ActivationType.Gelu,torch.bfloat16,torch.bfloat16,torch.bfloat16,QuantType.No,1,1,64,0,124.5638,moe_ck2stages_gemm1_256x64x64x64_1x4_TypeCast_v1_Nswizzle0_Quant0_MulRoutedWeight1_gelu_B16_B16_B16,0.0%,310.32,4983.45
stage2,256,1024,4096,192,128,8,ActivationType.Gelu,torch.bfloat16,torch.bfloat16,torch.bfloat16,QuantType.No,1,1,64,0,inf,moe_ck2stages_gemm2_256x64x128x128_1x4_TypeCast_v1_Nswizzle0_Quant0_MulRoutedWeight0_B16_B16_B16,100.0%,0.0,0.0
stage2,256,1024,4096,192,128,8,ActivationType.Gelu,torch.bfloat16,torch.bfloat16,torch.bfloat16,QuantType.No,1,1,64,0,74.697,moe_ck2stages_gemm2_256x64x64x64_1x4_TypeCast_v1_Nswizzle0_Quant0_MulRoutedWeight0_B16_B16_B16,0.0%,517.49,8310.33
stage2,256,1024,4096,192,128,8,ActivationType.Gelu,torch.bfloat16,torch.bfloat16,torch.bfloat16,QuantType.No,1,1,64,0,120.2872,moe_ck2stages_gemm2_256x64x128x64_1x4_TypeCast_v1_Nswizzle0_Quant0_MulRoutedWeight0_B16_B16_B16,0.0%,321.35,5160.62
stage1,256,1024,4096,192,128,8,ActivationType.Gelu,torch.bfloat16,torch.bfloat16,torch.bfloat16,QuantType.No,1,1,128,0,91.7645,moe_ck2stages_gemm1_256x128x64x64_1x4_TypeCast_v1_Nswizzle0_Quant0_MulRoutedWeight1_gelu_B16_B16_B16,0.0%,421.24,6764.67
stage1,256,1024,4096,192,128,8,ActivationType.Gelu,torch.bfloat16,torch.bfloat16,torch.bfloat16,QuantType.No,1,1,128,0,inf,moe_ck2stages_gemm1_256x128x128x64_1x4_TypeCast_v3_Nswizzle0_Quant0_MulRoutedWeight1_gelu_B16_B16_B16,100.0%,0.0,0.0
stage2,256,1024,4096,192,128,8,ActivationType.Gelu,torch.bfloat16,torch.bfloat16,torch.bfloat16,QuantType.No,1,1,128,0,124.7292,moe_ck2stages_gemm2_256x128x128x64_1x4_TypeCast_v1_Nswizzle0_Quant0_MulRoutedWeight0_B16_B16_B16,0.0%,309.91,4976.84
stage2,256,1024,4096,192,128,8,ActivationType.Gelu,torch.bfloat16,torch.bfloat16,torch.bfloat16,QuantType.No,1,1,128,0,126.3967,moe_ck2stages_gemm2_256x128x128x64_1x4_TypeCast_v3_Nswizzle0_Quant0_MulRoutedWeight0_B16_B16_B16,0.0%,305.82,4911.18
stage2,256,1024,4096,192,128,8,ActivationType.Gelu,torch.bfloat16,torch.bfloat16,torch.bfloat16,QuantType.No,1,1,128,0,81.5119,moe_ck2stages_gemm2_256x128x64x64_1x4_TypeCast_v3_Nswizzle0_Quant0_MulRoutedWeight0_B16_B16_B16,0.0%,474.22,7615.54
stage2,256,1024,4096,192,128,8,ActivationType.Gelu,torch.bfloat16,torch.bfloat16,torch.bfloat16,QuantType.No,1,1,128,0,90.6451,moe_ck2stages_gemm2_256x128x64x64_1x4_TypeCast_v1_Nswizzle0_Quant0_MulRoutedWeight0_B16_B16_B16,0.0%,426.44,6848.21
stage1,256,1024,4096,192,128,8,ActivationType.Silu,torch.bfloat16,torch.bfloat16,torch.bfloat16,QuantType.No,1,0,32,0,163.009,moe_ck2stages_gemm1_256x32x64x128_1x4_TypeCast_v1_Nswizzle0_Quant0_MulRoutedWeight0_silu_B16_B16_B16,0.0%,237.13,3808.11
stage1,256,1024,4096,192,128,8,ActivationType.Silu,torch.bfloat16,torch.bfloat16,torch.bfloat16,QuantType.No,1,0,32,0,155.0998,moe_ck2stages_gemm1_256x32x64x64_1x4_TypeCast_v1_Nswizzle0_Quant0_MulRoutedWeight0_silu_B16_B16_B16,0.0%,249.22,4002.31
stage2,256,1024,4096,192,128,8,ActivationType.Silu,torch.bfloat16,torch.bfloat16,torch.bfloat16,QuantType.No,1,0,32,0,inf,moe_ck2stages_gemm2_256x32x128x128_1x4_TypeCast_v1_Nswizzle0_Quant0_MulRoutedWeight1_B16_B16_B16,100.0%,0.0,0.0
stage2,256,1024,4096,192,128,8,ActivationType.Silu,torch.bfloat16,torch.bfloat16,torch.bfloat16,QuantType.No,1,0,32,0,79.446,moe_ck2stages_gemm2_256x32x64x64_1x4_TypeCast_v1_Nswizzle0_Quant0_MulRoutedWeight1_B16_B16_B16,0.1%,486.55,7813.57
stage1,256,1024,4096,192,128,8,ActivationType.Silu,torch.bfloat16,torch.bfloat16,torch.bfloat16,QuantType.No,1,0,64,0,117.2605,moe_ck2stages_gemm1_256x64x64x128_1x4_TypeCast_v1_Nswizzle0_Quant0_MulRoutedWeight0_silu_B16_B16_B16,0.0%,329.65,5293.83
stage1,256,1024,4096,192,128,8,ActivationType.Silu,torch.bfloat16,torch.bfloat16,torch.bfloat16,QuantType.No,1,0,64,0,121.3164,moe_ck2stages_gemm1_256x64x64x64_1x4_TypeCast_v1_Nswizzle0_Quant0_MulRoutedWeight0_silu_B16_B16_B16,0.0%,318.63,5116.84
stage2,256,1024,4096,192,128,8,ActivationType.Silu,torch.bfloat16,torch.bfloat16,torch.bfloat16,QuantType.No,1,0,64,0,inf,moe_ck2stages_gemm2_256x64x128x128_1x4_TypeCast_v1_Nswizzle0_Quant0_MulRoutedWeight1_B16_B16_B16,100.0%,0.0,0.0
stage2,256,1024,4096,192,128,8,ActivationType.Silu,torch.bfloat16,torch.bfloat16,torch.bfloat16,QuantType.No,1,0,64,0,79.0138,moe_ck2stages_gemm2_256x64x64x64_1x4_TypeCast_v1_Nswizzle0_Quant0_MulRoutedWeight1_B16_B16_B16,0.1%,489.21,7856.31
stage2,256,1024,4096,192,128,8,ActivationType.Silu,torch.bfloat16,torch.bfloat16,torch.bfloat16,QuantType.No,1,0,64,0,121.753,moe_ck2stages_gemm2_256x64x128x64_1x4_TypeCast_v1_Nswizzle0_Quant0_MulRoutedWeight1_B16_B16_B16,0.1%,317.48,5098.49
stage1,256,1024,4096,192,128,8,ActivationType.Silu,torch.bfloat16,torch.bfloat16,torch.bfloat16,QuantType.No,1,0,128,0,86.538,moe_ck2stages_gemm1_256x128x64x64_1x4_TypeCast_v1_Nswizzle0_Quant0_MulRoutedWeight0_silu_B16_B16_B16,0.0%,446.68,7173.23
stage1,256,1024,4096,192,128,8,ActivationType.Silu,torch.bfloat16,torch.bfloat16,torch.bfloat16,QuantType.No,1,0,128,0,inf,moe_ck2stages_gemm1_256x128x128x64_1x4_TypeCast_v3_Nswizzle0_Quant0_MulRoutedWeight0_silu_B16_B16_B16,100.0%,0.0,0.0
stage2,256,1024,4096,192,128,8,ActivationType.Silu,torch.bfloat16,torch.bfloat16,torch.bfloat16,QuantType.No,1,0,128,0,129.0725,moe_ck2stages_gemm2_256x128x128x64_1x4_TypeCast_v1_Nswizzle0_Quant0_MulRoutedWeight1_B16_B16_B16,0.1%,299.48,4809.37
stage2,256,1024,4096,192,128,8,ActivationType.Silu,torch.bfloat16,torch.bfloat16,torch.bfloat16,QuantType.No,1,0,128,0,128.9804,moe_ck2stages_gemm2_256x128x128x64_1x4_TypeCast_v3_Nswizzle0_Quant0_MulRoutedWeight1_B16_B16_B16,0.1%,299.69,4812.8
stage2,256,1024,4096,192,128,8,ActivationType.Silu,torch.bfloat16,torch.bfloat16,torch.bfloat16,QuantType.No,1,0,128,0,87.5424,moe_ck2stages_gemm2_256x128x64x64_1x4_TypeCast_v3_Nswizzle0_Quant0_MulRoutedWeight1_B16_B16_B16,0.1%,441.55,7090.93
stage2,256,1024,4096,192,128,8,ActivationType.Silu,torch.bfloat16,torch.bfloat16,torch.bfloat16,QuantType.No,1,0,128,0,98.1915,moe_ck2stages_gemm2_256x128x64x64_1x4_TypeCast_v1_Nswizzle0_Quant0_MulRoutedWeight1_B16_B16_B16,0.1%,393.67,6321.9
stage1,256,1024,4096,192,128,8,ActivationType.Silu,torch.bfloat16,torch.bfloat16,torch.bfloat16,QuantType.No,1,1,32,0,158.1021,moe_ck2stages_gemm1_256x32x64x128_1x4_TypeCast_v1_Nswizzle0_Quant0_MulRoutedWeight1_silu_B16_B16_B16,0.0%,244.49,3926.3
stage1,256,1024,4096,192,128,8,ActivationType.Silu,torch.bfloat16,torch.bfloat16,torch.bfloat16,QuantType.No,1,1,32,0,152.7922,moe_ck2stages_gemm1_256x32x64x64_1x4_TypeCast_v1_Nswizzle0_Quant0_MulRoutedWeight1_silu_B16_B16_B16,0.0%,252.99,4062.75
stage2,256,1024,4096,192,128,8,ActivationType.Silu,torch.bfloat16,torch.bfloat16,torch.bfloat16,QuantType.No,1,1,32,0,inf,moe_ck2stages_gemm2_256x32x128x128_1x4_TypeCast_v1_Nswizzle0_Quant0_MulRoutedWeight0_B16_B16_B16,100.0%,0.0,0.0
stage2,256,1024,4096,192,128,8,ActivationType.Silu,torch.bfloat16,torch.bfloat16,torch.bfloat16,QuantType.No,1,1,32,0,76.0742,moe_ck2stages_gemm2_256x32x64x64_1x4_TypeCast_v1_Nswizzle0_Quant0_MulRoutedWeight0_B16_B16_B16,0.0%,508.12,8159.89
stage1,256,1024,4096,192,128,8,ActivationType.Silu,torch.bfloat16,torch.bfloat16,torch.bfloat16,QuantType.No,1,1,64,0,118.2942,moe_ck2stages_gemm1_256x64x64x128_1x4_TypeCast_v1_Nswizzle0_Quant0_MulRoutedWeight1_silu_B16_B16_B16,0.0%,326.77,5247.57
stage1,256,1024,4096,192,128,8,ActivationType.Silu,torch.bfloat16,torch.bfloat16,torch.bfloat16,QuantType.No,1,1,64,0,121.9526,moe_ck2stages_gemm1_256x64x64x64_1x4_TypeCast_v1_Nswizzle0_Quant0_MulRoutedWeight1_silu_B16_B16_B16,0.0%,316.96,5090.15
stage2,256,1024,4096,192,128,8,ActivationType.Silu,torch.bfloat16,torch.bfloat16,torch.bfloat16,QuantType.No,1,1,64,0,inf,moe_ck2stages_gemm2_256x64x128x128_1x4_TypeCast_v1_Nswizzle0_Quant0_MulRoutedWeight0_B16_B16_B16,100.0%,0.0,0.0
stage2,256,1024,4096,192,128,8,ActivationType.Silu,torch.bfloat16,torch.bfloat16,torch.bfloat16,QuantType.No,1,1,64,0,74.919,moe_ck2stages_gemm2_256x64x64x64_1x4_TypeCast_v1_Nswizzle0_Quant0_MulRoutedWeight0_B16_B16_B16,0.0%,515.95,8285.71
stage2,256,1024,4096,192,128,8,ActivationType.Silu,torch.bfloat16,torch.bfloat16,torch.bfloat16,QuantType.No,1,1,64,0,119.895,moe_ck2stages_gemm2_256x64x128x64_1x4_TypeCast_v1_Nswizzle0_Quant0_MulRoutedWeight0_B16_B16_B16,0.0%,322.4,5177.51
stage1,256,1024,4096,192,128,8,ActivationType.Silu,torch.bfloat16,torch.bfloat16,torch.bfloat16,QuantType.No,1,1,128,0,87.9748,moe_ck2stages_gemm1_256x128x64x64_1x4_TypeCast_v1_Nswizzle0_Quant0_MulRoutedWeight1_silu_B16_B16_B16,0.0%,439.38,7056.08
stage1,256,1024,4096,192,128,8,ActivationType.Silu,torch.bfloat16,torch.bfloat16,torch.bfloat16,QuantType.No,1,1,128,0,inf,moe_ck2stages_gemm1_256x128x128x64_1x4_TypeCast_v3_Nswizzle0_Quant0_MulRoutedWeight1_silu_B16_B16_B16,100.0%,0.0,0.0
stage2,256,1024,4096,192,128,8,ActivationType.Silu,torch.bfloat16,torch.bfloat16,torch.bfloat16,QuantType.No,1,1,128,0,126.1356,moe_ck2stages_gemm2_256x128x128x64_1x4_TypeCast_v1_Nswizzle0_Quant0_MulRoutedWeight0_B16_B16_B16,0.0%,306.45,4921.35
stage2,256,1024,4096,192,128,8,ActivationType.Silu,torch.bfloat16,torch.bfloat16,torch.bfloat16,QuantType.No,1,1,128,0,125.2324,moe_ck2stages_gemm2_256x128x128x64_1x4_TypeCast_v3_Nswizzle0_Quant0_MulRoutedWeight0_B16_B16_B16,0.0%,308.66,4956.84
stage2,256,1024,4096,192,128,8,ActivationType.Silu,torch.bfloat16,torch.bfloat16,torch.bfloat16,QuantType.No,1,1,128,0,80.2079,moe_ck2stages_gemm2_256x128x64x64_1x4_TypeCast_v3_Nswizzle0_Quant0_MulRoutedWeight0_B16_B16_B16,0.0%,481.93,7739.35
stage2,256,1024,4096,192,128,8,ActivationType.Silu,torch.bfloat16,torch.bfloat16,torch.bfloat16,QuantType.No,1,1,128,0,91.1479,moe_ck2stages_gemm2_256x128x64x64_1x4_TypeCast_v1_Nswizzle0_Quant0_MulRoutedWeight0_B16_B16_B16,0.0%,424.09,6810.44
stage1,256,1024,4096,384,128,8,ActivationType.Gelu,torch.bfloat16,torch.bfloat16,torch.bfloat16,QuantType.No,1,0,32,0,318.0191,moe_ck2stages_gemm1_256x32x64x128_1x4_TypeCast_v1_Nswizzle0_Quant0_MulRoutedWeight0_gelu_B16_B16_B16,0.0%,243.1,3851.14
stage1,256,1024,4096,384,128,8,ActivationType.Gelu,torch.bfloat16,torch.bfloat16,torch.bfloat16,QuantType.No,1,0,32,0,313.8829,moe_ck2stages_gemm1_256x32x64x64_1x4_TypeCast_v1_Nswizzle0_Quant0_MulRoutedWeight0_gelu_B16_B16_B16,0.0%,246.3,3901.89
stage2,256,1024,4096,384,128,8,ActivationType.Gelu,torch.bfloat16,torch.bfloat16,torch.bfloat16,QuantType.No,1,0,32,0,129.1808,moe_ck2stages_gemm2_256x32x128x128_1x4_TypeCast_v1_Nswizzle0_Quant0_MulRoutedWeight1_B16_B16_B16,0.5%,598.46,9480.8
stage2,256,1024,4096,384,128,8,ActivationType.Gelu,torch.bfloat16,torch.bfloat16,torch.bfloat16,QuantType.No,1,0,32,0,121.603,moe_ck2stages_gemm2_256x32x64x64_1x4_TypeCast_v1_Nswizzle0_Quant0_MulRoutedWeight1_B16_B16_B16,0.5%,635.75,10071.6
stage1,256,1024,4096,384,128,8,ActivationType.Gelu,torch.bfloat16,torch.bfloat16,torch.bfloat16,QuantType.No,1,0,64,0,212.9183,moe_ck2stages_gemm1_256x64x64x128_1x4_TypeCast_v1_Nswizzle0_Quant0_MulRoutedWeight0_gelu_B16_B16_B16,0.0%,363.09,5752.14
stage1,256,1024,4096,384,128,8,ActivationType.Gelu,torch.bfloat16,torch.bfloat16,torch.bfloat16,QuantType.No,1,0,64,0,214.0008,moe_ck2stages_gemm1_256x64x64x64_1x4_TypeCast_v1_Nswizzle0_Quant0_MulRoutedWeight0_gelu_B16_B16_B16,0.0%,361.26,5723.05
stage2,256,1024,4096,384,128,8,ActivationType.Gelu,torch.bfloat16,torch.bfloat16,torch.bfloat16,QuantType.No,1,0,64,0,137.8177,moe_ck2stages_gemm2_256x64x128x128_1x4_TypeCast_v1_Nswizzle0_Quant0_MulRoutedWeight1_B16_B16_B16,0.5%,560.95,8886.64
stage2,256,1024,4096,384,128,8,ActivationType.Gelu,torch.bfloat16,torch.bfloat16,torch.bfloat16,QuantType.No,1,0,64,0,114.2025,moe_ck2stages_gemm2_256x64x64x64_1x4_TypeCast_v1_Nswizzle0_Quant0_MulRoutedWeight1_B16_B16_B16,0.5%,676.95,10724.26
stage2,256,1024,4096,384,128,8,ActivationType.Gelu,torch.bfloat16,torch.bfloat16,torch.bfloat16,QuantType.No,1,0,64,0,133.5395,moe_ck2stages_gemm2_256x64x128x64_1x4_TypeCast_v1_Nswizzle0_Quant0_MulRoutedWeight1_B16_B16_B16,0.5%,578.93,9171.34
stage1,256,1024,4096,384,128,8,ActivationType.Gelu,torch.bfloat16,torch.bfloat16,torch.bfloat16,QuantType.No,1,0,128,0,177.1347,moe_ck2stages_gemm1_256x128x64x64_1x4_TypeCast_v1_Nswizzle0_Quant0_MulRoutedWeight0_gelu_B16_B16_B16,0.0%,436.44,6914.15
stage1,256,1024,4096,384,128,8,ActivationType.Gelu,torch.bfloat16,torch.bfloat16,torch.bfloat16,QuantType.No,1,0,128,0,178.6754,moe_ck2stages_gemm1_256x128x128x64_1x4_TypeCast_v3_Nswizzle0_Quant0_MulRoutedWeight0_gelu_B16_B16_B16,0.0%,432.68,6854.53
stage2,256,1024,4096,384,128,8,ActivationType.Gelu,torch.bfloat16,torch.bfloat16,torch.bfloat16,QuantType.No,1,0,128,0,154.4645,moe_ck2stages_gemm2_256x128x128x64_1x4_TypeCast_v1_Nswizzle0_Quant0_MulRoutedWeight1_B16_B16_B16,0.5%,500.5,7928.92
stage2,256,1024,4096,384,128,8,ActivationType.Gelu,torch.bfloat16,torch.bfloat16,torch.bfloat16,QuantType.No,1,0,128,0,149.6892,moe_ck2stages_gemm2_256x128x128x64_1x4_TypeCast_v3_Nswizzle0_Quant0_MulRoutedWeight1_B16_B16_B16,0.5%,516.47,8181.86
stage2,256,1024,4096,384,128,8,ActivationType.Gelu,torch.bfloat16,torch.bfloat16,torch.bfloat16,QuantType.No,1,0,128,0,116.0704,moe_ck2stages_gemm2_256x128x64x64_1x4_TypeCast_v3_Nswizzle0_Quant0_MulRoutedWeight1_B16_B16_B16,0.5%,666.06,10551.67
stage2,256,1024,4096,384,128,8,ActivationType.Gelu,torch.bfloat16,torch.bfloat16,torch.bfloat16,QuantType.No,1,0,128,0,129.31,moe_ck2stages_gemm2_256x128x64x64_1x4_TypeCast_v1_Nswizzle0_Quant0_MulRoutedWeight1_B16_B16_B16,0.5%,597.86,9471.32
stage1,256,1024,4096,384,128,8,ActivationType.Gelu,torch.bfloat16,torch.bfloat16,torch.bfloat16,QuantType.No,1,1,32,0,328.3502,moe_ck2stages_gemm1_256x32x64x128_1x4_TypeCast_v1_Nswizzle0_Quant0_MulRoutedWeight1_gelu_B16_B16_B16,0.0%,235.45,3729.97
stage1,256,1024,4096,384,128,8,ActivationType.Gelu,torch.bfloat16,torch.bfloat16,torch.bfloat16,QuantType.No,1,1,32,0,322.7775,moe_ck2stages_gemm1_256x32x64x64_1x4_TypeCast_v1_Nswizzle0_Quant0_MulRoutedWeight1_gelu_B16_B16_B16,0.0%,239.51,3794.37
stage2,256,1024,4096,384,128,8,ActivationType.Gelu,torch.bfloat16,torch.bfloat16,torch.bfloat16,QuantType.No,1,1,32,0,128.4215,moe_ck2stages_gemm2_256x32x128x128_1x4_TypeCast_v1_Nswizzle0_Quant0_MulRoutedWeight0_B16_B16_B16,0.0%,602.0,9536.85
stage2,256,1024,4096,384,128,8,ActivationType.Gelu,torch.bfloat16,torch.bfloat16,torch.bfloat16,QuantType.No,1,1,32,0,119.9663,moe_ck2stages_gemm2_256x32x64x64_1x4_TypeCast_v1_Nswizzle0_Quant0_MulRoutedWeight0_B16_B16_B16,0.0%,644.43,10209.01
stage1,256,1024,4096,384,128,8,ActivationType.Gelu,torch.bfloat16,torch.bfloat16,torch.bfloat16,QuantType.No,1,1,64,0,216.1301,moe_ck2stages_gemm1_256x64x64x128_1x4_TypeCast_v1_Nswizzle0_Quant0_MulRoutedWeight1_gelu_B16_B16_B16,0.0%,357.7,5666.66
stage1,256,1024,4096,384,128,8,ActivationType.Gelu,torch.bfloat16,torch.bfloat16,torch.bfloat16,QuantType.No,1,1,64,0,216.5253,moe_ck2stages_gemm1_256x64x64x64_1x4_TypeCast_v1_Nswizzle0_Quant0_MulRoutedWeight1_gelu_B16_B16_B16,0.0%,357.05,5656.32
stage2,256,1024,4096,384,128,8,ActivationType.Gelu,torch.bfloat16,torch.bfloat16,torch.bfloat16,QuantType.No,1,1,64,0,131.3942,moe_ck2stages_gemm2_256x64x128x128_1x4_TypeCast_v1_Nswizzle0_Quant0_MulRoutedWeight0_B16_B16_B16,0.0%,588.38,9321.09
stage2,256,1024,4096,384,128,8,ActivationType.Gelu,torch.bfloat16,torch.bfloat16,torch.bfloat16,QuantType.No,1,1,64,0,109.4903,moe_ck2stages_gemm2_256x64x64x64_1x4_TypeCast_v1_Nswizzle0_Quant0_MulRoutedWeight0_B16_B16_B16,0.0%,706.08,11185.8
stage2,256,1024,4096,384,128,8,ActivationType.Gelu,torch.bfloat16,torch.bfloat16,torch.bfloat16,QuantType.No,1,1,64,0,130.9313,moe_ck2stages_gemm2_256x64x128x64_1x4_TypeCast_v1_Nswizzle0_Quant0_MulRoutedWeight0_B16_B16_B16,0.0%,590.46,9354.04
stage1,256,1024,4096,384,128,8,ActivationType.Gelu,torch.bfloat16,torch.bfloat16,torch.bfloat16,QuantType.No,1,1,128,0,179.2026,moe_ck2stages_gemm1_256x128x64x64_1x4_TypeCast_v1_Nswizzle0_Quant0_MulRoutedWeight1_gelu_B16_B16_B16,0.0%,431.41,6834.37
stage1,256,1024,4096,384,128,8,ActivationType.Gelu,torch.bfloat16,torch.bfloat16,torch.bfloat16,QuantType.No,1,1,128,0,182.3134,moe_ck2stages_gemm1_256x128x128x64_1x4_TypeCast_v3_Nswizzle0_Quant0_MulRoutedWeight1_gelu_B16_B16_B16,0.0%,424.05,6717.76
stage2,256,1024,4096,384,128,8,ActivationType.Gelu,torch.bfloat16,torch.bfloat16,torch.bfloat16,QuantType.No,1,1,128,0,144.0382,moe_ck2stages_gemm2_256x128x128x64_1x4_TypeCast_v1_Nswizzle0_Quant0_MulRoutedWeight0_B16_B16_B16,0.0%,536.73,8502.86
stage2,256,1024,4096,384,128,8,ActivationType.Gelu,torch.bfloat16,torch.bfloat16,torch.bfloat16,QuantType.No,1,1,128,0,144.3179,moe_ck2stages_gemm2_256x128x128x64_1x4_TypeCast_v3_Nswizzle0_Quant0_MulRoutedWeight0_B16_B16_B16,0.0%,535.69,8486.38
stage2,256,1024,4096,384,128,8,ActivationType.Gelu,torch.bfloat16,torch.bfloat16,torch.bfloat16,QuantType.No,1,1,128,0,111.4938,moe_ck2stages_gemm2_256x128x64x64_1x4_TypeCast_v3_Nswizzle0_Quant0_MulRoutedWeight0_B16_B16_B16,0.0%,693.4,10984.8
stage2,256,1024,4096,384,128,8,ActivationType.Gelu,torch.bfloat16,torch.bfloat16,torch.bfloat16,QuantType.No,1,1,128,0,121.6777,moe_ck2stages_gemm2_256x128x64x64_1x4_TypeCast_v1_Nswizzle0_Quant0_MulRoutedWeight0_B16_B16_B16,0.0%,635.36,10065.42
stage1,256,1024,4096,384,128,8,ActivationType.Silu,torch.bfloat16,torch.bfloat16,torch.bfloat16,QuantType.No,1,0,32,0,327.4092,moe_ck2stages_gemm1_256x32x64x128_1x4_TypeCast_v1_Nswizzle0_Quant0_MulRoutedWeight0_silu_B16_B16_B16,0.0%,236.12,3740.69
stage1,256,1024,4096,384,128,8,ActivationType.Silu,torch.bfloat16,torch.bfloat16,torch.bfloat16,QuantType.No,1,0,32,0,325.3896,moe_ck2stages_gemm1_256x32x64x64_1x4_TypeCast_v1_Nswizzle0_Quant0_MulRoutedWeight0_silu_B16_B16_B16,0.0%,237.59,3763.91
stage2,256,1024,4096,384,128,8,ActivationType.Silu,torch.bfloat16,torch.bfloat16,torch.bfloat16,QuantType.No,1,0,32,0,129.7496,moe_ck2stages_gemm2_256x32x128x128_1x4_TypeCast_v1_Nswizzle0_Quant0_MulRoutedWeight1_B16_B16_B16,0.4%,595.84,9439.23
stage2,256,1024,4096,384,128,8,ActivationType.Silu,torch.bfloat16,torch.bfloat16,torch.bfloat16,QuantType.No,1,0,32,0,121.8135,moe_ck2stages_gemm2_256x32x64x64_1x4_TypeCast_v1_Nswizzle0_Quant0_MulRoutedWeight1_B16_B16_B16,0.4%,634.65,10054.2
stage1,256,1024,4096,384,128,8,ActivationType.Silu,torch.bfloat16,torch.bfloat16,torch.bfloat16,QuantType.No,1,0,64,0,214.0085,moe_ck2stages_gemm1_256x64x64x128_1x4_TypeCast_v1_Nswizzle0_Quant0_MulRoutedWeight0_silu_B16_B16_B16,0.0%,361.24,5722.84
stage1,256,1024,4096,384,128,8,ActivationType.Silu,torch.bfloat16,torch.bfloat16,torch.bfloat16,QuantType.No,1,0,64,0,215.6543,moe_ck2stages_gemm1_256x64x64x64_1x4_TypeCast_v1_Nswizzle0_Quant0_MulRoutedWeight0_silu_B16_B16_B16,0.0%,358.49,5679.17
stage2,256,1024,4096,384,128,8,ActivationType.Silu,torch.bfloat16,torch.bfloat16,torch.bfloat16,QuantType.No,1,0,64,0,137.5778,moe_ck2stages_gemm2_256x64x128x128_1x4_TypeCast_v1_Nswizzle0_Quant0_MulRoutedWeight1_B16_B16_B16,0.4%,561.93,8902.14
stage2,256,1024,4096,384,128,8,ActivationType.Silu,torch.bfloat16,torch.bfloat16,torch.bfloat16,QuantType.No,1,0,64,0,112.0332,moe_ck2stages_gemm2_256x64x64x64_1x4_TypeCast_v1_Nswizzle0_Quant0_MulRoutedWeight1_B16_B16_B16,0.4%,690.06,10931.91
stage2,256,1024,4096,384,128,8,ActivationType.Silu,torch.bfloat16,torch.bfloat16,torch.bfloat16,QuantType.No,1,0,64,0,131.9708,moe_ck2stages_gemm2_256x64x128x64_1x4_TypeCast_v1_Nswizzle0_Quant0_MulRoutedWeight1_B16_B16_B16,0.4%,585.81,9280.36
stage1,256,1024,4096,384,128,8,ActivationType.Silu,torch.bfloat16,torch.bfloat16,torch.bfloat16,QuantType.No,1,0,128,0,167.8169,moe_ck2stages_gemm1_256x128x64x64_1x4_TypeCast_v1_Nswizzle0_Quant0_MulRoutedWeight0_silu_B16_B16_B16,0.0%,460.68,7298.05
stage1,256,1024,4096,384,128,8,ActivationType.Silu,torch.bfloat16,torch.bfloat16,torch.bfloat16,QuantType.No,1,0,128,0,170.5798,moe_ck2stages_gemm1_256x128x128x64_1x4_TypeCast_v3_Nswizzle0_Quant0_MulRoutedWeight0_silu_B16_B16_B16,0.0%,453.22,7179.85
stage2,256,1024,4096,384,128,8,ActivationType.Silu,torch.bfloat16,torch.bfloat16,torch.bfloat16,QuantType.No,1,0,128,0,153.0932,moe_ck2stages_gemm2_256x128x128x64_1x4_TypeCast_v1_Nswizzle0_Quant0_MulRoutedWeight1_B16_B16_B16,0.4%,504.98,7999.94
stage2,256,1024,4096,384,128,8,ActivationType.Silu,torch.bfloat16,torch.bfloat16,torch.bfloat16,QuantType.No,1,0,128,0,149.7163,moe_ck2stages_gemm2_256x128x128x64_1x4_TypeCast_v3_Nswizzle0_Quant0_MulRoutedWeight1_B16_B16_B16,0.4%,516.37,8180.38
stage2,256,1024,4096,384,128,8,ActivationType.Silu,torch.bfloat16,torch.bfloat16,torch.bfloat16,QuantType.No,1,0,128,0,114.7026,moe_ck2stages_gemm2_256x128x64x64_1x4_TypeCast_v3_Nswizzle0_Quant0_MulRoutedWeight1_B16_B16_B16,0.4%,674.0,10677.5
stage2,256,1024,4096,384,128,8,ActivationType.Silu,torch.bfloat16,torch.bfloat16,torch.bfloat16,QuantType.No,1,0,128,0,127.9265,moe_ck2stages_gemm2_256x128x64x64_1x4_TypeCast_v1_Nswizzle0_Quant0_MulRoutedWeight1_B16_B16_B16,0.4%,604.33,9573.75
stage1,256,1024,4096,384,128,8,ActivationType.Silu,torch.bfloat16,torch.bfloat16,torch.bfloat16,QuantType.No,1,1,32,0,317.6622,moe_ck2stages_gemm1_256x32x64x128_1x4_TypeCast_v1_Nswizzle0_Quant0_MulRoutedWeight1_silu_B16_B16_B16,0.0%,243.37,3855.47
stage1,256,1024,4096,384,128,8,ActivationType.Silu,torch.bfloat16,torch.bfloat16,torch.bfloat16,QuantType.No,1,1,32,0,314.4472,moe_ck2stages_gemm1_256x32x64x64_1x4_TypeCast_v1_Nswizzle0_Quant0_MulRoutedWeight1_silu_B16_B16_B16,0.0%,245.86,3894.89
stage2,256,1024,4096,384,128,8,ActivationType.Silu,torch.bfloat16,torch.bfloat16,torch.bfloat16,QuantType.No,1,1,32,0,128.2184,moe_ck2stages_gemm2_256x32x128x128_1x4_TypeCast_v1_Nswizzle0_Quant0_MulRoutedWeight0_B16_B16_B16,0.0%,602.95,9551.96
stage2,256,1024,4096,384,128,8,ActivationType.Silu,torch.bfloat16,torch.bfloat16,torch.bfloat16,QuantType.No,1,1,32,0,117.6489,moe_ck2stages_gemm2_256x32x64x64_1x4_TypeCast_v1_Nswizzle0_Quant0_MulRoutedWeight0_B16_B16_B16,0.0%,657.12,10410.1
stage1,256,1024,4096,384,128,8,ActivationType.Silu,torch.bfloat16,torch.bfloat16,torch.bfloat16,QuantType.No,1,1,64,0,212.7531,moe_ck2stages_gemm1_256x64x64x128_1x4_TypeCast_v1_Nswizzle0_Quant0_MulRoutedWeight1_silu_B16_B16_B16,0.0%,363.38,5756.61
stage1,256,1024,4096,384,128,8,ActivationType.Silu,torch.bfloat16,torch.bfloat16,torch.bfloat16,QuantType.No,1,1,64,0,214.158,moe_ck2stages_gemm1_256x64x64x64_1x4_TypeCast_v1_Nswizzle0_Quant0_MulRoutedWeight1_silu_B16_B16_B16,0.0%,360.99,5718.85
stage2,256,1024,4096,384,128,8,ActivationType.Silu,torch.bfloat16,torch.bfloat16,torch.bfloat16,QuantType.No,1,1,64,0,130.4132,moe_ck2stages_gemm2_256x64x128x128_1x4_TypeCast_v1_Nswizzle0_Quant0_MulRoutedWeight0_B16_B16_B16,0.0%,592.8,9391.2
stage2,256,1024,4096,384,128,8,ActivationType.Silu,torch.bfloat16,torch.bfloat16,torch.bfloat16,QuantType.No,1,1,64,0,108.9015,moe_ck2stages_gemm2_256x64x64x64_1x4_TypeCast_v1_Nswizzle0_Quant0_MulRoutedWeight0_B16_B16_B16,0.0%,709.9,11246.28
stage2,256,1024,4096,384,128,8,ActivationType.Silu,torch.bfloat16,torch.bfloat16,torch.bfloat16,QuantType.No,1,1,64,0,130.4415,moe_ck2stages_gemm2_256x64x128x64_1x4_TypeCast_v1_Nswizzle0_Quant0_MulRoutedWeight0_B16_B16_B16,0.0%,592.67,9389.17
stage1,256,1024,4096,384,128,8,ActivationType.Silu,torch.bfloat16,torch.bfloat16,torch.bfloat16,QuantType.No,1,1,128,0,170.1301,moe_ck2stages_gemm1_256x128x64x64_1x4_TypeCast_v1_Nswizzle0_Quant0_MulRoutedWeight1_silu_B16_B16_B16,0.0%,454.41,7198.82
stage1,256,1024,4096,384,128,8,ActivationType.Silu,torch.bfloat16,torch.bfloat16,torch.bfloat16,QuantType.No,1,1,128,0,172.3509,moe_ck2stages_gemm1_256x128x128x64_1x4_TypeCast_v3_Nswizzle0_Quant0_MulRoutedWeight1_silu_B16_B16_B16,0.0%,448.56,7106.07
stage2,256,1024,4096,384,128,8,ActivationType.Silu,torch.bfloat16,torch.bfloat16,torch.bfloat16,QuantType.No,1,1,128,0,145.2872,moe_ck2stages_gemm2_256x128x128x64_1x4_TypeCast_v1_Nswizzle0_Quant0_MulRoutedWeight0_B16_B16_B16,0.0%,532.11,8429.76
stage2,256,1024,4096,384,128,8,ActivationType.Silu,torch.bfloat16,torch.bfloat16,torch.bfloat16,QuantType.No,1,1,128,0,145.1231,moe_ck2stages_gemm2_256x128x128x64_1x4_TypeCast_v3_Nswizzle0_Quant0_MulRoutedWeight0_B16_B16_B16,0.0%,532.72,8439.3
stage2,256,1024,4096,384,128,8,ActivationType.Silu,torch.bfloat16,torch.bfloat16,torch.bfloat16,QuantType.No,1,1,128,0,109.7407,moe_ck2stages_gemm2_256x128x64x64_1x4_TypeCast_v3_Nswizzle0_Quant0_MulRoutedWeight0_B16_B16_B16,0.0%,704.47,11160.28
stage2,256,1024,4096,384,128,8,ActivationType.Silu,torch.bfloat16,torch.bfloat16,torch.bfloat16,QuantType.No,1,1,128,0,121.7511,moe_ck2stages_gemm2_256x128x64x64_1x4_TypeCast_v1_Nswizzle0_Quant0_MulRoutedWeight0_B16_B16_B16,0.0%,634.98,10059.35
stage1,256,1024,7168,256,256,8,ActivationType.Gelu,torch.bfloat16,torch.bfloat16,torch.bfloat16,QuantType.No,1,0,32,0,430.962,moe_ck2stages_gemm1_256x32x64x128_1x4_TypeCast_v1_Nswizzle0_Quant0_MulRoutedWeight0_gelu_B16_B16_B16,0.0%,209.29,6608.31
stage1,256,1024,7168,256,256,8,ActivationType.Gelu,torch.bfloat16,torch.bfloat16,torch.bfloat16,QuantType.No,1,0,32,0,432.7366,moe_ck2stages_gemm1_256x32x64x64_1x4_TypeCast_v1_Nswizzle0_Quant0_MulRoutedWeight0_gelu_B16_B16_B16,0.0%,208.43,6581.21
stage2,256,1024,7168,256,256,8,ActivationType.Gelu,torch.bfloat16,torch.bfloat16,torch.bfloat16,QuantType.No,1,0,32,0,219.2741,moe_ck2stages_gemm2_256x32x128x128_1x4_TypeCast_v1_Nswizzle0_Quant0_MulRoutedWeight1_B16_B16_B16,1.6%,411.33,12988.0
stage2,256,1024,7168,256,256,8,ActivationType.Gelu,torch.bfloat16,torch.bfloat16,torch.bfloat16,QuantType.No,1,0,32,0,210.1184,moe_ck2stages_gemm2_256x32x64x64_1x4_TypeCast_v1_Nswizzle0_Quant0_MulRoutedWeight1_B16_B16_B16,1.6%,429.25,13553.94
stage1,256,1024,7168,256,256,8,ActivationType.Gelu,torch.bfloat16,torch.bfloat16,torch.bfloat16,QuantType.No,1,0,64,0,334.7056,moe_ck2stages_gemm1_256x64x64x128_1x4_TypeCast_v1_Nswizzle0_Quant0_MulRoutedWeight0_gelu_B16_B16_B16,0.0%,269.47,8508.77
stage1,256,1024,7168,256,256,8,ActivationType.Gelu,torch.bfloat16,torch.bfloat16,torch.bfloat16,QuantType.No,1,0,64,0,332.8268,moe_ck2stages_gemm1_256x64x64x64_1x4_TypeCast_v1_Nswizzle0_Quant0_MulRoutedWeight0_gelu_B16_B16_B16,0.0%,270.99,8556.8
stage2,256,1024,7168,256,256,8,ActivationType.Gelu,torch.bfloat16,torch.bfloat16,torch.bfloat16,QuantType.No,1,0,64,0,227.1276,moe_ck2stages_gemm2_256x64x128x128_1x4_TypeCast_v1_Nswizzle0_Quant0_MulRoutedWeight1_B16_B16_B16,1.6%,397.11,12538.91
stage2,256,1024,7168,256,256,8,ActivationType.Gelu,torch.bfloat16,torch.bfloat16,torch.bfloat16,QuantType.No,1,0,64,0,211.8317,moe_ck2stages_gemm2_256x64x64x64_1x4_TypeCast_v1_Nswizzle0_Quant0_MulRoutedWeight1_B16_B16_B16,1.6%,425.78,13444.32
stage2,256,1024,7168,256,256,8,ActivationType.Gelu,torch.bfloat16,torch.bfloat16,torch.bfloat16,QuantType.No,1,0,64,0,235.4023,moe_ck2stages_gemm2_256x64x128x64_1x4_TypeCast_v1_Nswizzle0_Quant0_MulRoutedWeight1_B16_B16_B16,1.6%,383.15,12098.15
stage1,256,1024,7168,256,256,8,ActivationType.Gelu,torch.bfloat16,torch.bfloat16,torch.bfloat16,QuantType.No,1,0,128,0,334.8201,moe_ck2stages_gemm1_256x128x64x64_1x4_TypeCast_v1_Nswizzle0_Quant0_MulRoutedWeight0_gelu_B16_B16_B16,0.0%,269.38,8505.86
stage1,256,1024,7168,256,256,8,ActivationType.Gelu,torch.bfloat16,torch.bfloat16,torch.bfloat16,QuantType.No,1,0,128,0,338.4679,moe_ck2stages_gemm1_256x128x128x64_1x4_TypeCast_v3_Nswizzle0_Quant0_MulRoutedWeight0_gelu_B16_B16_B16,0.0%,266.48,8414.19
stage2,256,1024,7168,256,256,8,ActivationType.Gelu,torch.bfloat16,torch.bfloat16,torch.bfloat16,QuantType.No,1,0,128,0,282.6865,moe_ck2stages_gemm2_256x128x128x64_1x4_TypeCast_v1_Nswizzle0_Quant0_MulRoutedWeight1_B16_B16_B16,1.6%,319.06,10074.53
stage2,256,1024,7168,256,256,8,ActivationType.Gelu,torch.bfloat16,torch.bfloat16,torch.bfloat16,QuantType.No,1,0,128,0,277.2687,moe_ck2stages_gemm2_256x128x128x64_1x4_TypeCast_v3_Nswizzle0_Quant0_MulRoutedWeight1_B16_B16_B16,1.6%,325.3,10271.38
stage2,256,1024,7168,256,256,8,ActivationType.Gelu,torch.bfloat16,torch.bfloat16,torch.bfloat16,QuantType.No,1,0,128,0,269.3842,moe_ck2stages_gemm2_256x128x64x64_1x4_TypeCast_v3_Nswizzle0_Quant0_MulRoutedWeight1_B16_B16_B16,1.6%,334.82,10572.01
stage2,256,1024,7168,256,256,8,ActivationType.Gelu,torch.bfloat16,torch.bfloat16,torch.bfloat16,QuantType.No,1,0,128,0,303.4589,moe_ck2stages_gemm2_256x128x64x64_1x4_TypeCast_v1_Nswizzle0_Quant0_MulRoutedWeight1_B16_B16_B16,1.6%,297.22,9384.9
stage1,256,1024,7168,256,256,8,ActivationType.Gelu,torch.bfloat16,torch.bfloat16,torch.bfloat16,QuantType.No,1,1,32,0,447.1791,moe_ck2stages_gemm1_256x32x64x128_1x4_TypeCast_v1_Nswizzle0_Quant0_MulRoutedWeight1_gelu_B16_B16_B16,0.0%,201.7,6368.66
stage1,256,1024,7168,256,256,8,ActivationType.Gelu,torch.bfloat16,torch.bfloat16,torch.bfloat16,QuantType.No,1,1,32,0,443.4816,moe_ck2stages_gemm1_256x32x64x64_1x4_TypeCast_v1_Nswizzle0_Quant0_MulRoutedWeight1_gelu_B16_B16_B16,0.0%,203.38,6421.76
stage2,256,1024,7168,256,256,8,ActivationType.Gelu,torch.bfloat16,torch.bfloat16,torch.bfloat16,QuantType.No,1,1,32,0,220.4844,moe_ck2stages_gemm2_256x32x128x128_1x4_TypeCast_v1_Nswizzle0_Quant0_MulRoutedWeight0_B16_B16_B16,0.0%,409.07,12916.71
stage2,256,1024,7168,256,256,8,ActivationType.Gelu,torch.bfloat16,torch.bfloat16,torch.bfloat16,QuantType.No,1,1,32,0,210.2297,moe_ck2stages_gemm2_256x32x64x64_1x4_TypeCast_v1_Nswizzle0_Quant0_MulRoutedWeight0_B16_B16_B16,0.0%,429.03,13546.77
stage1,256,1024,7168,256,256,8,ActivationType.Gelu,torch.bfloat16,torch.bfloat16,torch.bfloat16,QuantType.No,1,1,64,0,344.3404,moe_ck2stages_gemm1_256x64x64x128_1x4_TypeCast_v1_Nswizzle0_Quant0_MulRoutedWeight1_gelu_B16_B16_B16,0.0%,261.93,8270.69
stage1,256,1024,7168,256,256,8,ActivationType.Gelu,torch.bfloat16,torch.bfloat16,torch.bfloat16,QuantType.No,1,1,64,0,343.6225,moe_ck2stages_gemm1_256x64x64x64_1x4_TypeCast_v1_Nswizzle0_Quant0_MulRoutedWeight1_gelu_B16_B16_B16,0.0%,262.48,8287.97
stage2,256,1024,7168,256,256,8,ActivationType.Gelu,torch.bfloat16,torch.bfloat16,torch.bfloat16,QuantType.No,1,1,64,0,223.1864,moe_ck2stages_gemm2_256x64x128x128_1x4_TypeCast_v1_Nswizzle0_Quant0_MulRoutedWeight0_B16_B16_B16,0.0%,404.12,12760.33
stage2,256,1024,7168,256,256,8,ActivationType.Gelu,torch.bfloat16,torch.bfloat16,torch.bfloat16,QuantType.No,1,1,64,0,203.7815,moe_ck2stages_gemm2_256x64x64x64_1x4_TypeCast_v1_Nswizzle0_Quant0_MulRoutedWeight0_B16_B16_B16,0.0%,442.6,13975.42
stage2,256,1024,7168,256,256,8,ActivationType.Gelu,torch.bfloat16,torch.bfloat16,torch.bfloat16,QuantType.No,1,1,64,0,231.67,moe_ck2stages_gemm2_256x64x128x64_1x4_TypeCast_v1_Nswizzle0_Quant0_MulRoutedWeight0_B16_B16_B16,0.0%,389.32,12293.06
stage1,256,1024,7168,256,256,8,ActivationType.Gelu,torch.bfloat16,torch.bfloat16,torch.bfloat16,QuantType.No,1,1,128,0,336.1414,moe_ck2stages_gemm1_256x128x64x64_1x4_TypeCast_v1_Nswizzle0_Quant0_MulRoutedWeight1_gelu_B16_B16_B16,0.0%,268.32,8472.42
stage1,256,1024,7168,256,256,8,ActivationType.Gelu,torch.bfloat16,torch.bfloat16,torch.bfloat16,QuantType.No,1,1,128,0,335.7388,moe_ck2stages_gemm1_256x128x128x64_1x4_TypeCast_v3_Nswizzle0_Quant0_MulRoutedWeight1_gelu_B16_B16_B16,0.0%,268.64,8482.58
stage2,256,1024,7168,256,256,8,ActivationType.Gelu,torch.bfloat16,torch.bfloat16,torch.bfloat16,QuantType.No,1,1,128,0,267.3026,moe_ck2stages_gemm2_256x128x128x64_1x4_TypeCast_v1_Nswizzle0_Quant0_MulRoutedWeight0_B16_B16_B16,0.0%,337.42,10654.34
stage2,256,1024,7168,256,256,8,ActivationType.Gelu,torch.bfloat16,torch.bfloat16,torch.bfloat16,QuantType.No,1,1,128,0,263.0953,moe_ck2stages_gemm2_256x128x128x64_1x4_TypeCast_v3_Nswizzle0_Quant0_MulRoutedWeight0_B16_B16_B16,0.0%,342.82,10824.72
stage2,256,1024,7168,256,256,8,ActivationType.Gelu,torch.bfloat16,torch.bfloat16,torch.bfloat16,QuantType.No,1,1,128,0,248.1359,moe_ck2stages_gemm2_256x128x64x64_1x4_TypeCast_v3_Nswizzle0_Quant0_MulRoutedWeight0_B16_B16_B16,0.0%,363.49,11477.31
stage2,256,1024,7168,256,256,8,ActivationType.Gelu,torch.bfloat16,torch.bfloat16,torch.bfloat16,QuantType.No,1,1,128,0,285.089,moe_ck2stages_gemm2_256x128x64x64_1x4_TypeCast_v1_Nswizzle0_Quant0_MulRoutedWeight0_B16_B16_B16,0.0%,316.37,9989.63
stage1,256,1024,7168,256,256,8,ActivationType.Silu,torch.bfloat16,torch.bfloat16,torch.bfloat16,QuantType.No,1,0,32,0,442.0633,moe_ck2stages_gemm1_256x32x64x128_1x4_TypeCast_v1_Nswizzle0_Quant0_MulRoutedWeight0_silu_B16_B16_B16,0.0%,204.03,6442.36
stage1,256,1024,7168,256,256,8,ActivationType.Silu,torch.bfloat16,torch.bfloat16,torch.bfloat16,QuantType.No,1,0,32,0,442.1321,moe_ck2stages_gemm1_256x32x64x64_1x4_TypeCast_v1_Nswizzle0_Quant0_MulRoutedWeight0_silu_B16_B16_B16,0.0%,204.0,6441.36
stage2,256,1024,7168,256,256,8,ActivationType.Silu,torch.bfloat16,torch.bfloat16,torch.bfloat16,QuantType.No,1,0,32,0,220.8101,moe_ck2stages_gemm2_256x32x128x128_1x4_TypeCast_v1_Nswizzle0_Quant0_MulRoutedWeight1_B16_B16_B16,1.3%,408.47,12897.65
stage2,256,1024,7168,256,256,8,ActivationType.Silu,torch.bfloat16,torch.bfloat16,torch.bfloat16,QuantType.No,1,0,32,0,207.1366,moe_ck2stages_gemm2_256x32x64x64_1x4_TypeCast_v1_Nswizzle0_Quant0_MulRoutedWeight1_B16_B16_B16,1.3%,435.43,13749.05
stage1,256,1024,7168,256,256,8,ActivationType.Silu,torch.bfloat16,torch.bfloat16,torch.bfloat16,QuantType.No,1,0,64,0,343.4053,moe_ck2stages_gemm1_256x64x64x128_1x4_TypeCast_v1_Nswizzle0_Quant0_MulRoutedWeight0_silu_B16_B16_B16,0.0%,262.65,8293.21
stage1,256,1024,7168,256,256,8,ActivationType.Silu,torch.bfloat16,torch.bfloat16,torch.bfloat16,QuantType.No,1,0,64,0,346.4473,moe_ck2stages_gemm1_256x64x64x64_1x4_TypeCast_v1_Nswizzle0_Quant0_MulRoutedWeight0_silu_B16_B16_B16,0.0%,260.34,8220.39
stage2,256,1024,7168,256,256,8,ActivationType.Silu,torch.bfloat16,torch.bfloat16,torch.bfloat16,QuantType.No,1,0,64,0,228.5681,moe_ck2stages_gemm2_256x64x128x128_1x4_TypeCast_v1_Nswizzle0_Quant0_MulRoutedWeight1_B16_B16_B16,1.3%,394.61,12459.89
stage2,256,1024,7168,256,256,8,ActivationType.Silu,torch.bfloat16,torch.bfloat16,torch.bfloat16,QuantType.No,1,0,64,0,213.7658,moe_ck2stages_gemm2_256x64x64x64_1x4_TypeCast_v1_Nswizzle0_Quant0_MulRoutedWeight1_B16_B16_B16,1.3%,421.93,13322.68
stage2,256,1024,7168,256,256,8,ActivationType.Silu,torch.bfloat16,torch.bfloat16,torch.bfloat16,QuantType.No,1,0,64,0,236.8589,moe_ck2stages_gemm2_256x64x128x64_1x4_TypeCast_v1_Nswizzle0_Quant0_MulRoutedWeight1_B16_B16_B16,1.3%,380.79,12023.75
stage1,256,1024,7168,256,256,8,ActivationType.Silu,torch.bfloat16,torch.bfloat16,torch.bfloat16,QuantType.No,1,0,128,0,340.2016,moe_ck2stages_gemm1_256x128x64x64_1x4_TypeCast_v1_Nswizzle0_Quant0_MulRoutedWeight0_silu_B16_B16_B16,0.0%,265.12,8371.31
stage1,256,1024,7168,256,256,8,ActivationType.Silu,torch.bfloat16,torch.bfloat16,torch.bfloat16,QuantType.No,1,0,128,0,339.7664,moe_ck2stages_gemm1_256x128x128x64_1x4_TypeCast_v3_Nswizzle0_Quant0_MulRoutedWeight0_silu_B16_B16_B16,0.0%,265.46,8382.03
stage2,256,1024,7168,256,256,8,ActivationType.Silu,torch.bfloat16,torch.bfloat16,torch.bfloat16,QuantType.No,1,0,128,0,281.8714,moe_ck2stages_gemm2_256x128x128x64_1x4_TypeCast_v1_Nswizzle0_Quant0_MulRoutedWeight1_B16_B16_B16,1.3%,319.98,10103.66
stage2,256,1024,7168,256,256,8,ActivationType.Silu,torch.bfloat16,torch.bfloat16,torch.bfloat16,QuantType.No,1,0,128,0,278.593,moe_ck2stages_gemm2_256x128x128x64_1x4_TypeCast_v3_Nswizzle0_Quant0_MulRoutedWeight1_B16_B16_B16,1.3%,323.75,10222.56
stage2,256,1024,7168,256,256,8,ActivationType.Silu,torch.bfloat16,torch.bfloat16,torch.bfloat16,QuantType.No,1,0,128,0,263.9666,moe_ck2stages_gemm2_256x128x64x64_1x4_TypeCast_v3_Nswizzle0_Quant0_MulRoutedWeight1_B16_B16_B16,1.3%,341.69,10788.99
stage2,256,1024,7168,256,256,8,ActivationType.Silu,torch.bfloat16,torch.bfloat16,torch.bfloat16,QuantType.No,1,0,128,0,305.0461,moe_ck2stages_gemm2_256x128x64x64_1x4_TypeCast_v1_Nswizzle0_Quant0_MulRoutedWeight1_B16_B16_B16,1.3%,295.67,9336.07
stage1,256,1024,7168,256,256,8,ActivationType.Silu,torch.bfloat16,torch.bfloat16,torch.bfloat16,QuantType.No,1,1,32,0,429.7401,moe_ck2stages_gemm1_256x32x64x128_1x4_TypeCast_v1_Nswizzle0_Quant0_MulRoutedWeight1_silu_B16_B16_B16,0.0%,209.88,6627.1
stage1,256,1024,7168,256,256,8,ActivationType.Silu,torch.bfloat16,torch.bfloat16,torch.bfloat16,QuantType.No,1,1,32,0,439.0155,moe_ck2stages_gemm1_256x32x64x64_1x4_TypeCast_v1_Nswizzle0_Quant0_MulRoutedWeight1_silu_B16_B16_B16,0.0%,205.45,6487.09
stage2,256,1024,7168,256,256,8,ActivationType.Silu,torch.bfloat16,torch.bfloat16,torch.bfloat16,QuantType.No,1,1,32,0,218.8569,moe_ck2stages_gemm2_256x32x128x128_1x4_TypeCast_v1_Nswizzle0_Quant0_MulRoutedWeight0_B16_B16_B16,0.0%,412.12,13012.76
stage2,256,1024,7168,256,256,8,ActivationType.Silu,torch.bfloat16,torch.bfloat16,torch.bfloat16,QuantType.No,1,1,32,0,207.4185,moe_ck2stages_gemm2_256x32x64x64_1x4_TypeCast_v1_Nswizzle0_Quant0_MulRoutedWeight0_B16_B16_B16,0.0%,434.84,13730.37
stage1,256,1024,7168,256,256,8,ActivationType.Silu,torch.bfloat16,torch.bfloat16,torch.bfloat16,QuantType.No,1,1,64,0,335.5907,moe_ck2stages_gemm1_256x64x64x128_1x4_TypeCast_v1_Nswizzle0_Quant0_MulRoutedWeight1_silu_B16_B16_B16,0.0%,268.76,8486.33
stage1,256,1024,7168,256,256,8,ActivationType.Silu,torch.bfloat16,torch.bfloat16,torch.bfloat16,QuantType.No,1,1,64,0,332.0121,moe_ck2stages_gemm1_256x64x64x64_1x4_TypeCast_v1_Nswizzle0_Quant0_MulRoutedWeight1_silu_B16_B16_B16,0.0%,271.66,8577.8
stage2,256,1024,7168,256,256,8,ActivationType.Silu,torch.bfloat16,torch.bfloat16,torch.bfloat16,QuantType.No,1,1,64,0,223.6365,moe_ck2stages_gemm2_256x64x128x128_1x4_TypeCast_v1_Nswizzle0_Quant0_MulRoutedWeight0_B16_B16_B16,0.0%,403.31,12734.65
stage2,256,1024,7168,256,256,8,ActivationType.Silu,torch.bfloat16,torch.bfloat16,torch.bfloat16,QuantType.No,1,1,64,0,201.1541,moe_ck2stages_gemm2_256x64x64x64_1x4_TypeCast_v1_Nswizzle0_Quant0_MulRoutedWeight0_B16_B16_B16,0.0%,448.38,14157.96
stage2,256,1024,7168,256,256,8,ActivationType.Silu,torch.bfloat16,torch.bfloat16,torch.bfloat16,QuantType.No,1,1,64,0,230.8735,moe_ck2stages_gemm2_256x64x128x64_1x4_TypeCast_v1_Nswizzle0_Quant0_MulRoutedWeight0_B16_B16_B16,0.0%,390.67,12335.47
stage1,256,1024,7168,256,256,8,ActivationType.Silu,torch.bfloat16,torch.bfloat16,torch.bfloat16,QuantType.No,1,1,128,0,329.125,moe_ck2stages_gemm1_256x128x64x64_1x4_TypeCast_v1_Nswizzle0_Quant0_MulRoutedWeight1_silu_B16_B16_B16,0.0%,274.04,8653.04
stage1,256,1024,7168,256,256,8,ActivationType.Silu,torch.bfloat16,torch.bfloat16,torch.bfloat16,QuantType.No,1,1,128,0,328.7994,moe_ck2stages_gemm1_256x128x128x64_1x4_TypeCast_v3_Nswizzle0_Quant0_MulRoutedWeight1_silu_B16_B16_B16,0.0%,274.31,8661.61
stage2,256,1024,7168,256,256,8,ActivationType.Silu,torch.bfloat16,torch.bfloat16,torch.bfloat16,QuantType.No,1,1,128,0,266.0344,moe_ck2stages_gemm2_256x128x128x64_1x4_TypeCast_v1_Nswizzle0_Quant0_MulRoutedWeight0_B16_B16_B16,0.0%,339.03,10705.13
stage2,256,1024,7168,256,256,8,ActivationType.Silu,torch.bfloat16,torch.bfloat16,torch.bfloat16,QuantType.No,1,1,128,0,263.8728,moe_ck2stages_gemm2_256x128x128x64_1x4_TypeCast_v3_Nswizzle0_Quant0_MulRoutedWeight0_B16_B16_B16,0.0%,341.81,10792.82
stage2,256,1024,7168,256,256,8,ActivationType.Silu,torch.bfloat16,torch.bfloat16,torch.bfloat16,QuantType.No,1,1,128,0,245.1259,moe_ck2stages_gemm2_256x128x64x64_1x4_TypeCast_v3_Nswizzle0_Quant0_MulRoutedWeight0_B16_B16_B16,0.0%,367.95,11618.24
stage2,256,1024,7168,256,256,8,ActivationType.Silu,torch.bfloat16,torch.bfloat16,torch.bfloat16,QuantType.No,1,1,128,0,281.686,moe_ck2stages_gemm2_256x128x64x64_1x4_TypeCast_v1_Nswizzle0_Quant0_MulRoutedWeight0_B16_B16_B16,0.0%,320.19,10110.31
stage1,256,1024,7168,512,256,8,ActivationType.Gelu,torch.bfloat16,torch.bfloat16,torch.bfloat16,QuantType.No,1,0,32,0,749.4898,moe_ck2stages_gemm1_256x32x64x128_1x4_TypeCast_v1_Nswizzle0_Quant0_MulRoutedWeight0_gelu_B16_B16_B16,0.0%,240.68,7560.48
stage1,256,1024,7168,512,256,8,ActivationType.Gelu,torch.bfloat16,torch.bfloat16,torch.bfloat16,QuantType.No,1,0,32,0,745.9407,moe_ck2stages_gemm1_256x32x64x64_1x4_TypeCast_v1_Nswizzle0_Quant0_MulRoutedWeight0_gelu_B16_B16_B16,0.0%,241.83,7596.45
stage2,256,1024,7168,512,256,8,ActivationType.Gelu,torch.bfloat16,torch.bfloat16,torch.bfloat16,QuantType.No,1,0,32,0,366.3334,moe_ck2stages_gemm2_256x32x128x128_1x4_TypeCast_v1_Nswizzle0_Quant0_MulRoutedWeight1_B16_B16_B16,3.3%,492.42,15468.16
stage2,256,1024,7168,512,256,8,ActivationType.Gelu,torch.bfloat16,torch.bfloat16,torch.bfloat16,QuantType.No,1,0,32,0,393.0747,moe_ck2stages_gemm2_256x32x64x64_1x4_TypeCast_v1_Nswizzle0_Quant0_MulRoutedWeight1_B16_B16_B16,3.3%,458.92,14415.85
stage1,256,1024,7168,512,256,8,ActivationType.Gelu,torch.bfloat16,torch.bfloat16,torch.bfloat16,QuantType.No,1,0,64,0,653.567,moe_ck2stages_gemm1_256x64x64x128_1x4_TypeCast_v1_Nswizzle0_Quant0_MulRoutedWeight0_gelu_B16_B16_B16,0.0%,276.01,8670.12
stage1,256,1024,7168,512,256,8,ActivationType.Gelu,torch.bfloat16,torch.bfloat16,torch.bfloat16,QuantType.No,1,0,64,0,653.6796,moe_ck2stages_gemm1_256x64x64x64_1x4_TypeCast_v1_Nswizzle0_Quant0_MulRoutedWeight0_gelu_B16_B16_B16,0.0%,275.96,8668.63
stage2,256,1024,7168,512,256,8,ActivationType.Gelu,torch.bfloat16,torch.bfloat16,torch.bfloat16,QuantType.No,1,0,64,0,362.9288,moe_ck2stages_gemm2_256x64x128x128_1x4_TypeCast_v1_Nswizzle0_Quant0_MulRoutedWeight1_B16_B16_B16,3.3%,497.04,15613.27
stage2,256,1024,7168,512,256,8,ActivationType.Gelu,torch.bfloat16,torch.bfloat16,torch.bfloat16,QuantType.No,1,0,64,0,365.2067,moe_ck2stages_gemm2_256x64x64x64_1x4_TypeCast_v1_Nswizzle0_Quant0_MulRoutedWeight1_B16_B16_B16,3.3%,493.94,15515.88
stage2,256,1024,7168,512,256,8,ActivationType.Gelu,torch.bfloat16,torch.bfloat16,torch.bfloat16,QuantType.No,1,0,64,0,371.0797,moe_ck2stages_gemm2_256x64x128x64_1x4_TypeCast_v1_Nswizzle0_Quant0_MulRoutedWeight1_B16_B16_B16,3.3%,486.12,15270.32
stage1,256,1024,7168,512,256,8,ActivationType.Gelu,torch.bfloat16,torch.bfloat16,torch.bfloat16,QuantType.No,1,0,128,0,672.3951,moe_ck2stages_gemm1_256x128x64x64_1x4_TypeCast_v1_Nswizzle0_Quant0_MulRoutedWeight0_gelu_B16_B16_B16,0.0%,268.28,8427.34
stage1,256,1024,7168,512,256,8,ActivationType.Gelu,torch.bfloat16,torch.bfloat16,torch.bfloat16,QuantType.No,1,0,128,0,668.2915,moe_ck2stages_gemm1_256x128x128x64_1x4_TypeCast_v3_Nswizzle0_Quant0_MulRoutedWeight0_gelu_B16_B16_B16,0.0%,269.93,8479.09
stage2,256,1024,7168,512,256,8,ActivationType.Gelu,torch.bfloat16,torch.bfloat16,torch.bfloat16,QuantType.No,1,0,128,0,401.7272,moe_ck2stages_gemm2_256x128x128x64_1x4_TypeCast_v1_Nswizzle0_Quant0_MulRoutedWeight1_B16_B16_B16,3.3%,449.03,14105.35
stage2,256,1024,7168,512,256,8,ActivationType.Gelu,torch.bfloat16,torch.bfloat16,torch.bfloat16,QuantType.No,1,0,128,0,405.3195,moe_ck2stages_gemm2_256x128x128x64_1x4_TypeCast_v3_Nswizzle0_Quant0_MulRoutedWeight1_B16_B16_B16,3.3%,445.05,13980.34
stage2,256,1024,7168,512,256,8,ActivationType.Gelu,torch.bfloat16,torch.bfloat16,torch.bfloat16,QuantType.No,1,0,128,0,403.9196,moe_ck2stages_gemm2_256x128x64x64_1x4_TypeCast_v3_Nswizzle0_Quant0_MulRoutedWeight1_B16_B16_B16,3.3%,446.6,14028.79
stage2,256,1024,7168,512,256,8,ActivationType.Gelu,torch.bfloat16,torch.bfloat16,torch.bfloat16,QuantType.No,1,0,128,0,444.597,moe_ck2stages_gemm2_256x128x64x64_1x4_TypeCast_v1_Nswizzle0_Quant0_MulRoutedWeight1_B16_B16_B16,3.3%,405.74,12745.26
stage1,256,1024,7168,512,256,8,ActivationType.Gelu,torch.bfloat16,torch.bfloat16,torch.bfloat16,QuantType.No,1,1,32,0,759.7094,moe_ck2stages_gemm1_256x32x64x128_1x4_TypeCast_v1_Nswizzle0_Quant0_MulRoutedWeight1_gelu_B16_B16_B16,0.0%,237.44,7458.78
stage1,256,1024,7168,512,256,8,ActivationType.Gelu,torch.bfloat16,torch.bfloat16,torch.bfloat16,QuantType.No,1,1,32,0,755.6585,moe_ck2stages_gemm1_256x32x64x64_1x4_TypeCast_v1_Nswizzle0_Quant0_MulRoutedWeight1_gelu_B16_B16_B16,0.0%,238.72,7498.76
stage2,256,1024,7168,512,256,8,ActivationType.Gelu,torch.bfloat16,torch.bfloat16,torch.bfloat16,QuantType.No,1,1,32,0,370.1781,moe_ck2stages_gemm2_256x32x128x128_1x4_TypeCast_v1_Nswizzle0_Quant0_MulRoutedWeight0_B16_B16_B16,0.0%,487.3,15307.51
stage2,256,1024,7168,512,256,8,ActivationType.Gelu,torch.bfloat16,torch.bfloat16,torch.bfloat16,QuantType.No,1,1,32,0,394.0804,moe_ck2stages_gemm2_256x32x64x64_1x4_TypeCast_v1_Nswizzle0_Quant0_MulRoutedWeight0_B16_B16_B16,0.0%,457.75,14379.06
stage1,256,1024,7168,512,256,8,ActivationType.Gelu,torch.bfloat16,torch.bfloat16,torch.bfloat16,QuantType.No,1,1,64,0,666.9375,moe_ck2stages_gemm1_256x64x64x128_1x4_TypeCast_v1_Nswizzle0_Quant0_MulRoutedWeight1_gelu_B16_B16_B16,0.0%,270.47,8496.31
stage1,256,1024,7168,512,256,8,ActivationType.Gelu,torch.bfloat16,torch.bfloat16,torch.bfloat16,QuantType.No,1,1,64,0,665.5606,moe_ck2stages_gemm1_256x64x64x64_1x4_TypeCast_v1_Nswizzle0_Quant0_MulRoutedWeight1_gelu_B16_B16_B16,0.0%,271.03,8513.88
stage2,256,1024,7168,512,256,8,ActivationType.Gelu,torch.bfloat16,torch.bfloat16,torch.bfloat16,QuantType.No,1,1,64,0,361.7548,moe_ck2stages_gemm2_256x64x128x128_1x4_TypeCast_v1_Nswizzle0_Quant0_MulRoutedWeight0_B16_B16_B16,0.0%,498.65,15663.94
stage2,256,1024,7168,512,256,8,ActivationType.Gelu,torch.bfloat16,torch.bfloat16,torch.bfloat16,QuantType.No,1,1,64,0,370.0794,moe_ck2stages_gemm2_256x64x64x64_1x4_TypeCast_v1_Nswizzle0_Quant0_MulRoutedWeight0_B16_B16_B16,0.0%,487.43,15311.59
stage2,256,1024,7168,512,256,8,ActivationType.Gelu,torch.bfloat16,torch.bfloat16,torch.bfloat16,QuantType.No,1,1,64,0,371.669,moe_ck2stages_gemm2_256x64x128x64_1x4_TypeCast_v1_Nswizzle0_Quant0_MulRoutedWeight0_B16_B16_B16,0.0%,485.35,15246.11
stage1,256,1024,7168,512,256,8,ActivationType.Gelu,torch.bfloat16,torch.bfloat16,torch.bfloat16,QuantType.No,1,1,128,0,672.3505,moe_ck2stages_gemm1_256x128x64x64_1x4_TypeCast_v1_Nswizzle0_Quant0_MulRoutedWeight1_gelu_B16_B16_B16,0.0%,268.3,8427.9
stage1,256,1024,7168,512,256,8,ActivationType.Gelu,torch.bfloat16,torch.bfloat16,torch.bfloat16,QuantType.No,1,1,128,0,669.2437,moe_ck2stages_gemm1_256x128x128x64_1x4_TypeCast_v3_Nswizzle0_Quant0_MulRoutedWeight1_gelu_B16_B16_B16,0.0%,269.54,8467.03
stage2,256,1024,7168,512,256,8,ActivationType.Gelu,torch.bfloat16,torch.bfloat16,torch.bfloat16,QuantType.No,1,1,128,0,389.5212,moe_ck2stages_gemm2_256x128x128x64_1x4_TypeCast_v1_Nswizzle0_Quant0_MulRoutedWeight0_B16_B16_B16,0.0%,463.1,14547.36
stage2,256,1024,7168,512,256,8,ActivationType.Gelu,torch.bfloat16,torch.bfloat16,torch.bfloat16,QuantType.No,1,1,128,0,391.0934,moe_ck2stages_gemm2_256x128x128x64_1x4_TypeCast_v3_Nswizzle0_Quant0_MulRoutedWeight0_B16_B16_B16,0.0%,461.24,14488.88
stage2,256,1024,7168,512,256,8,ActivationType.Gelu,torch.bfloat16,torch.bfloat16,torch.bfloat16,QuantType.No,1,1,128,0,390.2369,moe_ck2stages_gemm2_256x128x64x64_1x4_TypeCast_v3_Nswizzle0_Quant0_MulRoutedWeight0_B16_B16_B16,0.0%,462.25,14520.68
stage2,256,1024,7168,512,256,8,ActivationType.Gelu,torch.bfloat16,torch.bfloat16,torch.bfloat16,QuantType.No,1,1,128,0,418.8489,moe_ck2stages_gemm2_256x128x64x64_1x4_TypeCast_v1_Nswizzle0_Quant0_MulRoutedWeight0_B16_B16_B16,0.0%,430.68,13528.76
stage1,256,1024,7168,512,256,8,ActivationType.Silu,torch.bfloat16,torch.bfloat16,torch.bfloat16,QuantType.No,1,0,32,0,747.8532,moe_ck2stages_gemm1_256x32x64x128_1x4_TypeCast_v1_Nswizzle0_Quant0_MulRoutedWeight0_silu_B16_B16_B16,0.0%,241.21,7577.03
stage1,256,1024,7168,512,256,8,ActivationType.Silu,torch.bfloat16,torch.bfloat16,torch.bfloat16,QuantType.No,1,0,32,0,749.9292,moe_ck2stages_gemm1_256x32x64x64_1x4_TypeCast_v1_Nswizzle0_Quant0_MulRoutedWeight0_silu_B16_B16_B16,0.0%,240.54,7556.05
stage2,256,1024,7168,512,256,8,ActivationType.Silu,torch.bfloat16,torch.bfloat16,torch.bfloat16,QuantType.No,1,0,32,0,352.4249,moe_ck2stages_gemm2_256x32x128x128_1x4_TypeCast_v1_Nswizzle0_Quant0_MulRoutedWeight1_B16_B16_B16,2.8%,511.85,16078.62
stage2,256,1024,7168,512,256,8,ActivationType.Silu,torch.bfloat16,torch.bfloat16,torch.bfloat16,QuantType.No,1,0,32,0,394.8185,moe_ck2stages_gemm2_256x32x64x64_1x4_TypeCast_v1_Nswizzle0_Quant0_MulRoutedWeight1_B16_B16_B16,2.8%,456.89,14352.18
stage1,256,1024,7168,512,256,8,ActivationType.Silu,torch.bfloat16,torch.bfloat16,torch.bfloat16,QuantType.No,1,0,64,0,652.2353,moe_ck2stages_gemm1_256x64x64x128_1x4_TypeCast_v1_Nswizzle0_Quant0_MulRoutedWeight0_silu_B16_B16_B16,0.0%,276.57,8687.82
stage1,256,1024,7168,512,256,8,ActivationType.Silu,torch.bfloat16,torch.bfloat16,torch.bfloat16,QuantType.No,1,0,64,0,656.3611,moe_ck2stages_gemm1_256x64x64x64_1x4_TypeCast_v1_Nswizzle0_Quant0_MulRoutedWeight0_silu_B16_B16_B16,0.0%,274.83,8633.21
stage2,256,1024,7168,512,256,8,ActivationType.Silu,torch.bfloat16,torch.bfloat16,torch.bfloat16,QuantType.No,1,0,64,0,366.3445,moe_ck2stages_gemm2_256x64x128x128_1x4_TypeCast_v1_Nswizzle0_Quant0_MulRoutedWeight1_B16_B16_B16,2.8%,492.4,15467.69
stage2,256,1024,7168,512,256,8,ActivationType.Silu,torch.bfloat16,torch.bfloat16,torch.bfloat16,QuantType.No,1,0,64,0,369.4626,moe_ck2stages_gemm2_256x64x64x64_1x4_TypeCast_v1_Nswizzle0_Quant0_MulRoutedWeight1_B16_B16_B16,2.8%,488.25,15337.15
stage2,256,1024,7168,512,256,8,ActivationType.Silu,torch.bfloat16,torch.bfloat16,torch.bfloat16,QuantType.No,1,0,64,0,367.4693,moe_ck2stages_gemm2_256x64x128x64_1x4_TypeCast_v1_Nswizzle0_Quant0_MulRoutedWeight1_B16_B16_B16,2.8%,490.89,15420.35
stage1,256,1024,7168,512,256,8,ActivationType.Silu,torch.bfloat16,torch.bfloat16,torch.bfloat16,QuantType.No,1,0,128,0,651.4931,moe_ck2stages_gemm1_256x128x64x64_1x4_TypeCast_v1_Nswizzle0_Quant0_MulRoutedWeight0_silu_B16_B16_B16,0.0%,276.88,8697.72
stage1,256,1024,7168,512,256,8,ActivationType.Silu,torch.bfloat16,torch.bfloat16,torch.bfloat16,QuantType.No,1,0,128,0,637.509,moe_ck2stages_gemm1_256x128x128x64_1x4_TypeCast_v3_Nswizzle0_Quant0_MulRoutedWeight0_silu_B16_B16_B16,0.0%,282.96,8888.51
stage2,256,1024,7168,512,256,8,ActivationType.Silu,torch.bfloat16,torch.bfloat16,torch.bfloat16,QuantType.No,1,0,128,0,403.7359,moe_ck2stages_gemm2_256x128x128x64_1x4_TypeCast_v1_Nswizzle0_Quant0_MulRoutedWeight1_B16_B16_B16,2.8%,446.8,14035.18
stage2,256,1024,7168,512,256,8,ActivationType.Silu,torch.bfloat16,torch.bfloat16,torch.bfloat16,QuantType.No,1,0,128,0,403.954,moe_ck2stages_gemm2_256x128x128x64_1x4_TypeCast_v3_Nswizzle0_Quant0_MulRoutedWeight1_B16_B16_B16,2.8%,446.56,14027.6
stage2,256,1024,7168,512,256,8,ActivationType.Silu,torch.bfloat16,torch.bfloat16,torch.bfloat16,QuantType.No,1,0,128,0,406.7608,moe_ck2stages_gemm2_256x128x64x64_1x4_TypeCast_v3_Nswizzle0_Quant0_MulRoutedWeight1_B16_B16_B16,2.8%,443.48,13930.8
stage2,256,1024,7168,512,256,8,ActivationType.Silu,torch.bfloat16,torch.bfloat16,torch.bfloat16,QuantType.No,1,0,128,0,434.5005,moe_ck2stages_gemm2_256x128x64x64_1x4_TypeCast_v1_Nswizzle0_Quant0_MulRoutedWeight1_B16_B16_B16,2.8%,415.16,13041.42
stage1,256,1024,7168,512,256,8,ActivationType.Silu,torch.bfloat16,torch.bfloat16,torch.bfloat16,QuantType.No,1,1,32,0,748.5247,moe_ck2stages_gemm1_256x32x64x128_1x4_TypeCast_v1_Nswizzle0_Quant0_MulRoutedWeight1_silu_B16_B16_B16,0.0%,240.99,7570.23
stage1,256,1024,7168,512,256,8,ActivationType.Silu,torch.bfloat16,torch.bfloat16,torch.bfloat16,QuantType.No,1,1,32,0,752.2643,moe_ck2stages_gemm1_256x32x64x64_1x4_TypeCast_v1_Nswizzle0_Quant0_MulRoutedWeight1_silu_B16_B16_B16,0.0%,239.79,7532.6
stage2,256,1024,7168,512,256,8,ActivationType.Silu,torch.bfloat16,torch.bfloat16,torch.bfloat16,QuantType.No,1,1,32,0,363.0261,moe_ck2stages_gemm2_256x32x128x128_1x4_TypeCast_v1_Nswizzle0_Quant0_MulRoutedWeight0_B16_B16_B16,0.0%,496.9,15609.08
stage2,256,1024,7168,512,256,8,ActivationType.Silu,torch.bfloat16,torch.bfloat16,torch.bfloat16,QuantType.No,1,1,32,0,391.7378,moe_ck2stages_gemm2_256x32x64x64_1x4_TypeCast_v1_Nswizzle0_Quant0_MulRoutedWeight0_B16_B16_B16,0.0%,460.48,14465.04
stage1,256,1024,7168,512,256,8,ActivationType.Silu,torch.bfloat16,torch.bfloat16,torch.bfloat16,QuantType.No,1,1,64,0,652.5404,moe_ck2stages_gemm1_256x64x64x128_1x4_TypeCast_v1_Nswizzle0_Quant0_MulRoutedWeight1_silu_B16_B16_B16,0.0%,276.44,8683.76
stage1,256,1024,7168,512,256,8,ActivationType.Silu,torch.bfloat16,torch.bfloat16,torch.bfloat16,QuantType.No,1,1,64,0,656.7406,moe_ck2stages_gemm1_256x64x64x64_1x4_TypeCast_v1_Nswizzle0_Quant0_MulRoutedWeight1_silu_B16_B16_B16,0.0%,274.67,8628.22
stage2,256,1024,7168,512,256,8,ActivationType.Silu,torch.bfloat16,torch.bfloat16,torch.bfloat16,QuantType.No,1,1,64,0,350.7688,moe_ck2stages_gemm2_256x64x128x128_1x4_TypeCast_v1_Nswizzle0_Quant0_MulRoutedWeight0_B16_B16_B16,0.0%,514.27,16154.53
stage2,256,1024,7168,512,256,8,ActivationType.Silu,torch.bfloat16,torch.bfloat16,torch.bfloat16,QuantType.No,1,1,64,0,367.5633,moe_ck2stages_gemm2_256x64x64x64_1x4_TypeCast_v1_Nswizzle0_Quant0_MulRoutedWeight0_B16_B16_B16,0.0%,490.77,15416.41
stage2,256,1024,7168,512,256,8,ActivationType.Silu,torch.bfloat16,torch.bfloat16,torch.bfloat16,QuantType.No,1,1,64,0,368.3365,moe_ck2stages_gemm2_256x64x128x64_1x4_TypeCast_v1_Nswizzle0_Quant0_MulRoutedWeight0_B16_B16_B16,0.0%,489.74,15384.04
stage1,256,1024,7168,512,256,8,ActivationType.Silu,torch.bfloat16,torch.bfloat16,torch.bfloat16,QuantType.No,1,1,128,0,652.8424,moe_ck2stages_gemm1_256x128x64x64_1x4_TypeCast_v1_Nswizzle0_Quant0_MulRoutedWeight1_silu_B16_B16_B16,0.0%,276.31,8679.74
stage1,256,1024,7168,512,256,8,ActivationType.Silu,torch.bfloat16,torch.bfloat16,torch.bfloat16,QuantType.No,1,1,128,0,639.4139,moe_ck2stages_gemm1_256x128x128x64_1x4_TypeCast_v3_Nswizzle0_Quant0_MulRoutedWeight1_silu_B16_B16_B16,0.0%,282.12,8862.03
stage2,256,1024,7168,512,256,8,ActivationType.Silu,torch.bfloat16,torch.bfloat16,torch.bfloat16,QuantType.No,1,1,128,0,390.6446,moe_ck2stages_gemm2_256x128x128x64_1x4_TypeCast_v1_Nswizzle0_Quant0_MulRoutedWeight0_B16_B16_B16,0.0%,461.77,14505.52
stage2,256,1024,7168,512,256,8,ActivationType.Silu,torch.bfloat16,torch.bfloat16,torch.bfloat16,QuantType.No,1,1,128,0,391.3915,moe_ck2stages_gemm2_256x128x128x64_1x4_TypeCast_v3_Nswizzle0_Quant0_MulRoutedWeight0_B16_B16_B16,0.0%,460.89,14477.84
stage2,256,1024,7168,512,256,8,ActivationType.Silu,torch.bfloat16,torch.bfloat16,torch.bfloat16,QuantType.No,1,1,128,0,388.8106,moe_ck2stages_gemm2_256x128x64x64_1x4_TypeCast_v3_Nswizzle0_Quant0_MulRoutedWeight0_B16_B16_B16,0.0%,463.95,14573.95
stage2,256,1024,7168,512,256,8,ActivationType.Silu,torch.bfloat16,torch.bfloat16,torch.bfloat16,QuantType.No,1,1,128,0,415.3841,moe_ck2stages_gemm2_256x128x64x64_1x4_TypeCast_v1_Nswizzle0_Quant0_MulRoutedWeight0_B16_B16_B16,0.0%,434.27,13641.6
stage1,256,128,2048,192,128,8,ActivationType.Gelu,torch.bfloat16,torch.bfloat16,torch.bfloat16,QuantType.No,1,0,32,0,41.8308,moe_ck2stages_gemm1_256x32x64x128_1x4_TypeCast_v1_Nswizzle0_Quant0_MulRoutedWeight0_gelu_B16_B16_B16,0.0%,57.75,7244.39
stage1,256,128,2048,192,128,8,ActivationType.Gelu,torch.bfloat16,torch.bfloat16,torch.bfloat16,QuantType.No,1,0,32,0,38.9531,moe_ck2stages_gemm1_256x32x64x64_1x4_TypeCast_v1_Nswizzle0_Quant0_MulRoutedWeight0_gelu_B16_B16_B16,0.0%,62.02,7779.57
stage2,256,128,2048,192,128,8,ActivationType.Gelu,torch.bfloat16,torch.bfloat16,torch.bfloat16,QuantType.No,1,0,32,0,inf,moe_ck2stages_gemm2_256x32x128x128_1x4_TypeCast_v1_Nswizzle0_Quant0_MulRoutedWeight1_B16_B16_B16,100.0%,0.0,0.0
stage2,256,128,2048,192,128,8,ActivationType.Gelu,torch.bfloat16,torch.bfloat16,torch.bfloat16,QuantType.No,1,0,32,0,26.1058,moe_ck2stages_gemm2_256x32x64x64_1x4_TypeCast_v1_Nswizzle0_Quant0_MulRoutedWeight1_B16_B16_B16,0.0%,92.54,11608.09
stage1,256,128,2048,192,128,8,ActivationType.Gelu,torch.bfloat16,torch.bfloat16,torch.bfloat16,QuantType.No,1,0,64,0,42.9314,moe_ck2stages_gemm1_256x64x64x128_1x4_TypeCast_v1_Nswizzle0_Quant0_MulRoutedWeight0_gelu_B16_B16_B16,0.0%,56.27,7058.67
stage1,256,128,2048,192,128,8,ActivationType.Gelu,torch.bfloat16,torch.bfloat16,torch.bfloat16,QuantType.No,1,0,64,0,40.1783,moe_ck2stages_gemm1_256x64x64x64_1x4_TypeCast_v1_Nswizzle0_Quant0_MulRoutedWeight0_gelu_B16_B16_B16,0.0%,60.13,7542.34
stage2,256,128,2048,192,128,8,ActivationType.Gelu,torch.bfloat16,torch.bfloat16,torch.bfloat16,QuantType.No,1,0,64,0,inf,moe_ck2stages_gemm2_256x64x128x128_1x4_TypeCast_v1_Nswizzle0_Quant0_MulRoutedWeight1_B16_B16_B16,100.0%,0.0,0.0
stage2,256,128,2048,192,128,8,ActivationType.Gelu,torch.bfloat16,torch.bfloat16,torch.bfloat16,QuantType.No,1,0,64,0,32.1259,moe_ck2stages_gemm2_256x64x64x64_1x4_TypeCast_v1_Nswizzle0_Quant0_MulRoutedWeight1_B16_B16_B16,0.0%,75.2,9432.84
stage2,256,128,2048,192,128,8,ActivationType.Gelu,torch.bfloat16,torch.bfloat16,torch.bfloat16,QuantType.No,1,0,64,0,29.0227,moe_ck2stages_gemm2_256x64x128x64_1x4_TypeCast_v1_Nswizzle0_Quant0_MulRoutedWeight1_B16_B16_B16,0.0%,83.24,10441.43
stage1,256,128,2048,192,128,8,ActivationType.Gelu,torch.bfloat16,torch.bfloat16,torch.bfloat16,QuantType.No,1,0,128,0,43.4769,moe_ck2stages_gemm1_256x128x64x64_1x4_TypeCast_v1_Nswizzle0_Quant0_MulRoutedWeight0_gelu_B16_B16_B16,0.0%,55.57,6970.1
stage1,256,128,2048,192,128,8,ActivationType.Gelu,torch.bfloat16,torch.bfloat16,torch.bfloat16,QuantType.No,1,0,128,0,inf,moe_ck2stages_gemm1_256x128x128x64_1x4_TypeCast_v3_Nswizzle0_Quant0_MulRoutedWeight0_gelu_B16_B16_B16,100.0%,0.0,0.0
stage2,256,128,2048,192,128,8,ActivationType.Gelu,torch.bfloat16,torch.bfloat16,torch.bfloat16,QuantType.No,1,0,128,0,40.9281,moe_ck2stages_gemm2_256x128x128x64_1x4_TypeCast_v1_Nswizzle0_Quant0_MulRoutedWeight1_B16_B16_B16,0.0%,59.03,7404.17
stage2,256,128,2048,192,128,8,ActivationType.Gelu,torch.bfloat16,torch.bfloat16,torch.bfloat16,QuantType.No,1,0,128,0,41.2493,moe_ck2stages_gemm2_256x128x128x64_1x4_TypeCast_v3_Nswizzle0_Quant0_MulRoutedWeight1_B16_B16_B16,0.0%,58.57,7346.51
stage2,256,128,2048,192,128,8,ActivationType.Gelu,torch.bfloat16,torch.bfloat16,torch.bfloat16,QuantType.No,1,0,128,0,41.1362,moe_ck2stages_gemm2_256x128x64x64_1x4_TypeCast_v3_Nswizzle0_Quant0_MulRoutedWeight1_B16_B16_B16,0.0%,58.73,7366.71
stage2,256,128,2048,192,128,8,ActivationType.Gelu,torch.bfloat16,torch.bfloat16,torch.bfloat16,QuantType.No,1,0,128,0,45.9997,moe_ck2stages_gemm2_256x128x64x64_1x4_TypeCast_v1_Nswizzle0_Quant0_MulRoutedWeight1_B16_B16_B16,0.0%,52.52,6587.84
stage1,256,128,2048,192,128,8,ActivationType.Gelu,torch.bfloat16,torch.bfloat16,torch.bfloat16,QuantType.No,1,1,32,0,43.4054,moe_ck2stages_gemm1_256x32x64x128_1x4_TypeCast_v1_Nswizzle0_Quant0_MulRoutedWeight1_gelu_B16_B16_B16,0.0%,55.66,6981.58
stage1,256,128,2048,192,128,8,ActivationType.Gelu,torch.bfloat16,torch.bfloat16,torch.bfloat16,QuantType.No,1,1,32,0,40.5853,moe_ck2stages_gemm1_256x32x64x64_1x4_TypeCast_v1_Nswizzle0_Quant0_MulRoutedWeight1_gelu_B16_B16_B16,0.0%,59.53,7466.71
stage2,256,128,2048,192,128,8,ActivationType.Gelu,torch.bfloat16,torch.bfloat16,torch.bfloat16,QuantType.No,1,1,32,0,inf,moe_ck2stages_gemm2_256x32x128x128_1x4_TypeCast_v1_Nswizzle0_Quant0_MulRoutedWeight0_B16_B16_B16,100.0%,0.0,0.0
stage2,256,128,2048,192,128,8,ActivationType.Gelu,torch.bfloat16,torch.bfloat16,torch.bfloat16,QuantType.No,1,1,32,0,25.3228,moe_ck2stages_gemm2_256x32x64x64_1x4_TypeCast_v1_Nswizzle0_Quant0_MulRoutedWeight0_B16_B16_B16,0.0%,95.4,11967.02
stage1,256,128,2048,192,128,8,ActivationType.Gelu,torch.bfloat16,torch.bfloat16,torch.bfloat16,QuantType.No,1,1,64,0,44.4425,moe_ck2stages_gemm1_256x64x64x128_1x4_TypeCast_v1_Nswizzle0_Quant0_MulRoutedWeight1_gelu_B16_B16_B16,0.0%,54.36,6818.66
stage1,256,128,2048,192,128,8,ActivationType.Gelu,torch.bfloat16,torch.bfloat16,torch.bfloat16,QuantType.No,1,1,64,0,42.1276,moe_ck2stages_gemm1_256x64x64x64_1x4_TypeCast_v1_Nswizzle0_Quant0_MulRoutedWeight1_gelu_B16_B16_B16,0.0%,57.35,7193.35
stage2,256,128,2048,192,128,8,ActivationType.Gelu,torch.bfloat16,torch.bfloat16,torch.bfloat16,QuantType.No,1,1,64,0,inf,moe_ck2stages_gemm2_256x64x128x128_1x4_TypeCast_v1_Nswizzle0_Quant0_MulRoutedWeight0_B16_B16_B16,100.0%,0.0,0.0
stage2,256,128,2048,192,128,8,ActivationType.Gelu,torch.bfloat16,torch.bfloat16,torch.bfloat16,QuantType.No,1,1,64,0,29.5232,moe_ck2stages_gemm2_256x64x64x64_1x4_TypeCast_v1_Nswizzle0_Quant0_MulRoutedWeight0_B16_B16_B16,0.0%,81.83,10264.42
stage2,256,128,2048,192,128,8,ActivationType.Gelu,torch.bfloat16,torch.bfloat16,torch.bfloat16,QuantType.No,1,1,64,0,27.8378,moe_ck2stages_gemm2_256x64x128x64_1x4_TypeCast_v1_Nswizzle0_Quant0_MulRoutedWeight0_B16_B16_B16,0.0%,86.79,10885.86
stage1,256,128,2048,192,128,8,ActivationType.Gelu,torch.bfloat16,torch.bfloat16,torch.bfloat16,QuantType.No,1,1,128,0,45.6592,moe_ck2stages_gemm1_256x128x64x64_1x4_TypeCast_v1_Nswizzle0_Quant0_MulRoutedWeight1_gelu_B16_B16_B16,0.0%,52.91,6636.96
stage1,256,128,2048,192,128,8,ActivationType.Gelu,torch.bfloat16,torch.bfloat16,torch.bfloat16,QuantType.No,1,1,128,0,inf,moe_ck2stages_gemm1_256x128x128x64_1x4_TypeCast_v3_Nswizzle0_Quant0_MulRoutedWeight1_gelu_B16_B16_B16,100.0%,0.0,0.0
stage2,256,128,2048,192,128,8,ActivationType.Gelu,torch.bfloat16,torch.bfloat16,torch.bfloat16,QuantType.No,1,1,128,0,38.5145,moe_ck2stages_gemm2_256x128x128x64_1x4_TypeCast_v1_Nswizzle0_Quant0_MulRoutedWeight0_B16_B16_B16,0.0%,62.73,7868.17
stage2,256,128,2048,192,128,8,ActivationType.Gelu,torch.bfloat16,torch.bfloat16,torch.bfloat16,QuantType.No,1,1,128,0,38.7883,moe_ck2stages_gemm2_256x128x128x64_1x4_TypeCast_v3_Nswizzle0_Quant0_MulRoutedWeight0_B16_B16_B16,0.0%,62.28,7812.63
stage2,256,128,2048,192,128,8,ActivationType.Gelu,torch.bfloat16,torch.bfloat16,torch.bfloat16,QuantType.No,1,1,128,0,38.2079,moe_ck2stages_gemm2_256x128x64x64_1x4_TypeCast_v3_Nswizzle0_Quant0_MulRoutedWeight0_B16_B16_B16,0.0%,63.23,7931.3
stage2,256,128,2048,192,128,8,ActivationType.Gelu,torch.bfloat16,torch.bfloat16,torch.bfloat16,QuantType.No,1,1,128,0,42.4522,moe_ck2stages_gemm2_256x128x64x64_1x4_TypeCast_v1_Nswizzle0_Quant0_MulRoutedWeight0_B16_B16_B16,0.0%,56.91,7138.35
stage1,256,128,2048,192,128,8,ActivationType.Silu,torch.bfloat16,torch.bfloat16,torch.bfloat16,QuantType.No,1,0,32,0,43.4626,moe_ck2stages_gemm1_256x32x64x128_1x4_TypeCast_v1_Nswizzle0_Quant0_MulRoutedWeight0_silu_B16_B16_B16,0.0%,55.59,6972.4
stage1,256,128,2048,192,128,8,ActivationType.Silu,torch.bfloat16,torch.bfloat16,torch.bfloat16,QuantType.No,1,0,32,0,40.6035,moe_ck2stages_gemm1_256x32x64x64_1x4_TypeCast_v1_Nswizzle0_Quant0_MulRoutedWeight0_silu_B16_B16_B16,0.0%,59.5,7463.36
stage2,256,128,2048,192,128,8,ActivationType.Silu,torch.bfloat16,torch.bfloat16,torch.bfloat16,QuantType.No,1,0,32,0,inf,moe_ck2stages_gemm2_256x32x128x128_1x4_TypeCast_v1_Nswizzle0_Quant0_MulRoutedWeight1_B16_B16_B16,100.0%,0.0,0.0
stage2,256,128,2048,192,128,8,ActivationType.Silu,torch.bfloat16,torch.bfloat16,torch.bfloat16,QuantType.No,1,0,32,0,25.2983,moe_ck2stages_gemm2_256x32x64x64_1x4_TypeCast_v1_Nswizzle0_Quant0_MulRoutedWeight1_B16_B16_B16,0.0%,95.5,11978.61
stage1,256,128,2048,192,128,8,ActivationType.Silu,torch.bfloat16,torch.bfloat16,torch.bfloat16,QuantType.No,1,0,64,0,42.9446,moe_ck2stages_gemm1_256x64x64x128_1x4_TypeCast_v1_Nswizzle0_Quant0_MulRoutedWeight0_silu_B16_B16_B16,0.0%,56.26,7056.5
stage1,256,128,2048,192,128,8,ActivationType.Silu,torch.bfloat16,torch.bfloat16,torch.bfloat16,QuantType.No,1,0,64,0,41.1142,moe_ck2stages_gemm1_256x64x64x64_1x4_TypeCast_v1_Nswizzle0_Quant0_MulRoutedWeight0_silu_B16_B16_B16,0.0%,58.76,7370.65
stage2,256,128,2048,192,128,8,ActivationType.Silu,torch.bfloat16,torch.bfloat16,torch.bfloat16,QuantType.No,1,0,64,0,inf,moe_ck2stages_gemm2_256x64x128x128_1x4_TypeCast_v1_Nswizzle0_Quant0_MulRoutedWeight1_B16_B16_B16,100.0%,0.0,0.0
stage2,256,128,2048,192,128,8,ActivationType.Silu,torch.bfloat16,torch.bfloat16,torch.bfloat16,QuantType.No,1,0,64,0,31.8472,moe_ck2stages_gemm2_256x64x64x64_1x4_TypeCast_v1_Nswizzle0_Quant0_MulRoutedWeight1_B16_B16_B16,0.0%,75.86,9515.39
stage2,256,128,2048,192,128,8,ActivationType.Silu,torch.bfloat16,torch.bfloat16,torch.bfloat16,QuantType.No,1,0,64,0,28.3619,moe_ck2stages_gemm2_256x64x128x64_1x4_TypeCast_v1_Nswizzle0_Quant0_MulRoutedWeight1_B16_B16_B16,0.0%,85.18,10684.7
stage1,256,128,2048,192,128,8,ActivationType.Silu,torch.bfloat16,torch.bfloat16,torch.bfloat16,QuantType.No,1,0,128,0,44.2141,moe_ck2stages_gemm1_256x128x64x64_1x4_TypeCast_v1_Nswizzle0_Quant0_MulRoutedWeight0_silu_B16_B16_B16,0.0%,54.64,6853.89
stage1,256,128,2048,192,128,8,ActivationType.Silu,torch.bfloat16,torch.bfloat16,torch.bfloat16,QuantType.No,1,0,128,0,inf,moe_ck2stages_gemm1_256x128x128x64_1x4_TypeCast_v3_Nswizzle0_Quant0_MulRoutedWeight0_silu_B16_B16_B16,100.0%,0.0,0.0
stage2,256,128,2048,192,128,8,ActivationType.Silu,torch.bfloat16,torch.bfloat16,torch.bfloat16,QuantType.No,1,0,128,0,40.7099,moe_ck2stages_gemm2_256x128x128x64_1x4_TypeCast_v1_Nswizzle0_Quant0_MulRoutedWeight1_B16_B16_B16,0.0%,59.34,7443.85
stage2,256,128,2048,192,128,8,ActivationType.Silu,torch.bfloat16,torch.bfloat16,torch.bfloat16,QuantType.No,1,0,128,0,40.428,moe_ck2stages_gemm2_256x128x128x64_1x4_TypeCast_v3_Nswizzle0_Quant0_MulRoutedWeight1_B16_B16_B16,0.0%,59.76,7495.76
stage2,256,128,2048,192,128,8,ActivationType.Silu,torch.bfloat16,torch.bfloat16,torch.bfloat16,QuantType.No,1,0,128,0,40.1808,moe_ck2stages_gemm2_256x128x64x64_1x4_TypeCast_v3_Nswizzle0_Quant0_MulRoutedWeight1_B16_B16_B16,0.0%,60.13,7541.87
stage2,256,128,2048,192,128,8,ActivationType.Silu,torch.bfloat16,torch.bfloat16,torch.bfloat16,QuantType.No,1,0,128,0,45.8857,moe_ck2stages_gemm2_256x128x64x64_1x4_TypeCast_v1_Nswizzle0_Quant0_MulRoutedWeight1_B16_B16_B16,0.0%,52.65,6604.2
stage1,256,128,2048,192,128,8,ActivationType.Silu,torch.bfloat16,torch.bfloat16,torch.bfloat16,QuantType.No,1,1,32,0,41.6578,moe_ck2stages_gemm1_256x32x64x128_1x4_TypeCast_v1_Nswizzle0_Quant0_MulRoutedWeight1_silu_B16_B16_B16,0.0%,57.99,7274.47
stage1,256,128,2048,192,128,8,ActivationType.Silu,torch.bfloat16,torch.bfloat16,torch.bfloat16,QuantType.No,1,1,32,0,39.5956,moe_ck2stages_gemm1_256x32x64x64_1x4_TypeCast_v1_Nswizzle0_Quant0_MulRoutedWeight1_silu_B16_B16_B16,0.0%,61.01,7653.34
stage2,256,128,2048,192,128,8,ActivationType.Silu,torch.bfloat16,torch.bfloat16,torch.bfloat16,QuantType.No,1,1,32,0,inf,moe_ck2stages_gemm2_256x32x128x128_1x4_TypeCast_v1_Nswizzle0_Quant0_MulRoutedWeight0_B16_B16_B16,100.0%,0.0,0.0
stage2,256,128,2048,192,128,8,ActivationType.Silu,torch.bfloat16,torch.bfloat16,torch.bfloat16,QuantType.No,1,1,32,0,24.5469,moe_ck2stages_gemm2_256x32x64x64_1x4_TypeCast_v1_Nswizzle0_Quant0_MulRoutedWeight0_B16_B16_B16,0.0%,98.42,12345.28
stage1,256,128,2048,192,128,8,ActivationType.Silu,torch.bfloat16,torch.bfloat16,torch.bfloat16,QuantType.No,1,1,64,0,43.1763,moe_ck2stages_gemm1_256x64x64x128_1x4_TypeCast_v1_Nswizzle0_Quant0_MulRoutedWeight1_silu_B16_B16_B16,0.0%,55.95,7018.63
stage1,256,128,2048,192,128,8,ActivationType.Silu,torch.bfloat16,torch.bfloat16,torch.bfloat16,QuantType.No,1,1,64,0,41.1645,moe_ck2stages_gemm1_256x64x64x64_1x4_TypeCast_v1_Nswizzle0_Quant0_MulRoutedWeight1_silu_B16_B16_B16,0.0%,58.69,7361.65
stage2,256,128,2048,192,128,8,ActivationType.Silu,torch.bfloat16,torch.bfloat16,torch.bfloat16,QuantType.No,1,1,64,0,inf,moe_ck2stages_gemm2_256x64x128x128_1x4_TypeCast_v1_Nswizzle0_Quant0_MulRoutedWeight0_B16_B16_B16,100.0%,0.0,0.0
stage2,256,128,2048,192,128,8,ActivationType.Silu,torch.bfloat16,torch.bfloat16,torch.bfloat16,QuantType.No,1,1,64,0,29.5072,moe_ck2stages_gemm2_256x64x64x64_1x4_TypeCast_v1_Nswizzle0_Quant0_MulRoutedWeight0_B16_B16_B16,0.0%,81.88,10269.98
stage2,256,128,2048,192,128,8,ActivationType.Silu,torch.bfloat16,torch.bfloat16,torch.bfloat16,QuantType.No,1,1,64,0,27.1796,moe_ck2stages_gemm2_256x64x128x64_1x4_TypeCast_v1_Nswizzle0_Quant0_MulRoutedWeight0_B16_B16_B16,0.0%,88.89,11149.48
stage1,256,128,2048,192,128,8,ActivationType.Silu,torch.bfloat16,torch.bfloat16,torch.bfloat16,QuantType.No,1,1,128,0,44.5331,moe_ck2stages_gemm1_256x128x64x64_1x4_TypeCast_v1_Nswizzle0_Quant0_MulRoutedWeight1_silu_B16_B16_B16,0.0%,54.25,6804.79
stage1,256,128,2048,192,128,8,ActivationType.Silu,torch.bfloat16,torch.bfloat16,torch.bfloat16,QuantType.No,1,1,128,0,inf,moe_ck2stages_gemm1_256x128x128x64_1x4_TypeCast_v3_Nswizzle0_Quant0_MulRoutedWeight1_silu_B16_B16_B16,100.0%,0.0,0.0
stage2,256,128,2048,192,128,8,ActivationType.Silu,torch.bfloat16,torch.bfloat16,torch.bfloat16,QuantType.No,1,1,128,0,38.2039,moe_ck2stages_gemm2_256x128x128x64_1x4_TypeCast_v1_Nswizzle0_Quant0_MulRoutedWeight0_B16_B16_B16,0.0%,63.24,7932.13
stage2,256,128,2048,192,128,8,ActivationType.Silu,torch.bfloat16,torch.bfloat16,torch.bfloat16,QuantType.No,1,1,128,0,38.6166,moe_ck2stages_gemm2_256x128x128x64_1x4_TypeCast_v3_Nswizzle0_Quant0_MulRoutedWeight0_B16_B16_B16,0.0%,62.56,7847.36
stage2,256,128,2048,192,128,8,ActivationType.Silu,torch.bfloat16,torch.bfloat16,torch.bfloat16,QuantType.No,1,1,128,0,37.405,moe_ck2stages_gemm2_256x128x64x64_1x4_TypeCast_v3_Nswizzle0_Quant0_MulRoutedWeight0_B16_B16_B16,0.0%,64.59,8101.55
stage2,256,128,2048,192,128,8,ActivationType.Silu,torch.bfloat16,torch.bfloat16,torch.bfloat16,QuantType.No,1,1,128,0,42.4615,moe_ck2stages_gemm2_256x128x64x64_1x4_TypeCast_v1_Nswizzle0_Quant0_MulRoutedWeight0_B16_B16_B16,0.0%,56.9,7136.78
stage1,256,128,4096,192,128,8,ActivationType.Gelu,torch.bfloat16,torch.bfloat16,torch.bfloat16,QuantType.No,1,0,32,0,75.3622,moe_ck2stages_gemm1_256x32x64x128_1x4_TypeCast_v1_Nswizzle0_Quant0_MulRoutedWeight0_gelu_B16_B16_B16,0.0%,64.11,8042.19
stage1,256,128,4096,192,128,8,ActivationType.Gelu,torch.bfloat16,torch.bfloat16,torch.bfloat16,QuantType.No,1,0,32,0,72.7504,moe_ck2stages_gemm1_256x32x64x64_1x4_TypeCast_v1_Nswizzle0_Quant0_MulRoutedWeight0_gelu_B16_B16_B16,0.0%,66.42,8330.91
stage2,256,128,4096,192,128,8,ActivationType.Gelu,torch.bfloat16,torch.bfloat16,torch.bfloat16,QuantType.No,1,0,32,0,inf,moe_ck2stages_gemm2_256x32x128x128_1x4_TypeCast_v1_Nswizzle0_Quant0_MulRoutedWeight1_B16_B16_B16,100.0%,0.0,0.0
stage2,256,128,4096,192,128,8,ActivationType.Gelu,torch.bfloat16,torch.bfloat16,torch.bfloat16,QuantType.No,1,0,32,0,41.0676,moe_ck2stages_gemm2_256x32x64x64_1x4_TypeCast_v1_Nswizzle0_Quant0_MulRoutedWeight1_B16_B16_B16,0.1%,117.66,14758.03
stage1,256,128,4096,192,128,8,ActivationType.Gelu,torch.bfloat16,torch.bfloat16,torch.bfloat16,QuantType.No,1,0,64,0,77.3114,moe_ck2stages_gemm1_256x64x64x128_1x4_TypeCast_v1_Nswizzle0_Quant0_MulRoutedWeight0_gelu_B16_B16_B16,0.0%,62.5,7839.43
stage1,256,128,4096,192,128,8,ActivationType.Gelu,torch.bfloat16,torch.bfloat16,torch.bfloat16,QuantType.No,1,0,64,0,73.8922,moe_ck2stages_gemm1_256x64x64x64_1x4_TypeCast_v1_Nswizzle0_Quant0_MulRoutedWeight0_gelu_B16_B16_B16,0.0%,65.39,8202.18
stage2,256,128,4096,192,128,8,ActivationType.Gelu,torch.bfloat16,torch.bfloat16,torch.bfloat16,QuantType.No,1,0,64,0,inf,moe_ck2stages_gemm2_256x64x128x128_1x4_TypeCast_v1_Nswizzle0_Quant0_MulRoutedWeight1_B16_B16_B16,100.0%,0.0,0.0
stage2,256,128,4096,192,128,8,ActivationType.Gelu,torch.bfloat16,torch.bfloat16,torch.bfloat16,QuantType.No,1,0,64,0,52.571,moe_ck2stages_gemm2_256x64x64x64_1x4_TypeCast_v1_Nswizzle0_Quant0_MulRoutedWeight1_B16_B16_B16,0.1%,91.91,11528.73
stage2,256,128,4096,192,128,8,ActivationType.Gelu,torch.bfloat16,torch.bfloat16,torch.bfloat16,QuantType.No,1,0,64,0,47.3705,moe_ck2stages_gemm2_256x64x128x64_1x4_TypeCast_v1_Nswizzle0_Quant0_MulRoutedWeight1_B16_B16_B16,0.1%,102.0,12794.4
stage1,256,128,4096,192,128,8,ActivationType.Gelu,torch.bfloat16,torch.bfloat16,torch.bfloat16,QuantType.No,1,0,128,0,77.3794,moe_ck2stages_gemm1_256x128x64x64_1x4_TypeCast_v1_Nswizzle0_Quant0_MulRoutedWeight0_gelu_B16_B16_B16,0.0%,62.44,7832.54
stage1,256,128,4096,192,128,8,ActivationType.Gelu,torch.bfloat16,torch.bfloat16,torch.bfloat16,QuantType.No,1,0,128,0,inf,moe_ck2stages_gemm1_256x128x128x64_1x4_TypeCast_v3_Nswizzle0_Quant0_MulRoutedWeight0_gelu_B16_B16_B16,100.0%,0.0,0.0
stage2,256,128,4096,192,128,8,ActivationType.Gelu,torch.bfloat16,torch.bfloat16,torch.bfloat16,QuantType.No,1,0,128,0,73.28,moe_ck2stages_gemm2_256x128x128x64_1x4_TypeCast_v1_Nswizzle0_Quant0_MulRoutedWeight1_B16_B16_B16,0.1%,65.94,8270.7
stage2,256,128,4096,192,128,8,ActivationType.Gelu,torch.bfloat16,torch.bfloat16,torch.bfloat16,QuantType.No,1,0,128,0,72.4171,moe_ck2stages_gemm2_256x128x128x64_1x4_TypeCast_v3_Nswizzle0_Quant0_MulRoutedWeight1_B16_B16_B16,0.1%,66.72,8369.25
stage2,256,128,4096,192,128,8,ActivationType.Gelu,torch.bfloat16,torch.bfloat16,torch.bfloat16,QuantType.No,1,0,128,0,71.8858,moe_ck2stages_gemm2_256x128x64x64_1x4_TypeCast_v3_Nswizzle0_Quant0_MulRoutedWeight1_B16_B16_B16,0.1%,67.22,8431.11
stage2,256,128,4096,192,128,8,ActivationType.Gelu,torch.bfloat16,torch.bfloat16,torch.bfloat16,QuantType.No,1,0,128,0,80.9407,moe_ck2stages_gemm2_256x128x64x64_1x4_TypeCast_v1_Nswizzle0_Quant0_MulRoutedWeight1_B16_B16_B16,0.1%,59.7,7487.91
stage1,256,128,4096,192,128,8,ActivationType.Gelu,torch.bfloat16,torch.bfloat16,torch.bfloat16,QuantType.No,1,1,32,0,74.8313,moe_ck2stages_gemm1_256x32x64x128_1x4_TypeCast_v1_Nswizzle0_Quant0_MulRoutedWeight1_gelu_B16_B16_B16,0.0%,64.57,8099.24
stage1,256,128,4096,192,128,8,ActivationType.Gelu,torch.bfloat16,torch.bfloat16,torch.bfloat16,QuantType.No,1,1,32,0,73.1424,moe_ck2stages_gemm1_256x32x64x64_1x4_TypeCast_v1_Nswizzle0_Quant0_MulRoutedWeight1_gelu_B16_B16_B16,0.0%,66.06,8286.26
stage2,256,128,4096,192,128,8,ActivationType.Gelu,torch.bfloat16,torch.bfloat16,torch.bfloat16,QuantType.No,1,1,32,0,inf,moe_ck2stages_gemm2_256x32x128x128_1x4_TypeCast_v1_Nswizzle0_Quant0_MulRoutedWeight0_B16_B16_B16,100.0%,0.0,0.0
stage2,256,128,4096,192,128,8,ActivationType.Gelu,torch.bfloat16,torch.bfloat16,torch.bfloat16,QuantType.No,1,1,32,0,41.7701,moe_ck2stages_gemm2_256x32x64x64_1x4_TypeCast_v1_Nswizzle0_Quant0_MulRoutedWeight0_B16_B16_B16,0.0%,115.68,14509.83
stage1,256,128,4096,192,128,8,ActivationType.Gelu,torch.bfloat16,torch.bfloat16,torch.bfloat16,QuantType.No,1,1,64,0,77.7058,moe_ck2stages_gemm1_256x64x64x128_1x4_TypeCast_v1_Nswizzle0_Quant0_MulRoutedWeight1_gelu_B16_B16_B16,0.0%,62.18,7799.64
stage1,256,128,4096,192,128,8,ActivationType.Gelu,torch.bfloat16,torch.bfloat16,torch.bfloat16,QuantType.No,1,1,64,0,73.6895,moe_ck2stages_gemm1_256x64x64x64_1x4_TypeCast_v1_Nswizzle0_Quant0_MulRoutedWeight1_gelu_B16_B16_B16,0.0%,65.57,8224.74
stage2,256,128,4096,192,128,8,ActivationType.Gelu,torch.bfloat16,torch.bfloat16,torch.bfloat16,QuantType.No,1,1,64,0,inf,moe_ck2stages_gemm2_256x64x128x128_1x4_TypeCast_v1_Nswizzle0_Quant0_MulRoutedWeight0_B16_B16_B16,100.0%,0.0,0.0
stage2,256,128,4096,192,128,8,ActivationType.Gelu,torch.bfloat16,torch.bfloat16,torch.bfloat16,QuantType.No,1,1,64,0,47.746,moe_ck2stages_gemm2_256x64x64x64_1x4_TypeCast_v1_Nswizzle0_Quant0_MulRoutedWeight0_B16_B16_B16,0.0%,101.2,12693.77
stage2,256,128,4096,192,128,8,ActivationType.Gelu,torch.bfloat16,torch.bfloat16,torch.bfloat16,QuantType.No,1,1,64,0,45.3849,moe_ck2stages_gemm2_256x64x128x64_1x4_TypeCast_v1_Nswizzle0_Quant0_MulRoutedWeight0_B16_B16_B16,0.0%,106.46,13354.15
stage1,256,128,4096,192,128,8,ActivationType.Gelu,torch.bfloat16,torch.bfloat16,torch.bfloat16,QuantType.No,1,1,128,0,78.9259,moe_ck2stages_gemm1_256x128x64x64_1x4_TypeCast_v1_Nswizzle0_Quant0_MulRoutedWeight1_gelu_B16_B16_B16,0.0%,61.22,7679.06
stage1,256,128,4096,192,128,8,ActivationType.Gelu,torch.bfloat16,torch.bfloat16,torch.bfloat16,QuantType.No,1,1,128,0,inf,moe_ck2stages_gemm1_256x128x128x64_1x4_TypeCast_v3_Nswizzle0_Quant0_MulRoutedWeight1_gelu_B16_B16_B16,100.0%,0.0,0.0
stage2,256,128,4096,192,128,8,ActivationType.Gelu,torch.bfloat16,torch.bfloat16,torch.bfloat16,QuantType.No,1,1,128,0,68.2086,moe_ck2stages_gemm2_256x128x128x64_1x4_TypeCast_v1_Nswizzle0_Quant0_MulRoutedWeight0_B16_B16_B16,0.0%,70.84,8885.64
stage2,256,128,4096,192,128,8,ActivationType.Gelu,torch.bfloat16,torch.bfloat16,torch.bfloat16,QuantType.No,1,1,128,0,68.8778,moe_ck2stages_gemm2_256x128x128x64_1x4_TypeCast_v3_Nswizzle0_Quant0_MulRoutedWeight0_B16_B16_B16,0.0%,70.15,8799.31
stage2,256,128,4096,192,128,8,ActivationType.Gelu,torch.bfloat16,torch.bfloat16,torch.bfloat16,QuantType.No,1,1,128,0,66.1334,moe_ck2stages_gemm2_256x128x64x64_1x4_TypeCast_v3_Nswizzle0_Quant0_MulRoutedWeight0_B16_B16_B16,0.0%,73.06,9164.46
stage2,256,128,4096,192,128,8,ActivationType.Gelu,torch.bfloat16,torch.bfloat16,torch.bfloat16,QuantType.No,1,1,128,0,73.923,moe_ck2stages_gemm2_256x128x64x64_1x4_TypeCast_v1_Nswizzle0_Quant0_MulRoutedWeight0_B16_B16_B16,0.0%,65.36,8198.76
stage1,256,128,4096,192,128,8,ActivationType.Silu,torch.bfloat16,torch.bfloat16,torch.bfloat16,QuantType.No,1,0,32,0,75.1818,moe_ck2stages_gemm1_256x32x64x128_1x4_TypeCast_v1_Nswizzle0_Quant0_MulRoutedWeight0_silu_B16_B16_B16,0.0%,64.27,8061.48
stage1,256,128,4096,192,128,8,ActivationType.Silu,torch.bfloat16,torch.bfloat16,torch.bfloat16,QuantType.No,1,0,32,0,72.8046,moe_ck2stages_gemm1_256x32x64x64_1x4_TypeCast_v1_Nswizzle0_Quant0_MulRoutedWeight0_silu_B16_B16_B16,0.0%,66.37,8324.71
stage2,256,128,4096,192,128,8,ActivationType.Silu,torch.bfloat16,torch.bfloat16,torch.bfloat16,QuantType.No,1,0,32,0,inf,moe_ck2stages_gemm2_256x32x128x128_1x4_TypeCast_v1_Nswizzle0_Quant0_MulRoutedWeight1_B16_B16_B16,100.0%,0.0,0.0
stage2,256,128,4096,192,128,8,ActivationType.Silu,torch.bfloat16,torch.bfloat16,torch.bfloat16,QuantType.No,1,0,32,0,41.2005,moe_ck2stages_gemm2_256x32x64x64_1x4_TypeCast_v1_Nswizzle0_Quant0_MulRoutedWeight1_B16_B16_B16,0.1%,117.28,14710.43
stage1,256,128,4096,192,128,8,ActivationType.Silu,torch.bfloat16,torch.bfloat16,torch.bfloat16,QuantType.No,1,0,64,0,77.2526,moe_ck2stages_gemm1_256x64x64x128_1x4_TypeCast_v1_Nswizzle0_Quant0_MulRoutedWeight0_silu_B16_B16_B16,0.0%,62.55,7845.39
stage1,256,128,4096,192,128,8,ActivationType.Silu,torch.bfloat16,torch.bfloat16,torch.bfloat16,QuantType.No,1,0,64,0,74.2608,moe_ck2stages_gemm1_256x64x64x64_1x4_TypeCast_v1_Nswizzle0_Quant0_MulRoutedWeight0_silu_B16_B16_B16,0.0%,65.07,8161.47
stage2,256,128,4096,192,128,8,ActivationType.Silu,torch.bfloat16,torch.bfloat16,torch.bfloat16,QuantType.No,1,0,64,0,inf,moe_ck2stages_gemm2_256x64x128x128_1x4_TypeCast_v1_Nswizzle0_Quant0_MulRoutedWeight1_B16_B16_B16,100.0%,0.0,0.0
stage2,256,128,4096,192,128,8,ActivationType.Silu,torch.bfloat16,torch.bfloat16,torch.bfloat16,QuantType.No,1,0,64,0,52.1766,moe_ck2stages_gemm2_256x64x64x64_1x4_TypeCast_v1_Nswizzle0_Quant0_MulRoutedWeight1_B16_B16_B16,0.1%,92.61,11615.88
stage2,256,128,4096,192,128,8,ActivationType.Silu,torch.bfloat16,torch.bfloat16,torch.bfloat16,QuantType.No,1,0,64,0,47.7667,moe_ck2stages_gemm2_256x64x128x64_1x4_TypeCast_v1_Nswizzle0_Quant0_MulRoutedWeight1_B16_B16_B16,0.1%,101.15,12688.27
stage1,256,128,4096,192,128,8,ActivationType.Silu,torch.bfloat16,torch.bfloat16,torch.bfloat16,QuantType.No,1,0,128,0,78.3767,moe_ck2stages_gemm1_256x128x64x64_1x4_TypeCast_v1_Nswizzle0_Quant0_MulRoutedWeight0_silu_B16_B16_B16,0.0%,61.65,7732.87
stage1,256,128,4096,192,128,8,ActivationType.Silu,torch.bfloat16,torch.bfloat16,torch.bfloat16,QuantType.No,1,0,128,0,inf,moe_ck2stages_gemm1_256x128x128x64_1x4_TypeCast_v3_Nswizzle0_Quant0_MulRoutedWeight0_silu_B16_B16_B16,100.0%,0.0,0.0
stage2,256,128,4096,192,128,8,ActivationType.Silu,torch.bfloat16,torch.bfloat16,torch.bfloat16,QuantType.No,1,0,128,0,72.8227,moe_ck2stages_gemm2_256x128x128x64_1x4_TypeCast_v1_Nswizzle0_Quant0_MulRoutedWeight1_B16_B16_B16,0.1%,66.35,8322.64
stage2,256,128,4096,192,128,8,ActivationType.Silu,torch.bfloat16,torch.bfloat16,torch.bfloat16,QuantType.No,1,0,128,0,72.2409,moe_ck2stages_gemm2_256x128x128x64_1x4_TypeCast_v3_Nswizzle0_Quant0_MulRoutedWeight1_B16_B16_B16,0.1%,66.89,8389.66
stage2,256,128,4096,192,128,8,ActivationType.Silu,torch.bfloat16,torch.bfloat16,torch.bfloat16,QuantType.No,1,0,128,0,72.1163,moe_ck2stages_gemm2_256x128x64x64_1x4_TypeCast_v3_Nswizzle0_Quant0_MulRoutedWeight1_B16_B16_B16,0.1%,67.0,8404.16
stage2,256,128,4096,192,128,8,ActivationType.Silu,torch.bfloat16,torch.bfloat16,torch.bfloat16,QuantType.No,1,0,128,0,80.9143,moe_ck2stages_gemm2_256x128x64x64_1x4_TypeCast_v1_Nswizzle0_Quant0_MulRoutedWeight1_B16_B16_B16,0.1%,59.72,7490.36
stage1,256,128,4096,192,128,8,ActivationType.Silu,torch.bfloat16,torch.bfloat16,torch.bfloat16,QuantType.No,1,1,32,0,75.6582,moe_ck2stages_gemm1_256x32x64x128_1x4_TypeCast_v1_Nswizzle0_Quant0_MulRoutedWeight1_silu_B16_B16_B16,0.0%,63.86,8010.72
stage1,256,128,4096,192,128,8,ActivationType.Silu,torch.bfloat16,torch.bfloat16,torch.bfloat16,QuantType.No,1,1,32,0,73.0146,moe_ck2stages_gemm1_256x32x64x64_1x4_TypeCast_v1_Nswizzle0_Quant0_MulRoutedWeight1_silu_B16_B16_B16,0.0%,66.18,8300.76
stage2,256,128,4096,192,128,8,ActivationType.Silu,torch.bfloat16,torch.bfloat16,torch.bfloat16,QuantType.No,1,1,32,0,inf,moe_ck2stages_gemm2_256x32x128x128_1x4_TypeCast_v1_Nswizzle0_Quant0_MulRoutedWeight0_B16_B16_B16,100.0%,0.0,0.0
stage2,256,128,4096,192,128,8,ActivationType.Silu,torch.bfloat16,torch.bfloat16,torch.bfloat16,QuantType.No,1,1,32,0,41.2667,moe_ck2stages_gemm2_256x32x64x64_1x4_TypeCast_v1_Nswizzle0_Quant0_MulRoutedWeight0_B16_B16_B16,0.0%,117.09,14686.83
stage1,256,128,4096,192,128,8,ActivationType.Silu,torch.bfloat16,torch.bfloat16,torch.bfloat16,QuantType.No,1,1,64,0,77.1252,moe_ck2stages_gemm1_256x64x64x128_1x4_TypeCast_v1_Nswizzle0_Quant0_MulRoutedWeight1_silu_B16_B16_B16,0.0%,62.65,7858.35
stage1,256,128,4096,192,128,8,ActivationType.Silu,torch.bfloat16,torch.bfloat16,torch.bfloat16,QuantType.No,1,1,64,0,74.5383,moe_ck2stages_gemm1_256x64x64x64_1x4_TypeCast_v1_Nswizzle0_Quant0_MulRoutedWeight1_silu_B16_B16_B16,0.0%,64.82,8131.08
stage2,256,128,4096,192,128,8,ActivationType.Silu,torch.bfloat16,torch.bfloat16,torch.bfloat16,QuantType.No,1,1,64,0,inf,moe_ck2stages_gemm2_256x64x128x128_1x4_TypeCast_v1_Nswizzle0_Quant0_MulRoutedWeight0_B16_B16_B16,100.0%,0.0,0.0
stage2,256,128,4096,192,128,8,ActivationType.Silu,torch.bfloat16,torch.bfloat16,torch.bfloat16,QuantType.No,1,1,64,0,47.8711,moe_ck2stages_gemm2_256x64x64x64_1x4_TypeCast_v1_Nswizzle0_Quant0_MulRoutedWeight0_B16_B16_B16,0.0%,100.93,12660.6
stage2,256,128,4096,192,128,8,ActivationType.Silu,torch.bfloat16,torch.bfloat16,torch.bfloat16,QuantType.No,1,1,64,0,45.5059,moe_ck2stages_gemm2_256x64x128x64_1x4_TypeCast_v1_Nswizzle0_Quant0_MulRoutedWeight0_B16_B16_B16,0.0%,106.18,13318.65
stage1,256,128,4096,192,128,8,ActivationType.Silu,torch.bfloat16,torch.bfloat16,torch.bfloat16,QuantType.No,1,1,128,0,78.6302,moe_ck2stages_gemm1_256x128x64x64_1x4_TypeCast_v1_Nswizzle0_Quant0_MulRoutedWeight1_silu_B16_B16_B16,0.0%,61.45,7707.94
stage1,256,128,4096,192,128,8,ActivationType.Silu,torch.bfloat16,torch.bfloat16,torch.bfloat16,QuantType.No,1,1,128,0,inf,moe_ck2stages_gemm1_256x128x128x64_1x4_TypeCast_v3_Nswizzle0_Quant0_MulRoutedWeight1_silu_B16_B16_B16,100.0%,0.0,0.0
stage2,256,128,4096,192,128,8,ActivationType.Silu,torch.bfloat16,torch.bfloat16,torch.bfloat16,QuantType.No,1,1,128,0,68.1269,moe_ck2stages_gemm2_256x128x128x64_1x4_TypeCast_v1_Nswizzle0_Quant0_MulRoutedWeight0_B16_B16_B16,0.0%,70.92,8896.29
stage2,256,128,4096,192,128,8,ActivationType.Silu,torch.bfloat16,torch.bfloat16,torch.bfloat16,QuantType.No,1,1,128,0,68.8999,moe_ck2stages_gemm2_256x128x128x64_1x4_TypeCast_v3_Nswizzle0_Quant0_MulRoutedWeight0_B16_B16_B16,0.0%,70.13,8796.48
stage2,256,128,4096,192,128,8,ActivationType.Silu,torch.bfloat16,torch.bfloat16,torch.bfloat16,QuantType.No,1,1,128,0,65.348,moe_ck2stages_gemm2_256x128x64x64_1x4_TypeCast_v3_Nswizzle0_Quant0_MulRoutedWeight0_B16_B16_B16,0.0%,73.94,9274.61
stage2,256,128,4096,192,128,8,ActivationType.Silu,torch.bfloat16,torch.bfloat16,torch.bfloat16,QuantType.No,1,1,128,0,73.847,moe_ck2stages_gemm2_256x128x64x64_1x4_TypeCast_v1_Nswizzle0_Quant0_MulRoutedWeight0_B16_B16_B16,0.0%,65.43,8207.2
stage1,256,128,4096,384,128,8,ActivationType.Gelu,torch.bfloat16,torch.bfloat16,torch.bfloat16,QuantType.No,1,0,32,0,138.3626,moe_ck2stages_gemm1_256x32x64x128_1x4_TypeCast_v1_Nswizzle0_Quant0_MulRoutedWeight0_gelu_B16_B16_B16,0.0%,69.84,8745.55
stage1,256,128,4096,384,128,8,ActivationType.Gelu,torch.bfloat16,torch.bfloat16,torch.bfloat16,QuantType.No,1,0,32,0,139.9889,moe_ck2stages_gemm1_256x32x64x64_1x4_TypeCast_v1_Nswizzle0_Quant0_MulRoutedWeight0_gelu_B16_B16_B16,0.0%,69.03,8643.95
stage2,256,128,4096,384,128,8,ActivationType.Gelu,torch.bfloat16,torch.bfloat16,torch.bfloat16,QuantType.No,1,0,32,0,77.6106,moe_ck2stages_gemm2_256x32x128x128_1x4_TypeCast_v1_Nswizzle0_Quant0_MulRoutedWeight1_B16_B16_B16,0.5%,124.51,15591.38
stage2,256,128,4096,384,128,8,ActivationType.Gelu,torch.bfloat16,torch.bfloat16,torch.bfloat16,QuantType.No,1,0,32,0,76.6243,moe_ck2stages_gemm2_256x32x64x64_1x4_TypeCast_v1_Nswizzle0_Quant0_MulRoutedWeight1_B16_B16_B16,0.5%,126.12,15792.08
stage1,256,128,4096,384,128,8,ActivationType.Gelu,torch.bfloat16,torch.bfloat16,torch.bfloat16,QuantType.No,1,0,64,0,138.3983,moe_ck2stages_gemm1_256x64x64x128_1x4_TypeCast_v1_Nswizzle0_Quant0_MulRoutedWeight0_gelu_B16_B16_B16,0.0%,69.83,8743.29
stage1,256,128,4096,384,128,8,ActivationType.Gelu,torch.bfloat16,torch.bfloat16,torch.bfloat16,QuantType.No,1,0,64,0,139.5099,moe_ck2stages_gemm1_256x64x64x64_1x4_TypeCast_v1_Nswizzle0_Quant0_MulRoutedWeight0_gelu_B16_B16_B16,0.0%,69.27,8673.63
stage2,256,128,4096,384,128,8,ActivationType.Gelu,torch.bfloat16,torch.bfloat16,torch.bfloat16,QuantType.No,1,0,64,0,86.3121,moe_ck2stages_gemm2_256x64x128x128_1x4_TypeCast_v1_Nswizzle0_Quant0_MulRoutedWeight1_B16_B16_B16,0.5%,111.96,14019.55
stage2,256,128,4096,384,128,8,ActivationType.Gelu,torch.bfloat16,torch.bfloat16,torch.bfloat16,QuantType.No,1,0,64,0,82.4011,moe_ck2stages_gemm2_256x64x64x64_1x4_TypeCast_v1_Nswizzle0_Quant0_MulRoutedWeight1_B16_B16_B16,0.5%,117.28,14684.96
stage2,256,128,4096,384,128,8,ActivationType.Gelu,torch.bfloat16,torch.bfloat16,torch.bfloat16,QuantType.No,1,0,64,0,79.809,moe_ck2stages_gemm2_256x64x128x64_1x4_TypeCast_v1_Nswizzle0_Quant0_MulRoutedWeight1_B16_B16_B16,0.5%,121.09,15161.91
stage1,256,128,4096,384,128,8,ActivationType.Gelu,torch.bfloat16,torch.bfloat16,torch.bfloat16,QuantType.No,1,0,128,0,156.6636,moe_ck2stages_gemm1_256x128x64x64_1x4_TypeCast_v1_Nswizzle0_Quant0_MulRoutedWeight0_gelu_B16_B16_B16,0.0%,61.68,7723.92
stage1,256,128,4096,384,128,8,ActivationType.Gelu,torch.bfloat16,torch.bfloat16,torch.bfloat16,QuantType.No,1,0,128,0,163.4896,moe_ck2stages_gemm1_256x128x128x64_1x4_TypeCast_v3_Nswizzle0_Quant0_MulRoutedWeight0_gelu_B16_B16_B16,0.0%,59.11,7401.43
stage2,256,128,4096,384,128,8,ActivationType.Gelu,torch.bfloat16,torch.bfloat16,torch.bfloat16,QuantType.No,1,0,128,0,101.1176,moe_ck2stages_gemm2_256x128x128x64_1x4_TypeCast_v1_Nswizzle0_Quant0_MulRoutedWeight1_B16_B16_B16,0.5%,95.57,11966.83
stage2,256,128,4096,384,128,8,ActivationType.Gelu,torch.bfloat16,torch.bfloat16,torch.bfloat16,QuantType.No,1,0,128,0,100.8257,moe_ck2stages_gemm2_256x128x128x64_1x4_TypeCast_v3_Nswizzle0_Quant0_MulRoutedWeight1_B16_B16_B16,0.5%,95.85,12001.47
stage2,256,128,4096,384,128,8,ActivationType.Gelu,torch.bfloat16,torch.bfloat16,torch.bfloat16,QuantType.No,1,0,128,0,102.122,moe_ck2stages_gemm2_256x128x64x64_1x4_TypeCast_v3_Nswizzle0_Quant0_MulRoutedWeight1_B16_B16_B16,0.5%,94.63,11849.13
stage2,256,128,4096,384,128,8,ActivationType.Gelu,torch.bfloat16,torch.bfloat16,torch.bfloat16,QuantType.No,1,0,128,0,110.9061,moe_ck2stages_gemm2_256x128x64x64_1x4_TypeCast_v1_Nswizzle0_Quant0_MulRoutedWeight1_B16_B16_B16,0.5%,87.13,10910.64
stage1,256,128,4096,384,128,8,ActivationType.Gelu,torch.bfloat16,torch.bfloat16,torch.bfloat16,QuantType.No,1,1,32,0,138.3579,moe_ck2stages_gemm1_256x32x64x128_1x4_TypeCast_v1_Nswizzle0_Quant0_MulRoutedWeight1_gelu_B16_B16_B16,0.0%,69.85,8745.84
stage1,256,128,4096,384,128,8,ActivationType.Gelu,torch.bfloat16,torch.bfloat16,torch.bfloat16,QuantType.No,1,1,32,0,139.7439,moe_ck2stages_gemm1_256x32x64x64_1x4_TypeCast_v1_Nswizzle0_Quant0_MulRoutedWeight1_gelu_B16_B16_B16,0.0%,69.15,8659.1
stage2,256,128,4096,384,128,8,ActivationType.Gelu,torch.bfloat16,torch.bfloat16,torch.bfloat16,QuantType.No,1,1,32,0,77.2441,moe_ck2stages_gemm2_256x32x128x128_1x4_TypeCast_v1_Nswizzle0_Quant0_MulRoutedWeight0_B16_B16_B16,0.0%,125.11,15665.36
stage2,256,128,4096,384,128,8,ActivationType.Gelu,torch.bfloat16,torch.bfloat16,torch.bfloat16,QuantType.No,1,1,32,0,76.8562,moe_ck2stages_gemm2_256x32x64x64_1x4_TypeCast_v1_Nswizzle0_Quant0_MulRoutedWeight0_B16_B16_B16,0.0%,125.74,15744.43
stage1,256,128,4096,384,128,8,ActivationType.Gelu,torch.bfloat16,torch.bfloat16,torch.bfloat16,QuantType.No,1,1,64,0,138.642,moe_ck2stages_gemm1_256x64x64x128_1x4_TypeCast_v1_Nswizzle0_Quant0_MulRoutedWeight1_gelu_B16_B16_B16,0.0%,69.7,8727.92
stage1,256,128,4096,384,128,8,ActivationType.Gelu,torch.bfloat16,torch.bfloat16,torch.bfloat16,QuantType.No,1,1,64,0,140.5072,moe_ck2stages_gemm1_256x64x64x64_1x4_TypeCast_v1_Nswizzle0_Quant0_MulRoutedWeight1_gelu_B16_B16_B16,0.0%,68.78,8612.06
stage2,256,128,4096,384,128,8,ActivationType.Gelu,torch.bfloat16,torch.bfloat16,torch.bfloat16,QuantType.No,1,1,64,0,82.6122,moe_ck2stages_gemm2_256x64x128x128_1x4_TypeCast_v1_Nswizzle0_Quant0_MulRoutedWeight0_B16_B16_B16,0.0%,116.98,14647.43
stage2,256,128,4096,384,128,8,ActivationType.Gelu,torch.bfloat16,torch.bfloat16,torch.bfloat16,QuantType.No,1,1,64,0,79.1802,moe_ck2stages_gemm2_256x64x64x64_1x4_TypeCast_v1_Nswizzle0_Quant0_MulRoutedWeight0_B16_B16_B16,0.0%,122.05,15282.31
stage2,256,128,4096,384,128,8,ActivationType.Gelu,torch.bfloat16,torch.bfloat16,torch.bfloat16,QuantType.No,1,1,64,0,79.1855,moe_ck2stages_gemm2_256x64x128x64_1x4_TypeCast_v1_Nswizzle0_Quant0_MulRoutedWeight0_B16_B16_B16,0.0%,122.04,15281.29
stage1,256,128,4096,384,128,8,ActivationType.Gelu,torch.bfloat16,torch.bfloat16,torch.bfloat16,QuantType.No,1,1,128,0,158.9955,moe_ck2stages_gemm1_256x128x64x64_1x4_TypeCast_v1_Nswizzle0_Quant0_MulRoutedWeight1_gelu_B16_B16_B16,0.0%,60.78,7610.63
stage1,256,128,4096,384,128,8,ActivationType.Gelu,torch.bfloat16,torch.bfloat16,torch.bfloat16,QuantType.No,1,1,128,0,167.2293,moe_ck2stages_gemm1_256x128x128x64_1x4_TypeCast_v3_Nswizzle0_Quant0_MulRoutedWeight1_gelu_B16_B16_B16,0.0%,57.79,7235.91
stage2,256,128,4096,384,128,8,ActivationType.Gelu,torch.bfloat16,torch.bfloat16,torch.bfloat16,QuantType.No,1,1,128,0,96.9233,moe_ck2stages_gemm2_256x128x128x64_1x4_TypeCast_v1_Nswizzle0_Quant0_MulRoutedWeight0_B16_B16_B16,0.0%,99.7,12484.68
stage2,256,128,4096,384,128,8,ActivationType.Gelu,torch.bfloat16,torch.bfloat16,torch.bfloat16,QuantType.No,1,1,128,0,97.4066,moe_ck2stages_gemm2_256x128x128x64_1x4_TypeCast_v3_Nswizzle0_Quant0_MulRoutedWeight0_B16_B16_B16,0.0%,99.21,12422.74
stage2,256,128,4096,384,128,8,ActivationType.Gelu,torch.bfloat16,torch.bfloat16,torch.bfloat16,QuantType.No,1,1,128,0,95.3715,moe_ck2stages_gemm2_256x128x64x64_1x4_TypeCast_v3_Nswizzle0_Quant0_MulRoutedWeight0_B16_B16_B16,0.0%,101.33,12687.82
stage2,256,128,4096,384,128,8,ActivationType.Gelu,torch.bfloat16,torch.bfloat16,torch.bfloat16,QuantType.No,1,1,128,0,105.0483,moe_ck2stages_gemm2_256x128x64x64_1x4_TypeCast_v1_Nswizzle0_Quant0_MulRoutedWeight0_B16_B16_B16,0.0%,91.99,11519.05
stage1,256,128,4096,384,128,8,ActivationType.Silu,torch.bfloat16,torch.bfloat16,torch.bfloat16,QuantType.No,1,0,32,0,138.5741,moe_ck2stages_gemm1_256x32x64x128_1x4_TypeCast_v1_Nswizzle0_Quant0_MulRoutedWeight0_silu_B16_B16_B16,0.0%,69.74,8732.2
stage1,256,128,4096,384,128,8,ActivationType.Silu,torch.bfloat16,torch.bfloat16,torch.bfloat16,QuantType.No,1,0,32,0,140.452,moe_ck2stages_gemm1_256x32x64x64_1x4_TypeCast_v1_Nswizzle0_Quant0_MulRoutedWeight0_silu_B16_B16_B16,0.0%,68.8,8615.45
stage2,256,128,4096,384,128,8,ActivationType.Silu,torch.bfloat16,torch.bfloat16,torch.bfloat16,QuantType.No,1,0,32,0,76.9706,moe_ck2stages_gemm2_256x32x128x128_1x4_TypeCast_v1_Nswizzle0_Quant0_MulRoutedWeight1_B16_B16_B16,0.4%,125.55,15721.02
stage2,256,128,4096,384,128,8,ActivationType.Silu,torch.bfloat16,torch.bfloat16,torch.bfloat16,QuantType.No,1,0,32,0,77.3687,moe_ck2stages_gemm2_256x32x64x64_1x4_TypeCast_v1_Nswizzle0_Quant0_MulRoutedWeight1_B16_B16_B16,0.4%,124.9,15640.13
stage1,256,128,4096,384,128,8,ActivationType.Silu,torch.bfloat16,torch.bfloat16,torch.bfloat16,QuantType.No,1,0,64,0,138.5098,moe_ck2stages_gemm1_256x64x64x128_1x4_TypeCast_v1_Nswizzle0_Quant0_MulRoutedWeight0_silu_B16_B16_B16,0.0%,69.77,8736.25
stage1,256,128,4096,384,128,8,ActivationType.Silu,torch.bfloat16,torch.bfloat16,torch.bfloat16,QuantType.No,1,0,64,0,140.7788,moe_ck2stages_gemm1_256x64x64x64_1x4_TypeCast_v1_Nswizzle0_Quant0_MulRoutedWeight0_silu_B16_B16_B16,0.0%,68.64,8595.45
stage2,256,128,4096,384,128,8,ActivationType.Silu,torch.bfloat16,torch.bfloat16,torch.bfloat16,QuantType.No,1,0,64,0,86.2907,moe_ck2stages_gemm2_256x64x128x128_1x4_TypeCast_v1_Nswizzle0_Quant0_MulRoutedWeight1_B16_B16_B16,0.4%,111.99,14023.03
stage2,256,128,4096,384,128,8,ActivationType.Silu,torch.bfloat16,torch.bfloat16,torch.bfloat16,QuantType.No,1,0,64,0,82.1318,moe_ck2stages_gemm2_256x64x64x64_1x4_TypeCast_v1_Nswizzle0_Quant0_MulRoutedWeight1_B16_B16_B16,0.4%,117.66,14733.11
stage2,256,128,4096,384,128,8,ActivationType.Silu,torch.bfloat16,torch.bfloat16,torch.bfloat16,QuantType.No,1,0,64,0,79.4184,moe_ck2stages_gemm2_256x64x128x64_1x4_TypeCast_v1_Nswizzle0_Quant0_MulRoutedWeight1_B16_B16_B16,0.4%,121.68,15236.48
stage1,256,128,4096,384,128,8,ActivationType.Silu,torch.bfloat16,torch.bfloat16,torch.bfloat16,QuantType.No,1,0,128,0,157.5333,moe_ck2stages_gemm1_256x128x64x64_1x4_TypeCast_v1_Nswizzle0_Quant0_MulRoutedWeight0_silu_B16_B16_B16,0.0%,61.34,7681.28
stage1,256,128,4096,384,128,8,ActivationType.Silu,torch.bfloat16,torch.bfloat16,torch.bfloat16,QuantType.No,1,0,128,0,164.9636,moe_ck2stages_gemm1_256x128x128x64_1x4_TypeCast_v3_Nswizzle0_Quant0_MulRoutedWeight0_silu_B16_B16_B16,0.0%,58.58,7335.3
stage2,256,128,4096,384,128,8,ActivationType.Silu,torch.bfloat16,torch.bfloat16,torch.bfloat16,QuantType.No,1,0,128,0,100.9944,moe_ck2stages_gemm2_256x128x128x64_1x4_TypeCast_v1_Nswizzle0_Quant0_MulRoutedWeight1_B16_B16_B16,0.4%,95.69,11981.42
stage2,256,128,4096,384,128,8,ActivationType.Silu,torch.bfloat16,torch.bfloat16,torch.bfloat16,QuantType.No,1,0,128,0,100.2594,moe_ck2stages_gemm2_256x128x128x64_1x4_TypeCast_v3_Nswizzle0_Quant0_MulRoutedWeight1_B16_B16_B16,0.4%,96.39,12069.26
stage2,256,128,4096,384,128,8,ActivationType.Silu,torch.bfloat16,torch.bfloat16,torch.bfloat16,QuantType.No,1,0,128,0,102.0229,moe_ck2stages_gemm2_256x128x64x64_1x4_TypeCast_v3_Nswizzle0_Quant0_MulRoutedWeight1_B16_B16_B16,0.4%,94.72,11860.64
stage2,256,128,4096,384,128,8,ActivationType.Silu,torch.bfloat16,torch.bfloat16,torch.bfloat16,QuantType.No,1,0,128,0,110.6634,moe_ck2stages_gemm2_256x128x64x64_1x4_TypeCast_v1_Nswizzle0_Quant0_MulRoutedWeight1_B16_B16_B16,0.4%,87.32,10934.57
stage1,256,128,4096,384,128,8,ActivationType.Silu,torch.bfloat16,torch.bfloat16,torch.bfloat16,QuantType.No,1,1,32,0,138.7066,moe_ck2stages_gemm1_256x32x64x128_1x4_TypeCast_v1_Nswizzle0_Quant0_MulRoutedWeight1_silu_B16_B16_B16,0.0%,69.67,8723.86
stage1,256,128,4096,384,128,8,ActivationType.Silu,torch.bfloat16,torch.bfloat16,torch.bfloat16,QuantType.No,1,1,32,0,140.3616,moe_ck2stages_gemm1_256x32x64x64_1x4_TypeCast_v1_Nswizzle0_Quant0_MulRoutedWeight1_silu_B16_B16_B16,0.0%,68.85,8621.0
stage2,256,128,4096,384,128,8,ActivationType.Silu,torch.bfloat16,torch.bfloat16,torch.bfloat16,QuantType.No,1,1,32,0,77.4928,moe_ck2stages_gemm2_256x32x128x128_1x4_TypeCast_v1_Nswizzle0_Quant0_MulRoutedWeight0_B16_B16_B16,0.0%,124.7,15615.09
stage2,256,128,4096,384,128,8,ActivationType.Silu,torch.bfloat16,torch.bfloat16,torch.bfloat16,QuantType.No,1,1,32,0,77.596,moe_ck2stages_gemm2_256x32x64x64_1x4_TypeCast_v1_Nswizzle0_Quant0_MulRoutedWeight0_B16_B16_B16,0.0%,124.54,15594.32
stage1,256,128,4096,384,128,8,ActivationType.Silu,torch.bfloat16,torch.bfloat16,torch.bfloat16,QuantType.No,1,1,64,0,138.6561,moe_ck2stages_gemm1_256x64x64x128_1x4_TypeCast_v1_Nswizzle0_Quant0_MulRoutedWeight1_silu_B16_B16_B16,0.0%,69.7,8727.04
stage1,256,128,4096,384,128,8,ActivationType.Silu,torch.bfloat16,torch.bfloat16,torch.bfloat16,QuantType.No,1,1,64,0,140.5075,moe_ck2stages_gemm1_256x64x64x64_1x4_TypeCast_v1_Nswizzle0_Quant0_MulRoutedWeight1_silu_B16_B16_B16,0.0%,68.78,8612.04
stage2,256,128,4096,384,128,8,ActivationType.Silu,torch.bfloat16,torch.bfloat16,torch.bfloat16,QuantType.No,1,1,64,0,82.0464,moe_ck2stages_gemm2_256x64x128x128_1x4_TypeCast_v1_Nswizzle0_Quant0_MulRoutedWeight0_B16_B16_B16,0.0%,117.78,14748.44
stage2,256,128,4096,384,128,8,ActivationType.Silu,torch.bfloat16,torch.bfloat16,torch.bfloat16,QuantType.No,1,1,64,0,79.3636,moe_ck2stages_gemm2_256x64x64x64_1x4_TypeCast_v1_Nswizzle0_Quant0_MulRoutedWeight0_B16_B16_B16,0.0%,121.76,15247.0
stage2,256,128,4096,384,128,8,ActivationType.Silu,torch.bfloat16,torch.bfloat16,torch.bfloat16,QuantType.No,1,1,64,0,79.0001,moe_ck2stages_gemm2_256x64x128x64_1x4_TypeCast_v1_Nswizzle0_Quant0_MulRoutedWeight0_B16_B16_B16,0.0%,122.32,15317.15
stage1,256,128,4096,384,128,8,ActivationType.Silu,torch.bfloat16,torch.bfloat16,torch.bfloat16,QuantType.No,1,1,128,0,159.1025,moe_ck2stages_gemm1_256x128x64x64_1x4_TypeCast_v1_Nswizzle0_Quant0_MulRoutedWeight1_silu_B16_B16_B16,0.0%,60.74,7605.52
stage1,256,128,4096,384,128,8,ActivationType.Silu,torch.bfloat16,torch.bfloat16,torch.bfloat16,QuantType.No,1,1,128,0,167.2901,moe_ck2stages_gemm1_256x128x128x64_1x4_TypeCast_v3_Nswizzle0_Quant0_MulRoutedWeight1_silu_B16_B16_B16,0.0%,57.77,7233.28
stage2,256,128,4096,384,128,8,ActivationType.Silu,torch.bfloat16,torch.bfloat16,torch.bfloat16,QuantType.No,1,1,128,0,97.2269,moe_ck2stages_gemm2_256x128x128x64_1x4_TypeCast_v1_Nswizzle0_Quant0_MulRoutedWeight0_B16_B16_B16,0.0%,99.39,12445.7
stage2,256,128,4096,384,128,8,ActivationType.Silu,torch.bfloat16,torch.bfloat16,torch.bfloat16,QuantType.No,1,1,128,0,97.1955,moe_ck2stages_gemm2_256x128x128x64_1x4_TypeCast_v3_Nswizzle0_Quant0_MulRoutedWeight0_B16_B16_B16,0.0%,99.43,12449.72
stage2,256,128,4096,384,128,8,ActivationType.Silu,torch.bfloat16,torch.bfloat16,torch.bfloat16,QuantType.No,1,1,128,0,95.7587,moe_ck2stages_gemm2_256x128x64x64_1x4_TypeCast_v3_Nswizzle0_Quant0_MulRoutedWeight0_B16_B16_B16,0.0%,100.92,12636.52
stage2,256,128,4096,384,128,8,ActivationType.Silu,torch.bfloat16,torch.bfloat16,torch.bfloat16,QuantType.No,1,1,128,0,106.4909,moe_ck2stages_gemm2_256x128x64x64_1x4_TypeCast_v1_Nswizzle0_Quant0_MulRoutedWeight0_B16_B16_B16,0.0%,90.75,11363.01
stage1,256,128,7168,256,256,8,ActivationType.Gelu,torch.bfloat16,torch.bfloat16,torch.bfloat16,QuantType.No,1,0,32,0,300.8572,moe_ck2stages_gemm1_256x32x64x128_1x4_TypeCast_v1_Nswizzle0_Quant0_MulRoutedWeight0_gelu_B16_B16_B16,0.0%,37.47,9380.67
stage1,256,128,7168,256,256,8,ActivationType.Gelu,torch.bfloat16,torch.bfloat16,torch.bfloat16,QuantType.No,1,0,32,0,306.8168,moe_ck2stages_gemm1_256x32x64x64_1x4_TypeCast_v1_Nswizzle0_Quant0_MulRoutedWeight0_gelu_B16_B16_B16,0.0%,36.75,9198.46
stage2,256,128,7168,256,256,8,ActivationType.Gelu,torch.bfloat16,torch.bfloat16,torch.bfloat16,QuantType.No,1,0,32,0,160.1263,moe_ck2stages_gemm2_256x32x128x128_1x4_TypeCast_v1_Nswizzle0_Quant0_MulRoutedWeight1_B16_B16_B16,1.6%,70.41,17625.1
stage2,256,128,7168,256,256,8,ActivationType.Gelu,torch.bfloat16,torch.bfloat16,torch.bfloat16,QuantType.No,1,0,32,0,159.5158,moe_ck2stages_gemm2_256x32x64x64_1x4_TypeCast_v1_Nswizzle0_Quant0_MulRoutedWeight1_B16_B16_B16,1.7%,70.68,17692.56
stage1,256,128,7168,256,256,8,ActivationType.Gelu,torch.bfloat16,torch.bfloat16,torch.bfloat16,QuantType.No,1,0,64,0,300.348,moe_ck2stages_gemm1_256x64x64x128_1x4_TypeCast_v1_Nswizzle0_Quant0_MulRoutedWeight0_gelu_B16_B16_B16,0.0%,37.54,9396.57
stage1,256,128,7168,256,256,8,ActivationType.Gelu,torch.bfloat16,torch.bfloat16,torch.bfloat16,QuantType.No,1,0,64,0,307.4156,moe_ck2stages_gemm1_256x64x64x64_1x4_TypeCast_v1_Nswizzle0_Quant0_MulRoutedWeight0_gelu_B16_B16_B16,0.0%,36.67,9180.54
stage2,256,128,7168,256,256,8,ActivationType.Gelu,torch.bfloat16,torch.bfloat16,torch.bfloat16,QuantType.No,1,0,64,0,159.8757,moe_ck2stages_gemm2_256x64x128x128_1x4_TypeCast_v1_Nswizzle0_Quant0_MulRoutedWeight1_B16_B16_B16,1.6%,70.52,17652.73
stage2,256,128,7168,256,256,8,ActivationType.Gelu,torch.bfloat16,torch.bfloat16,torch.bfloat16,QuantType.No,1,0,64,0,181.7726,moe_ck2stages_gemm2_256x64x64x64_1x4_TypeCast_v1_Nswizzle0_Quant0_MulRoutedWeight1_B16_B16_B16,1.7%,62.02,15526.23
stage2,256,128,7168,256,256,8,ActivationType.Gelu,torch.bfloat16,torch.bfloat16,torch.bfloat16,QuantType.No,1,0,64,0,161.5202,moe_ck2stages_gemm2_256x64x128x64_1x4_TypeCast_v1_Nswizzle0_Quant0_MulRoutedWeight1_B16_B16_B16,1.7%,69.8,17473.0
stage1,256,128,7168,256,256,8,ActivationType.Gelu,torch.bfloat16,torch.bfloat16,torch.bfloat16,QuantType.No,1,0,128,0,308.2235,moe_ck2stages_gemm1_256x128x64x64_1x4_TypeCast_v1_Nswizzle0_Quant0_MulRoutedWeight0_gelu_B16_B16_B16,0.0%,36.58,9156.48
stage1,256,128,7168,256,256,8,ActivationType.Gelu,torch.bfloat16,torch.bfloat16,torch.bfloat16,QuantType.No,1,0,128,0,307.1661,moe_ck2stages_gemm1_256x128x128x64_1x4_TypeCast_v3_Nswizzle0_Quant0_MulRoutedWeight0_gelu_B16_B16_B16,0.0%,36.7,9188.0
stage2,256,128,7168,256,256,8,ActivationType.Gelu,torch.bfloat16,torch.bfloat16,torch.bfloat16,QuantType.No,1,0,128,0,234.849,moe_ck2stages_gemm2_256x128x128x64_1x4_TypeCast_v1_Nswizzle0_Quant0_MulRoutedWeight1_B16_B16_B16,1.7%,48.01,12017.26
stage2,256,128,7168,256,256,8,ActivationType.Gelu,torch.bfloat16,torch.bfloat16,torch.bfloat16,QuantType.No,1,0,128,0,230.2979,moe_ck2stages_gemm2_256x128x128x64_1x4_TypeCast_v3_Nswizzle0_Quant0_MulRoutedWeight1_B16_B16_B16,1.7%,48.96,12254.75
stage2,256,128,7168,256,256,8,ActivationType.Gelu,torch.bfloat16,torch.bfloat16,torch.bfloat16,QuantType.No,1,0,128,0,242.7194,moe_ck2stages_gemm2_256x128x64x64_1x4_TypeCast_v3_Nswizzle0_Quant0_MulRoutedWeight1_B16_B16_B16,1.7%,46.45,11627.59
stage2,256,128,7168,256,256,8,ActivationType.Gelu,torch.bfloat16,torch.bfloat16,torch.bfloat16,QuantType.No,1,0,128,0,276.1587,moe_ck2stages_gemm2_256x128x64x64_1x4_TypeCast_v1_Nswizzle0_Quant0_MulRoutedWeight1_B16_B16_B16,1.7%,40.83,10219.64
stage1,256,128,7168,256,256,8,ActivationType.Gelu,torch.bfloat16,torch.bfloat16,torch.bfloat16,QuantType.No,1,1,32,0,301.7397,moe_ck2stages_gemm1_256x32x64x128_1x4_TypeCast_v1_Nswizzle0_Quant0_MulRoutedWeight1_gelu_B16_B16_B16,0.0%,37.36,9353.23
stage1,256,128,7168,256,256,8,ActivationType.Gelu,torch.bfloat16,torch.bfloat16,torch.bfloat16,QuantType.No,1,1,32,0,307.6979,moe_ck2stages_gemm1_256x32x64x64_1x4_TypeCast_v1_Nswizzle0_Quant0_MulRoutedWeight1_gelu_B16_B16_B16,0.0%,36.64,9172.12
stage2,256,128,7168,256,256,8,ActivationType.Gelu,torch.bfloat16,torch.bfloat16,torch.bfloat16,QuantType.No,1,1,32,0,160.5477,moe_ck2stages_gemm2_256x32x128x128_1x4_TypeCast_v1_Nswizzle0_Quant0_MulRoutedWeight0_B16_B16_B16,0.0%,70.22,17578.84
stage2,256,128,7168,256,256,8,ActivationType.Gelu,torch.bfloat16,torch.bfloat16,torch.bfloat16,QuantType.No,1,1,32,0,161.0129,moe_ck2stages_gemm2_256x32x64x64_1x4_TypeCast_v1_Nswizzle0_Quant0_MulRoutedWeight0_B16_B16_B16,0.0%,70.02,17528.05
stage1,256,128,7168,256,256,8,ActivationType.Gelu,torch.bfloat16,torch.bfloat16,torch.bfloat16,QuantType.No,1,1,64,0,301.79,moe_ck2stages_gemm1_256x64x64x128_1x4_TypeCast_v1_Nswizzle0_Quant0_MulRoutedWeight1_gelu_B16_B16_B16,0.0%,37.36,9351.68
stage1,256,128,7168,256,256,8,ActivationType.Gelu,torch.bfloat16,torch.bfloat16,torch.bfloat16,QuantType.No,1,1,64,0,306.9155,moe_ck2stages_gemm1_256x64x64x64_1x4_TypeCast_v1_Nswizzle0_Quant0_MulRoutedWeight1_gelu_B16_B16_B16,0.0%,36.73,9195.5
stage2,256,128,7168,256,256,8,ActivationType.Gelu,torch.bfloat16,torch.bfloat16,torch.bfloat16,QuantType.No,1,1,64,0,157.0462,moe_ck2stages_gemm2_256x64x128x128_1x4_TypeCast_v1_Nswizzle0_Quant0_MulRoutedWeight0_B16_B16_B16,0.0%,71.79,17970.78
stage2,256,128,7168,256,256,8,ActivationType.Gelu,torch.bfloat16,torch.bfloat16,torch.bfloat16,QuantType.No,1,1,64,0,171.9026,moe_ck2stages_gemm2_256x64x64x64_1x4_TypeCast_v1_Nswizzle0_Quant0_MulRoutedWeight0_B16_B16_B16,0.0%,65.59,16417.68
stage2,256,128,7168,256,256,8,ActivationType.Gelu,torch.bfloat16,torch.bfloat16,torch.bfloat16,QuantType.No,1,1,64,0,159.1972,moe_ck2stages_gemm2_256x64x128x64_1x4_TypeCast_v1_Nswizzle0_Quant0_MulRoutedWeight0_B16_B16_B16,0.0%,70.82,17727.96
stage1,256,128,7168,256,256,8,ActivationType.Gelu,torch.bfloat16,torch.bfloat16,torch.bfloat16,QuantType.No,1,1,128,0,310.2792,moe_ck2stages_gemm1_256x128x64x64_1x4_TypeCast_v1_Nswizzle0_Quant0_MulRoutedWeight1_gelu_B16_B16_B16,0.0%,36.34,9095.82
stage1,256,128,7168,256,256,8,ActivationType.Gelu,torch.bfloat16,torch.bfloat16,torch.bfloat16,QuantType.No,1,1,128,0,310.8035,moe_ck2stages_gemm1_256x128x128x64_1x4_TypeCast_v3_Nswizzle0_Quant0_MulRoutedWeight1_gelu_B16_B16_B16,0.0%,36.27,9080.47
stage2,256,128,7168,256,256,8,ActivationType.Gelu,torch.bfloat16,torch.bfloat16,torch.bfloat16,QuantType.No,1,1,128,0,221.0273,moe_ck2stages_gemm2_256x128x128x64_1x4_TypeCast_v1_Nswizzle0_Quant0_MulRoutedWeight0_B16_B16_B16,0.0%,51.01,12768.75
stage2,256,128,7168,256,256,8,ActivationType.Gelu,torch.bfloat16,torch.bfloat16,torch.bfloat16,QuantType.No,1,1,128,0,217.6556,moe_ck2stages_gemm2_256x128x128x64_1x4_TypeCast_v3_Nswizzle0_Quant0_MulRoutedWeight0_B16_B16_B16,0.0%,51.8,12966.55
stage2,256,128,7168,256,256,8,ActivationType.Gelu,torch.bfloat16,torch.bfloat16,torch.bfloat16,QuantType.No,1,1,128,0,225.7116,moe_ck2stages_gemm2_256x128x64x64_1x4_TypeCast_v3_Nswizzle0_Quant0_MulRoutedWeight0_B16_B16_B16,0.0%,49.95,12503.75
stage2,256,128,7168,256,256,8,ActivationType.Gelu,torch.bfloat16,torch.bfloat16,torch.bfloat16,QuantType.No,1,1,128,0,257.4897,moe_ck2stages_gemm2_256x128x64x64_1x4_TypeCast_v1_Nswizzle0_Quant0_MulRoutedWeight0_B16_B16_B16,0.0%,43.79,10960.6
stage1,256,128,7168,256,256,8,ActivationType.Silu,torch.bfloat16,torch.bfloat16,torch.bfloat16,QuantType.No,1,0,32,0,301.6576,moe_ck2stages_gemm1_256x32x64x128_1x4_TypeCast_v1_Nswizzle0_Quant0_MulRoutedWeight0_silu_B16_B16_B16,0.0%,37.37,9355.78
stage1,256,128,7168,256,256,8,ActivationType.Silu,torch.bfloat16,torch.bfloat16,torch.bfloat16,QuantType.No,1,0,32,0,308.1401,moe_ck2stages_gemm1_256x32x64x64_1x4_TypeCast_v1_Nswizzle0_Quant0_MulRoutedWeight0_silu_B16_B16_B16,0.0%,36.59,9158.96
stage2,256,128,7168,256,256,8,ActivationType.Silu,torch.bfloat16,torch.bfloat16,torch.bfloat16,QuantType.No,1,0,32,0,157.9441,moe_ck2stages_gemm2_256x32x128x128_1x4_TypeCast_v1_Nswizzle0_Quant0_MulRoutedWeight1_B16_B16_B16,1.3%,71.38,17868.61
stage2,256,128,7168,256,256,8,ActivationType.Silu,torch.bfloat16,torch.bfloat16,torch.bfloat16,QuantType.No,1,0,32,0,160.4373,moe_ck2stages_gemm2_256x32x64x64_1x4_TypeCast_v1_Nswizzle0_Quant0_MulRoutedWeight1_B16_B16_B16,1.3%,70.27,17590.94
stage1,256,128,7168,256,256,8,ActivationType.Silu,torch.bfloat16,torch.bfloat16,torch.bfloat16,QuantType.No,1,0,64,0,300.9422,moe_ck2stages_gemm1_256x64x64x128_1x4_TypeCast_v1_Nswizzle0_Quant0_MulRoutedWeight0_silu_B16_B16_B16,0.0%,37.46,9378.02
stage1,256,128,7168,256,256,8,ActivationType.Silu,torch.bfloat16,torch.bfloat16,torch.bfloat16,QuantType.No,1,0,64,0,306.5543,moe_ck2stages_gemm1_256x64x64x64_1x4_TypeCast_v1_Nswizzle0_Quant0_MulRoutedWeight0_silu_B16_B16_B16,0.0%,36.78,9206.34
stage2,256,128,7168,256,256,8,ActivationType.Silu,torch.bfloat16,torch.bfloat16,torch.bfloat16,QuantType.No,1,0,64,0,159.7116,moe_ck2stages_gemm2_256x64x128x128_1x4_TypeCast_v1_Nswizzle0_Quant0_MulRoutedWeight1_B16_B16_B16,1.3%,70.59,17670.87
stage2,256,128,7168,256,256,8,ActivationType.Silu,torch.bfloat16,torch.bfloat16,torch.bfloat16,QuantType.No,1,0,64,0,182.0992,moe_ck2stages_gemm2_256x64x64x64_1x4_TypeCast_v1_Nswizzle0_Quant0_MulRoutedWeight1_B16_B16_B16,1.3%,61.91,15498.38
stage2,256,128,7168,256,256,8,ActivationType.Silu,torch.bfloat16,torch.bfloat16,torch.bfloat16,QuantType.No,1,0,64,0,161.441,moe_ck2stages_gemm2_256x64x128x64_1x4_TypeCast_v1_Nswizzle0_Quant0_MulRoutedWeight1_B16_B16_B16,1.3%,69.84,17481.57
stage1,256,128,7168,256,256,8,ActivationType.Silu,torch.bfloat16,torch.bfloat16,torch.bfloat16,QuantType.No,1,0,128,0,308.3377,moe_ck2stages_gemm1_256x128x64x64_1x4_TypeCast_v1_Nswizzle0_Quant0_MulRoutedWeight0_silu_B16_B16_B16,0.0%,36.56,9153.09
stage1,256,128,7168,256,256,8,ActivationType.Silu,torch.bfloat16,torch.bfloat16,torch.bfloat16,QuantType.No,1,0,128,0,309.6944,moe_ck2stages_gemm1_256x128x128x64_1x4_TypeCast_v3_Nswizzle0_Quant0_MulRoutedWeight0_silu_B16_B16_B16,0.0%,36.4,9112.99
stage2,256,128,7168,256,256,8,ActivationType.Silu,torch.bfloat16,torch.bfloat16,torch.bfloat16,QuantType.No,1,0,128,0,234.7929,moe_ck2stages_gemm2_256x128x128x64_1x4_TypeCast_v1_Nswizzle0_Quant0_MulRoutedWeight1_B16_B16_B16,1.3%,48.02,12020.13
stage2,256,128,7168,256,256,8,ActivationType.Silu,torch.bfloat16,torch.bfloat16,torch.bfloat16,QuantType.No,1,0,128,0,230.5319,moe_ck2stages_gemm2_256x128x128x64_1x4_TypeCast_v3_Nswizzle0_Quant0_MulRoutedWeight1_B16_B16_B16,1.3%,48.91,12242.31
stage2,256,128,7168,256,256,8,ActivationType.Silu,torch.bfloat16,torch.bfloat16,torch.bfloat16,QuantType.No,1,0,128,0,240.611,moe_ck2stages_gemm2_256x128x64x64_1x4_TypeCast_v3_Nswizzle0_Quant0_MulRoutedWeight1_B16_B16_B16,1.3%,46.86,11729.48
stage2,256,128,7168,256,256,8,ActivationType.Silu,torch.bfloat16,torch.bfloat16,torch.bfloat16,QuantType.No,1,0,128,0,276.9826,moe_ck2stages_gemm2_256x128x64x64_1x4_TypeCast_v1_Nswizzle0_Quant0_MulRoutedWeight1_B16_B16_B16,1.3%,40.7,10189.24
stage1,256,128,7168,256,256,8,ActivationType.Silu,torch.bfloat16,torch.bfloat16,torch.bfloat16,QuantType.No,1,1,32,0,301.0143,moe_ck2stages_gemm1_256x32x64x128_1x4_TypeCast_v1_Nswizzle0_Quant0_MulRoutedWeight1_silu_B16_B16_B16,0.0%,37.45,9375.77
stage1,256,128,7168,256,256,8,ActivationType.Silu,torch.bfloat16,torch.bfloat16,torch.bfloat16,QuantType.No,1,1,32,0,307.9261,moe_ck2stages_gemm1_256x32x64x64_1x4_TypeCast_v1_Nswizzle0_Quant0_MulRoutedWeight1_silu_B16_B16_B16,0.0%,36.61,9165.32
stage2,256,128,7168,256,256,8,ActivationType.Silu,torch.bfloat16,torch.bfloat16,torch.bfloat16,QuantType.No,1,1,32,0,160.1753,moe_ck2stages_gemm2_256x32x128x128_1x4_TypeCast_v1_Nswizzle0_Quant0_MulRoutedWeight0_B16_B16_B16,0.0%,70.39,17619.71
stage2,256,128,7168,256,256,8,ActivationType.Silu,torch.bfloat16,torch.bfloat16,torch.bfloat16,QuantType.No,1,1,32,0,162.2838,moe_ck2stages_gemm2_256x32x64x64_1x4_TypeCast_v1_Nswizzle0_Quant0_MulRoutedWeight0_B16_B16_B16,0.0%,69.47,17390.78
stage1,256,128,7168,256,256,8,ActivationType.Silu,torch.bfloat16,torch.bfloat16,torch.bfloat16,QuantType.No,1,1,64,0,300.506,moe_ck2stages_gemm1_256x64x64x128_1x4_TypeCast_v1_Nswizzle0_Quant0_MulRoutedWeight1_silu_B16_B16_B16,0.0%,37.52,9391.63
stage1,256,128,7168,256,256,8,ActivationType.Silu,torch.bfloat16,torch.bfloat16,torch.bfloat16,QuantType.No,1,1,64,0,305.8649,moe_ck2stages_gemm1_256x64x64x64_1x4_TypeCast_v1_Nswizzle0_Quant0_MulRoutedWeight1_silu_B16_B16_B16,0.0%,36.86,9227.09
stage2,256,128,7168,256,256,8,ActivationType.Silu,torch.bfloat16,torch.bfloat16,torch.bfloat16,QuantType.No,1,1,64,0,155.6858,moe_ck2stages_gemm2_256x64x128x128_1x4_TypeCast_v1_Nswizzle0_Quant0_MulRoutedWeight0_B16_B16_B16,0.0%,72.42,18127.81
stage2,256,128,7168,256,256,8,ActivationType.Silu,torch.bfloat16,torch.bfloat16,torch.bfloat16,QuantType.No,1,1,64,0,171.8577,moe_ck2stages_gemm2_256x64x64x64_1x4_TypeCast_v1_Nswizzle0_Quant0_MulRoutedWeight0_B16_B16_B16,0.0%,65.6,16421.97
stage2,256,128,7168,256,256,8,ActivationType.Silu,torch.bfloat16,torch.bfloat16,torch.bfloat16,QuantType.No,1,1,64,0,160.0323,moe_ck2stages_gemm2_256x64x128x64_1x4_TypeCast_v1_Nswizzle0_Quant0_MulRoutedWeight0_B16_B16_B16,0.0%,70.45,17635.45
stage1,256,128,7168,256,256,8,ActivationType.Silu,torch.bfloat16,torch.bfloat16,torch.bfloat16,QuantType.No,1,1,128,0,310.6614,moe_ck2stages_gemm1_256x128x64x64_1x4_TypeCast_v1_Nswizzle0_Quant0_MulRoutedWeight1_silu_B16_B16_B16,0.0%,36.29,9084.62
stage1,256,128,7168,256,256,8,ActivationType.Silu,torch.bfloat16,torch.bfloat16,torch.bfloat16,QuantType.No,1,1,128,0,310.0613,moe_ck2stages_gemm1_256x128x128x64_1x4_TypeCast_v3_Nswizzle0_Quant0_MulRoutedWeight1_silu_B16_B16_B16,0.0%,36.36,9102.21
stage2,256,128,7168,256,256,8,ActivationType.Silu,torch.bfloat16,torch.bfloat16,torch.bfloat16,QuantType.No,1,1,128,0,221.5223,moe_ck2stages_gemm2_256x128x128x64_1x4_TypeCast_v1_Nswizzle0_Quant0_MulRoutedWeight0_B16_B16_B16,0.0%,50.89,12740.22
stage2,256,128,7168,256,256,8,ActivationType.Silu,torch.bfloat16,torch.bfloat16,torch.bfloat16,QuantType.No,1,1,128,0,217.9037,moe_ck2stages_gemm2_256x128x128x64_1x4_TypeCast_v3_Nswizzle0_Quant0_MulRoutedWeight0_B16_B16_B16,0.0%,51.74,12951.79
stage2,256,128,7168,256,256,8,ActivationType.Silu,torch.bfloat16,torch.bfloat16,torch.bfloat16,QuantType.No,1,1,128,0,226.3492,moe_ck2stages_gemm2_256x128x64x64_1x4_TypeCast_v3_Nswizzle0_Quant0_MulRoutedWeight0_B16_B16_B16,0.0%,49.81,12468.53
stage2,256,128,7168,256,256,8,ActivationType.Silu,torch.bfloat16,torch.bfloat16,torch.bfloat16,QuantType.No,1,1,128,0,256.5865,moe_ck2stages_gemm2_256x128x64x64_1x4_TypeCast_v1_Nswizzle0_Quant0_MulRoutedWeight0_B16_B16_B16,0.0%,43.94,10999.18
stage1,256,128,7168,512,256,8,ActivationType.Gelu,torch.bfloat16,torch.bfloat16,torch.bfloat16,QuantType.No,1,0,32,0,613.5751,moe_ck2stages_gemm1_256x32x64x128_1x4_TypeCast_v1_Nswizzle0_Quant0_MulRoutedWeight0_gelu_B16_B16_B16,0.0%,36.75,9193.36
stage1,256,128,7168,512,256,8,ActivationType.Gelu,torch.bfloat16,torch.bfloat16,torch.bfloat16,QuantType.No,1,0,32,0,617.4087,moe_ck2stages_gemm1_256x32x64x64_1x4_TypeCast_v1_Nswizzle0_Quant0_MulRoutedWeight0_gelu_B16_B16_B16,0.0%,36.52,9136.27
stage2,256,128,7168,512,256,8,ActivationType.Gelu,torch.bfloat16,torch.bfloat16,torch.bfloat16,QuantType.No,1,0,32,0,309.332,moe_ck2stages_gemm2_256x32x128x128_1x4_TypeCast_v1_Nswizzle0_Quant0_MulRoutedWeight1_B16_B16_B16,3.3%,72.89,18235.47
stage2,256,128,7168,512,256,8,ActivationType.Gelu,torch.bfloat16,torch.bfloat16,torch.bfloat16,QuantType.No,1,0,32,0,316.4329,moe_ck2stages_gemm2_256x32x64x64_1x4_TypeCast_v1_Nswizzle0_Quant0_MulRoutedWeight1_B16_B16_B16,3.3%,71.26,17826.26
stage1,256,128,7168,512,256,8,ActivationType.Gelu,torch.bfloat16,torch.bfloat16,torch.bfloat16,QuantType.No,1,0,64,0,612.6615,moe_ck2stages_gemm1_256x64x64x128_1x4_TypeCast_v1_Nswizzle0_Quant0_MulRoutedWeight0_gelu_B16_B16_B16,0.0%,36.8,9207.07
stage1,256,128,7168,512,256,8,ActivationType.Gelu,torch.bfloat16,torch.bfloat16,torch.bfloat16,QuantType.No,1,0,64,0,620.0257,moe_ck2stages_gemm1_256x64x64x64_1x4_TypeCast_v1_Nswizzle0_Quant0_MulRoutedWeight0_gelu_B16_B16_B16,0.0%,36.37,9097.71
stage2,256,128,7168,512,256,8,ActivationType.Gelu,torch.bfloat16,torch.bfloat16,torch.bfloat16,QuantType.No,1,0,64,0,308.2598,moe_ck2stages_gemm2_256x64x128x128_1x4_TypeCast_v1_Nswizzle0_Quant0_MulRoutedWeight1_B16_B16_B16,3.3%,73.15,18298.9
stage2,256,128,7168,512,256,8,ActivationType.Gelu,torch.bfloat16,torch.bfloat16,torch.bfloat16,QuantType.No,1,0,64,0,311.2167,moe_ck2stages_gemm2_256x64x64x64_1x4_TypeCast_v1_Nswizzle0_Quant0_MulRoutedWeight1_B16_B16_B16,3.3%,72.45,18125.04
stage2,256,128,7168,512,256,8,ActivationType.Gelu,torch.bfloat16,torch.bfloat16,torch.bfloat16,QuantType.No,1,0,64,0,310.5613,moe_ck2stages_gemm2_256x64x128x64_1x4_TypeCast_v1_Nswizzle0_Quant0_MulRoutedWeight1_B16_B16_B16,3.3%,72.61,18163.29
stage1,256,128,7168,512,256,8,ActivationType.Gelu,torch.bfloat16,torch.bfloat16,torch.bfloat16,QuantType.No,1,0,128,0,635.9074,moe_ck2stages_gemm1_256x128x64x64_1x4_TypeCast_v1_Nswizzle0_Quant0_MulRoutedWeight0_gelu_B16_B16_B16,0.0%,35.46,8870.5
stage1,256,128,7168,512,256,8,ActivationType.Gelu,torch.bfloat16,torch.bfloat16,torch.bfloat16,QuantType.No,1,0,128,0,630.7438,moe_ck2stages_gemm1_256x128x128x64_1x4_TypeCast_v3_Nswizzle0_Quant0_MulRoutedWeight0_gelu_B16_B16_B16,0.0%,35.75,8943.12
stage2,256,128,7168,512,256,8,ActivationType.Gelu,torch.bfloat16,torch.bfloat16,torch.bfloat16,QuantType.No,1,0,128,0,357.6486,moe_ck2stages_gemm2_256x128x128x64_1x4_TypeCast_v1_Nswizzle0_Quant0_MulRoutedWeight1_B16_B16_B16,3.3%,63.05,15771.95
stage2,256,128,7168,512,256,8,ActivationType.Gelu,torch.bfloat16,torch.bfloat16,torch.bfloat16,QuantType.No,1,0,128,0,358.0765,moe_ck2stages_gemm2_256x128x128x64_1x4_TypeCast_v3_Nswizzle0_Quant0_MulRoutedWeight1_B16_B16_B16,3.3%,62.97,15753.1
stage2,256,128,7168,512,256,8,ActivationType.Gelu,torch.bfloat16,torch.bfloat16,torch.bfloat16,QuantType.No,1,0,128,0,369.7214,moe_ck2stages_gemm2_256x128x64x64_1x4_TypeCast_v3_Nswizzle0_Quant0_MulRoutedWeight1_B16_B16_B16,3.3%,60.99,15256.93
stage2,256,128,7168,512,256,8,ActivationType.Gelu,torch.bfloat16,torch.bfloat16,torch.bfloat16,QuantType.No,1,0,128,0,405.7178,moe_ck2stages_gemm2_256x128x64x64_1x4_TypeCast_v1_Nswizzle0_Quant0_MulRoutedWeight1_B16_B16_B16,3.3%,55.58,13903.3
stage1,256,128,7168,512,256,8,ActivationType.Gelu,torch.bfloat16,torch.bfloat16,torch.bfloat16,QuantType.No,1,1,32,0,619.5687,moe_ck2stages_gemm1_256x32x64x128_1x4_TypeCast_v1_Nswizzle0_Quant0_MulRoutedWeight1_gelu_B16_B16_B16,0.0%,36.39,9104.42
stage1,256,128,7168,512,256,8,ActivationType.Gelu,torch.bfloat16,torch.bfloat16,torch.bfloat16,QuantType.No,1,1,32,0,619.5828,moe_ck2stages_gemm1_256x32x64x64_1x4_TypeCast_v1_Nswizzle0_Quant0_MulRoutedWeight1_gelu_B16_B16_B16,0.0%,36.39,9104.21
stage2,256,128,7168,512,256,8,ActivationType.Gelu,torch.bfloat16,torch.bfloat16,torch.bfloat16,QuantType.No,1,1,32,0,309.0008,moe_ck2stages_gemm2_256x32x128x128_1x4_TypeCast_v1_Nswizzle0_Quant0_MulRoutedWeight0_B16_B16_B16,0.0%,72.97,18255.02
stage2,256,128,7168,512,256,8,ActivationType.Gelu,torch.bfloat16,torch.bfloat16,torch.bfloat16,QuantType.No,1,1,32,0,318.6502,moe_ck2stages_gemm2_256x32x64x64_1x4_TypeCast_v1_Nswizzle0_Quant0_MulRoutedWeight0_B16_B16_B16,0.0%,70.76,17702.22
stage1,256,128,7168,512,256,8,ActivationType.Gelu,torch.bfloat16,torch.bfloat16,torch.bfloat16,QuantType.No,1,1,64,0,613.4498,moe_ck2stages_gemm1_256x64x64x128_1x4_TypeCast_v1_Nswizzle0_Quant0_MulRoutedWeight1_gelu_B16_B16_B16,0.0%,36.76,9195.23
stage1,256,128,7168,512,256,8,ActivationType.Gelu,torch.bfloat16,torch.bfloat16,torch.bfloat16,QuantType.No,1,1,64,0,620.5512,moe_ck2stages_gemm1_256x64x64x64_1x4_TypeCast_v1_Nswizzle0_Quant0_MulRoutedWeight1_gelu_B16_B16_B16,0.0%,36.34,9090.01
stage2,256,128,7168,512,256,8,ActivationType.Gelu,torch.bfloat16,torch.bfloat16,torch.bfloat16,QuantType.No,1,1,64,0,303.6072,moe_ck2stages_gemm2_256x64x128x128_1x4_TypeCast_v1_Nswizzle0_Quant0_MulRoutedWeight0_B16_B16_B16,0.0%,74.27,18579.32
stage2,256,128,7168,512,256,8,ActivationType.Gelu,torch.bfloat16,torch.bfloat16,torch.bfloat16,QuantType.No,1,1,64,0,308.7348,moe_ck2stages_gemm2_256x64x64x64_1x4_TypeCast_v1_Nswizzle0_Quant0_MulRoutedWeight0_B16_B16_B16,0.0%,73.04,18270.74
stage2,256,128,7168,512,256,8,ActivationType.Gelu,torch.bfloat16,torch.bfloat16,torch.bfloat16,QuantType.No,1,1,64,0,308.6921,moe_ck2stages_gemm2_256x64x128x64_1x4_TypeCast_v1_Nswizzle0_Quant0_MulRoutedWeight0_B16_B16_B16,0.0%,73.05,18273.27
stage1,256,128,7168,512,256,8,ActivationType.Gelu,torch.bfloat16,torch.bfloat16,torch.bfloat16,QuantType.No,1,1,128,0,624.5101,moe_ck2stages_gemm1_256x128x64x64_1x4_TypeCast_v1_Nswizzle0_Quant0_MulRoutedWeight1_gelu_B16_B16_B16,0.0%,36.11,9032.38
stage1,256,128,7168,512,256,8,ActivationType.Gelu,torch.bfloat16,torch.bfloat16,torch.bfloat16,QuantType.No,1,1,128,0,624.7709,moe_ck2stages_gemm1_256x128x128x64_1x4_TypeCast_v3_Nswizzle0_Quant0_MulRoutedWeight1_gelu_B16_B16_B16,0.0%,36.09,9028.61
stage2,256,128,7168,512,256,8,ActivationType.Gelu,torch.bfloat16,torch.bfloat16,torch.bfloat16,QuantType.No,1,1,128,0,341.6418,moe_ck2stages_gemm2_256x128x128x64_1x4_TypeCast_v1_Nswizzle0_Quant0_MulRoutedWeight0_B16_B16_B16,0.0%,66.0,16510.9
stage2,256,128,7168,512,256,8,ActivationType.Gelu,torch.bfloat16,torch.bfloat16,torch.bfloat16,QuantType.No,1,1,128,0,339.3805,moe_ck2stages_gemm2_256x128x128x64_1x4_TypeCast_v3_Nswizzle0_Quant0_MulRoutedWeight0_B16_B16_B16,0.0%,66.44,16620.92
stage2,256,128,7168,512,256,8,ActivationType.Gelu,torch.bfloat16,torch.bfloat16,torch.bfloat16,QuantType.No,1,1,128,0,347.8518,moe_ck2stages_gemm2_256x128x64x64_1x4_TypeCast_v3_Nswizzle0_Quant0_MulRoutedWeight0_B16_B16_B16,0.0%,64.82,16216.14
stage2,256,128,7168,512,256,8,ActivationType.Gelu,torch.bfloat16,torch.bfloat16,torch.bfloat16,QuantType.No,1,1,128,0,387.2243,moe_ck2stages_gemm2_256x128x64x64_1x4_TypeCast_v1_Nswizzle0_Quant0_MulRoutedWeight0_B16_B16_B16,0.0%,58.23,14567.31
stage1,256,128,7168,512,256,8,ActivationType.Silu,torch.bfloat16,torch.bfloat16,torch.bfloat16,QuantType.No,1,0,32,0,612.0341,moe_ck2stages_gemm1_256x32x64x128_1x4_TypeCast_v1_Nswizzle0_Quant0_MulRoutedWeight0_silu_B16_B16_B16,0.0%,36.84,9216.5
stage1,256,128,7168,512,256,8,ActivationType.Silu,torch.bfloat16,torch.bfloat16,torch.bfloat16,QuantType.No,1,0,32,0,642.0365,moe_ck2stages_gemm1_256x32x64x64_1x4_TypeCast_v1_Nswizzle0_Quant0_MulRoutedWeight0_silu_B16_B16_B16,0.0%,35.12,8785.82
stage2,256,128,7168,512,256,8,ActivationType.Silu,torch.bfloat16,torch.bfloat16,torch.bfloat16,QuantType.No,1,0,32,0,308.4274,moe_ck2stages_gemm2_256x32x128x128_1x4_TypeCast_v1_Nswizzle0_Quant0_MulRoutedWeight1_B16_B16_B16,2.8%,73.11,18288.95
stage2,256,128,7168,512,256,8,ActivationType.Silu,torch.bfloat16,torch.bfloat16,torch.bfloat16,QuantType.No,1,0,32,0,316.0597,moe_ck2stages_gemm2_256x32x64x64_1x4_TypeCast_v1_Nswizzle0_Quant0_MulRoutedWeight1_B16_B16_B16,2.8%,71.34,17847.31
stage1,256,128,7168,512,256,8,ActivationType.Silu,torch.bfloat16,torch.bfloat16,torch.bfloat16,QuantType.No,1,0,64,0,611.5901,moe_ck2stages_gemm1_256x64x64x128_1x4_TypeCast_v1_Nswizzle0_Quant0_MulRoutedWeight0_silu_B16_B16_B16,0.0%,36.87,9223.19
stage1,256,128,7168,512,256,8,ActivationType.Silu,torch.bfloat16,torch.bfloat16,torch.bfloat16,QuantType.No,1,0,64,0,620.0675,moe_ck2stages_gemm1_256x64x64x64_1x4_TypeCast_v1_Nswizzle0_Quant0_MulRoutedWeight0_silu_B16_B16_B16,0.0%,36.36,9097.1
stage2,256,128,7168,512,256,8,ActivationType.Silu,torch.bfloat16,torch.bfloat16,torch.bfloat16,QuantType.No,1,0,64,0,309.1546,moe_ck2stages_gemm2_256x64x128x128_1x4_TypeCast_v1_Nswizzle0_Quant0_MulRoutedWeight1_B16_B16_B16,2.8%,72.94,18245.93
stage2,256,128,7168,512,256,8,ActivationType.Silu,torch.bfloat16,torch.bfloat16,torch.bfloat16,QuantType.No,1,0,64,0,311.6479,moe_ck2stages_gemm2_256x64x64x64_1x4_TypeCast_v1_Nswizzle0_Quant0_MulRoutedWeight1_B16_B16_B16,2.8%,72.35,18099.96
stage2,256,128,7168,512,256,8,ActivationType.Silu,torch.bfloat16,torch.bfloat16,torch.bfloat16,QuantType.No,1,0,64,0,307.2967,moe_ck2stages_gemm2_256x64x128x64_1x4_TypeCast_v1_Nswizzle0_Quant0_MulRoutedWeight1_B16_B16_B16,2.8%,73.38,18356.25
stage1,256,128,7168,512,256,8,ActivationType.Silu,torch.bfloat16,torch.bfloat16,torch.bfloat16,QuantType.No,1,0,128,0,620.6612,moe_ck2stages_gemm1_256x128x64x64_1x4_TypeCast_v1_Nswizzle0_Quant0_MulRoutedWeight0_silu_B16_B16_B16,0.0%,36.33,9088.4
stage1,256,128,7168,512,256,8,ActivationType.Silu,torch.bfloat16,torch.bfloat16,torch.bfloat16,QuantType.No,1,0,128,0,622.1692,moe_ck2stages_gemm1_256x128x128x64_1x4_TypeCast_v3_Nswizzle0_Quant0_MulRoutedWeight0_silu_B16_B16_B16,0.0%,36.24,9066.37
stage2,256,128,7168,512,256,8,ActivationType.Silu,torch.bfloat16,torch.bfloat16,torch.bfloat16,QuantType.No,1,0,128,0,355.7153,moe_ck2stages_gemm2_256x128x128x64_1x4_TypeCast_v1_Nswizzle0_Quant0_MulRoutedWeight1_B16_B16_B16,2.8%,63.39,15857.67
stage2,256,128,7168,512,256,8,ActivationType.Silu,torch.bfloat16,torch.bfloat16,torch.bfloat16,QuantType.No,1,0,128,0,357.889,moe_ck2stages_gemm2_256x128x128x64_1x4_TypeCast_v3_Nswizzle0_Quant0_MulRoutedWeight1_B16_B16_B16,2.8%,63.0,15761.35
stage2,256,128,7168,512,256,8,ActivationType.Silu,torch.bfloat16,torch.bfloat16,torch.bfloat16,QuantType.No,1,0,128,0,369.0414,moe_ck2stages_gemm2_256x128x64x64_1x4_TypeCast_v3_Nswizzle0_Quant0_MulRoutedWeight1_B16_B16_B16,2.8%,61.1,15285.05
stage2,256,128,7168,512,256,8,ActivationType.Silu,torch.bfloat16,torch.bfloat16,torch.bfloat16,QuantType.No,1,0,128,0,410.6173,moe_ck2stages_gemm2_256x128x64x64_1x4_TypeCast_v1_Nswizzle0_Quant0_MulRoutedWeight1_B16_B16_B16,2.8%,54.91,13737.4
stage1,256,128,7168,512,256,8,ActivationType.Silu,torch.bfloat16,torch.bfloat16,torch.bfloat16,QuantType.No,1,1,32,0,610.4397,moe_ck2stages_gemm1_256x32x64x128_1x4_TypeCast_v1_Nswizzle0_Quant0_MulRoutedWeight1_silu_B16_B16_B16,0.0%,36.94,9240.58
stage1,256,128,7168,512,256,8,ActivationType.Silu,torch.bfloat16,torch.bfloat16,torch.bfloat16,QuantType.No,1,1,32,0,641.9366,moe_ck2stages_gemm1_256x32x64x64_1x4_TypeCast_v1_Nswizzle0_Quant0_MulRoutedWeight1_silu_B16_B16_B16,0.0%,35.13,8787.18
stage2,256,128,7168,512,256,8,ActivationType.Silu,torch.bfloat16,torch.bfloat16,torch.bfloat16,QuantType.No,1,1,32,0,309.2271,moe_ck2stages_gemm2_256x32x128x128_1x4_TypeCast_v1_Nswizzle0_Quant0_MulRoutedWeight0_B16_B16_B16,0.0%,72.92,18241.66
stage2,256,128,7168,512,256,8,ActivationType.Silu,torch.bfloat16,torch.bfloat16,torch.bfloat16,QuantType.No,1,1,32,0,318.6258,moe_ck2stages_gemm2_256x32x64x64_1x4_TypeCast_v1_Nswizzle0_Quant0_MulRoutedWeight0_B16_B16_B16,0.0%,70.77,17703.57
stage1,256,128,7168,512,256,8,ActivationType.Silu,torch.bfloat16,torch.bfloat16,torch.bfloat16,QuantType.No,1,1,64,0,612.3876,moe_ck2stages_gemm1_256x64x64x128_1x4_TypeCast_v1_Nswizzle0_Quant0_MulRoutedWeight1_silu_B16_B16_B16,0.0%,36.82,9211.18
stage1,256,128,7168,512,256,8,ActivationType.Silu,torch.bfloat16,torch.bfloat16,torch.bfloat16,QuantType.No,1,1,64,0,618.827,moe_ck2stages_gemm1_256x64x64x64_1x4_TypeCast_v1_Nswizzle0_Quant0_MulRoutedWeight1_silu_B16_B16_B16,0.0%,36.44,9115.33
stage2,256,128,7168,512,256,8,ActivationType.Silu,torch.bfloat16,torch.bfloat16,torch.bfloat16,QuantType.No,1,1,64,0,302.8188,moe_ck2stages_gemm2_256x64x128x128_1x4_TypeCast_v1_Nswizzle0_Quant0_MulRoutedWeight0_B16_B16_B16,0.0%,74.46,18627.69
stage2,256,128,7168,512,256,8,ActivationType.Silu,torch.bfloat16,torch.bfloat16,torch.bfloat16,QuantType.No,1,1,64,0,311.0886,moe_ck2stages_gemm2_256x64x64x64_1x4_TypeCast_v1_Nswizzle0_Quant0_MulRoutedWeight0_B16_B16_B16,0.0%,72.48,18132.5
stage2,256,128,7168,512,256,8,ActivationType.Silu,torch.bfloat16,torch.bfloat16,torch.bfloat16,QuantType.No,1,1,64,0,308.4449,moe_ck2stages_gemm2_256x64x128x64_1x4_TypeCast_v1_Nswizzle0_Quant0_MulRoutedWeight0_B16_B16_B16,0.0%,73.1,18287.92
stage1,256,128,7168,512,256,8,ActivationType.Silu,torch.bfloat16,torch.bfloat16,torch.bfloat16,QuantType.No,1,1,128,0,625.8587,moe_ck2stages_gemm1_256x128x64x64_1x4_TypeCast_v1_Nswizzle0_Quant0_MulRoutedWeight1_silu_B16_B16_B16,0.0%,36.03,9012.92
stage1,256,128,7168,512,256,8,ActivationType.Silu,torch.bfloat16,torch.bfloat16,torch.bfloat16,QuantType.No,1,1,128,0,623.1681,moe_ck2stages_gemm1_256x128x128x64_1x4_TypeCast_v3_Nswizzle0_Quant0_MulRoutedWeight1_silu_B16_B16_B16,0.0%,36.18,9051.83
stage2,256,128,7168,512,256,8,ActivationType.Silu,torch.bfloat16,torch.bfloat16,torch.bfloat16,QuantType.No,1,1,128,0,343.357,moe_ck2stages_gemm2_256x128x128x64_1x4_TypeCast_v1_Nswizzle0_Quant0_MulRoutedWeight0_B16_B16_B16,0.0%,65.67,16428.42
stage2,256,128,7168,512,256,8,ActivationType.Silu,torch.bfloat16,torch.bfloat16,torch.bfloat16,QuantType.No,1,1,128,0,341.009,moe_ck2stages_gemm2_256x128x128x64_1x4_TypeCast_v3_Nswizzle0_Quant0_MulRoutedWeight0_B16_B16_B16,0.0%,66.12,16541.54
stage2,256,128,7168,512,256,8,ActivationType.Silu,torch.bfloat16,torch.bfloat16,torch.bfloat16,QuantType.No,1,1,128,0,347.9877,moe_ck2stages_gemm2_256x128x64x64_1x4_TypeCast_v3_Nswizzle0_Quant0_MulRoutedWeight0_B16_B16_B16,0.0%,64.8,16209.81
stage2,256,128,7168,512,256,8,ActivationType.Silu,torch.bfloat16,torch.bfloat16,torch.bfloat16,QuantType.No,1,1,128,0,386.757,moe_ck2stages_gemm2_256x128x64x64_1x4_TypeCast_v1_Nswizzle0_Quant0_MulRoutedWeight0_B16_B16_B16,0.0%,58.3,14584.91
stage1,256,16,2048,192,128,8,ActivationType.Gelu,torch.bfloat16,torch.bfloat16,torch.bfloat16,QuantType.No,1,0,32,0,25.7961,moe_ck2stages_gemm1_256x32x64x128_1x4_TypeCast_v1_Nswizzle0_Quant0_MulRoutedWeight0_gelu_B16_B16_B16,0.0%,11.71,11711.89
stage1,256,16,2048,192,128,8,ActivationType.Gelu,torch.bfloat16,torch.bfloat16,torch.bfloat16,QuantType.No,1,0,32,0,27.5966,moe_ck2stages_gemm1_256x32x64x64_1x4_TypeCast_v1_Nswizzle0_Quant0_MulRoutedWeight0_gelu_B16_B16_B16,0.0%,10.94,10947.76
stage2,256,16,2048,192,128,8,ActivationType.Gelu,torch.bfloat16,torch.bfloat16,torch.bfloat16,QuantType.No,1,0,32,0,inf,moe_ck2stages_gemm2_256x32x128x128_1x4_TypeCast_v1_Nswizzle0_Quant0_MulRoutedWeight1_B16_B16_B16,100.0%,0.0,0.0
stage2,256,16,2048,192,128,8,ActivationType.Gelu,torch.bfloat16,torch.bfloat16,torch.bfloat16,QuantType.No,1,0,32,0,19.6763,moe_ck2stages_gemm2_256x32x64x64_1x4_TypeCast_v1_Nswizzle0_Quant0_MulRoutedWeight1_B16_B16_B16,0.0%,15.35,15354.56
stage1,256,16,2048,192,128,8,ActivationType.Gelu,torch.bfloat16,torch.bfloat16,torch.bfloat16,QuantType.No,1,0,64,0,26.6824,moe_ck2stages_gemm1_256x64x64x128_1x4_TypeCast_v1_Nswizzle0_Quant0_MulRoutedWeight0_gelu_B16_B16_B16,0.0%,11.32,11322.86
stage1,256,16,2048,192,128,8,ActivationType.Gelu,torch.bfloat16,torch.bfloat16,torch.bfloat16,QuantType.No,1,0,64,0,28.6922,moe_ck2stages_gemm1_256x64x64x64_1x4_TypeCast_v1_Nswizzle0_Quant0_MulRoutedWeight0_gelu_B16_B16_B16,0.0%,10.53,10529.72
stage2,256,16,2048,192,128,8,ActivationType.Gelu,torch.bfloat16,torch.bfloat16,torch.bfloat16,QuantType.No,1,0,64,0,inf,moe_ck2stages_gemm2_256x64x128x128_1x4_TypeCast_v1_Nswizzle0_Quant0_MulRoutedWeight1_B16_B16_B16,100.0%,0.0,0.0
stage2,256,16,2048,192,128,8,ActivationType.Gelu,torch.bfloat16,torch.bfloat16,torch.bfloat16,QuantType.No,1,0,64,0,22.6313,moe_ck2stages_gemm2_256x64x64x64_1x4_TypeCast_v1_Nswizzle0_Quant0_MulRoutedWeight1_B16_B16_B16,0.0%,13.34,13349.7
stage2,256,16,2048,192,128,8,ActivationType.Gelu,torch.bfloat16,torch.bfloat16,torch.bfloat16,QuantType.No,1,0,64,0,22.4991,moe_ck2stages_gemm2_256x64x128x64_1x4_TypeCast_v1_Nswizzle0_Quant0_MulRoutedWeight1_B16_B16_B16,0.0%,13.42,13428.14
stage1,256,16,2048,192,128,8,ActivationType.Gelu,torch.bfloat16,torch.bfloat16,torch.bfloat16,QuantType.No,1,0,128,0,31.6514,moe_ck2stages_gemm1_256x128x64x64_1x4_TypeCast_v1_Nswizzle0_Quant0_MulRoutedWeight0_gelu_B16_B16_B16,0.0%,9.54,9545.26
stage1,256,16,2048,192,128,8,ActivationType.Gelu,torch.bfloat16,torch.bfloat16,torch.bfloat16,QuantType.No,1,0,128,0,inf,moe_ck2stages_gemm1_256x128x128x64_1x4_TypeCast_v3_Nswizzle0_Quant0_MulRoutedWeight0_gelu_B16_B16_B16,100.0%,0.0,0.0
stage2,256,16,2048,192,128,8,ActivationType.Gelu,torch.bfloat16,torch.bfloat16,torch.bfloat16,QuantType.No,1,0,128,0,29.8555,moe_ck2stages_gemm2_256x128x128x64_1x4_TypeCast_v1_Nswizzle0_Quant0_MulRoutedWeight1_B16_B16_B16,0.0%,10.12,10119.44
stage2,256,16,2048,192,128,8,ActivationType.Gelu,torch.bfloat16,torch.bfloat16,torch.bfloat16,QuantType.No,1,0,128,0,29.9485,moe_ck2stages_gemm2_256x128x128x64_1x4_TypeCast_v3_Nswizzle0_Quant0_MulRoutedWeight1_B16_B16_B16,0.0%,10.08,10088.02
stage2,256,16,2048,192,128,8,ActivationType.Gelu,torch.bfloat16,torch.bfloat16,torch.bfloat16,QuantType.No,1,0,128,0,30.1684,moe_ck2stages_gemm2_256x128x64x64_1x4_TypeCast_v3_Nswizzle0_Quant0_MulRoutedWeight1_B16_B16_B16,0.0%,10.01,10014.48
stage2,256,16,2048,192,128,8,ActivationType.Gelu,torch.bfloat16,torch.bfloat16,torch.bfloat16,QuantType.No,1,0,128,0,32.7507,moe_ck2stages_gemm2_256x128x64x64_1x4_TypeCast_v1_Nswizzle0_Quant0_MulRoutedWeight1_B16_B16_B16,0.0%,9.22,9224.87
stage1,256,16,2048,192,128,8,ActivationType.Gelu,torch.bfloat16,torch.bfloat16,torch.bfloat16,QuantType.No,1,1,32,0,26.9684,moe_ck2stages_gemm1_256x32x64x128_1x4_TypeCast_v1_Nswizzle0_Quant0_MulRoutedWeight1_gelu_B16_B16_B16,0.0%,11.2,11202.78
stage1,256,16,2048,192,128,8,ActivationType.Gelu,torch.bfloat16,torch.bfloat16,torch.bfloat16,QuantType.No,1,1,32,0,29.0096,moe_ck2stages_gemm1_256x32x64x64_1x4_TypeCast_v1_Nswizzle0_Quant0_MulRoutedWeight1_gelu_B16_B16_B16,0.0%,10.41,10414.52
stage2,256,16,2048,192,128,8,ActivationType.Gelu,torch.bfloat16,torch.bfloat16,torch.bfloat16,QuantType.No,1,1,32,0,inf,moe_ck2stages_gemm2_256x32x128x128_1x4_TypeCast_v1_Nswizzle0_Quant0_MulRoutedWeight0_B16_B16_B16,100.0%,0.0,0.0
stage2,256,16,2048,192,128,8,ActivationType.Gelu,torch.bfloat16,torch.bfloat16,torch.bfloat16,QuantType.No,1,1,32,0,18.8545,moe_ck2stages_gemm2_256x32x64x64_1x4_TypeCast_v1_Nswizzle0_Quant0_MulRoutedWeight0_B16_B16_B16,0.0%,16.02,16023.81
stage1,256,16,2048,192,128,8,ActivationType.Gelu,torch.bfloat16,torch.bfloat16,torch.bfloat16,QuantType.No,1,1,64,0,27.9709,moe_ck2stages_gemm1_256x64x64x128_1x4_TypeCast_v1_Nswizzle0_Quant0_MulRoutedWeight1_gelu_B16_B16_B16,0.0%,10.8,10801.26
stage1,256,16,2048,192,128,8,ActivationType.Gelu,torch.bfloat16,torch.bfloat16,torch.bfloat16,QuantType.No,1,1,64,0,30.6555,moe_ck2stages_gemm1_256x64x64x64_1x4_TypeCast_v1_Nswizzle0_Quant0_MulRoutedWeight1_gelu_B16_B16_B16,0.0%,9.85,9855.36
stage2,256,16,2048,192,128,8,ActivationType.Gelu,torch.bfloat16,torch.bfloat16,torch.bfloat16,QuantType.No,1,1,64,0,inf,moe_ck2stages_gemm2_256x64x128x128_1x4_TypeCast_v1_Nswizzle0_Quant0_MulRoutedWeight0_B16_B16_B16,100.0%,0.0,0.0
stage2,256,16,2048,192,128,8,ActivationType.Gelu,torch.bfloat16,torch.bfloat16,torch.bfloat16,QuantType.No,1,1,64,0,21.4903,moe_ck2stages_gemm2_256x64x64x64_1x4_TypeCast_v1_Nswizzle0_Quant0_MulRoutedWeight0_B16_B16_B16,0.0%,14.05,14058.48
stage2,256,16,2048,192,128,8,ActivationType.Gelu,torch.bfloat16,torch.bfloat16,torch.bfloat16,QuantType.No,1,1,64,0,21.4947,moe_ck2stages_gemm2_256x64x128x64_1x4_TypeCast_v1_Nswizzle0_Quant0_MulRoutedWeight0_B16_B16_B16,0.0%,14.05,14055.6
stage1,256,16,2048,192,128,8,ActivationType.Gelu,torch.bfloat16,torch.bfloat16,torch.bfloat16,QuantType.No,1,1,128,0,34.2086,moe_ck2stages_gemm1_256x128x64x64_1x4_TypeCast_v1_Nswizzle0_Quant0_MulRoutedWeight1_gelu_B16_B16_B16,0.0%,8.83,8831.73
stage1,256,16,2048,192,128,8,ActivationType.Gelu,torch.bfloat16,torch.bfloat16,torch.bfloat16,QuantType.No,1,1,128,0,inf,moe_ck2stages_gemm1_256x128x128x64_1x4_TypeCast_v3_Nswizzle0_Quant0_MulRoutedWeight1_gelu_B16_B16_B16,100.0%,0.0,0.0
stage2,256,16,2048,192,128,8,ActivationType.Gelu,torch.bfloat16,torch.bfloat16,torch.bfloat16,QuantType.No,1,1,128,0,28.6839,moe_ck2stages_gemm2_256x128x128x64_1x4_TypeCast_v1_Nswizzle0_Quant0_MulRoutedWeight0_B16_B16_B16,0.0%,10.53,10532.77
stage2,256,16,2048,192,128,8,ActivationType.Gelu,torch.bfloat16,torch.bfloat16,torch.bfloat16,QuantType.No,1,1,128,0,28.314,moe_ck2stages_gemm2_256x128x128x64_1x4_TypeCast_v3_Nswizzle0_Quant0_MulRoutedWeight0_B16_B16_B16,0.0%,10.67,10670.37
stage2,256,16,2048,192,128,8,ActivationType.Gelu,torch.bfloat16,torch.bfloat16,torch.bfloat16,QuantType.No,1,1,128,0,27.0169,moe_ck2stages_gemm2_256x128x64x64_1x4_TypeCast_v3_Nswizzle0_Quant0_MulRoutedWeight0_B16_B16_B16,0.0%,11.18,11182.67
stage2,256,16,2048,192,128,8,ActivationType.Gelu,torch.bfloat16,torch.bfloat16,torch.bfloat16,QuantType.No,1,1,128,0,30.373,moe_ck2stages_gemm2_256x128x64x64_1x4_TypeCast_v1_Nswizzle0_Quant0_MulRoutedWeight0_B16_B16_B16,0.0%,9.94,9947.02
stage1,256,16,2048,192,128,8,ActivationType.Silu,torch.bfloat16,torch.bfloat16,torch.bfloat16,QuantType.No,1,0,32,0,25.7306,moe_ck2stages_gemm1_256x32x64x128_1x4_TypeCast_v1_Nswizzle0_Quant0_MulRoutedWeight0_silu_B16_B16_B16,0.0%,11.74,11741.7
stage1,256,16,2048,192,128,8,ActivationType.Silu,torch.bfloat16,torch.bfloat16,torch.bfloat16,QuantType.No,1,0,32,0,28.8571,moe_ck2stages_gemm1_256x32x64x64_1x4_TypeCast_v1_Nswizzle0_Quant0_MulRoutedWeight0_silu_B16_B16_B16,0.0%,10.47,10469.55
stage2,256,16,2048,192,128,8,ActivationType.Silu,torch.bfloat16,torch.bfloat16,torch.bfloat16,QuantType.No,1,0,32,0,inf,moe_ck2stages_gemm2_256x32x128x128_1x4_TypeCast_v1_Nswizzle0_Quant0_MulRoutedWeight1_B16_B16_B16,100.0%,0.0,0.0
stage2,256,16,2048,192,128,8,ActivationType.Silu,torch.bfloat16,torch.bfloat16,torch.bfloat16,QuantType.No,1,0,32,0,19.1039,moe_ck2stages_gemm2_256x32x64x64_1x4_TypeCast_v1_Nswizzle0_Quant0_MulRoutedWeight1_B16_B16_B16,0.0%,15.81,15814.62
stage1,256,16,2048,192,128,8,ActivationType.Silu,torch.bfloat16,torch.bfloat16,torch.bfloat16,QuantType.No,1,0,64,0,26.8934,moe_ck2stages_gemm1_256x64x64x128_1x4_TypeCast_v1_Nswizzle0_Quant0_MulRoutedWeight0_silu_B16_B16_B16,0.0%,11.23,11234.02
stage1,256,16,2048,192,128,8,ActivationType.Silu,torch.bfloat16,torch.bfloat16,torch.bfloat16,QuantType.No,1,0,64,0,30.5103,moe_ck2stages_gemm1_256x64x64x64_1x4_TypeCast_v1_Nswizzle0_Quant0_MulRoutedWeight0_silu_B16_B16_B16,0.0%,9.9,9902.26
stage2,256,16,2048,192,128,8,ActivationType.Silu,torch.bfloat16,torch.bfloat16,torch.bfloat16,QuantType.No,1,0,64,0,inf,moe_ck2stages_gemm2_256x64x128x128_1x4_TypeCast_v1_Nswizzle0_Quant0_MulRoutedWeight1_B16_B16_B16,100.0%,0.0,0.0
stage2,256,16,2048,192,128,8,ActivationType.Silu,torch.bfloat16,torch.bfloat16,torch.bfloat16,QuantType.No,1,0,64,0,22.9734,moe_ck2stages_gemm2_256x64x64x64_1x4_TypeCast_v1_Nswizzle0_Quant0_MulRoutedWeight1_B16_B16_B16,0.0%,13.15,13150.9
stage2,256,16,2048,192,128,8,ActivationType.Silu,torch.bfloat16,torch.bfloat16,torch.bfloat16,QuantType.No,1,0,64,0,22.2124,moe_ck2stages_gemm2_256x64x128x64_1x4_TypeCast_v1_Nswizzle0_Quant0_MulRoutedWeight1_B16_B16_B16,0.0%,13.6,13601.46
stage1,256,16,2048,192,128,8,ActivationType.Silu,torch.bfloat16,torch.bfloat16,torch.bfloat16,QuantType.No,1,0,128,0,32.1847,moe_ck2stages_gemm1_256x128x64x64_1x4_TypeCast_v1_Nswizzle0_Quant0_MulRoutedWeight0_silu_B16_B16_B16,0.0%,9.38,9387.1
stage1,256,16,2048,192,128,8,ActivationType.Silu,torch.bfloat16,torch.bfloat16,torch.bfloat16,QuantType.No,1,0,128,0,inf,moe_ck2stages_gemm1_256x128x128x64_1x4_TypeCast_v3_Nswizzle0_Quant0_MulRoutedWeight0_silu_B16_B16_B16,100.0%,0.0,0.0
stage2,256,16,2048,192,128,8,ActivationType.Silu,torch.bfloat16,torch.bfloat16,torch.bfloat16,QuantType.No,1,0,128,0,29.4143,moe_ck2stages_gemm2_256x128x128x64_1x4_TypeCast_v1_Nswizzle0_Quant0_MulRoutedWeight1_B16_B16_B16,0.0%,10.27,10271.23
stage2,256,16,2048,192,128,8,ActivationType.Silu,torch.bfloat16,torch.bfloat16,torch.bfloat16,QuantType.No,1,0,128,0,29.1874,moe_ck2stages_gemm2_256x128x128x64_1x4_TypeCast_v3_Nswizzle0_Quant0_MulRoutedWeight1_B16_B16_B16,0.0%,10.35,10351.07
stage2,256,16,2048,192,128,8,ActivationType.Silu,torch.bfloat16,torch.bfloat16,torch.bfloat16,QuantType.No,1,0,128,0,29.2199,moe_ck2stages_gemm2_256x128x64x64_1x4_TypeCast_v3_Nswizzle0_Quant0_MulRoutedWeight1_B16_B16_B16,0.0%,10.34,10339.56
stage2,256,16,2048,192,128,8,ActivationType.Silu,torch.bfloat16,torch.bfloat16,torch.bfloat16,QuantType.No,1,0,128,0,32.6641,moe_ck2stages_gemm2_256x128x64x64_1x4_TypeCast_v1_Nswizzle0_Quant0_MulRoutedWeight1_B16_B16_B16,0.0%,9.25,9249.33
stage1,256,16,2048,192,128,8,ActivationType.Silu,torch.bfloat16,torch.bfloat16,torch.bfloat16,QuantType.No,1,1,32,0,25.9503,moe_ck2stages_gemm1_256x32x64x128_1x4_TypeCast_v1_Nswizzle0_Quant0_MulRoutedWeight1_silu_B16_B16_B16,0.0%,11.64,11642.29
stage1,256,16,2048,192,128,8,ActivationType.Silu,torch.bfloat16,torch.bfloat16,torch.bfloat16,QuantType.No,1,1,32,0,27.8052,moe_ck2stages_gemm1_256x32x64x64_1x4_TypeCast_v1_Nswizzle0_Quant0_MulRoutedWeight1_silu_B16_B16_B16,0.0%,10.86,10865.63
stage2,256,16,2048,192,128,8,ActivationType.Silu,torch.bfloat16,torch.bfloat16,torch.bfloat16,QuantType.No,1,1,32,0,inf,moe_ck2stages_gemm2_256x32x128x128_1x4_TypeCast_v1_Nswizzle0_Quant0_MulRoutedWeight0_B16_B16_B16,100.0%,0.0,0.0
stage2,256,16,2048,192,128,8,ActivationType.Silu,torch.bfloat16,torch.bfloat16,torch.bfloat16,QuantType.No,1,1,32,0,17.9622,moe_ck2stages_gemm2_256x32x64x64_1x4_TypeCast_v1_Nswizzle0_Quant0_MulRoutedWeight0_B16_B16_B16,0.0%,16.81,16819.82
stage1,256,16,2048,192,128,8,ActivationType.Silu,torch.bfloat16,torch.bfloat16,torch.bfloat16,QuantType.No,1,1,64,0,27.1982,moe_ck2stages_gemm1_256x64x64x128_1x4_TypeCast_v1_Nswizzle0_Quant0_MulRoutedWeight1_silu_B16_B16_B16,0.0%,11.1,11108.12
stage1,256,16,2048,192,128,8,ActivationType.Silu,torch.bfloat16,torch.bfloat16,torch.bfloat16,QuantType.No,1,1,64,0,29.3998,moe_ck2stages_gemm1_256x64x64x64_1x4_TypeCast_v1_Nswizzle0_Quant0_MulRoutedWeight1_silu_B16_B16_B16,0.0%,10.27,10276.29
stage2,256,16,2048,192,128,8,ActivationType.Silu,torch.bfloat16,torch.bfloat16,torch.bfloat16,QuantType.No,1,1,64,0,inf,moe_ck2stages_gemm2_256x64x128x128_1x4_TypeCast_v1_Nswizzle0_Quant0_MulRoutedWeight0_B16_B16_B16,100.0%,0.0,0.0
stage2,256,16,2048,192,128,8,ActivationType.Silu,torch.bfloat16,torch.bfloat16,torch.bfloat16,QuantType.No,1,1,64,0,21.681,moe_ck2stages_gemm2_256x64x64x64_1x4_TypeCast_v1_Nswizzle0_Quant0_MulRoutedWeight0_B16_B16_B16,0.0%,13.93,13934.83
stage2,256,16,2048,192,128,8,ActivationType.Silu,torch.bfloat16,torch.bfloat16,torch.bfloat16,QuantType.No,1,1,64,0,21.1376,moe_ck2stages_gemm2_256x64x128x64_1x4_TypeCast_v1_Nswizzle0_Quant0_MulRoutedWeight0_B16_B16_B16,0.0%,14.29,14293.06
stage1,256,16,2048,192,128,8,ActivationType.Silu,torch.bfloat16,torch.bfloat16,torch.bfloat16,QuantType.No,1,1,128,0,32.9,moe_ck2stages_gemm1_256x128x64x64_1x4_TypeCast_v1_Nswizzle0_Quant0_MulRoutedWeight1_silu_B16_B16_B16,0.0%,9.18,9183.01
stage1,256,16,2048,192,128,8,ActivationType.Silu,torch.bfloat16,torch.bfloat16,torch.bfloat16,QuantType.No,1,1,128,0,inf,moe_ck2stages_gemm1_256x128x128x64_1x4_TypeCast_v3_Nswizzle0_Quant0_MulRoutedWeight1_silu_B16_B16_B16,100.0%,0.0,0.0
stage2,256,16,2048,192,128,8,ActivationType.Silu,torch.bfloat16,torch.bfloat16,torch.bfloat16,QuantType.No,1,1,128,0,27.8477,moe_ck2stages_gemm2_256x128x128x64_1x4_TypeCast_v1_Nswizzle0_Quant0_MulRoutedWeight0_B16_B16_B16,0.0%,10.84,10849.05
stage2,256,16,2048,192,128,8,ActivationType.Silu,torch.bfloat16,torch.bfloat16,torch.bfloat16,QuantType.No,1,1,128,0,28.2346,moe_ck2stages_gemm2_256x128x128x64_1x4_TypeCast_v3_Nswizzle0_Quant0_MulRoutedWeight0_B16_B16_B16,0.0%,10.7,10700.38
stage2,256,16,2048,192,128,8,ActivationType.Silu,torch.bfloat16,torch.bfloat16,torch.bfloat16,QuantType.No,1,1,128,0,27.0059,moe_ck2stages_gemm2_256x128x64x64_1x4_TypeCast_v3_Nswizzle0_Quant0_MulRoutedWeight0_B16_B16_B16,0.0%,11.18,11187.22
stage2,256,16,2048,192,128,8,ActivationType.Silu,torch.bfloat16,torch.bfloat16,torch.bfloat16,QuantType.No,1,1,128,0,29.6638,moe_ck2stages_gemm2_256x128x64x64_1x4_TypeCast_v1_Nswizzle0_Quant0_MulRoutedWeight0_B16_B16_B16,0.0%,10.18,10184.84
stage1,256,16,4096,192,128,8,ActivationType.Gelu,torch.bfloat16,torch.bfloat16,torch.bfloat16,QuantType.No,1,0,32,0,47.5822,moe_ck2stages_gemm1_256x32x64x128_1x4_TypeCast_v1_Nswizzle0_Quant0_MulRoutedWeight0_gelu_B16_B16_B16,0.0%,12.69,12698.91
stage1,256,16,4096,192,128,8,ActivationType.Gelu,torch.bfloat16,torch.bfloat16,torch.bfloat16,QuantType.No,1,0,32,0,50.4926,moe_ck2stages_gemm1_256x32x64x64_1x4_TypeCast_v1_Nswizzle0_Quant0_MulRoutedWeight0_gelu_B16_B16_B16,0.0%,11.96,11966.94
stage2,256,16,4096,192,128,8,ActivationType.Gelu,torch.bfloat16,torch.bfloat16,torch.bfloat16,QuantType.No,1,0,32,0,inf,moe_ck2stages_gemm2_256x32x128x128_1x4_TypeCast_v1_Nswizzle0_Quant0_MulRoutedWeight1_B16_B16_B16,100.0%,0.0,0.0
stage2,256,16,4096,192,128,8,ActivationType.Gelu,torch.bfloat16,torch.bfloat16,torch.bfloat16,QuantType.No,1,0,32,0,29.4505,moe_ck2stages_gemm2_256x32x64x64_1x4_TypeCast_v1_Nswizzle0_Quant0_MulRoutedWeight1_B16_B16_B16,0.1%,20.51,20517.2
stage1,256,16,4096,192,128,8,ActivationType.Gelu,torch.bfloat16,torch.bfloat16,torch.bfloat16,QuantType.No,1,0,64,0,49.3211,moe_ck2stages_gemm1_256x64x64x128_1x4_TypeCast_v1_Nswizzle0_Quant0_MulRoutedWeight0_gelu_B16_B16_B16,0.0%,12.25,12251.18
stage1,256,16,4096,192,128,8,ActivationType.Gelu,torch.bfloat16,torch.bfloat16,torch.bfloat16,QuantType.No,1,0,64,0,51.6395,moe_ck2stages_gemm1_256x64x64x64_1x4_TypeCast_v1_Nswizzle0_Quant0_MulRoutedWeight0_gelu_B16_B16_B16,0.0%,11.7,11701.16
stage2,256,16,4096,192,128,8,ActivationType.Gelu,torch.bfloat16,torch.bfloat16,torch.bfloat16,QuantType.No,1,0,64,0,inf,moe_ck2stages_gemm2_256x64x128x128_1x4_TypeCast_v1_Nswizzle0_Quant0_MulRoutedWeight1_B16_B16_B16,100.0%,0.0,0.0
stage2,256,16,4096,192,128,8,ActivationType.Gelu,torch.bfloat16,torch.bfloat16,torch.bfloat16,QuantType.No,1,0,64,0,37.0042,moe_ck2stages_gemm2_256x64x64x64_1x4_TypeCast_v1_Nswizzle0_Quant0_MulRoutedWeight1_B16_B16_B16,0.1%,16.32,16329.01
stage2,256,16,4096,192,128,8,ActivationType.Gelu,torch.bfloat16,torch.bfloat16,torch.bfloat16,QuantType.No,1,0,64,0,33.7978,moe_ck2stages_gemm2_256x64x128x64_1x4_TypeCast_v1_Nswizzle0_Quant0_MulRoutedWeight1_B16_B16_B16,0.1%,17.87,17878.14
stage1,256,16,4096,192,128,8,ActivationType.Gelu,torch.bfloat16,torch.bfloat16,torch.bfloat16,QuantType.No,1,0,128,0,56.4186,moe_ck2stages_gemm1_256x128x64x64_1x4_TypeCast_v1_Nswizzle0_Quant0_MulRoutedWeight0_gelu_B16_B16_B16,0.0%,10.71,10709.98
stage1,256,16,4096,192,128,8,ActivationType.Gelu,torch.bfloat16,torch.bfloat16,torch.bfloat16,QuantType.No,1,0,128,0,inf,moe_ck2stages_gemm1_256x128x128x64_1x4_TypeCast_v3_Nswizzle0_Quant0_MulRoutedWeight0_gelu_B16_B16_B16,100.0%,0.0,0.0
stage2,256,16,4096,192,128,8,ActivationType.Gelu,torch.bfloat16,torch.bfloat16,torch.bfloat16,QuantType.No,1,0,128,0,51.6524,moe_ck2stages_gemm2_256x128x128x64_1x4_TypeCast_v1_Nswizzle0_Quant0_MulRoutedWeight1_B16_B16_B16,0.1%,11.69,11698.24
stage2,256,16,4096,192,128,8,ActivationType.Gelu,torch.bfloat16,torch.bfloat16,torch.bfloat16,QuantType.No,1,0,128,0,51.6232,moe_ck2stages_gemm2_256x128x128x64_1x4_TypeCast_v3_Nswizzle0_Quant0_MulRoutedWeight1_B16_B16_B16,0.1%,11.7,11704.85
stage2,256,16,4096,192,128,8,ActivationType.Gelu,torch.bfloat16,torch.bfloat16,torch.bfloat16,QuantType.No,1,0,128,0,49.7266,moe_ck2stages_gemm2_256x128x64x64_1x4_TypeCast_v3_Nswizzle0_Quant0_MulRoutedWeight1_B16_B16_B16,0.1%,12.15,12151.28
stage2,256,16,4096,192,128,8,ActivationType.Gelu,torch.bfloat16,torch.bfloat16,torch.bfloat16,QuantType.No,1,0,128,0,54.9826,moe_ck2stages_gemm2_256x128x64x64_1x4_TypeCast_v1_Nswizzle0_Quant0_MulRoutedWeight1_B16_B16_B16,0.1%,10.98,10989.69
stage1,256,16,4096,192,128,8,ActivationType.Gelu,torch.bfloat16,torch.bfloat16,torch.bfloat16,QuantType.No,1,1,32,0,47.9485,moe_ck2stages_gemm1_256x32x64x128_1x4_TypeCast_v1_Nswizzle0_Quant0_MulRoutedWeight1_gelu_B16_B16_B16,0.0%,12.6,12601.89
stage1,256,16,4096,192,128,8,ActivationType.Gelu,torch.bfloat16,torch.bfloat16,torch.bfloat16,QuantType.No,1,1,32,0,50.5767,moe_ck2stages_gemm1_256x32x64x64_1x4_TypeCast_v1_Nswizzle0_Quant0_MulRoutedWeight1_gelu_B16_B16_B16,0.0%,11.94,11947.04
stage2,256,16,4096,192,128,8,ActivationType.Gelu,torch.bfloat16,torch.bfloat16,torch.bfloat16,QuantType.No,1,1,32,0,inf,moe_ck2stages_gemm2_256x32x128x128_1x4_TypeCast_v1_Nswizzle0_Quant0_MulRoutedWeight0_B16_B16_B16,100.0%,0.0,0.0
stage2,256,16,4096,192,128,8,ActivationType.Gelu,torch.bfloat16,torch.bfloat16,torch.bfloat16,QuantType.No,1,1,32,0,28.8909,moe_ck2stages_gemm2_256x32x64x64_1x4_TypeCast_v1_Nswizzle0_Quant0_MulRoutedWeight0_B16_B16_B16,0.0%,20.91,20914.61
stage1,256,16,4096,192,128,8,ActivationType.Gelu,torch.bfloat16,torch.bfloat16,torch.bfloat16,QuantType.No,1,1,64,0,49.4398,moe_ck2stages_gemm1_256x64x64x128_1x4_TypeCast_v1_Nswizzle0_Quant0_MulRoutedWeight1_gelu_B16_B16_B16,0.0%,12.22,12221.77
stage1,256,16,4096,192,128,8,ActivationType.Gelu,torch.bfloat16,torch.bfloat16,torch.bfloat16,QuantType.No,1,1,64,0,51.8077,moe_ck2stages_gemm1_256x64x64x64_1x4_TypeCast_v1_Nswizzle0_Quant0_MulRoutedWeight1_gelu_B16_B16_B16,0.0%,11.66,11663.17
stage2,256,16,4096,192,128,8,ActivationType.Gelu,torch.bfloat16,torch.bfloat16,torch.bfloat16,QuantType.No,1,1,64,0,inf,moe_ck2stages_gemm2_256x64x128x128_1x4_TypeCast_v1_Nswizzle0_Quant0_MulRoutedWeight0_B16_B16_B16,100.0%,0.0,0.0
stage2,256,16,4096,192,128,8,ActivationType.Gelu,torch.bfloat16,torch.bfloat16,torch.bfloat16,QuantType.No,1,1,64,0,33.9994,moe_ck2stages_gemm2_256x64x64x64_1x4_TypeCast_v1_Nswizzle0_Quant0_MulRoutedWeight0_B16_B16_B16,0.0%,17.76,17772.13
stage2,256,16,4096,192,128,8,ActivationType.Gelu,torch.bfloat16,torch.bfloat16,torch.bfloat16,QuantType.No,1,1,64,0,31.9993,moe_ck2stages_gemm2_256x64x128x64_1x4_TypeCast_v1_Nswizzle0_Quant0_MulRoutedWeight0_B16_B16_B16,0.0%,18.87,18882.97
stage1,256,16,4096,192,128,8,ActivationType.Gelu,torch.bfloat16,torch.bfloat16,torch.bfloat16,QuantType.No,1,1,128,0,57.5306,moe_ck2stages_gemm1_256x128x64x64_1x4_TypeCast_v1_Nswizzle0_Quant0_MulRoutedWeight1_gelu_B16_B16_B16,0.0%,10.5,10502.97
stage1,256,16,4096,192,128,8,ActivationType.Gelu,torch.bfloat16,torch.bfloat16,torch.bfloat16,QuantType.No,1,1,128,0,inf,moe_ck2stages_gemm1_256x128x128x64_1x4_TypeCast_v3_Nswizzle0_Quant0_MulRoutedWeight1_gelu_B16_B16_B16,100.0%,0.0,0.0
stage2,256,16,4096,192,128,8,ActivationType.Gelu,torch.bfloat16,torch.bfloat16,torch.bfloat16,QuantType.No,1,1,128,0,48.2108,moe_ck2stages_gemm2_256x128x128x64_1x4_TypeCast_v1_Nswizzle0_Quant0_MulRoutedWeight0_B16_B16_B16,0.0%,12.53,12533.33
stage2,256,16,4096,192,128,8,ActivationType.Gelu,torch.bfloat16,torch.bfloat16,torch.bfloat16,QuantType.No,1,1,128,0,48.5025,moe_ck2stages_gemm2_256x128x128x64_1x4_TypeCast_v3_Nswizzle0_Quant0_MulRoutedWeight0_B16_B16_B16,0.0%,12.45,12457.95
stage2,256,16,4096,192,128,8,ActivationType.Gelu,torch.bfloat16,torch.bfloat16,torch.bfloat16,QuantType.No,1,1,128,0,45.4388,moe_ck2stages_gemm2_256x128x64x64_1x4_TypeCast_v3_Nswizzle0_Quant0_MulRoutedWeight0_B16_B16_B16,0.0%,13.29,13297.93
stage2,256,16,4096,192,128,8,ActivationType.Gelu,torch.bfloat16,torch.bfloat16,torch.bfloat16,QuantType.No,1,1,128,0,49.7837,moe_ck2stages_gemm2_256x128x64x64_1x4_TypeCast_v1_Nswizzle0_Quant0_MulRoutedWeight0_B16_B16_B16,0.0%,12.13,12137.34
stage1,256,16,4096,192,128,8,ActivationType.Silu,torch.bfloat16,torch.bfloat16,torch.bfloat16,QuantType.No,1,0,32,0,47.6661,moe_ck2stages_gemm1_256x32x64x128_1x4_TypeCast_v1_Nswizzle0_Quant0_MulRoutedWeight0_silu_B16_B16_B16,0.0%,12.67,12676.55
stage1,256,16,4096,192,128,8,ActivationType.Silu,torch.bfloat16,torch.bfloat16,torch.bfloat16,QuantType.No,1,0,32,0,50.1002,moe_ck2stages_gemm1_256x32x64x64_1x4_TypeCast_v1_Nswizzle0_Quant0_MulRoutedWeight0_silu_B16_B16_B16,0.0%,12.06,12060.67
stage2,256,16,4096,192,128,8,ActivationType.Silu,torch.bfloat16,torch.bfloat16,torch.bfloat16,QuantType.No,1,0,32,0,inf,moe_ck2stages_gemm2_256x32x128x128_1x4_TypeCast_v1_Nswizzle0_Quant0_MulRoutedWeight1_B16_B16_B16,100.0%,0.0,0.0
stage2,256,16,4096,192,128,8,ActivationType.Silu,torch.bfloat16,torch.bfloat16,torch.bfloat16,QuantType.No,1,0,32,0,29.6933,moe_ck2stages_gemm2_256x32x64x64_1x4_TypeCast_v1_Nswizzle0_Quant0_MulRoutedWeight1_B16_B16_B16,0.1%,20.34,20349.44
stage1,256,16,4096,192,128,8,ActivationType.Silu,torch.bfloat16,torch.bfloat16,torch.bfloat16,QuantType.No,1,0,64,0,48.9455,moe_ck2stages_gemm1_256x64x64x128_1x4_TypeCast_v1_Nswizzle0_Quant0_MulRoutedWeight0_silu_B16_B16_B16,0.0%,12.34,12345.2
stage1,256,16,4096,192,128,8,ActivationType.Silu,torch.bfloat16,torch.bfloat16,torch.bfloat16,QuantType.No,1,0,64,0,51.5563,moe_ck2stages_gemm1_256x64x64x64_1x4_TypeCast_v1_Nswizzle0_Quant0_MulRoutedWeight0_silu_B16_B16_B16,0.0%,11.71,11720.04
stage2,256,16,4096,192,128,8,ActivationType.Silu,torch.bfloat16,torch.bfloat16,torch.bfloat16,QuantType.No,1,0,64,0,inf,moe_ck2stages_gemm2_256x64x128x128_1x4_TypeCast_v1_Nswizzle0_Quant0_MulRoutedWeight1_B16_B16_B16,100.0%,0.0,0.0
stage2,256,16,4096,192,128,8,ActivationType.Silu,torch.bfloat16,torch.bfloat16,torch.bfloat16,QuantType.No,1,0,64,0,36.7264,moe_ck2stages_gemm2_256x64x64x64_1x4_TypeCast_v1_Nswizzle0_Quant0_MulRoutedWeight1_B16_B16_B16,0.1%,16.45,16452.52
stage2,256,16,4096,192,128,8,ActivationType.Silu,torch.bfloat16,torch.bfloat16,torch.bfloat16,QuantType.No,1,0,64,0,33.9419,moe_ck2stages_gemm2_256x64x128x64_1x4_TypeCast_v1_Nswizzle0_Quant0_MulRoutedWeight1_B16_B16_B16,0.1%,17.79,17802.24
stage1,256,16,4096,192,128,8,ActivationType.Silu,torch.bfloat16,torch.bfloat16,torch.bfloat16,QuantType.No,1,0,128,0,56.8003,moe_ck2stages_gemm1_256x128x64x64_1x4_TypeCast_v1_Nswizzle0_Quant0_MulRoutedWeight0_silu_B16_B16_B16,0.0%,10.63,10638.01
stage1,256,16,4096,192,128,8,ActivationType.Silu,torch.bfloat16,torch.bfloat16,torch.bfloat16,QuantType.No,1,0,128,0,inf,moe_ck2stages_gemm1_256x128x128x64_1x4_TypeCast_v3_Nswizzle0_Quant0_MulRoutedWeight0_silu_B16_B16_B16,100.0%,0.0,0.0
stage2,256,16,4096,192,128,8,ActivationType.Silu,torch.bfloat16,torch.bfloat16,torch.bfloat16,QuantType.No,1,0,128,0,51.7878,moe_ck2stages_gemm2_256x128x128x64_1x4_TypeCast_v1_Nswizzle0_Quant0_MulRoutedWeight1_B16_B16_B16,0.1%,11.66,11667.65
stage2,256,16,4096,192,128,8,ActivationType.Silu,torch.bfloat16,torch.bfloat16,torch.bfloat16,QuantType.No,1,0,128,0,51.4447,moe_ck2stages_gemm2_256x128x128x64_1x4_TypeCast_v3_Nswizzle0_Quant0_MulRoutedWeight1_B16_B16_B16,0.1%,11.74,11745.46
stage2,256,16,4096,192,128,8,ActivationType.Silu,torch.bfloat16,torch.bfloat16,torch.bfloat16,QuantType.No,1,0,128,0,49.5975,moe_ck2stages_gemm2_256x128x64x64_1x4_TypeCast_v3_Nswizzle0_Quant0_MulRoutedWeight1_B16_B16_B16,0.1%,12.18,12182.91
stage2,256,16,4096,192,128,8,ActivationType.Silu,torch.bfloat16,torch.bfloat16,torch.bfloat16,QuantType.No,1,0,128,0,54.3073,moe_ck2stages_gemm2_256x128x64x64_1x4_TypeCast_v1_Nswizzle0_Quant0_MulRoutedWeight1_B16_B16_B16,0.1%,11.12,11126.35
stage1,256,16,4096,192,128,8,ActivationType.Silu,torch.bfloat16,torch.bfloat16,torch.bfloat16,QuantType.No,1,1,32,0,48.4777,moe_ck2stages_gemm1_256x32x64x128_1x4_TypeCast_v1_Nswizzle0_Quant0_MulRoutedWeight1_silu_B16_B16_B16,0.0%,12.46,12464.33
stage1,256,16,4096,192,128,8,ActivationType.Silu,torch.bfloat16,torch.bfloat16,torch.bfloat16,QuantType.No,1,1,32,0,50.6629,moe_ck2stages_gemm1_256x32x64x64_1x4_TypeCast_v1_Nswizzle0_Quant0_MulRoutedWeight1_silu_B16_B16_B16,0.0%,11.92,11926.71
stage2,256,16,4096,192,128,8,ActivationType.Silu,torch.bfloat16,torch.bfloat16,torch.bfloat16,QuantType.No,1,1,32,0,inf,moe_ck2stages_gemm2_256x32x128x128_1x4_TypeCast_v1_Nswizzle0_Quant0_MulRoutedWeight0_B16_B16_B16,100.0%,0.0,0.0
stage2,256,16,4096,192,128,8,ActivationType.Silu,torch.bfloat16,torch.bfloat16,torch.bfloat16,QuantType.No,1,1,32,0,28.271,moe_ck2stages_gemm2_256x32x64x64_1x4_TypeCast_v1_Nswizzle0_Quant0_MulRoutedWeight0_B16_B16_B16,0.0%,21.36,21373.21
stage1,256,16,4096,192,128,8,ActivationType.Silu,torch.bfloat16,torch.bfloat16,torch.bfloat16,QuantType.No,1,1,64,0,49.4662,moe_ck2stages_gemm1_256x64x64x128_1x4_TypeCast_v1_Nswizzle0_Quant0_MulRoutedWeight1_silu_B16_B16_B16,0.0%,12.21,12215.25
stage1,256,16,4096,192,128,8,ActivationType.Silu,torch.bfloat16,torch.bfloat16,torch.bfloat16,QuantType.No,1,1,64,0,52.1566,moe_ck2stages_gemm1_256x64x64x64_1x4_TypeCast_v1_Nswizzle0_Quant0_MulRoutedWeight1_silu_B16_B16_B16,0.0%,11.58,11585.15
stage2,256,16,4096,192,128,8,ActivationType.Silu,torch.bfloat16,torch.bfloat16,torch.bfloat16,QuantType.No,1,1,64,0,inf,moe_ck2stages_gemm2_256x64x128x128_1x4_TypeCast_v1_Nswizzle0_Quant0_MulRoutedWeight0_B16_B16_B16,100.0%,0.0,0.0
stage2,256,16,4096,192,128,8,ActivationType.Silu,torch.bfloat16,torch.bfloat16,torch.bfloat16,QuantType.No,1,1,64,0,33.65,moe_ck2stages_gemm2_256x64x64x64_1x4_TypeCast_v1_Nswizzle0_Quant0_MulRoutedWeight0_B16_B16_B16,0.0%,17.95,17956.67
stage2,256,16,4096,192,128,8,ActivationType.Silu,torch.bfloat16,torch.bfloat16,torch.bfloat16,QuantType.No,1,1,64,0,32.3354,moe_ck2stages_gemm2_256x64x128x64_1x4_TypeCast_v1_Nswizzle0_Quant0_MulRoutedWeight0_B16_B16_B16,0.0%,18.68,18686.7
stage1,256,16,4096,192,128,8,ActivationType.Silu,torch.bfloat16,torch.bfloat16,torch.bfloat16,QuantType.No,1,1,128,0,57.3696,moe_ck2stages_gemm1_256x128x64x64_1x4_TypeCast_v1_Nswizzle0_Quant0_MulRoutedWeight1_silu_B16_B16_B16,0.0%,10.53,10532.44
stage1,256,16,4096,192,128,8,ActivationType.Silu,torch.bfloat16,torch.bfloat16,torch.bfloat16,QuantType.No,1,1,128,0,inf,moe_ck2stages_gemm1_256x128x128x64_1x4_TypeCast_v3_Nswizzle0_Quant0_MulRoutedWeight1_silu_B16_B16_B16,100.0%,0.0,0.0
stage2,256,16,4096,192,128,8,ActivationType.Silu,torch.bfloat16,torch.bfloat16,torch.bfloat16,QuantType.No,1,1,128,0,48.1816,moe_ck2stages_gemm2_256x128x128x64_1x4_TypeCast_v1_Nswizzle0_Quant0_MulRoutedWeight0_B16_B16_B16,0.0%,12.54,12540.93
stage2,256,16,4096,192,128,8,ActivationType.Silu,torch.bfloat16,torch.bfloat16,torch.bfloat16,QuantType.No,1,1,128,0,48.4796,moe_ck2stages_gemm2_256x128x128x64_1x4_TypeCast_v3_Nswizzle0_Quant0_MulRoutedWeight0_B16_B16_B16,0.0%,12.46,12463.84
stage2,256,16,4096,192,128,8,ActivationType.Silu,torch.bfloat16,torch.bfloat16,torch.bfloat16,QuantType.No,1,1,128,0,45.3966,moe_ck2stages_gemm2_256x128x64x64_1x4_TypeCast_v3_Nswizzle0_Quant0_MulRoutedWeight0_B16_B16_B16,0.0%,13.3,13310.29
stage2,256,16,4096,192,128,8,ActivationType.Silu,torch.bfloat16,torch.bfloat16,torch.bfloat16,QuantType.No,1,1,128,0,49.6072,moe_ck2stages_gemm2_256x128x64x64_1x4_TypeCast_v1_Nswizzle0_Quant0_MulRoutedWeight0_B16_B16_B16,0.0%,12.18,12180.53
stage1,256,16,4096,384,128,8,ActivationType.Gelu,torch.bfloat16,torch.bfloat16,torch.bfloat16,QuantType.No,1,0,32,0,89.2877,moe_ck2stages_gemm1_256x32x64x128_1x4_TypeCast_v1_Nswizzle0_Quant0_MulRoutedWeight0_gelu_B16_B16_B16,0.0%,13.53,13531.78
stage1,256,16,4096,384,128,8,ActivationType.Gelu,torch.bfloat16,torch.bfloat16,torch.bfloat16,QuantType.No,1,0,32,0,90.7638,moe_ck2stages_gemm1_256x32x64x64_1x4_TypeCast_v1_Nswizzle0_Quant0_MulRoutedWeight0_gelu_B16_B16_B16,0.0%,13.31,13311.71
stage2,256,16,4096,384,128,8,ActivationType.Gelu,torch.bfloat16,torch.bfloat16,torch.bfloat16,QuantType.No,1,0,32,0,51.9484,moe_ck2stages_gemm2_256x32x128x128_1x4_TypeCast_v1_Nswizzle0_Quant0_MulRoutedWeight1_B16_B16_B16,0.5%,23.25,23258.11
stage2,256,16,4096,384,128,8,ActivationType.Gelu,torch.bfloat16,torch.bfloat16,torch.bfloat16,QuantType.No,1,0,32,0,50.9254,moe_ck2stages_gemm2_256x32x64x64_1x4_TypeCast_v1_Nswizzle0_Quant0_MulRoutedWeight1_B16_B16_B16,0.5%,23.72,23725.33
stage1,256,16,4096,384,128,8,ActivationType.Gelu,torch.bfloat16,torch.bfloat16,torch.bfloat16,QuantType.No,1,0,64,0,90.6345,moe_ck2stages_gemm1_256x64x64x128_1x4_TypeCast_v1_Nswizzle0_Quant0_MulRoutedWeight0_gelu_B16_B16_B16,0.0%,13.33,13330.7
stage1,256,16,4096,384,128,8,ActivationType.Gelu,torch.bfloat16,torch.bfloat16,torch.bfloat16,QuantType.No,1,0,64,0,91.8655,moe_ck2stages_gemm1_256x64x64x64_1x4_TypeCast_v1_Nswizzle0_Quant0_MulRoutedWeight0_gelu_B16_B16_B16,0.0%,13.15,13152.07
stage2,256,16,4096,384,128,8,ActivationType.Gelu,torch.bfloat16,torch.bfloat16,torch.bfloat16,QuantType.No,1,0,64,0,59.8802,moe_ck2stages_gemm2_256x64x128x128_1x4_TypeCast_v1_Nswizzle0_Quant0_MulRoutedWeight1_B16_B16_B16,0.5%,20.17,20177.32
stage2,256,16,4096,384,128,8,ActivationType.Gelu,torch.bfloat16,torch.bfloat16,torch.bfloat16,QuantType.No,1,0,64,0,55.0446,moe_ck2stages_gemm2_256x64x64x64_1x4_TypeCast_v1_Nswizzle0_Quant0_MulRoutedWeight1_B16_B16_B16,0.5%,21.95,21949.87
stage2,256,16,4096,384,128,8,ActivationType.Gelu,torch.bfloat16,torch.bfloat16,torch.bfloat16,QuantType.No,1,0,64,0,53.7387,moe_ck2stages_gemm2_256x64x128x64_1x4_TypeCast_v1_Nswizzle0_Quant0_MulRoutedWeight1_B16_B16_B16,0.5%,22.48,22483.27
stage1,256,16,4096,384,128,8,ActivationType.Gelu,torch.bfloat16,torch.bfloat16,torch.bfloat16,QuantType.No,1,0,128,0,94.9926,moe_ck2stages_gemm1_256x128x64x64_1x4_TypeCast_v1_Nswizzle0_Quant0_MulRoutedWeight0_gelu_B16_B16_B16,0.0%,12.72,12719.11
stage1,256,16,4096,384,128,8,ActivationType.Gelu,torch.bfloat16,torch.bfloat16,torch.bfloat16,QuantType.No,1,0,128,0,95.2982,moe_ck2stages_gemm1_256x128x128x64_1x4_TypeCast_v3_Nswizzle0_Quant0_MulRoutedWeight0_gelu_B16_B16_B16,0.0%,12.68,12678.33
stage2,256,16,4096,384,128,8,ActivationType.Gelu,torch.bfloat16,torch.bfloat16,torch.bfloat16,QuantType.No,1,0,128,0,73.5297,moe_ck2stages_gemm2_256x128x128x64_1x4_TypeCast_v1_Nswizzle0_Quant0_MulRoutedWeight1_B16_B16_B16,0.5%,16.43,16431.75
stage2,256,16,4096,384,128,8,ActivationType.Gelu,torch.bfloat16,torch.bfloat16,torch.bfloat16,QuantType.No,1,0,128,0,72.9608,moe_ck2stages_gemm2_256x128x128x64_1x4_TypeCast_v3_Nswizzle0_Quant0_MulRoutedWeight1_B16_B16_B16,0.5%,16.56,16559.87
stage2,256,16,4096,384,128,8,ActivationType.Gelu,torch.bfloat16,torch.bfloat16,torch.bfloat16,QuantType.No,1,0,128,0,65.8932,moe_ck2stages_gemm2_256x128x64x64_1x4_TypeCast_v3_Nswizzle0_Quant0_MulRoutedWeight1_B16_B16_B16,0.5%,18.33,18336.06
stage2,256,16,4096,384,128,8,ActivationType.Gelu,torch.bfloat16,torch.bfloat16,torch.bfloat16,QuantType.No,1,0,128,0,71.7511,moe_ck2stages_gemm2_256x128x64x64_1x4_TypeCast_v1_Nswizzle0_Quant0_MulRoutedWeight1_B16_B16_B16,0.4%,16.84,16839.07
stage1,256,16,4096,384,128,8,ActivationType.Gelu,torch.bfloat16,torch.bfloat16,torch.bfloat16,QuantType.No,1,1,32,0,89.6723,moe_ck2stages_gemm1_256x32x64x128_1x4_TypeCast_v1_Nswizzle0_Quant0_MulRoutedWeight1_gelu_B16_B16_B16,0.0%,13.47,13473.74
stage1,256,16,4096,384,128,8,ActivationType.Gelu,torch.bfloat16,torch.bfloat16,torch.bfloat16,QuantType.No,1,1,32,0,91.3218,moe_ck2stages_gemm1_256x32x64x64_1x4_TypeCast_v1_Nswizzle0_Quant0_MulRoutedWeight1_gelu_B16_B16_B16,0.0%,13.23,13230.38
stage2,256,16,4096,384,128,8,ActivationType.Gelu,torch.bfloat16,torch.bfloat16,torch.bfloat16,QuantType.No,1,1,32,0,51.3645,moe_ck2stages_gemm2_256x32x128x128_1x4_TypeCast_v1_Nswizzle0_Quant0_MulRoutedWeight0_B16_B16_B16,0.0%,23.52,23522.5
stage2,256,16,4096,384,128,8,ActivationType.Gelu,torch.bfloat16,torch.bfloat16,torch.bfloat16,QuantType.No,1,1,32,0,50.5945,moe_ck2stages_gemm2_256x32x64x64_1x4_TypeCast_v1_Nswizzle0_Quant0_MulRoutedWeight0_B16_B16_B16,0.0%,23.88,23880.49
stage1,256,16,4096,384,128,8,ActivationType.Gelu,torch.bfloat16,torch.bfloat16,torch.bfloat16,QuantType.No,1,1,64,0,90.8318,moe_ck2stages_gemm1_256x64x64x128_1x4_TypeCast_v1_Nswizzle0_Quant0_MulRoutedWeight1_gelu_B16_B16_B16,0.0%,13.3,13301.75
stage1,256,16,4096,384,128,8,ActivationType.Gelu,torch.bfloat16,torch.bfloat16,torch.bfloat16,QuantType.No,1,1,64,0,92.368,moe_ck2stages_gemm1_256x64x64x64_1x4_TypeCast_v1_Nswizzle0_Quant0_MulRoutedWeight1_gelu_B16_B16_B16,0.0%,13.08,13080.52
stage2,256,16,4096,384,128,8,ActivationType.Gelu,torch.bfloat16,torch.bfloat16,torch.bfloat16,QuantType.No,1,1,64,0,56.1365,moe_ck2stages_gemm2_256x64x128x128_1x4_TypeCast_v1_Nswizzle0_Quant0_MulRoutedWeight0_B16_B16_B16,0.0%,21.52,21522.93
stage2,256,16,4096,384,128,8,ActivationType.Gelu,torch.bfloat16,torch.bfloat16,torch.bfloat16,QuantType.No,1,1,64,0,52.8003,moe_ck2stages_gemm2_256x64x64x64_1x4_TypeCast_v1_Nswizzle0_Quant0_MulRoutedWeight0_B16_B16_B16,0.0%,22.88,22882.86
stage2,256,16,4096,384,128,8,ActivationType.Gelu,torch.bfloat16,torch.bfloat16,torch.bfloat16,QuantType.No,1,1,64,0,52.4235,moe_ck2stages_gemm2_256x64x128x64_1x4_TypeCast_v1_Nswizzle0_Quant0_MulRoutedWeight0_B16_B16_B16,0.0%,23.04,23047.33
stage1,256,16,4096,384,128,8,ActivationType.Gelu,torch.bfloat16,torch.bfloat16,torch.bfloat16,QuantType.No,1,1,128,0,96.3015,moe_ck2stages_gemm1_256x128x64x64_1x4_TypeCast_v1_Nswizzle0_Quant0_MulRoutedWeight1_gelu_B16_B16_B16,0.0%,12.54,12546.24
stage1,256,16,4096,384,128,8,ActivationType.Gelu,torch.bfloat16,torch.bfloat16,torch.bfloat16,QuantType.No,1,1,128,0,96.6284,moe_ck2stages_gemm1_256x128x128x64_1x4_TypeCast_v3_Nswizzle0_Quant0_MulRoutedWeight1_gelu_B16_B16_B16,0.0%,12.5,12503.79
stage2,256,16,4096,384,128,8,ActivationType.Gelu,torch.bfloat16,torch.bfloat16,torch.bfloat16,QuantType.No,1,1,128,0,68.6612,moe_ck2stages_gemm2_256x128x128x64_1x4_TypeCast_v1_Nswizzle0_Quant0_MulRoutedWeight0_B16_B16_B16,0.0%,17.59,17596.86
stage2,256,16,4096,384,128,8,ActivationType.Gelu,torch.bfloat16,torch.bfloat16,torch.bfloat16,QuantType.No,1,1,128,0,67.8799,moe_ck2stages_gemm2_256x128x128x64_1x4_TypeCast_v3_Nswizzle0_Quant0_MulRoutedWeight0_B16_B16_B16,0.0%,17.8,17799.4
stage2,256,16,4096,384,128,8,ActivationType.Gelu,torch.bfloat16,torch.bfloat16,torch.bfloat16,QuantType.No,1,1,128,0,61.6018,moe_ck2stages_gemm2_256x128x64x64_1x4_TypeCast_v3_Nswizzle0_Quant0_MulRoutedWeight0_B16_B16_B16,0.0%,19.61,19613.42
stage2,256,16,4096,384,128,8,ActivationType.Gelu,torch.bfloat16,torch.bfloat16,torch.bfloat16,QuantType.No,1,1,128,0,67.9926,moe_ck2stages_gemm2_256x128x64x64_1x4_TypeCast_v1_Nswizzle0_Quant0_MulRoutedWeight0_B16_B16_B16,0.0%,17.77,17769.9
stage1,256,16,4096,384,128,8,ActivationType.Silu,torch.bfloat16,torch.bfloat16,torch.bfloat16,QuantType.No,1,0,32,0,89.698,moe_ck2stages_gemm1_256x32x64x128_1x4_TypeCast_v1_Nswizzle0_Quant0_MulRoutedWeight0_silu_B16_B16_B16,0.0%,13.47,13469.88
stage1,256,16,4096,384,128,8,ActivationType.Silu,torch.bfloat16,torch.bfloat16,torch.bfloat16,QuantType.No,1,0,32,0,91.1177,moe_ck2stages_gemm1_256x32x64x64_1x4_TypeCast_v1_Nswizzle0_Quant0_MulRoutedWeight0_silu_B16_B16_B16,0.0%,13.26,13260.01
stage2,256,16,4096,384,128,8,ActivationType.Silu,torch.bfloat16,torch.bfloat16,torch.bfloat16,QuantType.No,1,0,32,0,51.3543,moe_ck2stages_gemm2_256x32x128x128_1x4_TypeCast_v1_Nswizzle0_Quant0_MulRoutedWeight1_B16_B16_B16,0.4%,23.52,23527.18
stage2,256,16,4096,384,128,8,ActivationType.Silu,torch.bfloat16,torch.bfloat16,torch.bfloat16,QuantType.No,1,0,32,0,50.8111,moe_ck2stages_gemm2_256x32x64x64_1x4_TypeCast_v1_Nswizzle0_Quant0_MulRoutedWeight1_B16_B16_B16,0.4%,23.77,23778.7
stage1,256,16,4096,384,128,8,ActivationType.Silu,torch.bfloat16,torch.bfloat16,torch.bfloat16,QuantType.No,1,0,64,0,90.4853,moe_ck2stages_gemm1_256x64x64x128_1x4_TypeCast_v1_Nswizzle0_Quant0_MulRoutedWeight0_silu_B16_B16_B16,0.0%,13.35,13352.68
stage1,256,16,4096,384,128,8,ActivationType.Silu,torch.bfloat16,torch.bfloat16,torch.bfloat16,QuantType.No,1,0,64,0,91.9906,moe_ck2stages_gemm1_256x64x64x64_1x4_TypeCast_v1_Nswizzle0_Quant0_MulRoutedWeight0_silu_B16_B16_B16,0.0%,13.13,13134.19
stage2,256,16,4096,384,128,8,ActivationType.Silu,torch.bfloat16,torch.bfloat16,torch.bfloat16,QuantType.No,1,0,64,0,59.2505,moe_ck2stages_gemm2_256x64x128x128_1x4_TypeCast_v1_Nswizzle0_Quant0_MulRoutedWeight1_B16_B16_B16,0.4%,20.39,20391.76
stage2,256,16,4096,384,128,8,ActivationType.Silu,torch.bfloat16,torch.bfloat16,torch.bfloat16,QuantType.No,1,0,64,0,55.4098,moe_ck2stages_gemm2_256x64x64x64_1x4_TypeCast_v1_Nswizzle0_Quant0_MulRoutedWeight1_B16_B16_B16,0.3%,21.8,21805.2
stage2,256,16,4096,384,128,8,ActivationType.Silu,torch.bfloat16,torch.bfloat16,torch.bfloat16,QuantType.No,1,0,64,0,53.6376,moe_ck2stages_gemm2_256x64x128x64_1x4_TypeCast_v1_Nswizzle0_Quant0_MulRoutedWeight1_B16_B16_B16,0.4%,22.52,22525.65
stage1,256,16,4096,384,128,8,ActivationType.Silu,torch.bfloat16,torch.bfloat16,torch.bfloat16,QuantType.No,1,0,128,0,96.0982,moe_ck2stages_gemm1_256x128x64x64_1x4_TypeCast_v1_Nswizzle0_Quant0_MulRoutedWeight0_silu_B16_B16_B16,0.0%,12.57,12572.78
stage1,256,16,4096,384,128,8,ActivationType.Silu,torch.bfloat16,torch.bfloat16,torch.bfloat16,QuantType.No,1,0,128,0,96.3254,moe_ck2stages_gemm1_256x128x128x64_1x4_TypeCast_v3_Nswizzle0_Quant0_MulRoutedWeight0_silu_B16_B16_B16,0.0%,12.54,12543.13
stage2,256,16,4096,384,128,8,ActivationType.Silu,torch.bfloat16,torch.bfloat16,torch.bfloat16,QuantType.No,1,0,128,0,73.1938,moe_ck2stages_gemm2_256x128x128x64_1x4_TypeCast_v1_Nswizzle0_Quant0_MulRoutedWeight1_B16_B16_B16,0.4%,16.5,16507.16
stage2,256,16,4096,384,128,8,ActivationType.Silu,torch.bfloat16,torch.bfloat16,torch.bfloat16,QuantType.No,1,0,128,0,72.6227,moe_ck2stages_gemm2_256x128x128x64_1x4_TypeCast_v3_Nswizzle0_Quant0_MulRoutedWeight1_B16_B16_B16,0.4%,16.63,16636.97
stage2,256,16,4096,384,128,8,ActivationType.Silu,torch.bfloat16,torch.bfloat16,torch.bfloat16,QuantType.No,1,0,128,0,65.8918,moe_ck2stages_gemm2_256x128x64x64_1x4_TypeCast_v3_Nswizzle0_Quant0_MulRoutedWeight1_B16_B16_B16,0.3%,18.33,18336.45
stage2,256,16,4096,384,128,8,ActivationType.Silu,torch.bfloat16,torch.bfloat16,torch.bfloat16,QuantType.No,1,0,128,0,71.908,moe_ck2stages_gemm2_256x128x64x64_1x4_TypeCast_v1_Nswizzle0_Quant0_MulRoutedWeight1_B16_B16_B16,0.4%,16.8,16802.33
stage1,256,16,4096,384,128,8,ActivationType.Silu,torch.bfloat16,torch.bfloat16,torch.bfloat16,QuantType.No,1,1,32,0,89.8538,moe_ck2stages_gemm1_256x32x64x128_1x4_TypeCast_v1_Nswizzle0_Quant0_MulRoutedWeight1_silu_B16_B16_B16,0.0%,13.44,13446.53
stage1,256,16,4096,384,128,8,ActivationType.Silu,torch.bfloat16,torch.bfloat16,torch.bfloat16,QuantType.No,1,1,32,0,91.5965,moe_ck2stages_gemm1_256x32x64x64_1x4_TypeCast_v1_Nswizzle0_Quant0_MulRoutedWeight1_silu_B16_B16_B16,0.0%,13.19,13190.7
stage2,256,16,4096,384,128,8,ActivationType.Silu,torch.bfloat16,torch.bfloat16,torch.bfloat16,QuantType.No,1,1,32,0,51.4608,moe_ck2stages_gemm2_256x32x128x128_1x4_TypeCast_v1_Nswizzle0_Quant0_MulRoutedWeight0_B16_B16_B16,0.0%,23.47,23478.49
stage2,256,16,4096,384,128,8,ActivationType.Silu,torch.bfloat16,torch.bfloat16,torch.bfloat16,QuantType.No,1,1,32,0,50.3915,moe_ck2stages_gemm2_256x32x64x64_1x4_TypeCast_v1_Nswizzle0_Quant0_MulRoutedWeight0_B16_B16_B16,0.0%,23.97,23976.7
stage1,256,16,4096,384,128,8,ActivationType.Silu,torch.bfloat16,torch.bfloat16,torch.bfloat16,QuantType.No,1,1,64,0,90.8821,moe_ck2stages_gemm1_256x64x64x128_1x4_TypeCast_v1_Nswizzle0_Quant0_MulRoutedWeight1_silu_B16_B16_B16,0.0%,13.29,13294.39
stage1,256,16,4096,384,128,8,ActivationType.Silu,torch.bfloat16,torch.bfloat16,torch.bfloat16,QuantType.No,1,1,64,0,92.7908,moe_ck2stages_gemm1_256x64x64x64_1x4_TypeCast_v1_Nswizzle0_Quant0_MulRoutedWeight1_silu_B16_B16_B16,0.0%,13.02,13020.92
stage2,256,16,4096,384,128,8,ActivationType.Silu,torch.bfloat16,torch.bfloat16,torch.bfloat16,QuantType.No,1,1,64,0,56.3757,moe_ck2stages_gemm2_256x64x128x128_1x4_TypeCast_v1_Nswizzle0_Quant0_MulRoutedWeight0_B16_B16_B16,0.0%,21.43,21431.6
stage2,256,16,4096,384,128,8,ActivationType.Silu,torch.bfloat16,torch.bfloat16,torch.bfloat16,QuantType.No,1,1,64,0,52.7994,moe_ck2stages_gemm2_256x64x64x64_1x4_TypeCast_v1_Nswizzle0_Quant0_MulRoutedWeight0_B16_B16_B16,0.0%,22.88,22883.25
stage2,256,16,4096,384,128,8,ActivationType.Silu,torch.bfloat16,torch.bfloat16,torch.bfloat16,QuantType.No,1,1,64,0,52.6528,moe_ck2stages_gemm2_256x64x128x64_1x4_TypeCast_v1_Nswizzle0_Quant0_MulRoutedWeight0_B16_B16_B16,0.0%,22.94,22946.96
stage1,256,16,4096,384,128,8,ActivationType.Silu,torch.bfloat16,torch.bfloat16,torch.bfloat16,QuantType.No,1,1,128,0,96.5508,moe_ck2stages_gemm1_256x128x64x64_1x4_TypeCast_v1_Nswizzle0_Quant0_MulRoutedWeight1_silu_B16_B16_B16,0.0%,12.51,12513.84
stage1,256,16,4096,384,128,8,ActivationType.Silu,torch.bfloat16,torch.bfloat16,torch.bfloat16,QuantType.No,1,1,128,0,97.2677,moe_ck2stages_gemm1_256x128x128x64_1x4_TypeCast_v3_Nswizzle0_Quant0_MulRoutedWeight1_silu_B16_B16_B16,0.0%,12.42,12421.61
stage2,256,16,4096,384,128,8,ActivationType.Silu,torch.bfloat16,torch.bfloat16,torch.bfloat16,QuantType.No,1,1,128,0,68.9785,moe_ck2stages_gemm2_256x128x128x64_1x4_TypeCast_v1_Nswizzle0_Quant0_MulRoutedWeight0_B16_B16_B16,0.0%,17.51,17515.92
stage2,256,16,4096,384,128,8,ActivationType.Silu,torch.bfloat16,torch.bfloat16,torch.bfloat16,QuantType.No,1,1,128,0,68.2337,moe_ck2stages_gemm2_256x128x128x64_1x4_TypeCast_v3_Nswizzle0_Quant0_MulRoutedWeight0_B16_B16_B16,0.0%,17.7,17707.11
stage2,256,16,4096,384,128,8,ActivationType.Silu,torch.bfloat16,torch.bfloat16,torch.bfloat16,QuantType.No,1,1,128,0,61.2419,moe_ck2stages_gemm2_256x128x64x64_1x4_TypeCast_v3_Nswizzle0_Quant0_MulRoutedWeight0_B16_B16_B16,0.0%,19.72,19728.68
stage2,256,16,4096,384,128,8,ActivationType.Silu,torch.bfloat16,torch.bfloat16,torch.bfloat16,QuantType.No,1,1,128,0,68.3057,moe_ck2stages_gemm2_256x128x64x64_1x4_TypeCast_v1_Nswizzle0_Quant0_MulRoutedWeight0_B16_B16_B16,0.0%,17.68,17688.45
stage1,256,16,7168,256,256,8,ActivationType.Gelu,torch.bfloat16,torch.bfloat16,torch.bfloat16,QuantType.No,1,0,32,0,132.5642,moe_ck2stages_gemm1_256x32x64x128_1x4_TypeCast_v1_Nswizzle0_Quant0_MulRoutedWeight0_gelu_B16_B16_B16,0.0%,10.63,21265.4
stage1,256,16,7168,256,256,8,ActivationType.Gelu,torch.bfloat16,torch.bfloat16,torch.bfloat16,QuantType.No,1,0,32,0,132.6755,moe_ck2stages_gemm1_256x32x64x64_1x4_TypeCast_v1_Nswizzle0_Quant0_MulRoutedWeight0_gelu_B16_B16_B16,0.0%,10.62,21247.56
stage2,256,16,7168,256,256,8,ActivationType.Gelu,torch.bfloat16,torch.bfloat16,torch.bfloat16,QuantType.No,1,0,32,0,70.4466,moe_ck2stages_gemm2_256x32x128x128_1x4_TypeCast_v1_Nswizzle0_Quant0_MulRoutedWeight1_B16_B16_B16,1.7%,20.01,40016.57
stage2,256,16,7168,256,256,8,ActivationType.Gelu,torch.bfloat16,torch.bfloat16,torch.bfloat16,QuantType.No,1,0,32,0,71.6666,moe_ck2stages_gemm2_256x32x64x64_1x4_TypeCast_v1_Nswizzle0_Quant0_MulRoutedWeight1_B16_B16_B16,1.7%,19.66,39335.35
stage1,256,16,7168,256,256,8,ActivationType.Gelu,torch.bfloat16,torch.bfloat16,torch.bfloat16,QuantType.No,1,0,64,0,132.6624,moe_ck2stages_gemm1_256x64x64x128_1x4_TypeCast_v1_Nswizzle0_Quant0_MulRoutedWeight0_gelu_B16_B16_B16,0.0%,10.62,21249.66
stage1,256,16,7168,256,256,8,ActivationType.Gelu,torch.bfloat16,torch.bfloat16,torch.bfloat16,QuantType.No,1,0,64,0,137.9953,moe_ck2stages_gemm1_256x64x64x64_1x4_TypeCast_v1_Nswizzle0_Quant0_MulRoutedWeight0_gelu_B16_B16_B16,0.0%,10.21,20428.46
stage2,256,16,7168,256,256,8,ActivationType.Gelu,torch.bfloat16,torch.bfloat16,torch.bfloat16,QuantType.No,1,0,64,0,72.9159,moe_ck2stages_gemm2_256x64x128x128_1x4_TypeCast_v1_Nswizzle0_Quant0_MulRoutedWeight1_B16_B16_B16,1.7%,19.33,38661.4
stage2,256,16,7168,256,256,8,ActivationType.Gelu,torch.bfloat16,torch.bfloat16,torch.bfloat16,QuantType.No,1,0,64,0,83.8917,moe_ck2stages_gemm2_256x64x64x64_1x4_TypeCast_v1_Nswizzle0_Quant0_MulRoutedWeight1_B16_B16_B16,1.7%,16.8,33603.22
stage2,256,16,7168,256,256,8,ActivationType.Gelu,torch.bfloat16,torch.bfloat16,torch.bfloat16,QuantType.No,1,0,64,0,73.7738,moe_ck2stages_gemm2_256x64x128x64_1x4_TypeCast_v1_Nswizzle0_Quant0_MulRoutedWeight1_B16_B16_B16,1.7%,19.1,38211.82
stage1,256,16,7168,256,256,8,ActivationType.Gelu,torch.bfloat16,torch.bfloat16,torch.bfloat16,QuantType.No,1,0,128,0,137.8218,moe_ck2stages_gemm1_256x128x64x64_1x4_TypeCast_v1_Nswizzle0_Quant0_MulRoutedWeight0_gelu_B16_B16_B16,0.0%,10.23,20454.17
stage1,256,16,7168,256,256,8,ActivationType.Gelu,torch.bfloat16,torch.bfloat16,torch.bfloat16,QuantType.No,1,0,128,0,141.4272,moe_ck2stages_gemm1_256x128x128x64_1x4_TypeCast_v3_Nswizzle0_Quant0_MulRoutedWeight0_gelu_B16_B16_B16,0.0%,9.96,19932.74
stage2,256,16,7168,256,256,8,ActivationType.Gelu,torch.bfloat16,torch.bfloat16,torch.bfloat16,QuantType.No,1,0,128,0,108.753,moe_ck2stages_gemm2_256x128x128x64_1x4_TypeCast_v1_Nswizzle0_Quant0_MulRoutedWeight1_B16_B16_B16,1.7%,12.96,25921.41
stage2,256,16,7168,256,256,8,ActivationType.Gelu,torch.bfloat16,torch.bfloat16,torch.bfloat16,QuantType.No,1,0,128,0,105.9096,moe_ck2stages_gemm2_256x128x128x64_1x4_TypeCast_v3_Nswizzle0_Quant0_MulRoutedWeight1_B16_B16_B16,1.7%,13.31,26617.33
stage2,256,16,7168,256,256,8,ActivationType.Gelu,torch.bfloat16,torch.bfloat16,torch.bfloat16,QuantType.No,1,0,128,0,107.7356,moe_ck2stages_gemm2_256x128x64x64_1x4_TypeCast_v3_Nswizzle0_Quant0_MulRoutedWeight1_B16_B16_B16,1.7%,13.08,26166.2
stage2,256,16,7168,256,256,8,ActivationType.Gelu,torch.bfloat16,torch.bfloat16,torch.bfloat16,QuantType.No,1,0,128,0,124.2323,moe_ck2stages_gemm2_256x128x64x64_1x4_TypeCast_v1_Nswizzle0_Quant0_MulRoutedWeight1_B16_B16_B16,1.7%,11.34,22691.61
stage1,256,16,7168,256,256,8,ActivationType.Gelu,torch.bfloat16,torch.bfloat16,torch.bfloat16,QuantType.No,1,1,32,0,131.8131,moe_ck2stages_gemm1_256x32x64x128_1x4_TypeCast_v1_Nswizzle0_Quant0_MulRoutedWeight1_gelu_B16_B16_B16,0.0%,10.69,21386.58
stage1,256,16,7168,256,256,8,ActivationType.Gelu,torch.bfloat16,torch.bfloat16,torch.bfloat16,QuantType.No,1,1,32,0,132.3088,moe_ck2stages_gemm1_256x32x64x64_1x4_TypeCast_v1_Nswizzle0_Quant0_MulRoutedWeight1_gelu_B16_B16_B16,0.0%,10.65,21306.45
stage2,256,16,7168,256,256,8,ActivationType.Gelu,torch.bfloat16,torch.bfloat16,torch.bfloat16,QuantType.No,1,1,32,0,72.1874,moe_ck2stages_gemm2_256x32x128x128_1x4_TypeCast_v1_Nswizzle0_Quant0_MulRoutedWeight0_B16_B16_B16,0.0%,19.52,39051.57
stage2,256,16,7168,256,256,8,ActivationType.Gelu,torch.bfloat16,torch.bfloat16,torch.bfloat16,QuantType.No,1,1,32,0,71.8625,moe_ck2stages_gemm2_256x32x64x64_1x4_TypeCast_v1_Nswizzle0_Quant0_MulRoutedWeight0_B16_B16_B16,0.0%,19.61,39228.12
stage1,256,16,7168,256,256,8,ActivationType.Gelu,torch.bfloat16,torch.bfloat16,torch.bfloat16,QuantType.No,1,1,64,0,133.5919,moe_ck2stages_gemm1_256x64x64x128_1x4_TypeCast_v1_Nswizzle0_Quant0_MulRoutedWeight1_gelu_B16_B16_B16,0.0%,10.55,21101.81
stage1,256,16,7168,256,256,8,ActivationType.Gelu,torch.bfloat16,torch.bfloat16,torch.bfloat16,QuantType.No,1,1,64,0,133.7837,moe_ck2stages_gemm1_256x64x64x64_1x4_TypeCast_v1_Nswizzle0_Quant0_MulRoutedWeight1_gelu_B16_B16_B16,0.0%,10.53,21071.56
stage2,256,16,7168,256,256,8,ActivationType.Gelu,torch.bfloat16,torch.bfloat16,torch.bfloat16,QuantType.No,1,1,64,0,70.527,moe_ck2stages_gemm2_256x64x128x128_1x4_TypeCast_v1_Nswizzle0_Quant0_MulRoutedWeight0_B16_B16_B16,0.0%,19.98,39970.95
stage2,256,16,7168,256,256,8,ActivationType.Gelu,torch.bfloat16,torch.bfloat16,torch.bfloat16,QuantType.No,1,1,64,0,74.5512,moe_ck2stages_gemm2_256x64x64x64_1x4_TypeCast_v1_Nswizzle0_Quant0_MulRoutedWeight0_B16_B16_B16,0.0%,18.9,37813.36
stage2,256,16,7168,256,256,8,ActivationType.Gelu,torch.bfloat16,torch.bfloat16,torch.bfloat16,QuantType.No,1,1,64,0,71.5859,moe_ck2stages_gemm2_256x64x128x64_1x4_TypeCast_v1_Nswizzle0_Quant0_MulRoutedWeight0_B16_B16_B16,0.0%,19.69,39379.7
stage1,256,16,7168,256,256,8,ActivationType.Gelu,torch.bfloat16,torch.bfloat16,torch.bfloat16,QuantType.No,1,1,128,0,139.4139,moe_ck2stages_gemm1_256x128x64x64_1x4_TypeCast_v1_Nswizzle0_Quant0_MulRoutedWeight1_gelu_B16_B16_B16,0.0%,10.11,20220.59
stage1,256,16,7168,256,256,8,ActivationType.Gelu,torch.bfloat16,torch.bfloat16,torch.bfloat16,QuantType.No,1,1,128,0,137.9387,moe_ck2stages_gemm1_256x128x128x64_1x4_TypeCast_v3_Nswizzle0_Quant0_MulRoutedWeight1_gelu_B16_B16_B16,0.0%,10.22,20436.84
stage2,256,16,7168,256,256,8,ActivationType.Gelu,torch.bfloat16,torch.bfloat16,torch.bfloat16,QuantType.No,1,1,128,0,101.2528,moe_ck2stages_gemm2_256x128x128x64_1x4_TypeCast_v1_Nswizzle0_Quant0_MulRoutedWeight0_B16_B16_B16,0.0%,13.92,27841.51
stage2,256,16,7168,256,256,8,ActivationType.Gelu,torch.bfloat16,torch.bfloat16,torch.bfloat16,QuantType.No,1,1,128,0,99.3431,moe_ck2stages_gemm2_256x128x128x64_1x4_TypeCast_v3_Nswizzle0_Quant0_MulRoutedWeight0_B16_B16_B16,0.0%,14.19,28376.72
stage2,256,16,7168,256,256,8,ActivationType.Gelu,torch.bfloat16,torch.bfloat16,torch.bfloat16,QuantType.No,1,1,128,0,99.4,moe_ck2stages_gemm2_256x128x64x64_1x4_TypeCast_v3_Nswizzle0_Quant0_MulRoutedWeight0_B16_B16_B16,0.0%,14.18,28360.47
stage2,256,16,7168,256,256,8,ActivationType.Gelu,torch.bfloat16,torch.bfloat16,torch.bfloat16,QuantType.No,1,1,128,0,114.0582,moe_ck2stages_gemm2_256x128x64x64_1x4_TypeCast_v1_Nswizzle0_Quant0_MulRoutedWeight0_B16_B16_B16,0.0%,12.36,24715.72
stage1,256,16,7168,256,256,8,ActivationType.Silu,torch.bfloat16,torch.bfloat16,torch.bfloat16,QuantType.No,1,0,32,0,131.7841,moe_ck2stages_gemm1_256x32x64x128_1x4_TypeCast_v1_Nswizzle0_Quant0_MulRoutedWeight0_silu_B16_B16_B16,0.0%,10.69,21391.28
stage1,256,16,7168,256,256,8,ActivationType.Silu,torch.bfloat16,torch.bfloat16,torch.bfloat16,QuantType.No,1,0,32,0,132.0213,moe_ck2stages_gemm1_256x32x64x64_1x4_TypeCast_v1_Nswizzle0_Quant0_MulRoutedWeight0_silu_B16_B16_B16,0.0%,10.67,21352.85
stage2,256,16,7168,256,256,8,ActivationType.Silu,torch.bfloat16,torch.bfloat16,torch.bfloat16,QuantType.No,1,0,32,0,70.4617,moe_ck2stages_gemm2_256x32x128x128_1x4_TypeCast_v1_Nswizzle0_Quant0_MulRoutedWeight1_B16_B16_B16,1.4%,20.0,40007.99
stage2,256,16,7168,256,256,8,ActivationType.Silu,torch.bfloat16,torch.bfloat16,torch.bfloat16,QuantType.No,1,0,32,0,71.5399,moe_ck2stages_gemm2_256x32x64x64_1x4_TypeCast_v1_Nswizzle0_Quant0_MulRoutedWeight1_B16_B16_B16,1.4%,19.7,39405.02
stage1,256,16,7168,256,256,8,ActivationType.Silu,torch.bfloat16,torch.bfloat16,torch.bfloat16,QuantType.No,1,0,64,0,133.4395,moe_ck2stages_gemm1_256x64x64x128_1x4_TypeCast_v1_Nswizzle0_Quant0_MulRoutedWeight0_silu_B16_B16_B16,0.0%,10.56,21125.91
stage1,256,16,7168,256,256,8,ActivationType.Silu,torch.bfloat16,torch.bfloat16,torch.bfloat16,QuantType.No,1,0,64,0,133.5499,moe_ck2stages_gemm1_256x64x64x64_1x4_TypeCast_v1_Nswizzle0_Quant0_MulRoutedWeight0_silu_B16_B16_B16,0.0%,10.55,21108.45
stage2,256,16,7168,256,256,8,ActivationType.Silu,torch.bfloat16,torch.bfloat16,torch.bfloat16,QuantType.No,1,0,64,0,72.6646,moe_ck2stages_gemm2_256x64x128x128_1x4_TypeCast_v1_Nswizzle0_Quant0_MulRoutedWeight1_B16_B16_B16,1.4%,19.39,38795.11
stage2,256,16,7168,256,256,8,ActivationType.Silu,torch.bfloat16,torch.bfloat16,torch.bfloat16,QuantType.No,1,0,64,0,81.5726,moe_ck2stages_gemm2_256x64x64x64_1x4_TypeCast_v1_Nswizzle0_Quant0_MulRoutedWeight1_B16_B16_B16,1.4%,17.28,34558.55
stage2,256,16,7168,256,256,8,ActivationType.Silu,torch.bfloat16,torch.bfloat16,torch.bfloat16,QuantType.No,1,0,64,0,73.7289,moe_ck2stages_gemm2_256x64x128x64_1x4_TypeCast_v1_Nswizzle0_Quant0_MulRoutedWeight1_B16_B16_B16,1.4%,19.11,38235.09
stage1,256,16,7168,256,256,8,ActivationType.Silu,torch.bfloat16,torch.bfloat16,torch.bfloat16,QuantType.No,1,0,128,0,139.922,moe_ck2stages_gemm1_256x128x64x64_1x4_TypeCast_v1_Nswizzle0_Quant0_MulRoutedWeight0_silu_B16_B16_B16,0.0%,10.07,20147.16
stage1,256,16,7168,256,256,8,ActivationType.Silu,torch.bfloat16,torch.bfloat16,torch.bfloat16,QuantType.No,1,0,128,0,136.8894,moe_ck2stages_gemm1_256x128x128x64_1x4_TypeCast_v3_Nswizzle0_Quant0_MulRoutedWeight0_silu_B16_B16_B16,0.0%,10.3,20593.49
stage2,256,16,7168,256,256,8,ActivationType.Silu,torch.bfloat16,torch.bfloat16,torch.bfloat16,QuantType.No,1,0,128,0,107.9176,moe_ck2stages_gemm2_256x128x128x64_1x4_TypeCast_v1_Nswizzle0_Quant0_MulRoutedWeight1_B16_B16_B16,1.4%,13.06,26122.07
stage2,256,16,7168,256,256,8,ActivationType.Silu,torch.bfloat16,torch.bfloat16,torch.bfloat16,QuantType.No,1,0,128,0,107.0712,moe_ck2stages_gemm2_256x128x128x64_1x4_TypeCast_v3_Nswizzle0_Quant0_MulRoutedWeight1_B16_B16_B16,1.4%,13.16,26328.56
stage2,256,16,7168,256,256,8,ActivationType.Silu,torch.bfloat16,torch.bfloat16,torch.bfloat16,QuantType.No,1,0,128,0,107.3462,moe_ck2stages_gemm2_256x128x64x64_1x4_TypeCast_v3_Nswizzle0_Quant0_MulRoutedWeight1_B16_B16_B16,1.4%,13.13,26261.12
stage2,256,16,7168,256,256,8,ActivationType.Silu,torch.bfloat16,torch.bfloat16,torch.bfloat16,QuantType.No,1,0,128,0,121.6174,moe_ck2stages_gemm2_256x128x64x64_1x4_TypeCast_v1_Nswizzle0_Quant0_MulRoutedWeight1_B16_B16_B16,1.4%,11.59,23179.5
stage1,256,16,7168,256,256,8,ActivationType.Silu,torch.bfloat16,torch.bfloat16,torch.bfloat16,QuantType.No,1,1,32,0,132.4873,moe_ck2stages_gemm1_256x32x64x128_1x4_TypeCast_v1_Nswizzle0_Quant0_MulRoutedWeight1_silu_B16_B16_B16,0.0%,10.64,21277.75
stage1,256,16,7168,256,256,8,ActivationType.Silu,torch.bfloat16,torch.bfloat16,torch.bfloat16,QuantType.No,1,1,32,0,132.4664,moe_ck2stages_gemm1_256x32x64x64_1x4_TypeCast_v1_Nswizzle0_Quant0_MulRoutedWeight1_silu_B16_B16_B16,0.0%,10.64,21281.1
stage2,256,16,7168,256,256,8,ActivationType.Silu,torch.bfloat16,torch.bfloat16,torch.bfloat16,QuantType.No,1,1,32,0,70.4465,moe_ck2stages_gemm2_256x32x128x128_1x4_TypeCast_v1_Nswizzle0_Quant0_MulRoutedWeight0_B16_B16_B16,0.0%,20.01,40016.62
stage2,256,16,7168,256,256,8,ActivationType.Silu,torch.bfloat16,torch.bfloat16,torch.bfloat16,QuantType.No,1,1,32,0,72.4092,moe_ck2stages_gemm2_256x32x64x64_1x4_TypeCast_v1_Nswizzle0_Quant0_MulRoutedWeight0_B16_B16_B16,0.0%,19.46,38931.95
stage1,256,16,7168,256,256,8,ActivationType.Silu,torch.bfloat16,torch.bfloat16,torch.bfloat16,QuantType.No,1,1,64,0,133.7307,moe_ck2stages_gemm1_256x64x64x128_1x4_TypeCast_v1_Nswizzle0_Quant0_MulRoutedWeight1_silu_B16_B16_B16,0.0%,10.54,21079.91
stage1,256,16,7168,256,256,8,ActivationType.Silu,torch.bfloat16,torch.bfloat16,torch.bfloat16,QuantType.No,1,1,64,0,133.8678,moe_ck2stages_gemm1_256x64x64x64_1x4_TypeCast_v1_Nswizzle0_Quant0_MulRoutedWeight1_silu_B16_B16_B16,0.0%,10.53,21058.32
stage2,256,16,7168,256,256,8,ActivationType.Silu,torch.bfloat16,torch.bfloat16,torch.bfloat16,QuantType.No,1,1,64,0,69.0357,moe_ck2stages_gemm2_256x64x128x128_1x4_TypeCast_v1_Nswizzle0_Quant0_MulRoutedWeight0_B16_B16_B16,0.0%,20.41,40834.39
stage2,256,16,7168,256,256,8,ActivationType.Silu,torch.bfloat16,torch.bfloat16,torch.bfloat16,QuantType.No,1,1,64,0,75.6248,moe_ck2stages_gemm2_256x64x64x64_1x4_TypeCast_v1_Nswizzle0_Quant0_MulRoutedWeight0_B16_B16_B16,0.0%,18.64,37276.54
stage2,256,16,7168,256,256,8,ActivationType.Silu,torch.bfloat16,torch.bfloat16,torch.bfloat16,QuantType.No,1,1,64,0,71.7976,moe_ck2stages_gemm2_256x64x128x64_1x4_TypeCast_v1_Nswizzle0_Quant0_MulRoutedWeight0_B16_B16_B16,0.0%,19.63,39263.58
stage1,256,16,7168,256,256,8,ActivationType.Silu,torch.bfloat16,torch.bfloat16,torch.bfloat16,QuantType.No,1,1,128,0,139.617,moe_ck2stages_gemm1_256x128x64x64_1x4_TypeCast_v1_Nswizzle0_Quant0_MulRoutedWeight1_silu_B16_B16_B16,0.0%,10.09,20191.17
stage1,256,16,7168,256,256,8,ActivationType.Silu,torch.bfloat16,torch.bfloat16,torch.bfloat16,QuantType.No,1,1,128,0,137.6532,moe_ck2stages_gemm1_256x128x128x64_1x4_TypeCast_v3_Nswizzle0_Quant0_MulRoutedWeight1_silu_B16_B16_B16,0.0%,10.24,20479.23
stage2,256,16,7168,256,256,8,ActivationType.Silu,torch.bfloat16,torch.bfloat16,torch.bfloat16,QuantType.No,1,1,128,0,100.5899,moe_ck2stages_gemm2_256x128x128x64_1x4_TypeCast_v1_Nswizzle0_Quant0_MulRoutedWeight0_B16_B16_B16,0.0%,14.01,28024.99
stage2,256,16,7168,256,256,8,ActivationType.Silu,torch.bfloat16,torch.bfloat16,torch.bfloat16,QuantType.No,1,1,128,0,98.9216,moe_ck2stages_gemm2_256x128x128x64_1x4_TypeCast_v3_Nswizzle0_Quant0_MulRoutedWeight0_B16_B16_B16,0.0%,14.25,28497.63
stage2,256,16,7168,256,256,8,ActivationType.Silu,torch.bfloat16,torch.bfloat16,torch.bfloat16,QuantType.No,1,1,128,0,98.6854,moe_ck2stages_gemm2_256x128x64x64_1x4_TypeCast_v3_Nswizzle0_Quant0_MulRoutedWeight0_B16_B16_B16,0.0%,14.28,28565.84
stage2,256,16,7168,256,256,8,ActivationType.Silu,torch.bfloat16,torch.bfloat16,torch.bfloat16,QuantType.No,1,1,128,0,113.829,moe_ck2stages_gemm2_256x128x64x64_1x4_TypeCast_v1_Nswizzle0_Quant0_MulRoutedWeight0_B16_B16_B16,0.0%,12.38,24765.49
stage1,256,16,7168,512,256,8,ActivationType.Gelu,torch.bfloat16,torch.bfloat16,torch.bfloat16,QuantType.No,1,0,32,0,270.6469,moe_ck2stages_gemm1_256x32x64x128_1x4_TypeCast_v1_Nswizzle0_Quant0_MulRoutedWeight0_gelu_B16_B16_B16,0.0%,10.41,20830.1
stage1,256,16,7168,512,256,8,ActivationType.Gelu,torch.bfloat16,torch.bfloat16,torch.bfloat16,QuantType.No,1,0,32,0,282.0602,moe_ck2stages_gemm1_256x32x64x64_1x4_TypeCast_v1_Nswizzle0_Quant0_MulRoutedWeight0_gelu_B16_B16_B16,0.0%,9.99,19987.23
stage2,256,16,7168,512,256,8,ActivationType.Gelu,torch.bfloat16,torch.bfloat16,torch.bfloat16,QuantType.No,1,0,32,0,133.0599,moe_ck2stages_gemm2_256x32x128x128_1x4_TypeCast_v1_Nswizzle0_Quant0_MulRoutedWeight1_B16_B16_B16,3.3%,21.18,42368.91
stage2,256,16,7168,512,256,8,ActivationType.Gelu,torch.bfloat16,torch.bfloat16,torch.bfloat16,QuantType.No,1,0,32,0,134.6851,moe_ck2stages_gemm2_256x32x64x64_1x4_TypeCast_v1_Nswizzle0_Quant0_MulRoutedWeight1_B16_B16_B16,3.3%,20.93,41857.66
stage1,256,16,7168,512,256,8,ActivationType.Gelu,torch.bfloat16,torch.bfloat16,torch.bfloat16,QuantType.No,1,0,64,0,284.4471,moe_ck2stages_gemm1_256x64x64x128_1x4_TypeCast_v1_Nswizzle0_Quant0_MulRoutedWeight0_gelu_B16_B16_B16,0.0%,9.91,19819.51
stage1,256,16,7168,512,256,8,ActivationType.Gelu,torch.bfloat16,torch.bfloat16,torch.bfloat16,QuantType.No,1,0,64,0,292.6832,moe_ck2stages_gemm1_256x64x64x64_1x4_TypeCast_v1_Nswizzle0_Quant0_MulRoutedWeight0_gelu_B16_B16_B16,0.0%,9.63,19261.79
stage2,256,16,7168,512,256,8,ActivationType.Gelu,torch.bfloat16,torch.bfloat16,torch.bfloat16,QuantType.No,1,0,64,0,135.937,moe_ck2stages_gemm2_256x64x128x128_1x4_TypeCast_v1_Nswizzle0_Quant0_MulRoutedWeight1_B16_B16_B16,3.3%,20.73,41472.18
stage2,256,16,7168,512,256,8,ActivationType.Gelu,torch.bfloat16,torch.bfloat16,torch.bfloat16,QuantType.No,1,0,64,0,137.4728,moe_ck2stages_gemm2_256x64x64x64_1x4_TypeCast_v1_Nswizzle0_Quant0_MulRoutedWeight1_B16_B16_B16,3.3%,20.5,41008.86
stage2,256,16,7168,512,256,8,ActivationType.Gelu,torch.bfloat16,torch.bfloat16,torch.bfloat16,QuantType.No,1,0,64,0,136.3961,moe_ck2stages_gemm2_256x64x128x64_1x4_TypeCast_v1_Nswizzle0_Quant0_MulRoutedWeight1_B16_B16_B16,3.3%,20.66,41332.58
stage1,256,16,7168,512,256,8,ActivationType.Gelu,torch.bfloat16,torch.bfloat16,torch.bfloat16,QuantType.No,1,0,128,0,275.9607,moe_ck2stages_gemm1_256x128x64x64_1x4_TypeCast_v1_Nswizzle0_Quant0_MulRoutedWeight0_gelu_B16_B16_B16,0.0%,10.21,20429.01
stage1,256,16,7168,512,256,8,ActivationType.Gelu,torch.bfloat16,torch.bfloat16,torch.bfloat16,QuantType.No,1,0,128,0,273.9237,moe_ck2stages_gemm1_256x128x128x64_1x4_TypeCast_v3_Nswizzle0_Quant0_MulRoutedWeight0_gelu_B16_B16_B16,0.0%,10.29,20580.93
stage2,256,16,7168,512,256,8,ActivationType.Gelu,torch.bfloat16,torch.bfloat16,torch.bfloat16,QuantType.No,1,0,128,0,160.489,moe_ck2stages_gemm2_256x128x128x64_1x4_TypeCast_v1_Nswizzle0_Quant0_MulRoutedWeight1_B16_B16_B16,3.3%,17.56,35127.66
stage2,256,16,7168,512,256,8,ActivationType.Gelu,torch.bfloat16,torch.bfloat16,torch.bfloat16,QuantType.No,1,0,128,0,159.8283,moe_ck2stages_gemm2_256x128x128x64_1x4_TypeCast_v3_Nswizzle0_Quant0_MulRoutedWeight1_B16_B16_B16,3.3%,17.64,35272.87
stage2,256,16,7168,512,256,8,ActivationType.Gelu,torch.bfloat16,torch.bfloat16,torch.bfloat16,QuantType.No,1,0,128,0,160.851,moe_ck2stages_gemm2_256x128x64x64_1x4_TypeCast_v3_Nswizzle0_Quant0_MulRoutedWeight1_B16_B16_B16,3.3%,17.52,35048.61
stage2,256,16,7168,512,256,8,ActivationType.Gelu,torch.bfloat16,torch.bfloat16,torch.bfloat16,QuantType.No,1,0,128,0,180.0146,moe_ck2stages_gemm2_256x128x64x64_1x4_TypeCast_v1_Nswizzle0_Quant0_MulRoutedWeight1_B16_B16_B16,3.3%,15.66,31317.48
stage1,256,16,7168,512,256,8,ActivationType.Gelu,torch.bfloat16,torch.bfloat16,torch.bfloat16,QuantType.No,1,1,32,0,283.9316,moe_ck2stages_gemm1_256x32x64x128_1x4_TypeCast_v1_Nswizzle0_Quant0_MulRoutedWeight1_gelu_B16_B16_B16,0.0%,9.93,19855.5
stage1,256,16,7168,512,256,8,ActivationType.Gelu,torch.bfloat16,torch.bfloat16,torch.bfloat16,QuantType.No,1,1,32,0,282.181,moe_ck2stages_gemm1_256x32x64x64_1x4_TypeCast_v1_Nswizzle0_Quant0_MulRoutedWeight1_gelu_B16_B16_B16,0.0%,9.99,19978.68
stage2,256,16,7168,512,256,8,ActivationType.Gelu,torch.bfloat16,torch.bfloat16,torch.bfloat16,QuantType.No,1,1,32,0,135.5885,moe_ck2stages_gemm2_256x32x128x128_1x4_TypeCast_v1_Nswizzle0_Quant0_MulRoutedWeight0_B16_B16_B16,0.0%,20.79,41578.77
stage2,256,16,7168,512,256,8,ActivationType.Gelu,torch.bfloat16,torch.bfloat16,torch.bfloat16,QuantType.No,1,1,32,0,138.1275,moe_ck2stages_gemm2_256x32x64x64_1x4_TypeCast_v1_Nswizzle0_Quant0_MulRoutedWeight0_B16_B16_B16,0.0%,20.41,40814.49
stage1,256,16,7168,512,256,8,ActivationType.Gelu,torch.bfloat16,torch.bfloat16,torch.bfloat16,QuantType.No,1,1,64,0,273.7785,moe_ck2stages_gemm1_256x64x64x128_1x4_TypeCast_v1_Nswizzle0_Quant0_MulRoutedWeight1_gelu_B16_B16_B16,0.0%,10.3,20591.84
stage1,256,16,7168,512,256,8,ActivationType.Gelu,torch.bfloat16,torch.bfloat16,torch.bfloat16,QuantType.No,1,1,64,0,284.1907,moe_ck2stages_gemm1_256x64x64x64_1x4_TypeCast_v1_Nswizzle0_Quant0_MulRoutedWeight1_gelu_B16_B16_B16,0.0%,9.92,19837.4
stage2,256,16,7168,512,256,8,ActivationType.Gelu,torch.bfloat16,torch.bfloat16,torch.bfloat16,QuantType.No,1,1,64,0,133.3163,moe_ck2stages_gemm2_256x64x128x128_1x4_TypeCast_v1_Nswizzle0_Quant0_MulRoutedWeight0_B16_B16_B16,0.0%,21.14,42287.43
stage2,256,16,7168,512,256,8,ActivationType.Gelu,torch.bfloat16,torch.bfloat16,torch.bfloat16,QuantType.No,1,1,64,0,132.9904,moe_ck2stages_gemm2_256x64x64x64_1x4_TypeCast_v1_Nswizzle0_Quant0_MulRoutedWeight0_B16_B16_B16,0.0%,21.19,42391.05
stage2,256,16,7168,512,256,8,ActivationType.Gelu,torch.bfloat16,torch.bfloat16,torch.bfloat16,QuantType.No,1,1,64,0,133.3419,moe_ck2stages_gemm2_256x64x128x64_1x4_TypeCast_v1_Nswizzle0_Quant0_MulRoutedWeight0_B16_B16_B16,0.0%,21.14,42279.31
stage1,256,16,7168,512,256,8,ActivationType.Gelu,torch.bfloat16,torch.bfloat16,torch.bfloat16,QuantType.No,1,1,128,0,276.2882,moe_ck2stages_gemm1_256x128x64x64_1x4_TypeCast_v1_Nswizzle0_Quant0_MulRoutedWeight1_gelu_B16_B16_B16,0.0%,10.2,20404.79
stage1,256,16,7168,512,256,8,ActivationType.Gelu,torch.bfloat16,torch.bfloat16,torch.bfloat16,QuantType.No,1,1,128,0,278.8634,moe_ck2stages_gemm1_256x128x128x64_1x4_TypeCast_v3_Nswizzle0_Quant0_MulRoutedWeight1_gelu_B16_B16_B16,0.0%,10.11,20216.36
stage2,256,16,7168,512,256,8,ActivationType.Gelu,torch.bfloat16,torch.bfloat16,torch.bfloat16,QuantType.No,1,1,128,0,153.642,moe_ck2stages_gemm2_256x128x128x64_1x4_TypeCast_v1_Nswizzle0_Quant0_MulRoutedWeight0_B16_B16_B16,0.0%,18.35,36693.11
stage2,256,16,7168,512,256,8,ActivationType.Gelu,torch.bfloat16,torch.bfloat16,torch.bfloat16,QuantType.No,1,1,128,0,152.0437,moe_ck2stages_gemm2_256x128x128x64_1x4_TypeCast_v3_Nswizzle0_Quant0_MulRoutedWeight0_B16_B16_B16,0.0%,18.54,37078.84
stage2,256,16,7168,512,256,8,ActivationType.Gelu,torch.bfloat16,torch.bfloat16,torch.bfloat16,QuantType.No,1,1,128,0,151.2064,moe_ck2stages_gemm2_256x128x64x64_1x4_TypeCast_v3_Nswizzle0_Quant0_MulRoutedWeight0_B16_B16_B16,0.0%,18.64,37284.16
stage2,256,16,7168,512,256,8,ActivationType.Gelu,torch.bfloat16,torch.bfloat16,torch.bfloat16,QuantType.No,1,1,128,0,168.9331,moe_ck2stages_gemm2_256x128x64x64_1x4_TypeCast_v1_Nswizzle0_Quant0_MulRoutedWeight0_B16_B16_B16,0.0%,16.68,33371.81
stage1,256,16,7168,512,256,8,ActivationType.Silu,torch.bfloat16,torch.bfloat16,torch.bfloat16,QuantType.No,1,0,32,0,272.594,moe_ck2stages_gemm1_256x32x64x128_1x4_TypeCast_v1_Nswizzle0_Quant0_MulRoutedWeight0_silu_B16_B16_B16,0.0%,10.34,20681.32
stage1,256,16,7168,512,256,8,ActivationType.Silu,torch.bfloat16,torch.bfloat16,torch.bfloat16,QuantType.No,1,0,32,0,281.6712,moe_ck2stages_gemm1_256x32x64x64_1x4_TypeCast_v1_Nswizzle0_Quant0_MulRoutedWeight0_silu_B16_B16_B16,0.0%,10.01,20014.84
stage2,256,16,7168,512,256,8,ActivationType.Silu,torch.bfloat16,torch.bfloat16,torch.bfloat16,QuantType.No,1,0,32,0,133.135,moe_ck2stages_gemm2_256x32x128x128_1x4_TypeCast_v1_Nswizzle0_Quant0_MulRoutedWeight1_B16_B16_B16,2.8%,21.17,42345.01
stage2,256,16,7168,512,256,8,ActivationType.Silu,torch.bfloat16,torch.bfloat16,torch.bfloat16,QuantType.No,1,0,32,0,134.4777,moe_ck2stages_gemm2_256x32x64x64_1x4_TypeCast_v1_Nswizzle0_Quant0_MulRoutedWeight1_B16_B16_B16,2.8%,20.96,41922.22
stage1,256,16,7168,512,256,8,ActivationType.Silu,torch.bfloat16,torch.bfloat16,torch.bfloat16,QuantType.No,1,0,64,0,274.2324,moe_ck2stages_gemm1_256x64x64x128_1x4_TypeCast_v1_Nswizzle0_Quant0_MulRoutedWeight0_silu_B16_B16_B16,0.0%,10.28,20557.76
stage1,256,16,7168,512,256,8,ActivationType.Silu,torch.bfloat16,torch.bfloat16,torch.bfloat16,QuantType.No,1,0,64,0,282.4913,moe_ck2stages_gemm1_256x64x64x64_1x4_TypeCast_v1_Nswizzle0_Quant0_MulRoutedWeight0_silu_B16_B16_B16,0.0%,9.98,19956.73
stage2,256,16,7168,512,256,8,ActivationType.Silu,torch.bfloat16,torch.bfloat16,torch.bfloat16,QuantType.No,1,0,64,0,135.9353,moe_ck2stages_gemm2_256x64x128x128_1x4_TypeCast_v1_Nswizzle0_Quant0_MulRoutedWeight1_B16_B16_B16,2.8%,20.73,41472.7
stage2,256,16,7168,512,256,8,ActivationType.Silu,torch.bfloat16,torch.bfloat16,torch.bfloat16,QuantType.No,1,0,64,0,135.1399,moe_ck2stages_gemm2_256x64x64x64_1x4_TypeCast_v1_Nswizzle0_Quant0_MulRoutedWeight1_B16_B16_B16,2.8%,20.86,41716.79
stage2,256,16,7168,512,256,8,ActivationType.Silu,torch.bfloat16,torch.bfloat16,torch.bfloat16,QuantType.No,1,0,64,0,133.8369,moe_ck2stages_gemm2_256x64x128x64_1x4_TypeCast_v1_Nswizzle0_Quant0_MulRoutedWeight1_B16_B16_B16,2.8%,21.06,42122.94
stage1,256,16,7168,512,256,8,ActivationType.Silu,torch.bfloat16,torch.bfloat16,torch.bfloat16,QuantType.No,1,0,128,0,274.9378,moe_ck2stages_gemm1_256x128x64x64_1x4_TypeCast_v1_Nswizzle0_Quant0_MulRoutedWeight0_silu_B16_B16_B16,0.0%,10.25,20505.01
stage1,256,16,7168,512,256,8,ActivationType.Silu,torch.bfloat16,torch.bfloat16,torch.bfloat16,QuantType.No,1,0,128,0,277.485,moe_ck2stages_gemm1_256x128x128x64_1x4_TypeCast_v3_Nswizzle0_Quant0_MulRoutedWeight0_silu_B16_B16_B16,0.0%,10.16,20316.79
stage2,256,16,7168,512,256,8,ActivationType.Silu,torch.bfloat16,torch.bfloat16,torch.bfloat16,QuantType.No,1,0,128,0,159.9793,moe_ck2stages_gemm2_256x128x128x64_1x4_TypeCast_v1_Nswizzle0_Quant0_MulRoutedWeight1_B16_B16_B16,2.9%,17.62,35239.58
stage2,256,16,7168,512,256,8,ActivationType.Silu,torch.bfloat16,torch.bfloat16,torch.bfloat16,QuantType.No,1,0,128,0,159.4867,moe_ck2stages_gemm2_256x128x128x64_1x4_TypeCast_v3_Nswizzle0_Quant0_MulRoutedWeight1_B16_B16_B16,2.8%,17.67,35348.42
stage2,256,16,7168,512,256,8,ActivationType.Silu,torch.bfloat16,torch.bfloat16,torch.bfloat16,QuantType.No,1,0,128,0,159.6745,moe_ck2stages_gemm2_256x128x64x64_1x4_TypeCast_v3_Nswizzle0_Quant0_MulRoutedWeight1_B16_B16_B16,2.8%,17.65,35306.85
stage2,256,16,7168,512,256,8,ActivationType.Silu,torch.bfloat16,torch.bfloat16,torch.bfloat16,QuantType.No,1,0,128,0,178.1176,moe_ck2stages_gemm2_256x128x64x64_1x4_TypeCast_v1_Nswizzle0_Quant0_MulRoutedWeight1_B16_B16_B16,2.8%,15.82,31651.02
stage1,256,16,7168,512,256,8,ActivationType.Silu,torch.bfloat16,torch.bfloat16,torch.bfloat16,QuantType.No,1,1,32,0,271.36,moe_ck2stages_gemm1_256x32x64x128_1x4_TypeCast_v1_Nswizzle0_Quant0_MulRoutedWeight1_silu_B16_B16_B16,0.0%,10.39,20775.37
stage1,256,16,7168,512,256,8,ActivationType.Silu,torch.bfloat16,torch.bfloat16,torch.bfloat16,QuantType.No,1,1,32,0,281.3028,moe_ck2stages_gemm1_256x32x64x64_1x4_TypeCast_v1_Nswizzle0_Quant0_MulRoutedWeight1_silu_B16_B16_B16,0.0%,10.02,20041.05
stage2,256,16,7168,512,256,8,ActivationType.Silu,torch.bfloat16,torch.bfloat16,torch.bfloat16,QuantType.No,1,1,32,0,133.3885,moe_ck2stages_gemm2_256x32x128x128_1x4_TypeCast_v1_Nswizzle0_Quant0_MulRoutedWeight0_B16_B16_B16,0.0%,21.13,42264.54
stage2,256,16,7168,512,256,8,ActivationType.Silu,torch.bfloat16,torch.bfloat16,torch.bfloat16,QuantType.No,1,1,32,0,135.2846,moe_ck2stages_gemm2_256x32x64x64_1x4_TypeCast_v1_Nswizzle0_Quant0_MulRoutedWeight0_B16_B16_B16,0.0%,20.83,41672.17
stage1,256,16,7168,512,256,8,ActivationType.Silu,torch.bfloat16,torch.bfloat16,torch.bfloat16,QuantType.No,1,1,64,0,274.3673,moe_ck2stages_gemm1_256x64x64x128_1x4_TypeCast_v1_Nswizzle0_Quant0_MulRoutedWeight1_silu_B16_B16_B16,0.0%,10.27,20547.65
stage1,256,16,7168,512,256,8,ActivationType.Silu,torch.bfloat16,torch.bfloat16,torch.bfloat16,QuantType.No,1,1,64,0,284.0291,moe_ck2stages_gemm1_256x64x64x64_1x4_TypeCast_v1_Nswizzle0_Quant0_MulRoutedWeight1_silu_B16_B16_B16,0.0%,9.92,19848.68
stage2,256,16,7168,512,256,8,ActivationType.Silu,torch.bfloat16,torch.bfloat16,torch.bfloat16,QuantType.No,1,1,64,0,133.1264,moe_ck2stages_gemm2_256x64x128x128_1x4_TypeCast_v1_Nswizzle0_Quant0_MulRoutedWeight0_B16_B16_B16,0.0%,21.17,42347.75
stage2,256,16,7168,512,256,8,ActivationType.Silu,torch.bfloat16,torch.bfloat16,torch.bfloat16,QuantType.No,1,1,64,0,132.6568,moe_ck2stages_gemm2_256x64x64x64_1x4_TypeCast_v1_Nswizzle0_Quant0_MulRoutedWeight0_B16_B16_B16,0.0%,21.25,42497.66
stage2,256,16,7168,512,256,8,ActivationType.Silu,torch.bfloat16,torch.bfloat16,torch.bfloat16,QuantType.No,1,1,64,0,133.8235,moe_ck2stages_gemm2_256x64x128x64_1x4_TypeCast_v1_Nswizzle0_Quant0_MulRoutedWeight0_B16_B16_B16,0.0%,21.06,42127.16
stage1,256,16,7168,512,256,8,ActivationType.Silu,torch.bfloat16,torch.bfloat16,torch.bfloat16,QuantType.No,1,1,128,0,277.3986,moe_ck2stages_gemm1_256x128x64x64_1x4_TypeCast_v1_Nswizzle0_Quant0_MulRoutedWeight1_silu_B16_B16_B16,0.0%,10.16,20323.11
stage1,256,16,7168,512,256,8,ActivationType.Silu,torch.bfloat16,torch.bfloat16,torch.bfloat16,QuantType.No,1,1,128,0,277.8855,moe_ck2stages_gemm1_256x128x128x64_1x4_TypeCast_v3_Nswizzle0_Quant0_MulRoutedWeight1_silu_B16_B16_B16,0.0%,10.14,20287.5
stage2,256,16,7168,512,256,8,ActivationType.Silu,torch.bfloat16,torch.bfloat16,torch.bfloat16,QuantType.No,1,1,128,0,154.3072,moe_ck2stages_gemm2_256x128x128x64_1x4_TypeCast_v1_Nswizzle0_Quant0_MulRoutedWeight0_B16_B16_B16,0.0%,18.27,36534.93
stage2,256,16,7168,512,256,8,ActivationType.Silu,torch.bfloat16,torch.bfloat16,torch.bfloat16,QuantType.No,1,1,128,0,152.3212,moe_ck2stages_gemm2_256x128x128x64_1x4_TypeCast_v3_Nswizzle0_Quant0_MulRoutedWeight0_B16_B16_B16,0.0%,18.5,37011.28
stage2,256,16,7168,512,256,8,ActivationType.Silu,torch.bfloat16,torch.bfloat16,torch.bfloat16,QuantType.No,1,1,128,0,151.4971,moe_ck2stages_gemm2_256x128x64x64_1x4_TypeCast_v3_Nswizzle0_Quant0_MulRoutedWeight0_B16_B16_B16,0.0%,18.6,37212.62
stage2,256,16,7168,512,256,8,ActivationType.Silu,torch.bfloat16,torch.bfloat16,torch.bfloat16,QuantType.No,1,1,128,0,169.2249,moe_ck2stages_gemm2_256x128x64x64_1x4_TypeCast_v1_Nswizzle0_Quant0_MulRoutedWeight0_B16_B16_B16,0.0%,16.66,33314.27
stage1,256,256,2048,192,128,8,ActivationType.Gelu,torch.bfloat16,torch.bfloat16,torch.bfloat16,QuantType.No,1,0,32,0,42.7296,moe_ck2stages_gemm1_256x32x64x128_1x4_TypeCast_v1_Nswizzle0_Quant0_MulRoutedWeight0_gelu_B16_B16_B16,0.0%,113.08,7116.54
stage1,256,256,2048,192,128,8,ActivationType.Gelu,torch.bfloat16,torch.bfloat16,torch.bfloat16,QuantType.No,1,0,32,0,39.5876,moe_ck2stages_gemm1_256x32x64x64_1x4_TypeCast_v1_Nswizzle0_Quant0_MulRoutedWeight0_gelu_B16_B16_B16,0.0%,122.05,7681.37
stage2,256,256,2048,192,128,8,ActivationType.Gelu,torch.bfloat16,torch.bfloat16,torch.bfloat16,QuantType.No,1,0,32,0,inf,moe_ck2stages_gemm2_256x32x128x128_1x4_TypeCast_v1_Nswizzle0_Quant0_MulRoutedWeight1_B16_B16_B16,100.0%,0.0,0.0
stage2,256,256,2048,192,128,8,ActivationType.Gelu,torch.bfloat16,torch.bfloat16,torch.bfloat16,QuantType.No,1,0,32,0,26.1219,moe_ck2stages_gemm2_256x32x64x64_1x4_TypeCast_v1_Nswizzle0_Quant0_MulRoutedWeight1_B16_B16_B16,0.0%,184.97,11641.08
stage1,256,256,2048,192,128,8,ActivationType.Gelu,torch.bfloat16,torch.bfloat16,torch.bfloat16,QuantType.No,1,0,64,0,43.8352,moe_ck2stages_gemm1_256x64x64x128_1x4_TypeCast_v1_Nswizzle0_Quant0_MulRoutedWeight0_gelu_B16_B16_B16,0.0%,110.23,6937.05
stage1,256,256,2048,192,128,8,ActivationType.Gelu,torch.bfloat16,torch.bfloat16,torch.bfloat16,QuantType.No,1,0,64,0,42.268,moe_ck2stages_gemm1_256x64x64x64_1x4_TypeCast_v1_Nswizzle0_Quant0_MulRoutedWeight0_gelu_B16_B16_B16,0.0%,114.31,7194.26
stage2,256,256,2048,192,128,8,ActivationType.Gelu,torch.bfloat16,torch.bfloat16,torch.bfloat16,QuantType.No,1,0,64,0,inf,moe_ck2stages_gemm2_256x64x128x128_1x4_TypeCast_v1_Nswizzle0_Quant0_MulRoutedWeight1_B16_B16_B16,100.0%,0.0,0.0
stage2,256,256,2048,192,128,8,ActivationType.Gelu,torch.bfloat16,torch.bfloat16,torch.bfloat16,QuantType.No,1,0,64,0,32.3798,moe_ck2stages_gemm2_256x64x64x64_1x4_TypeCast_v1_Nswizzle0_Quant0_MulRoutedWeight1_B16_B16_B16,0.0%,149.22,9391.26
stage2,256,256,2048,192,128,8,ActivationType.Gelu,torch.bfloat16,torch.bfloat16,torch.bfloat16,QuantType.No,1,0,64,0,33.2622,moe_ck2stages_gemm2_256x64x128x64_1x4_TypeCast_v1_Nswizzle0_Quant0_MulRoutedWeight1_B16_B16_B16,0.0%,145.27,9142.12
stage1,256,256,2048,192,128,8,ActivationType.Gelu,torch.bfloat16,torch.bfloat16,torch.bfloat16,QuantType.No,1,0,128,0,44.5522,moe_ck2stages_gemm1_256x128x64x64_1x4_TypeCast_v1_Nswizzle0_Quant0_MulRoutedWeight0_gelu_B16_B16_B16,0.0%,108.45,6825.41
stage1,256,256,2048,192,128,8,ActivationType.Gelu,torch.bfloat16,torch.bfloat16,torch.bfloat16,QuantType.No,1,0,128,0,inf,moe_ck2stages_gemm1_256x128x128x64_1x4_TypeCast_v3_Nswizzle0_Quant0_MulRoutedWeight0_gelu_B16_B16_B16,100.0%,0.0,0.0
stage2,256,256,2048,192,128,8,ActivationType.Gelu,torch.bfloat16,torch.bfloat16,torch.bfloat16,QuantType.No,1,0,128,0,45.005,moe_ck2stages_gemm2_256x128x128x64_1x4_TypeCast_v1_Nswizzle0_Quant0_MulRoutedWeight1_B16_B16_B16,0.0%,107.36,6756.74
stage2,256,256,2048,192,128,8,ActivationType.Gelu,torch.bfloat16,torch.bfloat16,torch.bfloat16,QuantType.No,1,0,128,0,44.1616,moe_ck2stages_gemm2_256x128x128x64_1x4_TypeCast_v3_Nswizzle0_Quant0_MulRoutedWeight1_B16_B16_B16,0.0%,109.41,6885.78
stage2,256,256,2048,192,128,8,ActivationType.Gelu,torch.bfloat16,torch.bfloat16,torch.bfloat16,QuantType.No,1,0,128,0,42.3213,moe_ck2stages_gemm2_256x128x64x64_1x4_TypeCast_v3_Nswizzle0_Quant0_MulRoutedWeight1_B16_B16_B16,0.0%,114.17,7185.2
stage2,256,256,2048,192,128,8,ActivationType.Gelu,torch.bfloat16,torch.bfloat16,torch.bfloat16,QuantType.No,1,0,128,0,47.3329,moe_ck2stages_gemm2_256x128x64x64_1x4_TypeCast_v1_Nswizzle0_Quant0_MulRoutedWeight1_B16_B16_B16,0.0%,102.08,6424.43
stage1,256,256,2048,192,128,8,ActivationType.Gelu,torch.bfloat16,torch.bfloat16,torch.bfloat16,QuantType.No,1,1,32,0,42.8998,moe_ck2stages_gemm1_256x32x64x128_1x4_TypeCast_v1_Nswizzle0_Quant0_MulRoutedWeight1_gelu_B16_B16_B16,0.0%,112.63,7088.31
stage1,256,256,2048,192,128,8,ActivationType.Gelu,torch.bfloat16,torch.bfloat16,torch.bfloat16,QuantType.No,1,1,32,0,39.9444,moe_ck2stages_gemm1_256x32x64x64_1x4_TypeCast_v1_Nswizzle0_Quant0_MulRoutedWeight1_gelu_B16_B16_B16,0.0%,120.96,7612.76
stage2,256,256,2048,192,128,8,ActivationType.Gelu,torch.bfloat16,torch.bfloat16,torch.bfloat16,QuantType.No,1,1,32,0,inf,moe_ck2stages_gemm2_256x32x128x128_1x4_TypeCast_v1_Nswizzle0_Quant0_MulRoutedWeight0_B16_B16_B16,100.0%,0.0,0.0
stage2,256,256,2048,192,128,8,ActivationType.Gelu,torch.bfloat16,torch.bfloat16,torch.bfloat16,QuantType.No,1,1,32,0,26.1236,moe_ck2stages_gemm2_256x32x64x64_1x4_TypeCast_v1_Nswizzle0_Quant0_MulRoutedWeight0_B16_B16_B16,0.0%,184.96,11640.32
stage1,256,256,2048,192,128,8,ActivationType.Gelu,torch.bfloat16,torch.bfloat16,torch.bfloat16,QuantType.No,1,1,64,0,45.4876,moe_ck2stages_gemm1_256x64x64x128_1x4_TypeCast_v1_Nswizzle0_Quant0_MulRoutedWeight1_gelu_B16_B16_B16,0.0%,106.22,6685.05
stage1,256,256,2048,192,128,8,ActivationType.Gelu,torch.bfloat16,torch.bfloat16,torch.bfloat16,QuantType.No,1,1,64,0,41.1623,moe_ck2stages_gemm1_256x64x64x64_1x4_TypeCast_v1_Nswizzle0_Quant0_MulRoutedWeight1_gelu_B16_B16_B16,0.0%,117.39,7387.51
stage2,256,256,2048,192,128,8,ActivationType.Gelu,torch.bfloat16,torch.bfloat16,torch.bfloat16,QuantType.No,1,1,64,0,inf,moe_ck2stages_gemm2_256x64x128x128_1x4_TypeCast_v1_Nswizzle0_Quant0_MulRoutedWeight0_B16_B16_B16,100.0%,0.0,0.0
stage2,256,256,2048,192,128,8,ActivationType.Gelu,torch.bfloat16,torch.bfloat16,torch.bfloat16,QuantType.No,1,1,64,0,30.1291,moe_ck2stages_gemm2_256x64x64x64_1x4_TypeCast_v1_Nswizzle0_Quant0_MulRoutedWeight0_B16_B16_B16,0.0%,160.37,10092.8
stage2,256,256,2048,192,128,8,ActivationType.Gelu,torch.bfloat16,torch.bfloat16,torch.bfloat16,QuantType.No,1,1,64,0,32.4878,moe_ck2stages_gemm2_256x64x128x64_1x4_TypeCast_v1_Nswizzle0_Quant0_MulRoutedWeight0_B16_B16_B16,0.0%,148.73,9360.04
stage1,256,256,2048,192,128,8,ActivationType.Gelu,torch.bfloat16,torch.bfloat16,torch.bfloat16,QuantType.No,1,1,128,0,44.4258,moe_ck2stages_gemm1_256x128x64x64_1x4_TypeCast_v1_Nswizzle0_Quant0_MulRoutedWeight1_gelu_B16_B16_B16,0.0%,108.76,6844.83
stage1,256,256,2048,192,128,8,ActivationType.Gelu,torch.bfloat16,torch.bfloat16,torch.bfloat16,QuantType.No,1,1,128,0,inf,moe_ck2stages_gemm1_256x128x128x64_1x4_TypeCast_v3_Nswizzle0_Quant0_MulRoutedWeight1_gelu_B16_B16_B16,100.0%,0.0,0.0
stage2,256,256,2048,192,128,8,ActivationType.Gelu,torch.bfloat16,torch.bfloat16,torch.bfloat16,QuantType.No,1,1,128,0,42.0073,moe_ck2stages_gemm2_256x128x128x64_1x4_TypeCast_v1_Nswizzle0_Quant0_MulRoutedWeight0_B16_B16_B16,0.0%,115.02,7238.91
stage2,256,256,2048,192,128,8,ActivationType.Gelu,torch.bfloat16,torch.bfloat16,torch.bfloat16,QuantType.No,1,1,128,0,42.3428,moe_ck2stages_gemm2_256x128x128x64_1x4_TypeCast_v3_Nswizzle0_Quant0_MulRoutedWeight0_B16_B16_B16,0.0%,114.11,7181.55
stage2,256,256,2048,192,128,8,ActivationType.Gelu,torch.bfloat16,torch.bfloat16,torch.bfloat16,QuantType.No,1,1,128,0,37.9141,moe_ck2stages_gemm2_256x128x64x64_1x4_TypeCast_v3_Nswizzle0_Quant0_MulRoutedWeight0_B16_B16_B16,0.0%,127.44,8020.42
stage2,256,256,2048,192,128,8,ActivationType.Gelu,torch.bfloat16,torch.bfloat16,torch.bfloat16,QuantType.No,1,1,128,0,43.2343,moe_ck2stages_gemm2_256x128x64x64_1x4_TypeCast_v1_Nswizzle0_Quant0_MulRoutedWeight0_B16_B16_B16,0.0%,111.76,7033.47
stage1,256,256,2048,192,128,8,ActivationType.Silu,torch.bfloat16,torch.bfloat16,torch.bfloat16,QuantType.No,1,0,32,0,42.282,moe_ck2stages_gemm1_256x32x64x128_1x4_TypeCast_v1_Nswizzle0_Quant0_MulRoutedWeight0_silu_B16_B16_B16,0.0%,114.28,7191.88
stage1,256,256,2048,192,128,8,ActivationType.Silu,torch.bfloat16,torch.bfloat16,torch.bfloat16,QuantType.No,1,0,32,0,41.4859,moe_ck2stages_gemm1_256x32x64x64_1x4_TypeCast_v1_Nswizzle0_Quant0_MulRoutedWeight0_silu_B16_B16_B16,0.0%,116.47,7329.89
stage2,256,256,2048,192,128,8,ActivationType.Silu,torch.bfloat16,torch.bfloat16,torch.bfloat16,QuantType.No,1,0,32,0,inf,moe_ck2stages_gemm2_256x32x128x128_1x4_TypeCast_v1_Nswizzle0_Quant0_MulRoutedWeight1_B16_B16_B16,100.0%,0.0,0.0
stage2,256,256,2048,192,128,8,ActivationType.Silu,torch.bfloat16,torch.bfloat16,torch.bfloat16,QuantType.No,1,0,32,0,26.004,moe_ck2stages_gemm2_256x32x64x64_1x4_TypeCast_v1_Nswizzle0_Quant0_MulRoutedWeight1_B16_B16_B16,0.0%,185.81,11693.86
stage1,256,256,2048,192,128,8,ActivationType.Silu,torch.bfloat16,torch.bfloat16,torch.bfloat16,QuantType.No,1,0,64,0,45.0806,moe_ck2stages_gemm1_256x64x64x128_1x4_TypeCast_v1_Nswizzle0_Quant0_MulRoutedWeight0_silu_B16_B16_B16,0.0%,107.18,6745.41
stage1,256,256,2048,192,128,8,ActivationType.Silu,torch.bfloat16,torch.bfloat16,torch.bfloat16,QuantType.No,1,0,64,0,41.2271,moe_ck2stages_gemm1_256x64x64x64_1x4_TypeCast_v1_Nswizzle0_Quant0_MulRoutedWeight0_silu_B16_B16_B16,0.0%,117.2,7375.9
stage2,256,256,2048,192,128,8,ActivationType.Silu,torch.bfloat16,torch.bfloat16,torch.bfloat16,QuantType.No,1,0,64,0,inf,moe_ck2stages_gemm2_256x64x128x128_1x4_TypeCast_v1_Nswizzle0_Quant0_MulRoutedWeight1_B16_B16_B16,100.0%,0.0,0.0
stage2,256,256,2048,192,128,8,ActivationType.Silu,torch.bfloat16,torch.bfloat16,torch.bfloat16,QuantType.No,1,0,64,0,31.7967,moe_ck2stages_gemm2_256x64x64x64_1x4_TypeCast_v1_Nswizzle0_Quant0_MulRoutedWeight1_B16_B16_B16,0.0%,151.96,9563.48
stage2,256,256,2048,192,128,8,ActivationType.Silu,torch.bfloat16,torch.bfloat16,torch.bfloat16,QuantType.No,1,0,64,0,33.1915,moe_ck2stages_gemm2_256x64x128x64_1x4_TypeCast_v1_Nswizzle0_Quant0_MulRoutedWeight1_B16_B16_B16,0.0%,145.57,9161.59
stage1,256,256,2048,192,128,8,ActivationType.Silu,torch.bfloat16,torch.bfloat16,torch.bfloat16,QuantType.No,1,0,128,0,44.4005,moe_ck2stages_gemm1_256x128x64x64_1x4_TypeCast_v1_Nswizzle0_Quant0_MulRoutedWeight0_silu_B16_B16_B16,0.0%,108.82,6848.73
stage1,256,256,2048,192,128,8,ActivationType.Silu,torch.bfloat16,torch.bfloat16,torch.bfloat16,QuantType.No,1,0,128,0,inf,moe_ck2stages_gemm1_256x128x128x64_1x4_TypeCast_v3_Nswizzle0_Quant0_MulRoutedWeight0_silu_B16_B16_B16,100.0%,0.0,0.0
stage2,256,256,2048,192,128,8,ActivationType.Silu,torch.bfloat16,torch.bfloat16,torch.bfloat16,QuantType.No,1,0,128,0,44.3282,moe_ck2stages_gemm2_256x128x128x64_1x4_TypeCast_v1_Nswizzle0_Quant0_MulRoutedWeight1_B16_B16_B16,0.0%,109.0,6859.9
stage2,256,256,2048,192,128,8,ActivationType.Silu,torch.bfloat16,torch.bfloat16,torch.bfloat16,QuantType.No,1,0,128,0,43.722,moe_ck2stages_gemm2_256x128x128x64_1x4_TypeCast_v3_Nswizzle0_Quant0_MulRoutedWeight1_B16_B16_B16,0.0%,110.51,6955.01
stage2,256,256,2048,192,128,8,ActivationType.Silu,torch.bfloat16,torch.bfloat16,torch.bfloat16,QuantType.No,1,0,128,0,41.167,moe_ck2stages_gemm2_256x128x64x64_1x4_TypeCast_v3_Nswizzle0_Quant0_MulRoutedWeight1_B16_B16_B16,0.0%,117.37,7386.67
stage2,256,256,2048,192,128,8,ActivationType.Silu,torch.bfloat16,torch.bfloat16,torch.bfloat16,QuantType.No,1,0,128,0,47.2224,moe_ck2stages_gemm2_256x128x64x64_1x4_TypeCast_v1_Nswizzle0_Quant0_MulRoutedWeight1_B16_B16_B16,0.0%,102.32,6439.47
stage1,256,256,2048,192,128,8,ActivationType.Silu,torch.bfloat16,torch.bfloat16,torch.bfloat16,QuantType.No,1,1,32,0,42.8253,moe_ck2stages_gemm1_256x32x64x128_1x4_TypeCast_v1_Nswizzle0_Quant0_MulRoutedWeight1_silu_B16_B16_B16,0.0%,112.83,7100.64
stage1,256,256,2048,192,128,8,ActivationType.Silu,torch.bfloat16,torch.bfloat16,torch.bfloat16,QuantType.No,1,1,32,0,40.4988,moe_ck2stages_gemm1_256x32x64x64_1x4_TypeCast_v1_Nswizzle0_Quant0_MulRoutedWeight1_silu_B16_B16_B16,0.0%,119.31,7508.54
stage2,256,256,2048,192,128,8,ActivationType.Silu,torch.bfloat16,torch.bfloat16,torch.bfloat16,QuantType.No,1,1,32,0,inf,moe_ck2stages_gemm2_256x32x128x128_1x4_TypeCast_v1_Nswizzle0_Quant0_MulRoutedWeight0_B16_B16_B16,100.0%,0.0,0.0
stage2,256,256,2048,192,128,8,ActivationType.Silu,torch.bfloat16,torch.bfloat16,torch.bfloat16,QuantType.No,1,1,32,0,25.1292,moe_ck2stages_gemm2_256x32x64x64_1x4_TypeCast_v1_Nswizzle0_Quant0_MulRoutedWeight0_B16_B16_B16,0.0%,192.28,12100.94
stage1,256,256,2048,192,128,8,ActivationType.Silu,torch.bfloat16,torch.bfloat16,torch.bfloat16,QuantType.No,1,1,64,0,44.833,moe_ck2stages_gemm1_256x64x64x128_1x4_TypeCast_v1_Nswizzle0_Quant0_MulRoutedWeight1_silu_B16_B16_B16,0.0%,107.77,6782.66
stage1,256,256,2048,192,128,8,ActivationType.Silu,torch.bfloat16,torch.bfloat16,torch.bfloat16,QuantType.No,1,1,64,0,41.3475,moe_ck2stages_gemm1_256x64x64x64_1x4_TypeCast_v1_Nswizzle0_Quant0_MulRoutedWeight1_silu_B16_B16_B16,0.0%,116.86,7354.42
stage2,256,256,2048,192,128,8,ActivationType.Silu,torch.bfloat16,torch.bfloat16,torch.bfloat16,QuantType.No,1,1,64,0,inf,moe_ck2stages_gemm2_256x64x128x128_1x4_TypeCast_v1_Nswizzle0_Quant0_MulRoutedWeight0_B16_B16_B16,100.0%,0.0,0.0
stage2,256,256,2048,192,128,8,ActivationType.Silu,torch.bfloat16,torch.bfloat16,torch.bfloat16,QuantType.No,1,1,64,0,29.5902,moe_ck2stages_gemm2_256x64x64x64_1x4_TypeCast_v1_Nswizzle0_Quant0_MulRoutedWeight0_B16_B16_B16,0.0%,163.29,10276.61
stage2,256,256,2048,192,128,8,ActivationType.Silu,torch.bfloat16,torch.bfloat16,torch.bfloat16,QuantType.No,1,1,64,0,31.9556,moe_ck2stages_gemm2_256x64x128x64_1x4_TypeCast_v1_Nswizzle0_Quant0_MulRoutedWeight0_B16_B16_B16,0.0%,151.2,9515.92
stage1,256,256,2048,192,128,8,ActivationType.Silu,torch.bfloat16,torch.bfloat16,torch.bfloat16,QuantType.No,1,1,128,0,45.1163,moe_ck2stages_gemm1_256x128x64x64_1x4_TypeCast_v1_Nswizzle0_Quant0_MulRoutedWeight1_silu_B16_B16_B16,0.0%,107.1,6740.07
stage1,256,256,2048,192,128,8,ActivationType.Silu,torch.bfloat16,torch.bfloat16,torch.bfloat16,QuantType.No,1,1,128,0,inf,moe_ck2stages_gemm1_256x128x128x64_1x4_TypeCast_v3_Nswizzle0_Quant0_MulRoutedWeight1_silu_B16_B16_B16,100.0%,0.0,0.0
stage2,256,256,2048,192,128,8,ActivationType.Silu,torch.bfloat16,torch.bfloat16,torch.bfloat16,QuantType.No,1,1,128,0,41.6796,moe_ck2stages_gemm2_256x128x128x64_1x4_TypeCast_v1_Nswizzle0_Quant0_MulRoutedWeight0_B16_B16_B16,0.0%,115.93,7295.82
stage2,256,256,2048,192,128,8,ActivationType.Silu,torch.bfloat16,torch.bfloat16,torch.bfloat16,QuantType.No,1,1,128,0,41.8366,moe_ck2stages_gemm2_256x128x128x64_1x4_TypeCast_v3_Nswizzle0_Quant0_MulRoutedWeight0_B16_B16_B16,0.0%,115.49,7268.45
stage2,256,256,2048,192,128,8,ActivationType.Silu,torch.bfloat16,torch.bfloat16,torch.bfloat16,QuantType.No,1,1,128,0,37.9279,moe_ck2stages_gemm2_256x128x64x64_1x4_TypeCast_v3_Nswizzle0_Quant0_MulRoutedWeight0_B16_B16_B16,0.0%,127.4,8017.5
stage2,256,256,2048,192,128,8,ActivationType.Silu,torch.bfloat16,torch.bfloat16,torch.bfloat16,QuantType.No,1,1,128,0,43.0526,moe_ck2stages_gemm2_256x128x64x64_1x4_TypeCast_v1_Nswizzle0_Quant0_MulRoutedWeight0_B16_B16_B16,0.0%,112.23,7063.15
stage1,256,256,4096,192,128,8,ActivationType.Gelu,torch.bfloat16,torch.bfloat16,torch.bfloat16,QuantType.No,1,0,32,0,76.4814,moe_ck2stages_gemm1_256x32x64x128_1x4_TypeCast_v1_Nswizzle0_Quant0_MulRoutedWeight0_gelu_B16_B16_B16,0.0%,126.35,7951.92
stage1,256,256,4096,192,128,8,ActivationType.Gelu,torch.bfloat16,torch.bfloat16,torch.bfloat16,QuantType.No,1,0,32,0,74.2502,moe_ck2stages_gemm1_256x32x64x64_1x4_TypeCast_v1_Nswizzle0_Quant0_MulRoutedWeight0_gelu_B16_B16_B16,0.0%,130.15,8190.87
stage2,256,256,4096,192,128,8,ActivationType.Gelu,torch.bfloat16,torch.bfloat16,torch.bfloat16,QuantType.No,1,0,32,0,inf,moe_ck2stages_gemm2_256x32x128x128_1x4_TypeCast_v1_Nswizzle0_Quant0_MulRoutedWeight1_B16_B16_B16,100.0%,0.0,0.0
stage2,256,256,4096,192,128,8,ActivationType.Gelu,torch.bfloat16,torch.bfloat16,torch.bfloat16,QuantType.No,1,0,32,0,43.1138,moe_ck2stages_gemm2_256x32x64x64_1x4_TypeCast_v1_Nswizzle0_Quant0_MulRoutedWeight1_B16_B16_B16,0.1%,224.14,14106.25
stage1,256,256,4096,192,128,8,ActivationType.Gelu,torch.bfloat16,torch.bfloat16,torch.bfloat16,QuantType.No,1,0,64,0,79.052,moe_ck2stages_gemm1_256x64x64x128_1x4_TypeCast_v1_Nswizzle0_Quant0_MulRoutedWeight0_gelu_B16_B16_B16,0.0%,122.24,7693.34
stage1,256,256,4096,192,128,8,ActivationType.Gelu,torch.bfloat16,torch.bfloat16,torch.bfloat16,QuantType.No,1,0,64,0,74.8398,moe_ck2stages_gemm1_256x64x64x64_1x4_TypeCast_v1_Nswizzle0_Quant0_MulRoutedWeight0_gelu_B16_B16_B16,0.0%,129.12,8126.35
stage2,256,256,4096,192,128,8,ActivationType.Gelu,torch.bfloat16,torch.bfloat16,torch.bfloat16,QuantType.No,1,0,64,0,inf,moe_ck2stages_gemm2_256x64x128x128_1x4_TypeCast_v1_Nswizzle0_Quant0_MulRoutedWeight1_B16_B16_B16,100.0%,0.0,0.0
stage2,256,256,4096,192,128,8,ActivationType.Gelu,torch.bfloat16,torch.bfloat16,torch.bfloat16,QuantType.No,1,0,64,0,53.1328,moe_ck2stages_gemm2_256x64x64x64_1x4_TypeCast_v1_Nswizzle0_Quant0_MulRoutedWeight1_B16_B16_B16,0.1%,181.88,11446.3
stage2,256,256,4096,192,128,8,ActivationType.Gelu,torch.bfloat16,torch.bfloat16,torch.bfloat16,QuantType.No,1,0,64,0,55.7833,moe_ck2stages_gemm2_256x64x128x64_1x4_TypeCast_v1_Nswizzle0_Quant0_MulRoutedWeight1_B16_B16_B16,0.1%,173.24,10902.44
stage1,256,256,4096,192,128,8,ActivationType.Gelu,torch.bfloat16,torch.bfloat16,torch.bfloat16,QuantType.No,1,0,128,0,78.6574,moe_ck2stages_gemm1_256x128x64x64_1x4_TypeCast_v1_Nswizzle0_Quant0_MulRoutedWeight0_gelu_B16_B16_B16,0.0%,122.86,7731.94
stage1,256,256,4096,192,128,8,ActivationType.Gelu,torch.bfloat16,torch.bfloat16,torch.bfloat16,QuantType.No,1,0,128,0,inf,moe_ck2stages_gemm1_256x128x128x64_1x4_TypeCast_v3_Nswizzle0_Quant0_MulRoutedWeight0_gelu_B16_B16_B16,100.0%,0.0,0.0
stage2,256,256,4096,192,128,8,ActivationType.Gelu,torch.bfloat16,torch.bfloat16,torch.bfloat16,QuantType.No,1,0,128,0,78.318,moe_ck2stages_gemm2_256x128x128x64_1x4_TypeCast_v1_Nswizzle0_Quant0_MulRoutedWeight1_B16_B16_B16,0.1%,123.39,7765.44
stage2,256,256,4096,192,128,8,ActivationType.Gelu,torch.bfloat16,torch.bfloat16,torch.bfloat16,QuantType.No,1,0,128,0,77.7366,moe_ck2stages_gemm2_256x128x128x64_1x4_TypeCast_v3_Nswizzle0_Quant0_MulRoutedWeight1_B16_B16_B16,0.1%,124.31,7823.52
stage2,256,256,4096,192,128,8,ActivationType.Gelu,torch.bfloat16,torch.bfloat16,torch.bfloat16,QuantType.No,1,0,128,0,72.5172,moe_ck2stages_gemm2_256x128x64x64_1x4_TypeCast_v3_Nswizzle0_Quant0_MulRoutedWeight1_B16_B16_B16,0.1%,133.26,8386.62
stage2,256,256,4096,192,128,8,ActivationType.Gelu,torch.bfloat16,torch.bfloat16,torch.bfloat16,QuantType.No,1,0,128,0,83.0065,moe_ck2stages_gemm2_256x128x64x64_1x4_TypeCast_v1_Nswizzle0_Quant0_MulRoutedWeight1_B16_B16_B16,0.1%,116.42,7326.82
stage1,256,256,4096,192,128,8,ActivationType.Gelu,torch.bfloat16,torch.bfloat16,torch.bfloat16,QuantType.No,1,1,32,0,76.6192,moe_ck2stages_gemm1_256x32x64x128_1x4_TypeCast_v1_Nswizzle0_Quant0_MulRoutedWeight1_gelu_B16_B16_B16,0.0%,126.13,7937.62
stage1,256,256,4096,192,128,8,ActivationType.Gelu,torch.bfloat16,torch.bfloat16,torch.bfloat16,QuantType.No,1,1,32,0,73.3363,moe_ck2stages_gemm1_256x32x64x64_1x4_TypeCast_v1_Nswizzle0_Quant0_MulRoutedWeight1_gelu_B16_B16_B16,0.0%,131.77,8292.95
stage2,256,256,4096,192,128,8,ActivationType.Gelu,torch.bfloat16,torch.bfloat16,torch.bfloat16,QuantType.No,1,1,32,0,inf,moe_ck2stages_gemm2_256x32x128x128_1x4_TypeCast_v1_Nswizzle0_Quant0_MulRoutedWeight0_B16_B16_B16,100.0%,0.0,0.0
stage2,256,256,4096,192,128,8,ActivationType.Gelu,torch.bfloat16,torch.bfloat16,torch.bfloat16,QuantType.No,1,1,32,0,42.3541,moe_ck2stages_gemm2_256x32x64x64_1x4_TypeCast_v1_Nswizzle0_Quant0_MulRoutedWeight0_B16_B16_B16,0.0%,228.16,14359.27
stage1,256,256,4096,192,128,8,ActivationType.Gelu,torch.bfloat16,torch.bfloat16,torch.bfloat16,QuantType.No,1,1,64,0,79.2896,moe_ck2stages_gemm1_256x64x64x128_1x4_TypeCast_v1_Nswizzle0_Quant0_MulRoutedWeight1_gelu_B16_B16_B16,0.0%,121.88,7670.29
stage1,256,256,4096,192,128,8,ActivationType.Gelu,torch.bfloat16,torch.bfloat16,torch.bfloat16,QuantType.No,1,1,64,0,75.4355,moe_ck2stages_gemm1_256x64x64x64_1x4_TypeCast_v1_Nswizzle0_Quant0_MulRoutedWeight1_gelu_B16_B16_B16,0.0%,128.11,8062.17
stage2,256,256,4096,192,128,8,ActivationType.Gelu,torch.bfloat16,torch.bfloat16,torch.bfloat16,QuantType.No,1,1,64,0,inf,moe_ck2stages_gemm2_256x64x128x128_1x4_TypeCast_v1_Nswizzle0_Quant0_MulRoutedWeight0_B16_B16_B16,100.0%,0.0,0.0
stage2,256,256,4096,192,128,8,ActivationType.Gelu,torch.bfloat16,torch.bfloat16,torch.bfloat16,QuantType.No,1,1,64,0,49.035,moe_ck2stages_gemm2_256x64x64x64_1x4_TypeCast_v1_Nswizzle0_Quant0_MulRoutedWeight0_B16_B16_B16,0.0%,197.08,12402.86
stage2,256,256,4096,192,128,8,ActivationType.Gelu,torch.bfloat16,torch.bfloat16,torch.bfloat16,QuantType.No,1,1,64,0,51.8284,moe_ck2stages_gemm2_256x64x128x64_1x4_TypeCast_v1_Nswizzle0_Quant0_MulRoutedWeight0_B16_B16_B16,0.0%,186.46,11734.38
stage1,256,256,4096,192,128,8,ActivationType.Gelu,torch.bfloat16,torch.bfloat16,torch.bfloat16,QuantType.No,1,1,128,0,79.157,moe_ck2stages_gemm1_256x128x64x64_1x4_TypeCast_v1_Nswizzle0_Quant0_MulRoutedWeight1_gelu_B16_B16_B16,0.0%,122.08,7683.14
stage1,256,256,4096,192,128,8,ActivationType.Gelu,torch.bfloat16,torch.bfloat16,torch.bfloat16,QuantType.No,1,1,128,0,inf,moe_ck2stages_gemm1_256x128x128x64_1x4_TypeCast_v3_Nswizzle0_Quant0_MulRoutedWeight1_gelu_B16_B16_B16,100.0%,0.0,0.0
stage2,256,256,4096,192,128,8,ActivationType.Gelu,torch.bfloat16,torch.bfloat16,torch.bfloat16,QuantType.No,1,1,128,0,72.369,moe_ck2stages_gemm2_256x128x128x64_1x4_TypeCast_v1_Nswizzle0_Quant0_MulRoutedWeight0_B16_B16_B16,0.0%,133.53,8403.79
stage2,256,256,4096,192,128,8,ActivationType.Gelu,torch.bfloat16,torch.bfloat16,torch.bfloat16,QuantType.No,1,1,128,0,73.0375,moe_ck2stages_gemm2_256x128x128x64_1x4_TypeCast_v3_Nswizzle0_Quant0_MulRoutedWeight0_B16_B16_B16,0.0%,132.31,8326.87
stage2,256,256,4096,192,128,8,ActivationType.Gelu,torch.bfloat16,torch.bfloat16,torch.bfloat16,QuantType.No,1,1,128,0,66.6209,moe_ck2stages_gemm2_256x128x64x64_1x4_TypeCast_v3_Nswizzle0_Quant0_MulRoutedWeight0_B16_B16_B16,0.0%,145.05,9128.88
stage2,256,256,4096,192,128,8,ActivationType.Gelu,torch.bfloat16,torch.bfloat16,torch.bfloat16,QuantType.No,1,1,128,0,75.5643,moe_ck2stages_gemm2_256x128x64x64_1x4_TypeCast_v1_Nswizzle0_Quant0_MulRoutedWeight0_B16_B16_B16,0.0%,127.89,8048.43
stage1,256,256,4096,192,128,8,ActivationType.Silu,torch.bfloat16,torch.bfloat16,torch.bfloat16,QuantType.No,1,0,32,0,76.6106,moe_ck2stages_gemm1_256x32x64x128_1x4_TypeCast_v1_Nswizzle0_Quant0_MulRoutedWeight0_silu_B16_B16_B16,0.0%,126.14,7938.51
stage1,256,256,4096,192,128,8,ActivationType.Silu,torch.bfloat16,torch.bfloat16,torch.bfloat16,QuantType.No,1,0,32,0,74.099,moe_ck2stages_gemm1_256x32x64x64_1x4_TypeCast_v1_Nswizzle0_Quant0_MulRoutedWeight0_silu_B16_B16_B16,0.0%,130.42,8207.59
stage2,256,256,4096,192,128,8,ActivationType.Silu,torch.bfloat16,torch.bfloat16,torch.bfloat16,QuantType.No,1,0,32,0,inf,moe_ck2stages_gemm2_256x32x128x128_1x4_TypeCast_v1_Nswizzle0_Quant0_MulRoutedWeight1_B16_B16_B16,100.0%,0.0,0.0
stage2,256,256,4096,192,128,8,ActivationType.Silu,torch.bfloat16,torch.bfloat16,torch.bfloat16,QuantType.No,1,0,32,0,42.8878,moe_ck2stages_gemm2_256x32x64x64_1x4_TypeCast_v1_Nswizzle0_Quant0_MulRoutedWeight1_B16_B16_B16,0.1%,225.32,14180.58
stage1,256,256,4096,192,128,8,ActivationType.Silu,torch.bfloat16,torch.bfloat16,torch.bfloat16,QuantType.No,1,0,64,0,79.0889,moe_ck2stages_gemm1_256x64x64x128_1x4_TypeCast_v1_Nswizzle0_Quant0_MulRoutedWeight0_silu_B16_B16_B16,0.0%,122.19,7689.75
stage1,256,256,4096,192,128,8,ActivationType.Silu,torch.bfloat16,torch.bfloat16,torch.bfloat16,QuantType.No,1,0,64,0,74.8769,moe_ck2stages_gemm1_256x64x64x64_1x4_TypeCast_v1_Nswizzle0_Quant0_MulRoutedWeight0_silu_B16_B16_B16,0.0%,129.06,8122.32
stage2,256,256,4096,192,128,8,ActivationType.Silu,torch.bfloat16,torch.bfloat16,torch.bfloat16,QuantType.No,1,0,64,0,inf,moe_ck2stages_gemm2_256x64x128x128_1x4_TypeCast_v1_Nswizzle0_Quant0_MulRoutedWeight1_B16_B16_B16,100.0%,0.0,0.0
stage2,256,256,4096,192,128,8,ActivationType.Silu,torch.bfloat16,torch.bfloat16,torch.bfloat16,QuantType.No,1,0,64,0,52.6818,moe_ck2stages_gemm2_256x64x64x64_1x4_TypeCast_v1_Nswizzle0_Quant0_MulRoutedWeight1_B16_B16_B16,0.1%,183.43,11544.29
stage2,256,256,4096,192,128,8,ActivationType.Silu,torch.bfloat16,torch.bfloat16,torch.bfloat16,QuantType.No,1,0,64,0,55.9012,moe_ck2stages_gemm2_256x64x128x64_1x4_TypeCast_v1_Nswizzle0_Quant0_MulRoutedWeight1_B16_B16_B16,0.1%,172.87,10879.45
stage1,256,256,4096,192,128,8,ActivationType.Silu,torch.bfloat16,torch.bfloat16,torch.bfloat16,QuantType.No,1,0,128,0,79.249,moe_ck2stages_gemm1_256x128x64x64_1x4_TypeCast_v1_Nswizzle0_Quant0_MulRoutedWeight0_silu_B16_B16_B16,0.0%,121.94,7674.22
stage1,256,256,4096,192,128,8,ActivationType.Silu,torch.bfloat16,torch.bfloat16,torch.bfloat16,QuantType.No,1,0,128,0,inf,moe_ck2stages_gemm1_256x128x128x64_1x4_TypeCast_v3_Nswizzle0_Quant0_MulRoutedWeight0_silu_B16_B16_B16,100.0%,0.0,0.0
stage2,256,256,4096,192,128,8,ActivationType.Silu,torch.bfloat16,torch.bfloat16,torch.bfloat16,QuantType.No,1,0,128,0,78.0122,moe_ck2stages_gemm2_256x128x128x64_1x4_TypeCast_v1_Nswizzle0_Quant0_MulRoutedWeight1_B16_B16_B16,0.1%,123.87,7795.88
stage2,256,256,4096,192,128,8,ActivationType.Silu,torch.bfloat16,torch.bfloat16,torch.bfloat16,QuantType.No,1,0,128,0,77.6808,moe_ck2stages_gemm2_256x128x128x64_1x4_TypeCast_v3_Nswizzle0_Quant0_MulRoutedWeight1_B16_B16_B16,0.1%,124.4,7829.14
stage2,256,256,4096,192,128,8,ActivationType.Silu,torch.bfloat16,torch.bfloat16,torch.bfloat16,QuantType.No,1,0,128,0,73.9253,moe_ck2stages_gemm2_256x128x64x64_1x4_TypeCast_v3_Nswizzle0_Quant0_MulRoutedWeight1_B16_B16_B16,0.1%,130.72,8226.87
stage2,256,256,4096,192,128,8,ActivationType.Silu,torch.bfloat16,torch.bfloat16,torch.bfloat16,QuantType.No,1,0,128,0,82.0982,moe_ck2stages_gemm2_256x128x64x64_1x4_TypeCast_v1_Nswizzle0_Quant0_MulRoutedWeight1_B16_B16_B16,0.1%,117.71,7407.89
stage1,256,256,4096,192,128,8,ActivationType.Silu,torch.bfloat16,torch.bfloat16,torch.bfloat16,QuantType.No,1,1,32,0,76.2484,moe_ck2stages_gemm1_256x32x64x128_1x4_TypeCast_v1_Nswizzle0_Quant0_MulRoutedWeight1_silu_B16_B16_B16,0.0%,126.74,7976.22
stage1,256,256,4096,192,128,8,ActivationType.Silu,torch.bfloat16,torch.bfloat16,torch.bfloat16,QuantType.No,1,1,32,0,74.3663,moe_ck2stages_gemm1_256x32x64x64_1x4_TypeCast_v1_Nswizzle0_Quant0_MulRoutedWeight1_silu_B16_B16_B16,0.0%,129.95,8178.09
stage2,256,256,4096,192,128,8,ActivationType.Silu,torch.bfloat16,torch.bfloat16,torch.bfloat16,QuantType.No,1,1,32,0,inf,moe_ck2stages_gemm2_256x32x128x128_1x4_TypeCast_v1_Nswizzle0_Quant0_MulRoutedWeight0_B16_B16_B16,100.0%,0.0,0.0
stage2,256,256,4096,192,128,8,ActivationType.Silu,torch.bfloat16,torch.bfloat16,torch.bfloat16,QuantType.No,1,1,32,0,42.2075,moe_ck2stages_gemm2_256x32x64x64_1x4_TypeCast_v1_Nswizzle0_Quant0_MulRoutedWeight0_B16_B16_B16,0.0%,228.96,14409.15
stage1,256,256,4096,192,128,8,ActivationType.Silu,torch.bfloat16,torch.bfloat16,torch.bfloat16,QuantType.No,1,1,64,0,78.0654,moe_ck2stages_gemm1_256x64x64x128_1x4_TypeCast_v1_Nswizzle0_Quant0_MulRoutedWeight1_silu_B16_B16_B16,0.0%,123.79,7790.57
stage1,256,256,4096,192,128,8,ActivationType.Silu,torch.bfloat16,torch.bfloat16,torch.bfloat16,QuantType.No,1,1,64,0,75.305,moe_ck2stages_gemm1_256x64x64x64_1x4_TypeCast_v1_Nswizzle0_Quant0_MulRoutedWeight1_silu_B16_B16_B16,0.0%,128.33,8076.14
stage2,256,256,4096,192,128,8,ActivationType.Silu,torch.bfloat16,torch.bfloat16,torch.bfloat16,QuantType.No,1,1,64,0,inf,moe_ck2stages_gemm2_256x64x128x128_1x4_TypeCast_v1_Nswizzle0_Quant0_MulRoutedWeight0_B16_B16_B16,100.0%,0.0,0.0
stage2,256,256,4096,192,128,8,ActivationType.Silu,torch.bfloat16,torch.bfloat16,torch.bfloat16,QuantType.No,1,1,64,0,49.0915,moe_ck2stages_gemm2_256x64x64x64_1x4_TypeCast_v1_Nswizzle0_Quant0_MulRoutedWeight0_B16_B16_B16,0.0%,196.85,12388.58
stage2,256,256,4096,192,128,8,ActivationType.Silu,torch.bfloat16,torch.bfloat16,torch.bfloat16,QuantType.No,1,1,64,0,51.4621,moe_ck2stages_gemm2_256x64x128x64_1x4_TypeCast_v1_Nswizzle0_Quant0_MulRoutedWeight0_B16_B16_B16,0.0%,187.78,11817.9
stage1,256,256,4096,192,128,8,ActivationType.Silu,torch.bfloat16,torch.bfloat16,torch.bfloat16,QuantType.No,1,1,128,0,79.8951,moe_ck2stages_gemm1_256x128x64x64_1x4_TypeCast_v1_Nswizzle0_Quant0_MulRoutedWeight1_silu_B16_B16_B16,0.0%,120.95,7612.16
stage1,256,256,4096,192,128,8,ActivationType.Silu,torch.bfloat16,torch.bfloat16,torch.bfloat16,QuantType.No,1,1,128,0,inf,moe_ck2stages_gemm1_256x128x128x64_1x4_TypeCast_v3_Nswizzle0_Quant0_MulRoutedWeight1_silu_B16_B16_B16,100.0%,0.0,0.0
stage2,256,256,4096,192,128,8,ActivationType.Silu,torch.bfloat16,torch.bfloat16,torch.bfloat16,QuantType.No,1,1,128,0,73.0269,moe_ck2stages_gemm2_256x128x128x64_1x4_TypeCast_v1_Nswizzle0_Quant0_MulRoutedWeight0_B16_B16_B16,0.0%,132.33,8328.08
stage2,256,256,4096,192,128,8,ActivationType.Silu,torch.bfloat16,torch.bfloat16,torch.bfloat16,QuantType.No,1,1,128,0,73.3037,moe_ck2stages_gemm2_256x128x128x64_1x4_TypeCast_v3_Nswizzle0_Quant0_MulRoutedWeight0_B16_B16_B16,0.0%,131.83,8296.64
stage2,256,256,4096,192,128,8,ActivationType.Silu,torch.bfloat16,torch.bfloat16,torch.bfloat16,QuantType.No,1,1,128,0,66.0574,moe_ck2stages_gemm2_256x128x64x64_1x4_TypeCast_v3_Nswizzle0_Quant0_MulRoutedWeight0_B16_B16_B16,0.0%,146.29,9206.75
stage2,256,256,4096,192,128,8,ActivationType.Silu,torch.bfloat16,torch.bfloat16,torch.bfloat16,QuantType.No,1,1,128,0,76.1453,moe_ck2stages_gemm2_256x128x64x64_1x4_TypeCast_v1_Nswizzle0_Quant0_MulRoutedWeight0_B16_B16_B16,0.0%,126.91,7987.02
stage1,256,256,4096,384,128,8,ActivationType.Gelu,torch.bfloat16,torch.bfloat16,torch.bfloat16,QuantType.No,1,0,32,0,140.8129,moe_ck2stages_gemm1_256x32x64x128_1x4_TypeCast_v1_Nswizzle0_Quant0_MulRoutedWeight0_gelu_B16_B16_B16,0.0%,137.26,8608.26
stage1,256,256,4096,384,128,8,ActivationType.Gelu,torch.bfloat16,torch.bfloat16,torch.bfloat16,QuantType.No,1,0,32,0,140.1532,moe_ck2stages_gemm1_256x32x64x64_1x4_TypeCast_v1_Nswizzle0_Quant0_MulRoutedWeight0_gelu_B16_B16_B16,0.0%,137.9,8648.78
stage2,256,256,4096,384,128,8,ActivationType.Gelu,torch.bfloat16,torch.bfloat16,torch.bfloat16,QuantType.No,1,0,32,0,81.5662,moe_ck2stages_gemm2_256x32x128x128_1x4_TypeCast_v1_Nswizzle0_Quant0_MulRoutedWeight1_B16_B16_B16,0.5%,236.95,14860.98
stage2,256,256,4096,384,128,8,ActivationType.Gelu,torch.bfloat16,torch.bfloat16,torch.bfloat16,QuantType.No,1,0,32,0,80.1745,moe_ck2stages_gemm2_256x32x64x64_1x4_TypeCast_v1_Nswizzle0_Quant0_MulRoutedWeight1_B16_B16_B16,0.5%,241.07,15118.95
stage1,256,256,4096,384,128,8,ActivationType.Gelu,torch.bfloat16,torch.bfloat16,torch.bfloat16,QuantType.No,1,0,64,0,141.2813,moe_ck2stages_gemm1_256x64x64x128_1x4_TypeCast_v1_Nswizzle0_Quant0_MulRoutedWeight0_gelu_B16_B16_B16,0.0%,136.8,8579.72
stage1,256,256,4096,384,128,8,ActivationType.Gelu,torch.bfloat16,torch.bfloat16,torch.bfloat16,QuantType.No,1,0,64,0,141.8515,moe_ck2stages_gemm1_256x64x64x64_1x4_TypeCast_v1_Nswizzle0_Quant0_MulRoutedWeight0_gelu_B16_B16_B16,0.0%,136.25,8545.23
stage2,256,256,4096,384,128,8,ActivationType.Gelu,torch.bfloat16,torch.bfloat16,torch.bfloat16,QuantType.No,1,0,64,0,89.9416,moe_ck2stages_gemm2_256x64x128x128_1x4_TypeCast_v1_Nswizzle0_Quant0_MulRoutedWeight1_B16_B16_B16,0.5%,214.89,13477.12
stage2,256,256,4096,384,128,8,ActivationType.Gelu,torch.bfloat16,torch.bfloat16,torch.bfloat16,QuantType.No,1,0,64,0,83.5805,moe_ck2stages_gemm2_256x64x64x64_1x4_TypeCast_v1_Nswizzle0_Quant0_MulRoutedWeight1_B16_B16_B16,0.5%,231.24,14502.83
stage2,256,256,4096,384,128,8,ActivationType.Gelu,torch.bfloat16,torch.bfloat16,torch.bfloat16,QuantType.No,1,0,64,0,82.3408,moe_ck2stages_gemm2_256x64x128x64_1x4_TypeCast_v1_Nswizzle0_Quant0_MulRoutedWeight1_B16_B16_B16,0.5%,234.72,14721.18
stage1,256,256,4096,384,128,8,ActivationType.Gelu,torch.bfloat16,torch.bfloat16,torch.bfloat16,QuantType.No,1,0,128,0,157.8683,moe_ck2stages_gemm1_256x128x64x64_1x4_TypeCast_v1_Nswizzle0_Quant0_MulRoutedWeight0_gelu_B16_B16_B16,0.0%,122.43,7678.26
stage1,256,256,4096,384,128,8,ActivationType.Gelu,torch.bfloat16,torch.bfloat16,torch.bfloat16,QuantType.No,1,0,128,0,165.1636,moe_ck2stages_gemm1_256x128x128x64_1x4_TypeCast_v3_Nswizzle0_Quant0_MulRoutedWeight0_gelu_B16_B16_B16,0.0%,117.02,7339.11
stage2,256,256,4096,384,128,8,ActivationType.Gelu,torch.bfloat16,torch.bfloat16,torch.bfloat16,QuantType.No,1,0,128,0,106.3861,moe_ck2stages_gemm2_256x128x128x64_1x4_TypeCast_v1_Nswizzle0_Quant0_MulRoutedWeight1_B16_B16_B16,0.5%,181.67,11393.91
stage2,256,256,4096,384,128,8,ActivationType.Gelu,torch.bfloat16,torch.bfloat16,torch.bfloat16,QuantType.No,1,0,128,0,104.8321,moe_ck2stages_gemm2_256x128x128x64_1x4_TypeCast_v3_Nswizzle0_Quant0_MulRoutedWeight1_B16_B16_B16,0.5%,184.36,11562.81
stage2,256,256,4096,384,128,8,ActivationType.Gelu,torch.bfloat16,torch.bfloat16,torch.bfloat16,QuantType.No,1,0,128,0,101.6618,moe_ck2stages_gemm2_256x128x64x64_1x4_TypeCast_v3_Nswizzle0_Quant0_MulRoutedWeight1_B16_B16_B16,0.5%,190.11,11923.4
stage2,256,256,4096,384,128,8,ActivationType.Gelu,torch.bfloat16,torch.bfloat16,torch.bfloat16,QuantType.No,1,0,128,0,112.5918,moe_ck2stages_gemm2_256x128x64x64_1x4_TypeCast_v1_Nswizzle0_Quant0_MulRoutedWeight1_B16_B16_B16,0.5%,171.66,10765.92
stage1,256,256,4096,384,128,8,ActivationType.Gelu,torch.bfloat16,torch.bfloat16,torch.bfloat16,QuantType.No,1,1,32,0,139.9033,moe_ck2stages_gemm1_256x32x64x128_1x4_TypeCast_v1_Nswizzle0_Quant0_MulRoutedWeight1_gelu_B16_B16_B16,0.0%,138.15,8664.23
stage1,256,256,4096,384,128,8,ActivationType.Gelu,torch.bfloat16,torch.bfloat16,torch.bfloat16,QuantType.No,1,1,32,0,140.8964,moe_ck2stages_gemm1_256x32x64x64_1x4_TypeCast_v1_Nswizzle0_Quant0_MulRoutedWeight1_gelu_B16_B16_B16,0.0%,137.17,8603.16
stage2,256,256,4096,384,128,8,ActivationType.Gelu,torch.bfloat16,torch.bfloat16,torch.bfloat16,QuantType.No,1,1,32,0,80.263,moe_ck2stages_gemm2_256x32x128x128_1x4_TypeCast_v1_Nswizzle0_Quant0_MulRoutedWeight0_B16_B16_B16,0.0%,240.8,15102.27
stage2,256,256,4096,384,128,8,ActivationType.Gelu,torch.bfloat16,torch.bfloat16,torch.bfloat16,QuantType.No,1,1,32,0,78.1898,moe_ck2stages_gemm2_256x32x64x64_1x4_TypeCast_v1_Nswizzle0_Quant0_MulRoutedWeight0_B16_B16_B16,0.0%,247.19,15502.71
stage1,256,256,4096,384,128,8,ActivationType.Gelu,torch.bfloat16,torch.bfloat16,torch.bfloat16,QuantType.No,1,1,64,0,140.868,moe_ck2stages_gemm1_256x64x64x128_1x4_TypeCast_v1_Nswizzle0_Quant0_MulRoutedWeight1_gelu_B16_B16_B16,0.0%,137.2,8604.89
stage1,256,256,4096,384,128,8,ActivationType.Gelu,torch.bfloat16,torch.bfloat16,torch.bfloat16,QuantType.No,1,1,64,0,142.0663,moe_ck2stages_gemm1_256x64x64x64_1x4_TypeCast_v1_Nswizzle0_Quant0_MulRoutedWeight1_gelu_B16_B16_B16,0.0%,136.04,8532.31
stage2,256,256,4096,384,128,8,ActivationType.Gelu,torch.bfloat16,torch.bfloat16,torch.bfloat16,QuantType.No,1,1,64,0,85.2228,moe_ck2stages_gemm2_256x64x128x128_1x4_TypeCast_v1_Nswizzle0_Quant0_MulRoutedWeight0_B16_B16_B16,0.0%,226.79,14223.35
stage2,256,256,4096,384,128,8,ActivationType.Gelu,torch.bfloat16,torch.bfloat16,torch.bfloat16,QuantType.No,1,1,64,0,79.2986,moe_ck2stages_gemm2_256x64x64x64_1x4_TypeCast_v1_Nswizzle0_Quant0_MulRoutedWeight0_B16_B16_B16,0.0%,243.73,15285.94
stage2,256,256,4096,384,128,8,ActivationType.Gelu,torch.bfloat16,torch.bfloat16,torch.bfloat16,QuantType.No,1,1,64,0,82.1868,moe_ck2stages_gemm2_256x64x128x64_1x4_TypeCast_v1_Nswizzle0_Quant0_MulRoutedWeight0_B16_B16_B16,0.0%,235.16,14748.77
stage1,256,256,4096,384,128,8,ActivationType.Gelu,torch.bfloat16,torch.bfloat16,torch.bfloat16,QuantType.No,1,1,128,0,160.1353,moe_ck2stages_gemm1_256x128x64x64_1x4_TypeCast_v1_Nswizzle0_Quant0_MulRoutedWeight1_gelu_B16_B16_B16,0.0%,120.69,7569.56
stage1,256,256,4096,384,128,8,ActivationType.Gelu,torch.bfloat16,torch.bfloat16,torch.bfloat16,QuantType.No,1,1,128,0,168.2577,moe_ck2stages_gemm1_256x128x128x64_1x4_TypeCast_v3_Nswizzle0_Quant0_MulRoutedWeight1_gelu_B16_B16_B16,0.0%,114.87,7204.15
stage2,256,256,4096,384,128,8,ActivationType.Gelu,torch.bfloat16,torch.bfloat16,torch.bfloat16,QuantType.No,1,1,128,0,101.7894,moe_ck2stages_gemm2_256x128x128x64_1x4_TypeCast_v1_Nswizzle0_Quant0_MulRoutedWeight0_B16_B16_B16,0.0%,189.88,11908.45
stage2,256,256,4096,384,128,8,ActivationType.Gelu,torch.bfloat16,torch.bfloat16,torch.bfloat16,QuantType.No,1,1,128,0,100.5449,moe_ck2stages_gemm2_256x128x128x64_1x4_TypeCast_v3_Nswizzle0_Quant0_MulRoutedWeight0_B16_B16_B16,0.0%,192.23,12055.85
stage2,256,256,4096,384,128,8,ActivationType.Gelu,torch.bfloat16,torch.bfloat16,torch.bfloat16,QuantType.No,1,1,128,0,95.7328,moe_ck2stages_gemm2_256x128x64x64_1x4_TypeCast_v3_Nswizzle0_Quant0_MulRoutedWeight0_B16_B16_B16,0.0%,201.89,12661.84
stage2,256,256,4096,384,128,8,ActivationType.Gelu,torch.bfloat16,torch.bfloat16,torch.bfloat16,QuantType.No,1,1,128,0,107.7827,moe_ck2stages_gemm2_256x128x64x64_1x4_TypeCast_v1_Nswizzle0_Quant0_MulRoutedWeight0_B16_B16_B16,0.0%,179.32,11246.27
stage1,256,256,4096,384,128,8,ActivationType.Silu,torch.bfloat16,torch.bfloat16,torch.bfloat16,QuantType.No,1,0,32,0,139.8593,moe_ck2stages_gemm1_256x32x64x128_1x4_TypeCast_v1_Nswizzle0_Quant0_MulRoutedWeight0_silu_B16_B16_B16,0.0%,138.19,8666.95
stage1,256,256,4096,384,128,8,ActivationType.Silu,torch.bfloat16,torch.bfloat16,torch.bfloat16,QuantType.No,1,0,32,0,140.6801,moe_ck2stages_gemm1_256x32x64x64_1x4_TypeCast_v1_Nswizzle0_Quant0_MulRoutedWeight0_silu_B16_B16_B16,0.0%,137.39,8616.38
stage2,256,256,4096,384,128,8,ActivationType.Silu,torch.bfloat16,torch.bfloat16,torch.bfloat16,QuantType.No,1,0,32,0,79.9163,moe_ck2stages_gemm2_256x32x128x128_1x4_TypeCast_v1_Nswizzle0_Quant0_MulRoutedWeight1_B16_B16_B16,0.4%,241.84,15167.79
