aiter/configs/a8w8_blockscale_tuned_gemm.csv
cu_num,M,N,K,kernelId,splitK,us,kernelName,tflops,bw,errRatio
256,1,100,5120,8,0,16.0079,a8w8_blockscale_1x128x128_256x16x64x256_16x16_16x16_16x16x1_16x16x1_1x16x1x16_4_1x1_intrawave_v1,0.06,32.32,0.0
256,1,200,5120,8,0,16.1116,a8w8_blockscale_1x128x128_256x16x64x256_16x16_16x16_16x16x1_16x16x1_1x16x1x16_4_1x1_intrawave_v1,0.13,63.9,0.0
256,1,800,5120,8,0,17.9252,a8w8_blockscale_1x128x128_256x16x64x256_16x16_16x16_16x16x1_16x16x1_1x16x1x16_4_1x1_intrawave_v1,0.46,228.88,0.0
256,1,1280,8192,8,0,28.1634,a8w8_blockscale_1x128x128_256x16x64x256_16x16_16x16_16x16x1_16x16x1_1x16x1x16_4_1x1_intrawave_v1,0.74,372.7,0.0
256,1,2304,16384,8,0,52.6198,a8w8_blockscale_1x128x128_256x16x64x256_16x16_16x16_16x16x1_16x16x1_1x16x1x16_4_1x1_intrawave_v1,1.43,717.79,0.0
256,1,2560,8192,8,0,27.9545,a8w8_blockscale_1x128x128_256x16x64x256_16x16_16x16_16x16x1_16x16x1_1x16x1x16_4_1x1_intrawave_v1,1.5,750.68,0.0
256,1,4608,16384,8,0,53.4466,a8w8_blockscale_1x128x128_256x16x64x256_16x16_16x16_16x16x1_16x16x1_1x16x1x16_4_1x1_intrawave_v1,2.83,1413.06,0.0
256,1,5120,640,8,0,4.4527,a8w8_blockscale_1x128x128_256x16x64x256_16x16_16x16_16x16x1_16x16x1_1x16x1x16_4_1x1_intrawave_v1,1.47,738.36,0.0
256,1,5120,1280,8,0,6.8727,a8w8_blockscale_1x128x128_256x16x64x256_16x16_16x16_16x16x1_16x16x1_1x16x1x16_4_1x1_intrawave_v1,1.91,955.25,0.0
256,1,5120,3200,8,0,12.5108,a8w8_blockscale_1x128x128_256x16x64x256_16x16_16x16_16x16x1_16x16x1_1x16x1x16_4_1x1_intrawave_v1,2.62,1310.66,0.0
256,1,5120,5120,8,0,18.4654,a8w8_blockscale_1x128x128_256x16x64x256_16x16_16x16_16x16x1_16x16x1_1x16x1x16_4_1x1_intrawave_v1,2.84,1420.48,0.0
256,1,5120,6400,8,0,22.3901,a8w8_blockscale_1x128x128_256x16x64x256_16x16_16x16_16x16x1_16x16x1_1x16x1x16_4_1x1_intrawave_v1,2.93,1464.25,0.0
256,1,5120,25600,8,0,84.3559,a8w8_blockscale_1x128x128_256x16x64x256_16x16_16x16_16x16x1_16x16x1_1x16x1x16_4_1x1_intrawave_v1,3.11,1554.22,0.0
256,1,6400,5120,8,0,18.8247,a8w8_blockscale_1x128x128_256x16x64x256_16x16_16x16_16x16x1_16x16x1_1x16x1x16_4_1x1_intrawave_v1,3.48,1741.64,0.0
256,1,7168,8192,8,0,29.0563,a8w8_blockscale_1x128x128_256x16x64x256_16x16_16x16_16x16x1_16x16x1_1x16x1x16_4_1x1_intrawave_v1,4.04,2021.69,0.0
256,1,8192,1024,8,0,5.7097,a8w8_blockscale_1x128x128_256x16x64x256_16x16_16x16_16x16x1_16x16x1_1x16x1x16_4_1x1_intrawave_v1,2.94,1472.23,0.0
256,1,8192,2048,8,0,8.5139,a8w8_blockscale_1x128x128_256x16x64x256_16x16_16x16_16x16x1_16x16x1_1x16x1x16_4_1x1_intrawave_v1,3.94,1972.73,0.0
256,1,8192,3584,8,0,13.6764,a8w8_blockscale_1x128x128_256x16x64x256_16x16_16x16_16x16x1_16x16x1_1x16x1x16_4_1x1_intrawave_v1,4.29,2148.23,0.0
256,1,8192,7168,8,0,25.7964,a8w8_blockscale_1x128x128_256x16x64x256_16x16_16x16_16x16x1_16x16x1_1x16x1x16_4_1x1_intrawave_v1,4.55,2277.21,0.0
256,1,8192,8192,8,0,29.3346,a8w8_blockscale_1x128x128_256x16x64x256_16x16_16x16_16x16x1_16x16x1_1x16x1x16_4_1x1_intrawave_v1,4.58,2288.54,0.0
256,1,8192,28672,8,0,99.3974,a8w8_blockscale_1x128x128_256x16x64x256_16x16_16x16_16x16x1_16x16x1_1x16x1x16_4_1x1_intrawave_v1,4.73,2363.5,0.0
256,1,9216,16384,8,0,57.1657,a8w8_blockscale_1x128x128_256x16x64x256_16x16_16x16_16x16x1_16x16x1_1x16x1x16_4_1x1_intrawave_v1,5.28,2641.96,0.0
256,1,10240,8192,8,0,30.6363,a8w8_blockscale_1x128x128_256x16x64x256_16x16_16x16_16x16x1_16x16x1_1x16x1x16_4_1x1_intrawave_v1,5.48,2739.06,0.0
256,1,12800,5120,8,0,22.295,a8w8_blockscale_1x128x128_256x16x64x256_16x16_16x16_16x16x1_16x16x1_1x16x1x16_4_1x1_intrawave_v1,5.88,2940.87,0.0
256,1,13312,16384,8,0,66.3932,a8w8_blockscale_1x128x128_256x16x64x256_16x16_16x16_16x16x1_16x16x1_1x16x1x16_4_1x1_intrawave_v1,6.57,3285.68,0.0
256,1,14336,8192,8,0,35.1564,a8w8_blockscale_1x128x128_256x16x64x256_16x16_16x16_16x16x1_16x16x1_1x16x1x16_4_1x1_intrawave_v1,6.68,3341.56,0.0
256,1,16384,2048,8,0,10.0112,a8w8_blockscale_1x128x128_256x16x64x256_16x16_16x16_16x16x1_16x16x1_1x16x1x16_4_1x1_intrawave_v1,6.7,3355.17,0.0
256,1,16384,4096,8,0,18.4372,a8w8_blockscale_1x128x128_256x16x64x256_16x16_16x16_16x16x1_16x16x1_1x16x1x16_4_1x1_intrawave_v1,7.28,3641.86,0.0
256,1,16384,6656,8,0,29.9027,a8w8_blockscale_1x128x128_256x16x64x256_16x16_16x16_16x16x1_16x16x1_1x16x1x16_4_1x1_intrawave_v1,7.29,3648.21,0.0
256,1,16384,8192,18,0,35.6122,a8w8_blockscale_1x128x128_256x64x64x256_16x16_32x32_16x16x1_16x16x1_1x32x1x8_8_1x1_intrawave_v1,7.54,3770.02,0.0
256,1,16384,13312,8,0,56.1256,a8w8_blockscale_1x128x128_256x16x64x256_16x16_16x16_16x16x1_16x16x1_1x16x1x16_4_1x1_intrawave_v1,7.77,3886.82,0.0
256,1,16384,26624,18,0,108.7179,a8w8_blockscale_1x128x128_256x64x64x256_16x16_32x32_16x16x1_16x16x1_1x32x1x8_8_1x1_intrawave_v1,8.02,4012.84,0.0
256,1,26624,16384,12,0,94.8685,a8w8_blockscale_1x128x128_256x32x128x256_16x16_32x32_16x16x1_16x16x1_1x32x1x8_8_1x1_intrawave_v1,9.2,4598.76,0.0
256,1,51200,5120,7,0,48.5531,a8w8_blockscale_1x128x128_256x16x128x256_16x16_16x16_16x16x1_16x16x1_1x16x1x16_8_1x2_intrawave_v1,10.8,5401.33,0.0
256,1,53248,16384,5,0,166.7757,a8w8_blockscale_1x128x128_256x16x128x128_8x16_16x16_16x16x1_8x32x1_1x16x1x16_8_1x2_intrawave_v1,10.46,5231.81,0.0
256,1,57344,8192,7,0,96.6093,a8w8_blockscale_1x128x128_256x16x128x256_16x16_16x16_16x16x1_16x16x1_1x16x1x16_8_1x2_intrawave_v1,9.72,4863.76,0.0
256,16,100,5120,8,0,16.0889,a8w8_blockscale_1x128x128_256x16x64x256_16x16_16x16_16x16x1_16x16x1_1x16x1x16_4_1x1_intrawave_v1,1.02,37.11,0.0
256,16,200,5120,8,0,16.27,a8w8_blockscale_1x128x128_256x16x64x256_16x16_16x16_16x16x1_16x16x1_1x16x1x16_4_1x1_intrawave_v1,2.01,68.37,0.0
256,16,512,7168,8,0,20.9245,a8w8_blockscale_1x128x128_256x16x64x256_16x16_16x16_16x16x1_16x16x1_1x16x1x16_4_1x1_intrawave_v1,5.61,181.66,0.0
256,16,576,7168,8,0,21.0309,a8w8_blockscale_1x128x128_256x16x64x256_16x16_16x16_16x16x1_16x16x1_1x16x1x16_4_1x1_intrawave_v1,6.28,202.65,0.0
256,16,800,5120,8,0,18.2914,a8w8_blockscale_1x128x128_256x16x64x256_16x16_16x16_16x16x1_16x16x1_1x16x1x16_4_1x1_intrawave_v1,7.17,229.81,0.0
256,16,1280,8192,8,0,24.9326,a8w8_blockscale_1x128x128_256x16x64x256_16x16_16x16_16x16x1_16x16x1_1x16x1x16_4_1x1_intrawave_v1,13.46,427.46,0.0
256,16,1536,7168,8,0,21.5457,a8w8_blockscale_1x128x128_256x16x64x256_16x16_16x16_16x16x1_16x16x1_1x16x1x16_4_1x1_intrawave_v1,16.35,518.61,0.0
256,16,2304,16384,8,0,45.9835,a8w8_blockscale_1x128x128_256x16x64x256_16x16_16x16_16x16x1_16x16x1_1x16x1x16_4_1x1_intrawave_v1,26.27,828.22,0.0
256,16,2560,8192,8,0,24.6087,a8w8_blockscale_1x128x128_256x16x64x256_16x16_16x16_16x16x1_16x16x1_1x16x1x16_4_1x1_intrawave_v1,27.27,860.85,0.0
256,16,3072,1536,8,0,6.9695,a8w8_blockscale_1x128x128_256x16x64x256_16x16_16x16_16x16x1_16x16x1_1x16x1x16_4_1x1_intrawave_v1,21.67,694.67,0.0
256,16,4096,512,8,0,3.2643,a8w8_blockscale_1x128x128_256x16x64x256_16x16_16x16_16x16x1_16x16x1_1x16x1x16_4_1x1_intrawave_v1,20.56,685.11,0.0
256,16,4608,7168,8,0,21.3886,a8w8_blockscale_1x128x128_256x16x64x256_16x16_16x16_16x16x1_16x16x1_1x16x1x16_4_1x1_intrawave_v1,49.42,1556.54,0.0
256,16,4608,16384,8,0,46.9202,a8w8_blockscale_1x128x128_256x16x64x256_16x16_16x16_16x16x1_16x16x1_1x16x1x16_4_1x1_intrawave_v1,51.49,1617.79,0.0
256,16,5120,640,8,0,4.7344,a8w8_blockscale_1x128x128_256x16x64x256_16x16_16x16_16x16x1_16x16x1_1x16x1x16_4_1x1_intrawave_v1,22.15,728.89,0.0
256,16,5120,1280,8,0,5.6391,a8w8_blockscale_1x128x128_256x16x64x256_16x16_16x16_16x16x1_16x16x1_1x16x1x16_4_1x1_intrawave_v1,37.19,1194.86,0.0
256,16,5120,3200,8,0,12.5963,a8w8_blockscale_1x128x128_256x16x64x256_16x16_16x16_16x16x1_16x16x1_1x16x1x16_4_1x1_intrawave_v1,41.62,1317.77,0.0
256,16,5120,5120,8,0,16.0839,a8w8_blockscale_1x128x128_256x16x64x256_16x16_16x16_16x16x1_16x16x1_1x16x1x16_4_1x1_intrawave_v1,52.16,1645.13,0.0
256,16,5120,6400,8,0,19.2835,a8w8_blockscale_1x128x128_256x16x64x256_16x16_16x16_16x16x1_16x16x1_1x16x1x16_4_1x1_intrawave_v1,54.38,1713.08,0.0
256,16,5120,25600,8,0,71.8331,a8w8_blockscale_1x128x128_256x16x64x256_16x16_16x16_16x16x1_16x16x1_1x16x1x16_4_1x1_intrawave_v1,58.39,1832.66,0.0
256,16,6400,5120,8,0,16.3912,a8w8_blockscale_1x128x128_256x16x64x256_16x16_16x16_16x16x1_16x16x1_1x16x1x16_4_1x1_intrawave_v1,63.97,2016.61,0.0
256,16,7168,256,8,0,2.845,a8w8_blockscale_1x128x128_256x16x64x256_16x16_16x16_16x16x1_16x16x1_1x16x1x16_4_1x1_intrawave_v1,20.64,727.06,0.0
256,16,7168,2048,8,0,8.7398,a8w8_blockscale_1x128x128_256x16x64x256_16x16_16x16_16x16x1_16x16x1_1x16x1x16_4_1x1_intrawave_v1,53.75,1709.67,0.0
256,16,7168,2304,8,0,8.832,a8w8_blockscale_1x128x128_256x16x64x256_16x16_16x16_16x16x1_16x16x1_1x16x1x16_4_1x1_intrawave_v1,59.84,1900.06,0.0
256,16,7168,8192,8,0,25.4744,a8w8_blockscale_1x128x128_256x16x64x256_16x16_16x16_16x16x1_16x16x1_1x16x1x16_4_1x1_intrawave_v1,73.76,2319.22,0.0
256,16,8192,1024,8,0,5.1701,a8w8_blockscale_1x128x128_256x16x64x256_16x16_16x16_16x16x1_16x16x1_1x16x1x16_4_1x1_intrawave_v1,51.92,1676.4,0.0
256,16,8192,2048,8,0,8.5418,a8w8_blockscale_1x128x128_256x16x64x256_16x16_16x16_16x16x1_16x16x1_1x16x1x16_4_1x1_intrawave_v1,62.85,1998.66,0.0
256,16,8192,3584,8,0,12.0681,a8w8_blockscale_1x128x128_256x16x64x256_16x16_16x16_16x16x1_16x16x1_1x16x1x16_4_1x1_intrawave_v1,77.85,2459.34,0.0
256,16,8192,7168,8,0,22.7115,a8w8_blockscale_1x128x128_256x16x64x256_16x16_16x16_16x16x1_16x16x1_1x16x1x16_4_1x1_intrawave_v1,82.74,2602.08,0.0
256,16,8192,8192,8,0,26.2935,a8w8_blockscale_1x128x128_256x16x64x256_16x16_16x16_16x16x1_16x16x1_1x16x1x16_4_1x1_intrawave_v1,81.67,2567.25,0.0
256,16,8192,28672,8,0,88.3819,a8w8_blockscale_1x128x128_256x16x64x256_16x16_16x16_16x16x1_16x16x1_1x16x1x16_4_1x1_intrawave_v1,85.04,2665.73,0.0
256,16,9216,16384,8,0,51.4045,a8w8_blockscale_1x128x128_256x16x64x256_16x16_16x16_16x16x1_16x16x1_1x16x1x16_4_1x1_intrawave_v1,94.0,2948.22,0.0
256,16,10240,8192,8,0,28.9703,a8w8_blockscale_1x128x128_256x16x64x256_16x16_16x16_16x16x1_16x16x1_1x16x1x16_4_1x1_intrawave_v1,92.66,2911.42,0.0
256,16,12800,5120,8,0,19.9602,a8w8_blockscale_1x128x128_256x16x64x256_16x16_16x16_16x16x1_16x16x1_1x16x1x16_4_1x1_intrawave_v1,105.07,3307.96,0.0
256,16,13312,16384,8,0,57.9019,a8w8_blockscale_1x128x128_256x16x64x256_16x16_16x16_16x16x1_16x16x1_1x16x1x16_4_1x1_intrawave_v1,120.54,3778.67,0.0
256,16,14336,8192,8,0,31.6176,a8w8_blockscale_1x128x128_256x16x64x256_16x16_16x16_16x16x1_16x16x1_1x16x1x16_4_1x1_intrawave_v1,118.86,3733.06,0.0
256,16,16384,2048,8,0,9.1992,a8w8_blockscale_1x128x128_256x16x64x256_16x16_16x16_16x16x1_16x16x1_1x16x1x16_4_1x1_intrawave_v1,116.72,3708.09,0.0
256,16,16384,4096,8,0,17.2455,a8w8_blockscale_1x128x128_256x16x64x256_16x16_16x16_16x16x1_16x16x1_1x16x1x16_4_1x1_intrawave_v1,124.52,3925.59,0.0
256,16,16384,6656,8,0,24.3544,a8w8_blockscale_1x128x128_256x16x64x256_16x16_16x16_16x16x1_16x16x1_1x16x1x16_4_1x1_intrawave_v1,143.29,4503.61,0.0
256,16,16384,8192,8,0,31.0327,a8w8_blockscale_1x128x128_256x16x64x256_16x16_16x16_16x16x1_16x16x1_1x16x1x16_4_1x1_intrawave_v1,138.4,4346.16,0.0
256,16,16384,13312,8,0,44.7992,a8w8_blockscale_1x128x128_256x16x64x256_16x16_16x16_16x16x1_16x16x1_1x16x1x16_4_1x1_intrawave_v1,155.79,4884.93,0.0
256,16,16384,26624,8,0,91.4472,a8w8_blockscale_1x128x128_256x16x64x256_16x16_16x16_16x16x1_16x16x1_1x16x1x16_4_1x1_intrawave_v1,152.64,4780.44,0.0
256,16,26624,16384,8,0,98.5525,a8w8_blockscale_1x128x128_256x16x64x256_16x16_16x16_16x16x1_16x16x1_1x16x1x16_4_1x1_intrawave_v1,141.64,4437.45,0.0
256,16,51200,5120,4,0,49.1083,a8w8_blockscale_1x128x128_256x16x256x128_8x16_16x16_16x16x1_8x32x1_1x16x1x16_8_1x2_intrawave_v1,170.82,5373.11,0.0
256,16,53248,16384,4,0,173.9077,a8w8_blockscale_1x128x128_256x16x256x128_8x16_16x16_16x16x1_8x32x1_1x16x1x16_8_1x2_intrawave_v1,160.53,5027.85,0.0
256,16,57344,8192,7,0,96.2401,a8w8_blockscale_1x128x128_256x16x128x256_16x16_16x16_16x16x1_16x16x1_1x16x1x16_8_1x2_intrawave_v1,156.2,4901.58,0.0
256,32,100,5120,8,0,16.3838,a8w8_blockscale_1x128x128_256x16x64x256_16x16_16x16_16x16x1_16x16x1_1x16x1x16_4_1x1_intrawave_v1,2.0,41.64,0.0
256,32,200,5120,8,0,16.6109,a8w8_blockscale_1x128x128_256x16x64x256_16x16_16x16_16x16x1_16x16x1_1x16x1x16_4_1x1_intrawave_v1,3.95,72.28,0.0
256,32,512,7168,8,0,20.8789,a8w8_blockscale_1x128x128_256x16x64x256_16x16_16x16_16x16x1_16x16x1_1x16x1x16_4_1x1_intrawave_v1,11.25,188.33,0.0
256,32,576,7168,8,0,20.9821,a8w8_blockscale_1x128x128_256x16x64x256_16x16_16x16_16x16x1_16x16x1_1x16x1x16_4_1x1_intrawave_v1,12.59,209.46,0.0
256,32,800,5120,8,0,18.1035,a8w8_blockscale_1x128x128_256x16x64x256_16x16_16x16_16x16x1_16x16x1_1x16x1x16_4_1x1_intrawave_v1,14.48,238.13,0.0
256,32,1280,8192,8,0,24.8084,a8w8_blockscale_1x128x128_256x16x64x256_16x16_16x16_16x16x1_16x16x1_1x16x1x16_4_1x1_intrawave_v1,27.05,436.54,0.0
256,32,1536,7168,8,0,21.0778,a8w8_blockscale_1x128x128_256x16x64x256_16x16_16x16_16x16x1_16x16x1_1x16x1x16_4_1x1_intrawave_v1,33.43,537.9,0.0
256,32,2304,16384,8,0,45.7333,a8w8_blockscale_1x128x128_256x16x64x256_16x16_16x16_16x16x1_16x16x1_1x16x1x16_4_1x1_intrawave_v1,52.83,840.1,0.0
256,32,2560,8192,8,0,24.6278,a8w8_blockscale_1x128x128_256x16x64x256_16x16_16x16_16x16x1_16x16x1_1x16x1x16_4_1x1_intrawave_v1,54.5,868.84,0.0
256,32,3072,1536,8,0,7.0419,a8w8_blockscale_1x128x128_256x16x64x256_16x16_16x16_16x16x1_16x16x1_1x16x1x16_4_1x1_intrawave_v1,42.88,704.97,0.0
256,32,4096,512,13,0,3.392,a8w8_blockscale_1x128x128_256x32x64x256_16x16_16x16_16x16x1_16x16x1_1x32x1x8_8_2x1_intrawave_v1,39.57,700.38,0.0
256,32,4608,7168,8,0,21.4113,a8w8_blockscale_1x128x128_256x16x64x256_16x16_16x16_16x16x1_16x16x1_1x16x1x16_4_1x1_intrawave_v1,98.73,1567.14,0.0
256,32,4608,16384,8,0,46.5956,a8w8_blockscale_1x128x128_256x16x64x256_16x16_16x16_16x16x1_16x16x1_1x16x1x16_4_1x1_intrawave_v1,103.7,1637.85,0.0
256,32,5120,640,8,0,4.6313,a8w8_blockscale_1x128x128_256x16x64x256_16x16_16x16_16x16x1_16x16x1_1x16x1x16_4_1x1_intrawave_v1,45.28,782.71,0.0
256,32,5120,1280,8,0,5.5445,a8w8_blockscale_1x128x128_256x16x64x256_16x16_16x16_16x16x1_16x16x1_1x16x1x16_4_1x1_intrawave_v1,75.65,1248.49,0.0
256,32,5120,3200,8,0,12.7187,a8w8_blockscale_1x128x128_256x16x64x256_16x16_16x16_16x16x1_16x16x1_1x16x1x16_4_1x1_intrawave_v1,82.44,1322.0,0.0
256,32,5120,5120,8,0,16.176,a8w8_blockscale_1x128x128_256x16x64x256_16x16_16x16_16x16x1_16x16x1_1x16x1x16_4_1x1_intrawave_v1,103.72,1650.96,0.0
256,32,5120,6400,8,0,19.3804,a8w8_blockscale_1x128x128_256x16x64x256_16x16_16x16_16x16x1_16x16x1_1x16x1x16_4_1x1_intrawave_v1,108.21,1718.26,0.0
256,32,5120,25600,8,0,71.2762,a8w8_blockscale_1x128x128_256x16x64x256_16x16_16x16_16x16x1_16x16x1_1x16x1x16_4_1x1_intrawave_v1,117.69,1855.02,0.0
256,32,6400,5120,8,0,16.5798,a8w8_blockscale_1x128x128_256x16x64x256_16x16_16x16_16x16x1_16x16x1_1x16x1x16_4_1x1_intrawave_v1,126.49,2010.97,0.0
256,32,7168,256,13,0,3.0861,a8w8_blockscale_1x128x128_256x32x64x256_16x16_16x16_16x16x1_16x16x1_1x32x1x8_8_2x1_intrawave_v1,38.05,745.91,0.0
256,32,7168,2048,8,0,8.6003,a8w8_blockscale_1x128x128_256x16x64x256_16x16_16x16_16x16x1_16x16x1_1x16x1x16_4_1x1_intrawave_v1,109.24,1767.89,0.0
256,32,7168,2304,8,0,8.5514,a8w8_blockscale_1x128x128_256x16x64x256_16x16_16x16_16x16x1_16x16x1_1x16x1x16_4_1x1_intrawave_v1,123.6,1993.54,0.0
256,32,7168,8192,8,0,25.5808,a8w8_blockscale_1x128x128_256x16x64x256_16x16_16x16_16x16x1_16x16x1_1x16x1x16_4_1x1_intrawave_v1,146.91,2323.66,0.0
256,32,8192,1024,8,0,5.1762,a8w8_blockscale_1x128x128_256x16x64x256_16x16_16x16_16x16x1_16x16x1_1x16x1x16_4_1x1_intrawave_v1,103.72,1728.23,0.0
256,32,8192,2048,8,0,8.7291,a8w8_blockscale_1x128x128_256x16x64x256_16x16_16x16_16x16x1_16x16x1_1x16x1x16_4_1x1_intrawave_v1,123.01,1989.56,0.0
256,32,8192,3584,8,0,12.2362,a8w8_blockscale_1x128x128_256x16x64x256_16x16_16x16_16x16x1_16x16x1_1x16x1x16_4_1x1_intrawave_v1,153.56,2451.67,0.0
256,32,8192,7168,8,0,22.5382,a8w8_blockscale_1x128x128_256x16x64x256_16x16_16x16_16x16x1_16x16x1_1x16x1x16_4_1x1_intrawave_v1,166.74,2638.81,0.0
256,32,8192,8192,8,0,25.8518,a8w8_blockscale_1x128x128_256x16x64x256_16x16_16x16_16x16x1_16x16x1_1x16x1x16_4_1x1_intrawave_v1,166.14,2626.33,0.0
256,32,8192,28672,8,0,87.8476,a8w8_blockscale_1x128x128_256x16x64x256_16x16_16x16_16x16x1_16x16x1_1x16x1x16_4_1x1_intrawave_v1,171.12,2690.15,0.0
256,32,9216,16384,7,0,60.2797,a8w8_blockscale_1x128x128_256x16x128x256_16x16_16x16_16x16x1_16x16x1_1x16x1x16_8_1x2_intrawave_v1,160.31,2523.39,0.0
256,32,10240,8192,7,0,32.3543,a8w8_blockscale_1x128x128_256x16x128x256_16x16_16x16_16x16x1_16x16x1_1x16x1x16_8_1x2_intrawave_v1,165.93,2621.09,0.0
256,32,12800,5120,13,0,23.245,a8w8_blockscale_1x128x128_256x32x64x256_16x16_16x16_16x16x1_16x16x1_1x32x1x8_8_2x1_intrawave_v1,180.44,2861.65,0.0
256,32,13312,16384,7,0,67.4776,a8w8_blockscale_1x128x128_256x16x128x256_16x16_16x16_16x16x1_16x16x1_1x16x1x16_8_1x2_intrawave_v1,206.86,3252.64,0.0
256,32,14336,8192,7,0,34.3237,a8w8_blockscale_1x128x128_256x16x128x256_16x16_16x16_16x16x1_16x16x1_1x16x1x16_8_1x2_intrawave_v1,218.98,3455.93,0.0
256,32,16384,2048,13,0,10.7477,a8w8_blockscale_1x128x128_256x32x64x256_16x16_16x16_16x16x1_16x16x1_1x32x1x8_8_2x1_intrawave_v1,199.81,3225.67,0.0
256,32,16384,4096,7,0,20.9618,a8w8_blockscale_1x128x128_256x16x128x256_16x16_16x16_16x16x1_16x16x1_1x16x1x16_8_1x2_intrawave_v1,204.89,3257.76,0.0
256,32,16384,6656,7,0,30.2047,a8w8_blockscale_1x128x128_256x16x128x256_16x16_16x16_16x16x1_16x16x1_1x16x1x16_8_1x2_intrawave_v1,231.07,3652.2,0.0
256,32,16384,8192,7,0,37.7704,a8w8_blockscale_1x128x128_256x16x128x256_16x16_16x16_16x16x1_16x16x1_1x16x1x16_8_1x2_intrawave_v1,227.43,3588.22,0.0
256,32,16384,13312,18,0,57.2631,a8w8_blockscale_1x128x128_256x64x64x256_16x16_32x32_16x16x1_16x16x1_1x32x1x8_8_1x1_intrawave_v1,243.76,3834.55,0.0
256,32,16384,26624,7,0,112.3349,a8w8_blockscale_1x128x128_256x16x128x256_16x16_16x16_16x16x1_16x16x1_1x16x1x16_8_1x2_intrawave_v1,248.52,3900.02,0.0
256,32,26624,16384,12,0,96.4225,a8w8_blockscale_1x128x128_256x32x128x256_16x16_32x32_16x16x1_16x16x1_1x32x1x8_8_1x1_intrawave_v1,289.53,4547.03,0.0
256,32,51200,5120,12,0,54.8526,a8w8_blockscale_1x128x128_256x32x128x256_16x16_32x32_16x16x1_16x16x1_1x32x1x8_8_1x1_intrawave_v1,305.86,4841.79,0.0
256,32,53248,16384,9,0,169.7265,a8w8_blockscale_1x128x128_256x32x256x128_16x16_32x32_8x32x1_8x32x1_1x32x1x8_8_1x1_intrawave_v1,328.97,5163.29,0.0
256,32,57344,8192,12,0,100.6353,a8w8_blockscale_1x128x128_256x32x128x256_16x16_32x32_16x16x1_16x16x1_1x32x1x8_8_1x1_intrawave_v1,298.75,4707.04,0.0
256,64,100,5120,8,0,16.5796,a8w8_blockscale_1x128x128_256x16x64x256_16x16_16x16_16x16x1_16x16x1_1x16x1x16_4_1x1_intrawave_v1,3.95,51.42,0.0
256,64,192,1024,8,0,4.5983,a8w8_blockscale_1x128x128_256x16x64x256_16x16_16x16_16x16x1_16x16x1_1x16x1x16_4_1x1_intrawave_v1,5.47,62.35,0.0
256,64,200,5120,8,0,16.7447,a8w8_blockscale_1x128x128_256x16x64x256_16x16_16x16_16x16x1_16x16x1_1x16x1x16_4_1x1_intrawave_v1,7.83,82.25,0.0
256,64,512,7168,8,0,20.8606,a8w8_blockscale_1x128x128_256x16x64x256_16x16_16x16_16x16x1_16x16x1_1x16x1x16_4_1x1_intrawave_v1,22.52,201.06,0.0
256,64,576,7168,8,0,20.8661,a8w8_blockscale_1x128x128_256x16x64x256_16x16_16x16_16x16x1_16x16x1_1x16x1x16_4_1x1_intrawave_v1,25.33,223.39,0.0
256,64,800,5120,8,0,18.0584,a8w8_blockscale_1x128x128_256x16x64x256_16x16_16x16_16x16x1_16x16x1_1x16x1x16_4_1x1_intrawave_v1,29.03,250.64,0.0
256,64,1280,8192,8,0,24.7933,a8w8_blockscale_1x128x128_256x16x64x256_16x16_16x16_16x16x1_16x16x1_1x16x1x16_4_1x1_intrawave_v1,54.13,450.68,0.0
256,64,1536,7168,8,0,21.5893,a8w8_blockscale_1x128x128_256x16x64x256_16x16_16x16_16x16x1_16x16x1_1x16x1x16_4_1x1_intrawave_v1,65.28,540.33,0.0
256,64,2304,16384,8,0,45.5573,a8w8_blockscale_1x128x128_256x16x64x256_16x16_16x16_16x16x1_16x16x1_1x16x1x16_4_1x1_intrawave_v1,106.06,858.09,0.0
256,64,2560,8192,8,0,24.6726,a8w8_blockscale_1x128x128_256x16x64x256_16x16_16x16_16x16x1_16x16x1_1x16x1x16_4_1x1_intrawave_v1,108.8,884.52,0.0
256,64,3072,1536,8,0,7.2247,a8w8_blockscale_1x128x128_256x16x64x256_16x16_16x16_16x16x1_16x16x1_1x16x1x16_4_1x1_intrawave_v1,83.6,721.15,0.0
256,64,4096,512,13,0,3.7906,a8w8_blockscale_1x128x128_256x32x64x256_16x16_16x16_16x16x1_16x16x1_1x32x1x8_8_2x1_intrawave_v1,70.82,700.21,0.0
256,64,4608,7168,18,0,26.1254,a8w8_blockscale_1x128x128_256x64x64x256_16x16_32x32_16x16x1_16x16x1_1x32x1x8_8_1x1_intrawave_v1,161.83,1304.43,0.0
256,64,4608,16384,18,0,55.5507,a8w8_blockscale_1x128x128_256x64x64x256_16x16_32x32_16x16x1_16x16x1_1x32x1x8_8_1x1_intrawave_v1,173.96,1388.57,0.0
256,64,5120,640,13,0,5.2562,a8w8_blockscale_1x128x128_256x32x64x256_16x16_16x16_16x16x1_16x16x1_1x32x1x8_8_2x1_intrawave_v1,79.8,755.89,0.0
256,64,5120,1280,13,0,7.8459,a8w8_blockscale_1x128x128_256x32x64x256_16x16_16x16_16x16x1_16x16x1_1x32x1x8_8_2x1_intrawave_v1,106.92,929.26,0.0
256,64,5120,3200,13,0,14.9252,a8w8_blockscale_1x128x128_256x32x64x256_16x16_16x16_16x16x1_16x16x1_1x32x1x8_8_2x1_intrawave_v1,140.51,1155.37,0.0
256,64,5120,5120,18,0,19.8162,a8w8_blockscale_1x128x128_256x64x64x256_16x16_32x32_16x16x1_16x16x1_1x32x1x8_8_1x1_intrawave_v1,169.33,1372.49,0.0
256,64,5120,6400,18,0,23.6118,a8w8_blockscale_1x128x128_256x64x64x256_16x16_32x32_16x16x1_16x16x1_1x32x1x8_8_1x1_intrawave_v1,177.64,1432.88,0.0
256,64,5120,25600,18,0,85.6628,a8w8_blockscale_1x128x128_256x64x64x256_16x16_32x32_16x16x1_16x16x1_1x32x1x8_8_1x1_intrawave_v1,195.85,1556.87,0.0
256,64,6400,5120,18,0,20.1606,a8w8_blockscale_1x128x128_256x64x64x256_16x16_32x32_16x16x1_16x16x1_1x32x1x8_8_1x1_intrawave_v1,208.04,1682.24,0.0
256,64,7168,256,8,0,3.6514,a8w8_blockscale_1x128x128_256x16x64x256_16x16_16x16_16x16x1_16x16x1_1x16x1x16_4_1x1_intrawave_v1,64.33,758.31,0.0
256,64,7168,2048,7,0,9.4457,a8w8_blockscale_1x128x128_256x16x128x256_16x16_16x16_16x16x1_16x16x1_1x16x1x16_8_1x2_intrawave_v1,198.93,1665.16,0.0
256,64,7168,2304,18,0,10.407,a8w8_blockscale_1x128x128_256x64x64x256_16x16_32x32_16x16x1_16x16x1_1x32x1x8_8_1x1_intrawave_v1,203.13,1689.25,0.0
256,64,7168,8192,18,0,29.9483,a8w8_blockscale_1x128x128_256x64x64x256_16x16_32x32_16x16x1_16x16x1_1x32x1x8_8_1x1_intrawave_v1,250.97,2008.86,0.0
256,64,8192,2048,7,0,9.4987,a8w8_blockscale_1x128x128_256x16x128x256_16x16_16x16_16x16x1_16x16x1_1x16x1x16_8_1x2_intrawave_v1,226.08,1890.45,0.0
256,64,8192,3584,18,0,14.8112,a8w8_blockscale_1x128x128_256x64x64x256_16x16_32x32_16x16x1_16x16x1_1x32x1x8_8_1x1_intrawave_v1,253.73,2068.58,0.0
256,64,8192,7168,18,0,26.8241,a8w8_blockscale_1x128x128_256x64x64x256_16x16_32x32_16x16x1_16x16x1_1x32x1x8_8_1x1_intrawave_v1,280.2,2245.28,0.0
256,64,8192,8192,18,0,30.7312,a8w8_blockscale_1x128x128_256x64x64x256_16x16_32x32_16x16x1_16x16x1_1x32x1x8_8_1x1_intrawave_v1,279.52,2234.92,0.0
256,64,8192,28672,18,0,99.5032,a8w8_blockscale_1x128x128_256x64x64x256_16x16_32x32_16x16x1_16x16x1_1x32x1x8_8_1x1_intrawave_v1,302.15,2389.52,0.0
256,64,9216,16384,18,0,58.0832,a8w8_blockscale_1x128x128_256x64x64x256_16x16_32x32_16x16x1_16x16x1_1x32x1x8_8_1x1_intrawave_v1,332.75,2637.99,0.0
256,64,10240,8192,18,0,31.294,a8w8_blockscale_1x128x128_256x64x64x256_16x16_32x32_16x16x1_16x16x1_1x32x1x8_8_1x1_intrawave_v1,343.11,2739.22,0.0
256,64,12800,5120,18,0,22.1079,a8w8_blockscale_1x128x128_256x64x64x256_16x16_32x32_16x16x1_16x16x1_1x32x1x8_8_1x1_intrawave_v1,379.44,3053.3,0.0
256,64,13312,16384,18,0,66.5398,a8w8_blockscale_1x128x128_256x64x64x256_16x16_32x32_16x16x1_16x16x1_1x32x1x8_8_1x1_intrawave_v1,419.56,3319.16,0.0
256,64,14336,8192,18,0,35.0933,a8w8_blockscale_1x128x128_256x64x64x256_16x16_32x32_16x16x1_16x16x1_1x32x1x8_8_1x1_intrawave_v1,428.35,3413.75,0.0
256,64,16384,2048,18,0,10.6552,a8w8_blockscale_1x128x128_256x64x64x256_16x16_32x32_16x16x1_16x16x1_1x32x1x8_8_1x1_intrawave_v1,403.09,3358.23,0.0
256,64,16384,4096,18,0,20.264,a8w8_blockscale_1x128x128_256x64x64x256_16x16_32x32_16x16x1_16x16x1_1x32x1x8_8_1x1_intrawave_v1,423.9,3428.16,0.0
256,64,16384,6656,18,0,29.5553,a8w8_blockscale_1x128x128_256x64x64x256_16x16_32x32_16x16x1_16x16x1_1x32x1x8_8_1x1_intrawave_v1,472.29,3775.13,0.0
256,64,16384,8192,18,0,37.9735,a8w8_blockscale_1x128x128_256x64x64x256_16x16_32x32_16x16x1_16x16x1_1x32x1x8_8_1x1_intrawave_v1,452.42,3603.54,0.0
256,64,16384,13312,18,0,55.7232,a8w8_blockscale_1x128x128_256x64x64x256_16x16_32x32_16x16x1_16x16x1_1x32x1x8_8_1x1_intrawave_v1,501.0,3966.98,0.0
256,64,16384,26624,18,0,102.8234,a8w8_blockscale_1x128x128_256x64x64x256_16x16_32x32_16x16x1_16x16x1_1x32x1x8_8_1x1_intrawave_v1,543.01,4279.27,0.0
256,64,26624,16384,18,0,115.0916,a8w8_blockscale_1x128x128_256x64x64x256_16x16_32x32_16x16x1_16x16x1_1x32x1x8_8_1x1_intrawave_v1,485.13,3828.81,0.0
256,64,51200,5120,14,0,67.6368,a8w8_blockscale_1x128x128_256x64x256x128_16x16_32x32_8x32x1_8x32x1_1x32x1x8_8_1x1_intrawave_v1,496.1,3977.5,0.0
256,64,53248,16384,2,0,194.0509,a8w8_blockscale_1x128x128_256x64x128x128_16x16_32x32_8x32x1_8x32x1_1x32x1x8_8_1x1_intrawave_v3,575.46,4536.33,0.0
256,64,57344,8192,2,0,109.6811,a8w8_blockscale_1x128x128_256x64x128x128_16x16_32x32_8x32x1_8x32x1_1x32x1x8_8_1x1_intrawave_v3,548.22,4354.68,0.0
256,128,100,5120,8,0,16.733,a8w8_blockscale_1x128x128_256x16x64x256_16x16_16x16_16x16x1_16x16x1_1x16x1x16_4_1x1_intrawave_v1,7.83,71.29,0.0
256,128,200,5120,8,0,16.774,a8w8_blockscale_1x128x128_256x16x64x256_16x16_16x16_16x16x1_16x16x1_1x16x1x16_4_1x1_intrawave_v1,15.63,103.17,0.0
256,128,512,7168,8,0,20.6206,a8w8_blockscale_1x128x128_256x16x64x256_16x16_16x16_16x16x1_16x16x1_1x16x1x16_4_1x1_intrawave_v1,45.56,228.83,0.0
256,128,576,7168,8,0,20.7528,a8w8_blockscale_1x128x128_256x16x64x256_16x16_16x16_16x16x1_16x16x1_1x16x1x16_4_1x1_intrawave_v1,50.93,250.27,0.0
256,128,800,5120,8,0,17.8203,a8w8_blockscale_1x128x128_256x16x64x256_16x16_16x16_16x16x1_16x16x1_1x16x1x16_4_1x1_intrawave_v1,58.84,278.12,0.0
256,128,1280,8192,8,0,24.4243,a8w8_blockscale_1x128x128_256x16x64x256_16x16_16x16_16x16x1_16x16x1_1x16x1x16_4_1x1_intrawave_v1,109.91,485.66,0.0
256,128,1536,7168,8,0,21.3092,a8w8_blockscale_1x128x128_256x16x64x256_16x16_16x16_16x16x1_16x16x1_1x16x1x16_4_1x1_intrawave_v1,132.27,578.19,0.0
256,128,2304,16384,18,0,54.5104,a8w8_blockscale_1x128x128_256x64x64x256_16x16_32x32_16x16x1_16x16x1_1x32x1x8_8_1x1_intrawave_v1,177.28,741.8,0.0
256,128,2560,8192,18,0,29.3095,a8w8_blockscale_1x128x128_256x64x64x256_16x16_32x32_16x16x1_16x16x1_1x32x1x8_8_1x1_intrawave_v1,183.17,773.66,0.0
256,128,3072,1536,13,0,8.4282,a8w8_blockscale_1x128x128_256x32x64x256_16x16_16x16_16x16x1_16x16x1_1x32x1x8_8_2x1_intrawave_v1,143.32,676.49,0.0
256,128,4096,512,8,0,4.134,a8w8_blockscale_1x128x128_256x16x64x256_16x16_16x16_16x16x1_16x16x1_1x16x1x16_4_1x1_intrawave_v1,129.87,776.79,0.0
256,128,4608,7168,18,0,26.3603,a8w8_blockscale_1x128x128_256x64x64x256_16x16_32x32_16x16x1_16x16x1_1x32x1x8_8_1x1_intrawave_v1,320.77,1332.58,0.0
256,128,4608,16384,18,0,55.1806,a8w8_blockscale_1x128x128_256x64x64x256_16x16_32x32_16x16x1_16x16x1_1x32x1x8_8_1x1_intrawave_v1,350.26,1427.57,0.0
256,128,5120,640,18,0,5.6546,a8w8_blockscale_1x128x128_256x64x64x256_16x16_32x32_16x16x1_16x16x1_1x32x1x8_8_1x1_intrawave_v1,148.35,825.78,0.0
256,128,5120,1280,18,0,8.1731,a8w8_blockscale_1x128x128_256x64x64x256_16x16_32x32_16x16x1_16x16x1_1x32x1x8_8_1x1_intrawave_v1,205.27,982.27,0.0
256,128,5120,3200,18,0,15.9968,a8w8_blockscale_1x128x128_256x64x64x256_16x16_32x32_16x16x1_16x16x1_1x32x1x8_8_1x1_intrawave_v1,262.2,1131.75,0.0
256,128,5120,5120,18,0,20.066,a8w8_blockscale_1x128x128_256x64x64x256_16x16_32x32_16x16x1_16x16x1_1x32x1x8_8_1x1_intrawave_v1,334.44,1404.39,0.0
256,128,5120,6400,18,0,23.8263,a8w8_blockscale_1x128x128_256x64x64x256_16x16_32x32_16x16x1_16x16x1_1x32x1x8_8_1x1_intrawave_v1,352.07,1464.68,0.0
256,128,5120,25600,18,0,85.9267,a8w8_blockscale_1x128x128_256x64x64x256_16x16_32x32_16x16x1_16x16x1_1x32x1x8_8_1x1_intrawave_v1,390.5,1578.78,0.0
256,128,6400,5120,18,0,20.5739,a8w8_blockscale_1x128x128_256x64x64x256_16x16_32x32_16x16x1_16x16x1_1x32x1x8_8_1x1_intrawave_v1,407.73,1704.19,0.0
256,128,7168,256,18,0,4.2351,a8w8_blockscale_1x128x128_256x64x64x256_16x16_32x32_16x16x1_16x16x1_1x32x1x8_8_1x1_intrawave_v1,110.92,874.31,0.0
256,128,7168,2048,18,0,9.9528,a8w8_blockscale_1x128x128_256x64x64x256_16x16_32x32_16x16x1_16x16x1_1x32x1x8_8_1x1_intrawave_v1,377.59,1685.68,0.0
256,128,7168,2304,18,0,10.8359,a8w8_blockscale_1x128x128_256x64x64x256_16x16_32x32_16x16x1_16x16x1_1x32x1x8_8_1x1_intrawave_v1,390.17,1720.67,0.0
256,128,7168,8192,18,0,30.5737,a8w8_blockscale_1x128x128_256x64x64x256_16x16_32x32_16x16x1_16x16x1_1x32x1x8_8_1x1_intrawave_v1,491.68,2014.93,0.0
256,128,8192,1024,18,0,7.2283,a8w8_blockscale_1x128x128_256x64x64x256_16x16_32x32_16x16x1_16x16x1_1x32x1x8_8_1x1_intrawave_v1,297.09,1468.79,0.0
256,128,8192,2048,18,0,10.0547,a8w8_blockscale_1x128x128_256x64x64x256_16x16_32x32_16x16x1_16x16x1_1x32x1x8_8_1x1_intrawave_v1,427.16,1903.24,0.0
256,128,8192,3584,18,0,15.2709,a8w8_blockscale_1x128x128_256x64x64x256_16x16_32x32_16x16x1_16x16x1_1x32x1x8_8_1x1_intrawave_v1,492.19,2089.99,0.0
256,128,8192,7168,18,0,27.6199,a8w8_blockscale_1x128x128_256x64x64x256_16x16_32x32_16x16x1_16x16x1_1x32x1x8_8_1x1_intrawave_v1,544.26,2235.16,0.0
256,128,8192,8192,18,0,31.4844,a8w8_blockscale_1x128x128_256x64x64x256_16x16_32x32_16x16x1_16x16x1_1x32x1x8_8_1x1_intrawave_v1,545.66,2231.41,0.0
256,128,8192,28672,18,0,100.1365,a8w8_blockscale_1x128x128_256x64x64x256_16x16_32x32_16x16x1_16x16x1_1x32x1x8_8_1x1_intrawave_v1,600.48,2403.2,0.0
256,128,9216,16384,2,0,91.6897,a8w8_blockscale_1x128x128_256x64x128x128_16x16_32x32_8x32x1_8x32x1_1x32x1x8_8_1x1_intrawave_v3,421.58,1695.41,0.0
256,128,10240,8192,2,0,50.7096,a8w8_blockscale_1x128x128_256x64x128x128_16x16_32x32_8x32x1_8x32x1_1x32x1x8_8_1x1_intrawave_v3,423.49,1726.62,0.0
256,128,12800,5120,2,0,34.8835,a8w8_blockscale_1x128x128_256x64x128x128_16x16_32x32_8x32x1_8x32x1_1x32x1x8_8_1x1_intrawave_v3,480.95,1991.43,0.0
256,128,13312,16384,2,0,95.4006,a8w8_blockscale_1x128x128_256x64x128x128_16x16_32x32_8x32x1_8x32x1_1x32x1x8_8_1x1_intrawave_v3,585.26,2343.89,0.0
256,128,14336,8192,2,0,53.5564,a8w8_blockscale_1x128x128_256x64x128x128_16x16_32x32_8x32x1_8x32x1_1x32x1x8_8_1x1_intrawave_v3,561.37,2280.94,0.0
256,128,16384,2048,2,0,16.0044,a8w8_blockscale_1x128x128_256x64x128x128_16x16_32x32_8x32x1_8x32x1_1x32x1x8_8_1x1_intrawave_v3,536.72,2375.03,0.0
256,128,16384,4096,2,0,29.309,a8w8_blockscale_1x128x128_256x64x128x128_16x16_32x32_8x32x1_8x32x1_1x32x1x8_8_1x1_intrawave_v3,586.16,2450.7,0.0
256,128,16384,6656,2,0,42.3367,a8w8_blockscale_1x128x128_256x64x128x128_16x16_32x32_8x32x1_8x32x1_1x32x1x8_8_1x1_intrawave_v3,659.41,2695.02,0.0
256,128,16384,8192,2,0,55.6222,a8w8_blockscale_1x128x128_256x64x128x128_16x16_32x32_8x32x1_8x32x1_1x32x1x8_8_1x1_intrawave_v3,617.73,2507.28,0.0
256,128,16384,13312,2,0,82.0452,a8w8_blockscale_1x128x128_256x64x128x128_16x16_32x32_8x32x1_8x32x1_1x32x1x8_8_1x1_intrawave_v3,680.53,2730.23,0.0
256,128,16384,26624,2,0,158.6587,a8w8_blockscale_1x128x128_256x64x128x128_16x16_32x32_8x32x1_8x32x1_1x32x1x8_8_1x1_intrawave_v3,703.83,2797.26,0.0
256,128,26624,16384,0,0,136.1858,a8w8_blockscale_1x128x128_256x128x128x128_16x16_32x32_8x32x1_8x32x1_1x32x1x8_8_1x1_intrawave_v3,819.98,3268.48,0.0
256,128,51200,5120,0,0,90.5453,a8w8_blockscale_1x128x128_256x128x128x128_16x16_32x32_8x32x1_8x32x1_1x32x1x8_8_1x1_intrawave_v3,741.16,3047.17,0.0
256,128,53248,16384,0,0,247.8613,a8w8_blockscale_1x128x128_256x128x128x128_16x16_32x32_8x32x1_8x32x1_1x32x1x8_8_1x1_intrawave_v3,901.06,3583.23,0.0
256,128,57344,8192,0,0,137.1929,a8w8_blockscale_1x128x128_256x128x128x128_16x16_32x32_8x32x1_8x32x1_1x32x1x8_8_1x1_intrawave_v3,876.57,3538.74,0.0
256,256,100,5120,8,0,16.8485,a8w8_blockscale_1x128x128_256x16x64x256_16x16_16x16_16x16x1_16x16x1_1x16x1x16_4_1x1_intrawave_v1,15.56,111.22,0.0
256,256,200,5120,8,0,17.1797,a8w8_blockscale_1x128x128_256x16x64x256_16x16_16x16_16x16x1_16x16x1_1x16x1x16_4_1x1_intrawave_v1,30.52,141.86,0.0
256,256,512,7168,8,0,20.8367,a8w8_blockscale_1x128x128_256x16x64x256_16x16_16x16_16x16x1_16x16x1_1x16x1x16_4_1x1_intrawave_v1,90.18,276.78,0.0
256,256,576,7168,8,0,20.7872,a8w8_blockscale_1x128x128_256x16x64x256_16x16_16x16_16x16x1_16x16x1_1x16x1x16_4_1x1_intrawave_v1,101.69,301.08,0.0
256,256,800,5120,8,0,18.0446,a8w8_blockscale_1x128x128_256x16x64x256_16x16_16x16_16x16x1_16x16x1_1x16x1x16_4_1x1_intrawave_v1,116.22,322.33,0.0
256,256,1280,8192,18,0,29.2575,a8w8_blockscale_1x128x128_256x64x64x256_16x16_32x32_16x16x1_16x16x1_1x32x1x8_8_1x1_intrawave_v1,183.5,452.47,0.0
256,256,1536,7168,18,0,26.1165,a8w8_blockscale_1x128x128_256x64x64x256_16x16_32x32_16x16x1_16x16x1_1x32x1x8_8_1x1_intrawave_v1,215.85,521.95,0.0
256,256,2304,16384,18,0,55.2867,a8w8_blockscale_1x128x128_256x64x64x256_16x16_32x32_16x16x1_16x16x1_1x32x1x8_8_1x1_intrawave_v1,349.58,779.98,0.0
256,256,2560,8192,18,0,29.6083,a8w8_blockscale_1x128x128_256x64x64x256_16x16_32x32_16x16x1_16x16x1_1x32x1x8_8_1x1_intrawave_v1,362.65,823.4,0.0
256,256,3072,1536,18,0,8.4708,a8w8_blockscale_1x128x128_256x64x64x256_16x16_32x32_16x16x1_16x16x1_1x32x1x8_8_1x1_intrawave_v1,285.21,789.14,0.0
256,256,4096,512,4,0,4.7834,a8w8_blockscale_1x128x128_256x16x256x128_8x16_16x16_16x16x1_8x32x1_1x16x1x16_8_1x2_intrawave_v1,224.47,904.25,0.0
256,256,4608,7168,2,0,41.4944,a8w8_blockscale_1x128x128_256x64x128x128_16x16_32x32_8x32x1_8x32x1_1x32x1x8_8_1x1_intrawave_v3,407.56,897.1,0.0
256,256,4608,16384,2,0,87.3976,a8w8_blockscale_1x128x128_256x64x128x128_16x16_32x32_8x32x1_8x32x1_1x32x1x8_8_1x1_intrawave_v3,442.29,938.83,0.0
256,256,5120,640,2,0,7.8131,a8w8_blockscale_1x128x128_256x64x128x128_16x16_32x32_8x32x1_8x32x1_1x32x1x8_8_1x1_intrawave_v3,214.73,775.89,0.0
256,256,5120,1280,2,0,10.8214,a8w8_blockscale_1x128x128_256x64x128x128_16x16_32x32_8x32x1_8x32x1_1x32x1x8_8_1x1_intrawave_v3,310.07,878.14,0.0
256,256,5120,3200,2,0,20.1697,a8w8_blockscale_1x128x128_256x64x128x128_16x16_32x32_8x32x1_8x32x1_1x32x1x8_8_1x1_intrawave_v3,415.9,982.89,0.0
256,256,5120,5120,2,0,31.7951,a8w8_blockscale_1x128x128_256x64x128x128_16x16_32x32_8x32x1_8x32x1_1x32x1x8_8_1x1_intrawave_v3,422.13,948.15,0.0
256,256,5120,6400,2,0,36.2066,a8w8_blockscale_1x128x128_256x64x128x128_16x16_32x32_8x32x1_8x32x1_1x32x1x8_8_1x1_intrawave_v3,463.37,1022.68,0.0
256,256,5120,25600,2,0,137.7669,a8w8_blockscale_1x128x128_256x64x128x128_16x16_32x32_8x32x1_8x32x1_1x32x1x8_8_1x1_intrawave_v3,487.12,1018.0,0.0
256,256,6400,5120,2,0,32.7142,a8w8_blockscale_1x128x128_256x64x128x128_16x16_32x32_8x32x1_8x32x1_1x32x1x8_8_1x1_intrawave_v3,512.84,1141.87,0.0
256,256,7168,256,18,0,4.8783,a8w8_blockscale_1x128x128_256x64x64x256_16x16_32x32_16x16x1_16x16x1_1x32x1x8_8_1x1_intrawave_v1,192.59,1141.91,0.0
256,256,7168,2048,2,0,15.2484,a8w8_blockscale_1x128x128_256x64x128x128_16x16_32x32_8x32x1_8x32x1_1x32x1x8_8_1x1_intrawave_v3,492.92,1237.79,0.0
256,256,7168,2304,2,0,15.9546,a8w8_blockscale_1x128x128_256x64x128x128_16x16_32x32_8x32x1_8x32x1_1x32x1x8_8_1x1_intrawave_v3,529.99,1302.13,0.0
256,256,7168,8192,2,0,48.3765,a8w8_blockscale_1x128x128_256x64x128x128_16x16_32x32_8x32x1_8x32x1_1x32x1x8_8_1x1_intrawave_v3,621.47,1333.03,0.0
256,256,8192,1024,2,0,10.0044,a8w8_blockscale_1x128x128_256x64x128x128_16x16_32x32_8x32x1_8x32x1_1x32x1x8_8_1x1_intrawave_v3,429.31,1283.94,0.0
256,256,8192,2048,2,0,15.2735,a8w8_blockscale_1x128x128_256x64x128x128_16x16_32x32_8x32x1_8x32x1_1x32x1x8_8_1x1_intrawave_v3,562.41,1407.39,0.0
256,256,8192,3584,2,0,23.0914,a8w8_blockscale_1x128x128_256x64x128x128_16x16_32x32_8x32x1_8x32x1_1x32x1x8_8_1x1_intrawave_v3,650.99,1492.85,0.0
256,256,8192,7168,2,0,43.7462,a8w8_blockscale_1x128x128_256x64x128x128_16x16_32x32_8x32x1_8x32x1_1x32x1x8_8_1x1_intrawave_v3,687.25,1480.12,0.0
256,256,8192,8192,2,0,49.2229,a8w8_blockscale_1x128x128_256x64x128x128_16x16_32x32_8x32x1_8x32x1_1x32x1x8_8_1x1_intrawave_v3,698.04,1491.18,0.0
256,256,8192,28672,2,0,159.2857,a8w8_blockscale_1x128x128_256x64x128x128_16x16_32x32_8x32x1_8x32x1_1x32x1x8_8_1x1_intrawave_v3,754.99,1547.0,0.0
256,256,9216,16384,0,0,109.7269,a8w8_blockscale_1x128x128_256x128x128x128_16x16_32x32_8x32x1_8x32x1_1x32x1x8_8_1x1_intrawave_v3,704.56,1457.33,0.0
256,256,10240,8192,0,0,60.0808,a8w8_blockscale_1x128x128_256x128x128x128_16x16_32x32_8x32x1_8x32x1_1x32x1x8_8_1x1_intrawave_v3,714.87,1518.39,0.0
256,256,12800,5120,0,0,43.4479,a8w8_blockscale_1x128x128_256x128x128x128_16x16_32x32_8x32x1_8x32x1_1x32x1x8_8_1x1_intrawave_v3,772.29,1689.39,0.0
256,256,13312,16384,0,0,114.2041,a8w8_blockscale_1x128x128_256x128x128x128_16x16_32x32_8x32x1_8x32x1_1x32x1x8_8_1x1_intrawave_v3,977.8,2006.18,0.0
256,256,14336,8192,0,0,64.0235,a8w8_blockscale_1x128x128_256x128x128x128_16x16_32x32_8x32x1_8x32x1_1x32x1x8_8_1x1_intrawave_v3,939.18,1981.74,0.0
256,256,16384,2048,0,0,20.4168,a8w8_blockscale_1x128x128_256x128x128x128_16x16_32x32_8x32x1_8x32x1_1x32x1x8_8_1x1_intrawave_v3,841.46,2080.02,0.0
256,256,16384,4096,0,0,35.6989,a8w8_blockscale_1x128x128_256x128x128x128_16x16_32x32_8x32x1_8x32x1_1x32x1x8_8_1x1_intrawave_v3,962.49,2144.21,0.0
256,256,16384,6656,0,0,53.655,a8w8_blockscale_1x128x128_256x128x128x128_16x16_32x32_8x32x1_8x32x1_1x32x1x8_8_1x1_intrawave_v3,1040.62,2220.57,0.0
256,256,16384,8192,0,0,68.4046,a8w8_blockscale_1x128x128_256x128x128x128_16x16_32x32_8x32x1_8x32x1_1x32x1x8_8_1x1_intrawave_v3,1004.6,2115.41,0.0
256,256,16384,13312,0,0,100.7068,a8w8_blockscale_1x128x128_256x128x128x128_16x16_32x32_8x32x1_8x32x1_1x32x1x8_8_1x1_intrawave_v3,1108.85,2282.87,0.0
256,256,16384,26624,0,0,192.0921,a8w8_blockscale_1x128x128_256x128x128x128_16x16_32x32_8x32x1_8x32x1_1x32x1x8_8_1x1_intrawave_v3,1162.66,2349.98,0.0
256,256,26624,16384,0,0,203.8984,a8w8_blockscale_1x128x128_256x128x128x128_16x16_32x32_8x32x1_8x32x1_1x32x1x8_8_1x1_intrawave_v3,1095.34,2226.76,0.0
256,256,51200,5120,0,0,142.266,a8w8_blockscale_1x128x128_256x128x128x128_16x16_32x32_8x32x1_8x32x1_1x32x1x8_8_1x1_intrawave_v3,943.43,2036.11,0.0
256,256,53248,16384,0,0,392.135,a8w8_blockscale_1x128x128_256x128x128x128_16x16_32x32_8x32x1_8x32x1_1x32x1x8_8_1x1_intrawave_v3,1139.09,2305.0,0.0
256,256,57344,8192,0,0,217.0653,a8w8_blockscale_1x128x128_256x128x128x128_16x16_32x32_8x32x1_8x32x1_1x32x1x8_8_1x1_intrawave_v3,1108.05,2309.07,0.0
256,512,100,5120,8,0,17.5115,a8w8_blockscale_1x128x128_256x16x64x256_16x16_16x16_16x16x1_16x16x1_1x16x1x16_4_1x1_intrawave_v1,29.94,184.78,0.0
256,512,200,5120,8,0,17.6681,a8w8_blockscale_1x128x128_256x16x64x256_16x16_16x16_16x16x1_16x16x1_1x16x1x16_4_1x1_intrawave_v1,59.35,217.92,0.0
256,512,512,7168,8,0,21.3799,a8w8_blockscale_1x128x128_256x16x64x256_16x16_16x16_16x16x1_16x16x1_1x16x1x16_4_1x1_intrawave_v1,175.78,367.84,0.0
256,512,576,7168,18,0,25.8971,a8w8_blockscale_1x128x128_256x64x64x256_16x16_32x32_16x16x1_16x16x1_1x32x1x8_8_1x1_intrawave_v1,163.26,323.92,0.0
256,512,800,5120,13,0,21.0701,a8w8_blockscale_1x128x128_256x32x64x256_16x16_16x16_16x16x1_16x16x1_1x32x1x8_8_2x1_intrawave_v1,199.06,357.69,0.0
256,512,1280,8192,18,0,29.6044,a8w8_blockscale_1x128x128_256x64x64x256_16x16_32x32_16x16x1_16x16x1_1x32x1x8_8_1x1_intrawave_v1,362.7,540.15,0.0
256,512,1536,7168,18,0,26.4041,a8w8_blockscale_1x128x128_256x64x64x256_16x16_32x32_16x16x1_16x16x1_1x32x1x8_8_1x1_intrawave_v1,426.99,615.55,0.0
256,512,2304,16384,2,0,82.5917,a8w8_blockscale_1x128x128_256x64x128x128_16x16_32x32_8x32x1_8x32x1_1x32x1x8_8_1x1_intrawave_v3,468.02,587.19,0.0
256,512,2560,8192,2,0,44.8841,a8w8_blockscale_1x128x128_256x64x128x128_16x16_32x32_8x32x1_8x32x1_1x32x1x8_8_1x1_intrawave_v3,478.45,619.09,0.0
256,512,3072,1536,2,0,12.0045,a8w8_blockscale_1x128x128_256x64x128x128_16x16_32x32_8x32x1_8x32x1_1x32x1x8_8_1x1_intrawave_v3,402.5,720.63,0.0
256,512,4096,512,18,0,5.6883,a8w8_blockscale_1x128x128_256x64x64x256_16x16_32x32_16x16x1_16x16x1_1x32x1x8_8_1x1_intrawave_v1,377.53,1152.12,0.0
256,512,4608,7168,0,0,52.2467,a8w8_blockscale_1x128x128_256x128x128x128_16x16_32x32_8x32x1_8x32x1_1x32x1x8_8_1x1_intrawave_v3,647.37,792.75,0.0
256,512,4608,16384,0,0,106.0675,a8w8_blockscale_1x128x128_256x128x128x128_16x16_32x32_8x32x1_8x32x1_1x32x1x8_8_1x1_intrawave_v3,728.87,835.36,0.0
256,512,5120,640,3,0,9.5711,a8w8_blockscale_1x128x128_256x64x64x128_16x16_32x32_8x32x1_8x32x1_1x32x1x8_8_1x1_intrawave_v3,350.58,924.38,0.0
256,512,5120,1280,0,0,13.7137,a8w8_blockscale_1x128x128_256x128x128x128_16x16_32x32_8x32x1_8x32x1_1x32x1x8_8_1x1_intrawave_v3,489.36,907.99,0.0
256,512,5120,3200,0,0,24.6979,a8w8_blockscale_1x128x128_256x128x128x128_16x16_32x32_8x32x1_8x32x1_1x32x1x8_8_1x1_intrawave_v3,679.3,941.99,0.0
256,512,5120,5120,0,0,40.9175,a8w8_blockscale_1x128x128_256x128x128x128_16x16_32x32_8x32x1_8x32x1_1x32x1x8_8_1x1_intrawave_v3,656.04,832.86,0.0
256,512,5120,6400,0,0,44.8421,a8w8_blockscale_1x128x128_256x128x128x128_16x16_32x32_8x32x1_8x32x1_1x32x1x8_8_1x1_intrawave_v3,748.28,920.73,0.0
256,512,5120,25600,0,0,171.5034,a8w8_blockscale_1x128x128_256x128x128x128_16x16_32x32_8x32x1_8x32x1_1x32x1x8_8_1x1_intrawave_v3,782.6,871.25,0.0
256,512,6400,5120,0,0,42.3252,a8w8_blockscale_1x128x128_256x128x128x128_16x16_32x32_8x32x1_8x32x1_1x32x1x8_8_1x1_intrawave_v3,792.78,990.97,0.0
256,512,7168,256,18,0,8.1144,a8w8_blockscale_1x128x128_256x64x64x256_16x16_32x32_16x16x1_16x16x1_1x32x1x8_8_1x1_intrawave_v1,231.57,1146.86,0.0
256,512,7168,2048,0,0,19.3262,a8w8_blockscale_1x128x128_256x128x128x128_16x16_32x32_8x32x1_8x32x1_1x32x1x8_8_1x1_intrawave_v3,777.82,1193.65,0.0
256,512,7168,2304,0,0,20.037,a8w8_blockscale_1x128x128_256x128x128x128_16x16_32x32_8x32x1_8x32x1_1x32x1x8_8_1x1_intrawave_v3,844.01,1249.43,0.0
256,512,7168,8192,0,0,59.7884,a8w8_blockscale_1x128x128_256x128x128x128_16x16_32x32_8x32x1_8x32x1_1x32x1x8_8_1x1_intrawave_v3,1005.71,1175.05,0.0
256,512,8192,1024,0,0,12.9663,a8w8_blockscale_1x128x128_256x128x128x128_16x16_32x32_8x32x1_8x32x1_1x32x1x8_8_1x1_intrawave_v3,662.48,1334.34,0.0
256,512,8192,2048,0,0,19.8325,a8w8_blockscale_1x128x128_256x128x128x128_16x16_32x32_8x32x1_8x32x1_1x32x1x8_8_1x1_intrawave_v3,866.25,1321.79,0.0
256,512,8192,3584,0,0,30.0233,a8w8_blockscale_1x128x128_256x128x128x128_16x16_32x32_8x32x1_8x32x1_1x32x1x8_8_1x1_intrawave_v3,1001.38,1318.43,0.0
256,512,8192,7168,0,0,56.2791,a8w8_blockscale_1x128x128_256x128x128x128_16x16_32x32_8x32x1_8x32x1_1x32x1x8_8_1x1_intrawave_v3,1068.42,1257.64,0.0
256,512,8192,8192,0,0,62.9596,a8w8_blockscale_1x128x128_256x128x128x128_16x16_32x32_8x32x1_8x32x1_1x32x1x8_8_1x1_intrawave_v3,1091.49,1265.76,0.0
256,512,8192,28672,0,0,197.7949,a8w8_blockscale_1x128x128_256x128x128x128_16x16_32x32_8x32x1_8x32x1_1x32x1x8_8_1x1_intrawave_v3,1216.0,1304.13,0.0
256,512,9216,16384,2,0,167.8596,a8w8_blockscale_1x128x128_256x64x128x128_16x16_32x32_8x32x1_8x32x1_1x32x1x8_8_1x1_intrawave_v3,921.12,1005.73,0.0
256,512,10240,8192,2,0,93.6653,a8w8_blockscale_1x128x128_256x64x128x128_16x16_32x32_8x32x1_8x32x1_1x32x1x8_8_1x1_intrawave_v3,917.09,1052.32,0.0
256,512,12800,5120,0,0,73.2876,a8w8_blockscale_1x128x128_256x128x128x128_16x16_32x32_8x32x1_8x32x1_1x32x1x8_8_1x1_intrawave_v3,915.69,1108.85,0.0
256,512,13312,16384,0,0,191.4444,a8w8_blockscale_1x128x128_256x128x128x128_16x16_32x32_8x32x1_8x32x1_1x32x1x8_8_1x1_intrawave_v3,1166.6,1254.27,0.0
256,512,14336,8192,0,0,105.1206,a8w8_blockscale_1x128x128_256x128x128x128_16x16_32x32_8x32x1_8x32x1_1x32x1x8_8_1x1_intrawave_v3,1144.01,1296.75,0.0
256,512,16384,2048,0,0,34.2254,a8w8_blockscale_1x128x128_256x128x128x128_16x16_32x32_8x32x1_8x32x1_1x32x1x8_8_1x1_intrawave_v3,1003.93,1501.23,0.0
256,512,16384,4096,0,0,62.5528,a8w8_blockscale_1x128x128_256x128x128x128_16x16_32x32_8x32x1_8x32x1_1x32x1x8_8_1x1_intrawave_v3,1098.58,1374.57,0.0
256,512,16384,6656,0,0,89.1348,a8w8_blockscale_1x128x128_256x128x128x128_16x16_32x32_8x32x1_8x32x1_1x32x1x8_8_1x1_intrawave_v3,1252.81,1449.9,0.0
256,512,16384,8192,0,0,112.65,a8w8_blockscale_1x128x128_256x128x128x128_16x16_32x32_8x32x1_8x32x1_1x32x1x8_8_1x1_intrawave_v3,1220.05,1377.62,0.0
256,512,16384,13312,19,0,183.7547,a8w8_blockscale_1x128x128_256x256x128x128_16x16_32x32_8x32x1_8x32x1_1x32x1x8_8_1x1_intrawave_v1,1215.42,1315.32,0.0
256,512,16384,26624,19,0,345.7928,a8w8_blockscale_1x128x128_256x256x128x128_16x16_32x32_8x32x1_8x32x1_1x32x1x8_8_1x1_intrawave_v1,1291.75,1349.41,0.0
256,512,26624,16384,0,0,360.0853,a8w8_blockscale_1x128x128_256x128x128x128_16x16_32x32_8x32x1_8x32x1_1x32x1x8_8_1x1_intrawave_v3,1240.47,1310.41,0.0
256,512,51200,5120,0,0,225.8199,a8w8_blockscale_1x128x128_256x128x128x128_16x16_32x32_8x32x1_8x32x1_1x32x1x8_8_1x1_intrawave_v3,1188.71,1404.63,0.0
256,512,53248,16384,0,0,655.4935,a8w8_blockscale_1x128x128_256x128x128x128_16x16_32x32_8x32x1_8x32x1_1x32x1x8_8_1x1_intrawave_v3,1362.87,1426.91,0.0
256,512,57344,8192,0,0,357.1318,a8w8_blockscale_1x128x128_256x128x128x128_16x16_32x32_8x32x1_8x32x1_1x32x1x8_8_1x1_intrawave_v3,1346.94,1491.54,0.0
256,1024,100,5120,8,0,17.9702,a8w8_blockscale_1x128x128_256x16x64x256_16x16_16x16_16x16x1_16x16x1_1x16x1x16_4_1x1_intrawave_v1,58.35,331.64,0.0
256,1024,200,5120,8,0,17.9577,a8w8_blockscale_1x128x128_256x16x64x256_16x16_16x16_16x16x1_16x16x1_1x16x1x16_4_1x1_intrawave_v1,116.78,371.79,0.0
256,1024,512,7168,18,0,26.3261,a8w8_blockscale_1x128x128_256x64x64x256_16x16_32x32_16x16x1_16x16x1_1x32x1x8_8_1x1_intrawave_v1,285.5,458.05,0.0
256,1024,576,7168,18,0,26.2621,a8w8_blockscale_1x128x128_256x64x64x256_16x16_32x32_16x16x1_16x16x1_1x32x1x8_8_1x1_intrawave_v1,321.97,481.62,0.0
256,1024,800,5120,18,0,22.8616,a8w8_blockscale_1x128x128_256x64x64x256_16x16_32x32_16x16x1_16x16x1_1x32x1x8_8_1x1_intrawave_v1,366.93,480.16,0.0
256,1024,1280,8192,2,0,45.4595,a8w8_blockscale_1x128x128_256x64x128x128_16x16_32x32_8x32x1_8x32x1_1x32x1x8_8_1x1_intrawave_v3,472.39,472.86,0.0
256,1024,1536,7168,2,0,40.7731,a8w8_blockscale_1x128x128_256x64x128x128_16x16_32x32_8x32x1_8x32x1_1x32x1x8_8_1x1_intrawave_v3,553.03,527.21,0.0
256,1024,2304,16384,0,0,102.8898,a8w8_blockscale_1x128x128_256x128x128x128_16x16_32x32_8x32x1_8x32x1_1x32x1x8_8_1x1_intrawave_v3,751.38,575.81,0.0
256,1024,2560,8192,0,0,56.3654,a8w8_blockscale_1x128x128_256x128x128x128_16x16_32x32_8x32x1_8x32x1_1x32x1x8_8_1x1_intrawave_v3,761.99,613.91,0.0
256,1024,3072,1536,0,0,15.5066,a8w8_blockscale_1x128x128_256x128x128x128_16x16_32x32_8x32x1_8x32x1_1x32x1x8_8_1x1_intrawave_v3,623.2,811.46,0.0
256,1024,4096,512,0,0,9.4443,a8w8_blockscale_1x128x128_256x128x128x128_16x16_32x32_8x32x1_8x32x1_1x32x1x8_8_1x1_intrawave_v3,454.77,1165.79,0.0
256,1024,4608,7168,2,0,82.7929,a8w8_blockscale_1x128x128_256x64x128x128_16x16_32x32_8x32x1_8x32x1_1x32x1x8_8_1x1_intrawave_v3,817.05,601.59,0.0
256,1024,4608,16384,2,0,163.9193,a8w8_blockscale_1x128x128_256x64x128x128_16x16_32x32_8x32x1_8x32x1_1x32x1x8_8_1x1_intrawave_v3,943.26,620.5,0.0
256,1024,5120,640,2,0,14.4172,a8w8_blockscale_1x128x128_256x64x128x128_16x16_32x32_8x32x1_8x32x1_1x32x1x8_8_1x1_intrawave_v3,465.48,1000.05,0.0
256,1024,5120,1280,2,0,20.8424,a8w8_blockscale_1x128x128_256x64x128x128_16x16_32x32_8x32x1_8x32x1_1x32x1x8_8_1x1_intrawave_v3,643.96,880.42,0.0
256,1024,5120,3200,0,0,39.4353,a8w8_blockscale_1x128x128_256x128x128x128_16x16_32x32_8x32x1_8x32x1_1x32x1x8_8_1x1_intrawave_v3,850.87,764.46,0.0
256,1024,5120,5120,2,0,63.6534,a8w8_blockscale_1x128x128_256x64x128x128_16x16_32x32_8x32x1_8x32x1_1x32x1x8_8_1x1_intrawave_v3,843.43,658.93,0.0
256,1024,5120,6400,0,0,69.4276,a8w8_blockscale_1x128x128_256x128x128x128_16x16_32x32_8x32x1_8x32x1_1x32x1x8_8_1x1_intrawave_v3,966.6,717.4,0.0
256,1024,5120,25600,2,0,284.7396,a8w8_blockscale_1x128x128_256x64x128x128_16x16_32x32_8x32x1_8x32x1_1x32x1x8_8_1x1_intrawave_v3,942.74,589.21,0.0
256,1024,6400,5120,0,0,68.3547,a8w8_blockscale_1x128x128_256x128x128x128_16x16_32x32_8x32x1_8x32x1_1x32x1x8_8_1x1_intrawave_v3,981.77,747.84,0.0
256,1024,7168,256,18,0,10.8837,a8w8_blockscale_1x128x128_256x64x64x256_16x16_32x32_16x16x1_16x16x1_1x32x1x8_8_1x1_intrawave_v1,345.3,1541.5,0.0
256,1024,7168,2048,0,0,32.3296,a8w8_blockscale_1x128x128_256x128x128x128_16x16_32x32_8x32x1_8x32x1_1x32x1x8_8_1x1_intrawave_v3,929.95,973.02,0.0
256,1024,7168,2304,0,0,32.6383,a8w8_blockscale_1x128x128_256x128x128x128_16x16_32x32_8x32x1_8x32x1_1x32x1x8_8_1x1_intrawave_v3,1036.29,1028.07,0.0
256,1024,7168,8192,0,0,104.4713,a8w8_blockscale_1x128x128_256x128x128x128_16x16_32x32_8x32x1_8x32x1_1x32x1x8_8_1x1_intrawave_v3,1151.12,782.88,0.0
256,1024,8192,1024,0,0,21.2295,a8w8_blockscale_1x128x128_256x128x128x128_16x16_32x32_8x32x1_8x32x1_1x32x1x8_8_1x1_intrawave_v3,809.25,1234.81,0.0
256,1024,8192,2048,0,0,33.0883,a8w8_blockscale_1x128x128_256x128x128x128_16x16_32x32_8x32x1_8x32x1_1x32x1x8_8_1x1_intrawave_v3,1038.43,1077.47,0.0
256,1024,8192,3584,0,0,50.7779,a8w8_blockscale_1x128x128_256x128x128x128_16x16_32x32_8x32x1_8x32x1_1x32x1x8_8_1x1_intrawave_v3,1184.17,980.89,0.0
256,1024,8192,7168,0,0,99.469,a8w8_blockscale_1x128x128_256x128x128x128_16x16_32x32_8x32x1_8x32x1_1x32x1x8_8_1x1_intrawave_v3,1209.01,832.8,0.0
256,1024,8192,8192,0,0,108.5057,a8w8_blockscale_1x128x128_256x128x128x128_16x16_32x32_8x32x1_8x32x1_1x32x1x8_8_1x1_intrawave_v3,1266.65,850.41,0.0
256,1024,8192,28672,0,0,356.0252,a8w8_blockscale_1x128x128_256x128x128x128_16x16_32x32_8x32x1_8x32x1_1x32x1x8_8_1x1_intrawave_v3,1351.13,789.32,0.0
256,1024,9216,16384,0,0,261.5585,a8w8_blockscale_1x128x128_256x128x128x128_16x16_32x32_8x32x1_8x32x1_1x32x1x8_8_1x1_intrawave_v3,1182.29,713.59,0.0
256,1024,10240,8192,0,0,146.4961,a8w8_blockscale_1x128x128_256x128x128x128_16x16_32x32_8x32x1_8x32x1_1x32x1x8_8_1x1_intrawave_v3,1172.72,773.03,0.0
256,1024,12800,5120,0,0,123.8015,a8w8_blockscale_1x128x128_256x128x128x128_16x16_32x32_8x32x1_8x32x1_1x32x1x8_8_1x1_intrawave_v3,1084.14,783.46,0.0
256,1024,13312,16384,0,0,337.0395,a8w8_blockscale_1x128x128_256x128x128x128_16x16_32x32_8x32x1_8x32x1_1x32x1x8_8_1x1_intrawave_v3,1325.29,777.78,0.0
256,1024,14336,8192,0,0,187.9968,a8w8_blockscale_1x128x128_256x128x128x128_16x16_32x32_8x32x1_8x32x1_1x32x1x8_8_1x1_intrawave_v3,1279.37,825.49,0.0
256,1024,16384,2048,0,0,63.1388,a8w8_blockscale_1x128x128_256x128x128x128_16x16_32x32_8x32x1_8x32x1_1x32x1x8_8_1x1_intrawave_v3,1088.39,1096.09,0.0
256,1024,16384,4096,0,0,111.9951,a8w8_blockscale_1x128x128_256x128x128x128_16x16_32x32_8x32x1_8x32x1_1x32x1x8_8_1x1_intrawave_v3,1227.19,936.27,0.0
256,1024,16384,6656,0,0,165.4383,a8w8_blockscale_1x128x128_256x128x128x128_16x16_32x32_8x32x1_8x32x1_1x32x1x8_8_1x1_intrawave_v3,1349.98,903.19,0.0
256,1024,16384,8192,0,0,201.8426,a8w8_blockscale_1x128x128_256x128x128x128_16x16_32x32_8x32x1_8x32x1_1x32x1x8_8_1x1_intrawave_v3,1361.84,872.76,0.0
256,1024,16384,13312,0,0,328.4116,a8w8_blockscale_1x128x128_256x128x128x128_16x16_32x32_8x32x1_8x32x1_1x32x1x8_8_1x1_intrawave_v3,1360.11,807.8,0.0
256,1024,16384,26624,0,0,632.5279,a8w8_blockscale_1x128x128_256x128x128x128_16x16_32x32_8x32x1_8x32x1_1x32x1x8_8_1x1_intrawave_v3,1412.35,785.78,0.0
256,1024,26624,16384,0,0,628.6216,a8w8_blockscale_1x128x128_256x128x128x128_16x16_32x32_8x32x1_8x32x1_1x32x1x8_8_1x1_intrawave_v3,1421.13,807.34,0.0
256,1024,51200,5120,0,0,394.7612,a8w8_blockscale_1x128x128_256x128x128x128_16x16_32x32_8x32x1_8x32x1_1x32x1x8_8_1x1_intrawave_v3,1359.99,942.96,0.0
256,1024,53248,16384,0,0,1224.2285,a8w8_blockscale_1x128x128_256x128x128x128_16x16_32x32_8x32x1_8x32x1_1x32x1x8_8_1x1_intrawave_v3,1459.45,815.41,0.0
256,1024,57344,8192,0,0,648.7629,a8w8_blockscale_1x128x128_256x128x128x128_16x16_32x32_8x32x1_8x32x1_1x32x1x8_8_1x1_intrawave_v3,1482.93,918.04,0.0
256,1536,512,7168,18,0,26.3845,a8w8_blockscale_1x128x128_256x64x64x256_16x16_32x32_16x16x1_16x16x1_1x32x1x8_8_1x1_intrawave_v1,427.31,616.0,0.0
256,1536,576,7168,18,0,26.8098,a8w8_blockscale_1x128x128_256x64x64x256_16x16_32x32_16x16x1_16x16x1_1x32x1x8_8_1x1_intrawave_v1,473.09,630.68,0.0
256,1536,1536,7168,2,0,48.3904,a8w8_blockscale_1x128x128_256x64x128x128_16x16_32x32_8x32x1_8x32x1_1x32x1x8_8_1x1_intrawave_v3,698.96,552.56,0.0
256,1536,3072,1536,2,0,21.9708,a8w8_blockscale_1x128x128_256x64x128x128_16x16_32x32_8x32x1_8x32x1_1x32x1x8_8_1x1_intrawave_v3,659.76,751.68,0.0
256,1536,4096,512,2,0,12.931,a8w8_blockscale_1x128x128_256x64x128x128_16x16_32x32_8x32x1_8x32x1_1x32x1x8_8_1x1_intrawave_v3,498.22,1196.08,0.0
256,1536,4608,7168,0,0,94.0285,a8w8_blockscale_1x128x128_256x128x128x128_16x16_32x32_8x32x1_8x32x1_1x32x1x8_8_1x1_intrawave_v3,1079.13,618.92,0.0
256,1536,7168,256,18,0,14.16,a8w8_blockscale_1x128x128_256x64x64x256_16x16_32x32_16x16x1_16x16x1_1x32x1x8_8_1x1_intrawave_v1,398.1,1712.45,0.0
256,1536,7168,2048,0,0,44.1645,a8w8_blockscale_1x128x128_256x128x128x128_16x16_32x32_8x32x1_8x32x1_1x32x1x8_8_1x1_intrawave_v3,1021.12,902.22,0.0
256,1536,7168,2304,0,0,48.9474,a8w8_blockscale_1x128x128_256x128x128x128_16x16_32x32_8x32x1_8x32x1_1x32x1x8_8_1x1_intrawave_v3,1036.51,859.58,0.0
256,2048,100,5120,8,0,17.9222,a8w8_blockscale_1x128x128_256x16x64x256_16x16_16x16_16x16x1_16x16x1_1x16x1x16_4_1x1_intrawave_v1,117.01,636.49,0.0
256,2048,200,5120,13,0,21.2292,a8w8_blockscale_1x128x128_256x32x64x256_16x16_16x16_16x16x1_16x16x1_1x32x1x8_8_2x1_intrawave_v1,197.57,580.75,0.0
256,2048,512,7168,18,0,27.3506,a8w8_blockscale_1x128x128_256x64x64x256_16x16_32x32_16x16x1_16x16x1_1x32x1x8_8_1x1_intrawave_v1,549.62,747.6,0.0
256,2048,576,7168,18,0,44.6045,a8w8_blockscale_1x128x128_256x64x64x256_16x16_32x32_16x16x1_16x16x1_1x32x1x8_8_1x1_intrawave_v1,379.14,474.57,0.0
256,2048,800,5120,2,0,34.8008,a8w8_blockscale_1x128x128_256x64x128x128_16x16_32x32_8x32x1_8x32x1_1x32x1x8_8_1x1_intrawave_v3,482.09,513.17,0.0
256,2048,1280,8192,0,0,56.5186,a8w8_blockscale_1x128x128_256x128x128x128_16x16_32x32_8x32x1_8x32x1_1x32x1x8_8_1x1_intrawave_v3,759.92,575.14,0.0
256,2048,1536,7168,0,0,53.1722,a8w8_blockscale_1x128x128_256x128x128x128_16x16_32x32_8x32x1_8x32x1_1x32x1x8_8_1x1_intrawave_v3,848.13,601.47,0.0
256,2048,2304,16384,2,0,158.7823,a8w8_blockscale_1x128x128_256x64x128x128_16x16_32x32_8x32x1_8x32x1_1x32x1x8_8_1x1_intrawave_v3,973.78,508.5,0.0
256,2048,2560,8192,2,0,92.1528,a8w8_blockscale_1x128x128_256x64x128x128_16x16_32x32_8x32x1_8x32x1_1x32x1x8_8_1x1_intrawave_v3,932.14,523.42,0.0
256,2048,3072,1536,0,0,23.7817,a8w8_blockscale_1x128x128_256x128x128x128_16x16_32x32_8x32x1_8x32x1_1x32x1x8_8_1x1_intrawave_v3,812.7,859.79,0.0
256,2048,4096,512,0,0,14.8978,a8w8_blockscale_1x128x128_256x128x128x128_16x16_32x32_8x32x1_8x32x1_1x32x1x8_8_1x1_intrawave_v3,576.59,1337.31,0.0
256,2048,4608,7168,0,0,126.6966,a8w8_blockscale_1x128x128_256x128x128x128_16x16_32x32_8x32x1_8x32x1_1x32x1x8_8_1x1_intrawave_v3,1067.84,525.54,0.0
256,2048,4608,16384,0,0,261.1483,a8w8_blockscale_1x128x128_256x128x128x128_16x16_32x32_8x32x1_8x32x1_1x32x1x8_8_1x1_intrawave_v3,1184.15,489.86,0.0
256,2048,5120,640,0,0,21.7879,a8w8_blockscale_1x128x128_256x128x128x128_16x16_32x32_8x32x1_8x32x1_1x32x1x8_8_1x1_intrawave_v3,616.02,1173.08,0.0
256,2048,5120,1280,0,0,31.4032,a8w8_blockscale_1x128x128_256x128x128x128_16x16_32x32_8x32x1_8x32x1_1x32x1x8_8_1x1_intrawave_v3,854.8,959.98,0.0
256,2048,5120,3200,0,0,62.4064,a8w8_blockscale_1x128x128_256x128x128x128_16x16_32x32_8x32x1_8x32x1_1x32x1x8_8_1x1_intrawave_v3,1075.35,703.6,0.0
256,2048,5120,5120,0,0,99.5398,a8w8_blockscale_1x128x128_256x128x128x128_16x16_32x32_8x32x1_8x32x1_1x32x1x8_8_1x1_intrawave_v3,1078.71,579.38,0.0
256,2048,5120,6400,0,0,112.2928,a8w8_blockscale_1x128x128_256x128x128x128_16x16_32x32_8x32x1_8x32x1_1x32x1x8_8_1x1_intrawave_v3,1195.25,595.29,0.0
256,2048,5120,25600,0,0,425.2274,a8w8_blockscale_1x128x128_256x128x128x128_16x16_32x32_8x32x1_8x32x1_1x32x1x8_8_1x1_intrawave_v3,1262.55,480.85,0.0
256,2048,6400,5120,0,0,122.1785,a8w8_blockscale_1x128x128_256x128x128x128_16x16_32x32_8x32x1_8x32x1_1x32x1x8_8_1x1_intrawave_v3,1098.54,568.58,0.0
256,2048,7168,256,15,0,18.2088,a8w8_blockscale_1x128x128_256x64x128x128_16x16_32x32_8x32x1_8x32x1_1x32x1x8_8_1x1_intrawave_v1,412.78,1741.98,0.0
256,2048,7168,2048,0,0,58.3831,a8w8_blockscale_1x128x128_256x128x128x128_16x16_32x32_8x32x1_8x32x1_1x32x1x8_8_1x1_intrawave_v3,1029.91,826.17,0.0
256,2048,7168,2304,0,0,59.8236,a8w8_blockscale_1x128x128_256x128x128x128_16x16_32x32_8x32x1_8x32x1_1x32x1x8_8_1x1_intrawave_v3,1130.75,845.72,0.0
256,2048,7168,8192,0,0,187.8008,a8w8_blockscale_1x128x128_256x128x128x128_16x16_32x32_8x32x1_8x32x1_1x32x1x8_8_1x1_intrawave_v3,1280.71,558.34,0.0
256,2048,8192,1024,0,0,39.4053,a8w8_blockscale_1x128x128_256x128x128x128_16x16_32x32_8x32x1_8x32x1_1x32x1x8_8_1x1_intrawave_v3,871.96,1117.62,0.0
256,2048,8192,2048,0,0,61.9872,a8w8_blockscale_1x128x128_256x128x128x128_16x16_32x32_8x32x1_8x32x1_1x32x1x8_8_1x1_intrawave_v3,1108.61,879.63,0.0
256,2048,8192,3584,0,0,93.7405,a8w8_blockscale_1x128x128_256x128x128x128_16x16_32x32_8x32x1_8x32x1_1x32x1x8_8_1x1_intrawave_v3,1282.89,749.46,0.0
256,2048,8192,7168,0,0,183.1826,a8w8_blockscale_1x128x128_256x128x128x128_16x16_32x32_8x32x1_8x32x1_1x32x1x8_8_1x1_intrawave_v3,1313.0,583.87,0.0
256,2048,8192,8192,0,0,198.5682,a8w8_blockscale_1x128x128_256x128x128x128_16x16_32x32_8x32x1_8x32x1_1x32x1x8_8_1x1_intrawave_v3,1384.3,591.44,0.0
256,2048,8192,28672,0,0,662.5181,a8w8_blockscale_1x128x128_256x128x128x128_16x16_32x32_8x32x1_8x32x1_1x32x1x8_8_1x1_intrawave_v3,1452.15,493.81,0.0
256,2048,9216,16384,0,0,440.785,a8w8_blockscale_1x128x128_256x128x128x128_16x16_32x32_8x32x1_8x32x1_1x32x1x8_8_1x1_intrawave_v3,1403.12,504.32,0.0
256,2048,10240,8192,0,0,247.0613,a8w8_blockscale_1x128x128_256x128x128x128_16x16_32x32_8x32x1_8x32x1_1x32x1x8_8_1x1_intrawave_v3,1390.74,577.21,0.0
256,2048,12800,5120,0,0,210.6475,a8w8_blockscale_1x128x128_256x128x128x128_16x16_32x32_8x32x1_8x32x1_1x32x1x8_8_1x1_intrawave_v3,1274.33,609.79,0.0
256,2048,13312,16384,0,0,602.9797,a8w8_blockscale_1x128x128_256x128x128x128_16x16_32x32_8x32x1_8x32x1_1x32x1x8_8_1x1_intrawave_v3,1481.56,507.79,0.0
256,2048,14336,8192,0,0,331.1493,a8w8_blockscale_1x128x128_256x128x128x128_16x16_32x32_8x32x1_8x32x1_1x32x1x8_8_1x1_intrawave_v3,1452.63,582.63,0.0
256,2048,16384,2048,0,0,115.8413,a8w8_blockscale_1x128x128_256x128x128x128_16x16_32x32_8x32x1_8x32x1_1x32x1x8_8_1x1_intrawave_v3,1186.44,905.18,0.0
256,2048,16384,4096,0,0,205.7257,a8w8_blockscale_1x128x128_256x128x128x128_16x16_32x32_8x32x1_8x32x1_1x32x1x8_8_1x1_intrawave_v3,1336.14,693.19,0.0
256,2048,16384,6656,0,0,290.9013,a8w8_blockscale_1x128x128_256x128x128x128_16x16_32x32_8x32x1_8x32x1_1x32x1x8_8_1x1_intrawave_v3,1535.49,652.43,0.0
256,2048,16384,8192,0,0,376.0882,a8w8_blockscale_1x128x128_256x128x128x128_16x16_32x32_8x32x1_8x32x1_1x32x1x8_8_1x1_intrawave_v3,1461.77,579.93,0.0
256,2048,16384,13312,0,0,604.1407,a8w8_blockscale_1x128x128_256x128x128x128_16x16_32x32_8x32x1_8x32x1_1x32x1x8_8_1x1_intrawave_v3,1478.72,517.22,0.0
256,2048,16384,26624,0,0,1214.7725,a8w8_blockscale_1x128x128_256x128x128x128_16x16_32x32_8x32x1_8x32x1_1x32x1x8_8_1x1_intrawave_v3,1470.82,459.22,0.0
256,2048,26624,16384,0,0,1175.8653,a8w8_blockscale_1x128x128_256x128x128x128_16x16_32x32_8x32x1_8x32x1_1x32x1x8_8_1x1_intrawave_v3,1519.48,492.25,0.0
256,2048,51200,5120,0,0,732.718,a8w8_blockscale_1x128x128_256x128x128x128_16x16_32x32_8x32x1_8x32x1_1x32x1x8_8_1x1_intrawave_v3,1465.42,658.3,0.0
256,2048,53248,16384,0,0,2286.9788,a8w8_blockscale_1x128x128_256x128x128x128_16x16_32x32_8x32x1_8x32x1_1x32x1x8_8_1x1_intrawave_v3,1562.5,491.51,0.0
256,2048,57344,8192,0,0,1262.1976,a8w8_blockscale_1x128x128_256x128x128x128_16x16_32x32_8x32x1_8x32x1_1x32x1x8_8_1x1_intrawave_v3,1524.44,571.56,0.0
256,4096,100,5120,8,0,27.8643,a8w8_blockscale_1x128x128_256x16x64x256_16x16_16x16_16x16x1_16x16x1_1x16x1x16_4_1x1_intrawave_v1,150.53,800.4,0.0
256,4096,200,5120,18,0,23.0537,a8w8_blockscale_1x128x128_256x64x64x256_16x16_32x32_16x16x1_16x16x1_1x32x1x8_8_1x1_intrawave_v1,363.87,1025.17,0.0
256,4096,512,7168,2,0,42.0573,a8w8_blockscale_1x128x128_256x64x128x128_16x16_32x32_8x32x1_8x32x1_1x32x1x8_8_1x1_intrawave_v3,714.85,885.09,0.0
256,4096,576,7168,0,0,52.4605,a8w8_blockscale_1x128x128_256x128x128x128_16x16_32x32_8x32x1_8x32x1_1x32x1x8_8_1x1_intrawave_v3,644.73,728.31,0.0
256,4096,800,5120,0,0,40.9155,a8w8_blockscale_1x128x128_256x128x128x128_16x16_32x32_8x32x1_8x32x1_1x32x1x8_8_1x1_intrawave_v3,820.09,772.84,0.0
256,4096,1280,8192,0,0,91.6797,a8w8_blockscale_1x128x128_256x128x128x128_16x16_32x32_8x32x1_8x32x1_1x32x1x8_8_1x1_intrawave_v3,936.95,594.74,0.0
256,4096,1536,7168,0,0,86.438,a8w8_blockscale_1x128x128_256x128x128x128_16x16_32x32_8x32x1_8x32x1_1x32x1x8_8_1x1_intrawave_v3,1043.46,612.61,0.0
256,4096,2304,16384,0,0,258.7222,a8w8_blockscale_1x128x128_256x128x128x128_16x16_32x32_8x32x1_8x32x1_1x32x1x8_8_1x1_intrawave_v3,1195.25,478.24,0.0
256,4096,2560,8192,0,0,144.6549,a8w8_blockscale_1x128x128_256x128x128x128_16x16_32x32_8x32x1_8x32x1_1x32x1x8_8_1x1_intrawave_v3,1187.65,521.91,0.0
256,4096,3072,1536,0,0,38.4285,a8w8_blockscale_1x128x128_256x128x128x128_16x16_32x32_8x32x1_8x32x1_1x32x1x8_8_1x1_intrawave_v3,1005.89,941.38,0.0
256,4096,4096,512,0,0,26.3224,a8w8_blockscale_1x128x128_256x128x128x128_16x16_32x32_8x32x1_8x32x1_1x32x1x8_8_1x1_intrawave_v3,652.67,1434.09,0.0
256,4096,4608,7168,0,0,208.672,a8w8_blockscale_1x128x128_256x128x128x128_16x16_32x32_8x32x1_8x32x1_1x32x1x8_8_1x1_intrawave_v3,1296.69,479.89,0.0
256,4096,4608,16384,0,0,428.9932,a8w8_blockscale_1x128x128_256x128x128x128_16x16_32x32_8x32x1_8x32x1_1x32x1x8_8_1x1_intrawave_v3,1441.69,420.41,0.0
256,4096,5120,640,0,0,34.667,a8w8_blockscale_1x128x128_256x128x128x128_16x16_32x32_8x32x1_8x32x1_1x32x1x8_8_1x1_intrawave_v3,774.33,1380.02,0.0
256,4096,5120,1280,0,0,52.8434,a8w8_blockscale_1x128x128_256x128x128x128_16x16_32x32_8x32x1_8x32x1_1x32x1x8_8_1x1_intrawave_v3,1015.97,1016.96,0.0
256,4096,5120,3200,0,0,104.3839,a8w8_blockscale_1x128x128_256x128x128x128_16x16_32x32_8x32x1_8x32x1_1x32x1x8_8_1x1_intrawave_v3,1285.81,684.34,0.0
256,4096,5120,5120,0,0,167.0044,a8w8_blockscale_1x128x128_256x128x128x128_16x16_32x32_8x32x1_8x32x1_1x32x1x8_8_1x1_intrawave_v3,1285.88,533.69,0.0
256,4096,5120,6400,0,0,185.8833,a8w8_blockscale_1x128x128_256x128x128x128_16x16_32x32_8x32x1_8x32x1_1x32x1x8_8_1x1_intrawave_v3,1444.11,542.95,0.0
256,4096,5120,25600,0,0,720.5775,a8w8_blockscale_1x128x128_256x128x128x128_16x16_32x32_8x32x1_8x32x1_1x32x1x8_8_1x1_intrawave_v3,1490.11,385.62,0.0
256,4096,6400,5120,0,0,212.1756,a8w8_blockscale_1x128x128_256x128x128x128_16x16_32x32_8x32x1_8x32x1_1x32x1x8_8_1x1_intrawave_v3,1265.16,500.38,0.0
256,4096,7168,256,18,0,30.9415,a8w8_blockscale_1x128x128_256x64x64x256_16x16_32x32_16x16x1_16x16x1_1x32x1x8_8_1x1_intrawave_v1,485.83,1990.98,0.0
256,4096,7168,2048,0,0,103.4171,a8w8_blockscale_1x128x128_256x128x128x128_16x16_32x32_8x32x1_8x32x1_1x32x1x8_8_1x1_intrawave_v3,1162.85,790.86,0.0
256,4096,7168,2304,0,0,103.9647,a8w8_blockscale_1x128x128_256x128x128x128_16x16_32x32_8x32x1_8x32x1_1x32x1x8_8_1x1_intrawave_v3,1301.32,814.44,0.0
256,4096,7168,8192,0,0,337.4448,a8w8_blockscale_1x128x128_256x128x128x128_16x16_32x32_8x32x1_8x32x1_1x32x1x8_8_1x1_intrawave_v3,1425.53,447.47,0.0
256,4096,8192,1024,0,0,70.8143,a8w8_blockscale_1x128x128_256x128x128x128_16x16_32x32_8x32x1_8x32x1_1x32x1x8_8_1x1_intrawave_v3,970.42,1125.36,0.0
256,4096,8192,2048,0,0,113.8196,a8w8_blockscale_1x128x128_256x128x128x128_16x16_32x32_8x32x1_8x32x1_1x32x1x8_8_1x1_intrawave_v3,1207.52,810.71,0.0
256,4096,8192,3584,0,0,172.1325,a8w8_blockscale_1x128x128_256x128x128x128_16x16_32x32_8x32x1_8x32x1_1x32x1x8_8_1x1_intrawave_v3,1397.29,645.72,0.0
256,4096,8192,7168,0,0,336.4159,a8w8_blockscale_1x128x128_256x128x128x128_16x16_32x32_8x32x1_8x32x1_1x32x1x8_8_1x1_intrawave_v3,1429.89,461.3,0.0
256,4096,8192,8192,0,0,369.2995,a8w8_blockscale_1x128x128_256x128x128x128_16x16_32x32_8x32x1_8x32x1_1x32x1x8_8_1x1_intrawave_v3,1488.64,454.3,0.0
256,4096,8192,28672,0,0,1297.0372,a8w8_blockscale_1x128x128_256x128x128x128_16x16_32x32_8x32x1_8x32x1_1x32x1x8_8_1x1_intrawave_v3,1483.49,323.38,0.0
256,4096,9216,16384,0,0,800.0337,a8w8_blockscale_1x128x128_256x128x128x128_16x16_32x32_8x32x1_8x32x1_1x32x1x8_8_1x1_intrawave_v3,1546.12,366.99,0.0
256,4096,10240,8192,0,0,453.0707,a8w8_blockscale_1x128x128_256x128x128x128_16x16_32x32_8x32x1_8x32x1_1x32x1x8_8_1x1_intrawave_v3,1516.75,444.36,0.0
256,4096,12800,5120,0,0,373.1462,a8w8_blockscale_1x128x128_256x128x128x128_16x16_32x32_8x32x1_8x32x1_1x32x1x8_8_1x1_intrawave_v3,1438.77,512.84,0.0
256,4096,13312,16384,0,0,1153.0389,a8w8_blockscale_1x128x128_256x128x128x128_16x16_32x32_8x32x1_8x32x1_1x32x1x8_8_1x1_intrawave_v3,1549.56,341.94,0.0
256,4096,14336,8192,0,0,629.9284,a8w8_blockscale_1x128x128_256x128x128x128_16x16_32x32_8x32x1_8x32x1_1x32x1x8_8_1x1_intrawave_v3,1527.27,426.14,0.0
256,4096,16384,2048,0,0,210.0998,a8w8_blockscale_1x128x128_256x128x128x128_16x16_32x32_8x32x1_8x32x1_1x32x1x8_8_1x1_intrawave_v3,1308.32,838.46,0.0
256,4096,16384,4096,0,0,380.5052,a8w8_blockscale_1x128x128_256x128x128x128_16x16_32x32_8x32x1_8x32x1_1x32x1x8_8_1x1_intrawave_v3,1444.8,573.2,0.0
256,4096,16384,6656,0,0,562.3623,a8w8_blockscale_1x128x128_256x128x128x128_16x16_32x32_8x32x1_8x32x1_1x32x1x8_8_1x1_intrawave_v3,1588.57,481.06,0.0
256,4096,16384,8192,0,0,714.6012,a8w8_blockscale_1x128x128_256x128x128x128_16x16_32x32_8x32x1_8x32x1_1x32x1x8_8_1x1_intrawave_v3,1538.64,422.6,0.0
256,4096,16384,13312,0,0,1160.6556,a8w8_blockscale_1x128x128_256x128x128x128_16x16_32x32_8x32x1_8x32x1_1x32x1x8_8_1x1_intrawave_v3,1539.39,350.53,0.0
256,4096,16384,26624,0,0,2460.3487,a8w8_blockscale_1x128x128_256x128x128x128_16x16_32x32_8x32x1_8x32x1_1x32x1x8_8_1x1_intrawave_v3,1452.4,276.17,0.0
256,4096,26624,16384,0,0,2312.3426,a8w8_blockscale_1x128x128_256x128x128x128_16x16_32x32_8x32x1_8x32x1_1x32x1x8_8_1x1_intrawave_v3,1545.36,311.99,0.0
256,4096,51200,5120,0,0,1409.8863,a8w8_blockscale_1x128x128_256x128x128x128_16x16_32x32_8x32x1_8x32x1_1x32x1x8_8_1x1_intrawave_v3,1523.16,498.3,0.0
256,4096,53248,16384,0,0,4690.9631,a8w8_blockscale_1x128x128_256x128x128x128_16x16_32x32_8x32x1_8x32x1_1x32x1x8_8_1x1_intrawave_v3,1523.53,293.27,0.0
256,4096,57344,8192,0,0,2395.1314,a8w8_blockscale_1x128x128_256x128x128x128_16x16_32x32_8x32x1_8x32x1_1x32x1x8_8_1x1_intrawave_v3,1606.71,406.27,0.0
256,8192,100,5120,6,0,41.5193,a8w8_blockscale_1x128x128_256x16x64x128_8x16_16x16_16x16x1_8x32x1_1x16x1x16_4_1x1_intrawave_v1,202.04,1062.0,0.0
256,8192,200,5120,2,0,34.5186,a8w8_blockscale_1x128x128_256x64x128x128_16x16_32x32_8x32x1_8x32x1_1x32x1x8_8_1x1_intrawave_v3,486.03,1339.68,0.0
256,8192,512,7168,0,0,56.8688,a8w8_blockscale_1x128x128_256x128x128x128_16x16_32x32_8x32x1_8x32x1_1x32x1x8_8_1x1_intrawave_v3,1057.34,1244.6,0.0
256,8192,576,7168,0,0,77.5522,a8w8_blockscale_1x128x128_256x128x128x128_16x16_32x32_8x32x1_8x32x1_1x32x1x8_8_1x1_intrawave_v3,872.26,932.1,0.0
256,8192,800,5120,0,0,68.1309,a8w8_blockscale_1x128x128_256x128x128x128_16x16_32x32_8x32x1_8x32x1_1x32x1x8_8_1x1_intrawave_v3,985.0,868.13,0.0
256,8192,1280,8192,0,0,147.0618,a8w8_blockscale_1x128x128_256x128x128x128_16x16_32x32_8x32x1_8x32x1_1x32x1x8_8_1x1_intrawave_v3,1168.21,670.24,0.0
256,8192,1536,7168,0,0,149.4678,a8w8_blockscale_1x128x128_256x128x128x128_16x16_32x32_8x32x1_8x32x1_1x32x1x8_8_1x1_intrawave_v3,1206.87,634.89,0.0
256,8192,2304,16384,0,0,439.4352,a8w8_blockscale_1x128x128_256x128x128x128_16x16_32x32_8x32x1_8x32x1_1x32x1x8_8_1x1_intrawave_v3,1407.43,477.24,0.0
256,8192,2560,8192,0,0,242.9977,a8w8_blockscale_1x128x128_256x128x128x128_16x16_32x32_8x32x1_8x32x1_1x32x1x8_8_1x1_intrawave_v3,1413.99,535.08,0.0
256,8192,3072,1536,0,0,73.0708,a8w8_blockscale_1x128x128_256x128x128x128_16x16_32x32_8x32x1_8x32x1_1x32x1x8_8_1x1_intrawave_v3,1058.01,925.58,0.0
256,8192,4096,512,0,0,45.5081,a8w8_blockscale_1x128x128_256x128x128x128_16x16_32x32_8x32x1_8x32x1_1x32x1x8_8_1x1_intrawave_v3,755.02,1612.91,0.0
256,8192,4608,7168,0,0,370.7195,a8w8_blockscale_1x128x128_256x128x128x128_16x16_32x32_8x32x1_8x32x1_1x32x1x8_8_1x1_intrawave_v3,1459.77,451.14,0.0
256,8192,4608,16384,0,0,799.7671,a8w8_blockscale_1x128x128_256x128x128x128_16x16_32x32_8x32x1_8x32x1_1x32x1x8_8_1x1_intrawave_v3,1546.64,356.62,0.0
256,8192,5120,640,0,0,63.0311,a8w8_blockscale_1x128x128_256x128x128x128_16x16_32x32_8x32x1_8x32x1_1x32x1x8_8_1x1_intrawave_v3,851.76,1466.03,0.0
256,8192,5120,1280,0,0,98.3414,a8w8_blockscale_1x128x128_256x128x128x128_16x16_32x32_8x32x1_8x32x1_1x32x1x8_8_1x1_intrawave_v3,1091.85,1026.28,0.0
256,8192,5120,3200,0,0,189.6896,a8w8_blockscale_1x128x128_256x128x128x128_16x16_32x32_8x32x1_8x32x1_1x32x1x8_8_1x1_intrawave_v3,1415.13,666.8,0.0
256,8192,5120,5120,0,0,303.1095,a8w8_blockscale_1x128x128_256x128x128x128_16x16_32x32_8x32x1_8x32x1_1x32x1x8_8_1x1_intrawave_v3,1416.97,501.61,0.0
256,8192,5120,6400,0,0,338.8853,a8w8_blockscale_1x128x128_256x128x128x128_16x16_32x32_8x32x1_8x32x1_1x32x1x8_8_1x1_intrawave_v3,1584.23,498.94,0.0
256,8192,5120,25600,0,0,1430.6887,a8w8_blockscale_1x128x128_256x128x128x128_16x16_32x32_8x32x1_8x32x1_1x32x1x8_8_1x1_intrawave_v3,1501.01,296.83,0.0
256,8192,6400,5120,0,0,368.5556,a8w8_blockscale_1x128x128_256x128x128x128_16x16_32x32_8x32x1_8x32x1_1x32x1x8_8_1x1_intrawave_v3,1456.69,487.22,0.0
256,8192,7168,256,23,0,55.8167,a8w8_blockscale_1x128x128_256x128x128x256_16x16_32x32_8x32x1_8x32x1_1x32x1x8_8_1x1_intrawave_v1,538.63,2174.49,0.0
256,8192,7168,2048,0,0,183.0036,a8w8_blockscale_1x128x128_256x128x128x128_16x16_32x32_8x32x1_8x32x1_1x32x1x8_8_1x1_intrawave_v3,1314.28,813.63,0.0
256,8192,7168,2304,0,0,194.4961,a8w8_blockscale_1x128x128_256x128x128x128_16x16_32x32_8x32x1_8x32x1_1x32x1x8_8_1x1_intrawave_v3,1391.2,785.77,0.0
256,8192,7168,8192,0,0,623.6721,a8w8_blockscale_1x128x128_256x128x128x128_16x16_32x32_8x32x1_8x32x1_1x32x1x8_8_1x1_intrawave_v3,1542.59,390.06,0.0
256,8192,8192,1024,0,0,132.0163,a8w8_blockscale_1x128x128_256x128x128x128_16x16_32x32_8x32x1_8x32x1_1x32x1x8_8_1x1_intrawave_v3,1041.08,1143.76,0.0
256,8192,8192,2048,0,0,211.4666,a8w8_blockscale_1x128x128_256x128x128x128_16x16_32x32_8x32x1_8x32x1_1x32x1x8_8_1x1_intrawave_v3,1299.86,793.37,0.0
256,8192,8192,3584,0,0,324.3461,a8w8_blockscale_1x128x128_256x128x128x128_16x16_32x32_8x32x1_8x32x1_1x32x1x8_8_1x1_intrawave_v3,1483.1,594.85,0.0
256,8192,8192,7168,0,0,625.6014,a8w8_blockscale_1x128x128_256x128x128x128_16x16_32x32_8x32x1_8x32x1_1x32x1x8_8_1x1_intrawave_v3,1537.84,402.27,0.0
256,8192,8192,8192,0,0,705.0772,a8w8_blockscale_1x128x128_256x128x128x128_16x16_32x32_8x32x1_8x32x1_1x32x1x8_8_1x1_intrawave_v3,1559.42,380.72,0.0
256,8192,8192,28672,0,0,2599.9916,a8w8_blockscale_1x128x128_256x128x128x128_16x16_32x32_8x32x1_8x32x1_1x32x1x8_8_1x1_intrawave_v3,1480.12,232.3,0.0
256,8192,9216,16384,0,0,1595.8343,a8w8_blockscale_1x128x128_256x128x128x128_16x16_32x32_8x32x1_8x32x1_1x32x1x8_8_1x1_intrawave_v3,1550.22,273.34,0.0
256,8192,10240,8192,0,0,881.1188,a8w8_blockscale_1x128x128_256x128x128x128_16x16_32x32_8x32x1_8x32x1_1x32x1x8_8_1x1_intrawave_v3,1559.82,361.78,0.0
256,8192,12800,5120,0,0,705.147,a8w8_blockscale_1x128x128_256x128x128x128_16x16_32x32_8x32x1_8x32x1_1x32x1x8_8_1x1_intrawave_v3,1522.72,449.83,0.0
256,8192,13312,16384,0,0,2319.0608,a8w8_blockscale_1x128x128_256x128x128x128_16x16_32x32_8x32x1_8x32x1_1x32x1x8_8_1x1_intrawave_v3,1540.89,245.97,0.0
256,8192,14336,8192,0,0,1229.59,a8w8_blockscale_1x128x128_256x128x128x128_16x16_32x32_8x32x1_8x32x1_1x32x1x8_8_1x1_intrawave_v3,1564.87,341.11,0.0
256,8192,16384,2048,0,0,396.2093,a8w8_blockscale_1x128x128_256x128x128x128_16x16_32x32_8x32x1_8x32x1_1x32x1x8_8_1x1_intrawave_v3,1387.54,804.54,0.0
256,8192,16384,4096,0,0,704.0244,a8w8_blockscale_1x128x128_256x128x128x128_16x16_32x32_8x32x1_8x32x1_1x32x1x8_8_1x1_intrawave_v3,1561.75,524.27,0.0
256,8192,16384,6656,0,0,1103.3849,a8w8_blockscale_1x128x128_256x128x128x128_16x16_32x32_8x32x1_8x32x1_1x32x1x8_8_1x1_intrawave_v3,1619.3,391.53,0.0
256,8192,16384,8192,0,0,1410.2415,a8w8_blockscale_1x128x128_256x128x128x128_16x16_32x32_8x32x1_8x32x1_1x32x1x8_8_1x1_intrawave_v3,1559.32,333.11,0.0
256,8192,16384,13312,0,0,2293.605,a8w8_blockscale_1x128x128_256x128x128x128_16x16_32x32_8x32x1_8x32x1_1x32x1x8_8_1x1_intrawave_v3,1557.99,259.67,0.0
256,8192,16384,26624,0,0,5115.4781,a8w8_blockscale_1x128x128_256x128x128x128_16x16_32x32_8x32x1_8x32x1_1x32x1x8_8_1x1_intrawave_v3,1397.1,180.38,0.0
256,8192,26624,16384,0,0,4671.6021,a8w8_blockscale_1x128x128_256x128x128x128_16x16_32x32_8x32x1_8x32x1_1x32x1x8_8_1x1_intrawave_v3,1529.84,215.48,0.0
256,8192,51200,5120,0,0,2792.5756,a8w8_blockscale_1x128x128_256x128x128x128_16x16_32x32_8x32x1_8x32x1_1x32x1x8_8_1x1_intrawave_v3,1537.99,409.28,0.0
256,8192,53248,16384,0,0,9699.1349,a8w8_blockscale_1x128x128_256x128x128x128_16x16_32x32_8x32x1_8x32x1_1x32x1x8_8_1x1_intrawave_v3,1473.7,193.73,0.0
256,8192,57344,8192,0,0,4908.1853,a8w8_blockscale_1x128x128_256x128x128x128_16x16_32x32_8x32x1_8x32x1_1x32x1x8_8_1x1_intrawave_v3,1568.11,300.8,0.0
256,16384,100,5120,6,0,80.3133,a8w8_blockscale_1x128x128_256x16x64x128_8x16_16x16_16x16x1_8x32x1_1x16x1x16_4_1x1_intrawave_v1,208.9,1091.66,0.0
256,16384,200,5120,0,0,44.7842,a8w8_blockscale_1x128x128_256x128x128x128_16x16_32x32_8x32x1_8x32x1_1x32x1x8_8_1x1_intrawave_v3,749.25,2042.32,0.0
256,16384,512,7168,0,0,99.533,a8w8_blockscale_1x128x128_256x128x128x128_16x16_32x32_8x32x1_8x32x1_1x32x1x8_8_1x1_intrawave_v3,1208.23,1385.35,0.0
256,16384,576,7168,0,0,129.3535,a8w8_blockscale_1x128x128_256x128x128x128_16x16_32x32_8x32x1_8x32x1_1x32x1x8_8_1x1_intrawave_v3,1045.9,1085.74,0.0
256,16384,800,5120,0,0,127.9347,a8w8_blockscale_1x128x128_256x128x128x128_16x16_32x32_8x32x1_8x32x1_1x32x1x8_8_1x1_intrawave_v3,1049.11,892.62,0.0
256,16384,1280,8192,0,0,260.8043,a8w8_blockscale_1x128x128_256x128x128x128_16x16_32x32_8x32x1_8x32x1_1x32x1x8_8_1x1_intrawave_v3,1317.45,715.66,0.0
256,16384,1536,7168,0,0,261.1566,a8w8_blockscale_1x128x128_256x128x128x128_16x16_32x32_8x32x1_8x32x1_1x32x1x8_8_1x1_intrawave_v3,1381.46,684.58,0.0
256,16384,2304,16384,0,0,825.4263,a8w8_blockscale_1x128x128_256x128x128x128_16x16_32x32_8x32x1_8x32x1_1x32x1x8_8_1x1_intrawave_v3,1498.56,462.41,0.0
256,16384,2560,8192,0,0,454.5691,a8w8_blockscale_1x128x128_256x128x128x128_16x16_32x32_8x32x1_8x32x1_1x32x1x8_8_1x1_intrawave_v3,1511.75,525.94,0.0
256,16384,3072,1536,0,0,130.7973,a8w8_blockscale_1x128x128_256x128x128x128_16x16_32x32_8x32x1_8x32x1_1x32x1x8_8_1x1_intrawave_v3,1182.13,998.09,0.0
256,16384,4096,512,0,0,87.2362,a8w8_blockscale_1x128x128_256x128x128x128_16x16_32x32_8x32x1_8x32x1_1x32x1x8_8_1x1_intrawave_v3,787.74,1658.76,0.0
256,16384,4608,7168,0,0,705.9648,a8w8_blockscale_1x128x128_256x128x128x128_16x16_32x32_8x32x1_8x32x1_1x32x1x8_8_1x1_intrawave_v3,1533.12,427.03,0.0
256,16384,4608,16384,0,0,1603.9141,a8w8_blockscale_1x128x128_256x128x128x128_16x16_32x32_8x32x1_8x32x1_1x32x1x8_8_1x1_intrawave_v3,1542.41,308.58,0.0
256,16384,5120,640,0,0,115.9557,a8w8_blockscale_1x128x128_256x128x128x128_16x16_32x32_8x32x1_8x32x1_1x32x1x8_8_1x1_intrawave_v3,925.99,1565.55,0.0
256,16384,5120,1280,0,0,176.9195,a8w8_blockscale_1x128x128_256x128x128x128_16x16_32x32_8x32x1_8x32x1_1x32x1x8_8_1x1_intrawave_v3,1213.82,1103.88,0.0
256,16384,5120,3200,0,0,357.7337,a8w8_blockscale_1x128x128_256x128x128x128_16x16_32x32_8x32x1_8x32x1_1x32x1x8_8_1x1_intrawave_v3,1500.76,661.34,0.0
256,16384,5120,5120,0,0,572.9805,a8w8_blockscale_1x128x128_256x128x128x128_16x16_32x32_8x32x1_8x32x1_1x32x1x8_8_1x1_intrawave_v3,1499.17,484.96,0.0
256,16384,5120,6400,0,0,673.508,a8w8_blockscale_1x128x128_256x128x128x128_16x16_32x32_8x32x1_8x32x1_1x32x1x8_8_1x1_intrawave_v3,1594.25,453.44,0.0
256,16384,5120,25600,0,0,2840.9703,a8w8_blockscale_1x128x128_256x128x128x128_16x16_32x32_8x32x1_8x32x1_1x32x1x8_8_1x1_intrawave_v3,1511.8,252.83,0.0
256,16384,6400,5120,0,0,715.0096,a8w8_blockscale_1x128x128_256x128x128x128_16x16_32x32_8x32x1_8x32x1_1x32x1x8_8_1x1_intrawave_v3,1501.72,456.45,0.0
256,16384,7168,256,23,0,102.5599,a8w8_blockscale_1x128x128_256x128x128x256_16x16_32x32_8x32x1_8x32x1_1x32x1x8_8_1x1_intrawave_v1,586.29,2348.97,0.0
256,16384,7168,2048,0,0,346.3744,a8w8_blockscale_1x128x128_256x128x128x128_16x16_32x32_8x32x1_8x32x1_1x32x1x8_8_1x1_intrawave_v3,1388.78,817.37,0.0
256,16384,7168,2304,0,0,368.3732,a8w8_blockscale_1x128x128_256x128x128x128_16x16_32x32_8x32x1_8x32x1_1x32x1x8_8_1x1_intrawave_v3,1469.07,784.92,0.0
256,16384,7168,8192,0,0,1238.7947,a8w8_blockscale_1x128x128_256x128x128x128_16x16_32x32_8x32x1_8x32x1_1x32x1x8_8_1x1_intrawave_v3,1553.24,345.35,0.0
256,16384,8192,1024,0,0,243.9638,a8w8_blockscale_1x128x128_256x128x128x128_16x16_32x32_8x32x1_8x32x1_1x32x1x8_8_1x1_intrawave_v3,1126.72,1203.46,0.0
256,16384,8192,2048,0,0,397.6598,a8w8_blockscale_1x128x128_256x128x128x128_16x16_32x32_8x32x1_8x32x1_1x32x1x8_8_1x1_intrawave_v3,1382.48,801.61,0.0
256,16384,8192,3584,0,0,608.9153,a8w8_blockscale_1x128x128_256x128x128x128_16x16_32x32_8x32x1_8x32x1_1x32x1x8_8_1x1_intrawave_v3,1579.98,585.49,0.0
256,16384,8192,7168,0,0,1232.8402,a8w8_blockscale_1x128x128_256x128x128x128_16x16_32x32_8x32x1_8x32x1_1x32x1x8_8_1x1_intrawave_v3,1560.74,360.63,0.0
256,16384,8192,8192,0,0,1398.3439,a8w8_blockscale_1x128x128_256x128x128x128_16x16_32x32_8x32x1_8x32x1_1x32x1x8_8_1x1_intrawave_v3,1572.59,335.94,0.0
256,16384,8192,28672,0,0,5335.0973,a8w8_blockscale_1x128x128_256x128x128x128_16x16_32x32_8x32x1_8x32x1_1x32x1x8_8_1x1_intrawave_v3,1442.63,182.39,0.0
256,16384,9216,16384,0,0,3241.959,a8w8_blockscale_1x128x128_256x128x128x128_16x16_32x32_8x32x1_8x32x1_1x32x1x8_8_1x1_intrawave_v3,1526.18,222.53,0.0
256,16384,10240,8192,0,0,1725.9049,a8w8_blockscale_1x128x128_256x128x128x128_16x16_32x32_8x32x1_8x32x1_1x32x1x8_8_1x1_intrawave_v3,1592.66,320.79,0.0
256,16384,12800,5120,0,0,1363.8088,a8w8_blockscale_1x128x128_256x128x128x128_16x16_32x32_8x32x1_8x32x1_1x32x1x8_8_1x1_intrawave_v3,1574.62,417.11,0.0
256,16384,13312,16384,0,0,4625.6817,a8w8_blockscale_1x128x128_256x128x128x128_16x16_32x32_8x32x1_8x32x1_1x32x1x8_8_1x1_intrawave_v3,1545.03,199.48,0.0
256,16384,14336,8192,0,0,2463.1151,a8w8_blockscale_1x128x128_256x128x128x128_16x16_32x32_8x32x1_8x32x1_1x32x1x8_8_1x1_intrawave_v3,1562.37,292.89,0.0
256,16384,16384,2048,0,0,775.2265,a8w8_blockscale_1x128x128_256x128x128x128_16x16_32x32_8x32x1_8x32x1_1x32x1x8_8_1x1_intrawave_v3,1418.31,779.1,0.0
256,16384,16384,4096,0,0,1412.8717,a8w8_blockscale_1x128x128_256x128x128x128_16x16_32x32_8x32x1_8x32x1_1x32x1x8_8_1x1_intrawave_v3,1556.42,474.98,0.0
256,16384,16384,6656,0,0,2196.414,a8w8_blockscale_1x128x128_256x128x128x128_16x16_32x32_8x32x1_8x32x1_1x32x1x8_8_1x1_intrawave_v3,1626.93,343.73,0.0
256,16384,16384,8192,0,0,2825.0205,a8w8_blockscale_1x128x128_256x128x128x128_16x16_32x32_8x32x1_8x32x1_1x32x1x8_8_1x1_intrawave_v3,1556.82,285.06,0.0
256,16384,16384,13312,0,0,4675.6102,a8w8_blockscale_1x128x128_256x128x128x128_16x16_32x32_8x32x1_8x32x1_1x32x1x8_8_1x1_intrawave_v3,1528.53,208.12,0.0
256,16384,16384,26624,19,0,10439.5749,a8w8_blockscale_1x128x128_256x256x128x128_16x16_32x32_8x32x1_8x32x1_1x32x1x8_8_1x1_intrawave_v1,1369.18,134.99,0.0
256,16384,26624,16384,0,0,9752.0758,a8w8_blockscale_1x128x128_256x128x128x128_16x16_32x32_8x32x1_8x32x1_1x32x1x8_8_1x1_intrawave_v3,1465.7,161.72,0.0
256,16384,51200,5120,0,0,5557.2196,a8w8_blockscale_1x128x128_256x128x128x128_16x16_32x32_8x32x1_8x32x1_1x32x1x8_8_1x1_intrawave_v3,1545.73,364.17,0.0
256,16384,53248,16384,0,0,20107.6359,a8w8_blockscale_1x128x128_256x128x128x128_16x16_32x32_8x32x1_8x32x1_1x32x1x8_8_1x1_intrawave_v3,1421.71,143.51,0.0
256,16384,57344,8192,0,0,9698.3896,a8w8_blockscale_1x128x128_256x128x128x128_16x16_32x32_8x32x1_8x32x1_1x32x1x8_8_1x1_intrawave_v3,1587.19,256.02,0.0
256,20480,512,7168,0,0,132.8114,a8w8_blockscale_1x128x128_256x128x128x128_16x16_32x32_8x32x1_8x32x1_1x32x1x8_8_1x1_intrawave_v3,1131.86,1290.87,0.0
256,20480,576,7168,0,0,162.7566,a8w8_blockscale_1x128x128_256x128x128x128_16x16_32x32_8x32x1_8x32x1_1x32x1x8_8_1x1_intrawave_v3,1039.06,1072.29,0.0
256,20480,1536,7168,0,0,315.2457,a8w8_blockscale_1x128x128_256x128x128x128_16x16_32x32_8x32x1_8x32x1_1x32x1x8_8_1x1_intrawave_v3,1430.54,700.17,0.0
256,20480,3072,1536,0,0,153.6284,a8w8_blockscale_1x128x128_256x128x128x128_16x16_32x32_8x32x1_8x32x1_1x32x1x8_8_1x1_intrawave_v3,1258.06,1054.53,0.0
256,20480,4096,512,0,0,102.0123,a8w8_blockscale_1x128x128_256x128x128x128_16x16_32x32_8x32x1_8x32x1_1x32x1x8_8_1x1_intrawave_v3,842.05,1767.97,0.0
256,20480,4608,7168,0,0,878.0621,a8w8_blockscale_1x128x128_256x128x128x128_16x16_32x32_8x32x1_8x32x1_1x32x1x8_8_1x1_intrawave_v3,1540.8,419.76,0.0
256,20480,7168,256,23,0,126.4212,a8w8_blockscale_1x128x128_256x128x128x256_16x16_32x32_8x32x1_8x32x1_1x32x1x8_8_1x1_intrawave_v1,594.54,2378.39,0.0
256,20480,7168,2048,0,0,429.0995,a8w8_blockscale_1x128x128_256x128x128x128_16x16_32x32_8x32x1_8x32x1_1x32x1x8_8_1x1_intrawave_v3,1401.3,816.18,0.0
256,20480,7168,2304,0,0,442.1586,a8w8_blockscale_1x128x128_256x128x128x128_16x16_32x32_8x32x1_8x32x1_1x32x1x8_8_1x1_intrawave_v3,1529.9,808.09,0.0
256,32768,100,5120,6,0,152.3788,a8w8_blockscale_1x128x128_256x16x64x128_8x16_16x16_16x16x1_8x32x1_1x16x1x16_4_1x1_intrawave_v1,220.2,1147.39,0.0
256,32768,200,5120,0,0,78.8484,a8w8_blockscale_1x128x128_256x128x128x128_16x16_32x32_8x32x1_8x32x1_1x32x1x8_8_1x1_intrawave_v3,851.11,2307.0,0.0
256,32768,800,5120,0,0,226.4549,a8w8_blockscale_1x128x128_256x128x128x128_16x16_32x32_8x32x1_8x32x1_1x32x1x8_8_1x1_intrawave_v3,1185.38,990.47,0.0
256,32768,1280,8192,0,0,476.4314,a8w8_blockscale_1x128x128_256x128x128x128_16x16_32x32_8x32x1_8x32x1_1x32x1x8_8_1x1_intrawave_v3,1442.38,761.51,0.0
256,32768,2304,16384,0,0,1672.5651,a8w8_blockscale_1x128x128_256x128x128x128_16x16_32x32_8x32x1_8x32x1_1x32x1x8_8_1x1_intrawave_v3,1479.11,433.83,0.0
256,32768,2560,8192,0,0,886.82,a8w8_blockscale_1x128x128_256x128x128x128_16x16_32x32_8x32x1_8x32x1_1x32x1x8_8_1x1_intrawave_v3,1549.8,515.53,0.0
256,32768,4608,16384,0,0,3323.0315,a8w8_blockscale_1x128x128_256x128x128x128_16x16_32x32_8x32x1_8x32x1_1x32x1x8_8_1x1_intrawave_v3,1488.94,275.16,0.0
256,32768,5120,640,0,0,218.6055,a8w8_blockscale_1x128x128_256x128x128x128_16x16_32x32_8x32x1_8x32x1_1x32x1x8_8_1x1_intrawave_v3,982.36,1645.85,0.0
256,32768,5120,1280,0,0,330.6315,a8w8_blockscale_1x128x128_256x128x128x128_16x16_32x32_8x32x1_8x32x1_1x32x1x8_8_1x1_intrawave_v3,1299.02,1161.54,0.0
256,32768,5120,3200,0,0,698.0998,a8w8_blockscale_1x128x128_256x128x128x128_16x16_32x32_8x32x1_8x32x1_1x32x1x8_8_1x1_intrawave_v3,1538.09,654.33,0.0
256,32768,5120,5120,0,0,1119.0998,a8w8_blockscale_1x128x128_256x128x128x128_16x16_32x32_8x32x1_8x32x1_1x32x1x8_8_1x1_intrawave_v3,1535.15,473.18,0.0
256,32768,5120,6400,0,0,1332.9909,a8w8_blockscale_1x128x128_256x128x128x128_16x16_32x32_8x32x1_8x32x1_1x32x1x8_8_1x1_intrawave_v3,1611.03,433.63,0.0
256,32768,5120,25600,0,0,5732.3746,a8w8_blockscale_1x128x128_256x128x128x128_16x16_32x32_8x32x1_8x32x1_1x32x1x8_8_1x1_intrawave_v3,1498.49,227.74,0.0
256,32768,6400,5120,0,0,1392.2551,a8w8_blockscale_1x128x128_256x128x128x128_16x16_32x32_8x32x1_8x32x1_1x32x1x8_8_1x1_intrawave_v3,1542.45,445.3,0.0
256,32768,7168,8192,0,0,2370.6051,a8w8_blockscale_1x128x128_256x128x128x128_16x16_32x32_8x32x1_8x32x1_1x32x1x8_8_1x1_intrawave_v3,1623.34,336.17,0.0
256,32768,8192,1024,0,0,456.4029,a8w8_blockscale_1x128x128_256x128x128x128_16x16_32x32_8x32x1_8x32x1_1x32x1x8_8_1x1_intrawave_v3,1204.54,1268.21,0.0
256,32768,8192,2048,0,0,766.5925,a8w8_blockscale_1x128x128_256x128x128x128_16x16_32x32_8x32x1_8x32x1_1x32x1x8_8_1x1_intrawave_v3,1434.28,809.76,0.0
256,32768,8192,3584,0,0,1199.5857,a8w8_blockscale_1x128x128_256x128x128x128_16x16_32x32_8x32x1_8x32x1_1x32x1x8_8_1x1_intrawave_v3,1604.01,569.92,0.0
256,32768,8192,7168,0,0,2410.7631,a8w8_blockscale_1x128x128_256x128x128x128_16x16_32x32_8x32x1_8x32x1_1x32x1x8_8_1x1_intrawave_v3,1596.3,344.49,0.0
256,32768,8192,8192,0,0,2790.7419,a8w8_blockscale_1x128x128_256x128x128x128_16x16_32x32_8x32x1_8x32x1_1x32x1x8_8_1x1_intrawave_v3,1575.94,312.61,0.0
256,32768,8192,28672,19,0,11382.6321,a8w8_blockscale_1x128x128_256x256x128x128_16x16_32x32_8x32x1_8x32x1_1x32x1x8_8_1x1_intrawave_v1,1352.34,150.34,0.0
256,32768,9216,16384,0,0,6414.5813,a8w8_blockscale_1x128x128_256x128x128x128_16x16_32x32_8x32x1_8x32x1_1x32x1x8_8_1x1_intrawave_v3,1542.67,201.39,0.0
256,32768,10240,8192,0,0,3507.214,a8w8_blockscale_1x128x128_256x128x128x128_16x16_32x32_8x32x1_8x32x1_1x32x1x8_8_1x1_intrawave_v3,1567.5,291.8,0.0
256,32768,12800,5120,0,0,2712.1439,a8w8_blockscale_1x128x128_256x128x128x128_16x16_32x32_8x32x1_8x32x1_1x32x1x8_8_1x1_intrawave_v3,1583.61,395.32,0.0
256,32768,13312,16384,0,0,9526.814,a8w8_blockscale_1x128x128_256x128x128x128_16x16_32x32_8x32x1_8x32x1_1x32x1x8_8_1x1_intrawave_v3,1500.36,170.82,0.0
256,32768,14336,8192,0,0,4927.7308,a8w8_blockscale_1x128x128_256x128x128x128_16x16_32x32_8x32x1_8x32x1_1x32x1x8_8_1x1_intrawave_v3,1561.89,268.97,0.0
256,32768,16384,2048,0,0,1519.7255,a8w8_blockscale_1x128x128_256x128x128x128_16x16_32x32_8x32x1_8x32x1_1x32x1x8_8_1x1_intrawave_v3,1446.99,772.77,0.0
256,32768,16384,4096,0,0,2781.3493,a8w8_blockscale_1x128x128_256x128x128x128_16x16_32x32_8x32x1_8x32x1_1x32x1x8_8_1x1_intrawave_v3,1581.26,458.44,0.0
256,32768,16384,6656,0,0,4375.3441,a8w8_blockscale_1x128x128_256x128x128x128_16x16_32x32_8x32x1_8x32x1_1x32x1x8_8_1x1_intrawave_v3,1633.43,320.18,0.0
256,32768,16384,8192,0,0,5522.7532,a8w8_blockscale_1x128x128_256x128x128x128_16x16_32x32_8x32x1_8x32x1_1x32x1x8_8_1x1_intrawave_v3,1592.7,267.33,0.0
256,32768,16384,13312,0,0,9651.4665,a8w8_blockscale_1x128x128_256x128x128x128_16x16_32x32_8x32x1_8x32x1_1x32x1x8_8_1x1_intrawave_v3,1480.98,179.05,0.0
256,32768,16384,26624,19,0,20849.1728,a8w8_blockscale_1x128x128_256x256x128x128_16x16_32x32_8x32x1_8x32x1_1x32x1x8_8_1x1_intrawave_v1,1371.15,114.27,0.0
256,32768,26624,16384,0,0,19888.0848,a8w8_blockscale_1x128x128_256x128x128x128_16x16_32x32_8x32x1_8x32x1_1x32x1x8_8_1x1_intrawave_v3,1437.41,136.66,0.0
256,32768,51200,5120,0,0,11227.1943,a8w8_blockscale_1x128x128_256x128x128x128_16x16_32x32_8x32x1_8x32x1_1x32x1x8_8_1x1_intrawave_v3,1530.2,337.16,0.0
256,32768,53248,16384,0,0,40708.0719,a8w8_blockscale_1x128x128_256x128x128x128_16x16_32x32_8x32x1_8x32x1_1x32x1x8_8_1x1_intrawave_v3,1404.5,120.34,0.0
256,32768,57344,8192,0,0,19042.9569,a8w8_blockscale_1x128x128_256x128x128x128_16x16_32x32_8x32x1_8x32x1_1x32x1x8_8_1x1_intrawave_v3,1616.68,236.11,0.0
