aiter/configs/a8w8_bpreshuffle_tuned_gemm.csv
cu_num,M,N,K,q_dtype_w,libtype,kernelId,splitK,us,kernelName,tflops,bw,errRatio
256,16,10240,8192,torch.float8_e4m3fn,ck,4,0,14.649800062179565,a8w8_bpreshuffle_256x192x128x128_16x16_16x16_8x32x1_8x32x1_1x32x1x8_8x8x1_1x2_intrawave_v3,0,0,0
256,16,8192,8192,torch.float8_e4m3fn,ck,3,0,12.325780391693115,a8w8_bpreshuffle_256x256x128x128_16x16_16x16_8x32x1_8x32x1_1x32x1x8_8x8x1_1x2_intrawave_v3,0,0,0
256,16,57344,8192,torch.float8_e4m3fn,ck,1,0,81.68922424316406,a8w8_bpreshuffle_256x128x128x256_16x16_16x16_16x16x1_16x16x1_1x32x1x8_8x8x1_1x2_intrawave_v3,0,0,0
256,16,8192,28672,torch.float8_e4m3fn,ck,28,0,33.377299308776855,a8w8_bpreshuffle_256x64x16x512_16x16_16x16_32x8x1_32x8x1_1x64x1x4_4x4x1_1x1_intrawave_v2,0,0,0
256,32,10240,8192,torch.float8_e4m3fn,ck,3,0,15.493839979171753,a8w8_bpreshuffle_256x256x128x128_16x16_16x16_8x32x1_8x32x1_1x32x1x8_8x8x1_1x2_intrawave_v3,0,0,0
256,32,8192,8192,torch.float8_e4m3fn,ck,3,0,12.4577796459198,a8w8_bpreshuffle_256x256x128x128_16x16_16x16_8x32x1_8x32x1_1x32x1x8_8x8x1_1x2_intrawave_v3,0,0,0
256,32,57344,8192,torch.float8_e4m3fn,ck,47,0,87.60693550109863,a8w8_bpreshuffle_256x192x256x128_16x16_16x16_8x32x1_8x32x1_1x32x1x8_8x8x1_2x1_intrawave_v3,0,0,0
256,32,8192,28672,torch.float8_e4m3fn,ck,28,0,34.21731948852539,a8w8_bpreshuffle_256x64x16x512_16x16_16x16_32x8x1_32x8x1_1x64x1x4_4x4x1_1x1_intrawave_v2,0,0,0
256,48,10240,8192,torch.float8_e4m3fn,ck,28,0,15.904239416122437,a8w8_bpreshuffle_256x64x16x512_16x16_16x16_32x8x1_32x8x1_1x64x1x4_4x4x1_1x1_intrawave_v2,0,0,0
256,48,8192,8192,torch.float8_e4m3fn,ck,3,0,14.298620223999023,a8w8_bpreshuffle_256x256x128x128_16x16_16x16_8x32x1_8x32x1_1x32x1x8_8x8x1_1x2_intrawave_v3,0,0,0
256,48,57344,8192,torch.float8_e4m3fn,ck,47,0,89.64537620544434,a8w8_bpreshuffle_256x192x256x128_16x16_16x16_8x32x1_8x32x1_1x32x1x8_8x8x1_2x1_intrawave_v3,0,0,0
256,48,8192,28672,torch.float8_e4m3fn,ck,4,0,43.683881759643555,a8w8_bpreshuffle_256x192x128x128_16x16_16x16_8x32x1_8x32x1_1x32x1x8_8x8x1_1x2_intrawave_v3,0,0,0
256,64,10240,8192,torch.float8_e4m3fn,ck,39,0,18.540279865264893,a8w8_bpreshuffle_256x256x64x128_16x16_16x16_8x32x1_8x32x1_1x32x1x8_8x8x1_2x1_intrawave_v3,0,0,0
256,64,8192,8192,torch.float8_e4m3fn,ck,28,0,15.061019659042358,a8w8_bpreshuffle_256x64x16x512_16x16_16x16_32x8x1_32x8x1_1x64x1x4_4x4x1_1x1_intrawave_v2,0,0,0
256,64,57344,8192,torch.float8_e4m3fn,ck,47,0,91.02540016174316,a8w8_bpreshuffle_256x192x256x128_16x16_16x16_8x32x1_8x32x1_1x32x1x8_8x8x1_2x1_intrawave_v3,0,0,0
256,64,8192,28672,torch.float8_e4m3fn,ck,28,0,47.876739501953125,a8w8_bpreshuffle_256x64x16x512_16x16_16x16_32x8x1_32x8x1_1x64x1x4_4x4x1_1x1_intrawave_v2,0,0,0
256,80,10240,8192,torch.float8_e4m3fn,ck,39,0,19.625920057296753,a8w8_bpreshuffle_256x256x64x128_16x16_16x16_8x32x1_8x32x1_1x32x1x8_8x8x1_2x1_intrawave_v3,0,0,0
256,80,8192,8192,torch.float8_e4m3fn,ck,46,0,18.654680252075195,a8w8_bpreshuffle_256x224x64x128_16x16_16x16_8x32x1_8x32x1_1x32x1x8_8x8x1_2x1_intrawave_v3,0,0,0
256,80,57344,8192,torch.float8_e4m3fn,ck,55,0,94.74785804748535,a8w8_bpreshuffle_256x160x224x128_16x16_16x16_8x32x1_8x32x1_1x32x1x8_4x4x1_1x1_intrawave_v3,0,0,0
256,80,8192,28672,torch.float8_e4m3fn,ck,46,0,56.76487922668457,a8w8_bpreshuffle_256x224x64x128_16x16_16x16_8x32x1_8x32x1_1x32x1x8_8x8x1_2x1_intrawave_v3,0,0,0
256,96,10240,8192,torch.float8_e4m3fn,ck,39,0,19.315500259399414,a8w8_bpreshuffle_256x256x64x128_16x16_16x16_8x32x1_8x32x1_1x32x1x8_8x8x1_2x1_intrawave_v3,0,0,0
256,96,8192,8192,torch.float8_e4m3fn,ck,46,0,16.163439750671387,a8w8_bpreshuffle_256x224x64x128_16x16_16x16_8x32x1_8x32x1_1x32x1x8_8x8x1_2x1_intrawave_v3,0,0,0
256,96,57344,8192,torch.float8_e4m3fn,ck,55,0,97.63509750366211,a8w8_bpreshuffle_256x160x224x128_16x16_16x16_8x32x1_8x32x1_1x32x1x8_4x4x1_1x1_intrawave_v3,0,0,0
256,96,8192,28672,torch.float8_e4m3fn,ck,46,0,49.63037967681885,a8w8_bpreshuffle_256x224x64x128_16x16_16x16_8x32x1_8x32x1_1x32x1x8_8x8x1_2x1_intrawave_v3,0,0,0
256,112,10240,8192,torch.float8_e4m3fn,ck,46,0,21.200320720672607,a8w8_bpreshuffle_256x224x64x128_16x16_16x16_8x32x1_8x32x1_1x32x1x8_8x8x1_2x1_intrawave_v3,0,0,0
256,112,8192,8192,torch.float8_e4m3fn,ck,39,0,20.12752056121826,a8w8_bpreshuffle_256x256x64x128_16x16_16x16_8x32x1_8x32x1_1x32x1x8_8x8x1_2x1_intrawave_v3,0,0,0
256,112,57344,8192,torch.float8_e4m3fn,ck,34,0,104.96804237365723,a8w8_bpreshuffle_256x256x224x128_16x16_16x16_8x32x1_8x32x1_1x64x1x4_8x8x1_2x1_intrawave_v3,0,0,0
256,112,8192,28672,torch.float8_e4m3fn,ck,46,0,63.36098194122314,a8w8_bpreshuffle_256x224x64x128_16x16_16x16_8x32x1_8x32x1_1x32x1x8_8x8x1_2x1_intrawave_v3,0,0,0
256,128,10240,8192,torch.float8_e4m3fn,ck,46,0,21.64194107055664,a8w8_bpreshuffle_256x224x64x128_16x16_16x16_8x32x1_8x32x1_1x32x1x8_8x8x1_2x1_intrawave_v3,0,0,0
256,128,8192,8192,torch.float8_e4m3fn,ck,39,0,18.905880451202393,a8w8_bpreshuffle_256x256x64x128_16x16_16x16_8x32x1_8x32x1_1x32x1x8_8x8x1_2x1_intrawave_v3,0,0,0
256,128,57344,8192,torch.float8_e4m3fn,ck,34,0,105.0400161743164,a8w8_bpreshuffle_256x256x224x128_16x16_16x16_8x32x1_8x32x1_1x64x1x4_8x8x1_2x1_intrawave_v3,0,0,0
256,128,8192,28672,torch.float8_e4m3fn,ck,39,0,62.17936038970947,a8w8_bpreshuffle_256x256x64x128_16x16_16x16_8x32x1_8x32x1_1x32x1x8_8x8x1_2x1_intrawave_v3,0,0,0
256,144,10240,8192,torch.float8_e4m3fn,ck,46,0,21.063520908355713,a8w8_bpreshuffle_256x224x64x128_16x16_16x16_8x32x1_8x32x1_1x32x1x8_8x8x1_2x1_intrawave_v3,0,0,0
256,144,8192,8192,torch.float8_e4m3fn,ck,46,0,20.680320262908936,a8w8_bpreshuffle_256x224x64x128_16x16_16x16_8x32x1_8x32x1_1x32x1x8_8x8x1_2x1_intrawave_v3,0,0,0
256,144,57344,8192,torch.float8_e4m3fn,ck,34,0,105.97043991088867,a8w8_bpreshuffle_256x256x224x128_16x16_16x16_8x32x1_8x32x1_1x64x1x4_8x8x1_2x1_intrawave_v3,0,0,0
256,144,8192,28672,torch.float8_e4m3fn,ck,54,0,65.60902118682861,a8w8_bpreshuffle_256x160x256x128_16x16_16x16_8x32x1_8x32x1_1x32x1x8_8x8x1_2x1_intrawave_v3,0,0,0
256,160,10240,8192,torch.float8_e4m3fn,ck,51,0,27.723639011383057,a8w8_bpreshuffle_256x192x128x128_16x16_16x16_8x32x1_8x32x1_1x32x1x8_8x8x1_2x1_intrawave_v3,0,0,0
256,160,8192,8192,torch.float8_e4m3fn,ck,54,0,21.535539627075195,a8w8_bpreshuffle_256x160x256x128_16x16_16x16_8x32x1_8x32x1_1x32x1x8_8x8x1_2x1_intrawave_v3,0,0,0
256,160,57344,8192,torch.float8_e4m3fn,ck,34,0,106.40323638916016,a8w8_bpreshuffle_256x256x224x128_16x16_16x16_8x32x1_8x32x1_1x64x1x4_8x8x1_2x1_intrawave_v3,0,0,0
256,160,8192,28672,torch.float8_e4m3fn,ck,54,0,66.0298204421997,a8w8_bpreshuffle_256x160x256x128_16x16_16x16_8x32x1_8x32x1_1x32x1x8_8x8x1_2x1_intrawave_v3,0,0,0
256,176,10240,8192,torch.float8_e4m3fn,ck,51,0,28.10041904449463,a8w8_bpreshuffle_256x192x128x128_16x16_16x16_8x32x1_8x32x1_1x32x1x8_8x8x1_2x1_intrawave_v3,0,0,0
256,176,8192,8192,torch.float8_e4m3fn,ck,46,0,22.26353883743286,a8w8_bpreshuffle_256x224x64x128_16x16_16x16_8x32x1_8x32x1_1x32x1x8_8x8x1_2x1_intrawave_v3,0,0,0
256,176,57344,8192,torch.float8_e4m3fn,ck,34,0,110.34250259399414,a8w8_bpreshuffle_256x256x224x128_16x16_16x16_8x32x1_8x32x1_1x64x1x4_8x8x1_2x1_intrawave_v3,0,0,0
256,176,8192,28672,torch.float8_e4m3fn,ck,46,0,71.01870059967041,a8w8_bpreshuffle_256x224x64x128_16x16_16x16_8x32x1_8x32x1_1x32x1x8_8x8x1_2x1_intrawave_v3,0,0,0
256,192,10240,8192,torch.float8_e4m3fn,ck,51,0,26.75719976425171,a8w8_bpreshuffle_256x192x128x128_16x16_16x16_8x32x1_8x32x1_1x32x1x8_8x8x1_2x1_intrawave_v3,0,0,0
256,192,8192,8192,torch.float8_e4m3fn,ck,46,0,22.187540531158447,a8w8_bpreshuffle_256x224x64x128_16x16_16x16_8x32x1_8x32x1_1x32x1x8_8x8x1_2x1_intrawave_v3,0,0,0
256,192,57344,8192,torch.float8_e4m3fn,ck,34,0,111.07452392578125,a8w8_bpreshuffle_256x256x224x128_16x16_16x16_8x32x1_8x32x1_1x64x1x4_8x8x1_2x1_intrawave_v3,0,0,0
256,192,8192,28672,torch.float8_e4m3fn,ck,46,0,69.88669872283936,a8w8_bpreshuffle_256x224x64x128_16x16_16x16_8x32x1_8x32x1_1x32x1x8_8x8x1_2x1_intrawave_v3,0,0,0
256,208,10240,8192,torch.float8_e4m3fn,ck,33,0,40.5062198638916,a8w8_bpreshuffle_256x256x256x128_16x16_16x16_8x32x1_8x32x1_1x32x1x8_8x8x1_2x1_intrawave_v3,0,0,0
256,208,8192,8192,torch.float8_e4m3fn,ck,39,0,30.488479137420654,a8w8_bpreshuffle_256x256x64x128_16x16_16x16_8x32x1_8x32x1_1x32x1x8_8x8x1_2x1_intrawave_v3,0,0,0
256,208,57344,8192,torch.float8_e4m3fn,ck,37,0,125.09954452514648,a8w8_bpreshuffle_256x256x128x128_16x16_16x16_8x32x1_8x32x1_1x32x1x8_8x8x1_2x1_intrawave_v3,0,0,0
256,208,8192,28672,torch.float8_e4m3fn,ck,40,0,95.79347610473633,a8w8_bpreshuffle_256x224x256x128_16x16_16x16_8x32x1_8x32x1_1x32x1x8_8x8x1_2x1_intrawave_v3,0,0,0
256,224,10240,8192,torch.float8_e4m3fn,ck,33,0,40.98544120788574,a8w8_bpreshuffle_256x256x256x128_16x16_16x16_8x32x1_8x32x1_1x32x1x8_8x8x1_2x1_intrawave_v3,0,0,0
256,224,8192,8192,torch.float8_e4m3fn,ck,40,0,30.582880973815918,a8w8_bpreshuffle_256x224x256x128_16x16_16x16_8x32x1_8x32x1_1x32x1x8_8x8x1_2x1_intrawave_v3,0,0,0
256,224,57344,8192,torch.float8_e4m3fn,ck,37,0,123.42512130737305,a8w8_bpreshuffle_256x256x128x128_16x16_16x16_8x32x1_8x32x1_1x32x1x8_8x8x1_2x1_intrawave_v3,0,0,0
256,224,8192,28672,torch.float8_e4m3fn,ck,40,0,91.07582092285156,a8w8_bpreshuffle_256x224x256x128_16x16_16x16_8x32x1_8x32x1_1x32x1x8_8x8x1_2x1_intrawave_v3,0,0,0
256,240,10240,8192,torch.float8_e4m3fn,ck,33,0,41.0478401184082,a8w8_bpreshuffle_256x256x256x128_16x16_16x16_8x32x1_8x32x1_1x32x1x8_8x8x1_2x1_intrawave_v3,0,0,0
256,240,8192,8192,torch.float8_e4m3fn,ck,39,0,30.569260120391846,a8w8_bpreshuffle_256x256x64x128_16x16_16x16_8x32x1_8x32x1_1x32x1x8_8x8x1_2x1_intrawave_v3,0,0,0
256,240,57344,8192,torch.float8_e4m3fn,ck,34,0,162.18652725219727,a8w8_bpreshuffle_256x256x224x128_16x16_16x16_8x32x1_8x32x1_1x64x1x4_8x8x1_2x1_intrawave_v3,0,0,0
256,240,8192,28672,torch.float8_e4m3fn,ck,39,0,109.59212303161621,a8w8_bpreshuffle_256x256x64x128_16x16_16x16_8x32x1_8x32x1_1x32x1x8_8x8x1_2x1_intrawave_v3,0,0,0
256,256,10240,8192,torch.float8_e4m3fn,ck,33,0,40.875840187072754,a8w8_bpreshuffle_256x256x256x128_16x16_16x16_8x32x1_8x32x1_1x32x1x8_8x8x1_2x1_intrawave_v3,0,0,0
256,256,8192,8192,torch.float8_e4m3fn,ck,39,0,29.756460189819336,a8w8_bpreshuffle_256x256x64x128_16x16_16x16_8x32x1_8x32x1_1x32x1x8_8x8x1_2x1_intrawave_v3,0,0,0
256,256,57344,8192,torch.float8_e4m3fn,ck,34,0,162.16571807861328,a8w8_bpreshuffle_256x256x224x128_16x16_16x16_8x32x1_8x32x1_1x64x1x4_8x8x1_2x1_intrawave_v3,0,0,0
256,256,8192,28672,torch.float8_e4m3fn,ck,39,0,104.36482429504395,a8w8_bpreshuffle_256x256x64x128_16x16_16x16_8x32x1_8x32x1_1x32x1x8_8x8x1_2x1_intrawave_v3,0,0,0
