aiter/configs/a8w8_blockscale_tuned_gemm_new.csv
cu_num,M,N,K,kernelId,splitK,us,kernelName,tflops,bw,errRatio
256,16,1536,7168,8,0,21.4294,a8w8_blockscale_1x128x128_256x16x64x256_16x16_16x16_16x16x1_16x16x1_1x16x1x16_4_1x1_intrawave_v1,16.44,521.43,0.0
256,16,576,7168,8,0,21.0447,a8w8_blockscale_1x128x128_256x16x64x256_16x16_16x16_16x16x1_16x16x1_1x16x1x16_4_1x1_intrawave_v1,6.28,202.52,0.0
256,16,7168,256,7,0,3.1395,a8w8_blockscale_1x128x128_256x16x128x256_16x16_16x16_16x16x1_16x16x1_1x16x1x16_8_1x2_intrawave_v1,18.7,658.86,0.0
256,16,4608,7168,8,0,21.3896,a8w8_blockscale_1x128x128_256x16x64x256_16x16_16x16_16x16x1_16x16x1_1x16x1x16_4_1x1_intrawave_v1,49.41,1556.47,0.0
256,16,7168,2304,8,0,8.8124,a8w8_blockscale_1x128x128_256x16x64x256_16x16_16x16_16x16x1_16x16x1_1x16x1x16_4_1x1_intrawave_v1,59.97,1904.28,0.0
256,16,512,7168,8,0,20.8066,a8w8_blockscale_1x128x128_256x16x64x256_16x16_16x16_16x16x1_16x16x1_1x16x1x16_4_1x1_intrawave_v1,5.64,182.69,0.0
256,32,1536,7168,8,0,21.4929,a8w8_blockscale_1x128x128_256x16x64x256_16x16_16x16_16x16x1_16x16x1_1x16x1x16_4_1x1_intrawave_v1,32.78,527.51,0.0
256,32,576,7168,8,0,21.1338,a8w8_blockscale_1x128x128_256x16x64x256_16x16_16x16_16x16x1_16x16x1_1x16x1x16_4_1x1_intrawave_v1,12.5,207.96,0.0
256,32,7168,256,6,0,3.2424,a8w8_blockscale_1x128x128_256x16x64x128_8x16_16x16_16x16x1_8x32x1_1x16x1x16_4_1x1_intrawave_v1,36.22,709.95,0.0
256,32,4608,7168,8,0,21.4107,a8w8_blockscale_1x128x128_256x16x64x256_16x16_16x16_16x16x1_16x16x1_1x16x1x16_4_1x1_intrawave_v1,98.73,1567.18,0.0
256,32,7168,2304,8,0,8.5284,a8w8_blockscale_1x128x128_256x16x64x256_16x16_16x16_16x16x1_16x16x1_1x16x1x16_4_1x1_intrawave_v1,123.93,1998.92,0.0
256,32,512,7168,8,0,20.7637,a8w8_blockscale_1x128x128_256x16x64x256_16x16_16x16_16x16x1_16x16x1_1x16x1x16_4_1x1_intrawave_v1,11.31,189.38,0.0
256,64,1536,7168,8,0,21.382,a8w8_blockscale_1x128x128_256x16x64x256_16x16_16x16_16x16x1_16x16x1_1x16x1x16_4_1x1_intrawave_v1,65.91,545.57,0.0
256,64,576,7168,8,0,21.1573,a8w8_blockscale_1x128x128_256x16x64x256_16x16_16x16_16x16x1_16x16x1_1x16x1x16_4_1x1_intrawave_v1,24.98,220.31,0.0
256,64,7168,256,6,0,3.9053,a8w8_blockscale_1x128x128_256x16x64x128_8x16_16x16_16x16x1_8x32x1_1x16x1x16_4_1x1_intrawave_v1,60.14,709.01,0.0
256,64,4608,7168,18,0,26.015,a8w8_blockscale_1x128x128_256x64x64x256_16x16_32x32_16x16x1_16x16x1_1x32x1x8_8_1x1_intrawave_v1,162.52,1309.96,0.0
256,64,7168,2304,18,0,10.3903,a8w8_blockscale_1x128x128_256x64x64x256_16x16_32x32_16x16x1_16x16x1_1x32x1x8_8_1x1_intrawave_v1,203.45,1691.97,0.0
256,64,512,7168,8,0,20.8324,a8w8_blockscale_1x128x128_256x16x64x256_16x16_16x16_16x16x1_16x16x1_1x16x1x16_4_1x1_intrawave_v1,22.55,201.34,0.0
256,128,1536,7168,8,0,20.8404,a8w8_blockscale_1x128x128_256x16x64x256_16x16_16x16_16x16x1_16x16x1_1x16x1x16_4_1x1_intrawave_v1,135.25,591.2,0.0
256,128,576,7168,8,0,20.6122,a8w8_blockscale_1x128x128_256x16x64x256_16x16_16x16_16x16x1_16x16x1_1x16x1x16_4_1x1_intrawave_v1,51.28,251.97,0.0
256,128,7168,256,18,0,4.3093,a8w8_blockscale_1x128x128_256x64x64x256_16x16_32x32_16x16x1_16x16x1_1x32x1x8_8_1x1_intrawave_v1,109.01,859.25,0.0
256,128,4608,7168,18,0,26.4431,a8w8_blockscale_1x128x128_256x64x64x256_16x16_32x32_16x16x1_16x16x1_1x32x1x8_8_1x1_intrawave_v1,319.77,1328.41,0.0
256,128,7168,2304,18,0,10.8608,a8w8_blockscale_1x128x128_256x64x64x256_16x16_32x32_16x16x1_16x16x1_1x32x1x8_8_1x1_intrawave_v1,389.28,1716.72,0.0
256,128,512,7168,8,0,20.4411,a8w8_blockscale_1x128x128_256x16x64x256_16x16_16x16_16x16x1_16x16x1_1x16x1x16_4_1x1_intrawave_v1,45.96,230.84,0.0
256,256,1536,7168,18,0,26.0617,a8w8_blockscale_1x128x128_256x64x64x256_16x16_32x32_16x16x1_16x16x1_1x32x1x8_8_1x1_intrawave_v1,216.3,523.05,0.0
256,256,576,7168,8,0,20.7771,a8w8_blockscale_1x128x128_256x16x64x256_16x16_16x16_16x16x1_16x16x1_1x16x1x16_4_1x1_intrawave_v1,101.74,301.23,0.0
256,256,7168,256,13,0,4.7247,a8w8_blockscale_1x128x128_256x32x64x256_16x16_16x16_16x16x1_16x16x1_1x32x1x8_8_2x1_intrawave_v1,198.85,1179.03,0.0
256,256,4608,7168,2,0,41.5553,a8w8_blockscale_1x128x128_256x64x128x128_16x16_32x32_8x32x1_8x32x1_1x32x1x8_8_1x1_intrawave_v3,406.96,895.78,0.0
256,256,7168,2304,2,0,16.0233,a8w8_blockscale_1x128x128_256x64x128x128_16x16_32x32_8x32x1_8x32x1_1x32x1x8_8_1x1_intrawave_v3,527.71,1296.54,0.0
256,256,512,7168,8,0,20.8496,a8w8_blockscale_1x128x128_256x16x64x256_16x16_16x16_16x16x1_16x16x1_1x16x1x16_4_1x1_intrawave_v1,90.12,276.61,0.0
256,512,1536,7168,18,0,26.4716,a8w8_blockscale_1x128x128_256x64x64x256_16x16_32x32_16x16x1_16x16x1_1x32x1x8_8_1x1_intrawave_v1,425.9,613.98,0.0
256,512,576,7168,18,0,25.9377,a8w8_blockscale_1x128x128_256x64x64x256_16x16_32x32_16x16x1_16x16x1_1x32x1x8_8_1x1_intrawave_v1,163.0,323.41,0.0
256,512,7168,256,18,0,7.5239,a8w8_blockscale_1x128x128_256x64x64x256_16x16_32x32_16x16x1_16x16x1_1x32x1x8_8_1x1_intrawave_v1,249.74,1236.87,0.0
256,512,4608,7168,0,0,52.2019,a8w8_blockscale_1x128x128_256x128x128x128_16x16_32x32_8x32x1_8x32x1_1x32x1x8_8_1x1_intrawave_v3,647.92,793.43,0.0
256,512,7168,2304,0,0,20.0691,a8w8_blockscale_1x128x128_256x128x128x128_16x16_32x32_8x32x1_8x32x1_1x32x1x8_8_1x1_intrawave_v3,842.66,1247.43,0.0
256,512,512,7168,8,0,21.3169,a8w8_blockscale_1x128x128_256x16x64x256_16x16_16x16_16x16x1_16x16x1_1x16x1x16_4_1x1_intrawave_v1,176.3,368.92,0.0
256,1024,1536,7168,2,0,40.8978,a8w8_blockscale_1x128x128_256x64x128x128_16x16_32x32_8x32x1_8x32x1_1x32x1x8_8_1x1_intrawave_v3,551.34,525.6,0.0
256,1024,576,7168,18,0,26.3173,a8w8_blockscale_1x128x128_256x64x64x256_16x16_32x32_16x16x1_16x16x1_1x32x1x8_8_1x1_intrawave_v1,321.3,480.61,0.0
256,1024,7168,256,18,0,10.865,a8w8_blockscale_1x128x128_256x64x64x256_16x16_32x32_16x16x1_16x16x1_1x32x1x8_8_1x1_intrawave_v1,345.89,1544.15,0.0
256,1024,4608,7168,2,0,82.3886,a8w8_blockscale_1x128x128_256x64x128x128_16x16_32x32_8x32x1_8x32x1_1x32x1x8_8_1x1_intrawave_v3,821.06,604.54,0.0
256,1024,7168,2304,0,0,32.6395,a8w8_blockscale_1x128x128_256x128x128x128_16x16_32x32_8x32x1_8x32x1_1x32x1x8_8_1x1_intrawave_v3,1036.26,1028.03,0.0
256,1024,512,7168,18,0,26.2504,a8w8_blockscale_1x128x128_256x64x64x256_16x16_32x32_16x16x1_16x16x1_1x32x1x8_8_1x1_intrawave_v1,286.33,459.37,0.0
256,1536,1536,7168,2,0,48.6753,a8w8_blockscale_1x128x128_256x64x128x128_16x16_32x32_8x32x1_8x32x1_1x32x1x8_8_1x1_intrawave_v3,694.87,549.33,0.0
256,1536,576,7168,18,0,26.7536,a8w8_blockscale_1x128x128_256x64x64x256_16x16_32x32_16x16x1_16x16x1_1x32x1x8_8_1x1_intrawave_v1,474.09,632.0,0.0
256,1536,7168,256,18,0,14.2413,a8w8_blockscale_1x128x128_256x64x64x256_16x16_32x32_16x16x1_16x16x1_1x32x1x8_8_1x1_intrawave_v1,395.83,1702.68,0.0
256,1536,4608,7168,0,0,91.0932,a8w8_blockscale_1x128x128_256x128x128x128_16x16_32x32_8x32x1_8x32x1_1x32x1x8_8_1x1_intrawave_v3,1113.9,638.86,0.0
256,1536,7168,2304,0,0,47.0989,a8w8_blockscale_1x128x128_256x128x128x128_16x16_32x32_8x32x1_8x32x1_1x32x1x8_8_1x1_intrawave_v3,1077.19,893.31,0.0
256,1536,512,7168,18,0,26.4554,a8w8_blockscale_1x128x128_256x64x64x256_16x16_32x32_16x16x1_16x16x1_1x32x1x8_8_1x1_intrawave_v1,426.16,614.35,0.0
256,2048,1536,7168,0,0,53.0593,a8w8_blockscale_1x128x128_256x128x128x128_16x16_32x32_8x32x1_8x32x1_1x32x1x8_8_1x1_intrawave_v3,849.94,602.75,0.0
256,2048,576,7168,18,0,44.3712,a8w8_blockscale_1x128x128_256x64x64x256_16x16_32x32_16x16x1_16x16x1_1x32x1x8_8_1x1_intrawave_v1,381.14,477.07,0.0
256,2048,7168,256,17,0,18.206,a8w8_blockscale_1x128x128_256x64x128x256_16x16_32x32_16x16x1_16x16x1_1x32x1x8_8_1x1_intrawave_v1,412.84,1742.25,0.0
256,2048,4608,7168,0,0,127.9138,a8w8_blockscale_1x128x128_256x128x128x128_16x16_32x32_8x32x1_8x32x1_1x32x1x8_8_1x1_intrawave_v3,1057.68,520.54,0.0
256,2048,7168,2304,0,0,61.0216,a8w8_blockscale_1x128x128_256x128x128x128_16x16_32x32_8x32x1_8x32x1_1x32x1x8_8_1x1_intrawave_v3,1108.55,829.11,0.0
256,2048,512,7168,18,0,27.4997,a8w8_blockscale_1x128x128_256x64x64x256_16x16_32x32_16x16x1_16x16x1_1x32x1x8_8_1x1_intrawave_v1,546.64,743.54,0.0
256,4096,1536,7168,0,0,85.5828,a8w8_blockscale_1x128x128_256x128x128x128_16x16_32x32_8x32x1_8x32x1_1x32x1x8_8_1x1_intrawave_v3,1053.88,618.74,0.0
256,4096,576,7168,0,0,52.5496,a8w8_blockscale_1x128x128_256x128x128x128_16x16_32x32_8x32x1_8x32x1_1x32x1x8_8_1x1_intrawave_v3,643.64,727.07,0.0
256,4096,7168,256,15,0,30.944,a8w8_blockscale_1x128x128_256x64x128x128_16x16_32x32_8x32x1_8x32x1_1x32x1x8_8_1x1_intrawave_v1,485.79,1990.82,0.0
256,4096,4608,7168,0,0,210.9224,a8w8_blockscale_1x128x128_256x128x128x128_16x16_32x32_8x32x1_8x32x1_1x32x1x8_8_1x1_intrawave_v3,1282.86,474.77,0.0
256,4096,7168,2304,0,0,105.1135,a8w8_blockscale_1x128x128_256x128x128x128_16x16_32x32_8x32x1_8x32x1_1x32x1x8_8_1x1_intrawave_v3,1287.1,805.53,0.0
256,4096,512,7168,2,0,42.0197,a8w8_blockscale_1x128x128_256x64x128x128_16x16_32x32_8x32x1_8x32x1_1x32x1x8_8_1x1_intrawave_v3,715.49,885.88,0.0
256,8192,1536,7168,0,0,149.9767,a8w8_blockscale_1x128x128_256x128x128x128_16x16_32x32_8x32x1_8x32x1_1x32x1x8_8_1x1_intrawave_v3,1202.78,632.74,0.0
256,8192,576,7168,0,0,76.6408,a8w8_blockscale_1x128x128_256x128x128x128_16x16_32x32_8x32x1_8x32x1_1x32x1x8_8_1x1_intrawave_v3,882.63,943.18,0.0
256,8192,7168,256,23,0,56.2676,a8w8_blockscale_1x128x128_256x128x128x256_16x16_32x32_8x32x1_8x32x1_1x32x1x8_8_1x1_intrawave_v1,534.32,2157.06,0.0
256,8192,4608,7168,0,0,373.1568,a8w8_blockscale_1x128x128_256x128x128x128_16x16_32x32_8x32x1_8x32x1_1x32x1x8_8_1x1_intrawave_v3,1450.24,448.2,0.0
256,8192,7168,2304,0,0,190.7436,a8w8_blockscale_1x128x128_256x128x128x128_16x16_32x32_8x32x1_8x32x1_1x32x1x8_8_1x1_intrawave_v3,1418.57,801.23,0.0
256,8192,512,7168,0,0,57.3425,a8w8_blockscale_1x128x128_256x128x128x128_16x16_32x32_8x32x1_8x32x1_1x32x1x8_8_1x1_intrawave_v3,1048.6,1234.32,0.0
256,16384,1536,7168,0,0,258.8661,a8w8_blockscale_1x128x128_256x128x128x128_16x16_32x32_8x32x1_8x32x1_1x32x1x8_8_1x1_intrawave_v3,1393.68,690.64,0.0
256,16384,576,7168,0,0,127.8422,a8w8_blockscale_1x128x128_256x128x128x128_16x16_32x32_8x32x1_8x32x1_1x32x1x8_8_1x1_intrawave_v3,1058.27,1098.57,0.0
256,16384,7168,256,23,0,102.745,a8w8_blockscale_1x128x128_256x128x128x256_16x16_32x32_8x32x1_8x32x1_1x32x1x8_8_1x1_intrawave_v1,585.23,2344.74,0.0
256,16384,4608,7168,0,0,710.4004,a8w8_blockscale_1x128x128_256x128x128x128_16x16_32x32_8x32x1_8x32x1_1x32x1x8_8_1x1_intrawave_v3,1523.55,424.36,0.0
256,16384,7168,2304,0,0,359.8945,a8w8_blockscale_1x128x128_256x128x128x128_16x16_32x32_8x32x1_8x32x1_1x32x1x8_8_1x1_intrawave_v3,1503.68,803.42,0.0
256,16384,512,7168,0,0,98.2749,a8w8_blockscale_1x128x128_256x128x128x128_16x16_32x32_8x32x1_8x32x1_1x32x1x8_8_1x1_intrawave_v3,1223.7,1403.08,0.0
256,20480,1536,7168,0,0,323.3106,a8w8_blockscale_1x128x128_256x128x128x128_16x16_32x32_8x32x1_8x32x1_1x32x1x8_8_1x1_intrawave_v3,1394.86,682.7,0.0
256,20480,576,7168,0,0,162.08,a8w8_blockscale_1x128x128_256x128x128x128_16x16_32x32_8x32x1_8x32x1_1x32x1x8_8_1x1_intrawave_v3,1043.4,1076.77,0.0
256,20480,7168,256,23,0,125.9922,a8w8_blockscale_1x128x128_256x128x128x256_16x16_32x32_8x32x1_8x32x1_1x32x1x8_8_1x1_intrawave_v1,596.56,2386.49,0.0
256,20480,4608,7168,0,0,870.3509,a8w8_blockscale_1x128x128_256x128x128x128_16x16_32x32_8x32x1_8x32x1_1x32x1x8_8_1x1_intrawave_v3,1554.45,423.48,0.0
256,20480,7168,2304,0,0,453.2727,a8w8_blockscale_1x128x128_256x128x128x128_16x16_32x32_8x32x1_8x32x1_1x32x1x8_8_1x1_intrawave_v3,1492.38,788.27,0.0
256,20480,512,7168,0,0,131.9216,a8w8_blockscale_1x128x128_256x128x128x128_16x16_32x32_8x32x1_8x32x1_1x32x1x8_8_1x1_intrawave_v3,1139.49,1299.58,0.0
