aiter/configs/a8w8_bpreshuffle_tuned_gemm.csv
cu_num,M,N,K,kernelId,splitK,us,kernelName,tflops,bw,errRatio
80,1,512,7168,5,0,12.4802,a8w8_bpreshuffle_256x16x64x512_16x16_16x16_32x8x1_32x8x1_1x16x1x16_4x4x1_1x1_intrawave_v1,0.59,294.72,0.0
80,1,1280,8192,11,0,14.3155,a8w8_bpreshuffle_256x16x64x512_16x16_16x16_32x8x1_32x8x1_1x16x1x16_4x4x1_1x1_intrawave_v1,1.46,733.23,0.0
80,1,2112,7168,11,0,13.4147,a8w8_bpreshuffle_256x16x64x512_16x16_16x16_32x8x1_32x8x1_1x16x1x16_4x4x1_1x1_intrawave_v1,2.26,1129.37,0.0
80,1,4096,512,9,0,4.2138,a8w8_bpreshuffle_128x16x32x128_16x16_16x16_8x16x1_8x16x1_1x16x1x8_4x4x1_1x1_intrawave_v1,1.0,499.75,0.0
80,1,4608,4096,11,0,10.5838,a8w8_bpreshuffle_256x16x64x512_16x16_16x16_32x8x1_32x8x1_1x16x1x16_4x4x1_1x1_intrawave_v1,3.57,1784.58,0.0
80,1,4608,7168,5,0,13.8515,a8w8_bpreshuffle_256x16x64x512_16x16_16x16_32x8x1_32x8x1_1x16x1x16_4x4x1_1x1_intrawave_v1,4.77,2385.77,0.0
80,1,7168,256,75,0,6.4606,a8w8_bpreshuffle_128x16x256x64_16x16_16x16_4x16x1_4x32x1_1x16x1x8_8x8x1_1x2_intrawave_v1,0.57,286.29,0.0
80,1,7168,2304,29,0,10.1762,a8w8_bpreshuffle_256x16x64x256_16x16_16x16_16x16x1_16x16x1_1x16x1x16_4x4x1_1x1_intrawave_v2,3.25,1624.55,0.0
80,1,8192,1024,15,0,6.4482,a8w8_bpreshuffle_256x16x64x256_16x16_16x16_16x16x1_16x16x1_1x16x1x16_4x4x1_1x1_intrawave_v1,2.6,1303.62,0.0
80,1,9216,4096,19,0,14.4331,a8w8_bpreshuffle_256x16x64x512_16x16_16x16_32x8x1_32x8x1_1x16x1x16_4x4x1_1x1_intrawave_v2,5.23,2616.99,0.0
80,2,4608,4096,5,0,10.661,a8w8_bpreshuffle_256x16x64x512_16x16_16x16_32x8x1_32x8x1_1x16x1x16_4x4x1_1x1_intrawave_v1,7.08,1772.91,0.0
80,2,9216,4096,5,0,14.4331,a8w8_bpreshuffle_256x16x64x512_16x16_16x16_32x8x1_32x8x1_1x16x1x16_4x4x1_1x1_intrawave_v1,10.46,2618.55,0.0
80,4,4608,4096,5,0,10.4863,a8w8_bpreshuffle_256x16x64x512_16x16_16x16_32x8x1_32x8x1_1x16x1x16_4x4x1_1x1_intrawave_v1,14.4,1804.99,0.0
80,4,9216,4096,11,0,14.6151,a8w8_bpreshuffle_256x16x64x512_16x16_16x16_32x8x1_32x8x1_1x16x1x16_4x4x1_1x1_intrawave_v1,20.66,2589.02,0.0
80,8,4608,4096,5,0,10.8626,a8w8_bpreshuffle_256x16x64x512_16x16_16x16_32x8x1_32x8x1_1x16x1x16_4x4x1_1x1_intrawave_v1,27.8,1747.36,0.0
80,8,9216,4096,5,0,15.0571,a8w8_bpreshuffle_256x16x64x512_16x16_16x16_32x8x1_32x8x1_1x16x1x16_4x4x1_1x1_intrawave_v1,40.11,2519.01,0.0
80,16,512,7168,24,0,10.7923,a8w8_bpreshuffle_128x16x32x512_16x16_16x16_32x4x1_32x4x1_1x16x1x8_4x4x1_1x1_intrawave_v2,10.88,352.2,0.0
80,16,576,7168,10,0,11.091,a8w8_bpreshuffle_128x16x32x512_16x16_16x16_32x4x1_32x4x1_1x16x1x8_4x4x1_1x1_intrawave_v1,11.91,384.27,0.0
80,16,1536,7168,10,0,11.2927,a8w8_bpreshuffle_128x16x32x512_16x16_16x16_32x4x1_32x4x1_1x16x1x8_4x4x1_1x1_intrawave_v1,31.2,989.48,0.0
80,16,2112,7168,24,0,11.7534,a8w8_bpreshuffle_128x16x32x512_16x16_16x16_32x4x1_32x4x1_1x16x1x8_4x4x1_1x1_intrawave_v2,41.22,1303.55,0.0
80,16,3072,1536,11,0,5.8974,a8w8_bpreshuffle_256x16x64x512_16x16_16x16_32x8x1_32x8x1_1x16x1x16_4x4x1_1x1_intrawave_v1,25.6,820.95,0.0
80,16,4096,512,9,0,4.939,a8w8_bpreshuffle_128x16x32x128_16x16_16x16_8x16x1_8x16x1_1x16x1x8_4x4x1_1x1_intrawave_v1,13.59,452.81,0.0
80,16,4608,4096,24,0,10.8403,a8w8_bpreshuffle_128x16x32x512_16x16_16x16_32x4x1_32x4x1_1x16x1x8_4x4x1_1x1_intrawave_v2,55.72,1760.78,0.0
80,16,4608,7168,5,0,14.1863,a8w8_bpreshuffle_256x16x64x512_16x16_16x16_32x8x1_32x8x1_1x16x1x16_4x4x1_1x1_intrawave_v1,74.51,2346.79,0.0
80,16,7168,256,75,0,6.629,a8w8_bpreshuffle_128x16x256x64_16x16_16x16_4x16x1_4x32x1_1x16x1x8_8x8x1_1x2_intrawave_v1,8.86,312.03,0.0
80,16,7168,2048,10,0,8.769,a8w8_bpreshuffle_128x16x32x512_16x16_16x16_32x4x1_32x4x1_1x16x1x8_4x4x1_1x1_intrawave_v1,53.57,1703.98,0.0
80,16,7168,2304,15,0,10.491,a8w8_bpreshuffle_256x16x64x256_16x16_16x16_16x16x1_16x16x1_1x16x1x16_4x4x1_1x1_intrawave_v1,50.37,1599.59,0.0
80,16,9216,4096,11,0,15.5867,a8w8_bpreshuffle_256x16x64x512_16x16_16x16_32x8x1_32x8x1_1x16x1x16_4x4x1_1x1_intrawave_v1,77.5,2444.98,0.0
80,32,512,7168,10,0,11.1022,a8w8_bpreshuffle_128x16x32x512_16x16_16x16_32x4x1_32x4x1_1x16x1x8_4x4x1_1x1_intrawave_v1,21.16,354.18,0.0
80,32,576,7168,10,0,11.199,a8w8_bpreshuffle_128x16x32x512_16x16_16x16_32x4x1_32x4x1_1x16x1x8_4x4x1_1x1_intrawave_v1,23.6,392.45,0.0
80,32,1280,8192,24,0,12.4575,a8w8_bpreshuffle_128x16x32x512_16x16_16x16_32x4x1_32x4x1_1x16x1x8_4x4x1_1x1_intrawave_v2,53.87,869.34,0.0
80,32,1536,7168,19,0,12.6967,a8w8_bpreshuffle_256x16x64x512_16x16_16x16_32x8x1_32x8x1_1x16x1x16_4x4x1_1x1_intrawave_v2,55.5,892.97,0.0
80,32,2112,7168,5,0,13.1607,a8w8_bpreshuffle_256x16x64x512_16x16_16x16_32x8x1_32x8x1_1x16x1x16_4x4x1_1x1_intrawave_v1,73.62,1178.0,0.0
80,32,3072,1536,112,0,6.9922,a8w8_bpreshuffle_256x32x64x256_16x16_16x16_16x16x1_16x16x1_1x32x1x8_8x8x1_2x1_intrawave_v1,43.19,709.98,0.0
80,32,4096,512,9,0,4.8822,a8w8_bpreshuffle_128x16x32x128_16x16_16x16_8x16x1_8x16x1_1x16x1x8_4x4x1_1x1_intrawave_v1,27.49,486.6,0.0
80,32,4608,4096,6,0,13.4935,a8w8_bpreshuffle_256x16x128x512_16x16_16x16_32x8x1_32x8x1_1x16x1x16_8x8x1_1x2_intrawave_v1,89.52,1430.34,0.0
80,32,4608,7168,12,0,19.4019,a8w8_bpreshuffle_256x32x64x512_16x16_16x16_32x8x1_32x8x1_1x32x1x8_8x8x1_1x2_intrawave_v1,108.95,1729.44,0.0
80,32,7168,256,75,0,6.8302,a8w8_bpreshuffle_128x16x256x64_16x16_16x16_4x16x1_4x32x1_1x16x1x8_8x8x1_1x2_intrawave_v1,17.19,337.03,0.0
80,32,7168,2048,119,0,11.0711,a8w8_bpreshuffle_256x32x128x256_16x16_16x16_16x16x1_16x16x1_1x16x1x16_8x8x1_1x2_intrawave_v1,84.86,1373.34,0.0
80,32,7168,2304,119,0,11.6614,a8w8_bpreshuffle_256x32x128x256_16x16_16x16_16x16x1_16x16x1_1x16x1x16_8x8x1_1x2_intrawave_v1,90.64,1461.88,0.0
80,32,8192,1024,119,0,7.4863,a8w8_bpreshuffle_256x32x128x256_16x16_16x16_16x16x1_16x16x1_1x16x1x16_8x8x1_1x2_intrawave_v1,71.71,1194.94,0.0
80,32,9216,4096,119,0,18.4783,a8w8_bpreshuffle_256x32x128x256_16x16_16x16_16x16x1_16x16x1_1x16x1x16_8x8x1_1x2_intrawave_v1,130.74,2081.88,0.0
80,48,512,7168,10,0,11.2279,a8w8_bpreshuffle_128x16x32x512_16x16_16x16_32x4x1_32x4x1_1x16x1x8_4x4x1_1x1_intrawave_v1,31.38,361.89,0.0
80,48,2112,7168,10,0,18.4707,a8w8_bpreshuffle_128x16x32x512_16x16_16x16_32x4x1_32x4x1_1x16x1x8_4x4x1_1x1_intrawave_v1,78.68,849.22,0.0
80,48,4096,512,9,0,5.3534,a8w8_bpreshuffle_128x16x32x128_16x16_16x16_8x16x1_8x16x1_1x16x1x8_4x4x1_1x1_intrawave_v1,37.61,469.78,0.0
80,48,4608,7168,113,0,22.5027,a8w8_bpreshuffle_256x48x64x256_16x16_16x16_16x16x1_16x16x1_1x16x1x16_4x4x1_1x1_intrawave_v1,140.91,1502.78,0.0
80,48,7168,256,75,0,7.0126,a8w8_bpreshuffle_128x16x256x64_16x16_16x16_4x16x1_4x32x1_1x16x1x8_8x8x1_1x2_intrawave_v1,25.12,361.55,0.0
80,48,7168,2304,113,0,13.6727,a8w8_bpreshuffle_256x48x64x256_16x16_16x16_16x16x1_16x16x1_1x16x1x16_4x4x1_1x1_intrawave_v1,115.96,1266.3,0.0
80,64,512,7168,10,0,11.1263,a8w8_bpreshuffle_128x16x32x512_16x16_16x16_32x4x1_32x4x1_1x16x1x8_4x4x1_1x1_intrawave_v1,42.22,376.97,0.0
80,64,576,7168,24,0,11.163,a8w8_bpreshuffle_128x16x32x512_16x16_16x16_32x4x1_32x4x1_1x16x1x8_4x4x1_1x1_intrawave_v2,47.34,417.56,0.0
80,64,1280,8192,19,0,13.7807,a8w8_bpreshuffle_256x16x64x512_16x16_16x16_32x8x1_32x8x1_1x16x1x16_4x4x1_1x1_intrawave_v2,97.4,810.84,0.0
80,64,1536,7168,19,0,16.9363,a8w8_bpreshuffle_256x16x64x512_16x16_16x16_32x8x1_32x8x1_1x16x1x16_4x4x1_1x1_intrawave_v2,83.21,688.78,0.0
80,64,2112,7168,112,0,18.9179,a8w8_bpreshuffle_256x32x64x256_16x16_16x16_16x16x1_16x16x1_1x32x1x8_8x8x1_2x1_intrawave_v1,102.43,838.78,0.0
80,64,3072,1536,114,0,9.0146,a8w8_bpreshuffle_256x64x64x256_16x16_16x16_16x16x1_16x16x1_1x32x1x8_8x8x1_2x1_intrawave_v3,67.0,577.96,0.0
80,64,4096,512,77,0,5.8414,a8w8_bpreshuffle_256x64x64x128_16x16_16x16_8x32x1_8x32x1_1x32x1x8_8x8x1_2x1_intrawave_v3,45.95,454.38,0.0
80,64,4608,4096,114,0,16.3715,a8w8_bpreshuffle_256x64x64x256_16x16_16x16_16x16x1_16x16x1_1x32x1x8_8x8x1_2x1_intrawave_v3,147.57,1204.92,0.0
80,64,4608,7168,114,0,24.7999,a8w8_bpreshuffle_256x64x64x256_16x16_16x16_16x16x1_16x16x1_1x32x1x8_8x8x1_2x1_intrawave_v3,170.48,1374.15,0.0
80,64,7168,256,75,0,7.6886,a8w8_bpreshuffle_128x16x256x64_16x16_16x16_4x16x1_4x32x1_1x16x1x8_8x8x1_1x2_intrawave_v1,30.55,360.13,0.0
80,64,7168,2048,112,0,14.2819,a8w8_bpreshuffle_256x32x64x256_16x16_16x16_16x16x1_16x16x1_1x32x1x8_8x8x1_2x1_intrawave_v1,131.57,1101.3,0.0
80,64,7168,2304,112,0,15.5151,a8w8_bpreshuffle_256x32x64x256_16x16_16x16_16x16x1_16x16x1_1x32x1x8_8x8x1_2x1_intrawave_v1,136.25,1133.09,0.0
80,64,8192,1024,114,0,10.9842,a8w8_bpreshuffle_256x64x64x256_16x16_16x16_16x16x1_16x16x1_1x32x1x8_8x8x1_2x1_intrawave_v3,97.75,865.13,0.0
80,64,9216,4096,114,0,25.0703,a8w8_bpreshuffle_256x64x64x256_16x16_16x16_16x16x1_16x16x1_1x32x1x8_8x8x1_2x1_intrawave_v3,192.73,1563.23,0.0
80,80,512,7168,24,0,11.2303,a8w8_bpreshuffle_128x16x32x512_16x16_16x16_32x4x1_32x4x1_1x16x1x8_4x4x1_1x1_intrawave_v2,52.29,385.15,0.0
80,80,2112,7168,113,0,24.3931,a8w8_bpreshuffle_256x48x64x256_16x16_16x16_16x16x1_16x16x1_1x16x1x16_4x4x1_1x1_intrawave_v1,99.3,657.98,0.0
80,80,4096,512,76,0,6.8102,a8w8_bpreshuffle_256x32x64x128_16x16_16x16_8x32x1_8x32x1_1x32x1x8_8x8x1_2x1_intrawave_v1,49.27,410.19,0.0
80,80,4608,7168,115,0,28.9995,a8w8_bpreshuffle_256x80x64x256_16x16_16x16_16x16x1_16x16x1_1x16x1x16_4x4x1_1x1_intrawave_v3,182.24,1184.19,0.0
80,80,7168,256,75,0,8.2998,a8w8_bpreshuffle_128x16x256x64_16x16_16x16_4x16x1_4x32x1_1x16x1x8_8x8x1_1x2_intrawave_v1,35.37,361.74,0.0
80,80,7168,2304,113,0,18.9055,a8w8_bpreshuffle_256x48x64x256_16x16_16x16_16x16x1_16x16x1_1x16x1x16_4x4x1_1x1_intrawave_v1,139.77,943.97,0.0
80,96,512,7168,10,0,11.6635,a8w8_bpreshuffle_128x16x32x512_16x16_16x16_32x4x1_32x4x1_1x16x1x8_4x4x1_1x1_intrawave_v1,60.41,382.08,0.0
80,96,2112,7168,113,0,22.3255,a8w8_bpreshuffle_256x48x64x256_16x16_16x16_16x16x1_16x16x1_1x16x1x16_4x4x1_1x1_intrawave_v1,130.19,727.08,0.0
80,96,4096,512,76,0,6.6322,a8w8_bpreshuffle_256x32x64x128_16x16_16x16_8x32x1_8x32x1_1x32x1x8_8x8x1_2x1_intrawave_v1,60.71,442.2,0.0
80,96,4608,7168,120,0,29.4707,a8w8_bpreshuffle_256x48x128x256_16x16_16x16_16x16x1_16x16x1_1x16x1x16_8x8x1_1x2_intrawave_v1,215.19,1174.15,0.0
80,96,7168,256,75,0,8.6194,a8w8_bpreshuffle_128x16x256x64_16x16_16x16_4x16x1_4x32x1_1x16x1x8_8x8x1_1x2_intrawave_v1,40.88,375.41,0.0
80,96,7168,2304,84,0,19.1495,a8w8_bpreshuffle_256x32x128x128_16x16_16x16_8x32x1_8x32x1_1x32x1x8_8x8x1_2x1_intrawave_v1,165.59,945.85,0.0
80,112,512,7168,10,0,11.9903,a8w8_bpreshuffle_128x16x32x512_16x16_16x16_32x4x1_32x4x1_1x16x1x8_4x4x1_1x1_intrawave_v1,68.56,382.6,0.0
80,112,2112,7168,112,0,25.9619,a8w8_bpreshuffle_256x32x64x256_16x16_16x16_16x16x1_16x16x1_1x32x1x8_8x8x1_2x1_intrawave_v1,130.62,632.26,0.0
80,112,4096,512,76,0,7.3154,a8w8_bpreshuffle_256x32x64x128_16x16_16x16_8x32x1_8x32x1_1x32x1x8_8x8x1_2x1_intrawave_v1,64.22,419.94,0.0
80,112,4608,7168,117,0,37.2568,a8w8_bpreshuffle_256x112x64x256_16x16_16x16_16x16x1_16x16x1_1x16x1x16_4x4x1_1x1_intrawave_v3,198.59,935.81,0.0
80,112,7168,256,75,0,9.207,a8w8_bpreshuffle_128x16x256x64_16x16_16x16_4x16x1_4x32x1_1x16x1x8_8x8x1_1x2_intrawave_v1,44.64,376.81,0.0
80,112,7168,2304,119,0,21.7835,a8w8_bpreshuffle_256x32x128x256_16x16_16x16_16x16x1_16x16x1_1x16x1x16_8x8x1_1x2_intrawave_v1,169.82,843.7,0.0
80,128,512,7168,19,0,12.3367,a8w8_bpreshuffle_256x16x64x512_16x16_16x16_32x8x1_32x8x1_1x16x1x16_4x4x1_1x1_intrawave_v2,76.16,382.48,0.0
80,128,576,7168,25,0,12.3755,a8w8_bpreshuffle_256x16x64x512_16x16_16x16_32x8x1_32x8x1_1x16x1x16_4x4x1_1x1_intrawave_v2,85.41,419.68,0.0
80,128,1280,8192,6,0,20.4871,a8w8_bpreshuffle_256x16x128x512_16x16_16x16_32x8x1_32x8x1_1x16x1x16_8x8x1_1x2_intrawave_v1,131.03,579.0,0.0
80,128,1536,7168,112,0,22.8955,a8w8_bpreshuffle_256x32x64x256_16x16_16x16_16x16x1_16x16x1_1x32x1x8_8x8x1_2x1_intrawave_v1,123.11,538.13,0.0
80,128,2112,7168,114,0,24.5755,a8w8_bpreshuffle_256x64x64x256_16x16_16x16_16x16x1_16x16x1_1x32x1x8_8x8x1_2x1_intrawave_v3,157.7,675.35,0.0
80,128,3072,1536,112,0,11.1838,a8w8_bpreshuffle_256x32x64x256_16x16_16x16_16x16x1_16x16x1_1x32x1x8_8x8x1_2x1_intrawave_v1,108.01,509.81,0.0
80,128,4096,512,76,0,7.2018,a8w8_bpreshuffle_256x32x64x128_16x16_16x16_8x32x1_8x32x1_1x32x1x8_8x8x1_2x1_intrawave_v1,74.55,445.9,0.0
80,128,4608,4096,121,0,24.6387,a8w8_bpreshuffle_256x64x128x256_16x16_16x16_16x16x1_16x16x1_1x16x1x16_8x8x1_1x2_intrawave_v3,196.11,835.2,0.0
80,128,4608,7168,114,0,38.7224,a8w8_bpreshuffle_256x64x64x256_16x16_16x16_16x16x1_16x16x1_1x32x1x8_8x8x1_2x1_intrawave_v3,218.37,907.16,0.0
80,128,7168,256,73,0,10.1406,a8w8_bpreshuffle_256x32x256x64_16x16_16x16_4x32x1_4x64x1_1x32x1x8_8x8x1_2x1_intrawave_v1,46.32,365.14,0.0
80,128,7168,2048,119,0,20.5111,a8w8_bpreshuffle_256x32x128x256_16x16_16x16_16x16x1_16x16x1_1x16x1x16_8x8x1_1x2_intrawave_v1,183.22,817.96,0.0
80,128,7168,2304,84,0,21.9275,a8w8_bpreshuffle_256x32x128x128_16x16_16x16_8x32x1_8x32x1_1x32x1x8_8x8x1_2x1_intrawave_v1,192.81,850.3,0.0
80,128,8192,1024,121,0,14.9703,a8w8_bpreshuffle_256x64x128x256_16x16_16x16_16x16x1_16x16x1_1x16x1x16_8x8x1_1x2_intrawave_v3,143.45,709.19,0.0
80,128,9216,4096,121,0,39.1328,a8w8_bpreshuffle_256x64x128x256_16x16_16x16_16x16x1_16x16x1_1x16x1x16_8x8x1_1x2_intrawave_v3,246.95,1038.32,0.0
80,192,1280,8192,113,0,24.3731,a8w8_bpreshuffle_256x48x64x256_16x16_16x16_16x16x1_16x16x1_1x16x1x16_4x4x1_1x1_intrawave_v1,165.2,514.92,0.0
80,192,8192,1024,85,0,18.7963,a8w8_bpreshuffle_256x64x128x128_16x16_16x16_8x32x1_8x32x1_1x32x1x8_8x8x1_2x1_intrawave_v3,171.38,624.11,0.0
80,256,512,7168,6,0,17.5859,a8w8_bpreshuffle_256x16x128x512_16x16_16x16_32x8x1_32x8x1_1x16x1x16_8x8x1_1x2_intrawave_v1,106.85,327.94,0.0
80,256,576,7168,112,0,18.3779,a8w8_bpreshuffle_256x32x64x256_16x16_16x16_16x16x1_16x16x1_1x32x1x8_8x8x1_2x1_intrawave_v1,115.03,340.56,0.0
80,256,1280,8192,114,0,26.7743,a8w8_bpreshuffle_256x64x64x256_16x16_16x16_16x16x1_16x16x1_1x32x1x8_8x8x1_2x1_intrawave_v3,200.52,494.44,0.0
80,256,1536,7168,120,0,31.1851,a8w8_bpreshuffle_256x48x128x256_16x16_16x16_16x16x1_16x16x1_1x16x1x16_8x8x1_1x2_intrawave_v1,180.76,437.12,0.0
80,256,2112,7168,114,0,37.3908,a8w8_bpreshuffle_256x64x64x256_16x16_16x16_16x16x1_16x16x1_1x32x1x8_8x8x1_2x1_intrawave_v3,207.3,482.88,0.0
80,256,3072,1536,120,0,16.0983,a8w8_bpreshuffle_256x48x128x256_16x16_16x16_16x16x1_16x16x1_1x16x1x16_8x8x1_1x2_intrawave_v1,150.07,415.24,0.0
80,256,4096,512,76,0,10.9814,a8w8_bpreshuffle_256x32x64x128_16x16_16x16_8x32x1_8x32x1_1x32x1x8_8x8x1_2x1_intrawave_v1,97.78,393.88,0.0
80,256,4608,4096,85,0,37.982,a8w8_bpreshuffle_256x64x128x128_16x16_16x16_8x32x1_8x32x1_1x32x1x8_8x8x1_2x1_intrawave_v3,254.43,586.65,0.0
80,256,4608,7168,121,0,62.2609,a8w8_bpreshuffle_256x64x128x256_16x16_16x16_16x16x1_16x16x1_1x16x1x16_8x8x1_1x2_intrawave_v3,271.62,597.88,0.0
80,256,7168,256,73,0,11.5078,a8w8_bpreshuffle_256x32x256x64_16x16_16x16_4x32x1_4x64x1_1x32x1x8_8x8x1_2x1_intrawave_v1,81.64,484.07,0.0
80,256,7168,2048,85,0,30.5235,a8w8_bpreshuffle_256x64x128x128_16x16_16x16_8x32x1_8x32x1_1x32x1x8_8x8x1_2x1_intrawave_v3,246.24,618.36,0.0
80,256,7168,2304,85,0,32.0436,a8w8_bpreshuffle_256x64x128x128_16x16_16x16_8x32x1_8x32x1_1x32x1x8_8x8x1_2x1_intrawave_v3,263.88,648.33,0.0
80,256,8192,1024,70,0,23.9267,a8w8_bpreshuffle_256x128x128x128_16x16_16x16_8x32x1_8x32x1_1x32x1x8_8x8x1_2x1_intrawave_v3,179.51,536.85,0.0
80,256,9216,4096,70,0,64.6741,a8w8_bpreshuffle_256x128x128x128_16x16_16x16_8x32x1_8x32x1_1x32x1x8_8x8x1_2x1_intrawave_v3,298.84,672.85,0.0
80,320,1280,8192,115,0,32.2959,a8w8_bpreshuffle_256x80x64x256_16x16_16x16_16x16x1_16x16x1_1x16x1x16_4x4x1_1x1_intrawave_v3,207.79,431.21,0.0
80,320,8192,1024,85,0,24.7583,a8w8_bpreshuffle_256x64x128x128_16x16_16x16_8x32x1_8x32x1_1x32x1x8_8x8x1_2x1_intrawave_v3,216.84,563.82,0.0
80,512,512,7168,119,0,23.6639,a8w8_bpreshuffle_256x32x128x256_16x16_16x16_16x16x1_16x16x1_1x16x1x16_8x8x1_1x2_intrawave_v1,158.81,332.33,0.0
80,512,576,7168,114,0,23.9199,a8w8_bpreshuffle_256x64x64x256_16x16_16x16_16x16x1_16x16x1_1x32x1x8_8x8x1_2x1_intrawave_v3,176.75,350.7,0.0
80,512,1280,8192,114,0,42.3216,a8w8_bpreshuffle_256x64x64x256_16x16_16x16_16x16x1_16x16x1_1x32x1x8_8x8x1_2x1_intrawave_v3,253.71,377.84,0.0
80,512,1536,7168,128,0,47.65,a8w8_bpreshuffle_256x64x192x256_16x16_16x16_16x16x1_16x16x1_1x32x1x8_8x8x1_2x1_intrawave_v3,236.61,341.09,0.0
80,512,2112,7168,129,0,60.4509,a8w8_bpreshuffle_256x80x192x256_16x16_16x16_16x16x1_16x16x1_1x16x1x16_4x4x1_1x1_intrawave_v3,256.44,346.92,0.0
80,512,3072,1536,85,0,24.3751,a8w8_bpreshuffle_256x64x128x128_16x16_16x16_8x32x1_8x32x1_1x32x1x8_8x8x1_2x1_intrawave_v3,198.23,354.9,0.0
80,512,4096,512,85,0,15.7231,a8w8_bpreshuffle_256x64x128x128_16x16_16x16_8x32x1_8x32x1_1x32x1x8_8x8x1_2x1_intrawave_v3,136.58,416.81,0.0
80,512,4608,7168,70,0,105.5819,a8w8_bpreshuffle_256x128x128x128_16x16_16x16_8x32x1_8x32x1_1x32x1x8_8x8x1_2x1_intrawave_v3,320.35,392.29,0.0
80,512,7168,256,72,0,16.1951,a8w8_bpreshuffle_256x64x256x64_16x16_16x16_4x64x1_4x64x1_1x16x1x16_8x8x1_1x2_intrawave_v1,116.03,574.63,0.0
80,512,7168,2048,71,0,53.438,a8w8_bpreshuffle_256x128x128x64_16x16_16x16_4x64x1_4x64x1_1x32x1x8_8x8x1_2x1_intrawave_v3,281.31,431.69,0.0
80,512,7168,2304,72,0,57.4769,a8w8_bpreshuffle_256x64x256x64_16x16_16x16_4x64x1_4x64x1_1x16x1x16_8x8x1_1x2_intrawave_v1,294.23,435.56,0.0
80,512,8192,1024,85,0,37.882,a8w8_bpreshuffle_256x64x128x128_16x16_16x16_8x32x1_8x32x1_1x32x1x8_8x8x1_2x1_intrawave_v3,226.76,456.72,0.0
80,1024,512,7168,114,0,36.6616,a8w8_bpreshuffle_256x64x64x256_16x16_16x16_16x16x1_16x16x1_1x32x1x8_8x8x1_2x1_intrawave_v3,205.02,328.92,0.0
80,1024,576,7168,114,0,37.1872,a8w8_bpreshuffle_256x64x64x256_16x16_16x16_16x16x1_16x16x1_1x32x1x8_8x8x1_2x1_intrawave_v3,227.38,340.13,0.0
80,1024,1280,8192,85,0,68.1209,a8w8_bpreshuffle_256x64x128x128_16x16_16x16_8x32x1_8x32x1_1x32x1x8_8x8x1_2x1_intrawave_v3,315.25,315.55,0.0
80,1024,1536,7168,136,0,74.0965,a8w8_bpreshuffle_256x80x256x256_16x16_16x16_16x16x1_16x16x1_1x16x1x16_8x8x1_1x2_intrawave_v3,304.31,290.11,0.0
80,1024,2112,7168,93,0,115.8099,a8w8_bpreshuffle_256x64x192x128_16x16_16x16_8x32x1_8x32x1_1x32x1x8_8x8x1_2x1_intrawave_v3,267.72,231.45,0.0
80,1024,3072,1536,85,0,38.8336,a8w8_bpreshuffle_256x64x128x128_16x16_16x16_8x32x1_8x32x1_1x32x1x8_8x8x1_2x1_intrawave_v3,248.85,324.02,0.0
80,1024,4096,512,85,0,24.9039,a8w8_bpreshuffle_256x64x128x128_16x16_16x16_8x32x1_8x32x1_1x32x1x8_8x8x1_2x1_intrawave_v3,172.46,442.1,0.0
80,1024,4608,4096,71,0,120.44,a8w8_bpreshuffle_256x128x128x64_16x16_16x16_4x64x1_4x64x1_1x32x1x8_8x8x1_2x1_intrawave_v3,320.95,269.89,0.0
80,1024,4608,7168,93,0,189.1551,a8w8_bpreshuffle_256x64x192x128_16x16_16x16_8x32x1_8x32x1_1x32x1x8_8x8x1_2x1_intrawave_v3,357.62,263.31,0.0
80,1024,7168,256,71,0,27.7779,a8w8_bpreshuffle_256x128x128x64_16x16_16x16_4x64x1_4x64x1_1x32x1x8_8x8x1_2x1_intrawave_v3,135.29,603.98,0.0
80,1024,7168,2048,71,0,98.0567,a8w8_bpreshuffle_256x128x128x64_16x16_16x16_4x64x1_4x64x1_1x32x1x8_8x8x1_2x1_intrawave_v3,306.61,320.81,0.0
80,1024,7168,2304,85,0,107.3839,a8w8_bpreshuffle_256x64x128x128_16x16_16x16_8x32x1_8x32x1_1x32x1x8_8x8x1_2x1_intrawave_v3,314.97,312.47,0.0
80,1024,8192,1024,71,0,67.0889,a8w8_bpreshuffle_256x128x128x64_16x16_16x16_4x64x1_4x64x1_1x32x1x8_8x8x1_2x1_intrawave_v3,256.08,390.74,0.0
80,1024,9216,4096,93,0,219.0276,a8w8_bpreshuffle_256x64x192x128_16x16_16x16_8x32x1_8x32x1_1x32x1x8_8x8x1_2x1_intrawave_v3,352.97,277.67,0.0
80,1536,512,7168,120,0,48.0728,a8w8_bpreshuffle_256x48x128x256_16x16_16x16_16x16x1_16x16x1_1x16x1x16_8x8x1_1x2_intrawave_v1,234.53,338.09,0.0
80,1536,576,7168,128,0,47.2304,a8w8_bpreshuffle_256x64x192x256_16x16_16x16_16x16x1_16x16x1_1x32x1x8_8x8x1_2x1_intrawave_v3,268.55,358.0,0.0
80,1536,1536,7168,0,0,105.4423,a8w8_bpreshuffle_256x128x128x128_16x16_16x16_8x32x1_8x32x1_1x32x1x8_8x8x1_2x1_intrawave_v3,320.77,253.59,0.0
80,1536,2112,7168,68,0,148.9129,a8w8_bpreshuffle_256x128x192x128_16x16_16x16_8x32x1_8x32x1_1x32x1x8_8x8x1_2x1_intrawave_v3,312.31,219.17,0.0
80,1536,3072,1536,93,0,51.4668,a8w8_bpreshuffle_256x64x192x128_16x16_16x16_8x32x1_8x32x1_1x32x1x8_8x8x1_2x1_intrawave_v3,281.65,320.89,0.0
80,1536,4096,512,85,0,33.2015,a8w8_bpreshuffle_256x64x128x128_16x16_16x16_8x32x1_8x32x1_1x32x1x8_8x8x1_2x1_intrawave_v3,194.04,465.84,0.0
80,1536,4608,7168,85,0,279.9019,a8w8_bpreshuffle_256x64x128x128_16x16_16x16_8x32x1_8x32x1_1x32x1x8_8x8x1_2x1_intrawave_v3,362.51,207.92,0.0
80,1536,7168,256,71,0,37.3284,a8w8_bpreshuffle_256x128x128x64_16x16_16x16_4x64x1_4x64x1_1x32x1x8_8x8x1_2x1_intrawave_v3,151.01,649.59,0.0
80,1536,7168,2048,85,0,138.0452,a8w8_bpreshuffle_256x64x128x128_16x16_16x16_8x32x1_8x32x1_1x32x1x8_8x8x1_2x1_intrawave_v3,326.68,288.64,0.0
80,1536,7168,2304,85,0,150.2725,a8w8_bpreshuffle_256x64x128x128_16x16_16x16_8x32x1_8x32x1_1x32x1x8_8x8x1_2x1_intrawave_v3,337.62,279.99,0.0
80,2048,512,7168,85,0,58.1113,a8w8_bpreshuffle_256x64x128x128_16x16_16x16_8x32x1_8x32x1_1x32x1x8_8x8x1_2x1_intrawave_v3,258.68,351.86,0.0
80,2048,576,7168,129,0,60.7837,a8w8_bpreshuffle_256x80x192x256_16x16_16x16_16x16x1_16x16x1_1x16x1x16_4x4x1_1x1_intrawave_v3,278.22,348.25,0.0
80,2048,1280,8192,0,0,119.2848,a8w8_bpreshuffle_256x128x128x128_16x16_16x16_8x32x1_8x32x1_1x32x1x8_8x8x1_2x1_intrawave_v3,360.06,272.51,0.0
80,2048,1536,7168,85,0,138.8692,a8w8_bpreshuffle_256x64x128x128_16x16_16x16_8x32x1_8x32x1_1x32x1x8_8x8x1_2x1_intrawave_v3,324.75,230.3,0.0
80,2048,2112,7168,93,0,186.5271,a8w8_bpreshuffle_256x64x192x128_16x16_16x16_8x32x1_8x32x1_1x32x1x8_8x8x1_2x1_intrawave_v3,332.44,206.24,0.0
80,2048,3072,1536,72,0,69.8541,a8w8_bpreshuffle_256x64x256x64_16x16_16x16_4x64x1_4x64x1_1x16x1x16_8x8x1_1x2_intrawave_v1,276.68,292.71,0.0
80,2048,4096,512,71,0,43.6672,a8w8_bpreshuffle_256x128x128x64_16x16_16x16_4x64x1_4x64x1_1x32x1x8_8x8x1_2x1_intrawave_v3,196.71,456.25,0.0
80,2048,4608,4096,68,0,218.9032,a8w8_bpreshuffle_256x128x192x128_16x16_16x16_8x32x1_8x32x1_1x32x1x8_8x8x1_2x1_intrawave_v3,353.17,210.77,0.0
80,2048,4608,7168,93,0,366.0791,a8w8_bpreshuffle_256x64x192x128_16x16_16x16_8x32x1_8x32x1_1x32x1x8_8x8x1_2x1_intrawave_v3,369.57,181.89,0.0
80,2048,7168,256,71,0,48.0096,a8w8_bpreshuffle_256x128x128x64_16x16_16x16_4x64x1_4x64x1_1x32x1x8_8x8x1_2x1_intrawave_v3,156.56,660.69,0.0
80,2048,7168,2048,85,0,186.7051,a8w8_bpreshuffle_256x64x128x128_16x16_16x16_8x32x1_8x32x1_1x32x1x8_8x8x1_2x1_intrawave_v3,322.06,258.35,0.0
80,2048,7168,2304,85,0,199.0359,a8w8_bpreshuffle_256x64x128x128_16x16_16x16_8x32x1_8x32x1_1x32x1x8_8x8x1_2x1_intrawave_v3,339.87,254.19,0.0
80,2048,8192,1024,71,0,120.4715,a8w8_bpreshuffle_256x128x128x64_16x16_16x16_4x64x1_4x64x1_1x32x1x8_8x8x1_2x1_intrawave_v3,285.21,365.57,0.0
80,2048,9216,4096,68,0,425.2314,a8w8_bpreshuffle_256x128x192x128_16x16_16x16_8x32x1_8x32x1_1x32x1x8_8x8x1_2x1_intrawave_v3,363.61,197.27,0.0
80,4096,512,7168,85,0,101.7067,a8w8_bpreshuffle_256x64x128x128_16x16_16x16_8x32x1_8x32x1_1x32x1x8_8x8x1_2x1_intrawave_v3,295.6,366.0,0.0
80,4096,576,7168,93,0,113.3711,a8w8_bpreshuffle_256x64x192x128_16x16_16x16_8x32x1_8x32x1_1x32x1x8_8x8x1_2x1_intrawave_v3,298.34,337.01,0.0
80,4096,1280,8192,71,0,234.5689,a8w8_bpreshuffle_256x128x128x64_16x16_16x16_4x64x1_4x64x1_1x32x1x8_8x8x1_2x1_intrawave_v3,366.2,232.45,0.0
80,4096,1536,7168,85,0,256.917,a8w8_bpreshuffle_256x64x128x128_16x16_16x16_8x32x1_8x32x1_1x32x1x8_8x8x1_2x1_intrawave_v3,351.06,206.11,0.0
80,4096,2112,7168,93,0,329.2957,a8w8_bpreshuffle_256x64x192x128_16x16_16x16_8x32x1_8x32x1_1x32x1x8_8x8x1_2x1_intrawave_v3,376.61,187.67,0.0
80,4096,3072,1536,93,0,123.6652,a8w8_bpreshuffle_256x64x192x128_16x16_16x16_8x32x1_8x32x1_1x32x1x8_8x8x1_2x1_intrawave_v3,312.58,292.53,0.0
80,4096,4096,512,71,0,75.7421,a8w8_bpreshuffle_256x128x128x64_16x16_16x16_4x64x1_4x64x1_1x32x1x8_8x8x1_2x1_intrawave_v3,226.82,498.39,0.0
80,4096,4608,4096,85,0,420.6946,a8w8_bpreshuffle_256x64x128x128_16x16_16x16_8x32x1_8x32x1_1x32x1x8_8x8x1_2x1_intrawave_v3,367.53,174.47,0.0
80,4096,4608,7168,85,0,715.7879,a8w8_bpreshuffle_256x64x128x128_16x16_16x16_8x32x1_8x32x1_1x32x1x8_8x8x1_2x1_intrawave_v3,378.02,139.9,0.0
80,4096,7168,256,71,0,85.7258,a8w8_bpreshuffle_256x128x128x64_16x16_16x16_4x64x1_4x64x1_1x32x1x8_8x8x1_2x1_intrawave_v3,175.35,718.61,0.0
80,4096,7168,2048,71,0,345.3094,a8w8_bpreshuffle_256x128x128x64_16x16_16x16_4x64x1_4x64x1_1x32x1x8_8x8x1_2x1_intrawave_v3,348.26,236.86,0.0
80,4096,7168,2304,71,0,379.4759,a8w8_bpreshuffle_256x128x128x64_16x16_16x16_4x64x1_4x64x1_1x32x1x8_8x8x1_2x1_intrawave_v3,356.52,223.13,0.0
80,4096,8192,1024,71,0,227.2969,a8w8_bpreshuffle_256x128x128x64_16x16_16x16_4x64x1_4x64x1_1x32x1x8_8x8x1_2x1_intrawave_v3,302.33,350.61,0.0
80,4096,9216,4096,71,0,812.5832,a8w8_bpreshuffle_256x128x128x64_16x16_16x16_4x64x1_4x64x1_1x32x1x8_8x8x1_2x1_intrawave_v3,380.56,160.01,0.0
80,4240,9216,4096,93,0,903.6056,a8w8_bpreshuffle_256x64x192x128_16x16_16x16_8x32x1_8x32x1_1x32x1x8_8x8x1_2x1_intrawave_v3,354.26,147.48,0.0
80,8192,512,7168,85,0,195.7643,a8w8_bpreshuffle_256x64x128x128_16x16_16x16_8x32x1_8x32x1_1x32x1x8_8x8x1_2x1_intrawave_v3,307.15,361.55,0.0
80,8192,576,7168,93,0,191.4823,a8w8_bpreshuffle_256x64x192x128_16x16_16x16_8x32x1_8x32x1_1x32x1x8_8x8x1_2x1_intrawave_v3,353.27,377.51,0.0
80,8192,1280,8192,71,0,452.4299,a8w8_bpreshuffle_256x128x128x64_16x16_16x16_4x64x1_4x64x1_1x32x1x8_8x8x1_2x1_intrawave_v3,379.72,217.86,0.0
80,8192,1536,7168,72,0,501.1581,a8w8_bpreshuffle_256x64x256x64_16x16_16x16_4x64x1_4x64x1_1x16x1x16_8x8x1_1x2_intrawave_v1,359.94,189.35,0.0
80,8192,2112,7168,68,0,649.3748,a8w8_bpreshuffle_256x128x192x128_16x16_16x16_8x32x1_8x32x1_1x32x1x8_8x8x1_2x1_intrawave_v3,381.96,167.03,0.0
80,8192,3072,1536,71,0,235.4545,a8w8_bpreshuffle_256x128x128x64_16x16_16x16_4x64x1_4x64x1_1x32x1x8_8x8x1_2x1_intrawave_v3,328.34,287.25,0.0
80,8192,4096,512,71,0,140.1016,a8w8_bpreshuffle_256x128x128x64_16x16_16x16_4x64x1_4x64x1_1x32x1x8_8x8x1_2x1_intrawave_v3,245.25,523.91,0.0
80,8192,4608,7168,93,0,1405.0902,a8w8_bpreshuffle_256x64x192x128_16x16_16x16_8x32x1_8x32x1_1x32x1x8_8x8x1_2x1_intrawave_v3,385.15,119.03,0.0
80,8192,7168,256,71,0,158.8437,a8w8_bpreshuffle_256x128x128x64_16x16_16x16_4x64x1_4x64x1_1x32x1x8_8x8x1_2x1_intrawave_v3,189.27,764.1,0.0
80,8192,7168,2048,71,0,665.8308,a8w8_bpreshuffle_256x128x128x64_16x16_16x16_4x64x1_4x64x1_1x32x1x8_8x8x1_2x1_intrawave_v3,361.23,223.63,0.0
80,8192,7168,2304,71,0,736.4592,a8w8_bpreshuffle_256x128x128x64_16x16_16x16_4x64x1_4x64x1_1x32x1x8_8x8x1_2x1_intrawave_v3,367.41,207.52,0.0
80,8192,8192,1024,71,0,434.801,a8w8_bpreshuffle_256x128x128x64_16x16_16x16_4x64x1_4x64x1_1x32x1x8_8x8x1_2x1_intrawave_v3,316.1,347.27,0.0
80,16384,512,7168,85,0,354.1062,a8w8_bpreshuffle_256x64x128x128_16x16_16x16_8x32x1_8x32x1_1x32x1x8_8x8x1_2x1_intrawave_v3,339.61,389.4,0.0
80,16384,576,7168,68,0,372.1747,a8w8_bpreshuffle_256x128x192x128_16x16_16x16_8x32x1_8x32x1_1x32x1x8_8x8x1_2x1_intrawave_v3,363.52,377.36,0.0
80,16384,1280,8192,71,0,902.6619,a8w8_bpreshuffle_256x128x128x64_16x16_16x16_4x64x1_4x64x1_1x32x1x8_8x8x1_2x1_intrawave_v3,380.65,206.77,0.0
80,16384,1536,7168,68,0,940.0969,a8w8_bpreshuffle_256x128x192x128_16x16_16x16_8x32x1_8x32x1_1x32x1x8_8x8x1_2x1_intrawave_v3,383.77,190.17,0.0
80,16384,2112,7168,93,0,1284.8613,a8w8_bpreshuffle_256x64x192x128_16x16_16x16_8x32x1_8x32x1_1x32x1x8_8x8x1_2x1_intrawave_v3,386.09,157.05,0.0
80,16384,3072,1536,71,0,450.9699,a8w8_bpreshuffle_256x128x128x64_16x16_16x16_4x64x1_4x64x1_1x32x1x8_8x8x1_2x1_intrawave_v3,342.86,289.48,0.0
80,16384,4096,512,71,0,268.2002,a8w8_bpreshuffle_256x128x128x64_16x16_16x16_4x64x1_4x64x1_1x32x1x8_8x8x1_2x1_intrawave_v3,256.22,539.54,0.0
80,16384,4608,4096,93,0,1613.6388,a8w8_bpreshuffle_256x64x192x128_16x16_16x16_8x32x1_8x32x1_1x32x1x8_8x8x1_2x1_intrawave_v3,383.28,146.86,0.0
80,16384,4608,7168,93,0,2770.8265,a8w8_bpreshuffle_256x64x192x128_16x16_16x16_8x32x1_8x32x1_1x32x1x8_8x8x1_2x1_intrawave_v3,390.62,108.8,0.0
80,16384,7168,256,71,0,306.2344,a8w8_bpreshuffle_256x128x128x64_16x16_16x16_4x64x1_4x64x1_1x32x1x8_8x8x1_2x1_intrawave_v3,196.35,786.69,0.0
80,16384,7168,2048,71,0,1322.9659,a8w8_bpreshuffle_256x128x128x64_16x16_16x16_4x64x1_4x64x1_1x32x1x8_8x8x1_2x1_intrawave_v3,363.6,214.0,0.0
80,16384,7168,2304,71,0,1464.8949,a8w8_bpreshuffle_256x128x128x64_16x16_16x16_4x64x1_4x64x1_1x32x1x8_8x8x1_2x1_intrawave_v3,369.42,197.38,0.0
80,16384,8192,1024,71,0,849.5169,a8w8_bpreshuffle_256x128x128x64_16x16_16x16_4x64x1_4x64x1_1x32x1x8_8x8x1_2x1_intrawave_v3,323.57,345.61,0.0
80,16384,9216,4096,71,0,3218.0651,a8w8_bpreshuffle_256x128x128x64_16x16_16x16_4x64x1_4x64x1_1x32x1x8_8x8x1_2x1_intrawave_v3,384.38,126.43,0.0
80,20480,512,7168,70,0,411.9813,a8w8_bpreshuffle_256x128x128x128_16x16_16x16_8x32x1_8x32x1_1x32x1x8_8x8x1_2x1_intrawave_v3,364.88,416.14,0.0
80,20480,576,7168,68,0,439.759,a8w8_bpreshuffle_256x128x192x128_16x16_16x16_8x32x1_8x32x1_1x32x1x8_8x8x1_2x1_intrawave_v3,384.56,396.86,0.0
80,20480,1536,7168,93,0,1157.9543,a8w8_bpreshuffle_256x64x192x128_16x16_16x16_8x32x1_8x32x1_1x32x1x8_8x8x1_2x1_intrawave_v3,389.46,190.62,0.0
80,20480,3072,1536,71,0,557.954,a8w8_bpreshuffle_256x128x128x64_16x16_16x16_4x64x1_4x64x1_1x32x1x8_8x8x1_2x1_intrawave_v3,346.4,290.36,0.0
80,20480,4096,512,71,0,331.5621,a8w8_bpreshuffle_256x128x128x64_16x16_16x16_4x64x1_4x64x1_1x32x1x8_8x8x1_2x1_intrawave_v3,259.07,543.96,0.0
80,20480,4608,7168,68,0,3421.2891,a8w8_bpreshuffle_256x128x192x128_16x16_16x16_8x32x1_8x32x1_1x32x1x8_8x8x1_2x1_intrawave_v3,395.44,107.73,0.0
80,20480,7168,256,71,0,381.5807,a8w8_bpreshuffle_256x128x128x64_16x16_16x16_4x64x1_4x64x1_1x32x1x8_8x8x1_2x1_intrawave_v3,196.98,787.98,0.0
80,20480,7168,2048,71,0,1639.9077,a8w8_bpreshuffle_256x128x128x64_16x16_16x16_4x64x1_4x64x1_1x32x1x8_8x8x1_2x1_intrawave_v3,366.66,213.56,0.0
80,20480,7168,2304,71,0,1805.4245,a8w8_bpreshuffle_256x128x128x64_16x16_16x16_4x64x1_4x64x1_1x32x1x8_8x8x1_2x1_intrawave_v3,374.68,197.9,0.0
80,32768,512,7168,70,0,664.7692,a8w8_bpreshuffle_256x128x128x128_16x16_16x16_8x32x1_8x32x1_1x32x1x8_8x8x1_2x1_intrawave_v3,361.81,409.32,0.0
80,32768,2112,7168,93,0,2566.2639,a8w8_bpreshuffle_256x64x192x128_16x16_16x16_8x32x1_8x32x1_1x32x1x8_8x8x1_2x1_intrawave_v3,386.61,151.36,0.0
80,32768,4096,512,71,0,523.3298,a8w8_bpreshuffle_256x128x128x64_16x16_16x16_4x64x1_4x64x1_1x32x1x8_8x8x1_2x1_intrawave_v3,262.62,549.0,0.0
80,32768,4608,4096,93,0,3207.2182,a8w8_bpreshuffle_256x64x192x128_16x16_16x16_8x32x1_8x32x1_1x32x1x8_8x8x1_2x1_intrawave_v3,385.68,141.89,0.0
80,32768,4608,7168,68,0,5527.6346,a8w8_bpreshuffle_256x128x192x128_16x16_16x16_8x32x1_8x32x1_1x32x1x8_8x8x1_2x1_intrawave_v3,391.61,103.1,0.0
80,32768,7168,256,71,0,600.9077,a8w8_bpreshuffle_256x128x128x64_16x16_16x16_4x64x1_4x64x1_1x32x1x8_8x8x1_2x1_intrawave_v3,200.13,798.77,0.0
80,32768,7168,2304,71,0,2907.7206,a8w8_bpreshuffle_256x128x128x64_16x16_16x16_4x64x1_4x64x1_1x32x1x8_8x8x1_2x1_intrawave_v3,372.23,193.2,0.0
80,32768,9216,4096,68,0,6437.3643,a8w8_bpreshuffle_256x128x192x128_16x16_16x16_8x32x1_8x32x1_1x32x1x8_8x8x1_2x1_intrawave_v3,384.3,120.54,0.0
304,1,10240,8192,24,0,0.0123,tuned_cu304,0.0,0.0,0.0
304,1,8192,8192,20,0,0.0114,tuned_cu304,0.0,0.0,0.0
304,1,57344,8192,18,0,0.0495,tuned_cu304,0.0,0.0,0.0
304,1,8192,28672,20,0,0.0268,tuned_cu304,0.0,0.0,0.0
304,7,10240,8192,10,0,0.0121,tuned_cu304,0.0,0.0,0.0
304,7,8192,8192,8,0,0.0115,tuned_cu304,0.0,0.0,0.0
304,7,57344,8192,18,0,0.0498,tuned_cu304,0.0,0.0,0.0
304,7,8192,28672,6,0,0.0261,tuned_cu304,0.0,0.0,0.0
304,16,10240,8192,10,0,0.012,tuned_cu304,0.0,0.0,0.0
304,16,8192,8192,10,0,0.0114,tuned_cu304,0.0,0.0,0.0
304,16,57344,8192,18,0,0.0503,tuned_cu304,0.0,0.0,0.0
304,16,8192,28672,6,0,0.0267,tuned_cu304,0.0,0.0,0.0
304,32,10240,8192,16,0,0.0132,tuned_cu304,0.0,0.0,0.0
304,32,8192,8192,15,0,0.0113,tuned_cu304,0.0,0.0,0.0
304,32,57344,8192,5,0,0.0524,tuned_cu304,0.0,0.0,0.0
304,32,8192,28672,6,0,0.0267,tuned_cu304,0.0,0.0,0.0
304,64,10240,8192,7,0,0.0165,tuned_cu304,0.0,0.0,0.0
304,64,8192,8192,12,0,0.0131,tuned_cu304,0.0,0.0,0.0
304,64,57344,8192,26,0,0.0603,tuned_cu304,0.0,0.0,0.0
304,64,8192,28672,12,0,0.0305,tuned_cu304,0.0,0.0,0.0
304,128,10240,8192,12,0,0.0284,tuned_cu304,0.0,0.0,0.0
304,128,8192,8192,26,0,0.02,tuned_cu304,0.0,0.0,0.0
304,128,57344,8192,0,0,0.0867,tuned_cu304,0.0,0.0,0.0
304,128,8192,28672,12,0,0.0572,tuned_cu304,0.0,0.0,0.0
304,256,10240,8192,0,0,0.0339,tuned_cu304,0.0,0.0,0.0
304,256,8192,8192,0,0,0.0297,tuned_cu304,0.0,0.0,0.0
304,256,57344,8192,0,0,0.1283,tuned_cu304,0.0,0.0,0.0
304,256,8192,28672,0,0,0.0884,tuned_cu304,0.0,0.0,0.0
304,512,10240,8192,4,0,0.0628,tuned_cu304,0.0,0.0,0.0
304,512,8192,8192,0,0,0.0417,tuned_cu304,0.0,0.0,0.0
304,512,57344,8192,0,0,0.23,tuned_cu304,0.0,0.0,0.0
304,512,8192,28672,0,0,0.1091,tuned_cu304,0.0,0.0,0.0
304,1,1024,8192,10,0,10.3671,a8w8_bpreshuffle_128x16x32x512_16x16_16x16_32x4x1_32x4x1_1x16x1x8_4x4x1_1x1_intrawave_v1,1.62,810.14,0.0
304,2,1024,8192,10,0,10.5311,a8w8_bpreshuffle_128x16x32x512_16x16_16x16_32x4x1_32x4x1_1x16x1x8_4x4x1_1x1_intrawave_v1,3.19,798.5,0.0
304,4,1024,8192,10,0,10.4491,a8w8_bpreshuffle_128x16x32x512_16x16_16x16_32x4x1_32x4x1_1x16x1x8_4x4x1_1x1_intrawave_v1,6.42,806.73,0.0
304,8,1024,8192,10,0,10.8043,a8w8_bpreshuffle_128x16x32x512_16x16_16x16_32x4x1_32x4x1_1x16x1x8_4x4x1_1x1_intrawave_v1,12.42,784.0,0.0
304,16,1024,8192,10,0,9.987,a8w8_bpreshuffle_128x16x32x512_16x16_16x16_32x4x1_32x4x1_1x16x1x8_4x4x1_1x1_intrawave_v1,26.88,856.36,0.0
304,32,1024,8192,10,0,10.0482,a8w8_bpreshuffle_128x16x32x512_16x16_16x16_32x4x1_32x4x1_1x16x1x8_4x4x1_1x1_intrawave_v1,53.43,867.45,0.0
304,64,1024,8192,10,0,10.2391,a8w8_bpreshuffle_128x16x32x512_16x16_16x16_32x4x1_32x4x1_1x16x1x8_4x4x1_1x1_intrawave_v1,104.87,883.28,0.0
304,128,1024,8192,11,0,10.6933,a8w8_bpreshuffle_256x16x64x512_16x16_16x16_32x8x1_32x8x1_1x16x1x16_4x4x1_1x1_intrawave_v1,200.83,907.05,0.0
304,256,1024,8192,5,0,14.9298,a8w8_bpreshuffle_256x16x64x512_16x16_16x16_32x8x1_32x8x1_1x16x1x16_4x4x1_1x1_intrawave_v1,287.68,737.45,0.0
304,512,1024,8192,112,0,21.5583,a8w8_bpreshuffle_256x32x64x256_16x16_16x16_16x16x1_16x16x1_1x32x1x8_8x8x1_2x1_intrawave_v1,398.45,632.31,0.0
304,1,28672,8192,23,0,58.3171,a8w8_bpreshuffle_128x16x32x128_16x16_16x16_8x16x1_8x16x1_1x16x1x8_4x4x1_1x1_intrawave_v2,8.06,4028.78,0.0
304,2,28672,8192,110,0,59.4337,a8w8_bpreshuffle_256x16x256x256_16x16_16x16_16x16x1_16x16x1_1x16x1x16_8x8x1_1x2_intrawave_v1,15.81,3954.19,0.0
304,4,28672,8192,17,0,59.7118,a8w8_bpreshuffle_256x16x256x256_16x16_16x16_16x16x1_16x16x1_1x16x1x16_8x8x1_1x2_intrawave_v1,31.47,3937.97,0.0
304,8,28672,8192,10,0,59.653,a8w8_bpreshuffle_128x16x32x512_16x16_16x16_32x4x1_32x4x1_1x16x1x8_4x4x1_1x1_intrawave_v1,63.0,3946.24,0.0
304,16,28672,8192,110,0,60.5233,a8w8_bpreshuffle_256x16x256x256_16x16_16x16_16x16x1_16x16x1_1x16x1x16_8x8x1_1x2_intrawave_v1,124.19,3898.16,0.0
304,32,28672,8192,133,0,64.9751,a8w8_bpreshuffle_256x32x256x256_16x16_16x16_16x16x1_16x16x1_1x16x1x16_8x8x1_1x2_intrawave_v1,231.36,3647.22,0.0
304,64,28672,8192,133,0,75.4499,a8w8_bpreshuffle_256x32x256x256_16x16_16x16_16x16x1_16x16x1_1x16x1x16_8x8x1_1x2_intrawave_v1,398.47,3168.66,0.0
304,128,28672,8192,135,0,98.6737,a8w8_bpreshuffle_256x64x256x256_16x16_16x16_16x16x1_16x16x1_1x16x1x16_8x8x1_1x2_intrawave_v3,609.38,2465.39,0.0
304,256,28672,8192,103,0,150.7906,a8w8_bpreshuffle_256x128x256x128_16x16_16x16_8x32x1_8x32x1_1x16x1x16_4x4x1_1x1_intrawave_v3,797.52,1668.93,0.0
304,512,28672,8192,0,0,254.4487,a8w8_bpreshuffle_256x128x128x128_16x16_16x16_8x32x1_8x32x1_1x32x1x8_8x8x1_2x1_intrawave_v3,945.25,1054.97,0.0
304,768,10240,8192,138,0,145.0517,a8w8_bpreshuffle_256x112x256x256_16x16_16x16_16x16x1_16x16x1_1x16x1x16_8x8x1_1x2_intrawave_v3,888.3,730.13,0.0
304,1024,10240,8192,156,0,192.4031,a8w8_bpreshuffle_256x160x256x128_16x16_16x16_8x32x1_8x32x1_1x16x1x16_8x8x1_1x2_intrawave_v3,892.91,588.59,0.0
304,2048,10240,8192,102,0,351.8727,a8w8_bpreshuffle_256x96x256x128_16x16_16x16_8x32x1_8x32x1_1x32x1x8_8x8x1_2x1_intrawave_v3,976.48,405.28,0.0
304,768,8192,8192,143,0,116.6758,a8w8_bpreshuffle_256x192x128x128_16x16_16x16_8x32x1_8x32x1_1x16x1x16_8x8x1_1x2_intrawave_v3,883.47,736.94,0.0
304,1024,8192,8192,103,0,147.6772,a8w8_bpreshuffle_256x128x256x128_16x16_16x16_8x32x1_8x32x1_1x16x1x16_4x4x1_1x1_intrawave_v3,930.67,624.84,0.0
304,2048,8192,8192,154,0,281.1307,a8w8_bpreshuffle_256x128x256x256_16x16_16x16_16x16x1_16x16x1_1x16x1x16_8x8x1_1x2_intrawave_v3,977.76,417.74,0.0
304,768,57344,8192,158,0,697.9508,a8w8_bpreshuffle_256x192x256x128_16x16_16x16_8x32x1_8x32x1_1x16x1x16_8x8x1_1x2_intrawave_v3,1033.82,808.27,0.0
304,1024,57344,8192,33,0,932.7051,a8w8_bpreshuffle_256x256x256x128_16x16_16x16_8x32x1_8x32x1_1x32x1x8_8x8x1_2x1_intrawave_v3,1031.49,638.56,0.0
304,2048,57344,8192,33,0,1819.5305,a8w8_bpreshuffle_256x256x256x128_16x16_16x16_8x32x1_8x32x1_1x32x1x8_8x8x1_2x1_intrawave_v3,1057.5,396.49,0.0
304,768,8192,28672,137,0,378.2106,a8w8_bpreshuffle_256x96x256x256_16x16_16x16_16x16x1_16x16x1_1x16x1x16_8x8x1_1x2_intrawave_v3,953.91,712.52,0.0
304,1024,8192,28672,154,0,467.5714,a8w8_bpreshuffle_256x128x256x256_16x16_16x16_16x16x1_16x16x1_1x16x1x16_8x8x1_1x2_intrawave_v3,1028.8,601.02,0.0
304,2048,8192,28672,33,0,910.3523,a8w8_bpreshuffle_256x256x256x128_16x16_16x16_8x32x1_8x32x1_1x32x1x8_8x8x1_2x1_intrawave_v3,1056.81,359.37,0.0
256,1,10240,8192,24,0,0.0123,tuned_cu304,0.0,0.0,0.0
256,1,8192,8192,20,0,0.0114,tuned_cu304,0.0,0.0,0.0
256,1,57344,8192,18,0,0.0495,tuned_cu304,0.0,0.0,0.0
256,1,8192,28672,20,0,0.0268,tuned_cu304,0.0,0.0,0.0
256,7,10240,8192,10,0,0.0121,tuned_cu304,0.0,0.0,0.0
256,7,8192,8192,8,0,0.0115,tuned_cu304,0.0,0.0,0.0
256,7,57344,8192,18,0,0.0498,tuned_cu304,0.0,0.0,0.0
256,7,8192,28672,6,0,0.0261,tuned_cu304,0.0,0.0,0.0
256,16,10240,8192,10,0,0.012,tuned_cu304,0.0,0.0,0.0
256,16,8192,8192,10,0,0.0114,tuned_cu304,0.0,0.0,0.0
256,16,57344,8192,18,0,0.0503,tuned_cu304,0.0,0.0,0.0
256,16,8192,28672,6,0,0.0267,tuned_cu304,0.0,0.0,0.0
256,32,10240,8192,16,0,0.0132,tuned_cu304,0.0,0.0,0.0
256,32,8192,8192,15,0,0.0113,tuned_cu304,0.0,0.0,0.0
256,32,57344,8192,5,0,0.0524,tuned_cu304,0.0,0.0,0.0
256,32,8192,28672,6,0,0.0267,tuned_cu304,0.0,0.0,0.0
256,64,10240,8192,7,0,0.0165,tuned_cu304,0.0,0.0,0.0
256,64,8192,8192,12,0,0.0131,tuned_cu304,0.0,0.0,0.0
256,64,57344,8192,26,0,0.0603,tuned_cu304,0.0,0.0,0.0
256,64,8192,28672,12,0,0.0305,tuned_cu304,0.0,0.0,0.0
256,128,10240,8192,12,0,0.0284,tuned_cu304,0.0,0.0,0.0
256,128,8192,8192,26,0,0.02,tuned_cu304,0.0,0.0,0.0
256,128,57344,8192,0,0,0.0867,tuned_cu304,0.0,0.0,0.0
256,128,8192,28672,12,0,0.0572,tuned_cu304,0.0,0.0,0.0
256,256,10240,8192,0,0,0.0339,tuned_cu304,0.0,0.0,0.0
256,256,8192,8192,0,0,0.0297,tuned_cu304,0.0,0.0,0.0
256,256,57344,8192,0,0,0.1283,tuned_cu304,0.0,0.0,0.0
256,256,8192,28672,0,0,0.0884,tuned_cu304,0.0,0.0,0.0
256,512,10240,8192,4,0,0.0628,tuned_cu304,0.0,0.0,0.0
256,512,8192,8192,0,0,0.0417,tuned_cu304,0.0,0.0,0.0
256,512,57344,8192,0,0,0.23,tuned_cu304,0.0,0.0,0.0
256,512,8192,28672,0,0,0.1091,tuned_cu304,0.0,0.0,0.0
256,1,1024,8192,10,0,10.3671,a8w8_bpreshuffle_128x16x32x512_16x16_16x16_32x4x1_32x4x1_1x16x1x8_4x4x1_1x1_intrawave_v1,1.62,810.14,0.0
256,2,1024,8192,10,0,10.5311,a8w8_bpreshuffle_128x16x32x512_16x16_16x16_32x4x1_32x4x1_1x16x1x8_4x4x1_1x1_intrawave_v1,3.19,798.5,0.0
256,4,1024,8192,10,0,10.4491,a8w8_bpreshuffle_128x16x32x512_16x16_16x16_32x4x1_32x4x1_1x16x1x8_4x4x1_1x1_intrawave_v1,6.42,806.73,0.0
256,8,1024,8192,10,0,10.8043,a8w8_bpreshuffle_128x16x32x512_16x16_16x16_32x4x1_32x4x1_1x16x1x8_4x4x1_1x1_intrawave_v1,12.42,784.0,0.0
256,16,1024,8192,10,0,9.987,a8w8_bpreshuffle_128x16x32x512_16x16_16x16_32x4x1_32x4x1_1x16x1x8_4x4x1_1x1_intrawave_v1,26.88,856.36,0.0
256,32,1024,8192,10,0,10.0482,a8w8_bpreshuffle_128x16x32x512_16x16_16x16_32x4x1_32x4x1_1x16x1x8_4x4x1_1x1_intrawave_v1,53.43,867.45,0.0
256,64,1024,8192,10,0,10.2391,a8w8_bpreshuffle_128x16x32x512_16x16_16x16_32x4x1_32x4x1_1x16x1x8_4x4x1_1x1_intrawave_v1,104.87,883.28,0.0
256,128,1024,8192,11,0,10.6933,a8w8_bpreshuffle_256x16x64x512_16x16_16x16_32x8x1_32x8x1_1x16x1x16_4x4x1_1x1_intrawave_v1,200.83,907.05,0.0
256,256,1024,8192,5,0,14.9298,a8w8_bpreshuffle_256x16x64x512_16x16_16x16_32x8x1_32x8x1_1x16x1x16_4x4x1_1x1_intrawave_v1,287.68,737.45,0.0
256,512,1024,8192,112,0,21.5583,a8w8_bpreshuffle_256x32x64x256_16x16_16x16_16x16x1_16x16x1_1x32x1x8_8x8x1_2x1_intrawave_v1,398.45,632.31,0.0
256,1,28672,8192,23,0,58.3171,a8w8_bpreshuffle_128x16x32x128_16x16_16x16_8x16x1_8x16x1_1x16x1x8_4x4x1_1x1_intrawave_v2,8.06,4028.78,0.0
256,2,28672,8192,110,0,59.4337,a8w8_bpreshuffle_256x16x256x256_16x16_16x16_16x16x1_16x16x1_1x16x1x16_8x8x1_1x2_intrawave_v1,15.81,3954.19,0.0
256,4,28672,8192,17,0,59.7118,a8w8_bpreshuffle_256x16x256x256_16x16_16x16_16x16x1_16x16x1_1x16x1x16_8x8x1_1x2_intrawave_v1,31.47,3937.97,0.0
256,8,28672,8192,10,0,59.653,a8w8_bpreshuffle_128x16x32x512_16x16_16x16_32x4x1_32x4x1_1x16x1x8_4x4x1_1x1_intrawave_v1,63.0,3946.24,0.0
256,16,28672,8192,110,0,60.5233,a8w8_bpreshuffle_256x16x256x256_16x16_16x16_16x16x1_16x16x1_1x16x1x16_8x8x1_1x2_intrawave_v1,124.19,3898.16,0.0
256,32,28672,8192,133,0,64.9751,a8w8_bpreshuffle_256x32x256x256_16x16_16x16_16x16x1_16x16x1_1x16x1x16_8x8x1_1x2_intrawave_v1,231.36,3647.22,0.0
256,64,28672,8192,133,0,75.4499,a8w8_bpreshuffle_256x32x256x256_16x16_16x16_16x16x1_16x16x1_1x16x1x16_8x8x1_1x2_intrawave_v1,398.47,3168.66,0.0
256,128,28672,8192,135,0,98.6737,a8w8_bpreshuffle_256x64x256x256_16x16_16x16_16x16x1_16x16x1_1x16x1x16_8x8x1_1x2_intrawave_v3,609.38,2465.39,0.0
256,256,28672,8192,103,0,150.7906,a8w8_bpreshuffle_256x128x256x128_16x16_16x16_8x32x1_8x32x1_1x16x1x16_4x4x1_1x1_intrawave_v3,797.52,1668.93,0.0
256,512,28672,8192,0,0,254.4487,a8w8_bpreshuffle_256x128x128x128_16x16_16x16_8x32x1_8x32x1_1x32x1x8_8x8x1_2x1_intrawave_v3,945.25,1054.97,0.0
256,768,10240,8192,138,0,145.0517,a8w8_bpreshuffle_256x112x256x256_16x16_16x16_16x16x1_16x16x1_1x16x1x16_8x8x1_1x2_intrawave_v3,888.3,730.13,0.0
256,1024,10240,8192,156,0,192.4031,a8w8_bpreshuffle_256x160x256x128_16x16_16x16_8x32x1_8x32x1_1x16x1x16_8x8x1_1x2_intrawave_v3,892.91,588.59,0.0
256,2048,10240,8192,102,0,351.8727,a8w8_bpreshuffle_256x96x256x128_16x16_16x16_8x32x1_8x32x1_1x32x1x8_8x8x1_2x1_intrawave_v3,976.48,405.28,0.0
256,768,8192,8192,143,0,116.6758,a8w8_bpreshuffle_256x192x128x128_16x16_16x16_8x32x1_8x32x1_1x16x1x16_8x8x1_1x2_intrawave_v3,883.47,736.94,0.0
256,1024,8192,8192,103,0,147.6772,a8w8_bpreshuffle_256x128x256x128_16x16_16x16_8x32x1_8x32x1_1x16x1x16_4x4x1_1x1_intrawave_v3,930.67,624.84,0.0
256,2048,8192,8192,154,0,281.1307,a8w8_bpreshuffle_256x128x256x256_16x16_16x16_16x16x1_16x16x1_1x16x1x16_8x8x1_1x2_intrawave_v3,977.76,417.74,0.0
256,768,57344,8192,158,0,697.9508,a8w8_bpreshuffle_256x192x256x128_16x16_16x16_8x32x1_8x32x1_1x16x1x16_8x8x1_1x2_intrawave_v3,1033.82,808.27,0.0
256,1024,57344,8192,33,0,932.7051,a8w8_bpreshuffle_256x256x256x128_16x16_16x16_8x32x1_8x32x1_1x32x1x8_8x8x1_2x1_intrawave_v3,1031.49,638.56,0.0
256,2048,57344,8192,33,0,1819.5305,a8w8_bpreshuffle_256x256x256x128_16x16_16x16_8x32x1_8x32x1_1x32x1x8_8x8x1_2x1_intrawave_v3,1057.5,396.49,0.0
256,768,8192,28672,137,0,378.2106,a8w8_bpreshuffle_256x96x256x256_16x16_16x16_16x16x1_16x16x1_1x16x1x16_8x8x1_1x2_intrawave_v3,953.91,712.52,0.0
256,1024,8192,28672,154,0,467.5714,a8w8_bpreshuffle_256x128x256x256_16x16_16x16_16x16x1_16x16x1_1x16x1x16_8x8x1_1x2_intrawave_v3,1028.8,601.02,0.0
256,2048,8192,28672,33,0,910.3523,a8w8_bpreshuffle_256x256x256x128_16x16_16x16_8x32x1_8x32x1_1x32x1x8_8x8x1_2x1_intrawave_v3,1056.81,359.37,0.0
256,1,1280,8192,10,0,13.5025,a8w8_bpreshuffle_128x16x32x512_16x16_16x16_32x4x1_32x4x1_1x16x1x8_4x4x1_1x1_intrawave_v1,1.55,777.38,0.0
256,1,8192,1024,108,0,5.7449,a8w8_bpreshuffle_256x16x64x256_16x16_16x16_16x16x1_16x16x1_1x16x1x16_4x4x1_1x1_intrawave_v1,2.92,1463.21,0.0
256,1,8192,4096,10,0,10.2001,a8w8_bpreshuffle_128x16x32x512_16x16_16x16_32x4x1_32x4x1_1x16x1x8_4x4x1_1x1_intrawave_v1,6.58,3291.63,0.0
256,7,1280,8192,10,0,13.6262,a8w8_bpreshuffle_128x16x32x512_16x16_16x16_32x4x1_32x4x1_1x16x1x8_4x4x1_1x1_intrawave_v1,10.77,775.05,0.0
256,7,8192,1024,15,0,6.1612,a8w8_bpreshuffle_256x16x64x256_16x16_16x16_16x16x1_16x16x1_1x16x1x16_4x4x1_1x1_intrawave_v1,19.06,1381.3,0.0
256,7,8192,4096,24,0,10.4216,a8w8_bpreshuffle_128x16x32x512_16x16_16x16_32x4x1_32x4x1_1x16x1x8_4x4x1_1x1_intrawave_v2,45.08,3233.46,0.0
256,16,1280,8192,10,0,12.0494,a8w8_bpreshuffle_128x16x32x512_16x16_16x16_32x4x1_32x4x1_1x16x1x8_4x4x1_1x1_intrawave_v1,27.85,884.51,0.0
256,16,8192,1024,108,0,6.1344,a8w8_bpreshuffle_256x16x64x256_16x16_16x16_16x16x1_16x16x1_1x16x1x16_4x4x1_1x1_intrawave_v1,43.76,1412.87,0.0
256,16,8192,4096,10,0,9.3236,a8w8_bpreshuffle_128x16x32x512_16x16_16x16_32x4x1_32x4x1_1x16x1x8_4x4x1_1x1_intrawave_v1,115.16,3634.02,0.0
256,32,1280,8192,8,0,12.2981,a8w8_bpreshuffle_128x32x16x512_16x16_16x16_32x4x1_32x4x1_1x32x1x4_4x4x1_1x1_intrawave_v1,54.57,880.61,0.0
256,32,8192,1024,108,0,6.3645,a8w8_bpreshuffle_256x16x64x256_16x16_16x16_16x16x1_16x16x1_1x16x1x16_4x4x1_1x1_intrawave_v1,84.35,1405.56,0.0
256,32,8192,4096,25,0,11.2049,a8w8_bpreshuffle_256x16x64x512_16x16_16x16_32x8x1_32x8x1_1x16x1x16_4x4x1_1x1_intrawave_v2,191.66,3053.11,0.0
256,64,1280,8192,10,0,12.5135,a8w8_bpreshuffle_128x16x32x512_16x16_16x16_32x4x1_32x4x1_1x16x1x8_4x4x1_1x1_intrawave_v1,107.26,892.95,0.0
256,64,8192,1024,118,0,6.5434,a8w8_bpreshuffle_256x16x128x256_16x16_16x16_16x16x1_16x16x1_1x16x1x16_8x8x1_1x2_intrawave_v1,164.1,1452.26,0.0
256,64,8192,4096,12,0,12.7091,a8w8_bpreshuffle_256x32x64x512_16x16_16x16_32x8x1_32x8x1_1x32x1x8_8x8x1_1x2_intrawave_v1,337.94,2743.32,0.0
256,128,1280,8192,11,0,13.1289,a8w8_bpreshuffle_256x16x64x512_16x16_16x16_32x8x1_32x8x1_1x16x1x16_4x4x1_1x1_intrawave_v1,204.46,903.5,0.0
256,128,8192,1024,119,0,7.0907,a8w8_bpreshuffle_256x32x128x256_16x16_16x16_16x16x1_16x16x1_1x16x1x16_8x8x1_1x2_intrawave_v1,302.86,1497.29,0.0
256,128,8192,4096,114,0,14.8833,a8w8_bpreshuffle_256x64x64x256_16x16_16x16_16x16x1_16x16x1_1x32x1x8_8x8x1_2x1_intrawave_v3,577.15,2430.64,0.0
256,256,1280,8192,12,0,18.0026,a8w8_bpreshuffle_256x32x64x512_16x16_16x16_32x8x1_32x8x1_1x32x1x8_8x8x1_1x2_intrawave_v1,298.22,735.35,0.0
256,256,8192,1024,116,0,9.9848,a8w8_bpreshuffle_256x96x64x256_16x16_16x16_16x16x1_16x16x1_1x32x1x8_8x8x1_2x1_intrawave_v3,430.15,1286.46,0.0
256,256,8192,4096,65,0,18.7636,a8w8_bpreshuffle_256x128x64x256_16x16_16x16_16x16x1_16x16x1_1x32x1x8_8x8x1_2x1_intrawave_v3,915.6,2067.69,0.0
256,512,1280,8192,114,0,21.7627,a8w8_bpreshuffle_256x64x64x256_16x16_16x16_16x16x1_16x16x1_1x32x1x8_8x8x1_2x1_intrawave_v3,493.39,734.78,0.0
256,512,8192,1024,62,0,12.6764,a8w8_bpreshuffle_256x128x64x128_16x16_16x16_8x32x1_8x32x1_1x32x1x8_8x8x1_2x1_intrawave_v3,677.63,1364.86,0.0
256,512,8192,4096,139,0,28.1932,a8w8_bpreshuffle_256x128x128x256_16x16_16x16_16x16x1_16x16x1_1x16x1x16_8x8x1_1x2_intrawave_v3,1218.72,1562.09,0.0
256,1024,1280,8192,120,0,30.4345,a8w8_bpreshuffle_256x48x128x256_16x16_16x16_16x16x1_16x16x1_1x16x1x16_8x8x1_1x2_intrawave_v1,705.61,706.3,0.0
256,1024,8192,1024,70,0,20.3519,a8w8_bpreshuffle_256x128x128x128_16x16_16x16_8x32x1_8x32x1_1x32x1x8_8x8x1_2x1_intrawave_v3,844.14,1288.06,0.0
256,1024,8192,4096,154,0,48.2399,a8w8_bpreshuffle_256x128x256x256_16x16_16x16_16x16x1_16x16x1_1x16x1x16_8x8x1_1x2_intrawave_v3,1424.54,1130.31,0.0
256,2,1280,8192,10,0,13.5878,a8w8_bpreshuffle_128x16x32x512_16x16_16x16_32x4x1_32x4x1_1x16x1x8_4x4x1_1x1_intrawave_v1,3.09,773.29,0.0
256,2,8192,1024,108,0,6.2032,a8w8_bpreshuffle_256x16x64x256_16x16_16x16_16x16x1_16x16x1_1x16x1x16_4x4x1_1x1_intrawave_v1,5.41,1357.92,0.0
256,2,8192,4096,24,0,9.703,a8w8_bpreshuffle_128x16x32x512_16x16_16x16_32x4x1_32x4x1_1x16x1x8_4x4x1_1x1_intrawave_v2,13.83,3462.37,0.0
256,4,1280,8192,10,0,13.747,a8w8_bpreshuffle_128x16x32x512_16x16_16x16_32x4x1_32x4x1_1x16x1x8_4x4x1_1x1_intrawave_v1,6.1,765.9,0.0
256,4,8192,1024,108,0,5.6537,a8w8_bpreshuffle_256x16x64x256_16x16_16x16_16x16x1_16x16x1_1x16x1x16_4x4x1_1x1_intrawave_v1,11.87,1496.05,0.0
256,4,8192,4096,10,0,10.2027,a8w8_bpreshuffle_128x16x32x512_16x16_16x16_32x4x1_32x4x1_1x16x1x8_4x4x1_1x1_intrawave_v1,26.31,3296.81,0.0
256,8,1280,8192,10,0,13.8584,a8w8_bpreshuffle_128x16x32x512_16x16_16x16_32x4x1_32x4x1_1x16x1x8_4x4x1_1x1_intrawave_v1,12.11,762.84,0.0
256,8,8192,1024,15,0,6.2315,a8w8_bpreshuffle_256x16x64x256_16x16_16x16_16x16x1_16x16x1_1x16x1x16_4x4x1_1x1_intrawave_v1,21.54,1368.51,0.0
256,8,8192,4096,10,0,10.8647,a8w8_bpreshuffle_128x16x32x512_16x16_16x16_32x4x1_32x4x1_1x16x1x8_4x4x1_1x1_intrawave_v1,49.41,3103.47,0.0
256,12,1280,8192,10,0,13.8162,a8w8_bpreshuffle_128x16x32x512_16x16_16x16_32x4x1_32x4x1_1x16x1x8_4x4x1_1x1_intrawave_v1,18.21,768.29,0.0
256,12,8192,1024,15,0,6.2371,a8w8_bpreshuffle_256x16x64x256_16x16_16x16_16x16x1_16x16x1_1x16x1x16_4x4x1_1x1_intrawave_v1,32.28,1378.45,0.0
256,12,8192,4096,10,0,10.0495,a8w8_bpreshuffle_128x16x32x512_16x16_16x16_32x4x1_32x4x1_1x16x1x8_4x4x1_1x1_intrawave_v1,80.13,3363.37,0.0
256,24,1280,8192,10,0,13.7723,a8w8_bpreshuffle_128x16x32x512_16x16_16x16_32x4x1_32x4x1_1x16x1x8_4x4x1_1x1_intrawave_v1,36.55,780.1,0.0
256,24,8192,1024,108,0,5.8196,a8w8_bpreshuffle_256x16x64x256_16x16_16x16_16x16x1_16x16x1_1x16x1x16_4x4x1_1x1_intrawave_v1,69.19,1513.23,0.0
256,24,8192,4096,11,0,11.2844,a8w8_bpreshuffle_256x16x64x512_16x16_16x16_32x8x1_32x8x1_1x16x1x16_4x4x1_1x1_intrawave_v1,142.73,3017.08,0.0
256,40,1280,8192,10,0,13.5957,a8w8_bpreshuffle_128x16x32x512_16x16_16x16_32x4x1_32x4x1_1x16x1x8_4x4x1_1x1_intrawave_v1,61.7,802.89,0.0
256,40,8192,1024,15,0,5.9974,a8w8_bpreshuffle_256x16x64x256_16x16_16x16_16x16x1_16x16x1_1x16x1x16_4x4x1_1x1_intrawave_v1,111.9,1514.81,0.0
256,40,8192,4096,12,0,12.5304,a8w8_bpreshuffle_256x32x64x512_16x16_16x16_32x8x1_32x8x1_1x32x1x8_8x8x1_1x2_intrawave_v1,214.23,2743.22,0.0
256,48,1280,8192,24,0,12.8083,a8w8_bpreshuffle_128x16x32x512_16x16_16x16_32x4x1_32x4x1_1x16x1x8_4x4x1_1x1_intrawave_v2,78.59,858.96,0.0
256,48,8192,1024,15,0,6.7324,a8w8_bpreshuffle_256x16x64x256_16x16_16x16_16x16x1_16x16x1_1x16x1x16_4x4x1_1x1_intrawave_v1,119.62,1370.12,0.0
256,48,8192,4096,12,0,12.7082,a8w8_bpreshuffle_256x32x64x512_16x16_16x16_32x8x1_32x8x1_1x32x1x8_8x8x1_1x2_intrawave_v1,253.48,2717.73,0.0
256,56,1280,8192,10,0,13.6075,a8w8_bpreshuffle_128x16x32x512_16x16_16x16_32x4x1_32x4x1_1x16x1x8_4x4x1_1x1_intrawave_v1,86.31,814.84,0.0
256,56,8192,1024,15,0,6.0808,a8w8_bpreshuffle_256x16x64x256_16x16_16x16_16x16x1_16x16x1_1x16x1x16_4x4x1_1x1_intrawave_v1,154.51,1539.84,0.0
256,56,8192,4096,12,0,12.7953,a8w8_bpreshuffle_256x32x64x512_16x16_16x16_32x8x1_32x8x1_1x32x1x8_8x8x1_1x2_intrawave_v1,293.71,2712.04,0.0
256,72,1280,8192,10,0,13.5452,a8w8_bpreshuffle_128x16x32x512_16x16_16x16_32x4x1_32x4x1_1x16x1x8_4x4x1_1x1_intrawave_v1,111.47,831.28,0.0
256,72,8192,1024,113,0,6.7665,a8w8_bpreshuffle_256x48x64x256_16x16_16x16_16x16x1_16x16x1_1x16x1x16_4x4x1_1x1_intrawave_v1,178.52,1424.96,0.0
256,72,8192,4096,114,0,14.8771,a8w8_bpreshuffle_256x64x64x256_16x16_16x16_16x16x1_16x16x1_1x32x1x8_8x8x1_2x1_intrawave_v3,324.78,2354.56,0.0
256,80,1280,8192,10,0,12.1678,a8w8_bpreshuffle_128x16x32x512_16x16_16x16_32x4x1_32x4x1_1x16x1x8_4x4x1_1x1_intrawave_v1,137.88,932.45,0.0
256,80,8192,1024,113,0,7.2196,a8w8_bpreshuffle_256x48x64x256_16x16_16x16_16x16x1_16x16x1_1x16x1x16_4x4x1_1x1_intrawave_v1,185.91,1354.82,0.0
256,80,8192,4096,114,0,14.9394,a8w8_bpreshuffle_256x64x64x256_16x16_16x16_16x16x1_16x16x1_1x32x1x8_8x8x1_2x1_intrawave_v3,359.37,2355.71,0.0
256,88,1280,8192,10,0,13.5059,a8w8_bpreshuffle_128x16x32x512_16x16_16x16_32x4x1_32x4x1_1x16x1x8_4x4x1_1x1_intrawave_v1,136.64,846.44,0.0
256,88,8192,1024,113,0,6.7976,a8w8_bpreshuffle_256x48x64x256_16x16_16x16_16x16x1_16x16x1_1x16x1x16_4x4x1_1x1_intrawave_v1,217.19,1459.41,0.0
256,88,8192,4096,114,0,14.9783,a8w8_bpreshuffle_256x64x64x256_16x16_16x16_16x16x1_16x16x1_1x32x1x8_8x8x1_2x1_intrawave_v3,394.28,2360.53,0.0
256,96,1280,8192,8,0,12.1708,a8w8_bpreshuffle_128x32x16x512_16x16_16x16_32x4x1_32x4x1_1x32x1x4_4x4x1_1x1_intrawave_v1,165.42,946.36,0.0
256,96,8192,1024,29,0,6.2256,a8w8_bpreshuffle_256x16x64x256_16x16_16x16_16x16x1_16x16x1_1x16x1x16_4x4x1_1x1_intrawave_v2,258.71,1615.87,0.0
256,96,8192,4096,113,0,14.4057,a8w8_bpreshuffle_256x48x64x256_16x16_16x16_16x16x1_16x16x1_1x16x1x16_4x4x1_1x1_intrawave_v1,447.22,2465.73,0.0
256,104,1280,8192,10,0,13.5879,a8w8_bpreshuffle_128x16x32x512_16x16_16x16_32x4x1_32x4x1_1x16x1x8_4x4x1_1x1_intrawave_v1,160.51,853.99,0.0
256,104,8192,1024,119,0,6.9854,a8w8_bpreshuffle_256x32x128x256_16x16_16x16_16x16x1_16x16x1_1x16x1x16_8x8x1_1x2_intrawave_v1,249.78,1460.05,0.0
256,104,8192,4096,114,0,15.2615,a8w8_bpreshuffle_256x64x64x256_16x16_16x16_16x16x1_16x16x1_1x32x1x8_8x8x1_2x1_intrawave_v3,457.32,2338.19,0.0
256,112,1280,8192,10,0,12.7255,a8w8_bpreshuffle_128x16x32x512_16x16_16x16_32x4x1_32x4x1_1x16x1x8_4x4x1_1x1_intrawave_v1,184.58,918.63,0.0
256,112,8192,1024,119,0,6.9196,a8w8_bpreshuffle_256x32x128x256_16x16_16x16_16x16x1_16x16x1_1x16x1x16_8x8x1_1x2_intrawave_v1,271.55,1494.06,0.0
256,112,8192,4096,114,0,15.4574,a8w8_bpreshuffle_256x64x64x256_16x16_16x16_16x16x1_16x16x1_1x32x1x8_8x8x1_2x1_intrawave_v3,486.25,2319.16,0.0
256,120,1280,8192,11,0,14.4641,a8w8_bpreshuffle_256x16x64x512_16x16_16x16_32x8x1_32x8x1_1x16x1x16_4x4x1_1x1_intrawave_v1,173.99,814.15,0.0
256,120,8192,1024,119,0,7.0282,a8w8_bpreshuffle_256x32x128x256_16x16_16x16_16x16x1_16x16x1_1x16x1x16_8x8x1_1x2_intrawave_v1,286.46,1490.79,0.0
256,120,8192,4096,114,0,15.7653,a8w8_bpreshuffle_256x64x64x256_16x16_16x16_16x16x1_16x16x1_1x32x1x8_8x8x1_2x1_intrawave_v3,510.81,2284.26,0.0
256,768,1280,8192,114,0,23.0626,a8w8_bpreshuffle_256x64x64x256_16x16_16x16_16x16x1_16x16x1_1x32x1x8_8x8x1_2x1_intrawave_v3,698.37,812.71,0.0
256,768,8192,1024,85,0,15.9553,a8w8_bpreshuffle_256x64x128x128_16x16_16x16_8x32x1_8x32x1_1x32x1x8_8x8x1_2x1_intrawave_v3,807.56,1363.68,0.0
256,768,8192,4096,51,0,36.6523,a8w8_bpreshuffle_256x192x128x128_16x16_16x16_8x32x1_8x32x1_1x32x1x8_8x8x1_2x1_intrawave_v3,1406.18,1344.61,0.0
256,1536,1280,8192,65,0,35.738,a8w8_bpreshuffle_256x128x64x256_16x16_16x16_16x16x1_16x16x1_1x32x1x8_8x8x1_2x1_intrawave_v3,901.34,755.52,0.0
256,1536,8192,1024,4,0,27.0733,a8w8_bpreshuffle_256x192x128x128_16x16_16x16_8x32x1_8x32x1_1x32x1x8_8x8x1_1x2_intrawave_v3,951.85,1297.49,0.0
256,1536,8192,4096,158,0,64.8564,a8w8_bpreshuffle_256x192x256x128_16x16_16x16_8x32x1_8x32x1_1x16x1x16_8x8x1_1x2_intrawave_v3,1589.35,1002.39,0.0
256,2048,1280,8192,123,0,43.6018,a8w8_bpreshuffle_256x96x128x256_16x16_16x16_16x16x1_16x16x1_1x16x1x16_8x8x1_1x2_intrawave_v3,985.04,745.52,0.0
256,2048,8192,1024,86,0,38.3852,a8w8_bpreshuffle_256x96x128x128_16x16_16x16_8x32x1_8x32x1_1x32x1x8_8x8x1_2x1_intrawave_v3,895.13,1147.32,0.0
256,2048,8192,4096,33,0,86.5258,a8w8_bpreshuffle_256x256x256x128_16x16_16x16_8x32x1_8x32x1_1x32x1x8_8x8x1_2x1_intrawave_v3,1588.42,872.54,0.0
256,3904,1280,8192,141,0,63.3127,a8w8_bpreshuffle_256x160x128x128_16x16_16x16_8x32x1_8x32x1_1x16x1x16_8x8x1_1x2_intrawave_v3,1293.15,828.61,0.0
256,3904,8192,1024,51,0,66.8704,a8w8_bpreshuffle_256x192x128x128_16x16_16x16_8x32x1_8x32x1_1x32x1x8_8x8x1_2x1_intrawave_v3,979.48,1141.75,0.0
256,3904,8192,4096,154,0,170.2328,a8w8_bpreshuffle_256x128x256x256_16x16_16x16_16x16x1_16x16x1_1x16x1x16_8x8x1_1x2_intrawave_v3,1539.03,666.78,0.0
256,3904,8192,8192,33,0,281.1099,a8w8_bpreshuffle_256x256x256x128_16x16_16x16_8x32x1_8x32x1_1x32x1x8_8x8x1_2x1_intrawave_v3,1863.99,580.03,0.0
256,36288,1280,8192,158,0,393.1668,a8w8_bpreshuffle_256x192x256x128_16x16_16x16_8x32x1_8x32x1_1x16x1x16_8x8x1_1x2_intrawave_v3,1935.6,1019.04,0.0
256,36288,8192,1024,143,0,469.842,a8w8_bpreshuffle_256x192x128x128_16x16_16x16_8x32x1_8x32x1_1x16x1x16_8x8x1_1x2_intrawave_v3,1295.78,1362.35,0.0
256,36288,8192,4096,158,0,1306.4506,a8w8_bpreshuffle_256x192x256x128_16x16_16x16_8x32x1_8x32x1_1x16x1x16_8x8x1_1x2_intrawave_v3,1864.02,594.54,0.0
256,36288,8192,8192,40,0,2373.3751,a8w8_bpreshuffle_256x224x256x128_16x16_16x16_8x32x1_8x32x1_1x32x1x8_8x8x1_2x1_intrawave_v3,2052.14,404.03,0.0
256,42628,1280,8192,40,0,483.5106,a8w8_bpreshuffle_256x224x256x128_16x16_16x16_8x32x1_8x32x1_1x32x1x8_8x8x1_2x1_intrawave_v3,1848.92,969.62,0.0
256,42628,8192,1024,143,0,601.152,a8w8_bpreshuffle_256x192x128x128_16x16_16x16_8x32x1_8x32x1_1x16x1x16_8x8x1_1x2_intrawave_v3,1189.68,1248.36,0.0
256,42628,8192,4096,158,0,1639.2972,a8w8_bpreshuffle_256x192x256x128_16x16_16x16_8x32x1_8x32x1_1x16x1x16_8x8x1_1x2_intrawave_v3,1745.09,553.03,0.0
256,42628,8192,8192,158,0,2750.8985,a8w8_bpreshuffle_256x192x256x128_16x16_16x16_8x32x1_8x32x1_1x16x1x16_8x8x1_1x2_intrawave_v3,2079.84,405.23,0.0
256,65456,1280,8192,158,0,722.5264,a8w8_bpreshuffle_256x192x256x128_16x16_16x16_8x32x1_8x32x1_1x16x1x16_8x8x1_1x2_intrawave_v3,1899.88,988.57,0.0
256,65456,8192,1024,143,0,892.5109,a8w8_bpreshuffle_256x192x128x128_16x16_16x16_8x32x1_8x32x1_1x16x1x16_8x8x1_1x2_intrawave_v3,1230.43,1286.09,0.0
256,65456,8192,4096,158,0,2535.3235,a8w8_bpreshuffle_256x192x256x128_16x16_16x16_8x32x1_8x32x1_1x16x1x16_8x8x1_1x2_intrawave_v3,1732.59,541.98,0.0
256,65456,8192,8192,47,0,4347.4249,a8w8_bpreshuffle_256x192x256x128_16x16_16x16_8x32x1_8x32x1_1x32x1x8_8x8x1_2x1_intrawave_v3,2020.82,385.46,0.0
256,65490,1280,8192,158,0,734.9552,a8w8_bpreshuffle_256x192x256x128_16x16_16x16_8x32x1_8x32x1_1x16x1x16_8x8x1_1x2_intrawave_v3,1868.72,972.35,0.0
256,65490,8192,1024,143,0,897.9657,a8w8_bpreshuffle_256x192x128x128_16x16_16x16_8x32x1_8x32x1_1x16x1x16_8x8x1_1x2_intrawave_v3,1223.59,1278.93,0.0
256,65490,8192,4096,158,0,2427.5353,a8w8_bpreshuffle_256x192x256x128_16x16_16x16_8x32x1_8x32x1_1x16x1x16_8x8x1_1x2_intrawave_v3,1810.46,566.33,0.0
256,65490,8192,8192,158,0,4542.1349,a8w8_bpreshuffle_256x192x256x128_16x16_16x16_8x32x1_8x32x1_1x16x1x16_8x8x1_1x2_intrawave_v3,1935.2,369.12,0.0
256,136,1280,8192,10,0,14.2374,a8w8_bpreshuffle_128x16x32x512_16x16_16x16_32x4x1_32x4x1_1x16x1x8_4x4x1_1x1_intrawave_v1,200.33,839.2,0.0
256,136,8192,1024,113,0,7.3881,a8w8_bpreshuffle_256x48x64x256_16x16_16x16_16x16x1_16x16x1_1x16x1x16_4x4x1_1x1_intrawave_v1,308.83,1455.87,0.0
256,136,8192,4096,120,0,17.7086,a8w8_bpreshuffle_256x48x128x256_16x16_16x16_16x16x1_16x16x1_1x16x1x16_8x8x1_1x2_intrawave_v1,515.39,2052.09,0.0
256,144,1280,8192,11,0,13.3172,a8w8_bpreshuffle_256x16x64x512_16x16_16x16_32x8x1_32x8x1_1x16x1x16_4x4x1_1x1_intrawave_v1,226.77,903.65,0.0
256,144,8192,1024,113,0,7.3052,a8w8_bpreshuffle_256x48x64x256_16x16_16x16_16x16x1_16x16x1_1x16x1x16_4x4x1_1x1_intrawave_v1,330.71,1491.45,0.0
256,144,8192,4096,115,0,17.7128,a8w8_bpreshuffle_256x80x64x256_16x16_16x16_16x16x1_16x16x1_1x16x1x16_4x4x1_1x1_intrawave_v3,545.58,2060.86,0.0
256,152,1280,8192,10,0,14.5706,a8w8_bpreshuffle_128x16x32x512_16x16_16x16_32x4x1_32x4x1_1x16x1x8_4x4x1_1x1_intrawave_v1,218.77,831.82,0.0
256,152,8192,1024,113,0,7.5883,a8w8_bpreshuffle_256x48x64x256_16x16_16x16_16x16x1_16x16x1_1x16x1x16_4x4x1_1x1_intrawave_v1,336.06,1454.16,0.0
256,152,8192,4096,115,0,17.7277,a8w8_bpreshuffle_256x80x64x256_16x16_16x16_16x16x1_16x16x1_1x16x1x16_4x4x1_1x1_intrawave_v3,575.4,2068.37,0.0
256,160,1280,8192,5,0,13.2411,a8w8_bpreshuffle_256x16x64x512_16x16_16x16_32x8x1_32x8x1_1x16x1x16_4x4x1_1x1_intrawave_v1,253.41,921.83,0.0
256,160,8192,1024,113,0,7.7817,a8w8_bpreshuffle_256x48x64x256_16x16_16x16_16x16x1_16x16x1_1x16x1x16_4x4x1_1x1_intrawave_v1,344.96,1435.92,0.0
256,160,8192,4096,113,0,17.7732,a8w8_bpreshuffle_256x48x64x256_16x16_16x16_16x16x1_16x16x1_1x16x1x16_4x4x1_1x1_intrawave_v1,604.14,2072.29,0.0
256,168,1280,8192,10,0,14.5949,a8w8_bpreshuffle_128x16x32x512_16x16_16x16_32x4x1_32x4x1_1x16x1x8_4x4x1_1x1_intrawave_v1,241.4,842.22,0.0
256,168,8192,1024,113,0,7.8628,a8w8_bpreshuffle_256x48x64x256_16x16_16x16_16x16x1_16x16x1_1x16x1x16_4x4x1_1x1_intrawave_v1,358.47,1438.82,0.0
256,168,8192,4096,120,0,17.8223,a8w8_bpreshuffle_256x48x128x256_16x16_16x16_16x16x1_16x16x1_1x16x1x16_8x8x1_1x2_intrawave_v1,632.59,2075.77,0.0
256,176,1280,8192,11,0,13.3779,a8w8_bpreshuffle_256x16x64x512_16x16_16x16_32x8x1_32x8x1_1x16x1x16_4x4x1_1x1_intrawave_v1,275.9,925.27,0.0
256,176,8192,1024,120,0,8.3574,a8w8_bpreshuffle_256x48x128x256_16x16_16x16_16x16x1_16x16x1_1x16x1x16_8x8x1_1x2_intrawave_v1,353.31,1370.33,0.0
256,176,8192,4096,120,0,17.9562,a8w8_bpreshuffle_256x48x128x256_16x16_16x16_16x16x1_16x16x1_1x16x1x16_8x8x1_1x2_intrawave_v1,657.78,2069.42,0.0
256,184,1280,8192,10,0,14.8129,a8w8_bpreshuffle_128x16x32x512_16x16_16x16_32x4x1_32x4x1_1x16x1x8_4x4x1_1x1_intrawave_v1,260.5,841.44,0.0
256,184,8192,1024,120,0,7.8206,a8w8_bpreshuffle_256x48x128x256_16x16_16x16_16x16x1_16x16x1_1x16x1x16_8x8x1_1x2_intrawave_v1,394.73,1482.2,0.0
256,184,8192,4096,120,0,18.1683,a8w8_bpreshuffle_256x48x128x256_16x16_16x16_16x16x1_16x16x1_1x16x1x16_8x8x1_1x2_intrawave_v1,679.65,2054.28,0.0
256,192,1280,8192,11,0,12.8239,a8w8_bpreshuffle_256x16x64x512_16x16_16x16_32x8x1_32x8x1_1x16x1x16_4x4x1_1x1_intrawave_v1,313.99,978.65,0.0
256,192,8192,1024,120,0,8.2957,a8w8_bpreshuffle_256x48x128x256_16x16_16x16_16x16x1_16x16x1_1x16x1x16_8x8x1_1x2_intrawave_v1,388.3,1414.1,0.0
256,192,8192,4096,120,0,17.8179,a8w8_bpreshuffle_256x48x128x256_16x16_16x16_16x16x1_16x16x1_1x16x1x16_8x8x1_1x2_intrawave_v1,723.14,2103.87,0.0
256,200,1280,8192,10,0,16.0782,a8w8_bpreshuffle_128x16x32x512_16x16_16x16_32x4x1_32x4x1_1x16x1x8_4x4x1_1x1_intrawave_v1,260.87,785.92,0.0
256,200,8192,1024,114,0,8.0088,a8w8_bpreshuffle_256x64x64x256_16x16_16x16_16x16x1_16x16x1_1x32x1x8_8x8x1_2x1_intrawave_v3,418.97,1482.15,0.0
256,200,8192,4096,121,0,20.5776,a8w8_bpreshuffle_256x64x128x256_16x16_16x16_16x16x1_16x16x1_1x16x1x16_8x8x1_1x2_intrawave_v3,652.25,1829.68,0.0
256,208,1280,8192,10,0,15.0576,a8w8_bpreshuffle_128x16x32x512_16x16_16x16_32x4x1_32x4x1_1x16x1x8_4x4x1_1x1_intrawave_v1,289.69,844.9,0.0
256,208,8192,1024,114,0,9.0626,a8w8_bpreshuffle_256x64x64x256_16x16_16x16_16x16x1_16x16x1_1x32x1x8_8x8x1_2x1_intrawave_v3,385.06,1325.17,0.0
256,208,8192,4096,144,0,19.9204,a8w8_bpreshuffle_256x128x64x256_16x16_16x16_16x16x1_16x16x1_1x32x1x8_8x8x1_2x1_intrawave_v3,700.72,1898.27,0.0
256,216,1280,8192,10,0,15.7109,a8w8_bpreshuffle_128x16x32x512_16x16_16x16_32x4x1_32x4x1_1x16x1x8_4x4x1_1x1_intrawave_v1,288.33,815.24,0.0
256,216,8192,1024,114,0,8.5564,a8w8_bpreshuffle_256x64x64x256_16x16_16x16_16x16x1_16x16x1_1x32x1x8_8x8x1_2x1_intrawave_v3,423.53,1419.84,0.0
256,216,8192,4096,144,0,20.411,a8w8_bpreshuffle_256x128x64x256_16x16_16x16_16x16x1_16x16x1_1x32x1x8_8x8x1_2x1_intrawave_v3,710.18,1860.67,0.0
256,224,1280,8192,10,0,15.4399,a8w8_bpreshuffle_128x16x32x512_16x16_16x16_32x4x1_32x4x1_1x16x1x8_4x4x1_1x1_intrawave_v1,304.25,835.12,0.0
256,224,8192,1024,114,0,8.6762,a8w8_bpreshuffle_256x64x64x256_16x16_16x16_16x16x1_16x16x1_1x32x1x8_8x8x1_2x1_intrawave_v3,433.15,1416.29,0.0
256,224,8192,4096,117,0,19.2347,a8w8_bpreshuffle_256x112x64x256_16x16_16x16_16x16x1_16x16x1_1x16x1x16_4x4x1_1x1_intrawave_v3,781.52,1982.98,0.0
256,232,1280,8192,10,0,16.3599,a8w8_bpreshuffle_128x16x32x512_16x16_16x16_32x4x1_32x4x1_1x16x1x8_4x4x1_1x1_intrawave_v1,297.4,793.42,0.0
256,232,8192,1024,114,0,9.1834,a8w8_bpreshuffle_256x64x64x256_16x16_16x16_16x16x1_16x16x1_1x32x1x8_8x8x1_2x1_intrawave_v3,423.84,1353.23,0.0
256,232,8192,4096,65,0,20.2172,a8w8_bpreshuffle_256x128x64x256_16x16_16x16_16x16x1_16x16x1_1x32x1x8_8x8x1_2x1_intrawave_v3,770.1,1894.71,0.0
256,240,1280,8192,10,0,15.8232,a8w8_bpreshuffle_128x16x32x512_16x16_16x16_32x4x1_32x4x1_1x16x1x8_4x4x1_1x1_intrawave_v1,318.09,825.76,0.0
256,240,8192,1024,114,0,8.2978,a8w8_bpreshuffle_256x64x64x256_16x16_16x16_16x16x1_16x16x1_1x32x1x8_8x8x1_2x1_intrawave_v3,485.25,1514.44,0.0
256,240,8192,4096,65,0,20.0113,a8w8_bpreshuffle_256x128x64x256_16x16_16x16_16x16x1_16x16x1_1x32x1x8_8x8x1_2x1_intrawave_v3,804.85,1922.4,0.0
256,248,1280,8192,12,0,17.9575,a8w8_bpreshuffle_256x32x64x512_16x16_16x16_32x8x1_32x8x1_1x32x1x8_8x8x1_1x2_intrawave_v1,289.62,732.41,0.0
256,248,8192,1024,114,0,9.4295,a8w8_bpreshuffle_256x64x64x256_16x16_16x16_16x16x1_16x16x1_1x32x1x8_8x8x1_2x1_intrawave_v3,441.25,1347.45,0.0
256,248,8192,4096,144,0,20.4072,a8w8_bpreshuffle_256x128x64x256_16x16_16x16_16x16x1_16x16x1_1x32x1x8_8x8x1_2x1_intrawave_v3,815.55,1893.13,0.0
256,272,1280,8192,10,0,17.0758,a8w8_bpreshuffle_128x16x32x512_16x16_16x16_32x4x1_32x4x1_1x16x1x8_4x4x1_1x1_intrawave_v1,334.05,785.34,0.0
256,272,8192,1024,115,0,9.6881,a8w8_bpreshuffle_256x80x64x256_16x16_16x16_16x16x1_16x16x1_1x16x1x16_4x4x1_1x1_intrawave_v3,471.03,1354.61,0.0
256,272,8192,4096,123,0,23.5052,a8w8_bpreshuffle_256x96x128x256_16x16_16x16_16x16x1_16x16x1_1x16x1x16_8x8x1_1x2_intrawave_v3,776.58,1664.52,0.0
256,288,1280,8192,11,0,16.664,a8w8_bpreshuffle_256x16x64x512_16x16_16x16_32x8x1_32x8x1_1x16x1x16_4x4x1_1x1_intrawave_v1,362.45,815.07,0.0
256,288,8192,1024,113,0,10.2094,a8w8_bpreshuffle_256x48x64x256_16x16_16x16_16x16x1_16x16x1_1x16x1x16_4x4x1_1x1_intrawave_v1,473.27,1312.72,0.0
256,288,8192,4096,123,0,22.7579,a8w8_bpreshuffle_256x96x128x256_16x16_16x16_16x16x1_16x16x1_1x16x1x16_8x8x1_1x2_intrawave_v3,849.26,1733.58,0.0
256,304,1280,8192,5,0,16.154,a8w8_bpreshuffle_256x16x64x512_16x16_16x16_32x8x1_32x8x1_1x16x1x16_4x4x1_1x1_intrawave_v1,394.66,851.45,0.0
256,304,8192,1024,120,0,10.0788,a8w8_bpreshuffle_256x48x128x256_16x16_16x16_16x16x1_16x16x1_1x16x1x16_8x8x1_1x2_intrawave_v1,506.04,1357.37,0.0
256,304,8192,4096,123,0,23.8204,a8w8_bpreshuffle_256x96x128x256_16x16_16x16_16x16x1_16x16x1_1x16x1x16_8x8x1_1x2_intrawave_v3,856.45,1670.01,0.0
256,320,1280,8192,11,0,16.8302,a8w8_bpreshuffle_256x16x64x512_16x16_16x16_32x8x1_32x8x1_1x16x1x16_4x4x1_1x1_intrawave_v1,398.74,827.46,0.0
256,320,8192,1024,77,0,10.434,a8w8_bpreshuffle_256x64x64x128_16x16_16x16_8x32x1_8x32x1_1x32x1x8_8x8x1_2x1_intrawave_v3,514.54,1337.85,0.0
256,320,8192,4096,123,0,23.6167,a8w8_bpreshuffle_256x96x128x256_16x16_16x16_16x16x1_16x16x1_1x16x1x16_8x8x1_1x2_intrawave_v3,909.31,1698.29,0.0
256,336,1280,8192,12,0,18.0969,a8w8_bpreshuffle_256x32x64x512_16x16_16x16_32x8x1_32x8x1_1x32x1x8_8x8x1_1x2_intrawave_v1,389.37,779.05,0.0
256,336,8192,1024,116,0,10.205,a8w8_bpreshuffle_256x96x64x256_16x16_16x16_16x16x1_16x16x1_1x32x1x8_8x8x1_2x1_intrawave_v3,552.39,1395.17,0.0
256,336,8192,4096,123,0,25.5585,a8w8_bpreshuffle_256x96x128x256_16x16_16x16_16x16x1_16x16x1_1x16x1x16_8x8x1_1x2_intrawave_v3,882.23,1582.08,0.0
256,352,1280,8192,12,0,18.4415,a8w8_bpreshuffle_256x32x64x512_16x16_16x16_32x8x1_32x8x1_1x32x1x8_8x8x1_1x2_intrawave_v1,400.29,773.82,0.0
256,352,8192,1024,116,0,10.2099,a8w8_bpreshuffle_256x96x64x256_16x16_16x16_16x16x1_16x16x1_1x32x1x8_8x8x1_2x1_intrawave_v3,578.42,1421.78,0.0
256,352,8192,4096,123,0,25.1773,a8w8_bpreshuffle_256x96x128x256_16x16_16x16_16x16x1_16x16x1_1x16x1x16_8x8x1_1x2_intrawave_v3,938.24,1619.05,0.0
256,368,1280,8192,12,0,18.1697,a8w8_bpreshuffle_256x32x64x512_16x16_16x16_32x8x1_32x8x1_1x32x1x8_8x8x1_1x2_intrawave_v1,424.75,794.87,0.0
256,368,8192,1024,78,0,11.2319,a8w8_bpreshuffle_256x96x64x128_16x16_16x16_8x32x1_8x32x1_1x32x1x8_8x8x1_2x1_intrawave_v3,549.69,1317.21,0.0
256,368,8192,4096,123,0,25.024,a8w8_bpreshuffle_256x96x128x256_16x16_16x16_16x16x1_16x16x1_1x16x1x16_8x8x1_1x2_intrawave_v3,986.9,1642.07,0.0
256,384,1280,8192,12,0,18.7981,a8w8_bpreshuffle_256x32x64x512_16x16_16x16_32x8x1_32x8x1_1x32x1x8_8x8x1_1x2_intrawave_v1,428.4,777.45,0.0
256,384,8192,1024,116,0,10.3622,a8w8_bpreshuffle_256x96x64x256_16x16_16x16_16x16x1_16x16x1_1x32x1x8_8x8x1_2x1_intrawave_v3,621.73,1454.64,0.0
256,384,8192,4096,123,0,23.4365,a8w8_bpreshuffle_256x96x128x256_16x16_16x16_16x16x1_16x16x1_1x16x1x16_8x8x1_1x2_intrawave_v3,1099.56,1767.28,0.0
256,400,1280,8192,6,0,19.5585,a8w8_bpreshuffle_256x16x128x512_16x16_16x16_32x8x1_32x8x1_1x16x1x16_8x8x1_1x2_intrawave_v1,428.9,756.02,0.0
256,400,8192,1024,121,0,11.8331,a8w8_bpreshuffle_256x64x128x256_16x16_16x16_16x16x1_16x16x1_1x16x1x16_8x8x1_1x2_intrawave_v3,567.13,1297.36,0.0
256,400,8192,4096,124,0,28.6163,a8w8_bpreshuffle_256x112x128x256_16x16_16x16_16x16x1_16x16x1_1x16x1x16_8x8x1_1x2_intrawave_v3,938.05,1458.83,0.0
256,416,1280,8192,112,0,21.5007,a8w8_bpreshuffle_256x32x64x256_16x16_16x16_16x16x1_16x16x1_1x32x1x8_8x8x1_2x1_intrawave_v1,405.76,695.73,0.0
256,416,8192,1024,121,0,11.8405,a8w8_bpreshuffle_256x64x128x256_16x16_16x16_16x16x1_16x16x1_1x16x1x16_8x8x1_1x2_intrawave_v3,589.44,1320.07,0.0
256,416,8192,4096,124,0,28.3609,a8w8_bpreshuffle_256x112x128x256_16x16_16x16_16x16x1_16x16x1_1x16x1x16_8x8x1_1x2_intrawave_v3,984.36,1483.53,0.0
256,432,1280,8192,113,0,22.3532,a8w8_bpreshuffle_256x48x64x256_16x16_16x16_16x16x1_16x16x1_1x16x1x16_4x4x1_1x1_intrawave_v1,405.3,676.89,0.0
256,432,8192,1024,121,0,11.8993,a8w8_bpreshuffle_256x64x128x256_16x16_16x16_16x16x1_16x16x1_1x16x1x16_8x8x1_1x2_intrawave_v3,609.09,1336.96,0.0
256,432,8192,4096,124,0,29.9262,a8w8_bpreshuffle_256x112x128x256_16x16_16x16_16x16x1_16x16x1_1x16x1x16_8x8x1_1x2_intrawave_v3,968.75,1416.88,0.0
256,448,1280,8192,112,0,21.6998,a8w8_bpreshuffle_256x32x64x256_16x16_16x16_16x16x1_16x16x1_1x32x1x8_8x8x1_2x1_intrawave_v1,432.96,705.2,0.0
256,448,8192,1024,124,0,12.241,a8w8_bpreshuffle_256x112x128x256_16x16_16x16_16x16x1_16x16x1_1x16x1x16_8x8x1_1x2_intrawave_v3,614.02,1322.39,0.0
256,448,8192,4096,124,0,28.0853,a8w8_bpreshuffle_256x112x128x256_16x16_16x16_16x16x1_16x16x1_1x16x1x16_8x8x1_1x2_intrawave_v3,1070.48,1521.42,0.0
256,464,1280,8192,112,0,24.5787,a8w8_bpreshuffle_256x32x64x256_16x16_16x16_16x16x1_16x16x1_1x32x1x8_8x8x1_2x1_intrawave_v1,395.9,629.6,0.0
256,464,8192,1024,144,0,12.5016,a8w8_bpreshuffle_256x128x64x256_16x16_16x16_16x16x1_16x16x1_1x32x1x8_8x8x1_2x1_intrawave_v3,622.69,1317.11,0.0
256,464,8192,4096,0,0,30.5726,a8w8_bpreshuffle_256x128x128x128_16x16_16x16_8x32x1_8x32x1_1x32x1x8_8x8x1_2x1_intrawave_v3,1018.51,1408.36,0.0
256,480,1280,8192,112,0,22.1259,a8w8_bpreshuffle_256x32x64x256_16x16_16x16_16x16x1_16x16x1_1x32x1x8_8x8x1_2x1_intrawave_v1,454.96,707.17,0.0
256,480,8192,1024,121,0,12.2461,a8w8_bpreshuffle_256x64x128x256_16x16_16x16_16x16x1_16x16x1_1x16x1x16_8x8x1_1x2_intrawave_v3,657.6,1367.33,0.0
256,480,8192,4096,70,0,29.8064,a8w8_bpreshuffle_256x128x128x128_16x16_16x16_8x32x1_8x32x1_1x32x1x8_8x8x1_2x1_intrawave_v3,1080.72,1455.55,0.0
256,496,1280,8192,114,0,24.8943,a8w8_bpreshuffle_256x64x64x256_16x16_16x16_16x16x1_16x16x1_1x32x1x8_8x8x1_2x1_intrawave_v3,417.84,635.44,0.0
256,496,8192,1024,121,0,12.7977,a8w8_bpreshuffle_256x64x128x256_16x16_16x16_16x16x1_16x16x1_1x16x1x16_8x8x1_1x2_intrawave_v3,650.23,1330.16,0.0
256,496,8192,4096,70,0,31.3566,a8w8_bpreshuffle_256x128x128x128_16x16_16x16_8x32x1_8x32x1_1x32x1x8_8x8x1_2x1_intrawave_v3,1061.53,1394.05,0.0
256,544,1280,8192,112,0,23.5963,a8w8_bpreshuffle_256x32x64x256_16x16_16x16_16x16x1_16x16x1_1x32x1x8_8x8x1_2x1_intrawave_v1,483.49,692.26,0.0
256,544,8192,1024,122,0,13.5023,a8w8_bpreshuffle_256x80x128x256_16x16_16x16_16x16x1_16x16x1_1x16x1x16_8x8x1_1x2_intrawave_v3,675.94,1322.63,0.0
256,544,8192,4096,141,0,32.9955,a8w8_bpreshuffle_256x160x128x128_16x16_16x16_8x32x1_8x32x1_1x16x1x16_8x8x1_1x2_intrawave_v3,1106.43,1354.6,0.0
256,576,1280,8192,113,0,22.402,a8w8_bpreshuffle_256x48x64x256_16x16_16x16_16x16x1_16x16x1_1x16x1x16_4x4x1_1x1_intrawave_v1,539.22,744.53,0.0
256,576,8192,1024,120,0,13.5589,a8w8_bpreshuffle_256x48x128x256_16x16_16x16_16x16x1_16x16x1_1x16x1x16_8x8x1_1x2_intrawave_v1,712.72,1358.19,0.0
256,576,8192,4096,58,0,33.2691,a8w8_bpreshuffle_256x160x128x128_16x16_16x16_8x32x1_8x32x1_1x32x1x8_8x8x1_2x1_intrawave_v3,1161.88,1363.15,0.0
256,608,1280,8192,112,0,23.238,a8w8_bpreshuffle_256x32x64x256_16x16_16x16_16x16x1_16x16x1_1x32x1x8_8x8x1_2x1_intrawave_v1,548.7,732.55,0.0
256,608,8192,1024,122,0,14.519,a8w8_bpreshuffle_256x80x128x256_16x16_16x16_16x16x1_16x16x1_1x16x1x16_8x8x1_1x2_intrawave_v3,702.57,1306.75,0.0
256,608,8192,4096,141,0,33.4935,a8w8_bpreshuffle_256x160x128x128_16x16_16x16_8x32x1_8x32x1_1x16x1x16_8x8x1_1x2_intrawave_v3,1218.21,1373.59,0.0
256,640,1280,8192,114,0,22.7448,a8w8_bpreshuffle_256x64x64x256_16x16_16x16_16x16x1_16x16x1_1x32x1x8_8x8x1_2x1_intrawave_v3,590.1,763.56,0.0
256,640,8192,1024,85,0,14.8129,a8w8_bpreshuffle_256x64x128x128_16x16_16x16_8x32x1_8x32x1_1x32x1x8_8x8x1_2x1_intrawave_v3,724.87,1318.43,0.0
256,640,8192,4096,141,0,33.4342,a8w8_bpreshuffle_256x160x128x128_16x16_16x16_8x32x1_8x32x1_1x16x1x16_8x8x1_1x2_intrawave_v3,1284.6,1395.63,0.0
256,672,1280,8192,113,0,24.704,a8w8_bpreshuffle_256x48x64x256_16x16_16x16_16x16x1_16x16x1_1x16x1x16_4x4x1_1x1_intrawave_v1,570.47,716.93,0.0
256,672,8192,1024,86,0,14.8032,a8w8_bpreshuffle_256x96x128x128_16x16_16x16_8x32x1_8x32x1_1x32x1x8_8x8x1_2x1_intrawave_v3,761.61,1356.92,0.0
256,672,8192,4096,89,0,36.6424,a8w8_bpreshuffle_256x192x128x128_16x16_16x16_8x32x1_8x32x1_1x16x1x16_4x4x1_1x1_intrawave_v3,1230.74,1291.32,0.0
256,704,1280,8192,114,0,22.3414,a8w8_bpreshuffle_256x64x64x256_16x16_16x16_16x16x1_16x16x1_1x32x1x8_8x8x1_2x1_intrawave_v3,660.83,808.15,0.0
256,704,8192,1024,85,0,15.5496,a8w8_bpreshuffle_256x64x128x128_16x16_16x16_8x32x1_8x32x1_1x32x1x8_8x8x1_2x1_intrawave_v3,759.58,1327.61,0.0
256,704,8192,4096,143,0,36.1693,a8w8_bpreshuffle_256x192x128x128_16x16_16x16_8x32x1_8x32x1_1x16x1x16_8x8x1_1x2_intrawave_v3,1306.21,1326.33,0.0
256,736,1280,8192,112,0,25.6741,a8w8_bpreshuffle_256x32x64x256_16x16_16x16_16x16x1_16x16x1_1x32x1x8_8x8x1_2x1_intrawave_v1,601.19,716.65,0.0
256,736,8192,1024,86,0,15.8674,a8w8_bpreshuffle_256x96x128x128_16x16_16x16_8x32x1_8x32x1_1x32x1x8_8x8x1_2x1_intrawave_v3,778.2,1336.13,0.0
256,736,8192,4096,143,0,39.03,a8w8_bpreshuffle_256x192x128x128_16x16_16x16_8x32x1_8x32x1_1x16x1x16_8x8x1_1x2_intrawave_v3,1265.49,1245.91,0.0
256,800,1280,8192,112,0,26.8345,a8w8_bpreshuffle_256x32x64x256_16x16_16x16_16x16x1_16x16x1_1x32x1x8_8x8x1_2x1_intrawave_v1,625.21,711.3,0.0
256,800,8192,1024,0,0,17.1115,a8w8_bpreshuffle_256x128x128x128_16x16_16x16_8x32x1_8x32x1_1x32x1x8_8x8x1_2x1_intrawave_v3,784.37,1304.09,0.0
256,800,8192,4096,138,0,42.4989,a8w8_bpreshuffle_256x112x256x256_16x16_16x16_16x16x1_16x16x1_1x16x1x16_8x8x1_1x2_intrawave_v3,1263.26,1175.05,0.0
256,832,1280,8192,113,0,28.7325,a8w8_bpreshuffle_256x48x64x256_16x16_16x16_16x16x1_16x16x1_1x16x1x16_4x4x1_1x1_intrawave_v1,607.27,676.29,0.0
256,832,8192,1024,124,0,18.1263,a8w8_bpreshuffle_256x112x128x256_16x16_16x16_16x16x1_16x16x1_1x16x1x16_8x8x1_1x2_intrawave_v3,770.08,1261.82,0.0
256,832,8192,4096,138,0,44.639,a8w8_bpreshuffle_256x112x256x256_16x16_16x16_16x16x1_16x16x1_1x16x1x16_8x8x1_1x2_intrawave_v3,1250.8,1133.4,0.0
256,864,1280,8192,113,0,26.1213,a8w8_bpreshuffle_256x48x64x256_16x16_16x16_16x16x1_16x16x1_1x16x1x16_4x4x1_1x1_intrawave_v1,693.66,757.06,0.0
256,864,8192,1024,70,0,17.2399,a8w8_bpreshuffle_256x128x128x128_16x16_16x16_8x32x1_8x32x1_1x32x1x8_8x8x1_2x1_intrawave_v3,840.81,1359.01,0.0
256,864,8192,4096,138,0,45.3762,a8w8_bpreshuffle_256x112x256x256_16x16_16x16_16x16x1_16x16x1_1x16x1x16_8x8x1_1x2_intrawave_v3,1277.81,1129.43,0.0
256,896,1280,8192,114,0,28.3029,a8w8_bpreshuffle_256x64x64x256_16x16_16x16_16x16x1_16x16x1_1x32x1x8_8x8x1_2x1_intrawave_v3,663.91,710.87,0.0
256,896,8192,1024,85,0,18.624,a8w8_bpreshuffle_256x64x128x128_16x16_16x16_8x32x1_8x32x1_1x32x1x8_8x8x1_2x1_intrawave_v3,807.15,1287.92,0.0
256,896,8192,4096,138,0,42.7097,a8w8_bpreshuffle_256x112x256x256_16x16_16x16_16x16x1_16x16x1_1x16x1x16_8x8x1_1x2_intrawave_v3,1407.87,1215.29,0.0
256,928,1280,8192,115,0,28.9697,a8w8_bpreshuffle_256x80x64x256_16x16_16x16_16x16x1_16x16x1_1x16x1x16_4x4x1_1x1_intrawave_v3,671.79,706.38,0.0
256,928,8192,1024,0,0,18.4868,a8w8_bpreshuffle_256x128x128x128_16x16_16x16_8x32x1_8x32x1_1x32x1x8_8x8x1_2x1_intrawave_v3,842.18,1327.61,0.0
256,928,8192,4096,154,0,47.4602,a8w8_bpreshuffle_256x128x256x256_16x16_16x16_16x16x1_16x16x1_1x16x1x16_8x8x1_1x2_intrawave_v3,1312.19,1107.45,0.0
256,960,1280,8192,113,0,27.1456,a8w8_bpreshuffle_256x48x64x256_16x16_16x16_16x16x1_16x16x1_1x16x1x16_4x4x1_1x1_intrawave_v1,741.65,766.52,0.0
256,960,8192,1024,146,0,19.6748,a8w8_bpreshuffle_256x160x64x128_16x16_16x16_8x32x1_8x32x1_1x32x1x8_8x8x1_2x1_intrawave_v3,818.62,1275.76,0.0
256,960,8192,4096,154,0,50.2627,a8w8_bpreshuffle_256x128x256x256_16x16_16x16_16x16x1_16x16x1_1x16x1x16_8x8x1_1x2_intrawave_v3,1281.76,1058.74,0.0
256,992,1280,8192,120,0,30.1834,a8w8_bpreshuffle_256x48x128x256_16x16_16x16_16x16x1_16x16x1_1x16x1x16_8x8x1_1x2_intrawave_v1,689.24,700.77,0.0
256,992,8192,1024,70,0,20.3163,a8w8_bpreshuffle_256x128x128x128_16x16_16x16_8x32x1_8x32x1_1x32x1x8_8x8x1_2x1_intrawave_v3,819.19,1262.89,0.0
256,992,8192,4096,154,0,46.6578,a8w8_bpreshuffle_256x128x256x256_16x16_16x16_16x16x1_16x16x1_1x16x1x16_8x8x1_1x2_intrawave_v3,1426.81,1154.59,0.0
256,1056,1280,8192,113,0,29.9774,a8w8_bpreshuffle_256x48x64x256_16x16_16x16_16x16x1_16x16x1_1x16x1x16_4x4x1_1x1_intrawave_v1,738.75,728.54,0.0
256,1056,8192,1024,86,0,20.7507,a8w8_bpreshuffle_256x96x128x128_16x16_16x16_8x32x1_8x32x1_1x32x1x8_8x8x1_2x1_intrawave_v3,853.79,1290.15,0.0
256,1056,8192,4096,156,0,52.352,a8w8_bpreshuffle_256x160x256x128_16x16_16x16_8x32x1_8x32x1_1x16x1x16_8x8x1_1x2_intrawave_v3,1353.66,1054.04,0.0
256,1088,1280,8192,120,0,30.7438,a8w8_bpreshuffle_256x48x128x256_16x16_16x16_16x16x1_16x16x1_1x16x1x16_8x8x1_1x2_intrawave_v1,742.17,721.57,0.0
256,1088,8192,1024,86,0,21.3487,a8w8_bpreshuffle_256x96x128x128_16x16_16x16_8x32x1_8x32x1_1x32x1x8_8x8x1_2x1_intrawave_v3,855.02,1280.1,0.0
256,1088,8192,4096,156,0,55.166,a8w8_bpreshuffle_256x160x256x128_16x16_16x16_8x32x1_8x32x1_1x16x1x16_8x8x1_1x2_intrawave_v3,1323.54,1012.16,0.0
256,1120,1280,8192,113,0,31.009,a8w8_bpreshuffle_256x48x64x256_16x16_16x16_16x16x1_16x16x1_1x16x1x16_4x4x1_1x1_intrawave_v1,757.46,726.5,0.0
256,1120,8192,1024,86,0,19.9832,a8w8_bpreshuffle_256x96x128x128_16x16_16x16_8x32x1_8x32x1_1x32x1x8_8x8x1_2x1_intrawave_v3,940.31,1395.45,0.0
256,1120,8192,4096,156,0,51.7359,a8w8_bpreshuffle_256x160x256x128_16x16_16x16_8x32x1_8x32x1_1x16x1x16_8x8x1_1x2_intrawave_v3,1452.8,1091.93,0.0
256,1152,1280,8192,120,0,29.827,a8w8_bpreshuffle_256x48x128x256_16x16_16x16_16x16x1_16x16x1_1x16x1x16_8x8x1_1x2_intrawave_v1,809.98,766.82,0.0
256,1152,8192,1024,86,0,22.2456,a8w8_bpreshuffle_256x96x128x128_16x16_16x16_8x32x1_8x32x1_1x32x1x8_8x8x1_2x1_intrawave_v3,868.82,1278.57,0.0
256,1152,8192,4096,158,0,56.0348,a8w8_bpreshuffle_256x192x256x128_16x16_16x16_8x32x1_8x32x1_1x16x1x16_8x8x1_1x2_intrawave_v3,1379.67,1019.86,0.0
256,1184,1280,8192,120,0,32.395,a8w8_bpreshuffle_256x48x128x256_16x16_16x16_16x16x1_16x16x1_1x16x1x16_8x8x1_1x2_intrawave_v1,766.48,716.66,0.0
256,1184,8192,1024,141,0,23.5512,a8w8_bpreshuffle_256x160x128x128_16x16_16x16_8x32x1_8x32x1_1x16x1x16_8x8x1_1x2_intrawave_v3,843.45,1231.35,0.0
256,1184,8192,4096,156,0,55.7808,a8w8_bpreshuffle_256x160x256x128_16x16_16x16_8x32x1_8x32x1_1x16x1x16_8x8x1_1x2_intrawave_v3,1424.45,1036.25,0.0
256,1216,1280,8192,114,0,32.9542,a8w8_bpreshuffle_256x64x64x256_16x16_16x16_16x16x1_16x16x1_1x32x1x8_8x8x1_2x1_intrawave_v3,773.84,714.94,0.0
256,1216,8192,1024,58,0,23.1006,a8w8_bpreshuffle_256x160x128x128_16x16_16x16_8x32x1_8x32x1_1x32x1x8_8x8x1_2x1_intrawave_v3,883.14,1279.48,0.0
256,1216,8192,4096,156,0,57.1645,a8w8_bpreshuffle_256x160x256x128_16x16_16x16_8x32x1_8x32x1_1x16x1x16_8x8x1_1x2_intrawave_v3,1427.54,1022.63,0.0
256,1248,1280,8192,119,0,34.5627,a8w8_bpreshuffle_256x32x128x256_16x16_16x16_16x16x1_16x16x1_1x16x1x16_8x8x1_1x2_intrawave_v1,757.25,691.62,0.0
256,1248,8192,1024,141,0,24.006,a8w8_bpreshuffle_256x160x128x128_16x16_16x16_8x32x1_8x32x1_1x16x1x16_8x8x1_1x2_intrawave_v3,872.2,1254.43,0.0
256,1248,8192,4096,156,0,58.8649,a8w8_bpreshuffle_256x160x256x128_16x16_16x16_8x32x1_8x32x1_1x16x1x16_8x8x1_1x2_intrawave_v3,1422.78,1004.22,0.0
256,1280,1280,8192,144,0,32.5862,a8w8_bpreshuffle_256x128x64x256_16x16_16x16_16x16x1_16x16x1_1x32x1x8_8x8x1_2x1_intrawave_v3,823.77,744.13,0.0
256,1280,8192,1024,141,0,22.5236,a8w8_bpreshuffle_256x160x128x128_16x16_16x16_8x32x1_8x32x1_1x16x1x16_8x8x1_1x2_intrawave_v3,953.44,1361.72,0.0
256,1280,8192,4096,156,0,56.2657,a8w8_bpreshuffle_256x160x256x128_16x16_16x16_8x32x1_8x32x1_1x16x1x16_8x8x1_1x2_intrawave_v3,1526.67,1062.26,0.0
256,1312,1280,8192,119,0,34.3599,a8w8_bpreshuffle_256x32x128x256_16x16_16x16_16x16x1_16x16x1_1x16x1x16_8x8x1_1x2_intrawave_v1,800.78,715.73,0.0
256,1312,8192,1024,143,0,24.6176,a8w8_bpreshuffle_256x192x128x128_16x16_16x16_8x32x1_8x32x1_1x16x1x16_8x8x1_1x2_intrawave_v3,894.15,1268.52,0.0
256,1312,8192,4096,158,0,60.5782,a8w8_bpreshuffle_256x192x256x128_16x16_16x16_8x32x1_8x32x1_1x16x1x16_8x8x1_1x2_intrawave_v3,1453.44,997.46,0.0
256,1344,1280,8192,117,0,34.9687,a8w8_bpreshuffle_256x112x64x256_16x16_16x16_16x16x1_16x16x1_1x16x1x16_4x4x1_1x1_intrawave_v3,806.03,713.11,0.0
256,1344,8192,1024,4,0,25.5148,a8w8_bpreshuffle_256x192x128x128_16x16_16x16_8x32x1_8x32x1_1x32x1x8_8x8x1_1x2_intrawave_v3,883.75,1245.75,0.0
256,1344,8192,4096,158,0,59.8594,a8w8_bpreshuffle_256x192x256x128_16x16_16x16_8x32x1_8x32x1_1x16x1x16_8x8x1_1x2_intrawave_v3,1506.77,1020.38,0.0
256,1376,1280,8192,65,0,35.2999,a8w8_bpreshuffle_256x128x64x256_16x16_16x16_16x16x1_16x16x1_1x32x1x8_8x8x1_2x1_intrawave_v3,817.48,716.16,0.0
256,1376,8192,1024,85,0,25.7664,a8w8_bpreshuffle_256x64x128x128_16x16_16x16_8x32x1_8x32x1_1x32x1x8_8x8x1_2x1_intrawave_v3,895.95,1255.2,0.0
256,1376,8192,4096,158,0,66.8875,a8w8_bpreshuffle_256x192x256x128_16x16_16x16_8x32x1_8x32x1_1x16x1x16_8x8x1_1x2_intrawave_v3,1380.55,922.97,0.0
256,1408,1280,8192,65,0,31.6943,a8w8_bpreshuffle_256x128x64x256_16x16_16x16_16x16x1_16x16x1_1x32x1x8_8x8x1_2x1_intrawave_v3,931.65,808.49,0.0
256,1408,8192,1024,51,0,26.3314,a8w8_bpreshuffle_256x192x128x128_16x16_16x16_8x32x1_8x32x1_1x32x1x8_8x8x1_2x1_intrawave_v3,897.12,1249.42,0.0
256,1408,8192,4096,158,0,65.848,a8w8_bpreshuffle_256x192x256x128_16x16_16x16_8x32x1_8x32x1_1x16x1x16_8x8x1_1x2_intrawave_v3,1434.96,947.49,0.0
256,1440,1280,8192,115,0,34.6167,a8w8_bpreshuffle_256x80x64x256_16x16_16x16_16x16x1_16x16x1_1x16x1x16_4x4x1_1x1_intrawave_v3,872.38,750.18,0.0
256,1440,8192,1024,143,0,26.8801,a8w8_bpreshuffle_256x192x128x128_16x16_16x16_8x32x1_8x32x1_1x16x1x16_8x8x1_1x2_intrawave_v3,898.78,1244.64,0.0
256,1440,8192,4096,47,0,65.3111,a8w8_bpreshuffle_256x192x256x128_16x16_16x16_8x32x1_8x32x1_1x32x1x8_8x8x1_2x1_intrawave_v3,1479.64,965.31,0.0
256,1472,1280,8192,65,0,36.2792,a8w8_bpreshuffle_256x128x64x256_16x16_16x16_16x16x1_16x16x1_1x32x1x8_8x8x1_2x1_intrawave_v3,850.9,725.28,0.0
256,1472,8192,1024,143,0,26.6709,a8w8_bpreshuffle_256x192x128x128_16x16_16x16_8x32x1_8x32x1_1x16x1x16_8x8x1_1x2_intrawave_v3,925.96,1275.29,0.0
256,1472,8192,4096,158,0,62.3462,a8w8_bpreshuffle_256x192x256x128_16x16_16x16_8x32x1_8x32x1_1x16x1x16_8x8x1_1x2_intrawave_v3,1584.45,1021.73,0.0
256,1504,1280,8192,144,0,36.0311,a8w8_bpreshuffle_256x128x64x256_16x16_16x16_16x16x1_16x16x1_1x32x1x8_8x8x1_2x1_intrawave_v3,875.39,739.83,0.0
256,1504,8192,1024,4,0,27.5089,a8w8_bpreshuffle_256x192x128x128_16x16_16x16_8x32x1_8x32x1_1x32x1x8_8x8x1_1x2_intrawave_v3,917.26,1256.69,0.0
256,1504,8192,4096,158,0,66.2793,a8w8_bpreshuffle_256x192x256x128_16x16_16x16_8x32x1_8x32x1_1x16x1x16_8x8x1_1x2_intrawave_v3,1522.82,970.99,0.0
256,1568,1280,8192,121,0,38.6428,a8w8_bpreshuffle_256x64x128x256_16x16_16x16_16x16x1_16x16x1_1x16x1x16_8x8x1_1x2_intrawave_v3,850.96,707.63,0.0
256,1568,8192,1024,141,0,30.0138,a8w8_bpreshuffle_256x160x128x128_16x16_16x16_8x32x1_8x32x1_1x16x1x16_8x8x1_1x2_intrawave_v3,876.49,1188.93,0.0
256,1568,8192,4096,40,0,70.624,a8w8_bpreshuffle_256x224x256x128_16x16_16x16_8x32x1_8x32x1_1x32x1x8_8x8x1_2x1_intrawave_v3,1489.96,929.81,0.0
256,1600,1280,8192,114,0,39.5192,a8w8_bpreshuffle_256x64x64x256_16x16_16x16_16x16x1_16x16x1_1x32x1x8_8x8x1_2x1_intrawave_v3,849.07,700.65,0.0
256,1600,8192,1024,141,0,31.5634,a8w8_bpreshuffle_256x160x128x128_16x16_16x16_8x32x1_8x32x1_1x16x1x16_8x8x1_1x2_intrawave_v3,850.46,1148.21,0.0
256,1600,8192,4096,40,0,75.1769,a8w8_bpreshuffle_256x224x256x128_16x16_16x16_8x32x1_8x32x1_1x32x1x8_8x8x1_2x1_intrawave_v3,1428.29,882.22,0.0
256,1632,1280,8192,123,0,38.3148,a8w8_bpreshuffle_256x96x128x256_16x16_16x16_16x16x1_16x16x1_1x16x1x16_8x8x1_1x2_intrawave_v3,893.27,731.65,0.0
256,1632,8192,1024,86,0,32.229,a8w8_bpreshuffle_256x96x128x128_16x16_16x16_8x32x1_8x32x1_1x32x1x8_8x8x1_2x1_intrawave_v3,849.56,1141.78,0.0
256,1632,8192,4096,40,0,76.893,a8w8_bpreshuffle_256x224x256x128_16x16_16x16_8x32x1_8x32x1_1x32x1x8_8x8x1_2x1_intrawave_v3,1424.34,871.05,0.0
256,1664,1280,8192,115,0,37.7656,a8w8_bpreshuffle_256x80x64x256_16x16_16x16_16x16x1_16x16x1_1x16x1x16_4x4x1_1x1_intrawave_v3,924.03,751.4,0.0
256,1664,8192,1024,86,0,30.4689,a8w8_bpreshuffle_256x96x128x128_16x16_16x16_8x32x1_8x32x1_1x32x1x8_8x8x1_2x1_intrawave_v3,916.26,1226.02,0.0
256,1664,8192,4096,106,0,79.6406,a8w8_bpreshuffle_256x224x256x128_16x16_16x16_8x32x1_8x32x1_1x16x1x16_4x4x1_1x1_intrawave_v3,1402.16,849.23,0.0
256,1696,1280,8192,123,0,40.826,a8w8_bpreshuffle_256x96x128x256_16x16_16x16_16x16x1_16x16x1_1x16x1x16_8x8x1_1x2_intrawave_v3,871.2,703.5,0.0
256,1696,8192,1024,86,0,31.0678,a8w8_bpreshuffle_256x96x128x128_16x16_16x16_8x32x1_8x32x1_1x32x1x8_8x8x1_2x1_intrawave_v3,915.87,1220.32,0.0
256,1696,8192,4096,40,0,78.1464,a8w8_bpreshuffle_256x224x256x128_16x16_16x16_8x32x1_8x32x1_1x32x1x8_8x8x1_2x1_intrawave_v3,1456.45,873.85,0.0
256,1728,1280,8192,123,0,39.6668,a8w8_bpreshuffle_256x96x128x256_16x16_16x16_16x16x1_16x16x1_1x16x1x16_8x8x1_1x2_intrawave_v3,913.58,732.73,0.0
256,1728,8192,1024,86,0,31.8682,a8w8_bpreshuffle_256x96x128x128_16x16_16x16_8x32x1_8x32x1_1x32x1x8_8x8x1_2x1_intrawave_v3,909.72,1207.15,0.0
256,1728,8192,4096,40,0,78.8631,a8w8_bpreshuffle_256x224x256x128_16x16_16x16_8x32x1_8x32x1_1x32x1x8_8x8x1_2x1_intrawave_v3,1470.45,874.22,0.0
256,1760,1280,8192,115,0,39.516,a8w8_bpreshuffle_256x80x64x256_16x16_16x16_16x16x1_16x16x1_1x16x1x16_4x4x1_1x1_intrawave_v3,934.05,744.24,0.0
256,1760,8192,1024,86,0,33.1455,a8w8_bpreshuffle_256x96x128x128_16x16_16x16_8x32x1_8x32x1_1x32x1x8_8x8x1_2x1_intrawave_v3,890.86,1177.44,0.0
256,1760,8192,4096,40,0,80.1271,a8w8_bpreshuffle_256x224x256x128_16x16_16x16_8x32x1_8x32x1_1x32x1x8_8x8x1_2x1_intrawave_v3,1474.05,868.61,0.0
256,1792,1280,8192,123,0,40.7784,a8w8_bpreshuffle_256x96x128x256_16x16_16x16_16x16x1_16x16x1_1x16x1x16_8x8x1_1x2_intrawave_v3,921.59,729.63,0.0
256,1792,8192,1024,85,0,32.9963,a8w8_bpreshuffle_256x64x128x128_16x16_16x16_8x32x1_8x32x1_1x32x1x8_8x8x1_2x1_intrawave_v3,911.16,1199.64,0.0
256,1792,8192,4096,40,0,74.1581,a8w8_bpreshuffle_256x224x256x128_16x16_16x16_8x32x1_8x32x1_1x32x1x8_8x8x1_2x1_intrawave_v3,1621.66,947.36,0.0
256,1824,1280,8192,123,0,39.168,a8w8_bpreshuffle_256x96x128x256_16x16_16x16_16x16x1_16x16x1_1x16x1x16_8x8x1_1x2_intrawave_v3,976.61,768.42,0.0
256,1824,8192,1024,86,0,32.2785,a8w8_bpreshuffle_256x96x128x128_16x16_16x16_8x32x1_8x32x1_1x32x1x8_8x8x1_2x1_intrawave_v3,948.05,1243.58,0.0
256,1824,8192,4096,141,0,83.9467,a8w8_bpreshuffle_256x160x128x128_16x16_16x16_8x32x1_8x32x1_1x16x1x16_8x8x1_1x2_intrawave_v3,1458.15,844.7,0.0
256,1856,1280,8192,123,0,42.0341,a8w8_bpreshuffle_256x96x128x256_16x16_16x16_16x16x1_16x16x1_1x16x1x16_8x8x1_1x2_intrawave_v3,925.99,724.21,0.0
256,1856,8192,1024,141,0,32.6678,a8w8_bpreshuffle_256x160x128x128_16x16_16x16_8x32x1_8x32x1_1x16x1x16_8x8x1_1x2_intrawave_v3,953.19,1245.81,0.0
256,1856,8192,4096,141,0,84.846,a8w8_bpreshuffle_256x160x128x128_16x16_16x16_8x32x1_8x32x1_1x16x1x16_8x8x1_1x2_intrawave_v3,1468.0,843.47,0.0
256,1888,1280,8192,123,0,42.2901,a8w8_bpreshuffle_256x96x128x256_16x16_16x16_16x16x1_16x16x1_1x16x1x16_8x8x1_1x2_intrawave_v3,936.25,727.96,0.0
256,1888,8192,1024,141,0,32.654,a8w8_bpreshuffle_256x160x128x128_16x16_16x16_8x32x1_8x32x1_1x16x1x16_8x8x1_1x2_intrawave_v3,970.03,1263.4,0.0
256,1888,8192,4096,141,0,89.7209,a8w8_bpreshuffle_256x160x128x128_16x16_16x16_8x32x1_8x32x1_1x16x1x16_8x8x1_1x2_intrawave_v3,1412.17,804.95,0.0
256,1920,1280,8192,123,0,39.8072,a8w8_bpreshuffle_256x96x128x256_16x16_16x16_16x16x1_16x16x1_1x16x1x16_8x8x1_1x2_intrawave_v3,1011.51,782.01,0.0
256,1920,8192,1024,86,0,33.3463,a8w8_bpreshuffle_256x96x128x128_16x16_16x16_8x32x1_8x32x1_1x32x1x8_8x8x1_2x1_intrawave_v3,965.99,1253.87,0.0
256,1920,8192,4096,58,0,83.2972,a8w8_bpreshuffle_256x160x128x128_16x16_16x16_8x32x1_8x32x1_1x32x1x8_8x8x1_2x1_intrawave_v3,1546.86,874.89,0.0
256,1952,1280,8192,123,0,42.4901,a8w8_bpreshuffle_256x96x128x256_16x16_16x16_16x16x1_16x16x1_1x16x1x16_8x8x1_1x2_intrawave_v3,963.43,740.73,0.0
256,1952,8192,1024,86,0,38.3388,a8w8_bpreshuffle_256x96x128x128_16x16_16x16_8x32x1_8x32x1_1x32x1x8_8x8x1_2x1_intrawave_v3,854.2,1105.12,0.0
256,1952,8192,4096,154,0,89.7145,a8w8_bpreshuffle_256x128x256x256_16x16_16x16_16x16x1_16x16x1_1x16x1x16_8x8x1_1x2_intrawave_v3,1460.15,819.62,0.0
256,1984,1280,8192,123,0,41.5073,a8w8_bpreshuffle_256x96x128x256_16x16_16x16_16x16x1_16x16x1_1x16x1x16_8x8x1_1x2_intrawave_v3,1002.41,766.56,0.0
256,1984,8192,1024,58,0,38.4234,a8w8_bpreshuffle_256x160x128x128_16x16_16x16_8x32x1_8x32x1_1x32x1x8_8x8x1_2x1_intrawave_v3,866.29,1117.19,0.0
256,1984,8192,4096,154,0,91.9071,a8w8_bpreshuffle_256x128x256x256_16x16_16x16_16x16x1_16x16x1_1x16x1x16_8x8x1_1x2_intrawave_v3,1448.68,807.19,0.0
256,2016,1280,8192,123,0,41.5213,a8w8_bpreshuffle_256x96x128x256_16x16_16x16_16x16x1_16x16x1_1x16x1x16_8x8x1_1x2_intrawave_v3,1018.24,774.59,0.0
256,2016,8192,1024,86,0,37.7152,a8w8_bpreshuffle_256x96x128x128_16x16_16x16_8x32x1_8x32x1_1x32x1x8_8x8x1_2x1_intrawave_v3,896.8,1152.93,0.0
256,2016,8192,4096,33,0,90.9954,a8w8_bpreshuffle_256x256x256x128_16x16_16x16_8x32x1_8x32x1_1x32x1x8_8x8x1_2x1_intrawave_v3,1486.79,822.48,0.0
