aiter/configs/profile_fmoe.csv
stage,cu_num,token,model_dim,inter_dim,expert,topk,act_type,dtype,q_dtype_a,q_dtype_w,q_type,use_g1u1,doweight_stage1,block_m,ksplit,us,kernelName,err,tflops,bw
stage1,256,16,7168,256,257,9,ActivationType.Silu,torch.bfloat16,torch.float8_e4m3fn,torch.float8_e4m3fn,QuantType.per_1x128,1,0,16,0,90.115,_ZN5aiter59fmoe_stage1_bf16_pertokenFp8_blockscale_g1u1_16x128_4tg_pf2E,96.2%,17.59,15703.66
stage1,256,16,7168,256,257,9,ActivationType.Silu,torch.bfloat16,torch.float8_e4m3fn,torch.float8_e4m3fn,QuantType.per_1x128,1,0,16,0,71.4712,_ZN5aiter59fmoe_stage1_bf16_pertokenFp8_blockscale_g1u1_16x128_4tg_pf3E,96.1%,22.18,19800.08
stage1,256,16,7168,256,257,9,ActivationType.Silu,torch.bfloat16,torch.float8_e4m3fn,torch.float8_e4m3fn,QuantType.per_1x128,1,0,16,0,108.5186,_ZN5aiter59fmoe_stage1_bf16_pertokenFp8_blockscale_g1u1_16x256_3tg_pf2E,96.4%,14.61,13040.49
stage1,256,16,7168,256,257,9,ActivationType.Silu,torch.bfloat16,torch.float8_e4m3fn,torch.float8_e4m3fn,QuantType.per_1x128,1,0,16,0,90.8584,_ZN5aiter59fmoe_stage1_bf16_pertokenFp8_blockscale_g1u1_16x256_2tg_pf3E,96.4%,17.45,15575.17
stage1,256,16,7168,256,257,9,ActivationType.Silu,torch.bfloat16,torch.float8_e4m3fn,torch.float8_e4m3fn,QuantType.per_1x128,1,0,16,0,inf,_ZN5aiter59fmoe_stage1_bf16_pertokenFp8_blockscale_g1u1_16x512_2tg_pf2E,100.0%,0.0,0.0
stage1,256,16,7168,256,257,9,ActivationType.Silu,torch.bfloat16,torch.float8_e4m3fn,torch.float8_e4m3fn,QuantType.per_1x128,1,0,16,0,inf,_ZN5aiter55fmoe_stage1_bf16_pertokenFp8_blockscale_g1u1_16x512_pf3E,100.0%,0.0,0.0
stage1,256,16,7168,256,257,9,ActivationType.Silu,torch.bfloat16,torch.float8_e4m3fn,torch.float8_e4m3fn,QuantType.per_1x128,1,0,32,0,91.0331,_ZN5aiter59fmoe_stage1_bf16_pertokenFp8_blockscale_g1u1_32x128_3tg_pf2E,96.8%,17.42,15545.28
stage1,256,16,7168,256,257,9,ActivationType.Silu,torch.bfloat16,torch.float8_e4m3fn,torch.float8_e4m3fn,QuantType.per_1x128,1,0,32,0,72.3473,_ZN5aiter59fmoe_stage1_bf16_pertokenFp8_blockscale_g1u1_32x128_3tg_pf3E,96.8%,21.91,19560.3
stage1,256,16,7168,256,257,9,ActivationType.Silu,torch.bfloat16,torch.float8_e4m3fn,torch.float8_e4m3fn,QuantType.per_1x128,1,0,32,0,110.589,_ZN5aiter59fmoe_stage1_bf16_pertokenFp8_blockscale_g1u1_32x256_2tg_pf2E,96.8%,14.34,12796.35
stage1,256,16,7168,256,257,9,ActivationType.Silu,torch.bfloat16,torch.float8_e4m3fn,torch.float8_e4m3fn,QuantType.per_1x128,1,0,32,0,91.3784,_ZN5aiter59fmoe_stage1_bf16_pertokenFp8_blockscale_g1u1_32x256_2tg_pf3E,96.8%,17.35,15486.54
stage1,256,16,7168,256,257,9,ActivationType.Silu,torch.bfloat16,torch.float8_e4m3fn,torch.float8_e4m3fn,QuantType.per_1x128,1,0,32,0,inf,_ZN5aiter55fmoe_stage1_bf16_pertokenFp8_blockscale_g1u1_32x512_pf2E,100.0%,0.0,0.0
stage1,256,16,7168,256,257,9,ActivationType.Silu,torch.bfloat16,torch.float8_e4m3fn,torch.float8_e4m3fn,QuantType.per_1x128,1,0,32,0,inf,_ZN5aiter55fmoe_stage1_bf16_pertokenFp8_blockscale_g1u1_32x512_pf3E,100.0%,0.0,0.0
stage1,256,16,7168,256,257,9,ActivationType.Silu,torch.bfloat16,torch.float8_e4m3fn,torch.float8_e4m3fn,QuantType.per_1x128,1,0,64,0,90.37,_ZN5aiter59fmoe_stage1_bf16_pertokenFp8_blockscale_g1u1_64x128_2tg_pf2E,96.8%,17.54,15659.35
stage1,256,16,7168,256,257,9,ActivationType.Silu,torch.bfloat16,torch.float8_e4m3fn,torch.float8_e4m3fn,QuantType.per_1x128,1,0,64,0,72.9445,_ZN5aiter59fmoe_stage1_bf16_pertokenFp8_blockscale_g1u1_64x128_2tg_pf3E,96.8%,21.73,19400.16
stage1,256,16,7168,256,257,9,ActivationType.Silu,torch.bfloat16,torch.float8_e4m3fn,torch.float8_e4m3fn,QuantType.per_1x128,1,0,64,0,113.0969,_ZN5aiter55fmoe_stage1_bf16_pertokenFp8_blockscale_g1u1_64x256_pf2E,96.8%,14.02,12512.59
stage1,256,16,7168,256,257,9,ActivationType.Silu,torch.bfloat16,torch.float8_e4m3fn,torch.float8_e4m3fn,QuantType.per_1x128,1,0,64,0,98.1941,_ZN5aiter55fmoe_stage1_bf16_pertokenFp8_blockscale_g1u1_64x256_pf3E,96.8%,16.15,14411.61
stage1,256,16,7168,256,257,9,ActivationType.Silu,torch.bfloat16,torch.float8_e4m3fn,torch.float8_e4m3fn,QuantType.per_1x128,1,0,128,0,95.8148,_ZN5aiter56fmoe_stage1_bf16_pertokenFp8_blockscale_g1u1_128x128_pf2E,96.8%,16.55,14769.48
stage1,256,16,7168,256,257,9,ActivationType.Silu,torch.bfloat16,torch.float8_e4m3fn,torch.float8_e4m3fn,QuantType.per_1x128,1,0,128,0,83.4902,_ZN5aiter56fmoe_stage1_bf16_pertokenFp8_blockscale_g1u1_128x128_pf3E,96.8%,18.99,16949.72
stage1,256,16,7168,256,257,9,ActivationType.Silu,torch.bfloat16,torch.float8_e4m3fn,torch.float8_e4m3fn,QuantType.per_1x128,1,0,16,0,75.2396,moe_ck2stages_gemm1_256x16x128x256_1x4_MulABScaleExpertWeightA8W8blkscale_v1_Nswizzle0_Quant4_MulRoutedWeight0_silu_F8_F8_B16,0.1%,21.07,18808.38
stage2,256,16,7168,256,257,9,ActivationType.Silu,torch.bfloat16,torch.float8_e4m3fn,torch.float8_e4m3fn,QuantType.per_1x128,1,0,16,0,43.095,moe_ck2stages_gemm2_256x16x128x256_1x4_MulABScaleExpertWeightA8W8blkscale_v1_Nswizzle0_Quant4_MulRoutedWeight1_F8_F8_B16,16.8%,36.79,32837.57
stage1,256,16,7168,256,257,9,ActivationType.Silu,torch.bfloat16,torch.float8_e4m3fn,torch.float8_e4m3fn,QuantType.per_1x128,1,0,64,0,79.6543,moe_ck2stages_gemm1_256x64x128x128_1x4_MulABScaleExpertWeightA8W8blkscale_v3_Nswizzle0_Quant4_MulRoutedWeight0_silu_F8_F8_B16,0.1%,19.9,17765.96
stage2,256,16,7168,256,257,9,ActivationType.Silu,torch.bfloat16,torch.float8_e4m3fn,torch.float8_e4m3fn,QuantType.per_1x128,1,0,64,0,74.9075,moe_ck2stages_gemm2_256x64x128x128_1x4_MulABScaleExpertWeightA8W8blkscale_v3_Nswizzle0_Quant4_MulRoutedWeight1_F8_F8_B16,16.9%,21.17,18891.77
asm_1stage,256,16,7168,256,257,9,ActivationType.Silu,torch.bfloat16,torch.float8_e4m3fn,torch.float8_e4m3fn,QuantType.per_1x128,1,0,32,0,143.0116,_ZN5aiter52fmoe_bf16_blockscaleFp8_g1u1_novs_silu_1tg_ps_32x256E,0.0%,11.09,9895.25
asm_1stage,256,16,7168,256,257,9,ActivationType.Silu,torch.bfloat16,torch.float8_e4m3fn,torch.float8_e4m3fn,QuantType.per_1x128,1,0,32,0,138.5878,_ZN5aiter50fmoe_bf16_blockscaleFp8_g1u1_vs_silu_1tg_ps_32x256E,0.0%,11.44,10211.11
asm_1stage,256,16,7168,256,257,9,ActivationType.Silu,torch.bfloat16,torch.float8_e4m3fn,torch.float8_e4m3fn,QuantType.per_1x128,1,0,32,0,143.6949,_ZN5aiter49fmoe_bf16_blockscaleFp8_g1u1_novs_silu_1tg_32x256E,0.0%,11.03,9848.19
asm_1stage,256,16,7168,256,257,9,ActivationType.Silu,torch.bfloat16,torch.float8_e4m3fn,torch.float8_e4m3fn,QuantType.per_1x128,1,0,32,0,137.2094,_ZN5aiter47fmoe_bf16_blockscaleFp8_g1u1_vs_silu_1tg_32x256E,0.0%,11.55,10313.69
stage1,256,32,7168,256,257,9,ActivationType.Silu,torch.bfloat16,torch.float8_e4m3fn,torch.float8_e4m3fn,QuantType.per_1x128,1,0,16,0,112.8787,_ZN5aiter59fmoe_stage1_bf16_pertokenFp8_blockscale_g1u1_16x128_4tg_pf2E,99.1%,28.09,12539.83
stage1,256,32,7168,256,257,9,ActivationType.Silu,torch.bfloat16,torch.float8_e4m3fn,torch.float8_e4m3fn,QuantType.per_1x128,1,0,16,0,122.2188,_ZN5aiter59fmoe_stage1_bf16_pertokenFp8_blockscale_g1u1_16x128_4tg_pf3E,99.1%,25.94,11581.52
stage1,256,32,7168,256,257,9,ActivationType.Silu,torch.bfloat16,torch.float8_e4m3fn,torch.float8_e4m3fn,QuantType.per_1x128,1,0,16,0,120.8189,_ZN5aiter59fmoe_stage1_bf16_pertokenFp8_blockscale_g1u1_16x256_3tg_pf2E,99.4%,26.25,11715.71
stage1,256,32,7168,256,257,9,ActivationType.Silu,torch.bfloat16,torch.float8_e4m3fn,torch.float8_e4m3fn,QuantType.per_1x128,1,0,16,0,110.1195,_ZN5aiter59fmoe_stage1_bf16_pertokenFp8_blockscale_g1u1_16x256_2tg_pf3E,99.4%,28.8,12854.03
stage1,256,32,7168,256,257,9,ActivationType.Silu,torch.bfloat16,torch.float8_e4m3fn,torch.float8_e4m3fn,QuantType.per_1x128,1,0,16,0,inf,_ZN5aiter59fmoe_stage1_bf16_pertokenFp8_blockscale_g1u1_16x512_2tg_pf2E,100.0%,0.0,0.0
stage1,256,32,7168,256,257,9,ActivationType.Silu,torch.bfloat16,torch.float8_e4m3fn,torch.float8_e4m3fn,QuantType.per_1x128,1,0,16,0,inf,_ZN5aiter55fmoe_stage1_bf16_pertokenFp8_blockscale_g1u1_16x512_pf3E,100.0%,0.0,0.0
stage1,256,32,7168,256,257,9,ActivationType.Silu,torch.bfloat16,torch.float8_e4m3fn,torch.float8_e4m3fn,QuantType.per_1x128,1,0,32,0,113.6906,_ZN5aiter59fmoe_stage1_bf16_pertokenFp8_blockscale_g1u1_32x128_3tg_pf2E,99.7%,27.89,12450.28
stage1,256,32,7168,256,257,9,ActivationType.Silu,torch.bfloat16,torch.float8_e4m3fn,torch.float8_e4m3fn,QuantType.per_1x128,1,0,32,0,124.0155,_ZN5aiter59fmoe_stage1_bf16_pertokenFp8_blockscale_g1u1_32x128_3tg_pf3E,99.5%,25.57,11413.73
stage1,256,32,7168,256,257,9,ActivationType.Silu,torch.bfloat16,torch.float8_e4m3fn,torch.float8_e4m3fn,QuantType.per_1x128,1,0,32,0,124.783,_ZN5aiter59fmoe_stage1_bf16_pertokenFp8_blockscale_g1u1_32x256_2tg_pf2E,99.7%,25.41,11343.53
stage1,256,32,7168,256,257,9,ActivationType.Silu,torch.bfloat16,torch.float8_e4m3fn,torch.float8_e4m3fn,QuantType.per_1x128,1,0,32,0,111.3863,_ZN5aiter59fmoe_stage1_bf16_pertokenFp8_blockscale_g1u1_32x256_2tg_pf3E,99.7%,28.47,12707.84
stage1,256,32,7168,256,257,9,ActivationType.Silu,torch.bfloat16,torch.float8_e4m3fn,torch.float8_e4m3fn,QuantType.per_1x128,1,0,32,0,inf,_ZN5aiter55fmoe_stage1_bf16_pertokenFp8_blockscale_g1u1_32x512_pf2E,100.0%,0.0,0.0
stage1,256,32,7168,256,257,9,ActivationType.Silu,torch.bfloat16,torch.float8_e4m3fn,torch.float8_e4m3fn,QuantType.per_1x128,1,0,32,0,inf,_ZN5aiter55fmoe_stage1_bf16_pertokenFp8_blockscale_g1u1_32x512_pf3E,100.0%,0.0,0.0
stage1,256,32,7168,256,257,9,ActivationType.Silu,torch.bfloat16,torch.float8_e4m3fn,torch.float8_e4m3fn,QuantType.per_1x128,1,0,64,0,116.7554,_ZN5aiter59fmoe_stage1_bf16_pertokenFp8_blockscale_g1u1_64x128_2tg_pf2E,99.7%,27.16,12123.46
stage1,256,32,7168,256,257,9,ActivationType.Silu,torch.bfloat16,torch.float8_e4m3fn,torch.float8_e4m3fn,QuantType.per_1x128,1,0,64,0,127.6085,_ZN5aiter59fmoe_stage1_bf16_pertokenFp8_blockscale_g1u1_64x128_2tg_pf3E,99.7%,24.85,11092.36
stage1,256,32,7168,256,257,9,ActivationType.Silu,torch.bfloat16,torch.float8_e4m3fn,torch.float8_e4m3fn,QuantType.per_1x128,1,0,64,0,126.943,_ZN5aiter55fmoe_stage1_bf16_pertokenFp8_blockscale_g1u1_64x256_pf2E,99.7%,24.98,11150.51
stage1,256,32,7168,256,257,9,ActivationType.Silu,torch.bfloat16,torch.float8_e4m3fn,torch.float8_e4m3fn,QuantType.per_1x128,1,0,64,0,115.3046,_ZN5aiter55fmoe_stage1_bf16_pertokenFp8_blockscale_g1u1_64x256_pf3E,99.7%,27.5,12276.0
stage1,256,32,7168,256,257,9,ActivationType.Silu,torch.bfloat16,torch.float8_e4m3fn,torch.float8_e4m3fn,QuantType.per_1x128,1,0,128,0,178.8422,_ZN5aiter56fmoe_stage1_bf16_pertokenFp8_blockscale_g1u1_128x128_pf2E,99.7%,17.73,7914.68
stage1,256,32,7168,256,257,9,ActivationType.Silu,torch.bfloat16,torch.float8_e4m3fn,torch.float8_e4m3fn,QuantType.per_1x128,1,0,128,0,150.8186,_ZN5aiter56fmoe_stage1_bf16_pertokenFp8_blockscale_g1u1_128x128_pf3E,99.7%,21.02,9385.31
stage1,256,32,7168,256,257,9,ActivationType.Silu,torch.bfloat16,torch.float8_e4m3fn,torch.float8_e4m3fn,QuantType.per_1x128,1,0,16,0,126.2582,moe_ck2stages_gemm1_256x16x128x256_1x4_MulABScaleExpertWeightA8W8blkscale_v1_Nswizzle0_Quant4_MulRoutedWeight0_silu_F8_F8_B16,0.1%,25.11,11210.99
stage2,256,32,7168,256,257,9,ActivationType.Silu,torch.bfloat16,torch.float8_e4m3fn,torch.float8_e4m3fn,QuantType.per_1x128,1,0,16,0,63.0949,moe_ck2stages_gemm2_256x16x128x256_1x4_MulABScaleExpertWeightA8W8blkscale_v1_Nswizzle0_Quant4_MulRoutedWeight1_F8_F8_B16,17.0%,50.26,22434.13
stage1,256,32,7168,256,257,9,ActivationType.Silu,torch.bfloat16,torch.float8_e4m3fn,torch.float8_e4m3fn,QuantType.per_1x128,1,0,64,0,135.7116,moe_ck2stages_gemm1_256x64x128x128_1x4_MulABScaleExpertWeightA8W8blkscale_v3_Nswizzle0_Quant4_MulRoutedWeight0_silu_F8_F8_B16,0.1%,23.36,10430.05
stage2,256,32,7168,256,257,9,ActivationType.Silu,torch.bfloat16,torch.float8_e4m3fn,torch.float8_e4m3fn,QuantType.per_1x128,1,0,64,0,111.2537,moe_ck2stages_gemm2_256x64x128x128_1x4_MulABScaleExpertWeightA8W8blkscale_v3_Nswizzle0_Quant4_MulRoutedWeight1_F8_F8_B16,17.0%,28.5,12722.99
asm_1stage,256,32,7168,256,257,9,ActivationType.Silu,torch.bfloat16,torch.float8_e4m3fn,torch.float8_e4m3fn,QuantType.per_1x128,1,0,32,0,178.9001,_ZN5aiter52fmoe_bf16_blockscaleFp8_g1u1_novs_silu_1tg_ps_32x256E,0.0%,17.72,7912.12
asm_1stage,256,32,7168,256,257,9,ActivationType.Silu,torch.bfloat16,torch.float8_e4m3fn,torch.float8_e4m3fn,QuantType.per_1x128,1,0,32,0,176.4727,_ZN5aiter50fmoe_bf16_blockscaleFp8_g1u1_vs_silu_1tg_ps_32x256E,0.0%,17.97,8020.95
asm_1stage,256,32,7168,256,257,9,ActivationType.Silu,torch.bfloat16,torch.float8_e4m3fn,torch.float8_e4m3fn,QuantType.per_1x128,1,0,32,0,177.3157,_ZN5aiter49fmoe_bf16_blockscaleFp8_g1u1_novs_silu_1tg_32x256E,0.0%,17.88,7982.82
asm_1stage,256,32,7168,256,257,9,ActivationType.Silu,torch.bfloat16,torch.float8_e4m3fn,torch.float8_e4m3fn,QuantType.per_1x128,1,0,32,0,168.0159,_ZN5aiter47fmoe_bf16_blockscaleFp8_g1u1_vs_silu_1tg_32x256E,0.0%,18.87,8424.67
stage1,256,64,7168,256,257,9,ActivationType.Silu,torch.bfloat16,torch.float8_e4m3fn,torch.float8_e4m3fn,QuantType.per_1x128,1,0,16,0,143.7762,_ZN5aiter59fmoe_stage1_bf16_pertokenFp8_blockscale_g1u1_16x128_4tg_pf2E,99.1%,44.11,9849.8
stage1,256,64,7168,256,257,9,ActivationType.Silu,torch.bfloat16,torch.float8_e4m3fn,torch.float8_e4m3fn,QuantType.per_1x128,1,0,16,0,143.9887,_ZN5aiter59fmoe_stage1_bf16_pertokenFp8_blockscale_g1u1_16x128_4tg_pf3E,98.9%,44.04,9835.27
stage1,256,64,7168,256,257,9,ActivationType.Silu,torch.bfloat16,torch.float8_e4m3fn,torch.float8_e4m3fn,QuantType.per_1x128,1,0,16,0,143.3709,_ZN5aiter59fmoe_stage1_bf16_pertokenFp8_blockscale_g1u1_16x256_3tg_pf2E,99.2%,44.23,9877.65
stage1,256,64,7168,256,257,9,ActivationType.Silu,torch.bfloat16,torch.float8_e4m3fn,torch.float8_e4m3fn,QuantType.per_1x128,1,0,16,0,143.5523,_ZN5aiter59fmoe_stage1_bf16_pertokenFp8_blockscale_g1u1_16x256_2tg_pf3E,99.3%,44.18,9865.17
stage1,256,64,7168,256,257,9,ActivationType.Silu,torch.bfloat16,torch.float8_e4m3fn,torch.float8_e4m3fn,QuantType.per_1x128,1,0,16,0,inf,_ZN5aiter59fmoe_stage1_bf16_pertokenFp8_blockscale_g1u1_16x512_2tg_pf2E,100.0%,0.0,0.0
stage1,256,64,7168,256,257,9,ActivationType.Silu,torch.bfloat16,torch.float8_e4m3fn,torch.float8_e4m3fn,QuantType.per_1x128,1,0,16,0,inf,_ZN5aiter55fmoe_stage1_bf16_pertokenFp8_blockscale_g1u1_16x512_pf3E,100.0%,0.0,0.0
stage1,256,64,7168,256,257,9,ActivationType.Silu,torch.bfloat16,torch.float8_e4m3fn,torch.float8_e4m3fn,QuantType.per_1x128,1,0,32,0,144.1992,_ZN5aiter59fmoe_stage1_bf16_pertokenFp8_blockscale_g1u1_32x128_3tg_pf2E,99.7%,43.98,9820.91
stage1,256,64,7168,256,257,9,ActivationType.Silu,torch.bfloat16,torch.float8_e4m3fn,torch.float8_e4m3fn,QuantType.per_1x128,1,0,32,0,143.9358,_ZN5aiter59fmoe_stage1_bf16_pertokenFp8_blockscale_g1u1_32x128_3tg_pf3E,99.6%,44.06,9838.88
stage1,256,64,7168,256,257,9,ActivationType.Silu,torch.bfloat16,torch.float8_e4m3fn,torch.float8_e4m3fn,QuantType.per_1x128,1,0,32,0,146.0893,_ZN5aiter59fmoe_stage1_bf16_pertokenFp8_blockscale_g1u1_32x256_2tg_pf2E,99.7%,43.41,9693.85
stage1,256,64,7168,256,257,9,ActivationType.Silu,torch.bfloat16,torch.float8_e4m3fn,torch.float8_e4m3fn,QuantType.per_1x128,1,0,32,0,144.4555,_ZN5aiter59fmoe_stage1_bf16_pertokenFp8_blockscale_g1u1_32x256_2tg_pf3E,99.7%,43.9,9803.49
stage1,256,64,7168,256,257,9,ActivationType.Silu,torch.bfloat16,torch.float8_e4m3fn,torch.float8_e4m3fn,QuantType.per_1x128,1,0,32,0,inf,_ZN5aiter55fmoe_stage1_bf16_pertokenFp8_blockscale_g1u1_32x512_pf2E,100.0%,0.0,0.0
stage1,256,64,7168,256,257,9,ActivationType.Silu,torch.bfloat16,torch.float8_e4m3fn,torch.float8_e4m3fn,QuantType.per_1x128,1,0,32,0,inf,_ZN5aiter55fmoe_stage1_bf16_pertokenFp8_blockscale_g1u1_32x512_pf3E,100.0%,0.0,0.0
stage1,256,64,7168,256,257,9,ActivationType.Silu,torch.bfloat16,torch.float8_e4m3fn,torch.float8_e4m3fn,QuantType.per_1x128,1,0,64,0,145.2705,_ZN5aiter59fmoe_stage1_bf16_pertokenFp8_blockscale_g1u1_64x128_2tg_pf2E,99.7%,43.66,9748.49
stage1,256,64,7168,256,257,9,ActivationType.Silu,torch.bfloat16,torch.float8_e4m3fn,torch.float8_e4m3fn,QuantType.per_1x128,1,0,64,0,145.0707,_ZN5aiter59fmoe_stage1_bf16_pertokenFp8_blockscale_g1u1_64x128_2tg_pf3E,99.7%,43.72,9761.91
stage1,256,64,7168,256,257,9,ActivationType.Silu,torch.bfloat16,torch.float8_e4m3fn,torch.float8_e4m3fn,QuantType.per_1x128,1,0,64,0,148.6233,_ZN5aiter55fmoe_stage1_bf16_pertokenFp8_blockscale_g1u1_64x256_pf2E,99.7%,42.67,9528.57
stage1,256,64,7168,256,257,9,ActivationType.Silu,torch.bfloat16,torch.float8_e4m3fn,torch.float8_e4m3fn,QuantType.per_1x128,1,0,64,0,147.2931,_ZN5aiter55fmoe_stage1_bf16_pertokenFp8_blockscale_g1u1_64x256_pf3E,99.7%,43.06,9614.62
stage1,256,64,7168,256,257,9,ActivationType.Silu,torch.bfloat16,torch.float8_e4m3fn,torch.float8_e4m3fn,QuantType.per_1x128,1,0,128,0,191.0307,_ZN5aiter56fmoe_stage1_bf16_pertokenFp8_blockscale_g1u1_128x128_pf2E,99.7%,33.2,7413.3
stage1,256,64,7168,256,257,9,ActivationType.Silu,torch.bfloat16,torch.float8_e4m3fn,torch.float8_e4m3fn,QuantType.per_1x128,1,0,128,0,164.9624,_ZN5aiter56fmoe_stage1_bf16_pertokenFp8_blockscale_g1u1_128x128_pf3E,99.7%,38.44,8584.79
stage1,256,64,7168,256,257,9,ActivationType.Silu,torch.bfloat16,torch.float8_e4m3fn,torch.float8_e4m3fn,QuantType.per_1x128,1,0,16,0,147.4468,moe_ck2stages_gemm1_256x16x128x256_1x4_MulABScaleExpertWeightA8W8blkscale_v1_Nswizzle0_Quant4_MulRoutedWeight0_silu_F8_F8_B16,0.1%,43.01,9604.6
stage2,256,64,7168,256,257,9,ActivationType.Silu,torch.bfloat16,torch.float8_e4m3fn,torch.float8_e4m3fn,QuantType.per_1x128,1,0,16,0,82.2176,moe_ck2stages_gemm2_256x16x128x256_1x4_MulABScaleExpertWeightA8W8blkscale_v1_Nswizzle0_Quant4_MulRoutedWeight1_F8_F8_B16,16.9%,77.13,17224.63
stage1,256,64,7168,256,257,9,ActivationType.Silu,torch.bfloat16,torch.float8_e4m3fn,torch.float8_e4m3fn,QuantType.per_1x128,1,0,64,0,152.5675,moe_ck2stages_gemm1_256x64x128x128_1x4_MulABScaleExpertWeightA8W8blkscale_v3_Nswizzle0_Quant4_MulRoutedWeight0_silu_F8_F8_B16,0.1%,41.57,9282.24
stage2,256,64,7168,256,257,9,ActivationType.Silu,torch.bfloat16,torch.float8_e4m3fn,torch.float8_e4m3fn,QuantType.per_1x128,1,0,64,0,144.9819,moe_ck2stages_gemm2_256x64x128x128_1x4_MulABScaleExpertWeightA8W8blkscale_v3_Nswizzle0_Quant4_MulRoutedWeight1_F8_F8_B16,16.9%,43.74,9767.89
asm_1stage,256,64,7168,256,257,9,ActivationType.Silu,torch.bfloat16,torch.float8_e4m3fn,torch.float8_e4m3fn,QuantType.per_1x128,1,0,32,0,230.5659,_ZN5aiter52fmoe_bf16_blockscaleFp8_g1u1_novs_silu_1tg_ps_32x256E,0.0%,27.51,6142.14
asm_1stage,256,64,7168,256,257,9,ActivationType.Silu,torch.bfloat16,torch.float8_e4m3fn,torch.float8_e4m3fn,QuantType.per_1x128,1,0,32,0,218.1198,_ZN5aiter50fmoe_bf16_blockscaleFp8_g1u1_vs_silu_1tg_ps_32x256E,0.0%,29.07,6492.61
asm_1stage,256,64,7168,256,257,9,ActivationType.Silu,torch.bfloat16,torch.float8_e4m3fn,torch.float8_e4m3fn,QuantType.per_1x128,1,0,32,0,229.1609,_ZN5aiter49fmoe_bf16_blockscaleFp8_g1u1_novs_silu_1tg_32x256E,0.0%,27.67,6179.8
asm_1stage,256,64,7168,256,257,9,ActivationType.Silu,torch.bfloat16,torch.float8_e4m3fn,torch.float8_e4m3fn,QuantType.per_1x128,1,0,32,0,227.4868,_ZN5aiter47fmoe_bf16_blockscaleFp8_g1u1_vs_silu_1tg_32x256E,0.0%,27.88,6225.27
stage1,256,128,7168,256,257,9,ActivationType.Silu,torch.bfloat16,torch.float8_e4m3fn,torch.float8_e4m3fn,QuantType.per_1x128,1,0,16,0,158.9268,_ZN5aiter59fmoe_stage1_bf16_pertokenFp8_blockscale_g1u1_16x128_4tg_pf2E,99.0%,79.81,8919.48
stage1,256,128,7168,256,257,9,ActivationType.Silu,torch.bfloat16,torch.float8_e4m3fn,torch.float8_e4m3fn,QuantType.per_1x128,1,0,16,0,159.0981,_ZN5aiter59fmoe_stage1_bf16_pertokenFp8_blockscale_g1u1_16x128_4tg_pf3E,99.1%,79.72,8909.87
stage1,256,128,7168,256,257,9,ActivationType.Silu,torch.bfloat16,torch.float8_e4m3fn,torch.float8_e4m3fn,QuantType.per_1x128,1,0,16,0,160.3075,_ZN5aiter59fmoe_stage1_bf16_pertokenFp8_blockscale_g1u1_16x256_3tg_pf2E,99.3%,79.12,8842.65
stage1,256,128,7168,256,257,9,ActivationType.Silu,torch.bfloat16,torch.float8_e4m3fn,torch.float8_e4m3fn,QuantType.per_1x128,1,0,16,0,160.2916,_ZN5aiter59fmoe_stage1_bf16_pertokenFp8_blockscale_g1u1_16x256_2tg_pf3E,99.2%,79.13,8843.53
stage1,256,128,7168,256,257,9,ActivationType.Silu,torch.bfloat16,torch.float8_e4m3fn,torch.float8_e4m3fn,QuantType.per_1x128,1,0,16,0,inf,_ZN5aiter59fmoe_stage1_bf16_pertokenFp8_blockscale_g1u1_16x512_2tg_pf2E,100.0%,0.0,0.0
stage1,256,128,7168,256,257,9,ActivationType.Silu,torch.bfloat16,torch.float8_e4m3fn,torch.float8_e4m3fn,QuantType.per_1x128,1,0,16,0,inf,_ZN5aiter55fmoe_stage1_bf16_pertokenFp8_blockscale_g1u1_16x512_pf3E,100.0%,0.0,0.0
stage1,256,128,7168,256,257,9,ActivationType.Silu,torch.bfloat16,torch.float8_e4m3fn,torch.float8_e4m3fn,QuantType.per_1x128,1,0,32,0,160.4267,_ZN5aiter59fmoe_stage1_bf16_pertokenFp8_blockscale_g1u1_32x128_3tg_pf2E,99.7%,79.06,8836.08
stage1,256,128,7168,256,257,9,ActivationType.Silu,torch.bfloat16,torch.float8_e4m3fn,torch.float8_e4m3fn,QuantType.per_1x128,1,0,32,0,160.1827,_ZN5aiter59fmoe_stage1_bf16_pertokenFp8_blockscale_g1u1_32x128_3tg_pf3E,99.6%,79.18,8849.54
stage1,256,128,7168,256,257,9,ActivationType.Silu,torch.bfloat16,torch.float8_e4m3fn,torch.float8_e4m3fn,QuantType.per_1x128,1,0,32,0,159.7464,_ZN5aiter59fmoe_stage1_bf16_pertokenFp8_blockscale_g1u1_32x256_2tg_pf2E,99.7%,79.4,8873.71
stage1,256,128,7168,256,257,9,ActivationType.Silu,torch.bfloat16,torch.float8_e4m3fn,torch.float8_e4m3fn,QuantType.per_1x128,1,0,32,0,160.6272,_ZN5aiter59fmoe_stage1_bf16_pertokenFp8_blockscale_g1u1_32x256_2tg_pf3E,99.7%,78.96,8825.05
stage1,256,128,7168,256,257,9,ActivationType.Silu,torch.bfloat16,torch.float8_e4m3fn,torch.float8_e4m3fn,QuantType.per_1x128,1,0,32,0,inf,_ZN5aiter55fmoe_stage1_bf16_pertokenFp8_blockscale_g1u1_32x512_pf2E,100.0%,0.0,0.0
stage1,256,128,7168,256,257,9,ActivationType.Silu,torch.bfloat16,torch.float8_e4m3fn,torch.float8_e4m3fn,QuantType.per_1x128,1,0,32,0,inf,_ZN5aiter55fmoe_stage1_bf16_pertokenFp8_blockscale_g1u1_32x512_pf3E,100.0%,0.0,0.0
stage1,256,128,7168,256,257,9,ActivationType.Silu,torch.bfloat16,torch.float8_e4m3fn,torch.float8_e4m3fn,QuantType.per_1x128,1,0,64,0,161.0098,_ZN5aiter59fmoe_stage1_bf16_pertokenFp8_blockscale_g1u1_64x128_2tg_pf2E,99.7%,78.78,8804.08
stage1,256,128,7168,256,257,9,ActivationType.Silu,torch.bfloat16,torch.float8_e4m3fn,torch.float8_e4m3fn,QuantType.per_1x128,1,0,64,0,160.6479,_ZN5aiter59fmoe_stage1_bf16_pertokenFp8_blockscale_g1u1_64x128_2tg_pf3E,99.7%,78.95,8823.92
stage1,256,128,7168,256,257,9,ActivationType.Silu,torch.bfloat16,torch.float8_e4m3fn,torch.float8_e4m3fn,QuantType.per_1x128,1,0,64,0,162.2071,_ZN5aiter55fmoe_stage1_bf16_pertokenFp8_blockscale_g1u1_64x256_pf2E,99.7%,78.19,8739.1
stage1,256,128,7168,256,257,9,ActivationType.Silu,torch.bfloat16,torch.float8_e4m3fn,torch.float8_e4m3fn,QuantType.per_1x128,1,0,64,0,163.5224,_ZN5aiter55fmoe_stage1_bf16_pertokenFp8_blockscale_g1u1_64x256_pf3E,99.7%,77.56,8668.8
stage1,256,128,7168,256,257,9,ActivationType.Silu,torch.bfloat16,torch.float8_e4m3fn,torch.float8_e4m3fn,QuantType.per_1x128,1,0,128,0,197.3439,_ZN5aiter56fmoe_stage1_bf16_pertokenFp8_blockscale_g1u1_128x128_pf2E,99.7%,64.27,7183.11
stage1,256,128,7168,256,257,9,ActivationType.Silu,torch.bfloat16,torch.float8_e4m3fn,torch.float8_e4m3fn,QuantType.per_1x128,1,0,128,0,174.0337,_ZN5aiter56fmoe_stage1_bf16_pertokenFp8_blockscale_g1u1_128x128_pf3E,99.7%,72.88,8145.23
stage1,256,128,7168,256,257,9,ActivationType.Silu,torch.bfloat16,torch.float8_e4m3fn,torch.float8_e4m3fn,QuantType.per_1x128,1,0,16,0,161.6119,moe_ck2stages_gemm1_256x16x128x256_1x4_MulABScaleExpertWeightA8W8blkscale_v1_Nswizzle0_Quant4_MulRoutedWeight0_silu_F8_F8_B16,0.1%,78.48,8771.28
stage2,256,128,7168,256,257,9,ActivationType.Silu,torch.bfloat16,torch.float8_e4m3fn,torch.float8_e4m3fn,QuantType.per_1x128,1,0,16,0,95.6481,moe_ck2stages_gemm2_256x16x128x256_1x4_MulABScaleExpertWeightA8W8blkscale_v1_Nswizzle0_Quant4_MulRoutedWeight1_F8_F8_B16,16.9%,132.61,14820.41
stage1,256,128,7168,256,257,9,ActivationType.Silu,torch.bfloat16,torch.float8_e4m3fn,torch.float8_e4m3fn,QuantType.per_1x128,1,0,64,0,167.9235,moe_ck2stages_gemm1_256x64x128x128_1x4_MulABScaleExpertWeightA8W8blkscale_v3_Nswizzle0_Quant4_MulRoutedWeight0_silu_F8_F8_B16,0.1%,75.53,8441.6
stage2,256,128,7168,256,257,9,ActivationType.Silu,torch.bfloat16,torch.float8_e4m3fn,torch.float8_e4m3fn,QuantType.per_1x128,1,0,64,0,176.6525,moe_ck2stages_gemm2_256x64x128x128_1x4_MulABScaleExpertWeightA8W8blkscale_v3_Nswizzle0_Quant4_MulRoutedWeight1_F8_F8_B16,16.9%,71.8,8024.48
asm_1stage,256,128,7168,256,257,9,ActivationType.Silu,torch.bfloat16,torch.float8_e4m3fn,torch.float8_e4m3fn,QuantType.per_1x128,1,0,32,0,258.3945,_ZN5aiter52fmoe_bf16_blockscaleFp8_g1u1_novs_silu_1tg_ps_32x256E,0.0%,49.09,5485.97
asm_1stage,256,128,7168,256,257,9,ActivationType.Silu,torch.bfloat16,torch.float8_e4m3fn,torch.float8_e4m3fn,QuantType.per_1x128,1,0,32,0,257.5497,_ZN5aiter50fmoe_bf16_blockscaleFp8_g1u1_vs_silu_1tg_ps_32x256E,0.0%,49.25,5503.96
asm_1stage,256,128,7168,256,257,9,ActivationType.Silu,torch.bfloat16,torch.float8_e4m3fn,torch.float8_e4m3fn,QuantType.per_1x128,1,0,32,0,255.0867,_ZN5aiter49fmoe_bf16_blockscaleFp8_g1u1_novs_silu_1tg_32x256E,0.0%,49.72,5557.11
asm_1stage,256,128,7168,256,257,9,ActivationType.Silu,torch.bfloat16,torch.float8_e4m3fn,torch.float8_e4m3fn,QuantType.per_1x128,1,0,32,0,247.7266,_ZN5aiter47fmoe_bf16_blockscaleFp8_g1u1_vs_silu_1tg_32x256E,0.0%,51.2,5722.21
stage1,256,256,7168,256,257,9,ActivationType.Silu,torch.bfloat16,torch.float8_e4m3fn,torch.float8_e4m3fn,QuantType.per_1x128,1,0,16,0,191.1208,_ZN5aiter59fmoe_stage1_bf16_pertokenFp8_blockscale_g1u1_16x128_4tg_pf2E,99.1%,132.73,7431.41
stage1,256,256,7168,256,257,9,ActivationType.Silu,torch.bfloat16,torch.float8_e4m3fn,torch.float8_e4m3fn,QuantType.per_1x128,1,0,16,0,194.6365,_ZN5aiter59fmoe_stage1_bf16_pertokenFp8_blockscale_g1u1_16x128_4tg_pf3E,99.1%,130.33,7297.17
stage1,256,256,7168,256,257,9,ActivationType.Silu,torch.bfloat16,torch.float8_e4m3fn,torch.float8_e4m3fn,QuantType.per_1x128,1,0,16,0,212.3959,_ZN5aiter59fmoe_stage1_bf16_pertokenFp8_blockscale_g1u1_16x256_3tg_pf2E,99.3%,119.43,6687.02
stage1,256,256,7168,256,257,9,ActivationType.Silu,torch.bfloat16,torch.float8_e4m3fn,torch.float8_e4m3fn,QuantType.per_1x128,1,0,16,0,224.1076,_ZN5aiter59fmoe_stage1_bf16_pertokenFp8_blockscale_g1u1_16x256_2tg_pf3E,99.3%,113.19,6337.56
stage1,256,256,7168,256,257,9,ActivationType.Silu,torch.bfloat16,torch.float8_e4m3fn,torch.float8_e4m3fn,QuantType.per_1x128,1,0,16,0,inf,_ZN5aiter59fmoe_stage1_bf16_pertokenFp8_blockscale_g1u1_16x512_2tg_pf2E,100.0%,0.0,0.0
stage1,256,256,7168,256,257,9,ActivationType.Silu,torch.bfloat16,torch.float8_e4m3fn,torch.float8_e4m3fn,QuantType.per_1x128,1,0,16,0,inf,_ZN5aiter55fmoe_stage1_bf16_pertokenFp8_blockscale_g1u1_16x512_pf3E,100.0%,0.0,0.0
stage1,256,256,7168,256,257,9,ActivationType.Silu,torch.bfloat16,torch.float8_e4m3fn,torch.float8_e4m3fn,QuantType.per_1x128,1,0,32,0,194.0598,_ZN5aiter59fmoe_stage1_bf16_pertokenFp8_blockscale_g1u1_32x128_3tg_pf2E,99.7%,130.72,7318.86
stage1,256,256,7168,256,257,9,ActivationType.Silu,torch.bfloat16,torch.float8_e4m3fn,torch.float8_e4m3fn,QuantType.per_1x128,1,0,32,0,193.2477,_ZN5aiter59fmoe_stage1_bf16_pertokenFp8_blockscale_g1u1_32x128_3tg_pf3E,99.6%,131.27,7349.61
stage1,256,256,7168,256,257,9,ActivationType.Silu,torch.bfloat16,torch.float8_e4m3fn,torch.float8_e4m3fn,QuantType.per_1x128,1,0,32,0,211.7726,_ZN5aiter59fmoe_stage1_bf16_pertokenFp8_blockscale_g1u1_32x256_2tg_pf2E,99.7%,119.78,6706.7
stage1,256,256,7168,256,257,9,ActivationType.Silu,torch.bfloat16,torch.float8_e4m3fn,torch.float8_e4m3fn,QuantType.per_1x128,1,0,32,0,219.5114,_ZN5aiter59fmoe_stage1_bf16_pertokenFp8_blockscale_g1u1_32x256_2tg_pf3E,99.7%,115.56,6470.26
stage1,256,256,7168,256,257,9,ActivationType.Silu,torch.bfloat16,torch.float8_e4m3fn,torch.float8_e4m3fn,QuantType.per_1x128,1,0,32,0,inf,_ZN5aiter55fmoe_stage1_bf16_pertokenFp8_blockscale_g1u1_32x512_pf2E,100.0%,0.0,0.0
stage1,256,256,7168,256,257,9,ActivationType.Silu,torch.bfloat16,torch.float8_e4m3fn,torch.float8_e4m3fn,QuantType.per_1x128,1,0,32,0,inf,_ZN5aiter55fmoe_stage1_bf16_pertokenFp8_blockscale_g1u1_32x512_pf3E,100.0%,0.0,0.0
stage1,256,256,7168,256,257,9,ActivationType.Silu,torch.bfloat16,torch.float8_e4m3fn,torch.float8_e4m3fn,QuantType.per_1x128,1,0,64,0,223.8925,_ZN5aiter59fmoe_stage1_bf16_pertokenFp8_blockscale_g1u1_64x128_2tg_pf2E,99.7%,113.3,6343.65
stage1,256,256,7168,256,257,9,ActivationType.Silu,torch.bfloat16,torch.float8_e4m3fn,torch.float8_e4m3fn,QuantType.per_1x128,1,0,64,0,192.9236,_ZN5aiter59fmoe_stage1_bf16_pertokenFp8_blockscale_g1u1_64x128_2tg_pf3E,99.7%,131.49,7361.96
stage1,256,256,7168,256,257,9,ActivationType.Silu,torch.bfloat16,torch.float8_e4m3fn,torch.float8_e4m3fn,QuantType.per_1x128,1,0,64,0,249.5617,_ZN5aiter55fmoe_stage1_bf16_pertokenFp8_blockscale_g1u1_64x256_pf2E,99.7%,101.65,5691.16
stage1,256,256,7168,256,257,9,ActivationType.Silu,torch.bfloat16,torch.float8_e4m3fn,torch.float8_e4m3fn,QuantType.per_1x128,1,0,64,0,231.7974,_ZN5aiter55fmoe_stage1_bf16_pertokenFp8_blockscale_g1u1_64x256_pf3E,99.7%,109.44,6127.32
stage1,256,256,7168,256,257,9,ActivationType.Silu,torch.bfloat16,torch.float8_e4m3fn,torch.float8_e4m3fn,QuantType.per_1x128,1,0,128,0,268.229,_ZN5aiter56fmoe_stage1_bf16_pertokenFp8_blockscale_g1u1_128x128_pf2E,99.7%,94.57,5295.09
stage1,256,256,7168,256,257,9,ActivationType.Silu,torch.bfloat16,torch.float8_e4m3fn,torch.float8_e4m3fn,QuantType.per_1x128,1,0,128,0,228.5638,_ZN5aiter56fmoe_stage1_bf16_pertokenFp8_blockscale_g1u1_128x128_pf3E,99.7%,110.98,6214.0
stage1,256,256,7168,256,257,9,ActivationType.Silu,torch.bfloat16,torch.float8_e4m3fn,torch.float8_e4m3fn,QuantType.per_1x128,1,0,16,0,194.6679,moe_ck2stages_gemm1_256x16x128x256_1x4_MulABScaleExpertWeightA8W8blkscale_v1_Nswizzle0_Quant4_MulRoutedWeight0_silu_F8_F8_B16,0.1%,130.31,7296.0
stage2,256,256,7168,256,257,9,ActivationType.Silu,torch.bfloat16,torch.float8_e4m3fn,torch.float8_e4m3fn,QuantType.per_1x128,1,0,16,0,127.9774,moe_ck2stages_gemm2_256x16x128x256_1x4_MulABScaleExpertWeightA8W8blkscale_v1_Nswizzle0_Quant4_MulRoutedWeight1_F8_F8_B16,16.8%,198.22,11098.02
stage1,256,256,7168,256,257,9,ActivationType.Silu,torch.bfloat16,torch.float8_e4m3fn,torch.float8_e4m3fn,QuantType.per_1x128,1,0,64,0,206.9479,moe_ck2stages_gemm1_256x64x128x128_1x4_MulABScaleExpertWeightA8W8blkscale_v3_Nswizzle0_Quant4_MulRoutedWeight0_silu_F8_F8_B16,0.1%,122.58,6863.06
stage2,256,256,7168,256,257,9,ActivationType.Silu,torch.bfloat16,torch.float8_e4m3fn,torch.float8_e4m3fn,QuantType.per_1x128,1,0,64,0,281.8204,moe_ck2stages_gemm2_256x64x128x128_1x4_MulABScaleExpertWeightA8W8blkscale_v3_Nswizzle0_Quant4_MulRoutedWeight1_F8_F8_B16,16.8%,90.01,5039.72
asm_1stage,256,256,7168,256,257,9,ActivationType.Silu,torch.bfloat16,torch.float8_e4m3fn,torch.float8_e4m3fn,QuantType.per_1x128,1,0,32,0,343.9091,_ZN5aiter52fmoe_bf16_blockscaleFp8_g1u1_novs_silu_1tg_ps_32x256E,0.0%,73.76,4129.86
asm_1stage,256,256,7168,256,257,9,ActivationType.Silu,torch.bfloat16,torch.float8_e4m3fn,torch.float8_e4m3fn,QuantType.per_1x128,1,0,32,0,350.867,_ZN5aiter50fmoe_bf16_blockscaleFp8_g1u1_vs_silu_1tg_ps_32x256E,0.0%,72.3,4047.96
asm_1stage,256,256,7168,256,257,9,ActivationType.Silu,torch.bfloat16,torch.float8_e4m3fn,torch.float8_e4m3fn,QuantType.per_1x128,1,0,32,0,356.6853,_ZN5aiter49fmoe_bf16_blockscaleFp8_g1u1_novs_silu_1tg_32x256E,0.0%,71.12,3981.93
asm_1stage,256,256,7168,256,257,9,ActivationType.Silu,torch.bfloat16,torch.float8_e4m3fn,torch.float8_e4m3fn,QuantType.per_1x128,1,0,32,0,347.3205,_ZN5aiter47fmoe_bf16_blockscaleFp8_g1u1_vs_silu_1tg_32x256E,0.0%,73.04,4089.3
stage1,256,512,7168,256,257,9,ActivationType.Silu,torch.bfloat16,torch.float8_e4m3fn,torch.float8_e4m3fn,QuantType.per_1x128,1,0,16,0,253.932,_ZN5aiter59fmoe_stage1_bf16_pertokenFp8_blockscale_g1u1_16x128_4tg_pf2E,99.0%,199.79,5614.89
stage1,256,512,7168,256,257,9,ActivationType.Silu,torch.bfloat16,torch.float8_e4m3fn,torch.float8_e4m3fn,QuantType.per_1x128,1,0,16,0,243.8953,_ZN5aiter59fmoe_stage1_bf16_pertokenFp8_blockscale_g1u1_16x128_4tg_pf3E,99.0%,208.02,5845.96
stage1,256,512,7168,256,257,9,ActivationType.Silu,torch.bfloat16,torch.float8_e4m3fn,torch.float8_e4m3fn,QuantType.per_1x128,1,0,16,0,227.7534,_ZN5aiter59fmoe_stage1_bf16_pertokenFp8_blockscale_g1u1_16x256_3tg_pf2E,99.3%,222.76,6260.29
stage1,256,512,7168,256,257,9,ActivationType.Silu,torch.bfloat16,torch.float8_e4m3fn,torch.float8_e4m3fn,QuantType.per_1x128,1,0,16,0,229.0853,_ZN5aiter59fmoe_stage1_bf16_pertokenFp8_blockscale_g1u1_16x256_2tg_pf3E,99.3%,221.46,6223.89
stage1,256,512,7168,256,257,9,ActivationType.Silu,torch.bfloat16,torch.float8_e4m3fn,torch.float8_e4m3fn,QuantType.per_1x128,1,0,16,0,inf,_ZN5aiter59fmoe_stage1_bf16_pertokenFp8_blockscale_g1u1_16x512_2tg_pf2E,100.0%,0.0,0.0
stage1,256,512,7168,256,257,9,ActivationType.Silu,torch.bfloat16,torch.float8_e4m3fn,torch.float8_e4m3fn,QuantType.per_1x128,1,0,16,0,inf,_ZN5aiter55fmoe_stage1_bf16_pertokenFp8_blockscale_g1u1_16x512_pf3E,100.0%,0.0,0.0
stage1,256,512,7168,256,257,9,ActivationType.Silu,torch.bfloat16,torch.float8_e4m3fn,torch.float8_e4m3fn,QuantType.per_1x128,1,0,32,0,204.1347,_ZN5aiter59fmoe_stage1_bf16_pertokenFp8_blockscale_g1u1_32x128_3tg_pf2E,99.6%,248.53,6984.61
stage1,256,512,7168,256,257,9,ActivationType.Silu,torch.bfloat16,torch.float8_e4m3fn,torch.float8_e4m3fn,QuantType.per_1x128,1,0,32,0,198.7765,_ZN5aiter59fmoe_stage1_bf16_pertokenFp8_blockscale_g1u1_32x128_3tg_pf3E,99.6%,255.23,7172.89
stage1,256,512,7168,256,257,9,ActivationType.Silu,torch.bfloat16,torch.float8_e4m3fn,torch.float8_e4m3fn,QuantType.per_1x128,1,0,32,0,217.2141,_ZN5aiter59fmoe_stage1_bf16_pertokenFp8_blockscale_g1u1_32x256_2tg_pf2E,99.6%,233.57,6564.04
stage1,256,512,7168,256,257,9,ActivationType.Silu,torch.bfloat16,torch.float8_e4m3fn,torch.float8_e4m3fn,QuantType.per_1x128,1,0,32,0,223.4672,_ZN5aiter59fmoe_stage1_bf16_pertokenFp8_blockscale_g1u1_32x256_2tg_pf3E,99.6%,227.03,6380.36
stage1,256,512,7168,256,257,9,ActivationType.Silu,torch.bfloat16,torch.float8_e4m3fn,torch.float8_e4m3fn,QuantType.per_1x128,1,0,32,0,inf,_ZN5aiter55fmoe_stage1_bf16_pertokenFp8_blockscale_g1u1_32x512_pf2E,100.0%,0.0,0.0
stage1,256,512,7168,256,257,9,ActivationType.Silu,torch.bfloat16,torch.float8_e4m3fn,torch.float8_e4m3fn,QuantType.per_1x128,1,0,32,0,inf,_ZN5aiter55fmoe_stage1_bf16_pertokenFp8_blockscale_g1u1_32x512_pf3E,100.0%,0.0,0.0
stage1,256,512,7168,256,257,9,ActivationType.Silu,torch.bfloat16,torch.float8_e4m3fn,torch.float8_e4m3fn,QuantType.per_1x128,1,0,64,0,225.1903,_ZN5aiter59fmoe_stage1_bf16_pertokenFp8_blockscale_g1u1_64x128_2tg_pf2E,99.7%,225.3,6331.54
stage1,256,512,7168,256,257,9,ActivationType.Silu,torch.bfloat16,torch.float8_e4m3fn,torch.float8_e4m3fn,QuantType.per_1x128,1,0,64,0,197.2881,_ZN5aiter59fmoe_stage1_bf16_pertokenFp8_blockscale_g1u1_64x128_2tg_pf3E,99.7%,257.16,7227.0
stage1,256,512,7168,256,257,9,ActivationType.Silu,torch.bfloat16,torch.float8_e4m3fn,torch.float8_e4m3fn,QuantType.per_1x128,1,0,64,0,249.7012,_ZN5aiter55fmoe_stage1_bf16_pertokenFp8_blockscale_g1u1_64x256_pf2E,99.7%,203.18,5710.03
stage1,256,512,7168,256,257,9,ActivationType.Silu,torch.bfloat16,torch.float8_e4m3fn,torch.float8_e4m3fn,QuantType.per_1x128,1,0,64,0,231.7474,_ZN5aiter55fmoe_stage1_bf16_pertokenFp8_blockscale_g1u1_64x256_pf3E,99.7%,218.92,6152.39
stage1,256,512,7168,256,257,9,ActivationType.Silu,torch.bfloat16,torch.float8_e4m3fn,torch.float8_e4m3fn,QuantType.per_1x128,1,0,128,0,269.0212,_ZN5aiter56fmoe_stage1_bf16_pertokenFp8_blockscale_g1u1_128x128_pf2E,99.7%,188.59,5299.96
stage1,256,512,7168,256,257,9,ActivationType.Silu,torch.bfloat16,torch.float8_e4m3fn,torch.float8_e4m3fn,QuantType.per_1x128,1,0,128,0,230.9282,_ZN5aiter56fmoe_stage1_bf16_pertokenFp8_blockscale_g1u1_128x128_pf3E,99.7%,219.7,6174.22
stage1,256,512,7168,256,257,9,ActivationType.Silu,torch.bfloat16,torch.float8_e4m3fn,torch.float8_e4m3fn,QuantType.per_1x128,1,0,16,0,243.971,moe_ck2stages_gemm1_256x16x128x256_1x4_MulABScaleExpertWeightA8W8blkscale_v1_Nswizzle0_Quant4_MulRoutedWeight0_silu_F8_F8_B16,0.1%,207.95,5844.14
stage2,256,512,7168,256,257,9,ActivationType.Silu,torch.bfloat16,torch.float8_e4m3fn,torch.float8_e4m3fn,QuantType.per_1x128,1,0,16,0,234.0442,moe_ck2stages_gemm2_256x16x128x256_1x4_MulABScaleExpertWeightA8W8blkscale_v1_Nswizzle0_Quant4_MulRoutedWeight1_F8_F8_B16,16.7%,216.77,6092.02
stage1,256,512,7168,256,257,9,ActivationType.Silu,torch.bfloat16,torch.float8_e4m3fn,torch.float8_e4m3fn,QuantType.per_1x128,1,0,64,0,210.0026,moe_ck2stages_gemm1_256x64x128x128_1x4_MulABScaleExpertWeightA8W8blkscale_v3_Nswizzle0_Quant4_MulRoutedWeight0_silu_F8_F8_B16,0.1%,241.59,6789.45
stage2,256,512,7168,256,257,9,ActivationType.Silu,torch.bfloat16,torch.float8_e4m3fn,torch.float8_e4m3fn,QuantType.per_1x128,1,0,64,0,492.0487,moe_ck2stages_gemm2_256x64x128x128_1x4_MulABScaleExpertWeightA8W8blkscale_v3_Nswizzle0_Quant4_MulRoutedWeight1_F8_F8_B16,16.7%,103.11,2897.68
asm_1stage,256,512,7168,256,257,9,ActivationType.Silu,torch.bfloat16,torch.float8_e4m3fn,torch.float8_e4m3fn,QuantType.per_1x128,1,0,32,0,375.3519,_ZN5aiter52fmoe_bf16_blockscaleFp8_g1u1_novs_silu_1tg_ps_32x256E,0.0%,135.16,3798.57
asm_1stage,256,512,7168,256,257,9,ActivationType.Silu,torch.bfloat16,torch.float8_e4m3fn,torch.float8_e4m3fn,QuantType.per_1x128,1,0,32,0,370.6935,_ZN5aiter50fmoe_bf16_blockscaleFp8_g1u1_vs_silu_1tg_ps_32x256E,0.0%,136.86,3846.31
asm_1stage,256,512,7168,256,257,9,ActivationType.Silu,torch.bfloat16,torch.float8_e4m3fn,torch.float8_e4m3fn,QuantType.per_1x128,1,0,32,0,366.8549,_ZN5aiter49fmoe_bf16_blockscaleFp8_g1u1_novs_silu_1tg_32x256E,0.0%,138.3,3886.55
asm_1stage,256,512,7168,256,257,9,ActivationType.Silu,torch.bfloat16,torch.float8_e4m3fn,torch.float8_e4m3fn,QuantType.per_1x128,1,0,32,0,352.9199,_ZN5aiter47fmoe_bf16_blockscaleFp8_g1u1_vs_silu_1tg_32x256E,0.0%,143.76,4040.01
stage1,256,1024,7168,256,257,9,ActivationType.Silu,torch.bfloat16,torch.float8_e4m3fn,torch.float8_e4m3fn,QuantType.per_1x128,1,0,16,0,371.9813,_ZN5aiter59fmoe_stage1_bf16_pertokenFp8_blockscale_g1u1_16x128_4tg_pf2E,99.1%,272.78,3862.59
stage1,256,1024,7168,256,257,9,ActivationType.Silu,torch.bfloat16,torch.float8_e4m3fn,torch.float8_e4m3fn,QuantType.per_1x128,1,0,16,0,365.2959,_ZN5aiter59fmoe_stage1_bf16_pertokenFp8_blockscale_g1u1_16x128_4tg_pf3E,99.0%,277.77,3933.28
stage1,256,1024,7168,256,257,9,ActivationType.Silu,torch.bfloat16,torch.float8_e4m3fn,torch.float8_e4m3fn,QuantType.per_1x128,1,0,16,0,350.4569,_ZN5aiter59fmoe_stage1_bf16_pertokenFp8_blockscale_g1u1_16x256_3tg_pf2E,99.3%,289.53,4099.82
stage1,256,1024,7168,256,257,9,ActivationType.Silu,torch.bfloat16,torch.float8_e4m3fn,torch.float8_e4m3fn,QuantType.per_1x128,1,0,16,0,348.9835,_ZN5aiter59fmoe_stage1_bf16_pertokenFp8_blockscale_g1u1_16x256_2tg_pf3E,99.3%,290.75,4117.13
stage1,256,1024,7168,256,257,9,ActivationType.Silu,torch.bfloat16,torch.float8_e4m3fn,torch.float8_e4m3fn,QuantType.per_1x128,1,0,16,0,inf,_ZN5aiter59fmoe_stage1_bf16_pertokenFp8_blockscale_g1u1_16x512_2tg_pf2E,100.0%,0.0,0.0
stage1,256,1024,7168,256,257,9,ActivationType.Silu,torch.bfloat16,torch.float8_e4m3fn,torch.float8_e4m3fn,QuantType.per_1x128,1,0,16,0,inf,_ZN5aiter55fmoe_stage1_bf16_pertokenFp8_blockscale_g1u1_16x512_pf3E,100.0%,0.0,0.0
stage1,256,1024,7168,256,257,9,ActivationType.Silu,torch.bfloat16,torch.float8_e4m3fn,torch.float8_e4m3fn,QuantType.per_1x128,1,0,32,0,267.1409,_ZN5aiter59fmoe_stage1_bf16_pertokenFp8_blockscale_g1u1_32x128_3tg_pf2E,99.4%,379.83,5378.48
stage1,256,1024,7168,256,257,9,ActivationType.Silu,torch.bfloat16,torch.float8_e4m3fn,torch.float8_e4m3fn,QuantType.per_1x128,1,0,32,0,251.3289,_ZN5aiter59fmoe_stage1_bf16_pertokenFp8_blockscale_g1u1_32x128_3tg_pf3E,99.5%,403.73,5716.86
stage1,256,1024,7168,256,257,9,ActivationType.Silu,torch.bfloat16,torch.float8_e4m3fn,torch.float8_e4m3fn,QuantType.per_1x128,1,0,32,0,245.1339,_ZN5aiter59fmoe_stage1_bf16_pertokenFp8_blockscale_g1u1_32x256_2tg_pf2E,99.6%,413.93,5861.33
stage1,256,1024,7168,256,257,9,ActivationType.Silu,torch.bfloat16,torch.float8_e4m3fn,torch.float8_e4m3fn,QuantType.per_1x128,1,0,32,0,243.9788,_ZN5aiter59fmoe_stage1_bf16_pertokenFp8_blockscale_g1u1_32x256_2tg_pf3E,99.6%,415.89,5889.08
stage1,256,1024,7168,256,257,9,ActivationType.Silu,torch.bfloat16,torch.float8_e4m3fn,torch.float8_e4m3fn,QuantType.per_1x128,1,0,32,0,inf,_ZN5aiter55fmoe_stage1_bf16_pertokenFp8_blockscale_g1u1_32x512_pf2E,100.0%,0.0,0.0
stage1,256,1024,7168,256,257,9,ActivationType.Silu,torch.bfloat16,torch.float8_e4m3fn,torch.float8_e4m3fn,QuantType.per_1x128,1,0,32,0,inf,_ZN5aiter55fmoe_stage1_bf16_pertokenFp8_blockscale_g1u1_32x512_pf3E,100.0%,0.0,0.0
stage1,256,1024,7168,256,257,9,ActivationType.Silu,torch.bfloat16,torch.float8_e4m3fn,torch.float8_e4m3fn,QuantType.per_1x128,1,0,64,0,225.9317,_ZN5aiter59fmoe_stage1_bf16_pertokenFp8_blockscale_g1u1_64x128_2tg_pf2E,99.7%,449.11,6359.49
stage1,256,1024,7168,256,257,9,ActivationType.Silu,torch.bfloat16,torch.float8_e4m3fn,torch.float8_e4m3fn,QuantType.per_1x128,1,0,64,0,200.1477,_ZN5aiter59fmoe_stage1_bf16_pertokenFp8_blockscale_g1u1_64x128_2tg_pf3E,99.7%,506.97,7178.75
stage1,256,1024,7168,256,257,9,ActivationType.Silu,torch.bfloat16,torch.float8_e4m3fn,torch.float8_e4m3fn,QuantType.per_1x128,1,0,64,0,253.3954,_ZN5aiter55fmoe_stage1_bf16_pertokenFp8_blockscale_g1u1_64x256_pf2E,99.7%,400.44,5670.23
stage1,256,1024,7168,256,257,9,ActivationType.Silu,torch.bfloat16,torch.float8_e4m3fn,torch.float8_e4m3fn,QuantType.per_1x128,1,0,64,0,233.6335,_ZN5aiter55fmoe_stage1_bf16_pertokenFp8_blockscale_g1u1_64x256_pf3E,99.7%,434.31,6149.85
stage1,256,1024,7168,256,257,9,ActivationType.Silu,torch.bfloat16,torch.float8_e4m3fn,torch.float8_e4m3fn,QuantType.per_1x128,1,0,128,0,270.935,_ZN5aiter56fmoe_stage1_bf16_pertokenFp8_blockscale_g1u1_128x128_pf2E,99.7%,374.51,5303.16
stage1,256,1024,7168,256,257,9,ActivationType.Silu,torch.bfloat16,torch.float8_e4m3fn,torch.float8_e4m3fn,QuantType.per_1x128,1,0,128,0,234.2493,_ZN5aiter56fmoe_stage1_bf16_pertokenFp8_blockscale_g1u1_128x128_pf3E,99.7%,433.17,6133.68
stage1,256,1024,7168,256,257,9,ActivationType.Silu,torch.bfloat16,torch.float8_e4m3fn,torch.float8_e4m3fn,QuantType.per_1x128,1,0,16,0,373.7223,moe_ck2stages_gemm1_256x16x128x256_1x4_MulABScaleExpertWeightA8W8blkscale_v1_Nswizzle0_Quant4_MulRoutedWeight0_silu_F8_F8_B16,0.1%,271.51,3844.6
stage2,256,1024,7168,256,257,9,ActivationType.Silu,torch.bfloat16,torch.float8_e4m3fn,torch.float8_e4m3fn,QuantType.per_1x128,1,0,16,0,447.6444,moe_ck2stages_gemm2_256x16x128x256_1x4_MulABScaleExpertWeightA8W8blkscale_v1_Nswizzle0_Quant4_MulRoutedWeight1_F8_F8_B16,16.6%,226.67,3209.72
stage1,256,1024,7168,256,257,9,ActivationType.Silu,torch.bfloat16,torch.float8_e4m3fn,torch.float8_e4m3fn,QuantType.per_1x128,1,0,64,0,218.8617,moe_ck2stages_gemm1_256x64x128x128_1x4_MulABScaleExpertWeightA8W8blkscale_v3_Nswizzle0_Quant4_MulRoutedWeight0_silu_F8_F8_B16,0.1%,463.62,6564.93
stage2,256,1024,7168,256,257,9,ActivationType.Silu,torch.bfloat16,torch.float8_e4m3fn,torch.float8_e4m3fn,QuantType.per_1x128,1,0,64,0,921.1714,moe_ck2stages_gemm2_256x64x128x128_1x4_MulABScaleExpertWeightA8W8blkscale_v3_Nswizzle0_Quant4_MulRoutedWeight1_F8_F8_B16,16.6%,110.15,1559.77
asm_1stage,256,1024,7168,256,257,9,ActivationType.Silu,torch.bfloat16,torch.float8_e4m3fn,torch.float8_e4m3fn,QuantType.per_1x128,1,0,32,0,399.2618,_ZN5aiter52fmoe_bf16_blockscaleFp8_g1u1_novs_silu_1tg_ps_32x256E,0.0%,254.14,3598.67
asm_1stage,256,1024,7168,256,257,9,ActivationType.Silu,torch.bfloat16,torch.float8_e4m3fn,torch.float8_e4m3fn,QuantType.per_1x128,1,0,32,0,403.7865,_ZN5aiter50fmoe_bf16_blockscaleFp8_g1u1_vs_silu_1tg_ps_32x256E,0.0%,251.29,3558.34
asm_1stage,256,1024,7168,256,257,9,ActivationType.Silu,torch.bfloat16,torch.float8_e4m3fn,torch.float8_e4m3fn,QuantType.per_1x128,1,0,32,0,386.9482,_ZN5aiter49fmoe_bf16_blockscaleFp8_g1u1_novs_silu_1tg_32x256E,0.0%,262.23,3713.19
asm_1stage,256,1024,7168,256,257,9,ActivationType.Silu,torch.bfloat16,torch.float8_e4m3fn,torch.float8_e4m3fn,QuantType.per_1x128,1,0,32,0,391.2617,_ZN5aiter47fmoe_bf16_blockscaleFp8_g1u1_vs_silu_1tg_32x256E,0.0%,259.34,3672.25
stage1,256,2048,7168,256,257,9,ActivationType.Silu,torch.bfloat16,torch.float8_e4m3fn,torch.float8_e4m3fn,QuantType.per_1x128,1,0,16,0,561.5335,_ZN5aiter59fmoe_stage1_bf16_pertokenFp8_blockscale_g1u1_16x128_4tg_pf2E,99.1%,361.4,2597.94
stage1,256,2048,7168,256,257,9,ActivationType.Silu,torch.bfloat16,torch.float8_e4m3fn,torch.float8_e4m3fn,QuantType.per_1x128,1,0,16,0,548.2701,_ZN5aiter59fmoe_stage1_bf16_pertokenFp8_blockscale_g1u1_16x128_4tg_pf3E,99.1%,370.14,2660.79
stage1,256,2048,7168,256,257,9,ActivationType.Silu,torch.bfloat16,torch.float8_e4m3fn,torch.float8_e4m3fn,QuantType.per_1x128,1,0,16,0,634.0335,_ZN5aiter59fmoe_stage1_bf16_pertokenFp8_blockscale_g1u1_16x256_3tg_pf2E,99.4%,320.07,2300.87
stage1,256,2048,7168,256,257,9,ActivationType.Silu,torch.bfloat16,torch.float8_e4m3fn,torch.float8_e4m3fn,QuantType.per_1x128,1,0,16,0,636.1978,_ZN5aiter59fmoe_stage1_bf16_pertokenFp8_blockscale_g1u1_16x256_2tg_pf3E,99.3%,318.98,2293.05
stage1,256,2048,7168,256,257,9,ActivationType.Silu,torch.bfloat16,torch.float8_e4m3fn,torch.float8_e4m3fn,QuantType.per_1x128,1,0,16,0,inf,_ZN5aiter59fmoe_stage1_bf16_pertokenFp8_blockscale_g1u1_16x512_2tg_pf2E,100.0%,0.0,0.0
stage1,256,2048,7168,256,257,9,ActivationType.Silu,torch.bfloat16,torch.float8_e4m3fn,torch.float8_e4m3fn,QuantType.per_1x128,1,0,16,0,inf,_ZN5aiter55fmoe_stage1_bf16_pertokenFp8_blockscale_g1u1_16x512_pf3E,100.0%,0.0,0.0
stage1,256,2048,7168,256,257,9,ActivationType.Silu,torch.bfloat16,torch.float8_e4m3fn,torch.float8_e4m3fn,QuantType.per_1x128,1,0,32,0,400.6396,_ZN5aiter59fmoe_stage1_bf16_pertokenFp8_blockscale_g1u1_32x128_3tg_pf2E,99.4%,506.53,3641.26
stage1,256,2048,7168,256,257,9,ActivationType.Silu,torch.bfloat16,torch.float8_e4m3fn,torch.float8_e4m3fn,QuantType.per_1x128,1,0,32,0,391.26,_ZN5aiter59fmoe_stage1_bf16_pertokenFp8_blockscale_g1u1_32x128_3tg_pf3E,99.5%,518.68,3728.55
stage1,256,2048,7168,256,257,9,ActivationType.Silu,torch.bfloat16,torch.float8_e4m3fn,torch.float8_e4m3fn,QuantType.per_1x128,1,0,32,0,369.4092,_ZN5aiter59fmoe_stage1_bf16_pertokenFp8_blockscale_g1u1_32x256_2tg_pf2E,99.5%,549.36,3949.09
stage1,256,2048,7168,256,257,9,ActivationType.Silu,torch.bfloat16,torch.float8_e4m3fn,torch.float8_e4m3fn,QuantType.per_1x128,1,0,32,0,369.4733,_ZN5aiter59fmoe_stage1_bf16_pertokenFp8_blockscale_g1u1_32x256_2tg_pf3E,99.6%,549.26,3948.41
stage1,256,2048,7168,256,257,9,ActivationType.Silu,torch.bfloat16,torch.float8_e4m3fn,torch.float8_e4m3fn,QuantType.per_1x128,1,0,32,0,inf,_ZN5aiter55fmoe_stage1_bf16_pertokenFp8_blockscale_g1u1_32x512_pf2E,100.0%,0.0,0.0
stage1,256,2048,7168,256,257,9,ActivationType.Silu,torch.bfloat16,torch.float8_e4m3fn,torch.float8_e4m3fn,QuantType.per_1x128,1,0,32,0,inf,_ZN5aiter55fmoe_stage1_bf16_pertokenFp8_blockscale_g1u1_32x512_pf3E,100.0%,0.0,0.0
stage1,256,2048,7168,256,257,9,ActivationType.Silu,torch.bfloat16,torch.float8_e4m3fn,torch.float8_e4m3fn,QuantType.per_1x128,1,0,64,0,285.6299,_ZN5aiter59fmoe_stage1_bf16_pertokenFp8_blockscale_g1u1_64x128_2tg_pf2E,99.5%,710.49,5107.42
stage1,256,2048,7168,256,257,9,ActivationType.Silu,torch.bfloat16,torch.float8_e4m3fn,torch.float8_e4m3fn,QuantType.per_1x128,1,0,64,0,282.5742,_ZN5aiter59fmoe_stage1_bf16_pertokenFp8_blockscale_g1u1_64x128_2tg_pf3E,99.6%,718.17,5162.65
stage1,256,2048,7168,256,257,9,ActivationType.Silu,torch.bfloat16,torch.float8_e4m3fn,torch.float8_e4m3fn,QuantType.per_1x128,1,0,64,0,264.3117,_ZN5aiter55fmoe_stage1_bf16_pertokenFp8_blockscale_g1u1_64x256_pf2E,99.6%,767.8,5519.36
stage1,256,2048,7168,256,257,9,ActivationType.Silu,torch.bfloat16,torch.float8_e4m3fn,torch.float8_e4m3fn,QuantType.per_1x128,1,0,64,0,260.7589,_ZN5aiter55fmoe_stage1_bf16_pertokenFp8_blockscale_g1u1_64x256_pf3E,99.6%,778.26,5594.56
stage1,256,2048,7168,256,257,9,ActivationType.Silu,torch.bfloat16,torch.float8_e4m3fn,torch.float8_e4m3fn,QuantType.per_1x128,1,0,128,0,281.5969,_ZN5aiter56fmoe_stage1_bf16_pertokenFp8_blockscale_g1u1_128x128_pf2E,99.7%,720.67,5180.57
stage1,256,2048,7168,256,257,9,ActivationType.Silu,torch.bfloat16,torch.float8_e4m3fn,torch.float8_e4m3fn,QuantType.per_1x128,1,0,128,0,247.0213,_ZN5aiter56fmoe_stage1_bf16_pertokenFp8_blockscale_g1u1_128x128_pf3E,99.7%,821.54,5905.69
stage1,256,2048,7168,256,257,9,ActivationType.Silu,torch.bfloat16,torch.float8_e4m3fn,torch.float8_e4m3fn,QuantType.per_1x128,1,0,16,0,579.0215,moe_ck2stages_gemm1_256x16x128x256_1x4_MulABScaleExpertWeightA8W8blkscale_v1_Nswizzle0_Quant4_MulRoutedWeight0_silu_F8_F8_B16,0.1%,350.48,2519.48
stage2,256,2048,7168,256,257,9,ActivationType.Silu,torch.bfloat16,torch.float8_e4m3fn,torch.float8_e4m3fn,QuantType.per_1x128,1,0,16,0,884.7777,moe_ck2stages_gemm2_256x16x128x256_1x4_MulABScaleExpertWeightA8W8blkscale_v1_Nswizzle0_Quant4_MulRoutedWeight1_F8_F8_B16,16.6%,229.37,1648.81
stage1,256,2048,7168,256,257,9,ActivationType.Silu,torch.bfloat16,torch.float8_e4m3fn,torch.float8_e4m3fn,QuantType.per_1x128,1,0,64,0,296.5356,moe_ck2stages_gemm1_256x64x128x128_1x4_MulABScaleExpertWeightA8W8blkscale_v3_Nswizzle0_Quant4_MulRoutedWeight0_silu_F8_F8_B16,0.1%,684.36,4919.58
stage2,256,2048,7168,256,257,9,ActivationType.Silu,torch.bfloat16,torch.float8_e4m3fn,torch.float8_e4m3fn,QuantType.per_1x128,1,0,64,0,1818.3966,moe_ck2stages_gemm2_256x64x128x128_1x4_MulABScaleExpertWeightA8W8blkscale_v3_Nswizzle0_Quant4_MulRoutedWeight1_F8_F8_B16,16.6%,111.6,802.26
asm_1stage,256,2048,7168,256,257,9,ActivationType.Silu,torch.bfloat16,torch.float8_e4m3fn,torch.float8_e4m3fn,QuantType.per_1x128,1,0,32,0,647.2944,_ZN5aiter52fmoe_bf16_blockscaleFp8_g1u1_novs_silu_1tg_ps_32x256E,0.0%,313.52,2253.74
asm_1stage,256,2048,7168,256,257,9,ActivationType.Silu,torch.bfloat16,torch.float8_e4m3fn,torch.float8_e4m3fn,QuantType.per_1x128,1,0,32,0,654.0333,_ZN5aiter50fmoe_bf16_blockscaleFp8_g1u1_vs_silu_1tg_ps_32x256E,0.0%,310.29,2230.52
asm_1stage,256,2048,7168,256,257,9,ActivationType.Silu,torch.bfloat16,torch.float8_e4m3fn,torch.float8_e4m3fn,QuantType.per_1x128,1,0,32,0,644.1689,_ZN5aiter49fmoe_bf16_blockscaleFp8_g1u1_novs_silu_1tg_32x256E,0.0%,315.04,2264.67
asm_1stage,256,2048,7168,256,257,9,ActivationType.Silu,torch.bfloat16,torch.float8_e4m3fn,torch.float8_e4m3fn,QuantType.per_1x128,1,0,32,0,638.562,_ZN5aiter47fmoe_bf16_blockscaleFp8_g1u1_vs_silu_1tg_32x256E,0.0%,317.8,2284.56
stage1,256,4096,7168,256,257,9,ActivationType.Silu,torch.bfloat16,torch.float8_e4m3fn,torch.float8_e4m3fn,QuantType.per_1x128,1,0,16,0,681.3892,_ZN5aiter59fmoe_stage1_bf16_pertokenFp8_blockscale_g1u1_16x128_4tg_pf2E,99.1%,595.66,2205.6
stage1,256,4096,7168,256,257,9,ActivationType.Silu,torch.bfloat16,torch.float8_e4m3fn,torch.float8_e4m3fn,QuantType.per_1x128,1,0,16,0,682.5825,_ZN5aiter59fmoe_stage1_bf16_pertokenFp8_blockscale_g1u1_16x128_4tg_pf3E,99.0%,594.62,2201.74
stage1,256,4096,7168,256,257,9,ActivationType.Silu,torch.bfloat16,torch.float8_e4m3fn,torch.float8_e4m3fn,QuantType.per_1x128,1,0,16,0,1093.4495,_ZN5aiter59fmoe_stage1_bf16_pertokenFp8_blockscale_g1u1_16x256_3tg_pf2E,99.4%,371.19,1374.43
stage1,256,4096,7168,256,257,9,ActivationType.Silu,torch.bfloat16,torch.float8_e4m3fn,torch.float8_e4m3fn,QuantType.per_1x128,1,0,16,0,1081.3152,_ZN5aiter59fmoe_stage1_bf16_pertokenFp8_blockscale_g1u1_16x256_2tg_pf3E,99.4%,375.35,1389.86
stage1,256,4096,7168,256,257,9,ActivationType.Silu,torch.bfloat16,torch.float8_e4m3fn,torch.float8_e4m3fn,QuantType.per_1x128,1,0,16,0,inf,_ZN5aiter59fmoe_stage1_bf16_pertokenFp8_blockscale_g1u1_16x512_2tg_pf2E,100.0%,0.0,0.0
stage1,256,4096,7168,256,257,9,ActivationType.Silu,torch.bfloat16,torch.float8_e4m3fn,torch.float8_e4m3fn,QuantType.per_1x128,1,0,16,0,inf,_ZN5aiter55fmoe_stage1_bf16_pertokenFp8_blockscale_g1u1_16x512_pf3E,100.0%,0.0,0.0
stage1,256,4096,7168,256,257,9,ActivationType.Silu,torch.bfloat16,torch.float8_e4m3fn,torch.float8_e4m3fn,QuantType.per_1x128,1,0,32,0,607.4886,_ZN5aiter59fmoe_stage1_bf16_pertokenFp8_blockscale_g1u1_32x128_3tg_pf2E,99.4%,668.12,2473.91
stage1,256,4096,7168,256,257,9,ActivationType.Silu,torch.bfloat16,torch.float8_e4m3fn,torch.float8_e4m3fn,QuantType.per_1x128,1,0,32,0,602.8555,_ZN5aiter59fmoe_stage1_bf16_pertokenFp8_blockscale_g1u1_32x128_3tg_pf3E,99.5%,673.25,2492.92
stage1,256,4096,7168,256,257,9,ActivationType.Silu,torch.bfloat16,torch.float8_e4m3fn,torch.float8_e4m3fn,QuantType.per_1x128,1,0,32,0,659.8473,_ZN5aiter59fmoe_stage1_bf16_pertokenFp8_blockscale_g1u1_32x256_2tg_pf2E,99.6%,615.1,2277.61
stage1,256,4096,7168,256,257,9,ActivationType.Silu,torch.bfloat16,torch.float8_e4m3fn,torch.float8_e4m3fn,QuantType.per_1x128,1,0,32,0,658.2159,_ZN5aiter59fmoe_stage1_bf16_pertokenFp8_blockscale_g1u1_32x256_2tg_pf3E,99.6%,616.63,2283.25
stage1,256,4096,7168,256,257,9,ActivationType.Silu,torch.bfloat16,torch.float8_e4m3fn,torch.float8_e4m3fn,QuantType.per_1x128,1,0,32,0,inf,_ZN5aiter55fmoe_stage1_bf16_pertokenFp8_blockscale_g1u1_32x512_pf2E,100.0%,0.0,0.0
stage1,256,4096,7168,256,257,9,ActivationType.Silu,torch.bfloat16,torch.float8_e4m3fn,torch.float8_e4m3fn,QuantType.per_1x128,1,0,32,0,inf,_ZN5aiter55fmoe_stage1_bf16_pertokenFp8_blockscale_g1u1_32x512_pf3E,100.0%,0.0,0.0
stage1,256,4096,7168,256,257,9,ActivationType.Silu,torch.bfloat16,torch.float8_e4m3fn,torch.float8_e4m3fn,QuantType.per_1x128,1,0,64,0,448.2917,_ZN5aiter59fmoe_stage1_bf16_pertokenFp8_blockscale_g1u1_64x128_2tg_pf2E,99.5%,905.38,3352.44
stage1,256,4096,7168,256,257,9,ActivationType.Silu,torch.bfloat16,torch.float8_e4m3fn,torch.float8_e4m3fn,QuantType.per_1x128,1,0,64,0,448.0237,_ZN5aiter59fmoe_stage1_bf16_pertokenFp8_blockscale_g1u1_64x128_2tg_pf3E,99.6%,905.92,3354.45
stage1,256,4096,7168,256,257,9,ActivationType.Silu,torch.bfloat16,torch.float8_e4m3fn,torch.float8_e4m3fn,QuantType.per_1x128,1,0,64,0,408.1196,_ZN5aiter55fmoe_stage1_bf16_pertokenFp8_blockscale_g1u1_64x256_pf2E,99.6%,994.5,3682.43
stage1,256,4096,7168,256,257,9,ActivationType.Silu,torch.bfloat16,torch.float8_e4m3fn,torch.float8_e4m3fn,QuantType.per_1x128,1,0,64,0,405.9997,_ZN5aiter55fmoe_stage1_bf16_pertokenFp8_blockscale_g1u1_64x256_pf3E,99.6%,999.69,3701.66
stage1,256,4096,7168,256,257,9,ActivationType.Silu,torch.bfloat16,torch.float8_e4m3fn,torch.float8_e4m3fn,QuantType.per_1x128,1,0,128,0,400.2094,_ZN5aiter56fmoe_stage1_bf16_pertokenFp8_blockscale_g1u1_128x128_pf2E,99.6%,1014.16,3755.21
stage1,256,4096,7168,256,257,9,ActivationType.Silu,torch.bfloat16,torch.float8_e4m3fn,torch.float8_e4m3fn,QuantType.per_1x128,1,0,128,0,377.3394,_ZN5aiter56fmoe_stage1_bf16_pertokenFp8_blockscale_g1u1_128x128_pf3E,99.6%,1075.62,3982.81
stage1,256,4096,7168,256,257,9,ActivationType.Silu,torch.bfloat16,torch.float8_e4m3fn,torch.float8_e4m3fn,QuantType.per_1x128,1,0,16,0,765.0317,moe_ck2stages_gemm1_256x16x128x256_1x4_MulABScaleExpertWeightA8W8blkscale_v1_Nswizzle0_Quant4_MulRoutedWeight0_silu_F8_F8_B16,0.1%,530.53,1964.46
stage2,256,4096,7168,256,257,9,ActivationType.Silu,torch.bfloat16,torch.float8_e4m3fn,torch.float8_e4m3fn,QuantType.per_1x128,1,0,16,0,1752.179,moe_ck2stages_gemm2_256x16x128x256_1x4_MulABScaleExpertWeightA8W8blkscale_v1_Nswizzle0_Quant4_MulRoutedWeight1_F8_F8_B16,16.6%,231.64,857.72
stage1,256,4096,7168,256,257,9,ActivationType.Silu,torch.bfloat16,torch.float8_e4m3fn,torch.float8_e4m3fn,QuantType.per_1x128,1,0,64,0,448.2186,moe_ck2stages_gemm1_256x64x128x128_1x4_MulABScaleExpertWeightA8W8blkscale_v3_Nswizzle0_Quant4_MulRoutedWeight0_silu_F8_F8_B16,0.1%,905.53,3352.99
stage2,256,4096,7168,256,257,9,ActivationType.Silu,torch.bfloat16,torch.float8_e4m3fn,torch.float8_e4m3fn,QuantType.per_1x128,1,0,64,0,3586.4598,moe_ck2stages_gemm2_256x64x128x128_1x4_MulABScaleExpertWeightA8W8blkscale_v3_Nswizzle0_Quant4_MulRoutedWeight1_F8_F8_B16,16.6%,113.17,419.04
asm_1stage,256,4096,7168,256,257,9,ActivationType.Silu,torch.bfloat16,torch.float8_e4m3fn,torch.float8_e4m3fn,QuantType.per_1x128,1,0,32,0,1153.4727,_ZN5aiter52fmoe_bf16_blockscaleFp8_g1u1_novs_silu_1tg_ps_32x256E,0.0%,351.87,1302.91
asm_1stage,256,4096,7168,256,257,9,ActivationType.Silu,torch.bfloat16,torch.float8_e4m3fn,torch.float8_e4m3fn,QuantType.per_1x128,1,0,32,0,1149.4025,_ZN5aiter50fmoe_bf16_blockscaleFp8_g1u1_vs_silu_1tg_ps_32x256E,0.0%,353.12,1307.52
asm_1stage,256,4096,7168,256,257,9,ActivationType.Silu,torch.bfloat16,torch.float8_e4m3fn,torch.float8_e4m3fn,QuantType.per_1x128,1,0,32,0,1147.0425,_ZN5aiter49fmoe_bf16_blockscaleFp8_g1u1_novs_silu_1tg_32x256E,0.0%,353.84,1310.21
asm_1stage,256,4096,7168,256,257,9,ActivationType.Silu,torch.bfloat16,torch.float8_e4m3fn,torch.float8_e4m3fn,QuantType.per_1x128,1,0,32,0,1137.7354,_ZN5aiter47fmoe_bf16_blockscaleFp8_g1u1_vs_silu_1tg_32x256E,0.0%,356.74,1320.93
stage1,256,8192,7168,256,257,9,ActivationType.Silu,torch.bfloat16,torch.float8_e4m3fn,torch.float8_e4m3fn,QuantType.per_1x128,1,0,16,0,1123.8288,_ZN5aiter59fmoe_stage1_bf16_pertokenFp8_blockscale_g1u1_16x128_4tg_pf2E,99.1%,722.31,1415.65
stage1,256,8192,7168,256,257,9,ActivationType.Silu,torch.bfloat16,torch.float8_e4m3fn,torch.float8_e4m3fn,QuantType.per_1x128,1,0,16,0,1157.5958,_ZN5aiter59fmoe_stage1_bf16_pertokenFp8_blockscale_g1u1_16x128_4tg_pf3E,99.1%,701.24,1374.36
stage1,256,8192,7168,256,257,9,ActivationType.Silu,torch.bfloat16,torch.float8_e4m3fn,torch.float8_e4m3fn,QuantType.per_1x128,1,0,16,0,1432.2748,_ZN5aiter59fmoe_stage1_bf16_pertokenFp8_blockscale_g1u1_16x256_3tg_pf2E,99.4%,566.75,1110.79
stage1,256,8192,7168,256,257,9,ActivationType.Silu,torch.bfloat16,torch.float8_e4m3fn,torch.float8_e4m3fn,QuantType.per_1x128,1,0,16,0,1317.8342,_ZN5aiter59fmoe_stage1_bf16_pertokenFp8_blockscale_g1u1_16x256_2tg_pf3E,99.3%,615.97,1207.25
stage1,256,8192,7168,256,257,9,ActivationType.Silu,torch.bfloat16,torch.float8_e4m3fn,torch.float8_e4m3fn,QuantType.per_1x128,1,0,16,0,inf,_ZN5aiter59fmoe_stage1_bf16_pertokenFp8_blockscale_g1u1_16x512_2tg_pf2E,100.0%,0.0,0.0
stage1,256,8192,7168,256,257,9,ActivationType.Silu,torch.bfloat16,torch.float8_e4m3fn,torch.float8_e4m3fn,QuantType.per_1x128,1,0,16,0,inf,_ZN5aiter55fmoe_stage1_bf16_pertokenFp8_blockscale_g1u1_16x512_pf3E,100.0%,0.0,0.0
stage1,256,8192,7168,256,257,9,ActivationType.Silu,torch.bfloat16,torch.float8_e4m3fn,torch.float8_e4m3fn,QuantType.per_1x128,1,0,32,0,776.0139,_ZN5aiter59fmoe_stage1_bf16_pertokenFp8_blockscale_g1u1_32x128_3tg_pf2E,99.4%,1046.05,2050.16
stage1,256,8192,7168,256,257,9,ActivationType.Silu,torch.bfloat16,torch.float8_e4m3fn,torch.float8_e4m3fn,QuantType.per_1x128,1,0,32,0,776.2535,_ZN5aiter59fmoe_stage1_bf16_pertokenFp8_blockscale_g1u1_32x128_3tg_pf3E,99.5%,1045.73,2049.53
stage1,256,8192,7168,256,257,9,ActivationType.Silu,torch.bfloat16,torch.float8_e4m3fn,torch.float8_e4m3fn,QuantType.per_1x128,1,0,32,0,1098.0199,_ZN5aiter59fmoe_stage1_bf16_pertokenFp8_blockscale_g1u1_32x256_2tg_pf2E,99.6%,739.28,1448.93
stage1,256,8192,7168,256,257,9,ActivationType.Silu,torch.bfloat16,torch.float8_e4m3fn,torch.float8_e4m3fn,QuantType.per_1x128,1,0,32,0,1130.7904,_ZN5aiter59fmoe_stage1_bf16_pertokenFp8_blockscale_g1u1_32x256_2tg_pf3E,99.6%,717.86,1406.94
stage1,256,8192,7168,256,257,9,ActivationType.Silu,torch.bfloat16,torch.float8_e4m3fn,torch.float8_e4m3fn,QuantType.per_1x128,1,0,32,0,inf,_ZN5aiter55fmoe_stage1_bf16_pertokenFp8_blockscale_g1u1_32x512_pf2E,100.0%,0.0,0.0
stage1,256,8192,7168,256,257,9,ActivationType.Silu,torch.bfloat16,torch.float8_e4m3fn,torch.float8_e4m3fn,QuantType.per_1x128,1,0,32,0,inf,_ZN5aiter55fmoe_stage1_bf16_pertokenFp8_blockscale_g1u1_32x512_pf3E,100.0%,0.0,0.0
stage1,256,8192,7168,256,257,9,ActivationType.Silu,torch.bfloat16,torch.float8_e4m3fn,torch.float8_e4m3fn,QuantType.per_1x128,1,0,64,0,729.7249,_ZN5aiter59fmoe_stage1_bf16_pertokenFp8_blockscale_g1u1_64x128_2tg_pf2E,99.5%,1112.4,2180.21
stage1,256,8192,7168,256,257,9,ActivationType.Silu,torch.bfloat16,torch.float8_e4m3fn,torch.float8_e4m3fn,QuantType.per_1x128,1,0,64,0,731.6592,_ZN5aiter59fmoe_stage1_bf16_pertokenFp8_blockscale_g1u1_64x128_2tg_pf3E,99.6%,1109.46,2174.44
stage1,256,8192,7168,256,257,9,ActivationType.Silu,torch.bfloat16,torch.float8_e4m3fn,torch.float8_e4m3fn,QuantType.per_1x128,1,0,64,0,767.5103,_ZN5aiter55fmoe_stage1_bf16_pertokenFp8_blockscale_g1u1_64x256_pf2E,99.6%,1057.64,2072.87
stage1,256,8192,7168,256,257,9,ActivationType.Silu,torch.bfloat16,torch.float8_e4m3fn,torch.float8_e4m3fn,QuantType.per_1x128,1,0,64,0,751.0428,_ZN5aiter55fmoe_stage1_bf16_pertokenFp8_blockscale_g1u1_64x256_pf3E,99.6%,1080.83,2118.32
stage1,256,8192,7168,256,257,9,ActivationType.Silu,torch.bfloat16,torch.float8_e4m3fn,torch.float8_e4m3fn,QuantType.per_1x128,1,0,128,0,612.4716,_ZN5aiter56fmoe_stage1_bf16_pertokenFp8_blockscale_g1u1_128x128_pf2E,99.6%,1325.37,2597.59
stage1,256,8192,7168,256,257,9,ActivationType.Silu,torch.bfloat16,torch.float8_e4m3fn,torch.float8_e4m3fn,QuantType.per_1x128,1,0,128,0,592.324,_ZN5aiter56fmoe_stage1_bf16_pertokenFp8_blockscale_g1u1_128x128_pf3E,99.6%,1370.45,2685.95
stage1,256,8192,7168,256,257,9,ActivationType.Silu,torch.bfloat16,torch.float8_e4m3fn,torch.float8_e4m3fn,QuantType.per_1x128,1,0,16,0,978.0244,moe_ck2stages_gemm1_256x16x128x256_1x4_MulABScaleExpertWeightA8W8blkscale_v1_Nswizzle0_Quant4_MulRoutedWeight0_silu_F8_F8_B16,0.1%,829.99,1626.7
stage2,256,8192,7168,256,257,9,ActivationType.Silu,torch.bfloat16,torch.float8_e4m3fn,torch.float8_e4m3fn,QuantType.per_1x128,1,0,16,0,3484.1609,moe_ck2stages_gemm2_256x16x128x256_1x4_MulABScaleExpertWeightA8W8blkscale_v1_Nswizzle0_Quant4_MulRoutedWeight1_F8_F8_B16,16.7%,232.98,456.62
stage1,256,8192,7168,256,257,9,ActivationType.Silu,torch.bfloat16,torch.float8_e4m3fn,torch.float8_e4m3fn,QuantType.per_1x128,1,0,64,0,723.1606,moe_ck2stages_gemm1_256x64x128x128_1x4_MulABScaleExpertWeightA8W8blkscale_v3_Nswizzle0_Quant4_MulRoutedWeight0_silu_F8_F8_B16,0.1%,1122.5,2200.0
stage2,256,8192,7168,256,257,9,ActivationType.Silu,torch.bfloat16,torch.float8_e4m3fn,torch.float8_e4m3fn,QuantType.per_1x128,1,0,64,0,7137.0578,moe_ck2stages_gemm2_256x64x128x128_1x4_MulABScaleExpertWeightA8W8blkscale_v3_Nswizzle0_Quant4_MulRoutedWeight1_F8_F8_B16,16.7%,113.74,222.91
asm_1stage,256,8192,7168,256,257,9,ActivationType.Silu,torch.bfloat16,torch.float8_e4m3fn,torch.float8_e4m3fn,QuantType.per_1x128,1,0,32,0,2044.0974,_ZN5aiter52fmoe_bf16_blockscaleFp8_g1u1_novs_silu_1tg_ps_32x256E,0.0%,397.12,778.32
asm_1stage,256,8192,7168,256,257,9,ActivationType.Silu,torch.bfloat16,torch.float8_e4m3fn,torch.float8_e4m3fn,QuantType.per_1x128,1,0,32,0,2062.5278,_ZN5aiter50fmoe_bf16_blockscaleFp8_g1u1_vs_silu_1tg_ps_32x256E,0.0%,393.57,771.36
asm_1stage,256,8192,7168,256,257,9,ActivationType.Silu,torch.bfloat16,torch.float8_e4m3fn,torch.float8_e4m3fn,QuantType.per_1x128,1,0,32,0,1913.8188,_ZN5aiter49fmoe_bf16_blockscaleFp8_g1u1_novs_silu_1tg_32x256E,0.0%,424.15,831.3
asm_1stage,256,8192,7168,256,257,9,ActivationType.Silu,torch.bfloat16,torch.float8_e4m3fn,torch.float8_e4m3fn,QuantType.per_1x128,1,0,32,0,1911.8868,_ZN5aiter47fmoe_bf16_blockscaleFp8_g1u1_vs_silu_1tg_32x256E,0.0%,424.58,832.14
stage1,256,1,7168,256,257,9,ActivationType.Silu,torch.bfloat16,torch.float8_e4m3fn,torch.float8_e4m3fn,QuantType.per_1x128,1,0,16,0,76.1037,_ZN5aiter59fmoe_stage1_bf16_pertokenFp8_blockscale_g1u1_16x128_4tg_pf2E,51.1%,1.3,18590.59
stage1,256,1,7168,256,257,9,ActivationType.Silu,torch.bfloat16,torch.float8_e4m3fn,torch.float8_e4m3fn,QuantType.per_1x128,1,0,16,0,43.8629,_ZN5aiter59fmoe_stage1_bf16_pertokenFp8_blockscale_g1u1_16x128_4tg_pf3E,51.2%,2.26,32255.34
stage1,256,1,7168,256,257,9,ActivationType.Silu,torch.bfloat16,torch.float8_e4m3fn,torch.float8_e4m3fn,QuantType.per_1x128,1,0,16,0,94.0995,_ZN5aiter59fmoe_stage1_bf16_pertokenFp8_blockscale_g1u1_16x256_3tg_pf2E,51.2%,1.05,15035.28
stage1,256,1,7168,256,257,9,ActivationType.Silu,torch.bfloat16,torch.float8_e4m3fn,torch.float8_e4m3fn,QuantType.per_1x128,1,0,16,0,73.7102,_ZN5aiter59fmoe_stage1_bf16_pertokenFp8_blockscale_g1u1_16x256_2tg_pf3E,51.2%,1.34,19194.26
stage1,256,1,7168,256,257,9,ActivationType.Silu,torch.bfloat16,torch.float8_e4m3fn,torch.float8_e4m3fn,QuantType.per_1x128,1,0,16,0,inf,_ZN5aiter59fmoe_stage1_bf16_pertokenFp8_blockscale_g1u1_16x512_2tg_pf2E,100.0%,0.0,0.0
stage1,256,1,7168,256,257,9,ActivationType.Silu,torch.bfloat16,torch.float8_e4m3fn,torch.float8_e4m3fn,QuantType.per_1x128,1,0,16,0,inf,_ZN5aiter55fmoe_stage1_bf16_pertokenFp8_blockscale_g1u1_16x512_pf3E,100.0%,0.0,0.0
stage1,256,1,7168,256,257,9,ActivationType.Silu,torch.bfloat16,torch.float8_e4m3fn,torch.float8_e4m3fn,QuantType.per_1x128,1,0,32,0,76.742,_ZN5aiter59fmoe_stage1_bf16_pertokenFp8_blockscale_g1u1_32x128_3tg_pf2E,51.4%,1.29,18435.96
stage1,256,1,7168,256,257,9,ActivationType.Silu,torch.bfloat16,torch.float8_e4m3fn,torch.float8_e4m3fn,QuantType.per_1x128,1,0,32,0,44.7333,_ZN5aiter59fmoe_stage1_bf16_pertokenFp8_blockscale_g1u1_32x128_3tg_pf3E,51.4%,2.22,31627.73
stage1,256,1,7168,256,257,9,ActivationType.Silu,torch.bfloat16,torch.float8_e4m3fn,torch.float8_e4m3fn,QuantType.per_1x128,1,0,32,0,95.281,_ZN5aiter59fmoe_stage1_bf16_pertokenFp8_blockscale_g1u1_32x256_2tg_pf2E,51.4%,1.04,14848.84
stage1,256,1,7168,256,257,9,ActivationType.Silu,torch.bfloat16,torch.float8_e4m3fn,torch.float8_e4m3fn,QuantType.per_1x128,1,0,32,0,74.2617,_ZN5aiter59fmoe_stage1_bf16_pertokenFp8_blockscale_g1u1_32x256_2tg_pf3E,51.4%,1.33,19051.71
stage1,256,1,7168,256,257,9,ActivationType.Silu,torch.bfloat16,torch.float8_e4m3fn,torch.float8_e4m3fn,QuantType.per_1x128,1,0,32,0,inf,_ZN5aiter55fmoe_stage1_bf16_pertokenFp8_blockscale_g1u1_32x512_pf2E,100.0%,0.0,0.0
stage1,256,1,7168,256,257,9,ActivationType.Silu,torch.bfloat16,torch.float8_e4m3fn,torch.float8_e4m3fn,QuantType.per_1x128,1,0,32,0,inf,_ZN5aiter55fmoe_stage1_bf16_pertokenFp8_blockscale_g1u1_32x512_pf3E,100.0%,0.0,0.0
stage1,256,1,7168,256,257,9,ActivationType.Silu,torch.bfloat16,torch.float8_e4m3fn,torch.float8_e4m3fn,QuantType.per_1x128,1,0,64,0,76.8903,_ZN5aiter59fmoe_stage1_bf16_pertokenFp8_blockscale_g1u1_64x128_2tg_pf2E,51.4%,1.29,18400.41
stage1,256,1,7168,256,257,9,ActivationType.Silu,torch.bfloat16,torch.float8_e4m3fn,torch.float8_e4m3fn,QuantType.per_1x128,1,0,64,0,46.8755,_ZN5aiter59fmoe_stage1_bf16_pertokenFp8_blockscale_g1u1_64x128_2tg_pf3E,51.4%,2.11,30182.35
stage1,256,1,7168,256,257,9,ActivationType.Silu,torch.bfloat16,torch.float8_e4m3fn,torch.float8_e4m3fn,QuantType.per_1x128,1,0,64,0,98.3278,_ZN5aiter55fmoe_stage1_bf16_pertokenFp8_blockscale_g1u1_64x256_pf2E,51.4%,1.01,14388.74
stage1,256,1,7168,256,257,9,ActivationType.Silu,torch.bfloat16,torch.float8_e4m3fn,torch.float8_e4m3fn,QuantType.per_1x128,1,0,64,0,84.4652,_ZN5aiter55fmoe_stage1_bf16_pertokenFp8_blockscale_g1u1_64x256_pf3E,51.4%,1.17,16750.24
stage1,256,1,7168,256,257,9,ActivationType.Silu,torch.bfloat16,torch.float8_e4m3fn,torch.float8_e4m3fn,QuantType.per_1x128,1,0,128,0,83.1702,_ZN5aiter56fmoe_stage1_bf16_pertokenFp8_blockscale_g1u1_128x128_pf2E,51.4%,1.19,17011.05
stage1,256,1,7168,256,257,9,ActivationType.Silu,torch.bfloat16,torch.float8_e4m3fn,torch.float8_e4m3fn,QuantType.per_1x128,1,0,128,0,68.9964,_ZN5aiter56fmoe_stage1_bf16_pertokenFp8_blockscale_g1u1_128x128_pf3E,51.4%,1.44,20505.6
stage1,256,1,7168,256,257,9,ActivationType.Silu,torch.bfloat16,torch.float8_e4m3fn,torch.float8_e4m3fn,QuantType.per_1x128,1,0,16,0,46.4933,moe_ck2stages_gemm1_256x16x128x256_1x4_MulABScaleExpertWeightA8W8blkscale_v1_Nswizzle0_Quant4_MulRoutedWeight0_silu_F8_F8_B16,0.1%,2.13,30430.46
stage2,256,1,7168,256,257,9,ActivationType.Silu,torch.bfloat16,torch.float8_e4m3fn,torch.float8_e4m3fn,QuantType.per_1x128,1,0,16,0,8.4667,moe_ck2stages_gemm2_256x16x128x256_1x4_MulABScaleExpertWeightA8W8blkscale_v1_Nswizzle0_Quant4_MulRoutedWeight1_F8_F8_B16,16.6%,11.7,167103.2
stage1,256,1,7168,256,257,9,ActivationType.Silu,torch.bfloat16,torch.float8_e4m3fn,torch.float8_e4m3fn,QuantType.per_1x128,1,0,64,0,59.2135,moe_ck2stages_gemm1_256x64x128x128_1x4_MulABScaleExpertWeightA8W8blkscale_v3_Nswizzle0_Quant4_MulRoutedWeight0_silu_F8_F8_B16,0.1%,1.67,23893.41
stage2,256,1,7168,256,257,9,ActivationType.Silu,torch.bfloat16,torch.float8_e4m3fn,torch.float8_e4m3fn,QuantType.per_1x128,1,0,64,0,11.0847,moe_ck2stages_gemm2_256x64x128x128_1x4_MulABScaleExpertWeightA8W8blkscale_v3_Nswizzle0_Quant4_MulRoutedWeight1_F8_F8_B16,17.4%,8.94,127636.53
asm_1stage,256,1,7168,256,257,9,ActivationType.Silu,torch.bfloat16,torch.float8_e4m3fn,torch.float8_e4m3fn,QuantType.per_1x128,1,0,32,0,119.5075,_ZN5aiter52fmoe_bf16_blockscaleFp8_g1u1_novs_silu_1tg_ps_32x256E,0.0%,0.83,11838.69
asm_1stage,256,1,7168,256,257,9,ActivationType.Silu,torch.bfloat16,torch.float8_e4m3fn,torch.float8_e4m3fn,QuantType.per_1x128,1,0,32,0,111.2623,_ZN5aiter50fmoe_bf16_blockscaleFp8_g1u1_vs_silu_1tg_ps_32x256E,0.0%,0.89,12716.01
asm_1stage,256,1,7168,256,257,9,ActivationType.Silu,torch.bfloat16,torch.float8_e4m3fn,torch.float8_e4m3fn,QuantType.per_1x128,1,0,32,0,118.5771,_ZN5aiter49fmoe_bf16_blockscaleFp8_g1u1_novs_silu_1tg_32x256E,0.0%,0.84,11931.58
asm_1stage,256,1,7168,256,257,9,ActivationType.Silu,torch.bfloat16,torch.float8_e4m3fn,torch.float8_e4m3fn,QuantType.per_1x128,1,0,32,0,110.8416,_ZN5aiter47fmoe_bf16_blockscaleFp8_g1u1_vs_silu_1tg_32x256E,0.0%,0.89,12764.28
stage1,256,2,7168,256,257,9,ActivationType.Silu,torch.bfloat16,torch.float8_e4m3fn,torch.float8_e4m3fn,QuantType.per_1x128,1,0,16,0,76.092,_ZN5aiter59fmoe_stage1_bf16_pertokenFp8_blockscale_g1u1_16x128_4tg_pf2E,68.3%,2.6,18593.73
stage1,256,2,7168,256,257,9,ActivationType.Silu,torch.bfloat16,torch.float8_e4m3fn,torch.float8_e4m3fn,QuantType.per_1x128,1,0,16,0,44.1496,_ZN5aiter59fmoe_stage1_bf16_pertokenFp8_blockscale_g1u1_16x128_4tg_pf3E,68.2%,4.49,32046.36
stage1,256,2,7168,256,257,9,ActivationType.Silu,torch.bfloat16,torch.float8_e4m3fn,torch.float8_e4m3fn,QuantType.per_1x128,1,0,16,0,93.9326,_ZN5aiter59fmoe_stage1_bf16_pertokenFp8_blockscale_g1u1_16x256_3tg_pf2E,68.4%,2.11,15062.23
stage1,256,2,7168,256,257,9,ActivationType.Silu,torch.bfloat16,torch.float8_e4m3fn,torch.float8_e4m3fn,QuantType.per_1x128,1,0,16,0,73.6044,_ZN5aiter59fmoe_stage1_bf16_pertokenFp8_blockscale_g1u1_16x256_2tg_pf3E,68.1%,2.69,19222.14
stage1,256,2,7168,256,257,9,ActivationType.Silu,torch.bfloat16,torch.float8_e4m3fn,torch.float8_e4m3fn,QuantType.per_1x128,1,0,16,0,inf,_ZN5aiter59fmoe_stage1_bf16_pertokenFp8_blockscale_g1u1_16x512_2tg_pf2E,100.0%,0.0,0.0
stage1,256,2,7168,256,257,9,ActivationType.Silu,torch.bfloat16,torch.float8_e4m3fn,torch.float8_e4m3fn,QuantType.per_1x128,1,0,16,0,inf,_ZN5aiter55fmoe_stage1_bf16_pertokenFp8_blockscale_g1u1_16x512_pf3E,100.0%,0.0,0.0
stage1,256,2,7168,256,257,9,ActivationType.Silu,torch.bfloat16,torch.float8_e4m3fn,torch.float8_e4m3fn,QuantType.per_1x128,1,0,32,0,76.8248,_ZN5aiter59fmoe_stage1_bf16_pertokenFp8_blockscale_g1u1_32x128_3tg_pf2E,68.6%,2.58,18416.37
stage1,256,2,7168,256,257,9,ActivationType.Silu,torch.bfloat16,torch.float8_e4m3fn,torch.float8_e4m3fn,QuantType.per_1x128,1,0,32,0,45.1781,_ZN5aiter59fmoe_stage1_bf16_pertokenFp8_blockscale_g1u1_32x128_3tg_pf3E,68.6%,4.39,31316.81
stage1,256,2,7168,256,257,9,ActivationType.Silu,torch.bfloat16,torch.float8_e4m3fn,torch.float8_e4m3fn,QuantType.per_1x128,1,0,32,0,96.0279,_ZN5aiter59fmoe_stage1_bf16_pertokenFp8_blockscale_g1u1_32x256_2tg_pf2E,68.6%,2.06,14733.57
stage1,256,2,7168,256,257,9,ActivationType.Silu,torch.bfloat16,torch.float8_e4m3fn,torch.float8_e4m3fn,QuantType.per_1x128,1,0,32,0,74.5696,_ZN5aiter59fmoe_stage1_bf16_pertokenFp8_blockscale_g1u1_32x256_2tg_pf3E,68.6%,2.66,18973.34
stage1,256,2,7168,256,257,9,ActivationType.Silu,torch.bfloat16,torch.float8_e4m3fn,torch.float8_e4m3fn,QuantType.per_1x128,1,0,32,0,inf,_ZN5aiter55fmoe_stage1_bf16_pertokenFp8_blockscale_g1u1_32x512_pf2E,100.0%,0.0,0.0
stage1,256,2,7168,256,257,9,ActivationType.Silu,torch.bfloat16,torch.float8_e4m3fn,torch.float8_e4m3fn,QuantType.per_1x128,1,0,32,0,inf,_ZN5aiter55fmoe_stage1_bf16_pertokenFp8_blockscale_g1u1_32x512_pf3E,100.0%,0.0,0.0
stage1,256,2,7168,256,257,9,ActivationType.Silu,torch.bfloat16,torch.float8_e4m3fn,torch.float8_e4m3fn,QuantType.per_1x128,1,0,64,0,77.8365,_ZN5aiter59fmoe_stage1_bf16_pertokenFp8_blockscale_g1u1_64x128_2tg_pf2E,68.6%,2.55,18177.0
stage1,256,2,7168,256,257,9,ActivationType.Silu,torch.bfloat16,torch.float8_e4m3fn,torch.float8_e4m3fn,QuantType.per_1x128,1,0,64,0,47.3625,_ZN5aiter59fmoe_stage1_bf16_pertokenFp8_blockscale_g1u1_64x128_2tg_pf3E,68.6%,4.18,29872.46
stage1,256,2,7168,256,257,9,ActivationType.Silu,torch.bfloat16,torch.float8_e4m3fn,torch.float8_e4m3fn,QuantType.per_1x128,1,0,64,0,99.0471,_ZN5aiter55fmoe_stage1_bf16_pertokenFp8_blockscale_g1u1_64x256_pf2E,68.6%,2.0,14284.46
stage1,256,2,7168,256,257,9,ActivationType.Silu,torch.bfloat16,torch.float8_e4m3fn,torch.float8_e4m3fn,QuantType.per_1x128,1,0,64,0,85.6479,_ZN5aiter55fmoe_stage1_bf16_pertokenFp8_blockscale_g1u1_64x256_pf3E,68.6%,2.31,16519.19
stage1,256,2,7168,256,257,9,ActivationType.Silu,torch.bfloat16,torch.float8_e4m3fn,torch.float8_e4m3fn,QuantType.per_1x128,1,0,128,0,83.7714,_ZN5aiter56fmoe_stage1_bf16_pertokenFp8_blockscale_g1u1_128x128_pf2E,68.6%,2.37,16889.23
stage1,256,2,7168,256,257,9,ActivationType.Silu,torch.bfloat16,torch.float8_e4m3fn,torch.float8_e4m3fn,QuantType.per_1x128,1,0,128,0,68.8652,_ZN5aiter56fmoe_stage1_bf16_pertokenFp8_blockscale_g1u1_128x128_pf3E,68.6%,2.88,20544.98
stage1,256,2,7168,256,257,9,ActivationType.Silu,torch.bfloat16,torch.float8_e4m3fn,torch.float8_e4m3fn,QuantType.per_1x128,1,0,16,0,47.612,moe_ck2stages_gemm1_256x16x128x256_1x4_MulABScaleExpertWeightA8W8blkscale_v1_Nswizzle0_Quant4_MulRoutedWeight0_silu_F8_F8_B16,0.1%,4.16,29715.92
stage2,256,2,7168,256,257,9,ActivationType.Silu,torch.bfloat16,torch.float8_e4m3fn,torch.float8_e4m3fn,QuantType.per_1x128,1,0,16,0,11.2933,moe_ck2stages_gemm2_256x16x128x256_1x4_MulABScaleExpertWeightA8W8blkscale_v1_Nswizzle0_Quant4_MulRoutedWeight1_F8_F8_B16,17.5%,17.55,125280.85
stage1,256,2,7168,256,257,9,ActivationType.Silu,torch.bfloat16,torch.float8_e4m3fn,torch.float8_e4m3fn,QuantType.per_1x128,1,0,64,0,60.6583,moe_ck2stages_gemm1_256x64x128x128_1x4_MulABScaleExpertWeightA8W8blkscale_v3_Nswizzle0_Quant4_MulRoutedWeight0_silu_F8_F8_B16,0.1%,3.27,23324.66
stage2,256,2,7168,256,257,9,ActivationType.Silu,torch.bfloat16,torch.float8_e4m3fn,torch.float8_e4m3fn,QuantType.per_1x128,1,0,64,0,20.4069,moe_ck2stages_gemm2_256x64x128x128_1x4_MulABScaleExpertWeightA8W8blkscale_v3_Nswizzle0_Quant4_MulRoutedWeight1_F8_F8_B16,16.9%,9.71,69331.17
asm_1stage,256,2,7168,256,257,9,ActivationType.Silu,torch.bfloat16,torch.float8_e4m3fn,torch.float8_e4m3fn,QuantType.per_1x128,1,0,32,0,120.7577,_ZN5aiter52fmoe_bf16_blockscaleFp8_g1u1_novs_silu_1tg_ps_32x256E,0.0%,1.64,11716.31
asm_1stage,256,2,7168,256,257,9,ActivationType.Silu,torch.bfloat16,torch.float8_e4m3fn,torch.float8_e4m3fn,QuantType.per_1x128,1,0,32,0,112.7114,_ZN5aiter50fmoe_bf16_blockscaleFp8_g1u1_vs_silu_1tg_ps_32x256E,0.0%,1.76,12552.72
asm_1stage,256,2,7168,256,257,9,ActivationType.Silu,torch.bfloat16,torch.float8_e4m3fn,torch.float8_e4m3fn,QuantType.per_1x128,1,0,32,0,119.4866,_ZN5aiter49fmoe_bf16_blockscaleFp8_g1u1_novs_silu_1tg_32x256E,0.0%,1.66,11840.94
asm_1stage,256,2,7168,256,257,9,ActivationType.Silu,torch.bfloat16,torch.float8_e4m3fn,torch.float8_e4m3fn,QuantType.per_1x128,1,0,32,0,111.6691,_ZN5aiter47fmoe_bf16_blockscaleFp8_g1u1_vs_silu_1tg_32x256E,0.0%,1.77,12669.88
stage1,256,4,7168,256,257,9,ActivationType.Silu,torch.bfloat16,torch.float8_e4m3fn,torch.float8_e4m3fn,QuantType.per_1x128,1,0,16,0,77.6427,_ZN5aiter59fmoe_stage1_bf16_pertokenFp8_blockscale_g1u1_16x128_4tg_pf2E,82.0%,5.1,18222.93
stage1,256,4,7168,256,257,9,ActivationType.Silu,torch.bfloat16,torch.float8_e4m3fn,torch.float8_e4m3fn,QuantType.per_1x128,1,0,16,0,46.5903,_ZN5aiter59fmoe_stage1_bf16_pertokenFp8_blockscale_g1u1_16x128_4tg_pf3E,82.0%,8.51,30368.49
stage1,256,4,7168,256,257,9,ActivationType.Silu,torch.bfloat16,torch.float8_e4m3fn,torch.float8_e4m3fn,QuantType.per_1x128,1,0,16,0,96.0628,_ZN5aiter59fmoe_stage1_bf16_pertokenFp8_blockscale_g1u1_16x256_3tg_pf2E,82.1%,4.13,14728.67
stage1,256,4,7168,256,257,9,ActivationType.Silu,torch.bfloat16,torch.float8_e4m3fn,torch.float8_e4m3fn,QuantType.per_1x128,1,0,16,0,75.586,_ZN5aiter59fmoe_stage1_bf16_pertokenFp8_blockscale_g1u1_16x256_2tg_pf3E,82.1%,5.24,18718.77
stage1,256,4,7168,256,257,9,ActivationType.Silu,torch.bfloat16,torch.float8_e4m3fn,torch.float8_e4m3fn,QuantType.per_1x128,1,0,16,0,inf,_ZN5aiter59fmoe_stage1_bf16_pertokenFp8_blockscale_g1u1_16x512_2tg_pf2E,100.0%,0.0,0.0
stage1,256,4,7168,256,257,9,ActivationType.Silu,torch.bfloat16,torch.float8_e4m3fn,torch.float8_e4m3fn,QuantType.per_1x128,1,0,16,0,inf,_ZN5aiter55fmoe_stage1_bf16_pertokenFp8_blockscale_g1u1_16x512_pf3E,100.0%,0.0,0.0
stage1,256,4,7168,256,257,9,ActivationType.Silu,torch.bfloat16,torch.float8_e4m3fn,torch.float8_e4m3fn,QuantType.per_1x128,1,0,32,0,78.4891,_ZN5aiter59fmoe_stage1_bf16_pertokenFp8_blockscale_g1u1_32x128_3tg_pf2E,82.3%,5.05,18026.42
stage1,256,4,7168,256,257,9,ActivationType.Silu,torch.bfloat16,torch.float8_e4m3fn,torch.float8_e4m3fn,QuantType.per_1x128,1,0,32,0,47.482,_ZN5aiter59fmoe_stage1_bf16_pertokenFp8_blockscale_g1u1_32x128_3tg_pf3E,82.3%,8.35,29798.18
stage1,256,4,7168,256,257,9,ActivationType.Silu,torch.bfloat16,torch.float8_e4m3fn,torch.float8_e4m3fn,QuantType.per_1x128,1,0,32,0,98.2454,_ZN5aiter59fmoe_stage1_bf16_pertokenFp8_blockscale_g1u1_32x256_2tg_pf2E,82.3%,4.03,14401.46
stage1,256,4,7168,256,257,9,ActivationType.Silu,torch.bfloat16,torch.float8_e4m3fn,torch.float8_e4m3fn,QuantType.per_1x128,1,0,32,0,77.3978,_ZN5aiter59fmoe_stage1_bf16_pertokenFp8_blockscale_g1u1_32x256_2tg_pf3E,82.3%,5.12,18280.59
stage1,256,4,7168,256,257,9,ActivationType.Silu,torch.bfloat16,torch.float8_e4m3fn,torch.float8_e4m3fn,QuantType.per_1x128,1,0,32,0,inf,_ZN5aiter55fmoe_stage1_bf16_pertokenFp8_blockscale_g1u1_32x512_pf2E,100.0%,0.0,0.0
stage1,256,4,7168,256,257,9,ActivationType.Silu,torch.bfloat16,torch.float8_e4m3fn,torch.float8_e4m3fn,QuantType.per_1x128,1,0,32,0,inf,_ZN5aiter55fmoe_stage1_bf16_pertokenFp8_blockscale_g1u1_32x512_pf3E,100.0%,0.0,0.0
stage1,256,4,7168,256,257,9,ActivationType.Silu,torch.bfloat16,torch.float8_e4m3fn,torch.float8_e4m3fn,QuantType.per_1x128,1,0,64,0,79.3773,_ZN5aiter59fmoe_stage1_bf16_pertokenFp8_blockscale_g1u1_64x128_2tg_pf2E,82.3%,4.99,17824.71
stage1,256,4,7168,256,257,9,ActivationType.Silu,torch.bfloat16,torch.float8_e4m3fn,torch.float8_e4m3fn,QuantType.per_1x128,1,0,64,0,49.5925,_ZN5aiter59fmoe_stage1_bf16_pertokenFp8_blockscale_g1u1_64x128_2tg_pf3E,82.3%,7.99,28530.06
stage1,256,4,7168,256,257,9,ActivationType.Silu,torch.bfloat16,torch.float8_e4m3fn,torch.float8_e4m3fn,QuantType.per_1x128,1,0,64,0,100.7738,_ZN5aiter55fmoe_stage1_bf16_pertokenFp8_blockscale_g1u1_64x256_pf2E,82.3%,3.93,14040.13
stage1,256,4,7168,256,257,9,ActivationType.Silu,torch.bfloat16,torch.float8_e4m3fn,torch.float8_e4m3fn,QuantType.per_1x128,1,0,64,0,87.2016,_ZN5aiter55fmoe_stage1_bf16_pertokenFp8_blockscale_g1u1_64x256_pf3E,82.3%,4.55,16225.36
stage1,256,4,7168,256,257,9,ActivationType.Silu,torch.bfloat16,torch.float8_e4m3fn,torch.float8_e4m3fn,QuantType.per_1x128,1,0,128,0,84.9816,_ZN5aiter56fmoe_stage1_bf16_pertokenFp8_blockscale_g1u1_128x128_pf2E,82.3%,4.66,16649.22
stage1,256,4,7168,256,257,9,ActivationType.Silu,torch.bfloat16,torch.float8_e4m3fn,torch.float8_e4m3fn,QuantType.per_1x128,1,0,128,0,69.2776,_ZN5aiter56fmoe_stage1_bf16_pertokenFp8_blockscale_g1u1_128x128_pf3E,82.3%,5.72,20423.3
stage1,256,4,7168,256,257,9,ActivationType.Silu,torch.bfloat16,torch.float8_e4m3fn,torch.float8_e4m3fn,QuantType.per_1x128,1,0,16,0,49.817,moe_ck2stages_gemm1_256x16x128x256_1x4_MulABScaleExpertWeightA8W8blkscale_v1_Nswizzle0_Quant4_MulRoutedWeight0_silu_F8_F8_B16,0.1%,7.96,28401.49
stage2,256,4,7168,256,257,9,ActivationType.Silu,torch.bfloat16,torch.float8_e4m3fn,torch.float8_e4m3fn,QuantType.per_1x128,1,0,16,0,19.7593,moe_ck2stages_gemm2_256x16x128x256_1x4_MulABScaleExpertWeightA8W8blkscale_v1_Nswizzle0_Quant4_MulRoutedWeight1_F8_F8_B16,16.9%,20.06,71605.63
stage1,256,4,7168,256,257,9,ActivationType.Silu,torch.bfloat16,torch.float8_e4m3fn,torch.float8_e4m3fn,QuantType.per_1x128,1,0,64,0,62.0365,moe_ck2stages_gemm1_256x64x128x128_1x4_MulABScaleExpertWeightA8W8blkscale_v3_Nswizzle0_Quant4_MulRoutedWeight0_silu_F8_F8_B16,0.1%,6.39,22807.17
stage2,256,4,7168,256,257,9,ActivationType.Silu,torch.bfloat16,torch.float8_e4m3fn,torch.float8_e4m3fn,QuantType.per_1x128,1,0,64,0,30.4733,moe_ck2stages_gemm2_256x64x128x128_1x4_MulABScaleExpertWeightA8W8blkscale_v3_Nswizzle0_Quant4_MulRoutedWeight1_F8_F8_B16,16.6%,13.01,46430.06
asm_1stage,256,4,7168,256,257,9,ActivationType.Silu,torch.bfloat16,torch.float8_e4m3fn,torch.float8_e4m3fn,QuantType.per_1x128,1,0,32,0,124.1458,_ZN5aiter52fmoe_bf16_blockscaleFp8_g1u1_novs_silu_1tg_ps_32x256E,0.0%,3.19,11396.9
asm_1stage,256,4,7168,256,257,9,ActivationType.Silu,torch.bfloat16,torch.float8_e4m3fn,torch.float8_e4m3fn,QuantType.per_1x128,1,0,32,0,115.8063,_ZN5aiter50fmoe_bf16_blockscaleFp8_g1u1_vs_silu_1tg_ps_32x256E,0.0%,3.42,12217.62
asm_1stage,256,4,7168,256,257,9,ActivationType.Silu,torch.bfloat16,torch.float8_e4m3fn,torch.float8_e4m3fn,QuantType.per_1x128,1,0,32,0,123.4496,_ZN5aiter49fmoe_bf16_blockscaleFp8_g1u1_novs_silu_1tg_32x256E,0.0%,3.21,11461.17
asm_1stage,256,4,7168,256,257,9,ActivationType.Silu,torch.bfloat16,torch.float8_e4m3fn,torch.float8_e4m3fn,QuantType.per_1x128,1,0,32,0,114.7791,_ZN5aiter47fmoe_bf16_blockscaleFp8_g1u1_vs_silu_1tg_32x256E,0.0%,3.45,12326.96
stage1,256,8,7168,256,257,9,ActivationType.Silu,torch.bfloat16,torch.float8_e4m3fn,torch.float8_e4m3fn,QuantType.per_1x128,1,0,16,0,82.2734,_ZN5aiter59fmoe_stage1_bf16_pertokenFp8_blockscale_g1u1_16x128_4tg_pf2E,90.8%,9.64,17198.31
stage1,256,8,7168,256,257,9,ActivationType.Silu,torch.bfloat16,torch.float8_e4m3fn,torch.float8_e4m3fn,QuantType.per_1x128,1,0,16,0,52.4815,_ZN5aiter59fmoe_stage1_bf16_pertokenFp8_blockscale_g1u1_16x128_4tg_pf3E,90.6%,15.1,26961.18
stage1,256,8,7168,256,257,9,ActivationType.Silu,torch.bfloat16,torch.float8_e4m3fn,torch.float8_e4m3fn,QuantType.per_1x128,1,0,16,0,100.3143,_ZN5aiter59fmoe_stage1_bf16_pertokenFp8_blockscale_g1u1_16x256_3tg_pf2E,91.3%,7.9,14105.3
stage1,256,8,7168,256,257,9,ActivationType.Silu,torch.bfloat16,torch.float8_e4m3fn,torch.float8_e4m3fn,QuantType.per_1x128,1,0,16,0,81.6179,_ZN5aiter59fmoe_stage1_bf16_pertokenFp8_blockscale_g1u1_16x256_2tg_pf3E,91.2%,9.71,17336.43
stage1,256,8,7168,256,257,9,ActivationType.Silu,torch.bfloat16,torch.float8_e4m3fn,torch.float8_e4m3fn,QuantType.per_1x128,1,0,16,0,inf,_ZN5aiter59fmoe_stage1_bf16_pertokenFp8_blockscale_g1u1_16x512_2tg_pf2E,100.0%,0.0,0.0
stage1,256,8,7168,256,257,9,ActivationType.Silu,torch.bfloat16,torch.float8_e4m3fn,torch.float8_e4m3fn,QuantType.per_1x128,1,0,16,0,inf,_ZN5aiter55fmoe_stage1_bf16_pertokenFp8_blockscale_g1u1_16x512_pf3E,100.0%,0.0,0.0
stage1,256,8,7168,256,257,9,ActivationType.Silu,torch.bfloat16,torch.float8_e4m3fn,torch.float8_e4m3fn,QuantType.per_1x128,1,0,32,0,82.6361,_ZN5aiter59fmoe_stage1_bf16_pertokenFp8_blockscale_g1u1_32x128_3tg_pf2E,91.4%,9.59,17122.82
stage1,256,8,7168,256,257,9,ActivationType.Silu,torch.bfloat16,torch.float8_e4m3fn,torch.float8_e4m3fn,QuantType.per_1x128,1,0,32,0,53.5119,_ZN5aiter59fmoe_stage1_bf16_pertokenFp8_blockscale_g1u1_32x128_3tg_pf3E,91.4%,14.81,26442.03
stage1,256,8,7168,256,257,9,ActivationType.Silu,torch.bfloat16,torch.float8_e4m3fn,torch.float8_e4m3fn,QuantType.per_1x128,1,0,32,0,102.6522,_ZN5aiter59fmoe_stage1_bf16_pertokenFp8_blockscale_g1u1_32x256_2tg_pf2E,91.4%,7.72,13784.05
stage1,256,8,7168,256,257,9,ActivationType.Silu,torch.bfloat16,torch.float8_e4m3fn,torch.float8_e4m3fn,QuantType.per_1x128,1,0,32,0,82.4399,_ZN5aiter59fmoe_stage1_bf16_pertokenFp8_blockscale_g1u1_32x256_2tg_pf3E,91.4%,9.62,17163.57
stage1,256,8,7168,256,257,9,ActivationType.Silu,torch.bfloat16,torch.float8_e4m3fn,torch.float8_e4m3fn,QuantType.per_1x128,1,0,32,0,inf,_ZN5aiter55fmoe_stage1_bf16_pertokenFp8_blockscale_g1u1_32x512_pf2E,100.0%,0.0,0.0
stage1,256,8,7168,256,257,9,ActivationType.Silu,torch.bfloat16,torch.float8_e4m3fn,torch.float8_e4m3fn,QuantType.per_1x128,1,0,32,0,inf,_ZN5aiter55fmoe_stage1_bf16_pertokenFp8_blockscale_g1u1_32x512_pf3E,100.0%,0.0,0.0
stage1,256,8,7168,256,257,9,ActivationType.Silu,torch.bfloat16,torch.float8_e4m3fn,torch.float8_e4m3fn,QuantType.per_1x128,1,0,64,0,83.5167,_ZN5aiter59fmoe_stage1_bf16_pertokenFp8_blockscale_g1u1_64x128_2tg_pf2E,91.4%,9.49,16942.28
stage1,256,8,7168,256,257,9,ActivationType.Silu,torch.bfloat16,torch.float8_e4m3fn,torch.float8_e4m3fn,QuantType.per_1x128,1,0,64,0,55.2216,_ZN5aiter59fmoe_stage1_bf16_pertokenFp8_blockscale_g1u1_64x128_2tg_pf3E,91.4%,14.36,25623.36
stage1,256,8,7168,256,257,9,ActivationType.Silu,torch.bfloat16,torch.float8_e4m3fn,torch.float8_e4m3fn,QuantType.per_1x128,1,0,64,0,105.2986,_ZN5aiter55fmoe_stage1_bf16_pertokenFp8_blockscale_g1u1_64x256_pf2E,91.4%,7.53,13437.63
stage1,256,8,7168,256,257,9,ActivationType.Silu,torch.bfloat16,torch.float8_e4m3fn,torch.float8_e4m3fn,QuantType.per_1x128,1,0,64,0,90.7049,_ZN5aiter55fmoe_stage1_bf16_pertokenFp8_blockscale_g1u1_64x256_pf3E,91.4%,8.74,15599.63
stage1,256,8,7168,256,257,9,ActivationType.Silu,torch.bfloat16,torch.float8_e4m3fn,torch.float8_e4m3fn,QuantType.per_1x128,1,0,128,0,88.8694,_ZN5aiter56fmoe_stage1_bf16_pertokenFp8_blockscale_g1u1_128x128_pf2E,91.4%,8.92,15921.83
stage1,256,8,7168,256,257,9,ActivationType.Silu,torch.bfloat16,torch.float8_e4m3fn,torch.float8_e4m3fn,QuantType.per_1x128,1,0,128,0,71.6244,_ZN5aiter56fmoe_stage1_bf16_pertokenFp8_blockscale_g1u1_128x128_pf3E,91.4%,11.07,19755.32
stage1,256,8,7168,256,257,9,ActivationType.Silu,torch.bfloat16,torch.float8_e4m3fn,torch.float8_e4m3fn,QuantType.per_1x128,1,0,16,0,56.2431,moe_ck2stages_gemm1_256x16x128x256_1x4_MulABScaleExpertWeightA8W8blkscale_v1_Nswizzle0_Quant4_MulRoutedWeight0_silu_F8_F8_B16,0.1%,14.09,25157.99
stage2,256,8,7168,256,257,9,ActivationType.Silu,torch.bfloat16,torch.float8_e4m3fn,torch.float8_e4m3fn,QuantType.per_1x128,1,0,16,0,28.5535,moe_ck2stages_gemm2_256x16x128x256_1x4_MulABScaleExpertWeightA8W8blkscale_v1_Nswizzle0_Quant4_MulRoutedWeight1_F8_F8_B16,16.5%,27.76,49554.81
stage1,256,8,7168,256,257,9,ActivationType.Silu,torch.bfloat16,torch.float8_e4m3fn,torch.float8_e4m3fn,QuantType.per_1x128,1,0,64,0,67.0622,moe_ck2stages_gemm1_256x64x128x128_1x4_MulABScaleExpertWeightA8W8blkscale_v3_Nswizzle0_Quant4_MulRoutedWeight0_silu_F8_F8_B16,0.1%,11.82,21099.27
stage2,256,8,7168,256,257,9,ActivationType.Silu,torch.bfloat16,torch.float8_e4m3fn,torch.float8_e4m3fn,QuantType.per_1x128,1,0,64,0,48.6988,moe_ck2stages_gemm2_256x64x128x128_1x4_MulABScaleExpertWeightA8W8blkscale_v3_Nswizzle0_Quant4_MulRoutedWeight1_F8_F8_B16,16.6%,16.28,29055.4
asm_1stage,256,8,7168,256,257,9,ActivationType.Silu,torch.bfloat16,torch.float8_e4m3fn,torch.float8_e4m3fn,QuantType.per_1x128,1,0,32,0,132.69,_ZN5aiter52fmoe_bf16_blockscaleFp8_g1u1_novs_silu_1tg_ps_32x256E,0.0%,5.97,10663.68
asm_1stage,256,8,7168,256,257,9,ActivationType.Silu,torch.bfloat16,torch.float8_e4m3fn,torch.float8_e4m3fn,QuantType.per_1x128,1,0,32,0,128.481,_ZN5aiter50fmoe_bf16_blockscaleFp8_g1u1_vs_silu_1tg_ps_32x256E,0.0%,6.17,11013.02
asm_1stage,256,8,7168,256,257,9,ActivationType.Silu,torch.bfloat16,torch.float8_e4m3fn,torch.float8_e4m3fn,QuantType.per_1x128,1,0,32,0,133.6192,_ZN5aiter49fmoe_bf16_blockscaleFp8_g1u1_novs_silu_1tg_32x256E,0.0%,5.93,10589.52
asm_1stage,256,8,7168,256,257,9,ActivationType.Silu,torch.bfloat16,torch.float8_e4m3fn,torch.float8_e4m3fn,QuantType.per_1x128,1,0,32,0,127.1835,_ZN5aiter47fmoe_bf16_blockscaleFp8_g1u1_vs_silu_1tg_32x256E,0.0%,6.23,11125.37
stage1,256,16,7168,256,257,9,ActivationType.Silu,torch.bfloat16,torch.float8_e4m3fn,torch.float8_e4m3fn,QuantType.per_1x128,1,0,16,0,90.4812,_ZN5aiter59fmoe_stage1_bf16_pertokenFp8_blockscale_g1u1_16x128_4tg_pf2E,96.1%,17.52,15640.1
stage1,256,16,7168,256,257,9,ActivationType.Silu,torch.bfloat16,torch.float8_e4m3fn,torch.float8_e4m3fn,QuantType.per_1x128,1,0,16,0,71.2741,_ZN5aiter59fmoe_stage1_bf16_pertokenFp8_blockscale_g1u1_16x128_4tg_pf3E,96.2%,22.24,19854.83
stage1,256,16,7168,256,257,9,ActivationType.Silu,torch.bfloat16,torch.float8_e4m3fn,torch.float8_e4m3fn,QuantType.per_1x128,1,0,16,0,107.9211,_ZN5aiter59fmoe_stage1_bf16_pertokenFp8_blockscale_g1u1_16x256_3tg_pf2E,96.4%,14.69,13112.68
stage1,256,16,7168,256,257,9,ActivationType.Silu,torch.bfloat16,torch.float8_e4m3fn,torch.float8_e4m3fn,QuantType.per_1x128,1,0,16,0,90.0565,_ZN5aiter59fmoe_stage1_bf16_pertokenFp8_blockscale_g1u1_16x256_2tg_pf3E,96.2%,17.61,15713.86
stage1,256,16,7168,256,257,9,ActivationType.Silu,torch.bfloat16,torch.float8_e4m3fn,torch.float8_e4m3fn,QuantType.per_1x128,1,0,16,0,inf,_ZN5aiter59fmoe_stage1_bf16_pertokenFp8_blockscale_g1u1_16x512_2tg_pf2E,100.0%,0.0,0.0
stage1,256,16,7168,256,257,9,ActivationType.Silu,torch.bfloat16,torch.float8_e4m3fn,torch.float8_e4m3fn,QuantType.per_1x128,1,0,16,0,inf,_ZN5aiter55fmoe_stage1_bf16_pertokenFp8_blockscale_g1u1_16x512_pf3E,100.0%,0.0,0.0
stage1,256,16,7168,256,257,9,ActivationType.Silu,torch.bfloat16,torch.float8_e4m3fn,torch.float8_e4m3fn,QuantType.per_1x128,1,0,32,0,89.8295,_ZN5aiter59fmoe_stage1_bf16_pertokenFp8_blockscale_g1u1_32x128_3tg_pf2E,96.8%,17.65,15753.57
stage1,256,16,7168,256,257,9,ActivationType.Silu,torch.bfloat16,torch.float8_e4m3fn,torch.float8_e4m3fn,QuantType.per_1x128,1,0,32,0,72.0121,_ZN5aiter59fmoe_stage1_bf16_pertokenFp8_blockscale_g1u1_32x128_3tg_pf3E,96.8%,22.02,19651.35
stage1,256,16,7168,256,257,9,ActivationType.Silu,torch.bfloat16,torch.float8_e4m3fn,torch.float8_e4m3fn,QuantType.per_1x128,1,0,32,0,110.5899,_ZN5aiter59fmoe_stage1_bf16_pertokenFp8_blockscale_g1u1_32x256_2tg_pf2E,96.8%,14.34,12796.24
stage1,256,16,7168,256,257,9,ActivationType.Silu,torch.bfloat16,torch.float8_e4m3fn,torch.float8_e4m3fn,QuantType.per_1x128,1,0,32,0,91.0592,_ZN5aiter59fmoe_stage1_bf16_pertokenFp8_blockscale_g1u1_32x256_2tg_pf3E,96.8%,17.41,15540.83
stage1,256,16,7168,256,257,9,ActivationType.Silu,torch.bfloat16,torch.float8_e4m3fn,torch.float8_e4m3fn,QuantType.per_1x128,1,0,32,0,inf,_ZN5aiter55fmoe_stage1_bf16_pertokenFp8_blockscale_g1u1_32x512_pf2E,100.0%,0.0,0.0
stage1,256,16,7168,256,257,9,ActivationType.Silu,torch.bfloat16,torch.float8_e4m3fn,torch.float8_e4m3fn,QuantType.per_1x128,1,0,32,0,inf,_ZN5aiter55fmoe_stage1_bf16_pertokenFp8_blockscale_g1u1_32x512_pf3E,100.0%,0.0,0.0
stage1,256,16,7168,256,257,9,ActivationType.Silu,torch.bfloat16,torch.float8_e4m3fn,torch.float8_e4m3fn,QuantType.per_1x128,1,0,64,0,90.4985,_ZN5aiter59fmoe_stage1_bf16_pertokenFp8_blockscale_g1u1_64x128_2tg_pf2E,96.8%,17.52,15637.11
stage1,256,16,7168,256,257,9,ActivationType.Silu,torch.bfloat16,torch.float8_e4m3fn,torch.float8_e4m3fn,QuantType.per_1x128,1,0,64,0,73.2963,_ZN5aiter59fmoe_stage1_bf16_pertokenFp8_blockscale_g1u1_64x128_2tg_pf3E,96.8%,21.63,19307.05
stage1,256,16,7168,256,257,9,ActivationType.Silu,torch.bfloat16,torch.float8_e4m3fn,torch.float8_e4m3fn,QuantType.per_1x128,1,0,64,0,113.306,_ZN5aiter55fmoe_stage1_bf16_pertokenFp8_blockscale_g1u1_64x256_pf2E,96.8%,13.99,12489.5
stage1,256,16,7168,256,257,9,ActivationType.Silu,torch.bfloat16,torch.float8_e4m3fn,torch.float8_e4m3fn,QuantType.per_1x128,1,0,64,0,98.2159,_ZN5aiter55fmoe_stage1_bf16_pertokenFp8_blockscale_g1u1_64x256_pf3E,96.8%,16.14,14408.41
stage1,256,16,7168,256,257,9,ActivationType.Silu,torch.bfloat16,torch.float8_e4m3fn,torch.float8_e4m3fn,QuantType.per_1x128,1,0,128,0,95.9883,_ZN5aiter56fmoe_stage1_bf16_pertokenFp8_blockscale_g1u1_128x128_pf2E,96.8%,16.52,14742.79
stage1,256,16,7168,256,257,9,ActivationType.Silu,torch.bfloat16,torch.float8_e4m3fn,torch.float8_e4m3fn,QuantType.per_1x128,1,0,128,0,82.1339,_ZN5aiter56fmoe_stage1_bf16_pertokenFp8_blockscale_g1u1_128x128_pf3E,96.8%,19.3,17229.61
stage1,256,16,7168,256,257,9,ActivationType.Silu,torch.bfloat16,torch.float8_e4m3fn,torch.float8_e4m3fn,QuantType.per_1x128,1,0,16,0,74.6468,moe_ck2stages_gemm1_256x16x128x256_1x4_MulABScaleExpertWeightA8W8blkscale_v1_Nswizzle0_Quant4_MulRoutedWeight0_silu_F8_F8_B16,0.1%,21.24,18957.75
stage2,256,16,7168,256,257,9,ActivationType.Silu,torch.bfloat16,torch.float8_e4m3fn,torch.float8_e4m3fn,QuantType.per_1x128,1,0,16,0,42.7092,moe_ck2stages_gemm2_256x16x128x256_1x4_MulABScaleExpertWeightA8W8blkscale_v1_Nswizzle0_Quant4_MulRoutedWeight1_F8_F8_B16,16.9%,37.12,33134.2
stage1,256,16,7168,256,257,9,ActivationType.Silu,torch.bfloat16,torch.float8_e4m3fn,torch.float8_e4m3fn,QuantType.per_1x128,1,0,64,0,79.9144,moe_ck2stages_gemm1_256x64x128x128_1x4_MulABScaleExpertWeightA8W8blkscale_v3_Nswizzle0_Quant4_MulRoutedWeight0_silu_F8_F8_B16,0.1%,19.84,17708.14
stage2,256,16,7168,256,257,9,ActivationType.Silu,torch.bfloat16,torch.float8_e4m3fn,torch.float8_e4m3fn,QuantType.per_1x128,1,0,64,0,74.7935,moe_ck2stages_gemm2_256x64x128x128_1x4_MulABScaleExpertWeightA8W8blkscale_v3_Nswizzle0_Quant4_MulRoutedWeight1_F8_F8_B16,16.9%,21.2,18920.56
asm_1stage,256,16,7168,256,257,9,ActivationType.Silu,torch.bfloat16,torch.float8_e4m3fn,torch.float8_e4m3fn,QuantType.per_1x128,1,0,32,0,144.3735,_ZN5aiter52fmoe_bf16_blockscaleFp8_g1u1_novs_silu_1tg_ps_32x256E,0.0%,10.98,9801.9
asm_1stage,256,16,7168,256,257,9,ActivationType.Silu,torch.bfloat16,torch.float8_e4m3fn,torch.float8_e4m3fn,QuantType.per_1x128,1,0,32,0,152.332,_ZN5aiter50fmoe_bf16_blockscaleFp8_g1u1_vs_silu_1tg_ps_32x256E,0.0%,10.41,9289.81
asm_1stage,256,16,7168,256,257,9,ActivationType.Silu,torch.bfloat16,torch.float8_e4m3fn,torch.float8_e4m3fn,QuantType.per_1x128,1,0,32,0,157.829,_ZN5aiter49fmoe_bf16_blockscaleFp8_g1u1_novs_silu_1tg_32x256E,0.0%,10.05,8966.26
asm_1stage,256,16,7168,256,257,9,ActivationType.Silu,torch.bfloat16,torch.float8_e4m3fn,torch.float8_e4m3fn,QuantType.per_1x128,1,0,32,0,151.7859,_ZN5aiter47fmoe_bf16_blockscaleFp8_g1u1_vs_silu_1tg_32x256E,0.0%,10.45,9323.23
stage1,256,32,7168,256,257,9,ActivationType.Silu,torch.bfloat16,torch.float8_e4m3fn,torch.float8_e4m3fn,QuantType.per_1x128,1,0,16,0,112.6359,_ZN5aiter59fmoe_stage1_bf16_pertokenFp8_blockscale_g1u1_16x128_4tg_pf2E,99.1%,28.15,12566.86
stage1,256,32,7168,256,257,9,ActivationType.Silu,torch.bfloat16,torch.float8_e4m3fn,torch.float8_e4m3fn,QuantType.per_1x128,1,0,16,0,122.6646,_ZN5aiter59fmoe_stage1_bf16_pertokenFp8_blockscale_g1u1_16x128_4tg_pf3E,99.1%,25.85,11539.43
stage1,256,32,7168,256,257,9,ActivationType.Silu,torch.bfloat16,torch.float8_e4m3fn,torch.float8_e4m3fn,QuantType.per_1x128,1,0,16,0,121.8752,_ZN5aiter59fmoe_stage1_bf16_pertokenFp8_blockscale_g1u1_16x256_3tg_pf2E,99.4%,26.02,11614.17
stage1,256,32,7168,256,257,9,ActivationType.Silu,torch.bfloat16,torch.float8_e4m3fn,torch.float8_e4m3fn,QuantType.per_1x128,1,0,16,0,110.8335,_ZN5aiter59fmoe_stage1_bf16_pertokenFp8_blockscale_g1u1_16x256_2tg_pf3E,99.5%,28.61,12771.22
stage1,256,32,7168,256,257,9,ActivationType.Silu,torch.bfloat16,torch.float8_e4m3fn,torch.float8_e4m3fn,QuantType.per_1x128,1,0,16,0,inf,_ZN5aiter59fmoe_stage1_bf16_pertokenFp8_blockscale_g1u1_16x512_2tg_pf2E,100.0%,0.0,0.0
stage1,256,32,7168,256,257,9,ActivationType.Silu,torch.bfloat16,torch.float8_e4m3fn,torch.float8_e4m3fn,QuantType.per_1x128,1,0,16,0,inf,_ZN5aiter55fmoe_stage1_bf16_pertokenFp8_blockscale_g1u1_16x512_pf3E,100.0%,0.0,0.0
stage1,256,32,7168,256,257,9,ActivationType.Silu,torch.bfloat16,torch.float8_e4m3fn,torch.float8_e4m3fn,QuantType.per_1x128,1,0,32,0,114.1858,_ZN5aiter59fmoe_stage1_bf16_pertokenFp8_blockscale_g1u1_32x128_3tg_pf2E,99.7%,27.77,12396.28
stage1,256,32,7168,256,257,9,ActivationType.Silu,torch.bfloat16,torch.float8_e4m3fn,torch.float8_e4m3fn,QuantType.per_1x128,1,0,32,0,124.1699,_ZN5aiter59fmoe_stage1_bf16_pertokenFp8_blockscale_g1u1_32x128_3tg_pf3E,99.7%,25.54,11399.54
stage1,256,32,7168,256,257,9,ActivationType.Silu,torch.bfloat16,torch.float8_e4m3fn,torch.float8_e4m3fn,QuantType.per_1x128,1,0,32,0,124.3773,_ZN5aiter59fmoe_stage1_bf16_pertokenFp8_blockscale_g1u1_32x256_2tg_pf2E,99.7%,25.49,11380.53
stage1,256,32,7168,256,257,9,ActivationType.Silu,torch.bfloat16,torch.float8_e4m3fn,torch.float8_e4m3fn,QuantType.per_1x128,1,0,32,0,111.5887,_ZN5aiter59fmoe_stage1_bf16_pertokenFp8_blockscale_g1u1_32x256_2tg_pf3E,99.7%,28.42,12684.79
stage1,256,32,7168,256,257,9,ActivationType.Silu,torch.bfloat16,torch.float8_e4m3fn,torch.float8_e4m3fn,QuantType.per_1x128,1,0,32,0,inf,_ZN5aiter55fmoe_stage1_bf16_pertokenFp8_blockscale_g1u1_32x512_pf2E,100.0%,0.0,0.0
stage1,256,32,7168,256,257,9,ActivationType.Silu,torch.bfloat16,torch.float8_e4m3fn,torch.float8_e4m3fn,QuantType.per_1x128,1,0,32,0,inf,_ZN5aiter55fmoe_stage1_bf16_pertokenFp8_blockscale_g1u1_32x512_pf3E,100.0%,0.0,0.0
stage1,256,32,7168,256,257,9,ActivationType.Silu,torch.bfloat16,torch.float8_e4m3fn,torch.float8_e4m3fn,QuantType.per_1x128,1,0,64,0,117.2362,_ZN5aiter59fmoe_stage1_bf16_pertokenFp8_blockscale_g1u1_64x128_2tg_pf2E,99.7%,27.05,12073.74
stage1,256,32,7168,256,257,9,ActivationType.Silu,torch.bfloat16,torch.float8_e4m3fn,torch.float8_e4m3fn,QuantType.per_1x128,1,0,64,0,127.6232,_ZN5aiter59fmoe_stage1_bf16_pertokenFp8_blockscale_g1u1_64x128_2tg_pf3E,99.7%,24.85,11091.08
stage1,256,32,7168,256,257,9,ActivationType.Silu,torch.bfloat16,torch.float8_e4m3fn,torch.float8_e4m3fn,QuantType.per_1x128,1,0,64,0,127.145,_ZN5aiter55fmoe_stage1_bf16_pertokenFp8_blockscale_g1u1_64x256_pf2E,99.7%,24.94,11132.8
stage1,256,32,7168,256,257,9,ActivationType.Silu,torch.bfloat16,torch.float8_e4m3fn,torch.float8_e4m3fn,QuantType.per_1x128,1,0,64,0,115.0326,_ZN5aiter55fmoe_stage1_bf16_pertokenFp8_blockscale_g1u1_64x256_pf3E,99.7%,27.57,12305.03
stage1,256,32,7168,256,257,9,ActivationType.Silu,torch.bfloat16,torch.float8_e4m3fn,torch.float8_e4m3fn,QuantType.per_1x128,1,0,128,0,179.3386,_ZN5aiter56fmoe_stage1_bf16_pertokenFp8_blockscale_g1u1_128x128_pf2E,99.7%,17.68,7892.78
stage1,256,32,7168,256,257,9,ActivationType.Silu,torch.bfloat16,torch.float8_e4m3fn,torch.float8_e4m3fn,QuantType.per_1x128,1,0,128,0,152.1498,_ZN5aiter56fmoe_stage1_bf16_pertokenFp8_blockscale_g1u1_128x128_pf3E,99.7%,20.84,9303.2
stage1,256,32,7168,256,257,9,ActivationType.Silu,torch.bfloat16,torch.float8_e4m3fn,torch.float8_e4m3fn,QuantType.per_1x128,1,0,16,0,125.7352,moe_ck2stages_gemm1_256x16x128x256_1x4_MulABScaleExpertWeightA8W8blkscale_v1_Nswizzle0_Quant4_MulRoutedWeight0_silu_F8_F8_B16,0.1%,25.22,11257.62
stage2,256,32,7168,256,257,9,ActivationType.Silu,torch.bfloat16,torch.float8_e4m3fn,torch.float8_e4m3fn,QuantType.per_1x128,1,0,16,0,63.5623,moe_ck2stages_gemm2_256x16x128x256_1x4_MulABScaleExpertWeightA8W8blkscale_v1_Nswizzle0_Quant4_MulRoutedWeight1_F8_F8_B16,17.0%,49.89,22269.16
stage1,256,32,7168,256,257,9,ActivationType.Silu,torch.bfloat16,torch.float8_e4m3fn,torch.float8_e4m3fn,QuantType.per_1x128,1,0,64,0,135.5826,moe_ck2stages_gemm1_256x64x128x128_1x4_MulABScaleExpertWeightA8W8blkscale_v3_Nswizzle0_Quant4_MulRoutedWeight0_silu_F8_F8_B16,0.1%,23.39,10439.98
stage2,256,32,7168,256,257,9,ActivationType.Silu,torch.bfloat16,torch.float8_e4m3fn,torch.float8_e4m3fn,QuantType.per_1x128,1,0,64,0,110.7532,moe_ck2stages_gemm2_256x64x128x128_1x4_MulABScaleExpertWeightA8W8blkscale_v3_Nswizzle0_Quant4_MulRoutedWeight1_F8_F8_B16,17.0%,28.63,12780.48
asm_1stage,256,32,7168,256,257,9,ActivationType.Silu,torch.bfloat16,torch.float8_e4m3fn,torch.float8_e4m3fn,QuantType.per_1x128,1,0,32,0,178.1532,_ZN5aiter52fmoe_bf16_blockscaleFp8_g1u1_novs_silu_1tg_ps_32x256E,0.0%,17.8,7945.29
asm_1stage,256,32,7168,256,257,9,ActivationType.Silu,torch.bfloat16,torch.float8_e4m3fn,torch.float8_e4m3fn,QuantType.per_1x128,1,0,32,0,175.8508,_ZN5aiter50fmoe_bf16_blockscaleFp8_g1u1_vs_silu_1tg_ps_32x256E,0.0%,18.03,8049.32
asm_1stage,256,32,7168,256,257,9,ActivationType.Silu,torch.bfloat16,torch.float8_e4m3fn,torch.float8_e4m3fn,QuantType.per_1x128,1,0,32,0,172.1538,_ZN5aiter49fmoe_bf16_blockscaleFp8_g1u1_novs_silu_1tg_32x256E,0.0%,18.42,8222.18
asm_1stage,256,32,7168,256,257,9,ActivationType.Silu,torch.bfloat16,torch.float8_e4m3fn,torch.float8_e4m3fn,QuantType.per_1x128,1,0,32,0,174.9216,_ZN5aiter47fmoe_bf16_blockscaleFp8_g1u1_vs_silu_1tg_32x256E,0.0%,18.13,8092.08
stage1,256,64,7168,256,257,9,ActivationType.Silu,torch.bfloat16,torch.float8_e4m3fn,torch.float8_e4m3fn,QuantType.per_1x128,1,0,16,0,143.5412,_ZN5aiter59fmoe_stage1_bf16_pertokenFp8_blockscale_g1u1_16x128_4tg_pf2E,99.0%,44.18,9865.93
stage1,256,64,7168,256,257,9,ActivationType.Silu,torch.bfloat16,torch.float8_e4m3fn,torch.float8_e4m3fn,QuantType.per_1x128,1,0,16,0,143.9865,_ZN5aiter59fmoe_stage1_bf16_pertokenFp8_blockscale_g1u1_16x128_4tg_pf3E,99.1%,44.04,9835.42
stage1,256,64,7168,256,257,9,ActivationType.Silu,torch.bfloat16,torch.float8_e4m3fn,torch.float8_e4m3fn,QuantType.per_1x128,1,0,16,0,144.7205,_ZN5aiter59fmoe_stage1_bf16_pertokenFp8_blockscale_g1u1_16x256_3tg_pf2E,99.2%,43.82,9785.53
stage1,256,64,7168,256,257,9,ActivationType.Silu,torch.bfloat16,torch.float8_e4m3fn,torch.float8_e4m3fn,QuantType.per_1x128,1,0,16,0,144.306,_ZN5aiter59fmoe_stage1_bf16_pertokenFp8_blockscale_g1u1_16x256_2tg_pf3E,99.2%,43.95,9813.64
stage1,256,64,7168,256,257,9,ActivationType.Silu,torch.bfloat16,torch.float8_e4m3fn,torch.float8_e4m3fn,QuantType.per_1x128,1,0,16,0,inf,_ZN5aiter59fmoe_stage1_bf16_pertokenFp8_blockscale_g1u1_16x512_2tg_pf2E,100.0%,0.0,0.0
stage1,256,64,7168,256,257,9,ActivationType.Silu,torch.bfloat16,torch.float8_e4m3fn,torch.float8_e4m3fn,QuantType.per_1x128,1,0,16,0,inf,_ZN5aiter55fmoe_stage1_bf16_pertokenFp8_blockscale_g1u1_16x512_pf3E,100.0%,0.0,0.0
stage1,256,64,7168,256,257,9,ActivationType.Silu,torch.bfloat16,torch.float8_e4m3fn,torch.float8_e4m3fn,QuantType.per_1x128,1,0,32,0,144.3778,_ZN5aiter59fmoe_stage1_bf16_pertokenFp8_blockscale_g1u1_32x128_3tg_pf2E,99.7%,43.92,9808.76
stage1,256,64,7168,256,257,9,ActivationType.Silu,torch.bfloat16,torch.float8_e4m3fn,torch.float8_e4m3fn,QuantType.per_1x128,1,0,32,0,144.4276,_ZN5aiter59fmoe_stage1_bf16_pertokenFp8_blockscale_g1u1_32x128_3tg_pf3E,99.6%,43.91,9805.38
stage1,256,64,7168,256,257,9,ActivationType.Silu,torch.bfloat16,torch.float8_e4m3fn,torch.float8_e4m3fn,QuantType.per_1x128,1,0,32,0,146.2105,_ZN5aiter59fmoe_stage1_bf16_pertokenFp8_blockscale_g1u1_32x256_2tg_pf2E,99.7%,43.37,9685.81
stage1,256,64,7168,256,257,9,ActivationType.Silu,torch.bfloat16,torch.float8_e4m3fn,torch.float8_e4m3fn,QuantType.per_1x128,1,0,32,0,144.8714,_ZN5aiter59fmoe_stage1_bf16_pertokenFp8_blockscale_g1u1_32x256_2tg_pf3E,99.7%,43.78,9775.34
stage1,256,64,7168,256,257,9,ActivationType.Silu,torch.bfloat16,torch.float8_e4m3fn,torch.float8_e4m3fn,QuantType.per_1x128,1,0,32,0,inf,_ZN5aiter55fmoe_stage1_bf16_pertokenFp8_blockscale_g1u1_32x512_pf2E,100.0%,0.0,0.0
stage1,256,64,7168,256,257,9,ActivationType.Silu,torch.bfloat16,torch.float8_e4m3fn,torch.float8_e4m3fn,QuantType.per_1x128,1,0,32,0,inf,_ZN5aiter55fmoe_stage1_bf16_pertokenFp8_blockscale_g1u1_32x512_pf3E,100.0%,0.0,0.0
stage1,256,64,7168,256,257,9,ActivationType.Silu,torch.bfloat16,torch.float8_e4m3fn,torch.float8_e4m3fn,QuantType.per_1x128,1,0,64,0,146.347,_ZN5aiter59fmoe_stage1_bf16_pertokenFp8_blockscale_g1u1_64x128_2tg_pf2E,99.7%,43.33,9676.78
stage1,256,64,7168,256,257,9,ActivationType.Silu,torch.bfloat16,torch.float8_e4m3fn,torch.float8_e4m3fn,QuantType.per_1x128,1,0,64,0,144.9206,_ZN5aiter59fmoe_stage1_bf16_pertokenFp8_blockscale_g1u1_64x128_2tg_pf3E,99.7%,43.76,9772.02
stage1,256,64,7168,256,257,9,ActivationType.Silu,torch.bfloat16,torch.float8_e4m3fn,torch.float8_e4m3fn,QuantType.per_1x128,1,0,64,0,148.2353,_ZN5aiter55fmoe_stage1_bf16_pertokenFp8_blockscale_g1u1_64x256_pf2E,99.7%,42.78,9553.51
stage1,256,64,7168,256,257,9,ActivationType.Silu,torch.bfloat16,torch.float8_e4m3fn,torch.float8_e4m3fn,QuantType.per_1x128,1,0,64,0,147.9121,_ZN5aiter55fmoe_stage1_bf16_pertokenFp8_blockscale_g1u1_64x256_pf3E,99.7%,42.88,9574.39
stage1,256,64,7168,256,257,9,ActivationType.Silu,torch.bfloat16,torch.float8_e4m3fn,torch.float8_e4m3fn,QuantType.per_1x128,1,0,128,0,190.1038,_ZN5aiter56fmoe_stage1_bf16_pertokenFp8_blockscale_g1u1_128x128_pf2E,99.7%,33.36,7449.44
stage1,256,64,7168,256,257,9,ActivationType.Silu,torch.bfloat16,torch.float8_e4m3fn,torch.float8_e4m3fn,QuantType.per_1x128,1,0,128,0,166.3904,_ZN5aiter56fmoe_stage1_bf16_pertokenFp8_blockscale_g1u1_128x128_pf3E,99.7%,38.11,8511.11
stage1,256,64,7168,256,257,9,ActivationType.Silu,torch.bfloat16,torch.float8_e4m3fn,torch.float8_e4m3fn,QuantType.per_1x128,1,0,16,0,146.9716,moe_ck2stages_gemm1_256x16x128x256_1x4_MulABScaleExpertWeightA8W8blkscale_v1_Nswizzle0_Quant4_MulRoutedWeight0_silu_F8_F8_B16,0.1%,43.15,9635.65
stage2,256,64,7168,256,257,9,ActivationType.Silu,torch.bfloat16,torch.float8_e4m3fn,torch.float8_e4m3fn,QuantType.per_1x128,1,0,16,0,81.992,moe_ck2stages_gemm2_256x16x128x256_1x4_MulABScaleExpertWeightA8W8blkscale_v1_Nswizzle0_Quant4_MulRoutedWeight1_F8_F8_B16,16.9%,77.35,17272.02
stage1,256,64,7168,256,257,9,ActivationType.Silu,torch.bfloat16,torch.float8_e4m3fn,torch.float8_e4m3fn,QuantType.per_1x128,1,0,64,0,152.0764,moe_ck2stages_gemm1_256x64x128x128_1x4_MulABScaleExpertWeightA8W8blkscale_v3_Nswizzle0_Quant4_MulRoutedWeight0_silu_F8_F8_B16,0.1%,41.7,9312.21
stage2,256,64,7168,256,257,9,ActivationType.Silu,torch.bfloat16,torch.float8_e4m3fn,torch.float8_e4m3fn,QuantType.per_1x128,1,0,64,0,145.2151,moe_ck2stages_gemm2_256x64x128x128_1x4_MulABScaleExpertWeightA8W8blkscale_v3_Nswizzle0_Quant4_MulRoutedWeight1_F8_F8_B16,16.9%,43.67,9752.2
asm_1stage,256,64,7168,256,257,9,ActivationType.Silu,torch.bfloat16,torch.float8_e4m3fn,torch.float8_e4m3fn,QuantType.per_1x128,1,0,32,0,229.6788,_ZN5aiter52fmoe_bf16_blockscaleFp8_g1u1_novs_silu_1tg_ps_32x256E,0.0%,27.61,6165.86
asm_1stage,256,64,7168,256,257,9,ActivationType.Silu,torch.bfloat16,torch.float8_e4m3fn,torch.float8_e4m3fn,QuantType.per_1x128,1,0,32,0,228.0571,_ZN5aiter50fmoe_bf16_blockscaleFp8_g1u1_vs_silu_1tg_ps_32x256E,0.0%,27.81,6209.71
asm_1stage,256,64,7168,256,257,9,ActivationType.Silu,torch.bfloat16,torch.float8_e4m3fn,torch.float8_e4m3fn,QuantType.per_1x128,1,0,32,0,228.9117,_ZN5aiter49fmoe_bf16_blockscaleFp8_g1u1_novs_silu_1tg_32x256E,0.0%,27.7,6186.52
asm_1stage,256,64,7168,256,257,9,ActivationType.Silu,torch.bfloat16,torch.float8_e4m3fn,torch.float8_e4m3fn,QuantType.per_1x128,1,0,32,0,226.9434,_ZN5aiter47fmoe_bf16_blockscaleFp8_g1u1_vs_silu_1tg_32x256E,0.0%,27.94,6240.18
stage1,256,128,7168,256,257,9,ActivationType.Silu,torch.bfloat16,torch.float8_e4m3fn,torch.float8_e4m3fn,QuantType.per_1x128,1,0,16,0,159.5918,_ZN5aiter59fmoe_stage1_bf16_pertokenFp8_blockscale_g1u1_16x128_4tg_pf2E,99.1%,79.48,8882.31
stage1,256,128,7168,256,257,9,ActivationType.Silu,torch.bfloat16,torch.float8_e4m3fn,torch.float8_e4m3fn,QuantType.per_1x128,1,0,16,0,159.3355,_ZN5aiter59fmoe_stage1_bf16_pertokenFp8_blockscale_g1u1_16x128_4tg_pf3E,99.2%,79.6,8896.6
stage1,256,128,7168,256,257,9,ActivationType.Silu,torch.bfloat16,torch.float8_e4m3fn,torch.float8_e4m3fn,QuantType.per_1x128,1,0,16,0,159.9031,_ZN5aiter59fmoe_stage1_bf16_pertokenFp8_blockscale_g1u1_16x256_3tg_pf2E,99.3%,79.32,8865.02
stage1,256,128,7168,256,257,9,ActivationType.Silu,torch.bfloat16,torch.float8_e4m3fn,torch.float8_e4m3fn,QuantType.per_1x128,1,0,16,0,160.9032,_ZN5aiter59fmoe_stage1_bf16_pertokenFp8_blockscale_g1u1_16x256_2tg_pf3E,99.4%,78.83,8809.92
stage1,256,128,7168,256,257,9,ActivationType.Silu,torch.bfloat16,torch.float8_e4m3fn,torch.float8_e4m3fn,QuantType.per_1x128,1,0,16,0,inf,_ZN5aiter59fmoe_stage1_bf16_pertokenFp8_blockscale_g1u1_16x512_2tg_pf2E,100.0%,0.0,0.0
stage1,256,128,7168,256,257,9,ActivationType.Silu,torch.bfloat16,torch.float8_e4m3fn,torch.float8_e4m3fn,QuantType.per_1x128,1,0,16,0,inf,_ZN5aiter55fmoe_stage1_bf16_pertokenFp8_blockscale_g1u1_16x512_pf3E,100.0%,0.0,0.0
stage1,256,128,7168,256,257,9,ActivationType.Silu,torch.bfloat16,torch.float8_e4m3fn,torch.float8_e4m3fn,QuantType.per_1x128,1,0,32,0,160.1843,_ZN5aiter59fmoe_stage1_bf16_pertokenFp8_blockscale_g1u1_32x128_3tg_pf2E,99.7%,79.18,8849.45
stage1,256,128,7168,256,257,9,ActivationType.Silu,torch.bfloat16,torch.float8_e4m3fn,torch.float8_e4m3fn,QuantType.per_1x128,1,0,32,0,159.6912,_ZN5aiter59fmoe_stage1_bf16_pertokenFp8_blockscale_g1u1_32x128_3tg_pf3E,99.6%,79.43,8876.78
stage1,256,128,7168,256,257,9,ActivationType.Silu,torch.bfloat16,torch.float8_e4m3fn,torch.float8_e4m3fn,QuantType.per_1x128,1,0,32,0,161.5279,_ZN5aiter59fmoe_stage1_bf16_pertokenFp8_blockscale_g1u1_32x256_2tg_pf2E,99.7%,78.52,8775.84
stage1,256,128,7168,256,257,9,ActivationType.Silu,torch.bfloat16,torch.float8_e4m3fn,torch.float8_e4m3fn,QuantType.per_1x128,1,0,32,0,161.7397,_ZN5aiter59fmoe_stage1_bf16_pertokenFp8_blockscale_g1u1_32x256_2tg_pf3E,99.7%,78.42,8764.35
stage1,256,128,7168,256,257,9,ActivationType.Silu,torch.bfloat16,torch.float8_e4m3fn,torch.float8_e4m3fn,QuantType.per_1x128,1,0,32,0,inf,_ZN5aiter55fmoe_stage1_bf16_pertokenFp8_blockscale_g1u1_32x512_pf2E,100.0%,0.0,0.0
stage1,256,128,7168,256,257,9,ActivationType.Silu,torch.bfloat16,torch.float8_e4m3fn,torch.float8_e4m3fn,QuantType.per_1x128,1,0,32,0,inf,_ZN5aiter55fmoe_stage1_bf16_pertokenFp8_blockscale_g1u1_32x512_pf3E,100.0%,0.0,0.0
stage1,256,128,7168,256,257,9,ActivationType.Silu,torch.bfloat16,torch.float8_e4m3fn,torch.float8_e4m3fn,QuantType.per_1x128,1,0,64,0,161.6575,_ZN5aiter59fmoe_stage1_bf16_pertokenFp8_blockscale_g1u1_64x128_2tg_pf2E,99.7%,78.46,8768.81
stage1,256,128,7168,256,257,9,ActivationType.Silu,torch.bfloat16,torch.float8_e4m3fn,torch.float8_e4m3fn,QuantType.per_1x128,1,0,64,0,160.7118,_ZN5aiter59fmoe_stage1_bf16_pertokenFp8_blockscale_g1u1_64x128_2tg_pf3E,99.7%,78.92,8820.41
stage1,256,128,7168,256,257,9,ActivationType.Silu,torch.bfloat16,torch.float8_e4m3fn,torch.float8_e4m3fn,QuantType.per_1x128,1,0,64,0,162.9324,_ZN5aiter55fmoe_stage1_bf16_pertokenFp8_blockscale_g1u1_64x256_pf2E,99.7%,77.85,8700.2
stage1,256,128,7168,256,257,9,ActivationType.Silu,torch.bfloat16,torch.float8_e4m3fn,torch.float8_e4m3fn,QuantType.per_1x128,1,0,64,0,164.1216,_ZN5aiter55fmoe_stage1_bf16_pertokenFp8_blockscale_g1u1_64x256_pf3E,99.7%,77.28,8637.15
stage1,256,128,7168,256,257,9,ActivationType.Silu,torch.bfloat16,torch.float8_e4m3fn,torch.float8_e4m3fn,QuantType.per_1x128,1,0,128,0,197.6561,_ZN5aiter56fmoe_stage1_bf16_pertokenFp8_blockscale_g1u1_128x128_pf2E,99.7%,64.17,7171.77
stage1,256,128,7168,256,257,9,ActivationType.Silu,torch.bfloat16,torch.float8_e4m3fn,torch.float8_e4m3fn,QuantType.per_1x128,1,0,128,0,175.9042,_ZN5aiter56fmoe_stage1_bf16_pertokenFp8_blockscale_g1u1_128x128_pf3E,99.7%,72.11,8058.61
stage1,256,128,7168,256,257,9,ActivationType.Silu,torch.bfloat16,torch.float8_e4m3fn,torch.float8_e4m3fn,QuantType.per_1x128,1,0,16,0,161.7454,moe_ck2stages_gemm1_256x16x128x256_1x4_MulABScaleExpertWeightA8W8blkscale_v1_Nswizzle0_Quant4_MulRoutedWeight0_silu_F8_F8_B16,0.1%,78.42,8764.04
stage2,256,128,7168,256,257,9,ActivationType.Silu,torch.bfloat16,torch.float8_e4m3fn,torch.float8_e4m3fn,QuantType.per_1x128,1,0,16,0,94.866,moe_ck2stages_gemm2_256x16x128x256_1x4_MulABScaleExpertWeightA8W8blkscale_v1_Nswizzle0_Quant4_MulRoutedWeight1_F8_F8_B16,16.9%,133.7,14942.59
stage1,256,128,7168,256,257,9,ActivationType.Silu,torch.bfloat16,torch.float8_e4m3fn,torch.float8_e4m3fn,QuantType.per_1x128,1,0,64,0,167.3494,moe_ck2stages_gemm1_256x64x128x128_1x4_MulABScaleExpertWeightA8W8blkscale_v3_Nswizzle0_Quant4_MulRoutedWeight0_silu_F8_F8_B16,0.1%,75.79,8470.56
stage2,256,128,7168,256,257,9,ActivationType.Silu,torch.bfloat16,torch.float8_e4m3fn,torch.float8_e4m3fn,QuantType.per_1x128,1,0,64,0,176.3208,moe_ck2stages_gemm2_256x64x128x128_1x4_MulABScaleExpertWeightA8W8blkscale_v3_Nswizzle0_Quant4_MulRoutedWeight1_F8_F8_B16,16.9%,71.93,8039.57
asm_1stage,256,128,7168,256,257,9,ActivationType.Silu,torch.bfloat16,torch.float8_e4m3fn,torch.float8_e4m3fn,QuantType.per_1x128,1,0,32,0,257.5009,_ZN5aiter52fmoe_bf16_blockscaleFp8_g1u1_novs_silu_1tg_ps_32x256E,0.0%,49.26,5505.0
asm_1stage,256,128,7168,256,257,9,ActivationType.Silu,torch.bfloat16,torch.float8_e4m3fn,torch.float8_e4m3fn,QuantType.per_1x128,1,0,32,0,255.8676,_ZN5aiter50fmoe_bf16_blockscaleFp8_g1u1_vs_silu_1tg_ps_32x256E,0.0%,49.57,5540.15
asm_1stage,256,128,7168,256,257,9,ActivationType.Silu,torch.bfloat16,torch.float8_e4m3fn,torch.float8_e4m3fn,QuantType.per_1x128,1,0,32,0,257.2632,_ZN5aiter49fmoe_bf16_blockscaleFp8_g1u1_novs_silu_1tg_32x256E,0.0%,49.3,5510.09
asm_1stage,256,128,7168,256,257,9,ActivationType.Silu,torch.bfloat16,torch.float8_e4m3fn,torch.float8_e4m3fn,QuantType.per_1x128,1,0,32,0,254.8319,_ZN5aiter47fmoe_bf16_blockscaleFp8_g1u1_vs_silu_1tg_32x256E,0.0%,49.77,5562.66
stage1,256,256,7168,256,257,9,ActivationType.Silu,torch.bfloat16,torch.float8_e4m3fn,torch.float8_e4m3fn,QuantType.per_1x128,1,0,16,0,191.6952,_ZN5aiter59fmoe_stage1_bf16_pertokenFp8_blockscale_g1u1_16x128_4tg_pf2E,99.1%,132.33,7409.14
stage1,256,256,7168,256,257,9,ActivationType.Silu,torch.bfloat16,torch.float8_e4m3fn,torch.float8_e4m3fn,QuantType.per_1x128,1,0,16,0,193.7424,_ZN5aiter59fmoe_stage1_bf16_pertokenFp8_blockscale_g1u1_16x128_4tg_pf3E,99.1%,130.93,7330.85
stage1,256,256,7168,256,257,9,ActivationType.Silu,torch.bfloat16,torch.float8_e4m3fn,torch.float8_e4m3fn,QuantType.per_1x128,1,0,16,0,213.0984,_ZN5aiter59fmoe_stage1_bf16_pertokenFp8_blockscale_g1u1_16x256_3tg_pf2E,99.3%,119.04,6664.98
stage1,256,256,7168,256,257,9,ActivationType.Silu,torch.bfloat16,torch.float8_e4m3fn,torch.float8_e4m3fn,QuantType.per_1x128,1,0,16,0,225.2409,_ZN5aiter59fmoe_stage1_bf16_pertokenFp8_blockscale_g1u1_16x256_2tg_pf3E,99.3%,112.62,6305.68
stage1,256,256,7168,256,257,9,ActivationType.Silu,torch.bfloat16,torch.float8_e4m3fn,torch.float8_e4m3fn,QuantType.per_1x128,1,0,16,0,inf,_ZN5aiter59fmoe_stage1_bf16_pertokenFp8_blockscale_g1u1_16x512_2tg_pf2E,100.0%,0.0,0.0
stage1,256,256,7168,256,257,9,ActivationType.Silu,torch.bfloat16,torch.float8_e4m3fn,torch.float8_e4m3fn,QuantType.per_1x128,1,0,16,0,inf,_ZN5aiter55fmoe_stage1_bf16_pertokenFp8_blockscale_g1u1_16x512_pf3E,100.0%,0.0,0.0
stage1,256,256,7168,256,257,9,ActivationType.Silu,torch.bfloat16,torch.float8_e4m3fn,torch.float8_e4m3fn,QuantType.per_1x128,1,0,32,0,194.3601,_ZN5aiter59fmoe_stage1_bf16_pertokenFp8_blockscale_g1u1_32x128_3tg_pf2E,99.7%,130.52,7307.55
stage1,256,256,7168,256,257,9,ActivationType.Silu,torch.bfloat16,torch.float8_e4m3fn,torch.float8_e4m3fn,QuantType.per_1x128,1,0,32,0,192.8184,_ZN5aiter59fmoe_stage1_bf16_pertokenFp8_blockscale_g1u1_32x128_3tg_pf3E,99.7%,131.56,7365.98
stage1,256,256,7168,256,257,9,ActivationType.Silu,torch.bfloat16,torch.float8_e4m3fn,torch.float8_e4m3fn,QuantType.per_1x128,1,0,32,0,212.6236,_ZN5aiter59fmoe_stage1_bf16_pertokenFp8_blockscale_g1u1_32x256_2tg_pf2E,99.7%,119.31,6679.86
stage1,256,256,7168,256,257,9,ActivationType.Silu,torch.bfloat16,torch.float8_e4m3fn,torch.float8_e4m3fn,QuantType.per_1x128,1,0,32,0,221.1185,_ZN5aiter59fmoe_stage1_bf16_pertokenFp8_blockscale_g1u1_32x256_2tg_pf3E,99.7%,114.72,6423.24
stage1,256,256,7168,256,257,9,ActivationType.Silu,torch.bfloat16,torch.float8_e4m3fn,torch.float8_e4m3fn,QuantType.per_1x128,1,0,32,0,inf,_ZN5aiter55fmoe_stage1_bf16_pertokenFp8_blockscale_g1u1_32x512_pf2E,100.0%,0.0,0.0
stage1,256,256,7168,256,257,9,ActivationType.Silu,torch.bfloat16,torch.float8_e4m3fn,torch.float8_e4m3fn,QuantType.per_1x128,1,0,32,0,inf,_ZN5aiter55fmoe_stage1_bf16_pertokenFp8_blockscale_g1u1_32x512_pf3E,100.0%,0.0,0.0
stage1,256,256,7168,256,257,9,ActivationType.Silu,torch.bfloat16,torch.float8_e4m3fn,torch.float8_e4m3fn,QuantType.per_1x128,1,0,64,0,225.8199,_ZN5aiter59fmoe_stage1_bf16_pertokenFp8_blockscale_g1u1_64x128_2tg_pf2E,99.7%,112.33,6289.51
stage1,256,256,7168,256,257,9,ActivationType.Silu,torch.bfloat16,torch.float8_e4m3fn,torch.float8_e4m3fn,QuantType.per_1x128,1,0,64,0,194.5948,_ZN5aiter59fmoe_stage1_bf16_pertokenFp8_blockscale_g1u1_64x128_2tg_pf3E,99.7%,130.36,7298.74
stage1,256,256,7168,256,257,9,ActivationType.Silu,torch.bfloat16,torch.float8_e4m3fn,torch.float8_e4m3fn,QuantType.per_1x128,1,0,64,0,250.6569,_ZN5aiter55fmoe_stage1_bf16_pertokenFp8_blockscale_g1u1_64x256_pf2E,99.7%,101.2,5666.3
stage1,256,256,7168,256,257,9,ActivationType.Silu,torch.bfloat16,torch.float8_e4m3fn,torch.float8_e4m3fn,QuantType.per_1x128,1,0,64,0,231.5514,_ZN5aiter55fmoe_stage1_bf16_pertokenFp8_blockscale_g1u1_64x256_pf3E,99.7%,109.55,6133.83
stage1,256,256,7168,256,257,9,ActivationType.Silu,torch.bfloat16,torch.float8_e4m3fn,torch.float8_e4m3fn,QuantType.per_1x128,1,0,128,0,267.9119,_ZN5aiter56fmoe_stage1_bf16_pertokenFp8_blockscale_g1u1_128x128_pf2E,99.7%,94.68,5301.36
stage1,256,256,7168,256,257,9,ActivationType.Silu,torch.bfloat16,torch.float8_e4m3fn,torch.float8_e4m3fn,QuantType.per_1x128,1,0,128,0,229.3335,_ZN5aiter56fmoe_stage1_bf16_pertokenFp8_blockscale_g1u1_128x128_pf3E,99.7%,110.61,6193.15
stage1,256,256,7168,256,257,9,ActivationType.Silu,torch.bfloat16,torch.float8_e4m3fn,torch.float8_e4m3fn,QuantType.per_1x128,1,0,16,0,193.7159,moe_ck2stages_gemm1_256x16x128x256_1x4_MulABScaleExpertWeightA8W8blkscale_v1_Nswizzle0_Quant4_MulRoutedWeight0_silu_F8_F8_B16,0.1%,130.95,7331.85
stage2,256,256,7168,256,257,9,ActivationType.Silu,torch.bfloat16,torch.float8_e4m3fn,torch.float8_e4m3fn,QuantType.per_1x128,1,0,16,0,127.4921,moe_ck2stages_gemm2_256x16x128x256_1x4_MulABScaleExpertWeightA8W8blkscale_v1_Nswizzle0_Quant4_MulRoutedWeight1_F8_F8_B16,16.8%,198.97,11140.27
stage1,256,256,7168,256,257,9,ActivationType.Silu,torch.bfloat16,torch.float8_e4m3fn,torch.float8_e4m3fn,QuantType.per_1x128,1,0,64,0,206.6022,moe_ck2stages_gemm1_256x64x128x128_1x4_MulABScaleExpertWeightA8W8blkscale_v3_Nswizzle0_Quant4_MulRoutedWeight0_silu_F8_F8_B16,0.1%,122.78,6874.55
stage2,256,256,7168,256,257,9,ActivationType.Silu,torch.bfloat16,torch.float8_e4m3fn,torch.float8_e4m3fn,QuantType.per_1x128,1,0,64,0,281.692,moe_ck2stages_gemm2_256x64x128x128_1x4_MulABScaleExpertWeightA8W8blkscale_v3_Nswizzle0_Quant4_MulRoutedWeight1_F8_F8_B16,16.8%,90.05,5042.02
asm_1stage,256,256,7168,256,257,9,ActivationType.Silu,torch.bfloat16,torch.float8_e4m3fn,torch.float8_e4m3fn,QuantType.per_1x128,1,0,32,0,351.091,_ZN5aiter52fmoe_bf16_blockscaleFp8_g1u1_novs_silu_1tg_ps_32x256E,0.0%,72.25,4045.38
asm_1stage,256,256,7168,256,257,9,ActivationType.Silu,torch.bfloat16,torch.float8_e4m3fn,torch.float8_e4m3fn,QuantType.per_1x128,1,0,32,0,343.1819,_ZN5aiter50fmoe_bf16_blockscaleFp8_g1u1_vs_silu_1tg_ps_32x256E,0.0%,73.92,4138.61
asm_1stage,256,256,7168,256,257,9,ActivationType.Silu,torch.bfloat16,torch.float8_e4m3fn,torch.float8_e4m3fn,QuantType.per_1x128,1,0,32,0,347.4295,_ZN5aiter49fmoe_bf16_blockscaleFp8_g1u1_novs_silu_1tg_32x256E,0.0%,73.01,4088.01
asm_1stage,256,256,7168,256,257,9,ActivationType.Silu,torch.bfloat16,torch.float8_e4m3fn,torch.float8_e4m3fn,QuantType.per_1x128,1,0,32,0,339.1223,_ZN5aiter47fmoe_bf16_blockscaleFp8_g1u1_vs_silu_1tg_32x256E,0.0%,74.8,4188.15
stage1,256,512,7168,256,257,9,ActivationType.Silu,torch.bfloat16,torch.float8_e4m3fn,torch.float8_e4m3fn,QuantType.per_1x128,1,0,16,0,251.8875,_ZN5aiter59fmoe_stage1_bf16_pertokenFp8_blockscale_g1u1_16x128_4tg_pf2E,99.0%,201.42,5660.47
stage1,256,512,7168,256,257,9,ActivationType.Silu,torch.bfloat16,torch.float8_e4m3fn,torch.float8_e4m3fn,QuantType.per_1x128,1,0,16,0,243.5342,_ZN5aiter59fmoe_stage1_bf16_pertokenFp8_blockscale_g1u1_16x128_4tg_pf3E,99.0%,208.33,5854.62
stage1,256,512,7168,256,257,9,ActivationType.Silu,torch.bfloat16,torch.float8_e4m3fn,torch.float8_e4m3fn,QuantType.per_1x128,1,0,16,0,228.133,_ZN5aiter59fmoe_stage1_bf16_pertokenFp8_blockscale_g1u1_16x256_3tg_pf2E,99.3%,222.39,6249.87
stage1,256,512,7168,256,257,9,ActivationType.Silu,torch.bfloat16,torch.float8_e4m3fn,torch.float8_e4m3fn,QuantType.per_1x128,1,0,16,0,227.3088,_ZN5aiter59fmoe_stage1_bf16_pertokenFp8_blockscale_g1u1_16x256_2tg_pf3E,99.3%,223.2,6272.53
stage1,256,512,7168,256,257,9,ActivationType.Silu,torch.bfloat16,torch.float8_e4m3fn,torch.float8_e4m3fn,QuantType.per_1x128,1,0,16,0,inf,_ZN5aiter59fmoe_stage1_bf16_pertokenFp8_blockscale_g1u1_16x512_2tg_pf2E,100.0%,0.0,0.0
stage1,256,512,7168,256,257,9,ActivationType.Silu,torch.bfloat16,torch.float8_e4m3fn,torch.float8_e4m3fn,QuantType.per_1x128,1,0,16,0,inf,_ZN5aiter55fmoe_stage1_bf16_pertokenFp8_blockscale_g1u1_16x512_pf3E,100.0%,0.0,0.0
stage1,256,512,7168,256,257,9,ActivationType.Silu,torch.bfloat16,torch.float8_e4m3fn,torch.float8_e4m3fn,QuantType.per_1x128,1,0,32,0,204.845,_ZN5aiter59fmoe_stage1_bf16_pertokenFp8_blockscale_g1u1_32x128_3tg_pf2E,99.6%,247.67,6960.39
stage1,256,512,7168,256,257,9,ActivationType.Silu,torch.bfloat16,torch.float8_e4m3fn,torch.float8_e4m3fn,QuantType.per_1x128,1,0,32,0,197.4437,_ZN5aiter59fmoe_stage1_bf16_pertokenFp8_blockscale_g1u1_32x128_3tg_pf3E,99.5%,256.96,7221.31
stage1,256,512,7168,256,257,9,ActivationType.Silu,torch.bfloat16,torch.float8_e4m3fn,torch.float8_e4m3fn,QuantType.per_1x128,1,0,32,0,217.0792,_ZN5aiter59fmoe_stage1_bf16_pertokenFp8_blockscale_g1u1_32x256_2tg_pf2E,99.6%,233.71,6568.12
stage1,256,512,7168,256,257,9,ActivationType.Silu,torch.bfloat16,torch.float8_e4m3fn,torch.float8_e4m3fn,QuantType.per_1x128,1,0,32,0,225.0621,_ZN5aiter59fmoe_stage1_bf16_pertokenFp8_blockscale_g1u1_32x256_2tg_pf3E,99.6%,225.42,6335.15
stage1,256,512,7168,256,257,9,ActivationType.Silu,torch.bfloat16,torch.float8_e4m3fn,torch.float8_e4m3fn,QuantType.per_1x128,1,0,32,0,inf,_ZN5aiter55fmoe_stage1_bf16_pertokenFp8_blockscale_g1u1_32x512_pf2E,100.0%,0.0,0.0
stage1,256,512,7168,256,257,9,ActivationType.Silu,torch.bfloat16,torch.float8_e4m3fn,torch.float8_e4m3fn,QuantType.per_1x128,1,0,32,0,inf,_ZN5aiter55fmoe_stage1_bf16_pertokenFp8_blockscale_g1u1_32x512_pf3E,100.0%,0.0,0.0
stage1,256,512,7168,256,257,9,ActivationType.Silu,torch.bfloat16,torch.float8_e4m3fn,torch.float8_e4m3fn,QuantType.per_1x128,1,0,64,0,226.603,_ZN5aiter59fmoe_stage1_bf16_pertokenFp8_blockscale_g1u1_64x128_2tg_pf2E,99.7%,223.89,6292.07
stage1,256,512,7168,256,257,9,ActivationType.Silu,torch.bfloat16,torch.float8_e4m3fn,torch.float8_e4m3fn,QuantType.per_1x128,1,0,64,0,196.0404,_ZN5aiter59fmoe_stage1_bf16_pertokenFp8_blockscale_g1u1_64x128_2tg_pf3E,99.7%,258.8,7273.0
stage1,256,512,7168,256,257,9,ActivationType.Silu,torch.bfloat16,torch.float8_e4m3fn,torch.float8_e4m3fn,QuantType.per_1x128,1,0,64,0,251.8146,_ZN5aiter55fmoe_stage1_bf16_pertokenFp8_blockscale_g1u1_64x256_pf2E,99.7%,201.47,5662.11
stage1,256,512,7168,256,257,9,ActivationType.Silu,torch.bfloat16,torch.float8_e4m3fn,torch.float8_e4m3fn,QuantType.per_1x128,1,0,64,0,232.4411,_ZN5aiter55fmoe_stage1_bf16_pertokenFp8_blockscale_g1u1_64x256_pf3E,99.7%,218.27,6134.03
stage1,256,512,7168,256,257,9,ActivationType.Silu,torch.bfloat16,torch.float8_e4m3fn,torch.float8_e4m3fn,QuantType.per_1x128,1,0,128,0,267.3501,_ZN5aiter56fmoe_stage1_bf16_pertokenFp8_blockscale_g1u1_128x128_pf2E,99.7%,189.77,5333.09
stage1,256,512,7168,256,257,9,ActivationType.Silu,torch.bfloat16,torch.float8_e4m3fn,torch.float8_e4m3fn,QuantType.per_1x128,1,0,128,0,229.4056,_ZN5aiter56fmoe_stage1_bf16_pertokenFp8_blockscale_g1u1_128x128_pf3E,99.7%,221.16,6215.2
stage1,256,512,7168,256,257,9,ActivationType.Silu,torch.bfloat16,torch.float8_e4m3fn,torch.float8_e4m3fn,QuantType.per_1x128,1,0,16,0,243.7952,moe_ck2stages_gemm1_256x16x128x256_1x4_MulABScaleExpertWeightA8W8blkscale_v1_Nswizzle0_Quant4_MulRoutedWeight0_silu_F8_F8_B16,0.1%,208.1,5848.36
stage2,256,512,7168,256,257,9,ActivationType.Silu,torch.bfloat16,torch.float8_e4m3fn,torch.float8_e4m3fn,QuantType.per_1x128,1,0,16,0,234.6422,moe_ck2stages_gemm2_256x16x128x256_1x4_MulABScaleExpertWeightA8W8blkscale_v1_Nswizzle0_Quant4_MulRoutedWeight1_F8_F8_B16,16.7%,216.22,6076.49
stage1,256,512,7168,256,257,9,ActivationType.Silu,torch.bfloat16,torch.float8_e4m3fn,torch.float8_e4m3fn,QuantType.per_1x128,1,0,64,0,211.3964,moe_ck2stages_gemm1_256x64x128x128_1x4_MulABScaleExpertWeightA8W8blkscale_v3_Nswizzle0_Quant4_MulRoutedWeight0_silu_F8_F8_B16,0.1%,240.0,6744.68
stage2,256,512,7168,256,257,9,ActivationType.Silu,torch.bfloat16,torch.float8_e4m3fn,torch.float8_e4m3fn,QuantType.per_1x128,1,0,64,0,490.8663,moe_ck2stages_gemm2_256x64x128x128_1x4_MulABScaleExpertWeightA8W8blkscale_v3_Nswizzle0_Quant4_MulRoutedWeight1_F8_F8_B16,16.7%,103.36,2904.66
asm_1stage,256,512,7168,256,257,9,ActivationType.Silu,torch.bfloat16,torch.float8_e4m3fn,torch.float8_e4m3fn,QuantType.per_1x128,1,0,32,0,365.2928,_ZN5aiter52fmoe_bf16_blockscaleFp8_g1u1_novs_silu_1tg_ps_32x256E,0.0%,138.89,3903.17
asm_1stage,256,512,7168,256,257,9,ActivationType.Silu,torch.bfloat16,torch.float8_e4m3fn,torch.float8_e4m3fn,QuantType.per_1x128,1,0,32,0,365.2551,_ZN5aiter50fmoe_bf16_blockscaleFp8_g1u1_vs_silu_1tg_ps_32x256E,0.0%,138.9,3903.58
asm_1stage,256,512,7168,256,257,9,ActivationType.Silu,torch.bfloat16,torch.float8_e4m3fn,torch.float8_e4m3fn,QuantType.per_1x128,1,0,32,0,357.7622,_ZN5aiter49fmoe_bf16_blockscaleFp8_g1u1_novs_silu_1tg_32x256E,0.0%,141.81,3985.33
asm_1stage,256,512,7168,256,257,9,ActivationType.Silu,torch.bfloat16,torch.float8_e4m3fn,torch.float8_e4m3fn,QuantType.per_1x128,1,0,32,0,353.0405,_ZN5aiter47fmoe_bf16_blockscaleFp8_g1u1_vs_silu_1tg_32x256E,0.0%,143.71,4038.63
stage1,256,1024,7168,256,257,9,ActivationType.Silu,torch.bfloat16,torch.float8_e4m3fn,torch.float8_e4m3fn,QuantType.per_1x128,1,0,16,0,370.1492,_ZN5aiter59fmoe_stage1_bf16_pertokenFp8_blockscale_g1u1_16x128_4tg_pf2E,99.1%,274.13,3881.71
stage1,256,1024,7168,256,257,9,ActivationType.Silu,torch.bfloat16,torch.float8_e4m3fn,torch.float8_e4m3fn,QuantType.per_1x128,1,0,16,0,365.8711,_ZN5aiter59fmoe_stage1_bf16_pertokenFp8_blockscale_g1u1_16x128_4tg_pf3E,99.0%,277.33,3927.1
stage1,256,1024,7168,256,257,9,ActivationType.Silu,torch.bfloat16,torch.float8_e4m3fn,torch.float8_e4m3fn,QuantType.per_1x128,1,0,16,0,351.3645,_ZN5aiter59fmoe_stage1_bf16_pertokenFp8_blockscale_g1u1_16x256_3tg_pf2E,99.3%,288.78,4089.23
stage1,256,1024,7168,256,257,9,ActivationType.Silu,torch.bfloat16,torch.float8_e4m3fn,torch.float8_e4m3fn,QuantType.per_1x128,1,0,16,0,348.7089,_ZN5aiter59fmoe_stage1_bf16_pertokenFp8_blockscale_g1u1_16x256_2tg_pf3E,99.3%,290.98,4120.37
stage1,256,1024,7168,256,257,9,ActivationType.Silu,torch.bfloat16,torch.float8_e4m3fn,torch.float8_e4m3fn,QuantType.per_1x128,1,0,16,0,inf,_ZN5aiter59fmoe_stage1_bf16_pertokenFp8_blockscale_g1u1_16x512_2tg_pf2E,100.0%,0.0,0.0
stage1,256,1024,7168,256,257,9,ActivationType.Silu,torch.bfloat16,torch.float8_e4m3fn,torch.float8_e4m3fn,QuantType.per_1x128,1,0,16,0,inf,_ZN5aiter55fmoe_stage1_bf16_pertokenFp8_blockscale_g1u1_16x512_pf3E,100.0%,0.0,0.0
stage1,256,1024,7168,256,257,9,ActivationType.Silu,torch.bfloat16,torch.float8_e4m3fn,torch.float8_e4m3fn,QuantType.per_1x128,1,0,32,0,266.4989,_ZN5aiter59fmoe_stage1_bf16_pertokenFp8_blockscale_g1u1_32x128_3tg_pf2E,99.5%,380.75,5391.43
stage1,256,1024,7168,256,257,9,ActivationType.Silu,torch.bfloat16,torch.float8_e4m3fn,torch.float8_e4m3fn,QuantType.per_1x128,1,0,32,0,250.8317,_ZN5aiter59fmoe_stage1_bf16_pertokenFp8_blockscale_g1u1_32x128_3tg_pf3E,99.5%,404.53,5728.19
stage1,256,1024,7168,256,257,9,ActivationType.Silu,torch.bfloat16,torch.float8_e4m3fn,torch.float8_e4m3fn,QuantType.per_1x128,1,0,32,0,242.4968,_ZN5aiter59fmoe_stage1_bf16_pertokenFp8_blockscale_g1u1_32x256_2tg_pf2E,99.6%,418.43,5925.07
stage1,256,1024,7168,256,257,9,ActivationType.Silu,torch.bfloat16,torch.float8_e4m3fn,torch.float8_e4m3fn,QuantType.per_1x128,1,0,32,0,242.4659,_ZN5aiter59fmoe_stage1_bf16_pertokenFp8_blockscale_g1u1_32x256_2tg_pf3E,99.6%,418.49,5925.83
stage1,256,1024,7168,256,257,9,ActivationType.Silu,torch.bfloat16,torch.float8_e4m3fn,torch.float8_e4m3fn,QuantType.per_1x128,1,0,32,0,inf,_ZN5aiter55fmoe_stage1_bf16_pertokenFp8_blockscale_g1u1_32x512_pf2E,100.0%,0.0,0.0
stage1,256,1024,7168,256,257,9,ActivationType.Silu,torch.bfloat16,torch.float8_e4m3fn,torch.float8_e4m3fn,QuantType.per_1x128,1,0,32,0,inf,_ZN5aiter55fmoe_stage1_bf16_pertokenFp8_blockscale_g1u1_32x512_pf3E,100.0%,0.0,0.0
stage1,256,1024,7168,256,257,9,ActivationType.Silu,torch.bfloat16,torch.float8_e4m3fn,torch.float8_e4m3fn,QuantType.per_1x128,1,0,64,0,225.7444,_ZN5aiter59fmoe_stage1_bf16_pertokenFp8_blockscale_g1u1_64x128_2tg_pf2E,99.7%,449.48,6364.77
stage1,256,1024,7168,256,257,9,ActivationType.Silu,torch.bfloat16,torch.float8_e4m3fn,torch.float8_e4m3fn,QuantType.per_1x128,1,0,64,0,200.7762,_ZN5aiter59fmoe_stage1_bf16_pertokenFp8_blockscale_g1u1_64x128_2tg_pf3E,99.7%,505.38,7156.28
stage1,256,1024,7168,256,257,9,ActivationType.Silu,torch.bfloat16,torch.float8_e4m3fn,torch.float8_e4m3fn,QuantType.per_1x128,1,0,64,0,252.8078,_ZN5aiter55fmoe_stage1_bf16_pertokenFp8_blockscale_g1u1_64x256_pf2E,99.7%,401.37,5683.41
stage1,256,1024,7168,256,257,9,ActivationType.Silu,torch.bfloat16,torch.float8_e4m3fn,torch.float8_e4m3fn,QuantType.per_1x128,1,0,64,0,234.7839,_ZN5aiter55fmoe_stage1_bf16_pertokenFp8_blockscale_g1u1_64x256_pf3E,99.7%,432.18,6119.72
stage1,256,1024,7168,256,257,9,ActivationType.Silu,torch.bfloat16,torch.float8_e4m3fn,torch.float8_e4m3fn,QuantType.per_1x128,1,0,128,0,269.1036,_ZN5aiter56fmoe_stage1_bf16_pertokenFp8_blockscale_g1u1_128x128_pf2E,99.7%,377.06,5339.25
stage1,256,1024,7168,256,257,9,ActivationType.Silu,torch.bfloat16,torch.float8_e4m3fn,torch.float8_e4m3fn,QuantType.per_1x128,1,0,128,0,234.0047,_ZN5aiter56fmoe_stage1_bf16_pertokenFp8_blockscale_g1u1_128x128_pf3E,99.7%,433.62,6140.1
stage1,256,1024,7168,256,257,9,ActivationType.Silu,torch.bfloat16,torch.float8_e4m3fn,torch.float8_e4m3fn,QuantType.per_1x128,1,0,16,0,374.1966,moe_ck2stages_gemm1_256x16x128x256_1x4_MulABScaleExpertWeightA8W8blkscale_v1_Nswizzle0_Quant4_MulRoutedWeight0_silu_F8_F8_B16,0.1%,271.16,3839.72
stage2,256,1024,7168,256,257,9,ActivationType.Silu,torch.bfloat16,torch.float8_e4m3fn,torch.float8_e4m3fn,QuantType.per_1x128,1,0,16,0,448.7701,moe_ck2stages_gemm2_256x16x128x256_1x4_MulABScaleExpertWeightA8W8blkscale_v1_Nswizzle0_Quant4_MulRoutedWeight1_F8_F8_B16,16.6%,226.1,3201.66
stage1,256,1024,7168,256,257,9,ActivationType.Silu,torch.bfloat16,torch.float8_e4m3fn,torch.float8_e4m3fn,QuantType.per_1x128,1,0,64,0,216.5598,moe_ck2stages_gemm1_256x64x128x128_1x4_MulABScaleExpertWeightA8W8blkscale_v3_Nswizzle0_Quant4_MulRoutedWeight0_silu_F8_F8_B16,0.1%,468.55,6634.71
stage2,256,1024,7168,256,257,9,ActivationType.Silu,torch.bfloat16,torch.float8_e4m3fn,torch.float8_e4m3fn,QuantType.per_1x128,1,0,64,0,919.7313,moe_ck2stages_gemm2_256x64x128x128_1x4_MulABScaleExpertWeightA8W8blkscale_v3_Nswizzle0_Quant4_MulRoutedWeight1_F8_F8_B16,16.6%,110.32,1562.21
asm_1stage,256,1024,7168,256,257,9,ActivationType.Silu,torch.bfloat16,torch.float8_e4m3fn,torch.float8_e4m3fn,QuantType.per_1x128,1,0,32,0,397.9586,_ZN5aiter52fmoe_bf16_blockscaleFp8_g1u1_novs_silu_1tg_ps_32x256E,0.0%,254.97,3610.45
asm_1stage,256,1024,7168,256,257,9,ActivationType.Silu,torch.bfloat16,torch.float8_e4m3fn,torch.float8_e4m3fn,QuantType.per_1x128,1,0,32,0,402.3654,_ZN5aiter50fmoe_bf16_blockscaleFp8_g1u1_vs_silu_1tg_ps_32x256E,0.0%,252.18,3570.91
asm_1stage,256,1024,7168,256,257,9,ActivationType.Silu,torch.bfloat16,torch.float8_e4m3fn,torch.float8_e4m3fn,QuantType.per_1x128,1,0,32,0,386.5823,_ZN5aiter49fmoe_bf16_blockscaleFp8_g1u1_novs_silu_1tg_32x256E,0.0%,262.48,3716.7
asm_1stage,256,1024,7168,256,257,9,ActivationType.Silu,torch.bfloat16,torch.float8_e4m3fn,torch.float8_e4m3fn,QuantType.per_1x128,1,0,32,0,390.8344,_ZN5aiter47fmoe_bf16_blockscaleFp8_g1u1_vs_silu_1tg_32x256E,0.0%,259.62,3676.27
stage1,256,2048,7168,256,257,9,ActivationType.Silu,torch.bfloat16,torch.float8_e4m3fn,torch.float8_e4m3fn,QuantType.per_1x128,1,0,16,0,559.1368,_ZN5aiter59fmoe_stage1_bf16_pertokenFp8_blockscale_g1u1_16x128_4tg_pf2E,99.1%,362.95,2609.08
stage1,256,2048,7168,256,257,9,ActivationType.Silu,torch.bfloat16,torch.float8_e4m3fn,torch.float8_e4m3fn,QuantType.per_1x128,1,0,16,0,549.4092,_ZN5aiter59fmoe_stage1_bf16_pertokenFp8_blockscale_g1u1_16x128_4tg_pf3E,99.0%,369.37,2655.27
stage1,256,2048,7168,256,257,9,ActivationType.Silu,torch.bfloat16,torch.float8_e4m3fn,torch.float8_e4m3fn,QuantType.per_1x128,1,0,16,0,640.4059,_ZN5aiter59fmoe_stage1_bf16_pertokenFp8_blockscale_g1u1_16x256_3tg_pf2E,99.3%,316.89,2277.98
stage1,256,2048,7168,256,257,9,ActivationType.Silu,torch.bfloat16,torch.float8_e4m3fn,torch.float8_e4m3fn,QuantType.per_1x128,1,0,16,0,638.7815,_ZN5aiter59fmoe_stage1_bf16_pertokenFp8_blockscale_g1u1_16x256_2tg_pf3E,99.3%,317.69,2283.77
stage1,256,2048,7168,256,257,9,ActivationType.Silu,torch.bfloat16,torch.float8_e4m3fn,torch.float8_e4m3fn,QuantType.per_1x128,1,0,16,0,inf,_ZN5aiter59fmoe_stage1_bf16_pertokenFp8_blockscale_g1u1_16x512_2tg_pf2E,100.0%,0.0,0.0
stage1,256,2048,7168,256,257,9,ActivationType.Silu,torch.bfloat16,torch.float8_e4m3fn,torch.float8_e4m3fn,QuantType.per_1x128,1,0,16,0,inf,_ZN5aiter55fmoe_stage1_bf16_pertokenFp8_blockscale_g1u1_16x512_pf3E,100.0%,0.0,0.0
stage1,256,2048,7168,256,257,9,ActivationType.Silu,torch.bfloat16,torch.float8_e4m3fn,torch.float8_e4m3fn,QuantType.per_1x128,1,0,32,0,401.7657,_ZN5aiter59fmoe_stage1_bf16_pertokenFp8_blockscale_g1u1_32x128_3tg_pf2E,99.4%,505.11,3631.05
stage1,256,2048,7168,256,257,9,ActivationType.Silu,torch.bfloat16,torch.float8_e4m3fn,torch.float8_e4m3fn,QuantType.per_1x128,1,0,32,0,392.1252,_ZN5aiter59fmoe_stage1_bf16_pertokenFp8_blockscale_g1u1_32x128_3tg_pf3E,99.5%,517.53,3720.32
stage1,256,2048,7168,256,257,9,ActivationType.Silu,torch.bfloat16,torch.float8_e4m3fn,torch.float8_e4m3fn,QuantType.per_1x128,1,0,32,0,370.9824,_ZN5aiter59fmoe_stage1_bf16_pertokenFp8_blockscale_g1u1_32x256_2tg_pf2E,99.5%,547.03,3932.35
stage1,256,2048,7168,256,257,9,ActivationType.Silu,torch.bfloat16,torch.float8_e4m3fn,torch.float8_e4m3fn,QuantType.per_1x128,1,0,32,0,371.2904,_ZN5aiter59fmoe_stage1_bf16_pertokenFp8_blockscale_g1u1_32x256_2tg_pf3E,99.6%,546.57,3929.08
stage1,256,2048,7168,256,257,9,ActivationType.Silu,torch.bfloat16,torch.float8_e4m3fn,torch.float8_e4m3fn,QuantType.per_1x128,1,0,32,0,inf,_ZN5aiter55fmoe_stage1_bf16_pertokenFp8_blockscale_g1u1_32x512_pf2E,100.0%,0.0,0.0
stage1,256,2048,7168,256,257,9,ActivationType.Silu,torch.bfloat16,torch.float8_e4m3fn,torch.float8_e4m3fn,QuantType.per_1x128,1,0,32,0,inf,_ZN5aiter55fmoe_stage1_bf16_pertokenFp8_blockscale_g1u1_32x512_pf3E,100.0%,0.0,0.0
stage1,256,2048,7168,256,257,9,ActivationType.Silu,torch.bfloat16,torch.float8_e4m3fn,torch.float8_e4m3fn,QuantType.per_1x128,1,0,64,0,284.7511,_ZN5aiter59fmoe_stage1_bf16_pertokenFp8_blockscale_g1u1_64x128_2tg_pf2E,99.5%,712.68,5123.18
stage1,256,2048,7168,256,257,9,ActivationType.Silu,torch.bfloat16,torch.float8_e4m3fn,torch.float8_e4m3fn,QuantType.per_1x128,1,0,64,0,283.2276,_ZN5aiter59fmoe_stage1_bf16_pertokenFp8_blockscale_g1u1_64x128_2tg_pf3E,99.6%,716.52,5150.74
stage1,256,2048,7168,256,257,9,ActivationType.Silu,torch.bfloat16,torch.float8_e4m3fn,torch.float8_e4m3fn,QuantType.per_1x128,1,0,64,0,262.6435,_ZN5aiter55fmoe_stage1_bf16_pertokenFp8_blockscale_g1u1_64x256_pf2E,99.6%,772.67,5554.42
stage1,256,2048,7168,256,257,9,ActivationType.Silu,torch.bfloat16,torch.float8_e4m3fn,torch.float8_e4m3fn,QuantType.per_1x128,1,0,64,0,259.8578,_ZN5aiter55fmoe_stage1_bf16_pertokenFp8_blockscale_g1u1_64x256_pf3E,99.6%,780.95,5613.96
stage1,256,2048,7168,256,257,9,ActivationType.Silu,torch.bfloat16,torch.float8_e4m3fn,torch.float8_e4m3fn,QuantType.per_1x128,1,0,128,0,280.1454,_ZN5aiter56fmoe_stage1_bf16_pertokenFp8_blockscale_g1u1_128x128_pf2E,99.7%,724.4,5207.41
stage1,256,2048,7168,256,257,9,ActivationType.Silu,torch.bfloat16,torch.float8_e4m3fn,torch.float8_e4m3fn,QuantType.per_1x128,1,0,128,0,247.5825,_ZN5aiter56fmoe_stage1_bf16_pertokenFp8_blockscale_g1u1_128x128_pf3E,99.7%,819.68,5892.3
stage1,256,2048,7168,256,257,9,ActivationType.Silu,torch.bfloat16,torch.float8_e4m3fn,torch.float8_e4m3fn,QuantType.per_1x128,1,0,16,0,579.4851,moe_ck2stages_gemm1_256x16x128x256_1x4_MulABScaleExpertWeightA8W8blkscale_v1_Nswizzle0_Quant4_MulRoutedWeight0_silu_F8_F8_B16,0.1%,350.2,2517.46
stage2,256,2048,7168,256,257,9,ActivationType.Silu,torch.bfloat16,torch.float8_e4m3fn,torch.float8_e4m3fn,QuantType.per_1x128,1,0,16,0,884.0856,moe_ck2stages_gemm2_256x16x128x256_1x4_MulABScaleExpertWeightA8W8blkscale_v1_Nswizzle0_Quant4_MulRoutedWeight1_F8_F8_B16,16.6%,229.54,1650.1
stage1,256,2048,7168,256,257,9,ActivationType.Silu,torch.bfloat16,torch.float8_e4m3fn,torch.float8_e4m3fn,QuantType.per_1x128,1,0,64,0,296.9235,moe_ck2stages_gemm1_256x64x128x128_1x4_MulABScaleExpertWeightA8W8blkscale_v3_Nswizzle0_Quant4_MulRoutedWeight0_silu_F8_F8_B16,0.1%,683.47,4913.16
stage2,256,2048,7168,256,257,9,ActivationType.Silu,torch.bfloat16,torch.float8_e4m3fn,torch.float8_e4m3fn,QuantType.per_1x128,1,0,64,0,1817.55,moe_ck2stages_gemm2_256x64x128x128_1x4_MulABScaleExpertWeightA8W8blkscale_v3_Nswizzle0_Quant4_MulRoutedWeight1_F8_F8_B16,16.6%,111.65,802.64
asm_1stage,256,2048,7168,256,257,9,ActivationType.Silu,torch.bfloat16,torch.float8_e4m3fn,torch.float8_e4m3fn,QuantType.per_1x128,1,0,32,0,645.9721,_ZN5aiter52fmoe_bf16_blockscaleFp8_g1u1_novs_silu_1tg_ps_32x256E,0.0%,314.16,2258.35
asm_1stage,256,2048,7168,256,257,9,ActivationType.Silu,torch.bfloat16,torch.float8_e4m3fn,torch.float8_e4m3fn,QuantType.per_1x128,1,0,32,0,648.341,_ZN5aiter50fmoe_bf16_blockscaleFp8_g1u1_vs_silu_1tg_ps_32x256E,0.0%,313.01,2250.1
asm_1stage,256,2048,7168,256,257,9,ActivationType.Silu,torch.bfloat16,torch.float8_e4m3fn,torch.float8_e4m3fn,QuantType.per_1x128,1,0,32,0,639.4847,_ZN5aiter49fmoe_bf16_blockscaleFp8_g1u1_novs_silu_1tg_32x256E,0.0%,317.34,2281.26
asm_1stage,256,2048,7168,256,257,9,ActivationType.Silu,torch.bfloat16,torch.float8_e4m3fn,torch.float8_e4m3fn,QuantType.per_1x128,1,0,32,0,637.2087,_ZN5aiter47fmoe_bf16_blockscaleFp8_g1u1_vs_silu_1tg_32x256E,0.0%,318.48,2289.41
